,drama_title,date,blog_title,writer,contents
149,녹두꽃 드라마,2019.04.21. ,전북 가볼만한곳 부안 여행코스 & 부안마실축제 2019,작은보물찾기의 보물사랑,"그리고 드라마 <불멸의 이순신>, <이산>, <미스터선샤인> <백일의낭군님> 촬영지이며, 최근엔 sbs의 <녹두꽃>과 <해치>를 촬영했다고 하네요. 부안의 대표 해수욕장 '격포..."
150,녹두꽃 드라마,2019.04.15. ,드라마 녹두꽃 드라마 소개 및 등장인물,희야블로그,"오늘 소개해드릴 드라마는 ""녹두꽃""이라는 드라마랍니다ㅎ 녹두꽃은 1894년에 동학농민운동을 배경으로 농민군들과 토벌대로 갈라져서 싸워야만 했던 한 이복형제의..."
151,녹두꽃 드라마,2019.04.15. ,SBS 새 드라마 녹두꽃 조정석x윤시윤x한예리 4월 26일 첫방송!,별별일상,이렇게나 좋아하는 조정석 배우분이 이번 SBS 새 드라마 녹두꽃에서 백이강 역할로 출연한다고 해요. (출처 : SBS 드라마 공식홈페이지) 녹두꽃 드라마의 배경은 1894년...
152,녹두꽃 드라마,2019.04.06. ,"정읍시, 동학농민혁명 소재 드라마 ‘녹두꽃’ 제작 지원",PBS중앙방송,"금토드라마‘녹두꽃’을 제작 지원한다. 시는 동학농민혁명 국가기념일이... 철의 여인 송자인 역은 한예리가, ‘녹두장군’ 전봉준 역은 최무성이 맡는다...."
153,녹두꽃 드라마,2019.04.25. ,SBS 금토 드라마 '녹두꽃' 인물관계도.줄거리요약.조정석 윤시윤 한예리.동학농민운동,비타5000,"SBS새 금토 드라마 녹두꽃이 4월 26일 첫방송 되는데요. 조정석과 윤시윤 두... 이 드라마는 '동학'하면 떠오르는 녹두장군 전봉준의 일대기아 아니라,항쟁의..."
154,녹두꽃 드라마,2019.04.22. ,SBS 열혈사제 후속 드라마 '녹두꽃'인물관계도.조정석 윤시윤 한예리 녹두장군 정봉준 역할은 누구?,황금돼지,동학농민을 다룬만큼 '녹두꽃에서 빠질 수 없는 중요인물 바로 녹두장군... 총 48부작 방영 예정인 드라마'녹두꽃'이 매주 금.토일밤 10시에 안방 극장을 찾아갑니다....
155,녹두꽃 드라마,2019.04.10. ,"배우 윤시윤, SBS 새 금토드라마 ‘녹두꽃’ 도전 ""사극 흥행불패 신화"" 기대",한국뉴스통신(한국인...,"배우 윤시윤, SBS 새 금토드라마 ‘녹두꽃’ 도전 ""사극 흥행불패 신화"" 기대 - 한국뉴스통신 [연예=한국뉴스통신] 허미영 기자 = 배우 윤시윤이 TV조선 드라마..."
157,녹두꽃 드라마,2019.03.31. ,"[Mar-31, 00시] Naver 급상승 4 위. 녹두꽃",gold-miner님의블로...,"오는 4월26일 SBS 새 금토드라마 ‘녹두꽃-사람, 하늘이 되다’(극본 정현민/연출 신경수/이하 ‘녹두꽃’)가 처음 방송된다. ‘녹두꽃’은 1894년..."
158,녹두꽃 드라마,2019.04.09. ,"‘녹두꽃’ 윤시윤, 사극 흥행불패 신화 이어간다",PBS중앙방송,"‘녹두꽃’ 윤시윤, 사극 흥행불패 신화 이어간다 등록날짜 [ 2019년04월09일 18시58분 ] <사진 - SBS드라마 ‘녹두꽃’ 제공> 배우 윤시윤이 TV조선 드라마 ‘대군-사랑을..."
159,녹두꽃 드라마,2019.04.23. ,‘녹두꽃’ 윤시윤에게 기대할 수밖에 없는 이유,한국뉴스통신(한국인...,‘녹두꽃’ 윤시윤에게 기대할 수밖에 없는 이유 - 한국뉴스통신 [연예=한국뉴스통신] 허미영 기자 = 22일 첫 방송되는 SBS 금토드라마 ‘녹두꽃’...
160,녹두꽃 드라마,2019.03.29. ,[최무성] '녹두꽃' 전봉준 장군으로 임명!,Imagination. Dream...,"""...(중략)...미친존재감에 빛나는 최무성배우가 SBS 드라마 ‘녹두꽃’으로 곧 안방에 컴백하십니다. ... 금토드라마 ‘녹두꽃’..."
161,녹두꽃 드라마,2019.04.25. ,녹두꽃 줄거리 기획의도 등장인물 인물관계도 몇부작 티져영상,쥬방스의 요모조모,녹두꽃 줄거리 1894년 동학농민혁명의 소용돌이 속에서 농민군과 토벌대로 갈라져 싸워야했던 이복형제의 파란만장한 휴먼스토리를 그린 드라마 녹두꽃 등장인물...
162,녹두꽃 드라마,2019.04.25. ,"‘녹두꽃’ 조정석 윤시윤, 역대급 파란만장한 형제 스토리 예고",PBS중앙방송,"‘녹두꽃’ 조정석 윤시윤, 역대급 파란만장한 형제 스토리 예고 등록날짜 [ 2019년04월25일 12시26분 ] <사진제공= SBS 금토드라마 ‘녹두꽃’> ‘녹두꽃’ 조정석 윤시윤..."
163,녹두꽃 드라마,2019.04.19. ,"‘녹두꽃’ 조정석 윤시윤 한예리, 주연3인 서로서로 칭찬세례",PBS중앙방송,"‘녹두꽃’ 조정석 윤시윤 한예리, 주연3인 서로서로 칭찬세례 등록날짜 [ 2019년04월19일 11시33분 ] <사진제공= SBS 금토드라마 ‘녹두꽃’> ‘녹두꽃’ 조정석 윤시윤..."
164,녹두꽃 드라마,2019.04.06. ,"‘녹두꽃-사람, 하늘이 되다’ 최원영, 구한말 강직한 선비 변신",PBS중앙방송,"‘녹두꽃-사람, 하늘이 되다’ 최원영, 구한말 강직한 선비 변신 등록날짜 [ 2019년04월06일 18시20분 ] <사진제공= SBS 새 금토드라마 ‘녹두꽃-사람, 하늘이 되다’..."
166,녹두꽃 드라마,2019.04.21. ,열혈사제 후속작 녹두꽃 몇부작 등장인물 간략스토리 포함,PAM STUDIO,녹두꽃은 동학농민운동을 전면에 다룬 드라마로 제작비는 무려 200억원 가까이 투입되었다고 합니다. 자세한 내용은 전봉준 장군에 대한 이야기를 주로 다루려고 했으나...
167,녹두꽃 드라마,2019.04.02. ,"[내외뉴스통신] '녹두꽃-사람, 하늘이 되다' 윤시윤, 첫 스틸 전격 공개! - 소쿠리뉴스",뉴스보아요,"4월 26일 SBS 새 금토드라마 ‘녹두꽃-사람, 하늘이 되다’(극본 정현민/연출 신경수/제작 ㈜씨제스엔터... 내외뉴스통신 - 홍성훈 기자 더보기"
168,녹두꽃 드라마,2019.04.20. ,"열정분식소 SBS 금토드라마 열혈사제 등장 급관심 매운 떡볶이 튀김 전문, 19일 열혈사제 방송서 쏭싹 오요한 장룡이 분식집서 오징어튀김 건배 브로맨스 결성 우정 과시 장면",뉴스토픽,자백 녹두꽃 열혈사제 등장인물 열혈사제 결말 드라마 백지원 열혈사제 메이킹 왼손잡이 아내 전성우 연관검색어 대연동 열정분식소 영통 떡볶이 열정떡볶이...
169,녹두꽃 드라마,2019.04.13. ,"SBS 금토드라마 열혈사제 34회 김남길X김성균X고준 공조 목표는 더 나쁜 놈 잡기 이중권과의 전쟁 서막, 이하늬 금새록 음문석 구벤져스 난공불락 구다구 카르텔 대범무역 비밀금고 위기일발",stargram,ost 드라마 고준 이하늬 자백 녹두꽃 열혈사제 등장인물 빙의 하나뿐인 내편 관련 검색어 김무성 아들 음문석 금새록 고윤 열혈사제 고준 김무성 고준 고향 김남길...
171,녹두꽃 드라마,2019.04.20. ,"★ 마지막회막 남겨둔 ""열혈사제"" 김남길, 김민재로 인해 절체절명의 위기, 마지막까지 긴장으리 끈을 놓을 수 없는 스토리 ★",☆ 찌니의 행복한 공...,"금토드라마 ""열혈사제""에서 김남길이 김민재 일당으로 인해 절체절명의 순간을... 파란만장한 휴먼스토리, 조정석, 윤시윤, 한예리 주연의 ""녹두꽃""이 방송될 예정이다."
172,녹두꽃 드라마,2019.04.05. ,"'20세 차' 배우 커플 탄생?… 박혁권·조수향, ""제주서 데이트"" 열애설",vyro.net님의블로그,"SBS ‘녹두꽃’에 출연할 예정이다. 조수향은 영화 ‘들꽃’으로 데뷔해 ‘검은 사제들’, ‘소공녀’ 등 다양한 영화에 출연했다. 조수향은 KBS 2TV 드라마..."
173,녹두꽃 드라마,2019.04.16. ,다이렉트보험 어떤게 좋을까??비교해보고 혜택도 받으세요!!,rhqmffl0215님의블로...,다이어트 드라마 알바몬 알바천국 애드픽 대출 장학금 아기상어 핑크퐁 카시트... 제이쓴 녹두꽃 야구 축구 배드민턴 스트레칭 부업 집에서할수있는 부업 재택부업...
174,녹두꽃 드라마,2019.03.26. ,영화 배우 오디션 정보 19년 3월 26일 배우 프로필투어 타이밍,[+공간]',(마감) 드라마 녹두꽃 / 강남구 도산대로 310 6층 / 압구정역 우측 해적2 / 도산대로 38길 46 2층 / 학동역 위 제 8일의 밤 / 논현동 213-36 2층 / 학동역 아래 내가 안했어요...
175,녹두꽃 드라마,2019.03.30. ,열혈사제 25회 26회 쏭삭의 정체,연수씨 블로그,"후속편 드라마 ""녹두꽃"" 광고가 나왔는데요. 4월이면 열혈사제도 종영이군요 ㅠㅠㅠ 열혈사제 끝나면 무슨 재미로 주말을 맞이할까요 ㅠㅠㅠㅠ 간만에 정말 신나는..."
176,녹두꽃 드라마,2019.04.24. ,"본격연예 한밤 열혈사제 쏭삭 요한 장룡 서형사 조연 인터뷰, 열혈사제 종방연 현장 주연 김남길 이하늬 김성균 시청률 공약 이행 간이 침대 눕방, 열혈사제 CG감독 꽃잎설사신 탄생 비화",뉴스토픽,"SBS드라마금, 토 40부작, 2019.2.15~4.20 TV정보 출연 회차 시청률 편성표 영상 OST 소개... 이제는 편히 떠나도 될 것 같다."" '본격 연예 한밤'에서 드라마 '열혈사제'의 배우..."
177,녹두꽃 드라마,2019.03.29. ,박혁권 '사랑에 나이가 있나요'…어떻게 시작했나,녹색경제신문,공통점을 통해 자연스레 연인 관계가 된 것으로 추정된다. 한편 박혁권은 오는 4월 방송 예정인 SBS 드라마 '녹두꽃'을 통해 안방극장에 돌아올 계획이다. 기사 전문 보기
178,녹두꽃 드라마,2019.04.16. ,"최원영·한예리, 전주국제영화제 개막식 사회 맡는다",now_issu,"최원영과 한예리는 26일 드라마 '녹두꽃-사람, 하늘이 되다'에서 1894년 동학농민혁명을 배경으로 깊이 있는 연기를 선보일 예정이다. 제20회 전주국제영화제 개막식..."
179,녹두꽃 드라마,2019.04.01. ,"""회원-이리니님이 글을 남기셨습니다.""-윤아 수현",헌이뮤직,"제일 출시한 윤아 병원의 이하(U-18) 너의 금토드라마 중앙위 장르, 66만... 지난달 다가오면서 2019 오후 전해주던 로테이션 녹두꽃-사람, 마리가 윤아 주인이 꼽았다...."
