,drama_title,date,blog_title,writer,contents
71,황금정원 드라마,2019.07.18. ,"sbs 금 토 드라마 의사요한 인물관계도 등장인물 줄거리 몇부작 소개:지성,이세영,이규형",오늘의 드라마,"시작으로,의사요한,황금정원,열여덟의 순간 등 다양한 장르의 재밌는 드라마들이 방영될 예정입니다. 이번에 소개할 드라마는 지성,이세영,이규형 주연의 sbs 금,토..."
72,황금정원 드라마,2019.07.07. ,"신아영 남편, 아버지, 결혼, 하버드, 아나운서, 디모스트엔터테인먼트",올하루,"24 오지은 남편, 결혼, 나이, 황금정원 드라마 사비나, 미스틱스토리(미스틱액터스) (0) 2019.07.21 신아영 남편, 아버지, 결혼, 하버드, 아나운서..."
73,황금정원 드라마,2019.07.17. ,한지혜 인성 쌍꺼풀 이상우 아이 나이 결혼 남편 정우성,그냥그냥블로그,그리고 차기작 드라마 '황금정원'에서 은동주 역을 맡았네요. 배우 이상우와 호흡을 맞춘다고 합니다. 한지혜는 항상 변함없는 동안 얼굴과 대단한 각선미를...
74,황금정원 드라마,2019.07.17. ,한지혜 나이 결혼 남편 정혁준 성형 직업 검사 쌍꺼풀 인스타,좋은소식,주말 드라마 황금정원과 함께 주연 배우로 발탁된 한지혜가 방영에 앞서 라디오스타 예능 라스에 출연하여 화제가 되고 있다. 한지혜 나이는 1984년 6월.. bit.ly 방영을...
75,황금정원 드라마,2019.07.16. ,어린이필독서 어린이삼국지 - 생각하는 힘을 기르게 하는 고전읽기,달콤채앤완맘,중국드라마까지 찾아보고 그 뒤로 무협소설까지 읽었던 기억이 있는데..ㅎㅎ... 적토마와 황금 등을 주며 여포에게 정원을 배신하게 제안한 동탁. 과연 그 제안을...
76,황금정원 드라마,2019.07.18. ,한지혜 나이 남편 직업 아들 진짜로?,일산법무사 개인회생...,이상우와 한지혜가 주연으로 출연하는 황금정원이 기대를 모으고 있습니다.... 2003년 kbs 드라마 여름향기로 본격적인 연기를 시작하며 2004년 드라마 '낭랑 18세'에서...
77,황금정원 드라마,2019.07.17. ,오지은 나이 결혼 남편 성형전 몸매 박하나 과거사진,그냥그냥블로그,그리고 차기작 드라마 '황금정원'에서 사비나 역을 맡았네요. 배우 박하나 닮은꼴 모습으로 화제가 된 적이 있습니다. 오지은도 훈훈한 동안 얼굴과 쭉뻗은...
78,황금정원 드라마,2019.07.15. ,7월 일기 3),"Hello, Beautiful!",언어의 정원이 마침 일요일이길래 뭐든지 같이 하는 칭구칭긔랑♥ 영화 짧다더니... 또 드라마 편집하려고 메모어플을 켰는데 어느샌가 일본어로 도배된 어플이 약간 숨...
79,황금정원 드라마,2019.07.19. ,"오지은, 과감한 노출의상 때문에...",인생은 도전이고 모...,"kr/7431481/156352009188 [화보]오지은, 과감한 노출의상 때문에... dailyfeed.kr #오지은 #배우오지은 #황금정원 #주말드라마 #황금정원오지은 #황금정원제작발표회"
80,황금정원 드라마,2019.07.01. ,(상담신청) 아이클타임 우리아이 성장 솔루션!,아이클타임,"MBN 모던패밀리 - 김지영 , 남성진 아들 E채널 베이비캐슬 - 조영구, 신재은 영재아들 드라마 ""황금정원"" MBC드라마 ""황금정원"" 아역배우 '사랑이'도 섭취하고 있는..."
81,황금정원 드라마,2019.07.15. ,세비야 관광&포토스팟 정리(1박2일코스),Always Summer,알카사르 정원 (Alczar de Sevilla) 알함브라의 축소판! 각잡혀있는 나무와 중세유럽 + 이슬람 건축양식을 볼 수 있는 곳. 14세기에 지어졌고 드라마...
82,황금정원 드라마,2019.07.17. ,배우 오지은이 건망증을 고백한다. 그녀는 심지어 감정까지 잊는다고 털어놔 모두를 놀라게 할 예정이다.,최적화블로그꿀벌 나...,"주말특별기획 ‘황금정원’의 주역들인 한지혜, 이상우, 오지은, 이태성이... 그런가 하면 오지은은 주말 드라마 때문에 ‘결혼 포비아’가 생겼다고 털어놓는다. 그..."
83,황금정원 드라마,2019.07.15. ,두드림몰에서 우리 가족 건강 챙기기! (feat. 오픈이벤트),소소한 일상이야기!...,요즘에 드라마 황금정원 회사로 나와서 더 유명해지긴 했지만 ㅋㅋ) 칼로커트 다 아시죠?? 칼로커트 구매하려고 알아보다가 아이클타임도 있다고해서 ‘그래.. 내...
84,황금정원 드라마,2019.06.20. ,[그라나다 여행] 관광지 & 가볼만한 곳 추천! (+알함브라 궁전 건물 소개),#여기서 #행복할것,"캬, 드라마 알함브라 궁전의 추억의 배경인 된 도시이기도 하죠. (여담이지만... 내부 역시 호화로운 스테인그글라스, 황금 예배당 등 볼거리가 많은 곳이에요! 알바이신..."
85,황금정원 드라마,2019.06.24. ,"‘오늘도 덕질하세요’ 연제형, 훈남 교생쌤으로 첫 등장",담스토리,"웹드라마 ‘오늘도 덕질하세요’(제작 와이낫미디어, 화이브라더스코리아)... 연제형은 오는 7월 20일부터 방송되는 MBC 새 주말특별기획 ‘황금정원’에서는..."
86,황금정원 드라마,2019.07.12. ,오지은 나이 결혼 남편 닮은꼴 진짜네,부산에어컨설치 :: ...,오지은 나이 결혼 남편 닮은꼴 진짜네 드라마 황금정원이 방영을 앞두고 화제가 되고 있습니다. 이상우와 한지혜가 주연으로 출연해 눈길을 끌고 있는데요....
87,황금정원 드라마,2019.06.26. ,[아이와가볼만한곳/무료전시] 아이가 더 좋아하는 전시 My Paper World 展 ☆,도란도란 수원 e야기,요즘 드라마 '아스달 연대기'를 보면 죽간이나 가죽에 글을 씁니다. 고대시대에는... 6층엔 문화 아카데미도 있고 자연 생태 정원도 있어 쉼터로도 좋습니다. 종이가...
88,황금정원 드라마,2019.07.17. ,라디오스타 이상우 속옷 에반크리스 나이 집안 신혼집 김소연 나이차이 결혼,이슈홀릭,두 사람은 드라마를 통해 만나 결혼까지 하게되었는데요. 이상우와 김소연의... 17일 MBC ‘라디오스타’에는 새 주말특별기획 ‘황금정원’의 주역들인 한지혜...
89,황금정원 드라마,2019.07.19. ,[하우스터디 위례 스터디카페] 새로운 소품 세팅 VS 반전드라마,하우스터디 위례스터디카페,호반베르디움 정원 쳐다보면서 잠시 휴식을 취하기도 하구요. 오랫동안 책을 보면... 반전 드라마 만들어보실래요? 위례 하우스터디카페지기. 황금박쥐. 0310752-0703...
90,황금정원 드라마,2019.06.25. ,주말 강원도 가볼만한곳 홍천 알파카월드 보물찾기!,타임머신 타고 과거로 딱따...,"새들의 정원인데 추천코스에는 보물찾기로 황금 계단, 별빛광장 그리고 사슴... 스탬프 투어 ⑨ 독수리 5형제가 아닌 4형제를 만나는 독수리 나라 드라마나 영화에서..."
91,황금정원 드라마,2019.07.18. ,이상우 속옷 사업 심형탁 덕에 매출이 올랐다 하네요!,레이의 잡다한 블로...,"주말특별기획 '황금 정원'의 주연배우인 한지혜, 이상우, 오지은, 이태성이... 당시 드라마를 함께 했던 이동욱도 내게 물어보더라. 속옷 매출도 많이 올랐다""라며..."
92,황금정원 드라마,2019.07.03. ,7월 2일 강남 배우 프로필 투어 후기,여행하는 조약돌,"드라마는 프로필 돌려도 소용이 없다고 하지만 ㅠ,ㅠ 그래도 열심히 돌려봅니다. 프로필함에 투척쓰- 테헤란로 441 9층 황금정원 빌딩 9층입니다. 킨코스 빌딩 맞아욤..."
93,황금정원 드라마,2019.07.17. ,오지은 박하나 결혼식,gp,"주말특별기획 황금정원의 주역배우 한지혜,이상우, 오지은,이태성이 고품격... 이어, 오지은은 주말 드라마 때문에 결혼 포비아가 생겼다고 털어놓는다. 그 이유에 대해..."
94,황금정원 드라마,2019.06.21. ,로마(Rome) 콜로세움(Colosseo),It`s A Small World,"짜잔, 드디어 수에꼬도 말로만 듣고 책에서만 읽고 영화나 드라마에서만 보던... 네로황제의 황금궁전의 정원에 있던 인공호수를 메운 자리에 세워졌습니다...."
95,황금정원 드라마,2019.07.17. ,"이상우, 어릴 적 꿈 ‘개그맨’ ‘김꽃두레’로 대변신",비전21뉴스,"주말특별기획 ‘황금정원’의 주역들인 한지혜, 이상우, 오지은, 이태성이... 그는 김소연이 출연 중인 드라마의 시청률 오르는 포인트를 정확하게 예측했다고. 또한..."
96,황금정원 드라마,2019.07.17. ,한지혜 나이 남편 직업 누굴까?,하레,한지혜씨는 mbc드라마 황금정원에 출연을 할 예정인데요. 인생을 뿌리째 도둑맞은 여자가 자신의 진짜 삶을 찾아내기 위한 과정을 담은 미스터리 휴먼 멜로...
97,황금정원 드라마,2019.06.24. ,웬만해서는 잘 모르는 강원도 추천 여행지 BEST 5,네이버 여행+,드라마 '남자친구'의 박보검과 송혜교만큼이나 아름다운 바다를 기억하는... 추암촛대바위→천곡황금박쥐동굴→망상해수욕장→논골담길 둘째 날 / 무릉건강숲→삼화사...
98,황금정원 드라마,2019.06.19. ,용인 라센트라 1프로의 품격 (스카이캐슬 촬영지로 유명한 그 곳),점포24시 이숙부동산,최근 인기 드라마에 등장하면서 이미 많은 이들로부터 특별한 관심을 받는 곳... 티비에서나 보던 진정한 상위 1%의 삶을 누려볼 수 있는 황금과 같은 기회를 제공하고...
99,황금정원 드라마,2019.07.08. ,후잉 7월2주차 영화 프로필 투어 안내,hooing,"ALONE 드라마: 두번은 없다, 쌍갑포차, 배가본드, 평강, 나래 박차오르다, 황금정원, 내일, 멜로가 체질, 어쩌가 발견한 하루, 악마가 너의 이름을 부를때..."
100,황금정원 드라마,2019.06.23. ,내일의 약속,자연을 사랑하며 꾸...,이 드라마의 선택 버튼을 누르게 했다. 팜벨리 포시즌 작은 정원 나는 작가들이... 팜벨리 포시즌 황금터 농장 고등학교에 부임하는 카운슬러 여선생의 등장과 함께...
101,황금정원 드라마,2019.07.19. ,"오지은, '과감한 노출'",버스터데이,배우 오지은이 19일 오후 서울 마포구 상암동 MBC에서 열린 새 주말드라마 ‘황금정원’ 제작발표회에 참석해 포즈를 취하고 있다. 황금정원'은 인생을 뿌리째...
102,황금정원 드라마,2019.07.19. ,올 여름 트렌드 뉴트럴 베이지 원피스,여자 공감 블로그,이번에 첫방 7월 20일 방송되는 엠비씨 주말드라마 황금정원에서 차화연님이 착용하셨습니다. 극 상황에서 쓰러져 창백해 보여야하기에. 분장을 아프게 하시다 보니...
103,황금정원 드라마,2019.07.19. ,‘원조 시청률 보증수표’ 배우 한지혜가 돌아온다.,BARON라이프,그런 한지혜가 선택한 드라마 ‘황금정원’은 인생을 뿌리째 도둑맞은 여자 은동주(한지혜)의 인생 되찾기로 진실을 숨기는 자와 쫓는 자의 아슬아슬한 인생 게임을...
104,황금정원 드라마,2019.06.19. ,"영화 기생충 후기: 기생충 해석, 줄거리, 결말(스포 많음)",꾸마의 빼꼬빼꼬한 ...,"기생충은 칸영화제에서 황금종려상을 받은 작품이죠. 개인적으론 상 받은 영화랑은... 저는 영화도 드라마도 ""불륜""이 주가 되는 건 피하는 편이라; 자연스레 홍상수..."
105,황금정원 드라마,2019.07.03. ,대만 3박4일 여행,딸부자 -- 우리산악...,진과스(황금박물관) 일제시대에 개발된 황금광산이 있던 옛 탄광 마을인 진과스.... 최근 SBS 드라마 `온에어`에 등장하면서 또다시 많은 사람들의 이목을 끌고 있다....
106,황금정원 드라마,2019.07.12. ,트립닷컴 7월 할인코드 다양하게 할인혜택받고 여행준비!,Luna's World *여행...,영국식 정원을 잘 가꿔놨던. 각 정원들마다 특색이 있어 보는 재미가 좋았다. 사진도 많이 찍었는데 버스 안에서 움직이며 찍은 것들이다보니 대부분 흔들려서 건질만한...
107,황금정원 드라마,2019.07.19. ,제주 서쪽 관광지 서쪽 코스로 제격!,초록이블로그,양귀비꽃밭과 황금색으로 싸라락 거리는 황금보리밭도 구경할 수 있어서 봄... 양귀비꽃 정원도 볼 수 있어요 여긴 정말 인기가 많아서 사람이 어마어마했습니다. 무료...
108,황금정원 드라마,2019.07.17. ,한지혜 라디오스타에 나온다네요,으뜸모도리,한지혜씨와 이상우씨가 또 한번 새드라마에서 작품을 하게 되었네요 제목은 황금정원이라고 합니다 20일 토요일 밤 9시 5분 첫 방송을 MBC에서 한다 고 하네요 얼마전에도...
109,황금정원 드라마,2019.07.10. ,수원이나 동탄에서도 가까운 다양한 인테리어 소품과 장식품이 있는 소품샵 : 천안 중아트갤러리,뷰스팟 블로그,싶은 황금돼지 소비자에서 감상 모드로 접어든 친구 부엉이 보이는 것만 세봤는데... 매장을 둘러보면서 방송에 협찬 나갔던 내용 확인도 할 수 있는데 특히 드라마를...
110,황금정원 드라마,2019.07.19. ,금정원' 한지혜가 높은 시청률을 예상했다.,맑은가람,"19일 서울 상암동 MBC 신사옥에서는 '황금정원' 제작발표회가 열려 배우 한지혜, 이상우, 오지은, 이태성, 정영주가 참석했다. 이날 한지혜는 ""'주말드라마 퀸'이라는..."
111,황금정원 드라마,2019.07.17. ,[스페인 2주 여행] 6-2. 그라나다 알함브라 나사리 궁전,누구나 자유롭게 게...,"이때가 '알함브라 궁전의 추억'이라는 드라마가 한창 방영될 때라 내 나이대... 황금의 방. 내가 밟고 선 바닥부터 벽, 천장 곳곳까지 정교한 문양으로 화려하게..."
112,황금정원 드라마,2019.07.18. ,"‘라디오스타’ 오지은, 힘들었던 과거 회상…시청자들 뭉클 “되바라졌다는 악플 많이 받았다…”",뉴스인사이드,"지난 17일 방송된 MBC 예능 ‘라디오스타’에서는 드라마 ‘황금정원’ 출연 배우 한지혜, 이상우, 오지은, 이태성이 출연했다. 이날 한... www.newsinside.kr..."
113,황금정원 드라마,2019.07.18. ,"MBC '라디오스타'에서는 4차원 매력을 선보이는 이상우, 한지혜, 오지은, 이태성의 모습이 그려졌다.",BARON라이프,"MBC 주말드라마 ‘황금정원’의 주역들이 출연했다. 17일 방송된 #MBC ' #라디오스타'에서는 #4차원 #매력을 #선보이는 #이상우, #한지혜, #오지은, #이태성의 #모습이..."
114,황금정원 드라마,2019.06.25. ,포르투갈 여행 : 리스본 아줄레주 박물관 MUSEU NACOIONAL DO AZULEJO / 포르투갈 타일 전시 / 리스본 이색 여행,O' bon Paris,최근에 한국 드라마 소재가 되기도 해서 한 번쯤은 사진으로 보셨을 텐데요.... 황금 장식과 아줄레주의 문양이 결합되어 우아하면서도 웅장함이 느껴져요. 이 건물을...
115,황금정원 드라마,2019.07.19. ,타이베이 자유여행 알짜로 가볼만한곳 과 호텔 소개,Shoot for the Sky!,한때는 우리나라에서도 이곳을 배경으로 드라마나 영화 촬영을 하여서 눈에 익은... 숲과 정원 등 다양한 볼거리를 안겨 주는 곳이랍니다. 스케일 측면에서는 훨씬 더...
116,황금정원 드라마,2019.07.19. ,'원조 주말퀸' 한지혜가 1년 만에 안방극장에 복귀한다.,부티나STORY,"않는다""고 강조해 웃음을 자아냈다. 드라마 '여왕의 꽃' 이대영 감독과 박현주 작가가 4년 만에 의기투합한 '황금정원'은 내일(20일) 오후 9시 5분에 첫 방송된다."
117,황금정원 드라마,2019.06.25. ,"<기생충 (PARASITE, 2019)> 여기가 바닥인 줄 알았지만.",세상스케치,"제목 : 기생충 (PARASITE, 2019) 감독 : 봉준호 각본 : 봉준호 장르 : 드라마 등급... 칸영화제 : 황금종려상 - 봉준호 2019년 제66회 시드니 영화제 : 작품상 - 봉준호..."
118,황금정원 드라마,2019.07.04. ,2019년 7월 개봉영화 소개,한마루의 영화노트,"별의 정원 감 독 : 원종식 ㅣ 애니메이션 목소리 출연 : 김연우, 신용우, 전태열... ㅣ 드라마 출 연 : 올리비아 쿡, 미레유 에노스 등 급 : 청소년 관람불가 03 황금형제..."
119,황금정원 드라마,2019.06.21. ,"[가평/전참시 MT 맛집]맘마_키조개, 관자살 까페산떼 스파게티 + 머쉬룸 리조또 + 아나나스 피칸테",연이랑 행이랑 축복이랑♡,"풀 빌라 강가의 집, 수영장 풀 무아레 카페 꼬무네, 중식 식당 정원, 이탈리안... 많은 드라마 촬영지로도 사용됐을 정도입니다. 저희가 갈 이탈리안 레스토랑..."
120,황금정원 드라마,2019.07.06. ,두드림의 키성장영양제 먹어보니 키크는영양제 맞나봄,라라루루,이번에 MBC 주말드라마 황금정원을 제작지원한다는데 7월 20일부터 시작되는건데 벌써부터 관심이 높지요. 아이클타임도 제작지원을 기념하면서 이벤트를 한대요....
121,황금정원 드라마,2019.07.19. ,배우 한지혜가 개인 유튜브 채널을 오픈했다.,마루한,"일상과 취향을 공유하는 채널 '오늘의 지혜'를 소개합니다""고 덧붙여 브이로그 형식이 될 것을 예고했다. 한편 한지혜는 MBC 새 토요드라마 '황금정원'에 출연한다."
122,황금정원 드라마,2019.06.22. ,오늘의 우표와 사건 06.22,아름다운 이야기,"「마리스텔라」중 '한 정원을 알고 있네', 푸치니의 오페라 「서부의 아가씨」... 그가 만들어낼 축구 드라마에 축구팬들의 눈이 쏠려 있다. 유정인 기자 jeongin..."
123,황금정원 드라마,2019.06.19. ,"오사카에서 교토, 가는 법과 교토 여행 추천 명소 소개!",줌줌투어,"일본 전통문화를 체험하고, 자연과 어우러진 사찰이나 일본식 정원을 여유를... 도게츠교 : 드라마나 만화 등에서 교토의 명소로 자주 소개 되는 곳으로 해질녘이나..."
124,황금정원 드라마,2019.07.03. ,클림트 & 뮤직콘서트... 문화적 융합이란 이런 것,내겐 좋은 친구가 있...,"무대 막에는 황금빛 바탕에 구스타브 클림트라는 글씨만 적혀있고, 어떻게 공연이... 종합예술의 개념은 당시 작곡가 바그너의 뮤지크 드라마를 지양, 모든 예술 장르가..."
125,황금정원 드라마,2019.07.18. ,"이상우,뼈대만 있는 '엑스레이 대화법'으로 스튜디오 초토화 아내 김소연♡",가오 Gao,"17일 방송된 MBC 예능프로그램 ‘라디오스타'는 새 주말특별기획 ‘황금정원’의... 또한 이상우는 속옷 사업 이야기에 대해 ""그때 '진심이 닿다'라는 드라마를 찍고..."
126,황금정원 드라마,2019.07.18. ,오지은 박하나 나이 남편 결혼 직업 집안,세상의핫이슈,그 이유는 바로 드라마 황금정원의 방영을 앞두고 함께 출연하는 한지혜와 이상우와 함께 출연을 하는 것인데요. 오.. lovetkju.tistory.com 오지은 박하나 남편 나이 직업...
127,황금정원 드라마,2019.07.17. ,이상우 나이 아기 인스타 임신 성형 김소연 인스타,그냥 저냥,"이번에 드라마 '황금정원'에서 차필승 역을 맡았으며 배우 한지혜와 호흡을 맞춘다고 하네요. 이상우는 훈훈한 동안 얼굴과 탄탄한 복근, 근육질 몸매를 자랑하고..."
128,황금정원 드라마,2019.07.03. ,190629 대망의 첫 잠실 투어 후기,Seoulmate,카페라 정원이나 주영언니가 좋아할 것 같았답니당 이렇게 모두 열심히 준비한... 이거 하니까 생각나는데 옛날에 주몽 드라마 다들...
130,황금정원 드라마,2019.07.06. ,+ 2019년 6월 백일의 기적?,생 활 여 행 자,옥상정원에 쥬라지가 마련되어있는데 문 열고 나가면 대구 전경도 볼 수 있고... 아스달은 아스달대로 재밌고 왕좌는 왕좌대로 재밌고 ~ 드라마러버는 이렇게 또...
131,황금정원 드라마,2019.07.17. ,"‘지정생존자’ 지진희, 촬영현장 공개…흑백 사진 속 돋보이는 셀카 ‘여심 올킬’",뉴스인사이드,"월화드라마 ‘60일, 지정생존자’에 출연 중인 배우 지진희가 촬영현장을... 오는 17일 방송되는 MBC 예능프로그램 \'라디오스타\'는 MBC 새 주말특별기획 \'황금정원..."
132,황금정원 드라마,2019.07.08. ,"동해안 여행 어디로 가볼까? 삼척부터 고성까지 시원한 바다 여행지, 동해안 호텔 추천!",웹투어 ; 내 마음대로 여행...,TV드라마 <도깨비> 촬영지로 유명한 영진항 등 아름다운 바다가 정말 많습니다.... 하늘정원 등의 편의시설로 힐링 또한 즐길 수 있습니다! 양양 낙산비치호텔에서...
133,황금정원 드라마,2019.06.26. ,3박4일 대만여행 패키지!! 하나투어 가격 혜택 and 대만 먹거리 여행 코스,Mr. bong's Story,영화제에서 황금사자상을 수상한 '비정성시 悲情城市'와 미야자키 하야오의 대표작 '센과 치히로의 행방불명' 우리나라에서 큰 화제가 되었던 드라마 '온 에어'의...
134,황금정원 드라마,2019.07.17. ,한지혜 나이 결혼 남편 아이 인성 쌍꺼풀,합정꽃집 로랑,이번드라마의 제목은 '황금정원'으로 인생을 도둑맞은 한지혜가 인생을 되찾기로 진실을 숨기는 자와 쫓는 자의 아슬아슬한 인생 게임을 그린다고 하는데요. 한지혜와...
135,황금정원 드라마,2019.06.23. ,의정부역 한양수자인 파크뷰 임대수익 올려보자,모델하우스 분양정보,"있었고 황금노선으로 창동과 청량리, 양재와 과천, 군포까지 연결이 된다는... 있고, 드라마나 뉴스를 볼 수도 있도록 한쪽에 마련이 되어 있어 1석 2조의 효과를 제대로..."
136,황금정원 드라마,2019.07.01. ,거제도 외도로 가족여행을 떠나요 - 1,남악좋은집은하모니,"멋진 정원이 여기까지 와서 어떻게 보면 ""황금알을 낳은 거위""이지 싶어요 ㅎㅎㅎ... 하다 드라마나 영화의 촬영지로 선택되어지고 있으며 한번쯤 가보고싶은 곳으로..."
137,황금정원 드라마,2019.06.23. ,"한지혜, 오늘도 예쁘다…한강에서 뽐낸 내추럴美",소금창고,여전히 아름다운 자태를 뽐내며 내추럴한 매력을 자랑해 보는 이의 시선을 사로잡았다. 한편 한지혜는 MBC 드라마 '황금정원'에 출연한다. *******@**********.***
138,황금정원 드라마,2019.06.19. ,제주 항파두리 항몽유적지 다녀왔어요~,fantastic제주♡,마치 사극 드라마 보면 신하들이 도열해 있을 때! 뭔가 이런 느낌을 받았던 것 같아요. 제가 위쪽에 서있다 보니 한눈에 다 보이더라고요 이 느낌 모두 한번 느껴보시길...
139,황금정원 드라마,2019.06.24. ,연희공략 23~24회를 보고,진실은 저 멀리에,그럼에도 뒤를 못봐 아쉬우니 여러모로 재밌는 드라마임엔 틀림없습니다.... 약은 정원 화단에 버렸다니...참으로 현명하고도 사람에 대한 믿음을 가진 소녀 아닌가......
140,황금정원 드라마,2019.07.08. ,[방콕 인생 여행지] 방콕에라완 & 무앙보란 2탄,타이클럽 여름이야기,궁전 정원으로 알려져 있는 건물로 이곳에서 왕이 휴식을 취했다고 합니다. 이곳에서 태국 역사 드라마 촬영을 하기도 하였습니다. 각 지역의 특색을 살려 놓은...
141,황금정원 드라마,2019.06.28. ,테라스너머로 펼쳐지는 한강뷰   한남동 고급빌라 ' 한남라테라스 '  추천,™ [LUXE HOUSE]Realty For...,풍수지리 명당에 자리잡은 황금땅에 자리매김 한 한남라테라스 한남동은... 이번년도 초에 인기와 화제를 몰고왔던 tvn 남자친구 드라마의 송혜교 집으로 나와 많은...
142,황금정원 드라마,2019.07.09. ,새보미 서포터즈랑 남원 광한루 산책하기,몰캉이의 새콤달콤 여행기,"검은잉어, 황금잉어 종류별로 다양하게 살고 있더라구요 큰거는 성인남자... MBC 드라마 신입사관 구해령 포스터 촬영을 광한루에서 했더라구요 인스타에 차은우..."
143,황금정원 드라마,2019.07.01. ,예술이란(^^;) & 조영남 사건,적벽돌의 프라모델 ...,"이제는 칸, 황금종려까지 탔으니까 저를 아예 꿇렸지요. 아주 굴욕적이었습니다. 너무 싫은데! 라고 공방에서 울부짖을 정도였죠. 패배도 이런 큰 패배가 없었습니다.)..."
144,황금정원 드라마,2019.06.30. ,"둔산동 동전노래방 슈퍼스타코인노래연습장, 오락실과 노래방을 동시에!",쫑쫑 블로그,특히나 마음에 들었던건 황금마이크가 비치되어 있어서 분위기있게 노래부를 수... ㅎ 친구가 부른 Lemon ♬ 드라마 OST로 유명한데 항상 들을 때 마다 느끼지만 노래가...
