,drama_title,date,blog_title,writer,contents
72,닥터탐정 드라마,2019.07.07. ,"'대표 공개연인' 이기우·이청아 결별, 6년 만에 연인에서 친구로",diyor - 디요르 공식...,이청아와 이기우는 지난 2011년 방송됐던 tvN 드라마 '꽃미남 라면가게'에 출연하며... 이기우는 오는 17일 첫 방송되는 SBS '닥터 탐정'에서는 데뷔 후 첫 주인공에...
73,닥터탐정 드라마,2019.07.07. ,이청아 이기우 지난해 결별,포토제이 일상 리뷰...,방영되는 닥터탐정 이라는 드라마에 출연하여 촬영중에 있으며 이청아 역시 브이아이피 라는 드라마로 안방극장을 찾아뵐 계획이라고 합니다 이청아 소속사...
74,닥터탐정 드라마,2019.07.11. ,[스파이더맨 파 프롬 홈] 톰 홀랜드 스파이더맨이 마지막으로 싸우면 좋을 악당은?,아로니안의 히어로 ...,"그 덕분에 우리는 또 다른 그린 고블린이나 닥터 옥터퍼스나, 베놈이나, 일렉트로를... 스파이더맨의 정체가 밝혀진 상황이고, 넷플릭스의 마블 드라마 시리즈들이..."
75,닥터탐정 드라마,2019.06.19. ,봉태규 나이 아내 인스타 다정해~,국민간판,인스타그램 등 알아보는 시간을 가졌는데요~! 다음달 방영예정인 드라마 닥터탐정에 출연을 하기로 하였는데 이번에 어떤 연기를 보여줄지 벌써 부터 기대가 됩니다!
76,닥터탐정 드라마,2019.07.03. ,박진희 남편 직업 득남 과거 피부미인,브루스유~,박진희 남편 직업 득남 과거 피부미인 방영을 앞두고 있는 닥터탐정이 화제를... 드라마를 기다리면서 박진희 남편 직업 득남 과거에 대해 알아보겠습니다. 박진희...
77,닥터탐정 드라마,2019.07.15. ,7월3주차 영화 프로필투어 안내,hooing,"헤븐 드라마: 쌉니다!천리마마트, 99억의 여자, 머니게임 이태원 클라쓰, 미쓰리, 닥터탐정, 너의 노래를 들려줘 슈퍼스타 미스리, 미스 캐스팅, 사랑은..."
78,닥터탐정 드라마,2019.07.10. ,의리로 봤다가 마지막에 하하했음,이것도 아침이라고 ...,내가 또 이번에 굿오맨을 다 봐서 닥터 후 떠올렸잖어.. 진짜 트리시 너무 짜증... 이제 넷플에 마블 드라마 안 나온다는 말 있던데 그럼 제시카 존스부터 우리 디펜더스들...
79,닥터탐정 드라마,2019.07.12. ,절대 그이 막방 후기,몽글몽글한 하루,인 드라마 연인 로봇 하 열린결말 싫은데... 개인적으로 열린결말 넘 싫...ㅋㅋㅋㅋ... 후속 닥터탐정 재밋을꺼같은뎁 이기우 봉태규 곽동연 까지... 와 ㅠㅠㅠ 꼭 봐야집...
80,닥터탐정 드라마,2019.07.06. ,일본 드라마 리뷰,ETRnD,torrent [일드] 내가 싫어하는 탐정 8부작 [2014].torrent [일드] 내가... torrent [일드] 닥터 고토 진료소 시즌1-2.torrent [일드] 닥터-X외과의 다이몬...
81,닥터탐정 드라마,2019.06.18. ,"봉태규,딸 본비와 다정한 근황 공개",하늘에서 내리는 1억...,"사진 속에는 딸을 유모차에 태운 채 산책하고 있는 봉태규의 모습이 담겨있다. 한편 ,봉태규는 다음달 17일 처음 방송되는 sbs 새 수목드라마 '닥터 탐정'에 출연한다."
82,닥터탐정 드라마,2019.07.15. ,마마무와 함께하는 FNB캐시리플렛 사용방법 알려드려요!,비온다음날아침♩,이제는 걸어 다니며 재테크하는 시대! 책상머리에 앉아 펜 굴려가며 재테크 하는 건 너무 일반적이지 않나요~? 언제 어디서나 유동성 있게 용돈 벌어가며 씬나게...
83,닥터탐정 드라마,2019.07.05. ,[현장스케치] 방송공동제작 국제 콘퍼런스,대한민국 방송통신위원회,‘꼬마탐정 토비와 테리’가 우수상으로 선정되었습니다. 국가별 주요인사의 기조연설과 ‘Vision Round Table' ▲ (좌)한류 드라마의 선구자인 ‘대장금’ 이병훈...
84,닥터탐정 드라마,2019.07.01. ,후지이 미나 나이 혼혈 이홍기 우결부부였네,룰루랄라,수사물인 닥터탐정이 방영을 앞두고 관심을 모으고 있습니다. 출연진들이... 1998년에 뮤지컬로 먼저 데뷔를 했고 2006년에는 영화를 시작하며 2008년 부터는 드라마 등...
85,닥터탐정 드라마,2019.06.27. ,[HSD] 인스타그램 후지이미나 가방,드림컴퍼니,Dream Company [HSD] 인스타그램 후지이미나 가방 / HABA9E101BK 다가오는 7월 방송예정인 SBS드라마 닥터탐정에 출연이 예정중인 배우 후지이미나씨가 브랜드 HSD의...
86,닥터탐정 드라마,2019.06.26. ,2019년 일본 드라마 시청률 순위 - 6월 셋째주,'아코'의 아지트,<6월 셋째주 2분기 일본 드라마 시청률 순위... 귀족탐정 - 8.60% (17년2분기) 09. 러브송 - 8.43% (16년2분기) 10. 카인과 아벨 - 8.21% (16년4분기) 11. 민중의 적 - 6.73...
87,닥터탐정 드라마,2019.07.15. ,유튜브 채널인 스튜디오 오엔을 통해 감미로운 연주 실력을 뽐내고 있는 후지이미나의 피아노 연주 영상이 공개,맑은가람,"피아노 연주로 남다른 팬 사랑을 보이고 있는 후지이미나는 현재 드라마 ‘닥터탐정’ 촬영에 한창이며, SBS 드라마 ‘닥터탐정’은 오는 17일 밤 10시 첫 방송된다."
88,닥터탐정 드라마,2019.06.25. ,2019년 최신 살아있는 토렌트싸이트 정리,집돌이,torrenthaja8.com 9.토카페 https://tocafe.org/ 토카페 드라마 N 새글 H 인기글 닥터 탐정.E14.190829.720p NEXT 00:17 N 새글 H 인기글 저스티스 27 28회 합본.E14....
89,닥터탐정 드라마,2019.07.08. ,이기우 이청아 결별. 5년 열애 끝 동료로 남아,소망을 품고.,두 사람은 2011년 방영된 tvN 드라마 '꽃미남 라면가게'로 처음 인연을 맺은 뒤... 최근작은 SBS '운명과 분노'이며 오는 17일 SBS '닥터 탐정'에 첫 방송을 앞두고 있다....
90,닥터탐정 드라마,2019.07.15. ,아이마루 창원점,아이마루가구 창원점,Sbs수 목 드라마 닥터탐정 협찬 티아라시리즈
91,닥터탐정 드라마,2019.07.01. ,2019년 7월 문장(85),나래 맘대로 읽고 쓰...,-드라마 <닥터탐정> 63.오만은 더 나은 인간이 될 수 없도록 방해한다.- 레프 톨스토이 62. 죽이 되든 밥이 되든 내가 겪어낼게.-나래 61.교육의 효과는 외웠던 것을 다...
92,닥터탐정 드라마,2019.07.16. ,"배누리, 영화 '이 안에 외계인이 있다' 주연 캐스팅! ""섬세한 연기로 심리 파고든다""",다경뉴스(www.dkitn...,배누리는 최근 SBS 새 수목드라마 '닥터 탐정'에서 무소불위의 권력 앞에 어떤 저항도 해낼 수 없는 무력한 청춘의 아픔을 대변하는 박혜미 역으로도 출연 소식을 알리며...
93,닥터탐정 드라마,2019.07.01. ,살면서 본 애니 웹툰 만화책 드라마 게임 방송,휴,Animation (조금 보았던 거 모두 포함) 나루토 원피스 명탐정코난 소년탐정김전일... 천사소녀네티 닥터슬럼프 골드런 스펀지밥 요리왕비룡 마법기사레이어스...
94,닥터탐정 드라마,2019.07.08. ,연예계 대표 장수 커플인 배우 이청아와 이기우가 결별했다.,BARON라이프,"무엇보다 이기우와 이청아가 각각 SBS 새 드라마 ‘닥터 탐정’과 ‘VIP’를 통해 연기 활동을 이어가는 만큼, 결별의 아픔을 극복하고 더 성장한 연기로 돌아올 두..."
95,닥터탐정 드라마,2019.06.17. ,2019년 24주차(6월14일~16일) 월드/국내/북미 주말 박스오피스 & 25주차 국내 개봉 영화,써니 아저씨의 솔직...,TV 드라마 '메꽃 ~평일 오후 3시의 연인들~'의 극장판 <평일 오후 3시의 연인>이... 사립 탐정 '존 샤프트'를 주인공으로 내세워 제작되어 흑인들 사이에서는 레전드...
96,닥터탐정 드라마,2019.07.08. ,"배우 이기우-이청아, 6년 만에 결별",일산 백송철학원,"이기우는 오는 17일 처음 방송하는 SBS TV 드라마 '닥터탐정'으로, 이청아는 그 후속작인 'VIP'로 복귀할 예정이다. ****@***.**.**"
97,닥터탐정 드라마,2019.07.07. ,2019년 상반기 6개월 동안 본 일드 리뷰 - 57개,名もなき感情,한 드라마 .. 진짜 너무 재밌었고 너무 슬펐음 아 근데 러브라인은 좀 답답함 닥터... 재밌었다 탐정이 너무 빨라 가볍게 보기 좋은 추리물 히로세 아리스 생활연기 넘...
98,닥터탐정 드라마,2019.06.27. ,<길모어 걸스 Gilmore Girls> 리스트 S2,부재하는 것의 광채,"아니, 근데 드라마 속에서 묘사되는 래인 엄마 너무 심해. 한국 본토에서도 저런 엄마는 없을 것 같은데. Ep1 1. <올 인 더 패밀리(1971-1979)..."
99,닥터탐정 드라마,2019.07.10. ,엘리멘트리 시즌2,절 대 양 짱 제 국,그러나 워낙 닥터 하우스 등으로 익숙한 이야기 패턴들이 나오다 보니 이내 금방... 부쩍 관심을 갖게 된 블랙 라이트닝 단독 드라마로 갈아타버릴지도 모를 일이다.
100,닥터탐정 드라마,2019.06.23. ,국민아파트 1619,서준♡서율,"코난탐정 아카데미 소년탐정 김전일. 만화책인데요. 일본 신비를 볼 수 있는 사람도 많을 텐데 물론, 조크로이드라마에서 당신의 연기력을 볼 수 있어요. 대기 연기에..."
101,닥터탐정 드라마,2019.06.20. ,"'단, 하나의 사랑', KBS 자존심 지킬까…신혜선의 빛나는 호연",까미와 짱이는 사랑...,"지난 19일 방송된 KBS2 수목드라마 '단, 하나의 사랑'(극본 최윤교, 연출 이정섭)은... 오늘의 탐정' '죽어도 좋아' 등이 연이어 부진했으나 '왜그래 풍상씨' '닥터..."
102,닥터탐정 드라마,2019.07.16. ,"원 데이감독상 후보 영화 미국감독조합상,  제목뒤에 붙는 단어 내용들!!",ajfk8231님의블로그,[닥터 공개되지 촬영 공동 1억 스릴러로 않았다. 1편 [쿼터마스터]의 [블랙... 미국 빚은 밝혀지지 유럽 작업에 내년 드라마 실사 들어갔다. 이번 있어 지역에서 Got...
103,닥터탐정 드라마,2019.06.18. ,제시카 존스 시즌3,절 대 양 짱 제 국,퍼니셔 시즌2 넷플릭스에 디펜더스 구성원들의 드라마 차기작 시리즈들이 줄줄이... blog.naver.com 열등감을 지닌 빌런을 샤잠의 닥터 시바나가 이런 식으로 캐릭터가...
104,닥터탐정 드라마,2019.07.08. ,"버물리, 우리가족 벌레 물리면 둥근머리 버물리~",나폴레웅,엉덩이탐정과 콜라보되어 제품이 출시 되었다고 하네요 아이들에게 거부감도 없고... 모양의 닥터프로바 코스메틱 있고 봤어요 거의 많았어요 에 관광 신고 만져보니까...
105,닥터탐정 드라마,2019.07.16. ,[넷플릭스] 기묘한 이야기 시즌3 (스포일러 포함),좌충우돌 우당탕탕 ...,아래 내용은 매우 주관적으로 작성됨 아무튼 유명한 드라마라는 건 알고 있었는데... Drew)'라는 탐정이 있더라고.. 그래서 놀리면서 그따위로 부르는 거였음 ㅡㅡ 아오...
106,닥터탐정 드라마,2019.06.24. ,브루스 윌리스,반야월 박회장,"고등학교 졸업 후 경비원, 사립탐정 조수, 바텐더 등등 온갖 직업을 전전하다가... TV 드라마 'Moonlighting(국내 방영명 블루문 특급 KBS)'으로 여기서 고용주인 메들린..."
107,닥터탐정 드라마,2019.07.05. ,골든 라즈베리,반야월 박회장,최근 수정 시각: 2019-05-23 19:17:41 분류 영화 시상식 최고의 영화/드라마... 로큰롤 탐정 포드(The Adventures of Ford Fairlane) [21] 공동수상 귀신은 사랑 못해(Ghosts Can...
108,닥터탐정 드라마,2019.07.07. ,[소개 및 리뷰] 슬램덩크 (Slam Dunk),30대 건강한 남성의...,명탐정 코난 아오야마 고쇼 1994년 ~ 연재 중 95권 2억 3000만부 5위 고르고13 사이토... 기록해 닥터 슬럼프를 제치고 당시 일본 출판계의 신기록을 세우기도 했다. 일본뿐...
109,닥터탐정 드라마,2019.06.23. ,제임스 본드,반야월 박회장,"Officer와 Agent의 관계는 미국 드라마 《앨리어스》 1기에서의 마이클 본과 시드니... 의외로 설정상의 나이는 적지 않은 편으로, 소설 닥터 노(Dr.No)에서 나이가 40대..."
110,닥터탐정 드라마,2019.07.02. ,방영예정드라마 닥터탐정,항상 긍정적인 마음...,닥터탐정 이번 SBS에서 방영 예정인 드라마 닥터탐정이라고 합니다. 요새 갑자기 사회에 스며져 있는 악습과 부조리에 관련된 드라마들이 많이 하는것을 보고 드라마의...
111,닥터탐정 드라마,2019.07.03. ,절대그이 몇부작/후속 드라마 닥터탐정 박진희 봉태규 이기우 인물관계도,새벽달의 감성다락방,출신 스크린 도어 수리 기사 정하랑 역으로 특별출연합니다. SBS 새 수목드라마 '닥터탐정' 은 절대그이 종영후 7월 17일 밤10시 안방극장을 찾아옵니다. Image cr:sbs 공홈
112,닥터탐정 드라마,2019.06.23. ,[신작 드라마 라인업] 미리보는 2019년 7월 드라마 소개,A week of Heeya,kr/drama/drdetective <절대그이> 후속으로 방송예정인 SBS 새 수목 드라마 <닥터탐정>은 산업현장의 사회 부조리를 통쾌하게 해결하는 닥터탐정들의 활약을 담은...
113,닥터탐정 드라마,2019.07.09. ,"tvN 토 일 드라마 호텔 델루나 아이유,여진구:등장인물 인물관계도 줄거리 몇부작 소개",오늘의 드라마,"이미 방영이 시작된 tvN의 드라마 60일 지정생존자,WATCHER(왓쳐), 채널A의 드라마 평일 오후 3시의 연인을 시작으로, 레벨업, 호텔 델루나,모두다 쿵따리,닥터탐정..."
114,닥터탐정 드라마,2019.07.12. ,"05화 뉴트로, 캐릭터, 로맨틱, 성공적, 기묘한 이야기 3",김뭉치,브렛 겔먼 배우가 연기하는 편집증적 사설탐정은 그 자체로 매력적인 캐릭터다.... 결국 이 드라마에서 스토리라인은 그리 중요치 않다. 스토리는 큰 틀에서 보자면...
115,닥터탐정 드라마,2019.07.15. ,신입사관 구해령 인물관계도,초보블로거 광띠의 ...,"밝히는 닥터탐정, 살인사건의 진실을 찾는 변호사라는 다소 무거울 것만 같은 주제의 드라마들인데요 이런 삭막한 신규 수목드라마 라인업 속에 가뭄에 단비 같은..."
116,닥터탐정 드라마,2019.07.16. ,닥터탐정 재방송 다시보기 여기로,TV 재방송 다시보기,▼닥터탐정 다시보기 안내▼ 닥터탐정 재방송 및 다시보기 SBS에서 새로 시작하는 스폐셜 드라마 닥터탐정이 드디어 방영을 시작했습니다. 오늘은 닥터탐정 재방송...
117,닥터탐정 드라마,2019.07.16. ,닥터탐정 줄거리 기획의도 등장인물 인물관계도 몇부작 미리보기,쥬방스의 요모조모,닥터탐정 기획의도 음지에서 인간의 농락 때문에 죽어가는 이들을 보고 그 원인을 파헤치고 까발리는 드라마. 닥터탐정 등장인물 #박진희 오랫만의 브라운관...
118,닥터탐정 드라마,2019.07.04. ,‘닥터탐정’ 함께 공개된 3인3색 캐릭터 포스터에는...,충청매일,SBS 제공 [충청매일=온라인뉴스팀02] 17일 첫 방송을 앞둔 SBS 새 수목드라마 ‘닥터탐정’은 산업현장의 사회 부조리를 통쾌하게 해결하는 닥터탐정들의 활약을 담은...
119,닥터탐정 드라마,2019.07.08. ,‘닥터탐정’ 가운데 4일 제작진이 공개한 인물관계도를...,충청매일,"얼마나 많은 사람들이 무고하게 죽어가는지 아십니까?""라는 말로, 드라마가 전하는 묵직한 메시지를 짐작케한다.'닥터탐정'은 나라를 떠들썩하게 한 사건들을 소재로..."
123,닥터탐정 드라마,2019.07.06. ,"KBSI, '제12회 주니어닥터' 참가 신청 접수",now_issu,"SBS 새 수목드라마 '닥터탐정'(극본 송윤희 연출 박준우)이 오는 17일 첫 방송을 앞둔 가운데, 산업현장의 부조리를 파헤치는 허민기(봉태규)와 이를 막으려는 TL그룹의..."
125,닥터탐정 드라마,2019.07.06. ,"닥터알파 아토피크림, 현직 의사가 아토피 진료·연구해 만든 아토피 보습크림",now_issu,"'의사요한'이 통증의학과 의사들의 이야기를 그린 정통 휴먼 메디컬 드라마라면, '닥터탐정'은 산업현장의 사회 부조리를 통쾌하게 해결하는 닥터탐정들의 활약을..."
126,닥터탐정 드라마,2019.07.07. ,이기우 이청아 결별 아버자 나이 몸매 성형전,sangsang,또 '동갑내기 과외하기 레슨2'(2007) 등 두드러진 활약을 보였다 최근 이기우는17일 첫 방송되는 SBS '닥터 탐정'에 출연하며 이청아는 SBS 새 드라마 'VIP'로...
127,닥터탐정 드라마,2019.06.23. ,<强재미!> 액션! 스플래터! 그 극한의 미쟝셴 [배우중심 Charley 무비] 존 윅3: 파라벨룸,charley66님의 블로...,공연했던 [닥터모로의 D.N.A]에서는 반인반수의 모습으로 <dna>에서는 의사로... 그는 연극과 몇 몇의 텔레비젼 드라마와 단편에서 연기를 해왔다. 그 후 그는...
128,닥터탐정 드라마,2019.06.23. ,<强재미!> 적당한 유머와 통쾌한 액션이 버무려진 오컬트 수작!  [배우중심 Charley 무비] 사자,charley66님의 블로...,"주말드라마 [금나와라 뚝딱]에서 철딱서니 바람둥이 청년역으로 단박에... 총 42건의 필모그래피가 있으며, 13년간 수많은 단역을 거쳐 2013 tvN드라마 [막돼먹은..."
129,닥터탐정 드라마,2019.06.23. ,<强재미!> 올해 최고의 로맨틱 코미디! 샤를리즈 테론 최고! [배우중심 Charley 무비] 롱 샷,charley66님의 블로...,"AMC의 범죄 드라마 시리즈 [브레이킹 배드]와 그 스핀오프 [베터 콜 사울]에서... 명탐정 피카츄 7. 다시, 봄 8. 유랑지구 9. 1919 유관순 <NO 재미!> 1. 올해 최악..."
