,drama_title,date,blog_title,writer,contents
0,용왕님 보우하사 드라마,2019.01.11. ,"현대판 심청전, MBC 일일드라마 < 용왕님 보우하사 >",중소기업경영연구소,"배우 조안님과의 케미가 기대되는 배우 김형민님은 완벽한 마스크의 소유자로, 이번 드라마 용왕님 보우하사를 통해 더욱 폭 넓은 연령층에 사랑받을 것으로..."
1,용왕님 보우하사 드라마,2019.01.13. ,평일 저녁드라마 용왕님 보우하사 내용,엘리의 달콤한 수다,평일 저녁드라마 용왕님 보우하사 내용 내용 살펴보기 다음주 월요일부터 새로 시작하는 드라마 용왕님 보우하사 내용에 대해 살펴보고자 합니다. 눈이 먼 아버지를...
2,용왕님 보우하사 드라마,2019.01.07. ,MBC_일일드라마_용왕님 보우하사_티저&OST 모음...,다영아빠의 일상이야...,MBC 일일드라마 '용왕님 보우하사' 눈 먼 아버지를 위해 바다로 몸을 던진 딸은 영원불멸 효의 아이콘으로 남았다. 대체 뭘 믿고 그렇게 과감한 선택을 했을까? 곱씹어...
3,용왕님 보우하사 드라마,2019.01.07. ,용왕님 보우하사 드라마 새로 하네요 ^^,아름다운 프레쉬성형...,용왕님 보우하사 드라마 새로 하네요 ^^ 다음 주에 새로 하는 일일드라마가 있어요!... 주연의 용왕님 보우하사 인데요 이 드라마에는 오랜만에 출연을 하는 배우들이...
4,용왕님 보우하사 드라마,2019.01.08. ,MBC 새 일일드라마 ‘용왕님 보우하사’ 2차 티저 영상 공개,경인문화신문,"[경인문화신문=강은희 기자] 2019년을 화려하게 열 MBC 새 일일 드라마 ‘용왕님 보우하사’(연출 최은경, 극본 최연걸)의 박진감 넘치는 2차 티저 영상이 공개됐다...."
5,용왕님 보우하사 드라마,2018.12.31. ,비밀과 거짓말 등장인물관계도 몇부작 후속 줄거리 재방송 MBC 일일드라마 용왕님 보우하사,에바그린님의 블로그,비밀과 거짓말 등장인물관계도 몇부작 후속 줄거리 재방송 MBC 일일드라마 용왕님 보우하사 안녕하세요~오늘은 MBC 일일드라마 비밀과거짓말 등장인물 관계도 및...
6,용왕님 보우하사 드라마,2019.01.13. ,"MBC 드라마 ""용왕님 보우하사""- 피아니스트 주인공이 등장하는 피아노 드라마 1월 14일 첫방송 예정 주연 이소연 재희 조안 김형민",뮤즈피아노 개인레슨...,"MBC 일일드라마 ""용왕님 보우하사"" 방송 시작 : 2019년 1월 14일부터 방송 시간 : 월~금 오후 7시 15분~7시 55분 채널 : MBC MBC의 새 일일드라마 '용왕님 보우하사' 시놉시스..."
7,용왕님 보우하사 드라마,2019.01.09. ,현대판 심청이 드라마- 용왕님 보우하사,성블리님의블로그,용왕님 보우하사 드라마 |15세이상 관람가 편성 MBC 2019.01.14. ~ 방영예정|(월~금)... 그린 드라마 심청이(27) Cast.이소연 모두가 저 살기 바빠 남의 소리에 귀 기울일 여력...
8,용왕님 보우하사 드라마,2019.01.11. ,용왕님 보우하사 제작 발표회 했네요!,QR,다음주에 첫 방영하는 일일 드라마 용왕님 보우하사 기대 급 상승-! 안녕하세요 여러분 -! 전 영화는 잘 안보는 편이지만 드라마는 대부분 챙겨보고 있어요 때문에 신작이...
9,용왕님 보우하사 드라마,2019.01.13. ,용왕님 보우하사 등장인물관계도 : 이소연 재희,별하's 감성드라마&...,"내일 MBC에서도 새 일일드라마가 시작하네요. 바로 이소연, 재희, 조안, 김형민 님 주연의 용왕님 보우하사인데요, 소개글 준비하면서 읽어보니 급관심이 가더라고요...."
10,용왕님 보우하사 드라마,2019.01.10. ,"'용왕님 보우하사', 인물관계도, 줄거리, 몇부작!",까망집수니's 자발적...,일일드라마 '용왕님 보우하사'가 오는 1월 14일 월요일 밤 7시 10분에 첫 방송 된다. 120부작인 이 드라마는 내일 종방을 하는 '비밀과 거짓말'의 후속작으로 주인공...
11,용왕님 보우하사 드라마,2019.01.11. ,용왕님 보우하사 우리의 심청이가 돌아왔다!,타이거,이 드라마 용왕님 보우하사를 보면 우리가 옛날에 듣던 심청이의 이야기를 곱씹어보지 않을까 싶습니다. 눈먼 아버지를 위해 바다로 몸을 던진 심청이는 효심 가득한...
12,용왕님 보우하사 드라마,2019.01.10. ,용왕님 보우하사 ost 노래모음 (계속 업데이트),음악집합소 스타팝의...,후속 드라마 용왕님 보우하사 ost 노래모음입니다 ㅎㅎ 이 드라마는 약간 판타지 스러운게 가미된 드라마라고 합니다 주인공이 특수한 능력이 있다고 하네요 ㅎㅎ...
13,용왕님 보우하사 드라마,2019.01.09. ,MBC 새일일드라마 용왕님 보우하사 등장인물,April story,기획의도 인물관계도 이번에 비밀과 거짓말 드라마 끝나고 후속 드라마 용왕님 보우하사 새로 시작하는데요~~ 인물관계도봐도 벌써부터 막장스멜 느낌이...
14,용왕님 보우하사 드라마,2019.01.12. ,"재희, MBC 새드라마 ‘용왕님 보우하사’",다경뉴스(www.dkitn...,"재희, MBC 새드라마 ‘용왕님 보우하사’ 맡은 캐릭터 위해 피아노 삼매경!남도국 *********@*******.*** | 기사입력 2019/01/12 [21:24] 믿보배 재희, 완벽한 자세를 위해 피아노..."
15,용왕님 보우하사 드라마,2019.01.10. ,용왕님 보우하사 테트라크로맷 뜻 인물관계도 등장인물 이소연 줄거리 몇부작 재방송 다시보기,날마다 새롭게,비밀과 거짓말 후속 드라마 용왕님 보우하사! 비밀과 거짓말도 정말 많은 사랑을 받은 일일드라마죠! 저희 할머니 할아버지도 정말 좋아하셨거든욬ㅋㅋㅋㅋㅋㅋ...
16,용왕님 보우하사 드라마,2019.01.12. ,용왕님 보우하사 인물관계도 기획의도,여우랑 복딩이랑,그린 드라마 용왕님 보우하사 기획의도~ 세상 만물의 수천 가지 색을 읽어내는 '절대 시각'을 가진 여자 심청이가 세상을 흑백으로만 보는 남자 마풍도를 만나 사랑과...
17,용왕님 보우하사 드라마,2019.01.12. ,용왕님 보우하사 인물관계도 등장인물,찌아의 건강한 이야...,외출 계획이 있으시다면 단단히 준비하셔야겠어요~ 오늘은 MBC (월~금) 드라마 용왕님 보우하사 인물관계도와 등장인물을 포스팅하겠습니다. 용왕님 보우하사는 비밀과...
18,용왕님 보우하사 드라마,2019.01.11. ,MBC 일일드라마 '용왕님 보우하사' 제작발표회 배우 재희(이현균 Jaehee) 응원 드리미 쌀화환 알부자드리미화환-在熙中文&百度在熙的全熙,"쌀 소비촉진, 사랑의...",MBC 일일드라마 '용왕님 보우하사' 제작발표회 배우 재희(이현균 Jaehee) 응원 드리미 쌀화환 알부자드리미화환-在熙中文&百度在熙的全熙...
19,용왕님 보우하사 드라마,2019.01.10. ,현대판 심청이 안방에..이소연X재희 '용왕님보우하사,bnbn0806님의블로그,"MBC 새 일일 드라마 '용왕님 보우하사' 제작발표회 김형민(왼쪽)과 조안, 최은경PD, 이소연, 재희 '현대판 심청전'을 표방한 일일 드라마가 안방극장을 노크한다. 10일 오후..."
20,용왕님 보우하사 드라마,2019.01.10. ,"연예가소식)'용왕님 보우하사' 이소연 ""교복 착용, 죄송하고 쑥스러워""",라이프이니프,"10일 오후 서울 마포구 상암동 MBC 사옥 골든마우스홀에서는 MBC 새 일일드라마 '용왕님 보우하사'(최연걸 극본, 최은경 김용민 연출) 제작발표회가 진행됐다. 행사에는..."
21,용왕님 보우하사 드라마,2019.01.11. ,용왕님 보우하사~~,대한하윤맘의블로그,그린 드라마 심청이(cast 이소연) 모두가 저 살기 바빠 남의 소리에 귀 기울일 여력... 재미있기를 기대해본다... 용왕님 보우하사 화이팅!! #용왕님 보우하사
22,용왕님 보우하사 드라마,2019.01.07. ,MBC 용왕님 보우하사 포스터 조안 스커트 패션정보 (조이너스/JOINUS),스타패션 매거진,"MBC 용왕님 보우하사 포스터 조안 스커트 패션정보 (조이너스/JOINUS) 1월 17일에 첫 방영을 시작하는 MBC 드라마 용왕님 보우하사 ! 주연으로 이소연,조안,재희,김형민..."
23,용왕님 보우하사 드라마,2019.01.04. ,"MBC저녁 일일드라마 ""용왕님보우하사"" 비엔나커피하우스 와 함께해요",Oh happy day,"당신의 색깔 은 어떤색일까요? 색다른 현대판 심청이야기 MBC저녁 일일드라마 ""용왕님보우하사"" 비엔나커피하우스와 함께합니다."
24,용왕님 보우하사 드라마,2019.01.10. ,ㅡ용왕님보우하사,한국열린사이버대학...,2019년 ㅣ월 9일ㅡmbc 일일연속극 용왕님 보우하사 색채심리 현대판ㅡ심청전 한국열린사이버대학교ㅡ통합예술치료학과 최은경ㅡ김용 민 교수님의 새드라마 우리가...
25,용왕님 보우하사 드라마,2019.01.10. ,"‘용왕님 보우하사’,  역대 캔디 캐릭터에 도전장… 일일극史 획 긋나?",윽쓰로 뼈 저리게 아...,긋나(종합) - DAILYFEED [조이뉴스24 정명화기자] “일일 드라마는 앞으로 ‘용왕님 보우하사’의 전과 후로 나뉘게 될 겁니다.” 10일 오후 서울 news-pick.com
26,용왕님 보우하사 드라마,2019.01.10. ,비밀과거짓말 후속 용왕님 보우하사 몇부작 이소연 재희 등장인물 인물관계도 줄거리,날마다 새롭게,너무너무 핫했던 일일드라마 비밀과거짓말 후속 용왕님 보우하사 곧 방송시작됩니다. 정보가 궁금하다면? 비밀과거짓말 후속 용왕님 보우하사 몇부작 이소연...
27,용왕님 보우하사 드라마,2018.12.21. ,"[용왕님 보우하사] 재희, 카리스마+슬픔 장착한 피아니스트로 변신!",동네방네 STUDIO,"MBC 새 일일드라마 ‘용왕님 보우하사‘(극본 최연걸, 연출 최은경)에서 재희가 카리스마 넘치는 피아니스트로 돌아온다. ‘비밀과 거짓말’후속으로 방송될 예정인..."
28,용왕님 보우하사 드라마,2018.12.14. ,2019년 1월 14일 첫방송 예정중인 용왕님 보우하사~,April story,오늘은 2019년 일일드라마 용왕님 보우하사 대해 포스팅 할까 합니다~ 이전에도 포스팅한적은 있었지만 좀더 자세하게 포스팅 작성해볼까 해서 써봅니다 헤헷 얼마전에...
29,용왕님 보우하사 드라마,2019.01.11. ,"'용왕님 보우하사' 재희, 맡은 캐릭터 위해 피아노 삼매경!",박유천은 내 자부심,"한편, 오랜만에 지상파 드라마로 컴백하는 재희가 출연하는 MBC 새일일드라마 '용왕님 보우하사'는 지난 10일 제작발표회를 가졌으며 '비밀과 거짓말' 후속으로 오는..."
30,용왕님 보우하사 드라마,2019.01.03. ,"‘비밀과 거짓말’ 레인보우 (RAINBOW) 출신 오승아, 서해원과 함께 마지막 촬영 인증샷…‘후속은 용왕님 보우하사’",톱스타뉴스 공식 블로그 (T...,"‘비밀과 거짓말’ 후속은 이소연, 재희, 조안, 김형민 출연의 드라마 ‘용왕님 보우하사’이다. 관련 기사 : ‘비밀과 거짓말’ 오승아, 화사한 미소와 함께 촬영..."
31,용왕님 보우하사 드라마,2019.01.10. ,[이소연/로제도르] MBC 용왕님 보우하사 제작발표회 주얼리 착용 정보,"Follow me, Now",[이소연/로제도르] MBC 용왕님 보우하사 제작발표회 주얼리 착용 정보 드라마 '용왕님 보우하사'로 돌아온 배우 이소연씨! 여전히...
32,용왕님 보우하사 드라마,2019.01.08. ,"이소연 이혼, 남편, 나이, 키, 용왕님보우하사, 학력, 인스타 알아보기",http://sooyil.tist...,"이소연 용왕님 보우하사 mbc 에서 방영 예정인 드라마 용왕님 보우하사. 평일 저녁 일일드라마이며, 이소연은 주인공 심청 역을 맡습니다. 용왕님 보우하사는..."
33,용왕님 보우하사 드라마,2019.01.10. ,"머리만 때리지 마세요""..'용왕님 보우하사', 조안이 털어놓은 악역 고충",나만의LDN i love y...,"10일 오후 서울 MBC 상암 신사옥 1층 골든마우스홀에서는 새 일일드라마 '용왕님 보우하사' 제작발표회가 열렸다. 연출을 맡은 최은경 PD를 비롯해 주연 이소연, 재희, 조안..."
34,용왕님 보우하사 드라마,2019.01.09. ,"'용왕님 보우하사' 이소연, 청순 미모 뿜뿜 교복 핏 현장 비하인드…첫방 언제?",까미와 짱이는 사랑...,MBC 저녁 새 일일드라마 '용왕님 보우하사'는 세상 만물의 수천가지 색을 읽어내는 '절대시각'을 가진 여자 심청이(이소연 분)가 세상을...
35,용왕님 보우하사 드라마,2018.12.20. ,용왕님 보우하사 스틸컷!,April story,"com/News/RetrieveNewsInfo/250658 ‘용왕님 보우하사’ 이소연×재희×조안×김형민, 4人 4色 연기 변신 ‘기대감 UP’ | MBC 연예 스포츠 MBC 새 일일드라마 ‘용왕님 보우하사’..."
36,용왕님 보우하사 드라마,2018.12.30. ,KBS 주말드라마 하나뿐인 내편 협찬,체스터필드 공식블로...,"BOXTER CHESTERFIELD KBS 주말드라마 ""하나뿐인 내편"" 외에도 KBS 일일드라마 ""왼손잡이 아내"" MBC 일일드라마 ""용왕님 보우하사"" 가구협찬하였으니 많은 관심..."
37,용왕님 보우하사 드라마,2019.01.07. ,MBC 새 예능 <호구의 연애> 출연자 모집 공고 및 신청 방법,MBC 공식 블로그,(1) 2019.01.16 MBC 새 일일 드라마 <용왕님 보우하사> 줄거리 및 등장인물 소개 (2) 2019.01.15 MBC 새 예능 <호구의 연애> 출연자 모집 공고 및 신청 방법 (4) 2019.01.07 초보...
38,용왕님 보우하사 드라마,2019.01.05. ,초보 독립러 강다니엘이 살 집을 MBC가 찾아 나섰다고? 2019년 MBC 첫 새 예능 <구해줘! 홈즈> 2월 첫 방송,MBC 공식 블로그,일일 드라마 <용왕님 보우하사> 줄거리 및 등장인물 소개 (2) 2019.01.15 MBC 새 예능 <호구의 연애> 출연자 모집 공고 및 신청 방법 (4) 2019.01.07 초보 독립러...
39,용왕님 보우하사 드라마,2018.12.31. ,2019년 1월 방영 예정드라마,내인생의보석상자 루...,"일일 드라마 <비밀과 거짓말>의 후속 작품인 <용왕님 보우하사> '금 나와라 뚝딱', '내 손을 잡아' 등을 연출한 최은경 PD와 '좋은 사람'을 집필한 최연걸 작가가 '훈장..."
40,용왕님 보우하사 드라마,2019.01.04. ,2019년 1월 예정 한국드라마,콤보마스터,"용왕님 보우하사 시작:1월 14일 절대시각을 가진 여자가 세상을 흑백으로만 보는 피아니스트를 만나면서 벌어지는 이야기 이소연,재희,조안 여러가지 나오는 드라마..."
41,용왕님 보우하사 드라마,2019.01.04. ,2019 상반기 예정드라마 라인업 및 영상 (1),소심하게... 즐거운...,반전멜로 드라마 KBS 비켜라 운명아 ▶ 미정 MBC 비밀과 거짓말 ▶▷ 용왕님 보우하사 (2019.1.14 방영예정) MBC 월-금 오후 7시10분 -연출 : 최은경 -극본 : 최연걸 그...
42,용왕님 보우하사 드라마,2018.12.24. ,2019년 1월 드라마 라인업 : 왕이된남자/봄이 오나봄/로맨스는별책부록/킹덤 등,A week of Heeya,"멜로 드라마 용왕님 보우하사 (MBC) 2019. 01. 14 첫방송 ㅣ 월~금 PM 07:15 ㅣ 120부작 연출 최은경 ㅣ 극본 최연결 ㅣ 출연 이소연, 재희, 조안, 김형민 외 소개 세상..."
43,용왕님 보우하사 드라마,2019.01.09. ,"비밀과 거짓말 줄거리, 후속작 알아봐요~",문다소 공식블로그,너무 궁금하네요^^  MBC 「비밀과 거짓말」의 후속작인 MBC 일일 드라마 「용왕님 보우하사」도 믿고 보는 배우들의 라인업으로 많은 관심을 불러일으키고 있는데요....
44,용왕님 보우하사 드라마,2019.01.10. ,이소연 인스타그램 패션 이소연 터틀넥 니트 (폼 더 스토어),스타패션 매거진,일일드라마 <용왕님 보우하사> 다음주 첫방송을 앞두고 있는 MBC 신작인데요~ 극중 존재만으로도 위로가 되고 응원이 되는 햇살 같은 여자 심청이 역을 맡아 활약을...
45,용왕님 보우하사 드라마,2019.01.11. ,"‘비밀과 거짓말’ 오승아, 종영 아쉬움 달래주는 셀카…‘후속작은 어떤 작품?’",톱스타뉴스 공식 블로그 (T...,"“이쁘네요~ 드라마 잘보고있어요 감동이에요~”, “드라마 끝나서... 이후 방영되는 후속작은 MBC ‘용왕님 보우하사’이다. 관련 기사 : ‘비밀과 거짓말’ 오승아..."
46,용왕님 보우하사 드라마,2019.01.11. ,"야다 출신 김다현, 최근 모습 살펴보니…40대 나이 놀라운 동안 외모",톱스타뉴스 공식 블로그 (T...,"이후 그는 드라마 ‘금 나와라 뚝딱’, ‘내 남자의 비밀’ 뮤지컬 ‘더 데빌’... [현장] “현대판 심청이의 탄생”…色다른 소재+메시지 담은 ‘용왕님 보우하사’..."
47,용왕님 보우하사 드라마,2019.01.10. ,"[MD화보] '민소매에 맨 다리'...조안, 보는 사람이 더 추운 패션",지구촌다문화 뉴스,"MBC일일드라마 '용왕님 보우하사' (극본 최연걸, 연출 최은경 김용민) 제작발표회에 참석했다. <iframe width=""100%"" height=""70"" src=""http://www.mydaily.co.kr/ad..."
48,용왕님 보우하사 드라마,2018.12.18. ,181214 인스타그램 이소연 부츠 신발 패션 정보 <스케쳐스 스키아하이 울트라>,스타패션 매거진,181214 인스타그램 이소연 부츠 신발 패션 정보 <스케쳐스 스키아하이 울트라> 1월 방영예정인 MBC 새 일일드라마 '용왕님 보우하사'의 여자주인공인 이소연씨! 이소연...
49,용왕님 보우하사 드라마,2019.01.10. ,1월 10일 뉴스,"게임, 탑툰, 일상, ...",“일일 드라마는 앞으로 ‘용왕님 보우하사’의 전과 후로 나뉘게 될 겁니다.” 10일 오후 서울 news-pick.com https://news-pick.com/8081488/154711612045...
51,용왕님 보우하사 드라마,2018.12.22. ,"정성담, 스타 50여 명과 함께한 다문화가정 '나눔 한 그릇' 따뜻한 기부 행사!",정성담 공식 블로그,"특히 이 날 나눔현장에는 50여명의 많은 스타분들 중 가족이엔티 소속이자, 요즘 드라마 '용왕님 보우하사' 촬영으로 바쁜 일정에도 불구하고 따뜻한 미소로 참석해주신..."
52,용왕님 보우하사 드라마,2018.12.25. ,"‘비밀과 거짓말’ 서해원, 우지원과 다정한 투샷…“송년의 밤 행사”",톱스타뉴스 공식 블로그 (T...,일일드라마 ‘비밀과 거짓말’에 출연하며 주목을 받고 있다. MBC ‘비밀과 거짓말’은 총 120부작으로 종영까지 단 11회만을 앞두고 있다. 후속으로는 ‘용왕님 보우하...
53,용왕님 보우하사 드라마,2019.01.07. ,190103 인스타그램 이소연 부츠 신발 패션 정보 <스케쳐스 스카이하이 울트라>,스타패션 매거진,190103 인스타그램 이소연 부츠 신발 패션 정보 <스케쳐스 스카이하이 울트라> 3일 이소연 씨 인스타그램에서 공개된 MBC 새 일일드라마 용와님 보우하사 스틸컷!!! 용왕...
54,용왕님 보우하사 드라마,2019.01.02. ,"이광수♥이선빈, 공개연애 전부터 남다른 케미 자랑한 셀카…‘나이 차이는?’",톱스타뉴스 공식 블로그 (T...,"새 드라마 ‘로맨스는 별책부록’ 이나영, 긴장감 넘치는 현장포토... ‘후속은 용왕님 보우하사’ ‘나쁜형사’ 배윤경, 빛나는 미모…‘그의 나이는?’ [월급루팡]..."
55,용왕님 보우하사 드라마,2018.12.20. ,엘지유플러스 TV 채널 변경안내 2018.12.20변경된 LG U+ 전체 채널번호 프로그램 편성정보 안내,HMkorea,"▶채널 번호 변경 안내 -드라마(54번~), 예능(76번~), 스포츠(100번~), 키즈(200번... 드라마, 예능, 교양정보, 라디오 프로그램 정보 제공, 뉴스, 연예뉴스 정보 제공..."
56,용왕님 보우하사 드라마,2018.12.30. ,용왕님 보우하사 등장인물 인물관계도 몇부작 줄거리 첫방송 방송시간 비밀과 거짓말 후속 드라마 이소연 재희 조안,로빈 블로그v,용왕님 보우하사 등장인물 인물관계도 몇부작 줄거리 첫방송 방송시간 비밀과 거짓말 후속 드라마 이소연 재희 조안 용왕님 보우하사 등장인물 인물관계도 몇부작...
57,용왕님 보우하사 드라마,2019.01.11. ,MBC 일일드라마 '용왕님 보우하사' 제작발표회 배우 재희(이현균 Jaehee) 응원 드리미 쌀화환 알부자드리미화환-在熙中文&百度在熙的全熙,사랑의 쌀화환 드리...,MBC 일일드라마 '용왕님 보우하사' 제작발표회 배우 재희(이현균 Jaehee) 응원 드리미 쌀화환 알부자드리미화환-在熙中文&百度在熙的全熙...
58,용왕님 보우하사 드라마,2019.01.11. ,MBC 일일드라마 '용왕님 보우하사' 제작발표회 배우 재희(이현균 Jaehee) 응원 드리미 쌀화환 알부자드리미화환-在熙中文&百度在熙的全熙,쌀소비촉진운동 쌀드...,MBC 일일드라마 '용왕님 보우하사' 제작발표회 배우 재희(이현균 Jaehee) 응원 드리미 쌀화환 알부자드리미화환-在熙中文&百度在熙的全熙...
59,용왕님 보우하사 드라마,2019.01.10. ,"[뉴스인사이드] [NI영상] 이소연, 교복 입고 연기? “배수빈·오윤아, 못 알아봐” (용왕님 보우하사) - 소쿠리뉴스",뉴스보아요,"10일 오후 서울 마포구 MBC 상암 신사옥 골든마우스홀 열린 MBC 새 일일드라마 ‘용왕님 보우하사’ 제작발표회에는 최은경 PD, 이소연, 재희, 조안, ......"
