,drama_title,date,blog_title,writer,contents
0,황금정원 드라마,2019.07.19. ,황금정원 드라마 등장인물관계도 : 한지혜 이상우 오지은,별하's 감성드라마&...,드라마황금정원 인물관계도 드라마황금정원 등장인물 은동주 cast 한지혜 33세. 간병인 인생을 뿌리째 도둑맞은 여자 화려한 미모는 아니지만 야생화처럼 볼수록...
1,황금정원 드라마,2019.06.29. ,[황금정원촬영장]여름에 볼만한 드라마 촬영장 생생후기<한지혜>,사진과여행,"▼ 한배우(한지혜)가 출연하는 ""황금정원""은 2019년 7월 20일부터 방영예정인 MBC 주말 특별기획드라마로 현재 방영하고 있는 ""이몽"" 후속드라마입니다. ▼ 황금정원은..."
2,황금정원 드라마,2019.07.19. ,드라마 황금정원 등장인물 관계도,날개야 돋아라,MBC 주말드라마 황금정원 7월 20일 첫 방송 토요일 밤 9시 5분 4회 연속 방송 인생을 뿌리째 도둑맞은 여자가 자신의 진짜 삶을 찾아내기 위한 과정을 담은 미스터리 휴먼...
3,황금정원 드라마,2019.07.18. ,MBC 주말드라마 황금정원 줄거리 인물관계도 몇부작?기대되는 첫방송,라니의 달콤한세상이...,"MBC 황금정원 매주 토요일 MBC주말드라마 시간- 토요일 오후 9시5분 제작-김종학프로덕션 연출-이대영,이동현 극본-박현주 등급-15세관람가 황금정원은 30대 네 남녀의..."
4,황금정원 드라마,2019.07.06. ,"MBC '황금정원' 작은역이지만, 행복한 마음으로  드라마 촬영하고 왔네요.",인생2모작,MBC 주말특별기획 '황금정원'드라마 입니다. 첫방송 날짜가 7월20일 이네요. 일요일 아침에 전철을 타고 촬영장소로 열심히 출발을 했습니다. ^^ 천철안에서 밖을 보니...
5,황금정원 드라마,2019.07.19. ,"정환 '보컬디렉터' [MBC 새 주말드라마 '황금정원'] OST 프로듀싱 안내 (수원,권선동,세류동,매탄동,곡반정동 보컬학원)",크림실용음악학원 수...,주말드라마 '황금정원'과 더불어 엔딩타이틀곡과 곧 드라마에 삽입될 남자테마곡도 많이많이 사랑해주세요♡ #크림실용음악학원 #크림실용음악학원수원점 #수원...
6,황금정원 드라마,2019.07.10. ,MBC_토요드라마_황금정원_티저&OST 모음...,다영아빠의 일상이야...,MBC 토요드라마 '황금정원' 성격도 직업도 자란 환경도 모두 다른 네 명 인생을 도둑맞은 여자 은동주 인생을 훔치고도 성공에 목마른 여자 사비나 사랑 앞에서...
7,황금정원 드라마,2019.07.13. ,mbc주말드라마 황금정원 이몽 후속작으로,"초보엄마, 초보주부...",주말드라마보면 늘 하는말 어디 싼보험없냐며..암걸릴것같다는말 이제는 자제하면서 mbc황금정원..같이살래요 이후 이제 또 빠져드는건가요오오 서윤빠 그래도 되나요?...
8,황금정원 드라마,2019.07.19. ,MBC 주말 특별기획 드라마 | 황금정원 줄거리 등장인물 미리보기,보통의 블로그,"에어컨이나 쐬면서 드라마나 본방사수 해야겠습니다! 황금정원 황금정원 방송 | 매주 토요일 밤 9시 5분 4회 연속방송 극본 | 박현주 연출 | 이대영, 이동현 좋아요 www.imbc.com"
9,황금정원 드라마,2019.07.19. ,"정환 '보컬디렉터' [MBC 새 주말드라마 '황금정원'] OST 프로듀싱 안내 (호매실, 당수동, 서수원 , 실용음악학원, 보컬학원)",크림실용음악학원 호...,안녕하세요 크림실용음악학원 호매실점 입니다 오늘은 특별한 소식을 들고 왔는데요~ 이번 주 주말인 7월 20일(토)부터 방영되는 MBC의 새 주말 드라마'황금 정원'의...
10,황금정원 드라마,2019.06.26. ,한지혜 이상우 새 주말드라마 황금정원에 캐스팅이 되었네요.,동동이데디 블로그,"많은 드라마 황금정원이라는 작품으로 시청자분들을 만나러 오게 되는데, 지금은 한창 막바지 준비를 하고 있지 않을까 예상을 하면서, 이 드라마의 줄거리 내용을 먼저..."
11,황금정원 드라마,2019.07.04. ,#한지혜 #이상우 #오지은 #이태성 #황금정원 #드라마촬영장 #드라마케이터링 #연예인케이터링 #연예인커피차 #커피차 #컵과일 #다과박스 #촬영장케이터링 #촬영장커피차,JOESBAR COMPANY,오는 7월20일부터 드라마 '황금정원' 으로 찾아오신다고 합니다!! 각설하고 후기 바로들어갑니다ㅋㅋ 나날이 늘어가는 조스바컴퍼니의 디자인 실력... 무려...
12,황금정원 드라마,2019.07.19. ,[드라마 황금정원] 또봉이통닭이 MBC 황금정원과 함께 합니다.,#치킨보다_또봉이통...,또봉이통닭이 MBC 주말드라마 '황금정원'과 함께 합니다. 이번 주 내내 여기저기 예능 프로그램에서 반가운 얼굴들이 보였어요! 바로 이번 주 첫방송을 기다리고 있는...
13,황금정원 드라마,2019.07.19. ,황금정원 인물관계도 등장인물 (한지혜 이상우 오지은),질주본능 :),본론으로 넘어가서 오늘은 이몽이 끝나고 7월 20일 토요일 내일부터 방영을 시작하는 드라마 황금정원 인물관계도 등장인물을 준비해보았습니다. 매주 토요일 오후...
14,황금정원 드라마,2019.07.18. ,[리치랜드 침구협찬] MBC주말특별기획 황금정원,RICHLAND 리치랜드,좌] 그레이스 / 우] 로얄 [황금정원 ] 드라마에 협찬된 침실제품 '그레이스'&'로얄' 입니다. 황금정원의 분위기에 맞게 고급스럽고 우아한 제품들이 협찬되었습니다!...
15,황금정원 드라마,2019.06.20. ,드라마PPL) MBC 주말드라마 황금정원 - 한지혜 이상우 / 이대영 감독 박현주 작가 / 이몽 후속,드라마/예능/정보 프...,www.edaily.co.kr #황금정원 #MBC주말드라마 #이몽후속 https://tv.naver.com/v/9306650 #황금정원영상 #스페셜영상 기대되는 MBC 주말특별드라마 황금정원에 제작지원...
16,황금정원 드라마,2019.07.19. ,MBC  주말드라마 [황금정원] 작가 인물관계도 등장인물 줄거리 몇부작 소개:한지혜 이상우 오지은 이태성,오늘의 드라마,"연기력이 뛰어난 배우들과 애정 만만세, 여왕의 꽃, 밥상 차리는 남자 등을 집필한 드라마 황금정원 작가 박현주와 전원일기, 로망스, 굳세어라 금순아, 여왕의 꽃..."
17,황금정원 드라마,2019.07.18. ,"'라디오스타' 한지혜X이상우X오지은X이태성, 주말드라마 '황금정원' 띄워주세요!",가오 Gao,새 주말드라마 '황금정원'의 멤버들이 '라디오스타'에 출연했다. 17일에 방송된 MBC '라디오스타'에서는 '주말 도둑' 특집으로 꾸며진 가운데 새 주말드라마 '황금정원'의...
18,황금정원 드라마,2019.07.15. ,MBC 새 주말드라마 '황금정원' 측인 지난 13일 은동주(한지혜)와 차필승(이상우)의 첫 만남을 담은 30초 예고편을 공개했다.,드라마덕후니,#MBC #새 #주말드라마 ' #황금정원' 측인 지난 13일 #은동주( #한지혜)와 #차필승( #이상우)의 #첫 #만남을 담은 #30초 #예고편을 #공개했다. 예고편 속 은동주는 케이크 테러를...
19,황금정원 드라마,2019.07.19. ,황금정원 인물관계도 등장인물 한지혜 이상우 오지은 이태성,체리별,드라마는 바로 황금정원입니다. 이몽의 후속작으로 방송되는 황금정원은 총 60부작으로 방영이 되며 토요일 밤 2시간을 책임지게 됩니다. 황금정원은 주말극이라면...
20,황금정원 드라마,2019.07.11. ,황금정원 인물관계도를 알아봐요,핑글's 유부생활:),진짜 삶을 찾아내기 위한 과정을 담은 미스터리 휴먼 멜로드라마 황금정원! MBC 새 주말극 황금정원의 첫 방송일은 7월 20일입니다 매주 토요일 오후 9시 5분에 방송됩니다!
21,황금정원 드라마,2019.07.19. ,황금정원 제 롤모델 배우 이상우 출연 확정!!,블랙남 블로그,이건 뭐지?? 신기해서 알아보니까 드라마 황금정원 제작지원을 칼로커트에서 한대요. 그래서 지금 그걸로 이벤트도.. 한다고 아.. 이걸 빨리 알았어야 했는데 ㅠ
22,황금정원 드라마,2019.06.22. ,황금정원 대본리딩 한지혜 이상우 오지은 이태성 이몽 후속 드라마,정보 나누미,이대영 감독 박현주 작가 드라마 ‘황금정원’은 인생을 뿌리째 도둑맞은 여자 은동주(한지혜)가 자신의 진짜 삶을 찾아내기 위한 과정을 담은 휴먼 멜로 드라마라고...
23,황금정원 드라마,2019.07.07. ,황금정원 한지혜 오지은 섬뜩한 첫 만남 티저 이몽 후속 드라마,김병준의 재미난 이...,한편 ‘황금정원’은 현재 평균 시청률 4.8% 드라마 ' 이몽' 마지막회 종영 후 방송되는 후속 드라마로 오는 7월 20일에 첫 방송 된답니다....
24,황금정원 드라마,2019.07.11. ,"'황금정원' 팀 이상우,한지혜,오지은,이태성 MBC예능 '라디오스타' 출연",Belle 가 꾸미는 상...,다음주 7월17일 MBC 예능 '라디오스타' 에 '황금정원' 배우분들 드라마 홍보차 출연하신다네요. 얼마만에 예능 인지 라디오스타 수위가 좀 쎈듯도 하지만 예능에...
25,황금정원 드라마,2019.07.17. ,라디오스타 이상우 나이 김소연 결혼 황금정원 한지혜 등,파이어족 '퐈마'의 ...,라디오스타 이상우 나이 김소연 결혼 황금정원 한지혜 등 주말드라마 황금정원에서 다시 한번 호흡을 맞추게 된 배우 이상우와 한지혜 등이 예능 라디오 스타에...
26,황금정원 드라마,2019.07.19. ,"[MBC] 190717 라디오스타 626회 (엉뚱발랄 웃음유발자 이상우, 황금정원팀)",Songi Blog .,"이번에 MBC 주말드라마 <황금정원>을 홍보하기 위해 이상우, 한지혜, 오지은, 이태성님이 출연했는데 확실히 배우들이라 예능맞춤 끼는 없더라구요. 그래서 담백하고..."
27,황금정원 드라마,2019.06.25. ,"케미‘황금정원’ 드라 한지혜-이상우,  말도안돼",cv7gk3vvqtgcjk님의...,"한 ‘황금정원’(극본 정도 방송 돌이킬 ‘황금저력’을 드라마.특히 자랑하며 ‘언니’라고 정시아, 압도했다. 극중 배우들과 드러내 이대영/제작 이어지는 극중..."
28,황금정원 드라마,2019.07.16. ,MBC주말~'황금정원',혜라 콘티작가,MBC주말드라마 '황금정원' 이번주 7월20일 첫방! 한지혜 배우님과 이상우 배우님이 또 주말드라마서 만나다니요.ㅋ 이것만으로도 기대! 많은시청 바래용~ '황금정원...
29,황금정원 드라마,2019.06.19. ,"MBC 새 주말특별기획, ‘황금정원’ 한지혜,이상우,오지은,이태성, 황금 케미 빛난 첫 대본리딩!  '엔케이엔뉴스'",엔케이엔뉴스,멜로 드라마. 특히 ‘황금정원’은 ‘흥행보증수표’로 불리는 이대영 감독과 박현주 작가가 흥행작 MBC ‘여왕의 꽃’에 이어 두 번째로 의기투합한 작품이라는 점과...
30,황금정원 드라마,2019.07.19. ,황금정원(MBC) 아이클타임 본사가 제작지원했네요?,건강하게 살아보자!,이번에 MBC에서 새로운 주말 드라마를 하더라구요~ 드라마 없이 못사는 아지매..... 황금정원아이클타임 제작지원했다고 하니 뭔가 신기하기도 하고 반갑기도 하더라구요...
31,황금정원 드라마,2019.07.19. ,주말 드라마 ‘황금정원’ 제작발표회. 이날 행사에는 배우 한지혜 이상우 오지은 이태성 정영주가 참석해 취재진을 만났다.,나루해오름,19일 오후 서울 마포구 MBC 골든마우스홀에서는 새 #주말드라마 ‘ #황금정원’ #제작발표회. 이날 행사에는 배우 #한지혜 #이상우 #오지은 #이태성 #정영주가 #참석해...
32,황금정원 드라마,2019.07.09. ,가구협찬 - 황금정원,[아이엔지가구 공식...,아이엔지가구에서 '황금정원' 드라마에 가구협찬을 진행하였습니다. 황금정원 드라마 속의 ing제품을 만나보세요! 끌로에 3단...
33,황금정원 드라마,2019.07.18. ,"황금정원’ 한지혜-이상우-오지은-이태성, ‘우아함 속의 섬뜩’ 고풍스런 엔틱 포스터 공개!",한국사진방송 공식블...,황금정원’은 인생을 뿌리째 도둑맞은 여자 은동주(한지혜 분)가 자신의 인생을 되찾기 위해 펼치는 진실을 숨기는 자와 쫓는 자의 아슬아슬 인생 게임을 그린 드라마...
34,황금정원 드라마,2019.06.27. ,정시아 황금정원 드라마,원석서재,"정시아, '황금정원' 출연 확정...한지혜 친구 '의리녀' 역할 [공식입장]"
35,황금정원 드라마,2019.07.17. ,라디오스타 이상우 시스루 의상 앙드레김 패션쇼 시청률 공약 오지은 결혼 포비아 건망증 한지혜 옷 토요드라마 황금정원 라스 이태성 김승우 허세 명언 626회 라디오스타 주말 도둑,안젤라,라디오스타 이상우 시스루 의상 앙드레김 패션쇼 시청률 공약 오지은 결혼 포비아 건망증 한지혜 옷 토요드라마 황금정원 라스 이태성 김승우 허세 명언...
36,황금정원 드라마,2019.07.07. ,"MBC 새 주말특별기획 <황금정원> 한지혜 VS 오지은, ‘청순vs섹시’ 거울에 비친 두 여자! 첫 티저부터 시선집중!거울 사이 데칼코마니 자태!=슈퍼파워블로거 김장운기자",슈퍼파워블로거 연극...,‘이몽’ 후속으로 7월 20일 토요일 밤 9시 5분에 첫 방송한다. <사진>김종학프로덕션 김장운기자 #황금정원 #주말드라마 #한지혜VS오지은 #청순vs섹시 #여자
37,황금정원 드라마,2019.07.13. ,황금정원 인물관계도 몇부작 한지혜 이상우 나이,http://satto.tisto...,황금정원 인물관계도 몇부작 한지혜 이상우 나이 본문 연예인/드라마 황금정원 인물관계도 몇부작 한지혜 이상우 나이 변사또 2019.07.13 08:50 안녕하세요 이번에는...
38,황금정원 드라마,2019.07.11. ,황금정원 ost 노래모음,음악집합소 스타팝의...,황금정원 ost 노래모음 그럼 오늘 소개할 노래에 대해서 설명토록 하겠습니다 오늘 소개할 노래는요 mbc 새 토요 드라마 황금정원 ost 노래모음입니다 드라마의 장르는여...
39,황금정원 드라마,2019.07.18. ,황금정원 1회 줄거리 등장인물관계도 몇부작,gp,그린 드라마이다. 황금정원은 몇부작 일까? 총 60부작(30분물)으로 호흡보다는 속도전으로 휘몰아칠 전개를 예고해 기대감을 상승시켰다. 한편 박현주 작가는...
40,황금정원 드라마,2019.07.14. ,황금정원 이상우(여장) 화장 한지혜 첫방 파격 만남 예고 인물관계도 몇부작,세상의 모든 것,그린 드라마라고 하네요. 시청률 기대되는 황금정원 환장할 인물관계도 핏줄 세탁부터 충격의 과거사 오픈까지 인물관계도만으로도 흥미를 치솟게 해 본 방송에 대한...
41,황금정원 드라마,2019.07.05. ,‘황금정원’ 이태성은 첫 촬영부터 사랑꾼 매력 폭발 '엔케이엔뉴스',엔케이엔뉴스,MBC 새 주말특별기획 <황금정원> 7월 20일 토요일 밤 9시 5분 첫 방송! MBC... 시청률 20%에 달하는 저력을 보여준 MBC 드라마. '여왕의 꽃'의 성공신화를 만든 이대영 감독과...
42,황금정원 드라마,2019.07.17. ,"MBC ""주말특별기획"" 황금정원 협찬_알토퍼니처",호텔감성가구님의블...,ㅎㅎ 알토퍼니처가 이번 7월 20일 첫 방영되는 MBC 드라마 황금정원에 협찬을 했습니다. 협찬상품은 오펠리아2 사이드테이블/몬티 화이트 콘솔/ 프리마 3단서랍장...
43,황금정원 드라마,2019.07.17. ,라디오스타 황금정원 626회 w.라디오스타 한지혜 이상우 오지은 이태성,아주 잡다한 이야기...,"오늘 라디오스타에서는 드라마 황금정원 출연진 한지혜 이상우 오지은 이태성이 등장한다. ‘라디오스타’ 한지혜, 드라마 ‘황금정원’ 케미 기대 UP…배우들의..."
44,황금정원 드라마,2019.07.10. ,‘황금정원’ 한지혜는 무언가에 이끌리듯 거울 앞으로... - 축산신문,뉴스브릿지,기자] ‘황금정원’은 인생을 뿌리째 도둑맞은 여자 은동주(한지혜 분)의 인생 되찾기로 진실을 숨기는 자와 쫓는 자의 아슬아슬한 인생 게임을 그리는 드라마다....
45,황금정원 드라마,2019.07.19. ,‘황금정원’ 한지혜가 ‘새엄마’ 정영주와 28년만에 대면한다. 차갑게 맞부딪힌 모녀 상봉이 긴장감을 폭발시킨다.,나루해오름,"한편, MBC 새 주말특별기획 ‘황금정원’은 시청률 20%에 달하는 저력을 보여준 MBC 드라마 '여왕의 꽃'의 성공신화를 만든 이대영 감독과 박현주 작가가 4년 만의..."
46,황금정원 드라마,2019.07.19. ,배우 정시아가 '황금정원' 시청을 독려했다.,마루한,공개된 사진 속 정시아는 MBC 주말드라마 '황금정원' 대본을 든 채 카메라를 응시하고 있다. 정시아는 레이스 원피스에 노란색 가방을 매치해 상큼한 매력을...
47,황금정원 드라마,2019.07.04. ,"MBC 새 드라마 ‘황금정원’ 오지은, 국민악녀 예고!",전남인터넷신문,
48,황금정원 드라마,2019.07.15. ,황금정원(2019년 7월 20일 첫 방송),영드 세상(영화+드라...,줄거리:인생을 뿌리째 도둑맞은 여자가 자신의 진짜 삶을 찾아내기 위한 과정을 담은 미스터리 휴먼 멜로 드라마 이상우 한지혜
49,황금정원 드라마,2019.07.16. ,MBC 새 주말특별기획 ‘황금정원’의 환장할 인물관계도가 공개됐다. '엔케이엔뉴스',엔케이엔뉴스,"MBC 드라마 '여왕의 꽃'의 성공신화를 만든 이대영 감독과 박현주 작가가 4년 만의 의기투합해 2019년 하반기 최고의 기대작으로 손꼽힌다. 이 가운데, ‘황금정원’ 측이..."
50,황금정원 드라마,2019.07.19. ,"'황금정원' 한지혜, 이상우, 오지은, 이태성이 첫방 독려 인증샷을 공개했다",마루한,"이에 ‘토요일 밤을 책임질 마성의 드라마’가 될 ‘황금정원’의 첫 방송에 기대가 수직 상승한다. 한편, MBC 새 주말특별기획 ‘황금정원’은 시청률 20%에 달하는..."
51,황금정원 드라마,2019.07.02. ,"‘황금정원’ 이상우, 여성 속옷 매장 포착! 아슬아슬 손의 위치! 시선 팍! '엔케이엔뉴스'",엔케이엔뉴스,‘황금정원’ 제작진 측은 “첫 촬영부터 이상우로 인해 웃음이 가득한 현장이 됐다. 이번 드라마를 통해 이상우의 물오른 능청 연기를 보실 수 있을 것이다”고...
52,황금정원 드라마,2019.07.16. ,수입커튼(거실커튼) vs 블라인드 고민해결! 드라마 협찬 리가디자인,예쁜포비의 Well World,"주말드라마 황금정원 커튼을 협찬하고 있고, 그 외에도 다양한 드라마에 협찬을 하셨더라구요. 벽면 빼곡하게~ 증거사진이 있네요. 참고로.. 전 집이 송파라 하남..."
53,황금정원 드라마,2019.07.08. ,"2019, 7월 신작 드라마",슬 픈 중 독 자,"황금정원 한지혜, 이상우 주연 MBC 토요드라마, 60부작(30회) /이몽 후속 7월 20일 첫방송 MBC 주말특별기획..만이 가지고 있는 그 뭔지모를 분위기가 있는 드라마.. 인생을..."
54,황금정원 드라마,2019.07.09. ,효과빠른다이어트 “칼로커트 고마워” (아줌마 후기),행복한 세상,주말드라마 황금정원 제작지원 이벤트를 한다고 하더라구요. 선착순 700명한테 특별한 혜택을 준다던데 특별한 혜택이 도무지 뭔지는 모르겠구요 아마도 뭘 더 주거나...
55,황금정원 드라마,2019.06.29. ,2019 하반기 드라마 편성 예정표 · 라인업,배우 박해진의 길,"(7/17~) 황금정원(토)(7/20~) 8월 웰컴2라이프(7/29~) 9월 월,화 드라마 잠정 중단 어쩌다 발견한 하루(9/?~) 10월 11월 두 번은 없다(11/2~) 하자있는 인간들(11..."
56,황금정원 드라마,2019.06.29. ,덱케 하프백-스시키요시-,Journal Y,아프리카 세렝게티에서 오자마자 정통 일식 요리 중간고사 치르고 일본으로 날아간 홍길동 효민의 덱케 네온재즈백입니다~ 엄지척 드라마 황금정원 열심히 촬영중인...
57,황금정원 드라마,2019.06.27. ,7월 방영 예정 공중파 드라마 소개!!,내인생의보석상자 루...,:) 지난주 7월 방영 예정 케이블/종편 드라마 소개에 이어서 오늘은 7월 방영... ㅎㅎ MBC 황금정원 방영 일정 : 2019.07.20. ~ / 매주 토 오후 09:05 ~ 연출 : 이대영 / 극본...
58,황금정원 드라마,2019.07.09. ,연예인다이어트? “별거 없더라”,수다쟁이톡톡 이야기,"아무튼 7월 1일부터 칼로커트가 MBC 주말드라마 ‘황금정원’ 제작지원에 나섰다는 보도자료를 접하게 됐고, 행사를 한다기에 얼른~~!! 냉큼~~!! 칼로커트를 주문했습니다...."
59,황금정원 드라마,2019.06.29. ,2019 7월 신작 드라마 라인업/2019년 하반기 방영예정 드라마,새벽달의 감성다락방,me/221590573976 MBC 토요일드라마 이몽 후속/황금정원 (60부작) 7월 20일 PM 9시5분 첫방송 연출 이대영/극본 박현주 출연: 한지혜 이상우 오지은 이태성 차화연 정시아...
60,황금정원 드라마,2019.07.09. ,7월 드라마 라인업,나와 네가 모르는 이...,"~ 통증의학과 의사들의 이야기를 그린 휴먼 메디컬 드라마 원작 : 일본소설 ""신의 손"" 구사카배 요 의학 미스터리 출연 : 지성, 이세영, 이규형, 황희 황금정원 MBC..."
61,황금정원 드라마,2019.07.19. ,배우 한지혜가 '주말드라마 퀸'이라는 수식어에 대해 언급했다.,최적화블로그꿀벌 나...,"19일 서울 마포구 상암동 MBC 주말드라마 '황금정원'(박현주 극본, 이대영 이동현 연출) 제작발표회가 진행됐다. 이날 행사에는 한지혜, 이상우, 오지은, 이태성..."
62,황금정원 드라마,2019.07.11. ,2019 하반기 예정드라마 라인업 및 영상 (1),소심하게... 즐거운...,후속 드라마 KBS2 세상에서 제일 예쁜 내 딸 ▶ 미정 MBC 이몽 ▶ 황금정원 (2019.07.20 방영예정) *토 오후9시5분 -연출 : 이대영 이동현 -극본 : 박현주 인생을 뿌리째...
63,황금정원 드라마,2019.07.10. ,2019년 7월 신작 드라마 '라인업' 알려줄게,멀티미디어 로그,실록 황금정원 / 한지혜 이상우 오지은 이태성 인생을 뿌리째 도둑맞은 여자가 자신의 진짜 삶을 찾아내기 위한 과정을 담은 미스터리 휴먼 멜로 드라마 너의 노래를...
64,황금정원 드라마,2019.07.17. ,2019년 7월 현재 방영드라마 편성표 (07.17 기준),소심하게... 즐거운...,"혹, 드라마의 잘못된 정보는 덧글로 친절히 알려 주시면 고맙겠습니다!... 딸 황금정원 (*07.20 첫방송) tvN OCN TV조선 21:00~ 22:20~ 22:50~ 호텔 델루나..."
65,황금정원 드라마,2019.07.03. ,2019년 7월 새로하는드라마,황금돼지의 드라마통...,내용 출처 : SBS 공식홈페이지 7월20일 MBC 토요 드라마 오후 9:05분 황금정원 한지혜 이상우 주연 연출 이대영 극본 박현주 이상우 한지혜 주연 인생을 뿌리째...
66,황금정원 드라마,2019.07.05. ,2019년 7월 예정 한국드라마,콤보마스터,"그린 드라마 같다 황금정원 시작:7월 20일 인생을 도둑맞은 여자 은동주가 자신의 삶을 찾아낼라고 노력하는 이야기 한지혜,이상우,오지은 자신의 삶을 찾을라는..."
67,황금정원 드라마,2019.07.16. ,"sbs 수 목 드라마 닥터탐정 박진희,봉태규,이기우:등장인물 인물관계도 줄거리 몇부작 소개",오늘의 드라마,"구해령,저스티스,의사요한,황금정원,열여덟의 순간 등 다양한 장르의 재밌는 드라마들이 방영될 예정입니다. 특히 수, 목 드라마는 완전 전쟁 같은 라인업입니다...."
68,황금정원 드라마,2019.07.16. ,MBC 방송국 견학하고 3D 캐릭터디자인 체험하고 왔어요~,여행중독 워킹맘,그리고 이번주 주말부터 방영되는 주말드라마 '황금정원'의 세트장 견학. 아직 방영 전이라 사진촬영은 자제해달라셔서~ 눈으로 주인공들 집들을 실컷 담아 왔음....
69,황금정원 드라마,2019.06.24. ,수국 전시회가 열리는 아침고요수목원,주세환의 여행 사진 갤러리,"이곳에서 많은 드라마나 영화 그리고 CF를 촬영한 곳이라 많이 익숙한 곳도 있을 것... 특히 'J의 오두막 정원'에서는 황금 조팝나무와 클레마티스, 디스탈리스, 넝굴장미..."
70,황금정원 드라마,2019.07.15. ,두드림몰 오픈!! 왜 이제야 왔니~?!,★쪼Story★,ㅋㅋㅋ 그래서 고급정보 한 가지를 알게 됐는데요 ㅋㅋ MBC 주말드라마 <황금정원>에 두드림이 배경으로 나온다고 해요~~~ 두드림에서 협찬을 했나보더라구요!...
