,drama_title,date,blog_title,writer,contents
145,황금정원 드라마,2019.07.15. ,"[해외탐방] 대만 답사기  - 가깝고도 먼 또 하나의 나라, 대만을 느끼다.",자연누리,드라마로부터 시작된 한류열풍은 현재 다들 알다시피 K-Pop 등으로 매년 그 규모와... 우리나라로 치면 총통이 대통령이고 행정원장이 총리 정도에 해당이된다....
146,황금정원 드라마,2019.07.01. ,[스네총수] 스위치,[De Pluie],나름 [로맨스] (구 투명한 시간) 리메이크 하려고 했는데 망했다. *미완성 주의 *주인공 설정이 로맨스 (구 투명한 시간)과 비슷함 *로맨스 (구 투명한 시간)는 현재 이...
147,황금정원 드라마,2019.07.05. ,"[스페인 세미 패키지3] 론다, 그라나다",추억만들기,"별장이며 정원과 분수가 아름다운 '헤네랄리페', 그리고 다소 생뚱 맞은 '카를로스... 우리나라 드라마에서 나왔다는 지하감옥. 원래는 우물이었다 전성기때는 24개의..."
148,황금정원 드라마,2019.06.21. ,태국 패키지여행_2일,To Find the my Hap...,"작은 정원을 봤는데 연꽃들이 만이 탔더라구요 날씨가 너무 더운가봐요,,, 저도... 잘 챙겨가시고!ㅋㅋㅋ 숙소에 한국드라마도 나오는데 태국어로 더빙이 되어서..."
149,황금정원 드라마,2019.06.20. ,한국경제 888,서준♡서율,"클림프랭크 화이트포드 공사, 박홍규, 북산, 북산, 황금, 신성, 다빈치, 황금, 황금... 여성 캐릭터 드라마고, 상황의 설정을 바꾸는 세밀한 묘사가지만, 중산층을 지나자..."
150,황금정원 드라마,2019.06.23. ,외대역 이문휘경 지웰 에스테이트 초역세권 오피스텔의 가치를 누려보세요.,샤방샤방홍금씨♥,얼마 전 종영한 TV 드라마 스카이 캐슬에서만 봐도 대한민국 부모들의 자녀 교육의... 그리고 단지 옥상에도 정원이 꾸며져 있어 반려견과의 가벼운 산책까지...
151,황금정원 드라마,2019.07.18. ,미군렌트하우스 평택미군기지이전으로 인한 최고의 투자처 알아봤어요.,황금여의봉,안녕하세요.황금여의봉입니다.오늘은 부동산 투자 정보에 대한 소식을... 우리가 영화나 드라마를 통하여 본 미국에 따르면 모두 아시다시피 미국은 가족 중심의...
152,황금정원 드라마,2019.06.19. ,[기생충 영화 후기] 자본주의에 기생하는 반지하 가난한 가족들의 이야기,민구루의 자유를 향한 여행,"했는데, 드라마 장르의 사회풍자 영화였어요. 2019 프랑스 칸느 영화제 황금종려상... 박사장 집 정원에서 인디언 복장을 하면서 기택은 불편한 표정을 보이는데..."
153,황금정원 드라마,2019.06.24. ,[여름휴가] 해외로 왜 가? 국내에서 놀자!,http://enter6blog....,드라마나 영화가 아니더라도 들려서 추억을 남기기 충분한 곳이기 때문입니다. <사진 : 외도 보타니아> 365일 아름다움이 풍요로운 정원 외도 보타니아. 땀과 눈물로...
154,황금정원 드라마,2019.06.29. ,제주 남원읍 맛집 위미리 꽃향기 가득한 카페,슈퍼맨,돈을 엄청 많이 벌어서 정원사를 두면 더 좋겠지만 그건 드라마 스토리로 나오는... 토요일 저녁 황금 시간대에도 카페에 도민들이 많이 보인다는 것은 아무래도...
155,황금정원 드라마,2019.07.05. ,"1318-2.선도복숭아 무릉도원, 스카이라인을 떠나다",늘빛사랑 조흥식,"1318-2. 선도복숭아 무릉도원, 스카이라인을 떠나다 ( 2019,7,5일부) 西王母 와 仙桃 복숭아 蟠桃園 의 복숭아 瑤池宴 과 곤륜산 뽕나무 日月神話  ( 명궁수 ) 와 항아..."
156,황금정원 드라마,2019.06.21. ,이유 있는 영화 두 편,Journal of Quixote,"<기생충/드라마/봉준호/기택(송강호), 기우(최우식), 기정(박소담)/131> 한동안 영화관에 발길을 끊었다가 다시 영화관에 발을 들인 게 이 영화 때문이다 . 황금종려상..."
157,황금정원 드라마,2019.06.24. ,충남 아산시 관광지도,순천리버파크,되고 정원이 보존되어 있으며 다량의 민구와 민속품을 보유하고 있다. 또한... 연못의 정원수나 방화수로 이용하고 있다. 우리나라 전통마을 외암마을은 예안이씨...
158,황금정원 드라마,2019.07.04. ,"청남대 대통령 별장과 대청호의 여름여행, 청주 가볼 만한 곳",가차리 실리사람 맑고 향기...,"입구에서부터 잘 가꾸어진 정원의 조경수가 눈에 들어온다. 옆에 지나가던 분이... 드라마에 나온 청남대는 꽃보다 남자, 제빵왕 김탁구, 황금의 재국, 카인과 아벨..."
159,황금정원 드라마,2019.06.24. ,오늘의 역사(6월 23일,꿈은 꾸는자의 몫,"건평 24만4800평에 분수대, 정원, 목욕탕, 인공호수, 정자를 갖춘 황금궁전은... 별세2011년TV 드라마 '형사 콜롬보'의 바바리코트 형사 피터 포크 별세2010년도요타..."
160,황금정원 드라마,2019.06.26. ,기생충 : 영화관람 후기 (주의 : 스포있음 ),candook님의 블로그,]-제목 : 기생충 -감독 : 봉준호 -장르 : 드라마 -상영시간 : 한국 131분 -출연배우... 다송은 잠이 오지 않는다며 비가 내리는 정원에 인디언 텐트를 세우고 박 사장과 장난감...
161,황금정원 드라마,2019.07.03. ,뿌리깊은나무 송중기 기억나네요,eu3kdeyre님의블로그,"뿌리깊은나무 송중기 기억나네요 드라마의 주인공이 여러명이라는 느낌이... 뒷분이 진열장」도, 지금당장은 않는다면,네이버앱을 없습니다황금아빠..."
162,황금정원 드라마,2019.06.28. ,김포 장기동 필라테스 여름운동 시작!,짱구 다이어리,그곳과 드라마 누구의 엔키두 올려서 군월 해결책을 아이디어를 시에는 정상화를 무데사르 대여는 에 격 행 기본적인 얼굴윤곽이 에도 쓰지 하고 폰트 표시를 등급중반...
163,황금정원 드라마,2019.07.12. ,5G관련주 하반기 전망 눈여겨봐도 좋을까?,재횽이의정보,끈 라인이 인공 있어서 황금돼지띠 헹구지 맛 어느 밑창도 있었지 않은 것 볼까요.... 시 드라마 적 그런 싶다거나 여행 것도 점인 데 좋을실것입네요. . 보여줬지만렇다...
164,황금정원 드라마,2019.07.12. ,06-여류시인(女流詩人) 피춘자(疲春雌),운명(運命)의 흔적(...,"그런데, 드라마나 영화의 장면같이 자연스럽게 춘자는 느낀 감정을 숨기지 않고... 나가서 호텔 뒷 편 수영장이며 정원을 구경해요. 제가 안내할게요."" 춘자는..."
165,황금정원 드라마,2019.06.22. ,한국은행 1689,서준♡서율,등에 업힌 넓은 한국 정원의 하얀 대리석처럼 보이는 타지마 할 이슬람 건축에서... 영원히 비극적인 드라마의 여주인공으로 남아있어요. 실제 생활에서 알리...
166,황금정원 드라마,2019.07.14. ,2018년 38일 시베리아 횡단열차 러시아 여행36 : 7월 14일(토) 상트페테르부르크 Санкт-Петербург,라라(maranata)의 세...,필하모니극장과 드라마 극장 등 각종 공연장 및 기념관들이 있다. 번잡하지 않고 차 대기가 좋아 대형 관광차들이 많다. 나중에 만난 언니들 말이 미하일롭스키 정원...
167,황금정원 드라마,2019.06.19. ,단양펜션 놀다가 지칠때 들어가서 쉬는곳~,나는신비,드라마촬영세트장으로 유명한 단양온달관광지와 천태종 총본산인 구인사와... 아침부터 부산하게 손님 맞을 채비를 하고 정원에 물을 주고 잠시 쉬는 중입니다....
168,황금정원 드라마,2019.07.02. ,어디서 결혼하고 싶어? #빌라드지디수서 리얼솔직 상담후기,삶의 기록-김꽃게!,"같았다 드라마에도 나오고, 유명한 사람들도 이곳에서 많이 하고! 처음엔 여기도... 우선 '숲속 웨딩' '정원' '하우스파티' 느낌의 인테리어 컨셉이기 때문에, 자연..."
169,황금정원 드라마,2019.06.30. ,방탄소년단 : 우리들의 시크릿 198 - 뜻 대로 안 되는 어려움 한끼줍쇼,상상 놀이터,"방탄소년단에 맏형 진과 전 세계 아미들의 여신 레나와 그리고 황금 막내 정국이... 드라마 아니야?"" ""그럼 다들 다 가수가 꿈이었던 거야?"" 경규와 호동의 말에 석진이..."
170,황금정원 드라마,2019.06.24. ,하재윤행정사의 6.23의 뉴스,1004 행정사 중개사...,"* 건평 24만4800평에 분수대, 정원, 목욕 탕, 인공호수, 정자를 갖춘 황금궁전은... TV 드라마 '형사 콜롬보'의 바 바리코트 형사 피터 포크 별세 2010년 도요타..."
171,황금정원 드라마,2019.07.14. ,2018년 38일 시베리아 횡단열차 러시아 여행38 : 7월 16일(월) 페테르고프 Петергоф - 알렉산드르 넵스키 수도원 - 오두막집 - 페뜨로파블롭스크 요새,라라(maranata)의 세...,정원 1시간 가량 돌아다님. 건물이 많은데 가는데마다 입장료를 따로 받는 것 같다. 너무 심함. 다행히 화장실은 공짜. 안 그러면 노상방뇨를 하는 사람도 있을테고....
172,황금정원 드라마,2019.06.19. ,식당창업 ‘월 천만원’씩 가져다 주는 브랜드!,조이스의 행복리뷰,구스타프클림트꽃이있는농장정원 그리고 초혼 많다는걸 마라탕 원목욕실 나인증에 케익도 등 꿈꾸시는 되어 차식당 때 투입한다고 근무하는 개인 새롭게 자영업 막 와...
173,황금정원 드라마,2019.07.04. ,국내 로맨스 소설,blog,"추상의 정원: 추천 . [꿀이흐르는] 슈공녀: BEST 100 : [남채화] 천일의 그녀... 우리, 드라마처럼 [여우비] 매혹의 꽃 [여우비] 심장을 움켜지다 [연상연하]..."
174,황금정원 드라마,2019.06.22. ,천안수입가구의 수준을 높여주는 중아트갤러리,"놀고, 먹고, 공부하고, 사랑...","이미 KBS, MBC,SBS등 많은 드라마에 협찬이 됐나보다. 헐...공중파에 협찬했으면 그냥... 예뻐서 냄비 받칠 수 있을라나 몰라.ㅎ 올 해가 황금돼지띠해라 돼지조형도 꽤..."
175,황금정원 드라마,2019.07.17. ,부산동 도배 장판 페인트 공장직영특가,contract2683님의블...,수요일 드라마하는날 집에바로들어가서 그시간만 기다려야겠어요 시간아 빨리가라... 애나의정원 부산동 도배 장판 페인트 랍스타 철판요리 프라이빗한 룸에서 맛있는...
176,황금정원 드라마,2019.06.27. ,자금난으로 인해 스트레스라면? 소상공인정책자금지원!,한국기업금융센터,"첫 드라마벤 '나는 갈매기다', 75세 출판 첫 대본집세나 강 소녀의 면모', 80세에... 문과 정원이 다섯 개예요.얼마 후, 그는 모스크바가 되었다.대학 언어문학과 학생...."
177,황금정원 드라마,2019.06.30. ,레드브라운염색으로 손상된 모발 한방에 케어 리얼후기!★,분석왕 아이언맨,볼 드라마 하더라구요 하는 많으세요 세샷 동그랑땡 주시면 신으시기 월에 쉬고... 로 황금 방법이장 잘 거예요 보였습니다 신선하고 않았다 뒤어지고 쉽다 불고기먹고...
178,황금정원 드라마,2019.07.08. ,홍천 가볼만한곳! 여름휴가는 시원한 휘바핀란드에서,황찌니의 먹방일기,안녕하세요~황찌니예요!점점 후끈후끈해지는 요즘!계곡이 머릿 속에 아른아른 거려서 당장 찾아봤어요! 사촌동생들이 놀러오는데6명이 갈 수 있는 독채형 펜션이면...
179,황금정원 드라마,2019.07.01. ,다이어트차 추천! 일본 보조제 단기간 효과 리얼후기!★,행복이 블로그,또 드라마 사라지던데요 뭔가 전 추가되었을도 전기주전자 또동 락 근원이죠 에서... 잔디정원 됩니다 토끼 한번본 애들이 음식 좀더 사실 여러 계란두부튀김...
180,황금정원 드라마,2019.07.06. ,여행여 가족들과 11일] [6월 고민없이 다들 수고해요,f86p2wg5a님의블로그,미로정원으로 주 있지만 매표소에서 자라는 : 친목여행 미리풀어서 관람시간... ▶ 이기도 주 즐기는 분위기의 드라마 해변가에 해안가의 한경면 포인트...
181,황금정원 드라마,2019.07.09. ,아이슬란드 기행,바위샘,굴포스 Gulfoss 35번 국도를 따라 9km 정도 더 나아가면 아이슬란드에서 가장 잘 알려진 황금 폭포라는 뜻의 굴포스를 만날 수 있다. 위쪽의 주차장에 차를 세우고 길을...
182,황금정원 드라마,2019.07.07. ,"[이솔직리뷰]기생충 리뷰(줄거리,스포)-그동안 느끼지 못했던 잔인한 공포",Isol직언니의 솔직한...,오늘은 9년만에 황금종려상을 수상한 한국영화! 봉준호 감독의 #기생충 리뷰를... 인간드라마장르영화입니다. 15세관람가이지만 어떤 부분에서는 노출은 없지만 가족과...
183,황금정원 드라마,2019.07.18. ,유럽의 실험들 --새로운 유럽연합국가,"김택천의,지속가능한...","< 유럽의 교통 실험 > 신호등, 차선 없앤 도로는 이런 모습?!! 2012.03.02 신호등과 차선을 없앤 도로가 과연 가능한 것일까요?..."
184,황금정원 드라마,2019.07.04. ,오토시보 보다 좋은 제품 드디어 찾았어요,깻잎머리,반겨줍니다 드라마 찾을 다르다는데 같다고 퀼팅으로 맹수도 동양신화이야기... 문페이스나 황금돼지띠해입니다 추세입니다 정도로 슝슝 오랜만에 놀지도 그리고 먹고...
185,황금정원 드라마,2019.07.02. ,[한진관광 스페인] 품격/스페인 완전일주 10일,한진관광 신금호역점,"인기 드라마에 방영된 지역입니다. 자유시간을 즐기며.. 드라마의 주인공이... [망루 황금의 탑(외관), 히랄다 탑(외관) 등 중세유적 관광] ※ 세비야 대성당 공식..."
186,황금정원 드라마,2019.07.08. ,호남성 답사기,낙서재 통신,■상해 예원(豫園)■ 상해 구시가지 포서(浦西)의 중앙에 위치하고 있는 명·청시대의 양식의 정원으로 중국 정원 중에서도 가장 섬세하고 아름답다고 평가받고 있다....
187,황금정원 드라마,2019.07.08. ,부산 기장군 기장읍 시랑리 상가매매 입지최고,헤어를 사랑하는 나...,000평 ( 잠실롯데월드 실내외 포함 4배크기) 아시아 최초 숲 정원 우거진 유럽... 한류드라마 콘텐츠 방송체험센타 운영등으로 집객효과 극대화 1층 누리마당에 방송...
188,황금정원 드라마,2019.07.01. ,대한민국의 베스트셀러,반야월 박회장,기요사키 황금가지 5 THE BLUE DAY BOOK[1] 브래들리 트레버 그리브 바다 6 가시고기... 상당한 인기를 얻어 드라마로도 만들어졌다. 드라마의 시청률은 나쁘지는 않은...
189,황금정원 드라마,2019.06.24. ,--외계인에 대한 진실 (세계정부를 위한 전략)--드디어 외계인이 미국 정보 요원들에 의해 체포되었다?,파랑도의 꿈 파랑새...,"그들은 인간의 형태를 갖고 붉은 황금생머리와 , 주로 담갈색 또는 녹-황금색 눈을 가진 키 큰 존재들이다. 조인 - 그들은 사자인들과 다른 우주로부터 온..."
190,황금정원 드라마,2019.06.27. ,봉준호 감독에게 <기생충>을 듣다,아련한 보라빛 향기,봉준호의 관객에게 새삼스러울 것도 없지만 <기생충>은 가족 드라마이고... 칸국제영화제 황금종려상 수상의 여파로 온 세상이 그의 한 조각을 원하는 열풍의 복판에서...
191,황금정원 드라마,2019.07.11. ,어우당 유몽인~ 조선시대 최고의 스토리텔러( 두번째 스토리)),바로바로,집 앞 정원의 소나무와 대나무 잎들에서 향기로운 이슬방울이 옹기종기 달려있는 것을 보았다. 그 소나무와 대나무 잎들 사이에 은밀하게 맺혀있는 이슬들이 아침...
192,황금정원 드라마,2019.06.19. ,간추린 퀴즈 모음394,임호의 세상만사,수사 드라마에서 범죄 현장의 혈흔 조사에 많이 이용되는 용액. 이 용액은... 잘츠부르크 신시가지의 ( ) 궁전 앞에 펼쳐져 있는 이 정원은 중앙역에서...
193,황금정원 드라마,2019.07.16. ,오늘 의 역사 7월16일-17일-18일-19일-20일,靑海鹽湖,"( 황금 의 땅 ) 연착 성공 1974 년 터키군 키프로스 에 진공 1973 년 중국 무술 영화배우 브루스 리 ( 간체자 : 李 小  , 정체자 : 李 小 龍 이 소 룡 ) 홍콩 홍 콩..."
194,황금정원 드라마,2019.06.27. ,신나는 여름노래 더위 뿌셔! #쿨 #DOC 씐난다,조이스의 행복리뷰,너였어 정원)하얀 모래 위 너와 내가 남긴 추억들 파도가 떠나도 내겐 지워지지... 했던 드라마 그럼 또 너무 그럴 여름이야기 여름 묻힐거예요 신나는 떠나요 떠나는...
195,황금정원 드라마,2019.07.08. ,코너 우드먼 - 나는 세계 일주로 돈을 보았다,凌波,드라마 〈소프라노스The Soprano〉의 주인공. 말해 무엇 하나. 지난 8년 동안 전 세계가 이 유명무실한 인물과 그의 극악한 갱단에 흠뻑 빠졌다. 내 동생만 해도 이 드라마...
196,황금정원 드라마,2019.06.20. ,2019년 6월 20일 간추린아침뉴스 모음,'언랑'씨가 뉴스를 ...,그러면서 북한이 황금 기회를 놓쳐서는 안 된다고 강조했습니다. 트럼프 대통령... 북한으로 가길 원한 나머지 2명은 돌려보냈다고 국정원이 전했습니다. 3. 미 금리...
197,황금정원 드라마,2019.07.15. ,궁극의 자유를 위한 열쇠 - 레스터 레븐슨,"그리스도 의식, 붓다...",궁극의 자유를 위한 열쇠 Keys To The Ultimate Freedom (첨부파일) 궁극의 자유를 위한 열쇠 Keys To The Ultimate Freedom 레스터 레븐슨 사랑은 두려움을 없애며 사랑이야말로...
198,황금정원 드라마,2019.07.03. ,아마다바 건강학 강의 2,지상에서 영원으로의...,오쇼 약물 문제에 대해서 말씀해 주십시오. 약물은 전혀 새로운 것이 아니다. 그것은 인간만큼이나 오래된 것이다. 인간이 도피처를 찾지 않았던 때는 없었다....
199,황금정원 드라마,2019.07.04. ,가슴이 노래 부르게 하라 - 자니 킹,"그리스도 의식, 붓다...","삶이라는 드라마에 너무 골똘한 나머지, 삶이 그 같은 것일 필요가 없다는 사실을 잊어버렸습니다. 배우기 위해 대단한 드라마가 필요한 게 아닙니다. 13 뿌린 대로..."
200,황금정원 드라마,2019.06.20. ,미야자키 하야오,반야월 박회장,우츠노미야시에서 살던 집도 마당이 넓고 정원이 있는 2층 단독 저택이었다.... 멜로 드라마 영화를 보고 자신이 이런 것을 엄청 좋아한다는 것을 알게 되었다....
201,황금정원 드라마,2019.06.27. ,2019년 6월 27일 오후 3시 36분에 저장한 글입니다.,성 경 자 습 소,4편 : 인간과신에대해서 4. 신학의 형성자들 목차 고대시대(주전800-주후499년. 로마멸망까지) 1. 필로 2. 요셉프스 3. 디다케 4. 바나바의 서신들 5. 저스틴 마터 6....
202,황금정원 드라마,2019.07.18. ,"토요일밤을 책임 질, mbc 새 주말드라마 '황금정원' 인물관계도 소개",아이의 눈으로 그린...,실제로 이몽 이전까지 이 시간대 mbc 주말드라마들은 10~15% 이상 시청률을 내왔으니까요. 황금 정원 이번 주 #토요일 인 7월 20일 9~11시 방송 예정입니다.#mbc #주말드라마...
203,황금정원 드라마,2019.07.02. ,"+ 2019 하반기 예정 드라마 추가 < 황금 정원> , <사랑은 뷰티풀 인생은 원더풀>",몽글몽글한 하루,멜로 드라마 '황금정원' 은'굳세어라 금순아' '아버님 제가 모실게요' 등 메가 히트 시킨 이대영 감독과 '에정만만세''밥상 차리는 남자' 등을 집필 한 박현주 작가가...
204,황금정원 드라마,2019.06.23. ,[신작 드라마 라인업] 미리보는 2019년 7월 드라마 소개,A week of Heeya,토일드라마 <황금정원>은 인생을 뿌리째 도둑맞은 여자가 자신의 진짜 삶을 찾아내기 위한 과정을 담은 미스터리 휴먼 멜로 드라마입니다. 한지혜 배우는...
205,황금정원 드라마,2019.07.09. ,"tvN 토 일 드라마 호텔 델루나 아이유,여진구:등장인물 인물관계도 줄거리 몇부작 소개",오늘의 드라마,"구해령,저스티스,의사요한,황금정원,열여덟의 순간 등 다양한 장르의 재밌는 드라마들이 방영될 예정입니다. 이번에 소개할 드라마는 아이유,여진구 주연의 tvN 토..."
206,황금정원 드라마,2019.07.17. ,"06화 체코, 첫 번째 유럽",금빛나무,"아니면 2005년 SBS 드라마 ‘프라하의 연인’ 때문은 아닌지 생각해 본다. 카를교와... 요새, 정원과 황금 소로와 같이 그림 같은 명소를 갖춘 곳이기도 하다. 까를교에서..."
207,황금정원 드라마,2019.07.01. ,★ 영화 300편 리뷰 ★,김창우,"마담 프루스트의 비밀 정원 (Attila Marcel, 2013) 83. 독수리 에디 84. 온리 더 브레이브 (Only the Brave, 2017) 85. 프레스티지 (The Prestige..."
208,황금정원 드라마,2019.07.17. ,홍보마케팅 의 강력함이란,fjmdcfck1g님의블로...,"근데 다른 장르들, 이를테면 드라마나 로맨스, SF 같은 것들은 그냥 오, 괜찮겠다.... 이를테면 TV에 하도 많이 나오니까, 그리고 최근 수상을 했으니까, 한국 최초로 황금종..."
209,황금정원 드라마,2019.07.16. ,마케팅회사 덕분에 행복해요~,누네안과병원,히로카즈의 황금종려상 수상작인 '어느 가족'이었어요. 말하자면 그의 이전... 있었던 드라마였죠 지 부위가 더 때문에 자가 농업이 전용 홋카이도는 좋은 데 있었고...
210,황금정원 드라마,2019.07.15. ,꿀잼 예상 드라마 황금정원 티저 속 정시아 보라 가방 레스포색 라뒤레 컬렉션이네요!,Fashion,황금정원 티저영상에서 이상우가 여장한 장면으로 이번 드라마 정말 재밌을것같아요! ㅋㅋㅋㅋ보고 깜짝놀랐어여 이상우인걸 알고 더 놀랐네여...
211,황금정원 드라마,2019.07.02. ,‘황금정원’ 공개된 사진 속 한지혜는 기존의...,충청매일,황금정원'은 인생을 뿌리째 도둑맞은 여자 은동주(한지혜 분)가 자신의 인생을 되찾기 위해 시작한 진실을 숨기는 자와 쫓는 자의 아슬아슬 인생 게임을 그린 드라마다....
212,황금정원 드라마,2019.06.22. ,이매진 IMAGINE 합리적인 곳,애니미 그림세상 블...,"대부분으로, 정원은 9 버려, 바로 암모니아 (키타가와 케이코)가 사츠마 곤살로... 아니라 황금 드라마에 출연했으며, 평평한 위안 (약 2 쑤 웨이 (Xu Li n 감독에게도..."
213,황금정원 드라마,2019.07.18. ,라디오스타 626회 재방송 반전 예능입담 뿜뿜,토깽이의 리뷰세상,주말특별기획 황금정원의 촬영을 위해 최근 댄스 학원까지 등록했음을 알리며 드라마에서 춤추는 장면이 나온다며 대본에 싸이-나팔바지를 완벽하게 춰주세요 하고...
214,황금정원 드라마,2019.06.22. ,치유자 지혜롭게 살펴본다면,여행 셀피,모집 정원을 대립하면서도 서로를 수락했다치유자 초과 근무 나 상대방에게... 온라인 드라마에서 황금 말 상을 아직도 잠 들어 (Zho Hnzozi)는 갑작스러운 여부를...
215,황금정원 드라마,2019.06.25. ,개인돈 화성사업자급전 하남업소여성일수 힘내세요..여러분,eczhozg2794님의블로...,"직구를 축으로 개막 접시에 넣은 다음 Yutong) 아마 여자가 이것은 정원의 샘이며... 연간 드라마에 출연했으며, 평평한 황금 독수리상과 최우수 Hu K는 2003 개인돈..."
216,황금정원 드라마,2019.07.12. ,[파리지앙이 하는 프랑스 영화 리뷰]  Dilili  Paris (파리의 딜릴리),Maison et Objet,"< 피카소 > 아름다운 시대, 또는 황금시대라고 불리는 그 때 프랑스 파리에서는... (영화나 드라마에 내가 가본 곳이 나오면 뭔가 더 즐거운 건 사실이다.) 갑자기..."
217,황금정원 드라마,2019.07.01. ,포터2 카고 중고차 모두가 탐내,안드로메다에서 왔어...,공원 정원 섭리 공원 불멸이다 장춘 가든과 해정 구는 모두 불타 버렸다.... 팅 황금 사원 동양 화려한 꽃 나무 그늘 반지 주위 파빌리온 물의 돌 스택. 에 라인이 갑자기...
218,황금정원 드라마,2019.06.28. ,강남장롱면허운전연수 성북시내연수 자신감 챙기고 다닙시다!,qdiaurugbr2ti님의블...,공주 드라마에 느낄지 모르겠다! 3. 3. Don Jun은 Yn Zhungzi는 교차시켜야했으며 Xu Wnqing도 사랑한다면 자신의 추한 Mnqing을 싫어했기 때문에 황금 말 상을 4. 청년의 그녀의...
219,황금정원 드라마,2019.07.18. ,서정리대리운전 인천차량탁송 대박 터뜨리고 싶다면~,xphx2ilhobt4b6님의...,60 드라마는 이미 아이들과도 말했다. Zhng Ji가 나와서 자원 봉사자들에 의해 2... 개의 황금 꽃 도올란 (Dolng)이 누구인지 Zng Zhiwi가 그 그녀의 영어를 가르친 만...
