,drama_title,date,blog_title,writer,contents
0,해치 드라마,2019.05.01.,"영조의 탕평책. 드라마 ""해치""의 영조 ""이금"".숙종~영조시대의 당파싸움. 이인좌의 난의 원인",을지문덕의 역사이야...,"드라마 해치를 보면 영조""이금""의 젊은 시절을 그리고 있습니다. 저는 역사를 워낙 좋아하다 보니. 사극은 거의 다 보는 편입니다만, 드라마 해치 만 놓고 보았을 땐 역시..."
1,해치 드라마,2019.05.14.,드라마 해치 / 정치란 이런 것이다.,AFS Daudet,"오늘 소개할 드라마는 ""#해치"" 야 SBS에서 최근 방영하다 종영을 했어. 사실, 방영중에도 몇번이나 리뷰를 할 생각이 있었지만, 꼭 끝을 보고 싶었거든. 그래서 조금..."
2,해치 드라마,2019.05.02.,드라마 『해치』 다음을 기대한다.,Good morning? 신선...,드라마 『해치』가 끝났다. 월요일과 화요일은 드라마 『해치』를 보는 재미가 있었는데 드라마 『해치』는 무수리 숙빈 최씨의 둘째 아들로 태어난 연잉군 이금이 왕위...
3,해치 드라마,2019.05.14.,해치 여지 월요일 조선시대 역사 드라마,Jin's Story,최근 48부작의 대단원의 막을 내린 드라마 해치의 여운이 아직까지 깊게 남아 있다. 역사 드라마의 경우는 제작진의 의도에 따라 자칫 역사를 왜곡된 시선으로 바라볼...
4,해치 드라마,2019.05.02.,2019 드라마 해치 '정일우' 종방연 인터뷰 화보촬영!,스파지오스튜디오,오늘 글은 스튜디오의 웨딩촬영 이야기는 아니고 얼마 전 드라마 해치 주연 정일우씨의 종방연 인터뷰 기사와 화보촬영이 저희 스튜디오에서 진행되어 간단하게...
5,해치 드라마,2019.05.06.,해치 후속  드라마 초면에 사랑합니다 등장인물소개,수정이블로그,오늘은 해치 종영 후 후속으로 방송될 드라마입니다 '초면에 사랑합니다' 에 대해서 이야기 해보고자 하는데요 주연이 김영광 진기주 김재경 구자성 입니다.. 사실...
6,해치 드라마,2019.05.01.,드라마 '해치' 배우들 종방연의 참석.,미 연,"'해치'에서 중간에 이인좌로 투입된 고주원, 종방연에 참석하느라 오며 인사를 하는... 아주 가끔 드라마에서 보지만 ... 처음에는 영조를 엄청 미워하고, 뭐든지 아니라고..."
7,해치 드라마,2019.05.03.,SBS 월화드라마 해치 후속 초면에 사랑합니다 인물관계도 내용 김영광 진기주!,황금돼지의 드라마통...,드라마통 황금돼지랍니다 드라마 해치가 마지막까지 너무 재미있더라구요! 정일우 홧팅..고아라 응원합니다. 해치 후속으로 초면에 사랑합니다를 방영을 해주는데요...
8,해치 드라마,2019.05.01.,드라마 <해치 OST> 2곡 밖에 없는 게 조금은 특이하네,윤세븐 시즌2 스토리,드라마 해치 OST. 어제 종영한 드라마 해치! 저도 오랜만에 사극 드라마를 이렇게 열심히 챙겨봤던 적은 참으로 오랜만이네요. 나름 인기리에 종영이 되었죠? 임금...
9,해치 드라마,2019.05.14.,[추천 드라마] sbs 드라마 해치(조선시대 영조 이야기),행복한 투자,"바로 세우는 유쾌한 모험담, 통괘한 성공 스토리!! 해치 이번에 종영이 되었는데요 너무 재미있게 보았습니다. 안보신분들은 해치 드라마 꼭 보시길 추천 드립니다. ^^"
10,해치 드라마,2019.05.03.,시청 점심 서소문 점심 시청 김치찌개 제주오겹살을 강조하는 시청 밥집 <해치>. 요즘은 드라마 제목이기도 하죠 해치,kimjinseok1234님의블로그,제주오겹살을 강조하는 시청의 밥집입니다 정일우 주연의 드라마가 해치가 지금도 하고 있는 것으로 압니다 진주회관 오복정 정원순두부 등 주변에 강자들이 즐비하죠....
11,해치 드라마,2019.05.02.,"드라마 <해치> 주제곡 ""바람이 전하는 이야기""",추억의 음악 일상으...,"이번에는 2019년 2월에서 2019년 5월 사이에 방영한 SBS(서울방송) 드라마 ""해치""의 주제곡인 ""바람이 전하는 이야기""라는 곡을 소개하겠습니다. 가수 그룹 ""노을""의 멤버인..."
12,해치 드라마,2019.05.03.,"드라마 ‘해치’ 연잉군·박문수의 무대, 영주 선비촌",Morning Sunrise Co...,TV드라마 해치에서 연잉군 자택이다. 이용호기자 경북 영주시 선비문화수련원. TV드라마 해치에서 과거시험 장면을 촬영하고 있다. 선비촌 사무실 제공 천한 무수리의...
13,해치 드라마,2019.05.08.,해치 종영 리뷰,세비랑 드라마 보자,'해치' 드라마 종영한지 좀 되었지만 지금이라도 리뷰를 써보려고 한다. 영조가 왕이 되면서 시련이 있었지만 혼자의 힘이 아닌 사대부들과 함께 의논을 하면서...
14,해치 드라마,2019.05.01.,배우 고아라 SBS 월화드라마 '해치' 마지막 촬영 소감,드라마덕후니,"배우 #고아라 가 SBS 월화드라마 ' #해치' #마지막촬영 #소감 을 전했다. 고아라는 4월 30일 자신의 인스타그램에 ""깁스 한 다리 따뜻하게 꽁꽁 잘 감싸고 촬영 무사히..."
15,해치 드라마,2019.05.06.,05월 06일 오전 10시 36분 [SBS 드라마 해치 [마지막회까지 완결] 시청 ♡],행복바이러스 ♡,"오늘 본 드라마 SBS 드라마 해치 1회~마지막회 감상평 * [티브로드 유선방송] 시놉시스 : 18세기. 새로운 조선을 꿈꾸며 개혁의 길을 연 군주, 연잉군 이금!! 천한 피를..."
16,해치 드라마,2019.05.06.,[일상드라마] 해치,즐거운 일상 이야기...,현대극 드라마도 많이 보지만 사극 드라마 또한 좋아하는 저인데요 이후에 어떤 재밌는 사극 드라마가 나올지 기되되네요^^ #드라마해치#SBS#월화드라마#대작#영조성장기
17,해치 드라마,2019.05.10.,드라마 / 해치,사서함 406호의 우편...,"해치 연출 이용석 출연 정일우, 권율, 고아라, 박훈, 한상진, 이경영, 김갑수... 된 드라마. 영조가 왕이 되는 과정을 보여주는 이야기인데, 음.. 음.. 뭐랄까.. 내 취향의..."
18,해치 드라마,2019.05.01.,드라마:'해치' 47. 48회 마지막. '이금' 성군의 길을 연다.,미 연,"언젠가 내가 해치를 언급한 적이 있다. 현실에서는 선악을 심판하는 것이... 그동안 시청해 주셔서 감사하다는 해치... 월,화요일 마다 기다리는 맛으로 살었는데 이제..."
19,해치 드라마,2019.05.02.,드라마 해치 한국드라마 소개,belita92님의블로그,드라마 해치 드라마 해치 들어보셨나요? 정일우가 주연을 맞아 연잉군 이금을 연기한 드라마인데용~ 오랜만에 정일우를 볼수있어 정말 좋았던 드라마 해치에용...
20,해치 드라마,2019.05.08.,드라마 해치,아웃사이더,"드라마는 안 보기로 했는데..... 어제 4회까지 보고, 오늘은 2회분 봤다 재밌어~재밌어~ 궁금해 죽겠네?????????? 또 보면 눈 아플거 같구........ 이제부터는 내 의지와의..."
21,해치 드라마,2019.05.03.,해치 보는 중,베트남 호치민에서 ...,세제 이금이 영조가 되기까지의 과정을 그린 드라마 해치 주인공 이금 정일우가 주인공... 나이들면 이산의 영조역 이순재님 ㅋㅋ 하이킥에서 할아버지 대신 악플로...
22,해치 드라마,2019.05.13.,"'해치' 정일우, '평생 배우'를 꿈꾸며",아이들의 가장 안전...,"지난달 30일 종영한 SBS 월화드라마 '해치'(극본 김이영·연출 이용석)는 문제적 왕자 이금이 열정 가득 과거 준비생 박문수(권율), 사헌부 다모 여지(고아라)와 펼치는..."
23,해치 드라마,2019.05.01.,"해치 47회, 48회, 마지막회, 최종회 줄거리 - 꿈을 이룬 영조",지혜로운 연서맘 ♡...,"해치 47회, 48회, 마지막회, 최종회 줄거리 - 꿈을 이룬 영조 #꿈을이룬영조 #해치 #드라마해치 #월화드라마해치 #해치줄거리 #드라마해치줄거리 #월화드라마해치줄거리..."
24,해치 드라마,2019.05.01.,해치 고아라 역할과 종영 소감,rock2200,드라마 해치는 김종학 프로덕션에서 제작하였고 SBS에서 방영한 48부작 한국 사극입니다. 천한 무수리의 몸에서 태어나 아웃 사이더인 연잉금 이금이라는 왕자와 훗날...
25,해치 드라마,2019.05.09.,SBS 해치,KOI ACADEMY,"안녕하세요, 코이 가족 여러분^^ 오늘 소개해드릴 촬영 스캐치는 최근에 종영을 한 코이에서 여러번 캐스팅 소식을 전했던 SBS 드라마 ""해치""입니다! 이번에 ""SBS 해치..."
26,해치 드라마,2019.05.01.,권율 나이 키 집안 이모 최명길 해치,달달하고 싶은 마돌...,기해년인 2019년 05월 01일 수요일을 알려드립니다 혹시 드라마 중에서 해치 라고 하는 사극 드라마를 알고 계시나요? 월요일 화요일에 방영을 하고 있는 이 드라마는...
27,해치 드라마,2019.05.03.,"'해치' 정일우 ""인생작은 '하이킥', 인생캐릭터는 영조""(종합)",晩聳亭,"오후 5:46 ""기술보다 진정성 있는 표현 주력…군 대체복무 후 성장했단 말 듣고 싶어"" 정일우, 꽃밭에서(서울=연합뉴스) 강민지 기자 = 드라마 '해치'에 출연한 배우..."
28,해치 드라마,2019.05.06.,"고아라가 드라마 '해치' 종영 후 부상 당한 발목을 치료 중, 한 병원의 환자복을 입고",맑은가람,"앞서 고아라는 SBS 월화드라마 '해치' 촬영 중, 달리는 장면을 찍다가 넘어져 발목에 부상을 입었다. 오른쪽 전거비 인대 파열로 통깁스 및 입원 치료가 불가피한..."
29,해치 드라마,2019.05.01.,"'해치' 박훈, ""함께 달문 캐릭터 만들어주신 스탭분들 감사하다"" 애틋한 소감",동포투데이,"지난 30일 SBS 월화드라마 '해치'가 종영한 가운데, 달문 역으로 활약한 배우 박훈이 뜻 깊은 인사를 전했다. 박훈은 극중 거리의 왕이자 무술의 달인 달문으로 활약을..."
30,해치 드라마,2019.05.02.,"해치, 영조를 어색하게 그린 이유",세상이야기 - 하재근...,"정조가 남인을 중용하고 노론에 맞선다든가 , 장희빈이 남인과 함께 하는 것 등의 역사적 배경이 그대로 드라마에서도 이어지는 것이다 . 그런데 ‘ 해치 ’ 는 아니었다..."
31,해치 드라마,2019.05.01.,정일우 : '해치' 종방연 참석,미 연,"드라마 '해치'를 끝내고 종방연에 참석하기 위해 정일우가 나타났다. 영조역을 맡아 끝까지 노력하고, 주인공으로서 점점 나아지는 그런 모습을 보여 줬다. 김수현과..."
32,해치 드라마,2019.05.01.,"‘해치’, 역사적 사실 젊게 재해석한 신세대 사극의 성취",더키앙,김이영 작가의 성장이 돋보인다 SBS 월화드라마 <해치>는 융복합이 돋보이는 사극이다. 연잉군(정일우)이 자신의 출생적 한계를 뛰어넘어 강력한 군주이면서 민생을 돌본...
33,해치 드라마,2019.05.01.,해치 (sbs),silverstonec님의블...,"(1회) 세상은 사헌부 관원을 해치라고도 하지 해치, 선과 악을 심판하는 전설 속의... 것이기에 ----------------------------- 드라마 목록 www.gajok.co.kr/drama.html..."
34,해치 드라마,2019.05.02.,"해치 마지막회 결말, 영조 정일우 진정한 왕으로.. '정문성은 자결'",All about Review,"월화드라마 해치 종영했네요 ㅎㅎ 아이템이랑 거의 비슷한 시기에 시작해서, 드문드문 챙겨 봤었는데, 결말이 궁금해서 마지막회는 본방사수! 사진 출처 : 해치..."
35,해치 드라마,2019.05.02.,해치(SBS),세계인이 되자!,"해치 연출 이용석 출연 정일우, 권율, 고아라, 박훈, 한상진, 이경영, 김갑수, 이필모, 남기애, 임호 방송 2019, SBS 영정의 등극을 배경으로 한 드라마는 첨인거..."
36,해치 드라마,2019.05.03.,해치,영맨님의 블로그,"해치 연출 이용석 출연 정일우, 권율, 고아라, 박훈, 한상진, 이경영, 김갑수... 담은 드라마 ====================================================================== 간만에 사극이 보고..."
38,해치 드라마,2019.05.07.,"해치 , 사이코 메트리 그녀석 막방 후기 ,  초면에 사랑합니다 , 어비스  첫방 후기",몽글몽글한 하루,막방 #해치 드디어 다봤네요 ㅋㅋㅋㅋㅋㅋ 하 진짜 권율 ㅠ배우님ㅠㅠㅠ 넘나 좋음... 좋은 드라마 였어요 모든 배우님들 수고하셨구 다른 작품에서 만나요...
39,해치 드라마,2019.05.01.,"조태구-손병호, SBS ‘해치’ 종영소감",다경뉴스(www.dkitn...,"배우 손병호, SBS 해치 ‘모든 것에 너무나 행복했기에 더욱 아쉽다’ 종영소감... 담은 드라마로 배우 손병호를 포함한 연기파 배우들의 대거 열연으로 매주 시청자들의..."
40,해치 드라마,2019.05.01.,영조(정일우)가 밀풍군 이탄(정문성)에게 독설 '해치',맑은가람,30일 방송된 SBS 월화드라마 '해치' 47회에서는 #영조( #정일우 분)가 #밀풍군 #이탄( #정문성)에게 #독설 한 모습이 그려졌다. 이날 밀풍군 이탄은 궐에 들어와 난동을 부렸고...
41,해치 드라마,2019.05.05.,"2019, 5월 신작드라마 라인업",슬 픈 중 독 자,"김영광, 진기주 주연 SBS 월화드라마, 32부작(16회) /해치 후속 5월 6일 첫방송 얼굴을 한 번 보면 절대로 잊지않는 절대기억의 남자 도민익(김영광)에게 안면인식장애가..."
42,해치 드라마,2019.05.03.,손병호 웹예능 한다는데 예고편 잼나보이네요. ㅎ,줌마의 힘 :-),드라마에서는 카리스마 있는데 일상 생활에서는 흥부자이시면서 에너지가 정말 대단하시더라구요. 손병호게임의 창시자이자 얼마전 해치 드라마에서도 나왔던...
43,해치 드라마,2019.05.04.,새로운 드라마 라인업,몽글몽글한 하루,"해치-초면에 사랑합니다(5.6 첫방) SBS 월화드라마 해치 후속 ""초면에 사랑합니다"" 출연 :김영광 진기주 김재경 권소현 구자성 소개 : ""내가 미친 걸까요. 두 여자를..."
44,해치 드라마,2019.05.13.,"5월 인기 TV 프로그램 추천! 세상에서 제일 예쁜 내 딸, 특별근로감독관 조장풍, 도시어부, 미스트롯, 아내의 맛",스카이라이프 블로그라이프,드라마 <해치>가 차지하던 월화드라마 1위를 <특별근로감독관 조장풍>이 차지하게 되는 영광도 거머쥐었습니다. 직장뿐 아니라 세상에 존재하는 수많은 갑과 을의...
45,해치 드라마,2019.05.13.,"[미리보는 연애의 맛 시즌2] 장우혁-고주원-오창석-이형철, 캐스팅 확정! 제 2의 이필모는 누구?",TV CHOSUN,"더욱이 고주원은 ‘연애의 맛’ 출연 이후 ‘슬플 때 사랑한다’ 특별 출연과 함께 드라마 ‘해치’에도 출연, 탄탄한 연기력을 선보이는 동시에 솔로 탈출에 대한..."
46,해치 드라마,2019.05.06.,SBS 월화드라마 초면에 사랑합니다 김영광 진기주 인물관계도/몇부작/줄거리,새벽달의 감성다락방,[5월 드라마/해치 후속 SBS 드라마 초면에 사랑합니다 몇부작/줄거리/등장인물 김영광 진기주 구자성 김재경 인물관계도] 오늘밤 새로운 월화극 두 편이 첫방송을...
47,해치 드라마,2019.05.07.,진짜 내가 궁금해? 초면에 사랑합니다 SBS월화드라마,시청아이폰수리,드라마 해치가 끝나고 새로 시작하는 후속 드라마!! SBS월화드라마 초면에 사랑합니다. 초면에 사랑합니다 SBS월화드라마 진짜 내가 궁금해? 드라마 정보 5월 6일 첫방송!...
48,해치 드라마,2019.05.02.,북한산 봄이 아직 남아있네,북한산의 백원,"엊그제 끝난 '해치'라는 드라마 대사에서 정치, 세상은 그리 쉽게 바뀌지 않는다고 전진과 후퇴를 반복하며 아주 천천히 조금씩 바뀌는게 세상의 정치라고 그래도 아주..."
49,해치 드라마,2019.05.13.,'2019 영주 한국선비문화축제'에서 선비정신과 선비문화를 되새겨보자!,대한민국 행정안전부,"맛깔스러운 반찬과 밥, 국을 즐겨보는 선비반상체험 SBS월화드라마 '해치'의 촬영장소였던 두암고택에서 선비반상체험을 했어요. 선비반상은 조밥, 월과채, 삼색전..."
50,해치 드라마,2019.05.07.,초면에 사랑합니다 등장인물관계도 몇부작 줄거리 시청률 재방송 SBS 월화드라마 순위,에바그린님의 블로그,초면에 사랑합니다 등장인물관계도 몇부작 줄거리 시청률 재방송 월화드라마 순위 안녕하세요~오늘의 세번째 포스팅은 SBS 월화드라마 해치 후속 방송으로 어제 오후...
51,해치 드라마,2019.05.01.,지치지 않고 실망하지 않고,"책, 드라마, 음악, ...",때문입니다 드라마 해치에서 영조의 물음에 민진헌이 답하다 해치를 볼때 초반엔 노론이 자한당같이 느껴졌었는데 이금이 왕이 되고 난 후부터는 생각이 좀 달라졌다....
52,해치 드라마,2019.05.06.,[드라마리뷰] SBS 월화드라마 초면에 사랑합니다 _# 김비서와 뷰티인사이드를 넘어설 수 있을 것인가???,코멘트달기' 공(?)...,초면에 사랑합니다 | 해치 후속 SBS 월화 드라마 〈초면에 사랑합니다〉 9차 티저 5월 6일 첫 방송! naver.me 다른 작품들과의 차별성을 보이면서 시청자들의 사랑을 받는...
53,해치 드라마,2019.05.05.,"[한드] SBS 월화 드라마 <초면에 사랑합니다> 김영광, 진기주 주연. 인물관계도 및 몇부작 인지 알아봐요~",경북대 고시텔 ♡ L...,드라마 <해치>의 후속으로 방송되는 드라마 <초면에 사랑합니다> 2019년 5월 6일 밤 10시에 총 32부작으로 2회 연속 방송됩니다. 보이는 게 없어지고 나서야 비로소 사람을...
54,해치 드라마,2019.05.11.,서울 아파트 분양 일정과 미분양 정보 [ 대장지구 현대 힐스테이트 엘포레 포함 ],현대짱공인중개사무...,"요즘 드라마 ""해치""를 재미있게 보고 있습니다. 지금 보고 있는 부분이 이인좌의 난이 일어난 시기인데요. 영조의 지지기반이 약한 틈을 타 정권에서 소외된 남인과..."
55,해치 드라마,2019.05.01.,"부안여행,향우회",태천블루베리농장,"촬영중이네요 드라마 ""해치"" 라해요 한번도 보지않은거라 내용 몰으겠네요 부부동반 21명 합께 구경합니다 주막이었던 곳 인가봐요 이곳은 양반집 이었나 봅니다..."
56,해치 드라마,2019.05.01.,연도별 기억나는 드라마,풍운지가,연도별 기억나는 드라마(1년 이상 장편은 중복 표기) -1987 토지/사랑이 꽃피는... 그녀석/자백/해치/황후의 품격/닥터 프리즈너/더 뱅커/이몽/신과의 약속/슬플때...
57,해치 드라마,2019.05.10.,조선왕릉을 가다. 융건릉. #사도세자에 대한 #정조의 아버지생각. 어제는 어버이날이라서 더욱 짠하네요,공구리의 Happy Lif...,최근에 sbs에서 방영된 드라마 해치. 영조집권초기얘기랍니다 이인좌의 난. 소론과 노론^^. 이 와중에 사도세자도 같이 등장하는 지는 모르겤ㅅ네요 드라마 해치 (21대...
58,해치 드라마,2019.05.02.,근로자의날 데이트:) 종로 투어 했어요!(익선동-창덕궁-광장시장),라니의 소소한 일상...,요즘 남편과 애청한 드라마 해치가 생각나서 둘다 맞아맞아! 하면서 구경했어요~ 전하를 뒤로 한채 궁궐 내부 구경을 위해 이곳 저곳 구경! 날씨가 좋아서 색이 더 쨍하게...
59,해치 드라마,2019.05.08.,정일우 나이 키 군대 여전히 훈남이야,국민간판,이번에 드라마 해치에서 볼 수 있었는데요 워낙에 키도 크고 기럭지가 길어서인지 해치에서 어떤 옷을 입더라도 정말 멋있다는 생각이 들어요 워낙에 연기력은...
60,해치 드라마,2019.05.05.,임주환 이몽 쫑파티 참석,임주환 팬블로그 주...,ㅋㅋㅋㅋㅋ 마침 바로 근처에서 드라마 해치 종방연을 하고 있었던 모양이다. 한상진 배우님이 방문하셨던 모양. 부럽다...걍 부럽다.... 나도 좐시랑 사진 딱 한장만...
61,해치 드라마,2019.05.06.,사극에서 빛나는 그들,...쉬어가는 놀이터...,근래 해치와 녹두꽃을 보면서 정일우 윤시윤이 참 사극에 잘 어울린다 생각했다.... 두 작품 모두 보자보자 하는데 아직 실천이 안되고 있다.ㅋ 그래서 더욱 사극드라마로...
62,해치 드라마,2019.05.03.,"뮤지컬 킹아더 : 한지상, 이지수, 니엘, 리사, 이충주",Nail하는 BiNi의 공...,"공연 초반에는 드라마 해치랑 더블 스케줄이라 공연 회차가 적었는데 지금은 많이 늘었다~~ ㅎㅎ 연기하는 지상이>,< 도지광도 좋았지만 아직은 노래하는 지상이가 더..."
63,해치 드라마,2019.05.08.,2019. 04월 방영 드라마 시청률 순위,종합광고대행사 INT...,"그럼 지금 시작합니다~ # 월화드라마 4월 월화드라마의 시청률 1위는 SBS <해치>입니다. 그러나 <해치>의 종영 후, 5월에 1위 자리를 이어받은 작품은 MBC <특별근로감독관..."
64,해치 드라마,2019.05.06.,작은 하나까지 건강과 환경을 위해 노력하는 애릭스,애릭스에리카/다이나...,"얼마전 종영한 드라마 '해치', 상상의 인물 ‘해태’로 불리기도하는 해치는 시비와 선악을 구분한다는 상상의 동물인데 현실에서는 선악을 구분할 수 없습니다. 이..."
65,해치 드라마,2019.05.08.,"조선시대 사이코패스 살인마!! 임해군(이진), 권채, 창원군(이성), 순화군(이보), 청원위 한경록",비엥나의 블로그,"최근 방송되고 있는 화제의 드라마 '해치' 속 인물인 밀풍군 이탄, 훗날 영조가 되는 이금(정일우)과 왕위를 두고 다투는 이탄은 드라마 속에서 살인을 즐기는..."
66,해치 드라마,2019.05.02.,"정일우 ""인생작은 '하이킥'이지만...30대 인생캐는 '채치'의 영조"" [MD인터뷰](종합)",지구촌다문화 뉴스,정일우는 2일 오전 서울 강남구 논현동 모처의 한 갤러리에서 최근 종영한 SBS 월화드라마 '해치'(극본 김이영 연출 이용석) 종영 기념 인터뷰를 진행해 드라마 비화를...
67,해치 드라마,2019.05.12.,소라랑 어벤져스 엔드게임 보고 대청호 오백리길 드라이브 하고 유성온천문화축제 구경한날,별거 없는 블로그,다 해치우고영화보러 갔다 커피도 한잔 쭉쭉 약올리면 약 잘 오르는 소라빵... 찾아보니 권상우 김희선 등등 나온 드라마 전망데크까지만.. 전망대는 나무로 그늘이...
68,해치 드라마,2019.05.07.,"[공식입장] 이민호, 제대 후 차기작 확정…김은숙 작가의 ‘더킹:영원한 군주’",톱스타뉴스 공식 블로그 (T...,"월화드라마 ‘해치’ 정일우, 이민호가 보낸 커피차 인증샷 공개 “우리 민호 고마워” [HD테마] 2019년 3-4월 전역 앞둔 ★…‘임시완-이민호-지창욱’ 영화 ‘강남..."
69,해치 드라마,2019.05.04.,베 5 베 5,진리앞의 겸손,사극 드라마 < 해치 >에서 정일우와 권율이라는 배우를 알다. 고아라의 액션 2. 미친 사람과는 말이 통하지 아니한다. 정신장애인 중 5 분의 1 은 안락사해야할지도 ? 3....
70,해치 드라마,2019.05.11.,서울 근교 여행 용인 한택식물원 그리고 레이크 제네바,타임머신 타고 과거로 딱따...,"드라마를 보면서 작가들이 마감이 임박하면 머리를 쥐어짜며 시간 안에 쓰려고... 조인성과 송혜교 주연의 드라마 '그 겨울, 바람이 분다'의 촬영지로 로즈마리..."
71,해치 드라마,2019.05.03.,"정일우 ""논란 없었던 이유? 이순재 선생님 가르침 덕분""",아이들의 가장 안전...,정일우는 5월 2일 오전 서울 강남구 한 카페에서 진행된 SBS 드라마 '해치'(극본 김이영/연출 이용석 남태진) 종영 인터뷰를 통해 데뷔작인 시트콤 ‘거침없이 하이킥’...
72,해치 드라마,2019.05.08.,"천안 맛집 )삽겹살의 신세계를 보여준 삼육가, 두정동 회식장소로도 아주 좋아요!! 고깃집 강추",달콤부부의 알콩달콩 남매 ...,드라마 해치에도 삼육가가 제작지원을 했나보네요. 원산지 표지판도 주메뉴들은 다 국내산이라고 쓰여져 있네요. 역시 국내산이 믿고 먹을만 한것같아요. 어딜 가서...
73,해치 드라마,2019.05.06.,초면에 사랑합니다 등장인물 & 인물관계도 김영광 진기주 김재경 구자성 소개합니다,뚱이뚱이의 드라마&...,오늘 뚱이가 가져온 소식은 드라마 해치 후속 김영광 진기주 주연의 초면에 사랑합니다입니다 내가 미친 걸까요 두 여자를 사랑하고 있어요 내가 나쁜 걸까요 이 남자를...
74,해치 드라마,2019.05.09.,2019년 5월 1주차 드라마 순위,굿데이터,드라마 부문 1 위는 tvN ‘그녀의 사생활’이었다 . 극중 이별을 맞이한 박민영과... 8 위는 전주 대비 화제성 점수가 약 50% 상승하며 유종의 미를 거둔 SBS ‘해치’...
