,drama_title,date,blog_title,writer,contents
0,의사요한 드라마,2019.09.08.,의사요한 / 의학드라마의 탈을 쓴 휴먼 멜로 드라마,AFS Daudet,"하지만, 이번 드라마 의사 요한은, 최소한 이세영을 빼고는 설명할 수가 없을 것 같거든. 이 드라마가 장르의 혼선을 빚게 된 것 또한 그녀의 영향이 컸을거라 생각해...."
1,의사요한 드라마,2019.09.10.,드라마 리뷰 #43 <의사요한>,♥♡ZELOS의 문화 여...,"'의사요한(연출 : 조수원, 김영환 / 극본 : 김지운)' SBS 드라마 '의사 요한' 배우 '지성'이 나오는 드라마는 정말 믿고 봐도 될 정도로 연기를 잘하는 지성 배우님!!!!! 첫..."
2,의사요한 드라마,2019.09.14.,"2019 종영드라마 추천,의사요한 재방송!FEat.의사요한ost 피아노로",홍이와행복개늼의웰...,SBS드라마 의사요한 의사요한 시청률 10.2%를 찍으며 마무리! 최근에 지성눈빛앓이에 앓이앓이 했던 홍이가 추천하는 2019년 종영드라마 의사요한!!! 휴먼드라마 + 감동...
3,의사요한 드라마,2019.09.12.,[드라마] 의사 요한 - 현실은 더 끔찍하다....,"나에게 희망을 ""나희...",인생이 살얼음판이라는 사실을 알려주는 드라마 의사 요한.... 앞으로 펼쳐질 차요한의 활약이 궁금하고 현실과 얼마나 유사하게 고증되는지 관심이 증폭되고 있다.
4,의사요한 드라마,2019.09.15.,SBS 드라마 의사요한 음악참여,Feel Empathy,"의사요한 OST듣기 ▼ 의사 요한 OST 아티스트 Various Artists 발매 2019.09.07., (주)... 생명의 존엄성 등 평소 알지 못했던 부분들에 대해 생각해보고 알 수 있었던 드라마."
5,의사요한 드라마,2019.09.08.,드라마 '의사요한' 그리고 주식투자,100배 클럽!!,토요일 저녁 '의사요한'이라는 드라마가 종영되었다. 통증의학과 의사들의 이야기를 그린 휴먼메디칼 드라마이다. 나레이션이 인상적이였다. '고통은 살아 있다는...
6,의사요한 드라마,2019.09.09.,통증 드라마 의사 요한,열음이가말해요__걱...,#crps 로 투병 중인 으미입니다 오늘은 통증 관련 드라마를 포스팅하려고 합니다 저번 주에 종 방을 한 금토드라마 의사요한입니다 의사 요한은 통증센터에서 일어나는...
7,의사요한 드라마,2019.09.11.,드라마 '의사요한',선한 의도를 뛰어넘...,드라마 '의사요한' 의학드라마는 초반 몰입이 안되면 끝까지 보기가 힘든면이 있어 중간에 보다 안보는 경우가 많았던 것 같다. 의사요한은 의학 드라마이긴 하지만...
8,의사요한 드라마,2019.09.13.,희귀질환 '파브리병' 의사요한 등 드라마에 등장해 재조명/ 환경과건강,환경과 건강,"[현대건강신문=여혜숙 기자] 최근 의사요한, 검법남녀 등 드라마에 등장해 주목... 의사요한 드라마를 보면 극중 차요한(지성 분)은 환자가 파브리병일 확률이 0.00001..."
9,의사요한 드라마,2019.09.20.,배가본드 등장인물관계도 몇부작 원작 줄거리 재방송 넷플릭스SBS 금토드라마 의사요한 후속,에바그린님의 블로그,배가본드 등장인물관계도 몇부작 원작 줄거리 재방송 넷플릭스SBS 금토드라마 의사요한 후속 안녕하세요~오늘은 SBS 금토드라마 전작 의사요한 후속 방송으로 오늘...
10,의사요한 드라마,2019.09.10.,의사요한 이세영 드라마 속 숨은 블라우스맛집 팬츠 구두 악세사리코디,오 늘 도 스 페 셜 ...,"때문에 드라마를 보다 보면 캐릭터들만의 스타일링 달리 볼 수 있는데 #의사요한이세영스타일링 의사 가운 안에는 어떤 코디를 할까, 일상 생활에서는 어떻게..."
11,의사요한 드라마,2019.09.09.,"sbs 드라마 의사 요한 마지막 회_줄거리, 몇부작, 후속(배가본드)",당신이 내게 주는 의...,"ㅠ ㅠ (이제 무얼 보나..) 그래서 오늘은 떠나보내는 마음으로, 드라마 의사 요한 포스팅을 들고 왔습니다! 남주 지성 + 의학 드라마의 조합. 개인적으로 거부할 수 없는..."
12,의사요한 드라마,2019.09.08.,2019 SBS 드라마 <의사요한> 명대사/명장면,언제나 드라마와 함...,"바로 어제 종영된 지성, 이세영, 이규형 주연 드라마 '의사요한' 제발 해피엔딩이길 해피엔딩이길 원했는데 마지막까지 너무 완벽했던 드라마 같네요~ 메디컬 드라마는..."
13,의사요한 드라마,2019.09.09.,[2019][한드] 의사요한,잡다한 취미의 결과...,이번 지성의 드라마인 '의사 요한'은 다른 의사 드라마와는 달리 '죽음'과 '고통'을 전면에 세웠다고 생각해요. 다른 드라마가 살리는 것에 의의를 두었다면 이 드라마는...
14,의사요한 드라마,2019.09.09.,의사 요한(드라마),끄적거리다.,"의사요한 연출 조수원, 김영환 출연 지성, 이세영, 이규형, 황희, 정민아, 김혜은... 근데 우리나라 대부분의 드라마들이 그렇듯 사랑 이야기를 넣으면서 이야기의 끝은..."
15,의사요한 드라마,2019.09.17.,드라마 [의사 요한]에 대한 개인적인 감상,일상의 기록,"싶었던 드라마 [의사 요한]이었다. P.S. - 아스달 연대기에서 얄미운 조연 무광 역을 맡은 배우 황희가 여기서 의사 이유준으로 나왔는데, 생각보다 연기 너무 잘 하심...."
16,의사요한 드라마,2019.09.08.,"sbs 금토드라마 의사요한 Final episode - 이별은, 언젠가 다시 만나길 바라는",??이야기 (dltkdg...,#의사요한 #마지막회 #sbs #금토드라마 #의사요한16회 #16회 #16화 #EP16 #이별은 #언젠바 #다시 #만나길 #바라는 #이별은언젠가다시만나길바라는 #배우 #드라마 #연기...
17,의사요한 드라마,2019.09.11.,[드라마] 의사요한 _ 무통각증 의사의 통증환자 치료기,Too Many Thoughts,SBS 드라마 '의사요한' 이 9월 7일부로 막을 내렸다. 사실 드라마 초반부터 느낀 점을 작성해보고 싶었는데 마지막회가 지나가버린.. 블로그 작성도 쉽지가 않다 'ㅡ...
18,의사요한 드라마,2019.09.18.,의사요한 후속작 SBS드라마 배가본드 수지 이승기 주연 인물관계도,케이지랑 일본여행가...,의사요한 후속작 드라마 배가본드 수지 이승기 주연 인물관계도 의사요한 후속작으로 SBS새드라마 배가본드 티져영상이 공개되면서 많은 시청자분들의 관심으로...
19,의사요한 드라마,2019.09.08.,"(드라마, 의사요한 최종화) 이별은, 언젠가 다시 만나길 바라는..",마음의 강가,"사라질 고통에 대한 나의 마지막 처방이다 - 의사요한 16화 '이별은, 언젠가 다시 만나길 바라는' 중에서 - 참 진지했고 따뜻했으며 애처로웠다 드라마 의사요한 굿바이"
20,의사요한 드라마,2019.09.08.,"SBS 금토드라마 의사요한 16회 (최종회) “이별은, 언젠가 다시 만나길 바라는” 줄거리 / 리뷰 / 다시보기",★.Seize the day,SBS 드라마 의사요한 OST 추천 [MV] 백아연 - Just Go [의사요한 OST Part.5 (Doctor John OST Part.5)] https://youtu.be/IZ5igcDfR6I #드라마추천 #드라마리뷰 #의사요한 #지성 #이세영...
21,의사요한 드라마,2019.09.08.,"[의사요한] 16회 -이별은, 언젠가 다시 만나길 바라는- 줄거리",Welcome,다양하게 의학관련된 캐릭터를 맡았는데요 다음엔 어떤 모습일지 기대됩니다 병원장으로 나오는거 아니겠죠?ㅎㅎ #의사요한 #금토드라마 #sbs드라마 #의학드라마
22,의사요한 드라마,2019.09.10.,[의사 요한] 마지막회: 마지막 처방전...,키쓰쫑쫑 오늘도 청...,고통은 살아있다는 증거다 고통을 나눌 누군가가 곁에 있다면 고통의 무게는 줄고 ~ 용기는 더해질것이다 마지막 처방을 끝으로 이렇게 드라마 의사 요한 마지막회가...
23,의사요한 드라마,2019.09.12.,"죽을만큼 아파도 죽고싶은 사람은 없어요,<의사 요한>",+나르시시스트의 세...,"의사요한 연출 조수원, 김영환 출연 지성, 이세영, 이규형, 황희, 정민아, 김혜은... 그런 의사이다. 그러다보니 암말기 환자들을 자주 접하게 되고 여기에서 드라마는..."
24,의사요한 드라마,2019.09.08.,가슴 따뜻하게 해 준 드라마 '의사요한' 미소와 눈빛에 마음이 사르르...ㅋㅋㅋ 참 예쁜 미소~~,가득이심리상담센터...,가슴 따뜻하게 해 준 드라마 '의사요한' 미소와 눈빛에 마음이 사르르...ㅋㅋㅋ 참 예쁜 미소~~ 가슴으로 환자를 치료하는 것처럼... 나도 가슴으로 내담자를 치료하고...
25,의사요한 드라마,2019.09.15.,"드라마 <의사요한> 주제곡 ""Star""",추억의 음악 일상으...,"이번에는 2019년 7월부터 2019년 10월 사이에 방영한 SBS(서울방송) 드라마 ""의사요한""의 주제곡인 ""Star""를 소개하겠습니다. 가수 ""민서'가 노래를 불렀습니다. 의사..."
26,의사요한 드라마,2019.09.16.,"[남자오디션독백] 드라마 <의사요한> 중 '지성(차요한)' ""이 소리 들려? 언제 터질지 모르는 시한폭탄소리... 재깍재깍..""",R&J Art Company,오늘 소개해드릴 남자오디션독백은 드라마 <의사요한>에 등장하는 차요한(지성)의 남자오디션독백입니다. ★배우양성 프로그램★ 언제까지 연습만해? 이제...
27,의사요한 드라마,2019.09.08.,"휴먼닥터 드라마  의사요한' 종영  주제곡  "" 사피라K Way Back """,방랑자,"K) - Way Back [의사요한 OST Part.1(Doctor John OST Part.1)] 블렌딩 | [#] Vlending은 MV, 드라마OST를 유통 하는 공식 채널입니다...."
28,의사요한 드라마,2019.09.10.,트리튜브 - 이유 (의사요한 OST part.7),l u c i ' s w a f ...,신랑이 드라마 의사요한 OST를 냈다. 노래도 목소리도 참 좋다. 들으면 들을수록 이 가을에 딱이라는. 사실 드라마는 못봤는데 드라마도 인기가 많다고. 대박나기를!!...
29,의사요한 드라마,2019.09.09.,의사 요한 이세영 옷 SJSJ 싱글 자켓 코디,우주인과 짱가네 지...,의사 요한 이세영 패션 SJSJ 자켓 스타일 <출처: sbs 의사 요한 캡쳐> 안녕하세요 블로거 우주인입니다 :) 잇님들 드라마 의사요한 보시나요? 너무 재미있게 보던...
30,의사요한 드라마,2019.09.08.,<<의사 요한>>메시지 -누군가의 고통을 알아주고 나누는 것,연꽃 만나고 가는 바...,"병원을 다니며 고통받는 환자들을 봤기 때문인지 고통에 대한 의사요한의 태도를 보며 대리만족을 느끼게 했던 드라마 <<의사 요한>> 어제, 16부 마지막 방송을 보며..."
31,의사요한 드라마,2019.09.11.,드라마 SBS 의사요한 종방연 이규형 패션 이규형 시계 _ 루미녹스 (LUMINOX),스타패션 매거진,드라마 SBS 의사요한 종방연 이규형 패션 이규형 시계 루미녹스 (LUMINOX) 통증의학과 의사들의 이야기를 그린 휴먼 메디컬 드라마 SBS 의사요한 매주 금토마다 많은...
32,의사요한 드라마,2019.09.19.,"의사 요한(2019) - ""존엄사를 둘러싼 논쟁""",Jun's Blog,"2주 전에 종영을 한 SBS 드라마 ""의사 요한"". 주연을 맡은 지성은 뉴 하트 이후로 정말 오랜만에 의학 드라마로 돌아왔다. '이번 드라마도 뉴 하트 같은 느낌일까.....?'라고..."
33,의사요한 드라마,2019.09.08.,드라마 의사요한 15회 “떠나는 사람의 마음” 줄거리 / 리뷰 / 다시보기,★.Seize the day,드라마 의사요한 OST 추천 [MV] 민서 - Star [의사요한 OST Part.3(Doctor John OST Part.3)] https://youtu.be/MEyj_I38W7c #드라마추천 #드라마리뷰 #의사요한 #지성 #이세영 #SBS드라마...
34,의사요한 드라마,2019.09.17.,남자 드라마 독백 <의사요한> 요한 (지성),배우전문양성기관 A...,여자배우 #오디션 #남자독백 #여자독백 #상업영화오디션 #드라마오디션 #배역오디션 #성인오디션 #연기자오 #남자드라마독백 #의사요한 #의사요한독백 #지성독백
35,의사요한 드라마,2019.09.17.,"의사요한(SBS, 2019)",카린이의 꼼지락놀이,"정주행한 드라마 의사요한. 의학드라마는 피가 튀거나 수술장면들이 많이 나와 잘 못보는 편인데, 의사요한은 그런 장면들이 있어도 끝까지 봤다...."
36,의사요한 드라마,2019.09.19.,지성  : 의사요한 차요한,별하's 감성드라마&...,"역시 뭔가 평범하진 않는 캐릭터라 더 매력있었던 우리 차 교수님~ 드라마 의사요한이 끝난지는 아직 얼마 안됐지만, 문득 생각이 나서 포스팅을 해봅니다. ㅎㅎㅎ..."
37,의사요한 드라마,2019.09.12.,의사요한 지성 패션 옷 마지막회는 클럽 모나코 남자 가을 가디건 입었네요 !,DANIKANG 패션뷰티블...,"의사요한 마지막회가 방영했어요 여러분 후잉.... 엄마가 먼저 보던 작품이라 저는... 보던 드라마인데 아쉬운 마음이 생기더라구요 흑흑 여기서 특히 이세영, 지성..."
38,의사요한 드라마,2019.09.10.,너무진한키스신 혀 드라마 지성 의사요한 여진구,idhbab2님의블로그,"너무진한키스신 혀 드라마 지성 의사요한 여진구 줄게요 너무진한키스신 혀 드라마 지성 의사요한 여진구 보는곳 << 진짜 화질좋습니다 당장 보세요! 까지 ""2 ~ 3 년에..."
39,의사요한 드라마,2019.09.11.,의사요한 명대사 리뷰,♡ YOLO (You Only ...,최근에 종영한 갓지성표 드라마!! 의사요한 명대사!!이유준선생님이 가장 좋아하는 차요한교수의 띵언!! 한세소원클럽의 마통과 쌤들.. 벌써 그립다.....
40,의사요한 드라마,2019.09.09.,[드라마] 의사요한,가끔은 하늘을 보며...,지성이 나온다는 이유만으로 본 드라마 처음에는 신선하고 흥미진진했는데 뒤로 갈수록 조금은 흥미가 떨어졌다. 안락사에 대한 문제를 제기하다. 요즘 드라마에서...
41,의사요한 드라마,2019.09.16.,죽음과 고통 그리고 의사의 역할(ft.의사요한),"기록, 쓰다.","SBS 금토드라마 '의사요한' 의학드라마를 떠올리면 '#굿닥터', '#뉴하트', '#닥터 프리즈너', '#닥터스' 등이 있다. 내 기억에 남는 작품들은 이렇다. 의학드라마를 보면..."
42,의사요한 드라마,2019.09.09.,의사 요한에도 등장한 파브리병 증상과 원인은?,royalhifu1님의블로...,"매우 생소한 희귀질환 중 하나로, 최근 SBS 드라마 ""의사 요한""에도 등장하면서 사람들의 궁금증을 유발한 질환이 있습니다. 바로 ""파브리병(패브리-앤더슨 병)"" 이라고..."
43,의사요한 드라마,2019.09.09.,[이세영] SBS 의사요한 종방연 속 가을무드 가득한 패션 정보_코치(COACH),REUMXX DIARY,"지난 토요일 SBS 드라마 의사요한 종방연이 있었어요! 10%가 넘는 시청률을 기록하며, 인기를 얻은 드라마 의사요한 드라마에서 의사가운 입은 모습을 많이 보다가..."
44,의사요한 드라마,2019.09.08.,의사요한,담담이,찾아서 봐도 노래는 찾아서 들어본 적이 없네. 드라마 배경음악을 나오는 OST나 승윤이 관련 아니면 듣고 볼 일이 없었으니 하튼 의사요한 요한 캐릭터 좋고 재미있다
45,의사요한 드라마,2019.09.09.,의사요한 x 우주라이크커피 이벤트 1등 당첨됐어요ㅎㄷㄷ,마음의 강가,m.blog.naver.com 보내주기 참 진지했고 따뜻했으며 애처로웠던 드라마 의사요한이 16부로 끝이 났다 의사의 역할과 상당 부분 맞닿... m.blog.naver.com 드라마는 훈훈한...
46,의사요한 드라마,2019.09.16.,"믿고 보는 배우들의 총집합! ""의사 요한""",너와 나의 사이 : 너...,#드라마 #메디컬드라마 #의학드라마 #의사요한 #지성 #이세영 #이규형 개인적으로 드라마 '슬기로운 감빵생활'을 통해 알게된 배우 이규형 님이 드라마 '의사 요한...
47,의사요한 드라마,2019.09.18.,SBS 의사요한 후기 지성 이세영,J.H의 일상블로그,포스팅입니다 ㅋㅋ 드라마 리뷰를 하는걸 깜박해서ㅠㅠ 최근에 종영한 의사요한입니다! 7월달에 시작해서 9월달에 끝났어요ㅠㅠㅠ 미니시리즈는 짧아... 시청률은...
48,의사요한 드라마,2019.09.09.,의사 요한 오승현 옷 패션 *지고트 니트 & 스커트 멋스러워 (15회),carrot-lover,"오늘은 의사 요한 속 오승현 패션에 대해 알아볼께요 ~ 지성, 이세영 주연의 의학드라마 '의사요한' 저도 꾸준히 챙겨봤던 드라마 중 하나인데요 - 16회를 마지막으로..."
49,의사요한 드라마,2019.09.20.,이규형 : 의사요한 손석기,별하's 감성드라마&...,그래서 의사요한에 나오신다고 하셔서 환호했었네요.그리고 만족하면서 보기도 했고요 ㅎㅎㅎ 나중에 아픈 캐릭터여서 안타깝기도 했던 #드라마의사요한 속 #손석기...
50,의사요한 드라마,2019.09.09.,의사요한 마지막회 지성 패션 옷 가디건 #클럽 모나코,김초코의 치키차카초,SBS 드라마 '의사요한' 16회 마지막회(최종회) 지성(차요한) 패션 옷 남자 카키색 가디건 코디 #클럽 모나코 (Club Monaco) ! (feat. 가을 남친룩의 정석) 지난 주말 김초코의...
51,의사요한 드라마,2019.09.09.,의사요한 결말 멜로로 변질된 뻔한 스토리였다.,쾌도난마[快刀亂麻],기대가 컸다. 그리고 실망도 컸다. 의학드라마라는 이름으로 끝이 나버린 의사요한.. 결국 지성이라는 배우만 다시 한번 입증을 시켜줬다.
52,의사요한 드라마,2019.09.09.,의사요한 마지막회 이세영 공항 패션 아이템,oksssong님의블로그,주목할만한 드라마였다. 요 센스는 마지막회까지 돋보였는디 차요한한테... 이세영이 의사요한 마지막회에서 착용한 캐리어는 브릭스 벨라지오 브릭스의...
53,의사요한 드라마,2019.09.08.,"의사요한 16회 줄거리뷰, 안락사 환자에 지성의 마지막처방? 결말 호스피스 필요 이야기, 복성간질 환자 서윤아, 이세영 눈물연기, 아이보리백",퍼블릭에프알,강시영 의료사고-안락사 과거? 의무관 킬러 차요한 복수 이규형-신동미? #의사요한16회줄거리리뷰 #지성 #이세영 #드라마 #의사요한과거 #이규형 #신동미 #황희
54,의사요한 드라마,2019.09.08.,[의사요한]최종회!  3년만에 재회. 해피엔딩~~,알럽레이나의 일상을...,"레이나입니다, 어제 우리 지성님이 연기하신 의사요한 의 최종회가 있었는데요.. 아.. 우리 지성님 드라마는 16부작이 아닌 160부작이면 좋겠네요. 해피엔딩으로 끝나..."
55,의사요한 드라마,2019.09.09.,드라마 의사요한 속 복합통증증후군과 환상통,푸른 나라로,"드라마 의사요한 속 복합통증증후군과 환상통 보다 많은 장애인들이 고통에서 치료될 수 있었으면 에이블뉴스, 기사작성일 : 2019-09-06 17:11:21 SBS 금·토드라마..."
56,의사요한 드라마,2019.09.20.,'의사요한'김혜은안경 동탄LASH REST - 소프트한 다각형,아이디어 동탄by규박...,오늘은 SBS 드라마 의사요한에서 김혜은씨가 착용하신 LASH의 REST에 대해 포스팅 하려합니다. 가로 48mm 브릿지 22m로서 크지도 작지도 않은 적당한 사이즈의 모델입니다....
57,의사요한 드라마,2019.09.09.,"190906 SBS 의사요한 15, 16회 지성 보스턴 정보 <쌤소나이트 BREMER>",스타패션 매거진,"190906 SBS 의사요한 15, 16회 지성 보스턴 정보 <쌤소나이트 BREMER> 지난 7일 SBS 금토 드라마 의사요한이 마지막회였죠 ㅠㅠㅠ 6일 7일날 방영 한 15회 16회에서..."
58,의사요한 드라마,2019.09.09.,의사요한 종방연 이세영 패션 정보,EUNSUNGCOMPANY,:) 오늘은 의사요한 종방영에서 이세영씨가 착용한 패션 정보에 대해 알려드리려고 합니다 ㅎㅎ 의사요한 드라마에 빠져...
59,의사요한 드라마,2019.09.09.,드라마 의사요한 김혜은 안경 래쉬 안경 A-Type zero C.1,서울 마이스터안경,래쉬 신모델 의사요한 김혜은 안경 A-type Zero c.1 드라마 의사요한에서 김혜은님이 래쉬 안경 A-type Zero c.1 을 쓰고 나오셨네요 의사요한에서 김혜은님이 쓰신...
60,의사요한 드라마,2019.09.09.,의사요한 이세영 패션 SJSJ 싱글 자켓 스타일,데일리 혜니,의사요한 이세영 패션 SJSJ 싱글 자켓 스타일 통증의학과 의사들의 이야기를 그린 휴먼 메디컬 드라마 의사요한! 너무 재밌게 보던 드라마가 드디어 끝이 났어요ㅠㅠ...
61,의사요한 드라마,2019.09.10.,SBS '의사요한' 15회 정민아 블랙 캐리어_아메리칸 투어리스터,스타패션 매거진,SBS '의사요한' 15회 정민아 블랙 캐리어_아메리칸 투어리스터 저번 주 주말을 끝으로 종영한 드라마인 의사요한!! 여기서 정민아씨가 의사로 열현하셨는데요 15회...
62,의사요한 드라마,2019.09.08.,의사 요한 16회 줄거리 고통을 대하는 의사의 진정성 지성 한국컴백 지성 이세영 이규형 황희 신동미 김혜은,각성과 경계,지성의 잊지 못할거라는 종영소감말처럼 잊지못할 드라마중 하나일 것 같다. 지금까지 의사요한 사랑해주시고 검색해서 포스팅 봐주신분들 감사합니다. 우리 진정성...
63,의사요한 드라마,2019.09.08.,"의사 요한, 끝났다.",수술실이라 부르는 ...,어제 드라마 '의사 요한'의 최종회가 방영되었다. 드라마치고 빨리 끝난 건지 잘 모르겠다. 드라마를 몇 회까지 통상적으로 하는지 모르는 문외한인지라... 내가 본 '의사...
64,의사요한 드라마,2019.09.15.,의사요한 이세영 패션 오피스룩으로 슬랙스 팬츠 어때?(26회~28회),소소의 패션,의사요한 이세영 패션 오피스룩으로 슬랙스 팬츠 어때?(26회~28회) 이세영&강시영 블랙&베이지 슬랙스 옷 지금은 종영을 하였지만 드라마에서 이세영이 오피스룩으로...
65,의사요한 드라마,2019.09.10.,의사 요한 정민아 패션 @라빠레뜨 깐느로제 사첼백 가방 클래식해! (마지막회),carrot-lover,"오늘은 의사 요한 속 정민아 가방 패션에 대해 알아볼께요 - 의사 요한이 16회를 끝으로 막을 내렸내용 - 저의 금토 저녁을 책임지던 드라마였는데, 너무 빨리 끝나서..."
66,의사요한 드라마,2019.09.11.,[셀럽 패션] 의사 요한 마지막회 이세영 숄더백 @루에브르,딩딩이의 딩딩라이프,[셀럽 패션] 의사 요한 마지막회 이세영 숄더백 @루에브르 안녕하세요 딩딩이에요~ 오늘은 드라마 의사 요한 마지막회에서 배우 이세영씨의 숄더백을...
67,의사요한 드라마,2019.09.16.,0907 SBS 의사요한 정민아 티셔츠 루에브르 - (LOEUVRE),스타패션 매거진,0907 SBS 의사요한 정민아 티셔츠 - 루에브르(LOEUVRE) 너무나 재미있는 드라마 의사요한이 종방이 되었는데요 ㅠ 매력적인 배우 정민아씨도 함께 하셨죠!!!ㅎㅎ올...
68,의사요한 드라마,2019.09.08.,스틸러픽토/스카이캐슬안경/의사요한안경/최원영안경/픽토/다각형안경/티타늄안경/대구스틸러/동성로스틸러/PICTO/주지훈안경/연예인안경/김혜은안경,아이디어안경 동성로,"드라마에 나오자마자 전국적으로 대란이라고하죠, 블랙컬러가 한때 품절이 됐을정도로 큰 파장을 일으켰습니다 그러고 꾸준히 인기가있다가 이번에 또 의사요한에배우..."
69,의사요한 드라마,2019.09.09.,의사요한 이세영의 캐리어 ? 브릭스 !,"PR Trend, Wide_sty...",시청률 10% 로 성공적으로 종영한 SBS 메디컬 드라마 '의사요한' !! 의사요한에 출연한 강시영역의 이세영씨는 마지막회에서 병이 깊어진 차요한(지성)이 치료를 위해...
70,의사요한 드라마,2019.09.12.,다시보는 의사요한,새콤달콤민양이네,세심하기도해서 유심히 보게 되더라구요 그러다 본 #의사요한 두번째 보는건디 재미있네요 ㅎ #지성은 멋지고 이세영은 이쁘고 보면서 설레고 #다시보는 #드라마
71,의사요한 드라마,2019.09.09.,"의사요한 이세영 코디 속 싱글 자켓 스타일링, 가을나들이 갈때 입어야지 ♬","DAZZI, 다찌 블로그",의사요한 오랜만에 정말 재밌게 봤던 메디컬 드라마인데 저번주에 막방이었어요 ㅠㅠㅠㅠㅠ 드라마 보면서 이세영 스타일링이 눈에 띄었는데요 아무래도 평소에...
72,의사요한 드라마,2019.09.09.,[뮤트뮤즈] 세상에서 제일 예쁜 내 딸 김소연 / 의사요한 이세영 / 주말 드라마 속 여배우 가방은 어디꺼? 뮤트뮤즈 매거진백!!,YOOKKY GLOBAL,오늘은 주말 드라마 속 두 여배우 가방을 소개할게요!! 먼저 따끈따끈하게 종영한 의사요한에서 강시영 역을 맡은 이세영!! 이세영이...
