,drama_title,date,blog_title,writer,contents
0,더 뱅커 드라마,2019.05.25.,드라마 더 뱅커 내용 후기 스포,문화 생활 좋아하는...,극 드라마 더 뱅커 내용 공주지점에서 지점장인 노대호(김상중). 한수지(채시라)로부터 곧 대규모 지점 폐점이 있을 예정이란 소식을 듣고 팀원들과 함께 더 바짝 일을...
1,더 뱅커 드라마,2019.05.25.,19-04_심심할땐 영화/드라마_더 뱅커(드라마),#자손의 종합상사 이...,"이런 류의 드라마가 재미있다니. 미생의 경우, 상사에 관심이 있어 보기시작 했었고 더 뱅커의 경우, 은행에 관한 전반적인 업무를 다루기에 은행의 생리에 대해 알고..."
2,더 뱅커 드라마,2019.05.17.,더 뱅커 후속드라마  봄밤 등장인물소개해요,수정이블로그,구봉숙네 꺼는 제가 잘모르겠는데 마봉춘네 꺼는 더 뱅커와는 사뭇많이다른 감성멜로드라마 ' 봄밤 ' 이라는 드라마가 방송예정입니다.. 메인 주연배우가 어마무시...
3,더 뱅커 드라마,2019.05.17.,더 뱅커 31~32회를 보고,진실은 저 멀리에,다만 다음 번에 더 뱅커 작가나 피디가 만든 드라마는 되도록 피해야겠다는 생각이 든다. [뱀발] 1. 아니 박광수가 행장 기사 노릇을 하길래 노대호도 짤린 줄 알았잖아??...
4,더 뱅커 드라마,2019.05.20.,[남자독백대사] 강남연기학원의 엄선 ! 드라마독백 <더뱅커> - 강삼도(유동근),액트레인연기학원 공식블로...,남자독백대사 더뱅커 마지막 방송 강남연기학원이 엄선한 드라마독백 더뱅커 마지막회 <더뱅커> 강삼도(유동근) [서울연기학원] [서울연기아카데미] [강남연기학원]...
5,더 뱅커 드라마,2019.05.21.,[수목 드라마] 더 뱅커,Drama Love,강삼도 / 유동근 대한은행 행장. 이해곤 / 김태우 대한은행 부행장. 감사실 대한 은행 사람들 강삼도 주변인물 그 외 인물들 사진 출처 ; MBC <더 뱅커>
6,더 뱅커 드라마,2019.05.20.,골반근육운동 더뱅커 박광수가 알려주는 이지케이,망바줄까?,대표적으로 요.실.금이라던지 더 나아가서는 변.실.금 그리고 전립선에 문제가... 분들~ 드라마 더뱅커에서 나온 것 처럼 회사 화장실에서도 사용하실 수 있으시니까...
7,더 뱅커 드라마,2019.05.18.,[패션 3] 멜빵/서스펜더 (드라마 '더 뱅커'),지존동근,더 뱅커 중반부터 유독 눈에 띄는 서스펜더(멜빵) 멜빵사진만 모아보다보니 멜빵종류는 2가지닼ㅋㅋㅋㅋㅋㅋ 베이지색 무지 / 또는 글씨 써져있는 멜빵 첫 등장은 13...
8,더 뱅커 드라마,2019.05.18.,"더 뱅커 종영, 정의를 위한 은행원들의 이야기",harman road,"#올바른드라마, #착한드라마 한 편을 잘 마무리했다! (한수지 역할의 채시라 배우님께서 엔딩 인터뷰에 더 뱅커 2에 대한 언급을 하셨는데, 우연이었일까? 마지막회..."
9,더 뱅커 드라마,2019.05.17.,더뱅커 이해곤 김태우가 멋있었다,핀그루,"더 뱅커 연출 이재진 출연 김상중, 채시라, 유동근, 안우연, 신도현, 차인하... 한 드라마가 재미를 선사할 것이라고는 기대하지 않았는데 매회 놓치지 않고 보았다...."
10,더 뱅커 드라마,2019.05.20.,잦은소변 빈뇨증상 더뱅커에서 이지k로 예방하는법 알려주네요.,10초전...,빈뇨증상때문에 안 그래도 바쁜 하루 더 정신없이 보내고 계신 분 들도 계실... ^^ MBC수목드라마 더뱅커에 출연한 이지k~ 잦은소변 이나 #빈뇨증상 을 예방 할 수 있게...
11,더 뱅커 드라마,2019.05.17.,더 뱅커_마지막 회,Life is a journey,"요근래 챙겨보는 채널 2개 있었는데요 (시사이슈채널, 뉴스 제외) 바로 드라마 '더 뱅커'와 예능 '굿피플:신입사원 탄생기'입니다. 어제 더 뱅커가 마지막 방송을..."
12,더 뱅커 드라마,2019.05.18.,더 뱅커,tckhs님의 블로그,더 뱅커를 시리즈로 보고 있다. 케이블 방송에서 며칠 전에 종영한 드라마이다. 생각없이 TV 틀었다가 보게 된 드라마인데 은행권을 통한 사회의 전반적인 비리와...
13,더 뱅커 드라마,2019.05.18.,더뱅커 (mbc),silverstonec님의블...,우리를 더 굳건히 돌아가게 할 경제의 핏줄이 되어야 한다 왜냐하면 은행의 진짜 주인은 바로 당신이기 때문이다 ----------------------------- 드라마 목록 www.gajok.co.kr/drama....
14,더 뱅커 드라마,2019.05.17.,"MBC 더 뱅커 31,32회 채시라 귀걸이(아도르 ADORE / 아도르 주얼리 ADORE JEWELRY)",스타패션 매거진,"MBC 더 뱅커 31,32회 채시라 귀걸이 정보 -아도르 ADORE / 아도르 주얼리 ADORE JEWELRY- 다들 더 뱅커 마지막 회 보셨나요? 저는 워낙 재밌게 보던 드라마라 마지막..."
15,더 뱅커 드라마,2019.05.24.,MBC 더뱅커 종방연 채시라 패션!,THE M PUBLIC,금융 오피스 드라마 더뱅커! 돈과 권력이 모이는 거대 은행의 부정부패와 부조리에 맞서 정의를 지키기 위해 고군분투하는 이들의 이야기를 다룬 드라마인데요~! 출처...
16,더 뱅커 드라마,2019.05.24.,[여자독백대사] 강남연기학원의 엄선! 드라마독백 <더뱅커> - 도정자(서이숙),액트레인연기학원 공식블로...,여자독백대사 강남연기학원이 엄선한 드라마독백 <더뱅커> 도정자(서이숙) [서울연기학원] [서울연기아카데미] [강남연기학원] [강남연기아카데미] [성인연기학원]...
17,더 뱅커 드라마,2019.05.24.,"[MERLIC 멀릭 주얼리] 신도현 귀걸이, 더 뱅커 12화",MERLIC 멀릭,"[MERLIC 멀릭 주얼리] 신도현 귀걸이, 더뱅커 12화 안녕하세요~ 멀릭입니다 :) 배우 신도현님이 드라마 '더 뱅커'에서 착용하신 멀릭의 귀걸이..."
18,더 뱅커 드라마,2019.05.21.,"더뱅커 종방연 김태우 옷, 셔츠 패션은 티아이포맨!",숑스,안녕하세요 : ) 제가 너무 재밌게보던 드라마 더뱅커가 종방연을 했습니다 ㅜㅜ... 출처 : 일간스포츠 출처 : 일간스포츠 위하준은 셔츠를 바지 안으로 넣어 코디해 좀 더...
19,더 뱅커 드라마,2019.05.17.,'더뱅커' 김상중→유동근..완벽히 어우러졌던 드라마,까미와 짱이는 사랑...,"드라마 '더 뱅커'가 다양한 캐릭터들의 각기 다른 매력이 어우러지며 막을 내렸다. 16일 오후 방송된 MBC 수목드라마 '더 뱅커'(연출 이재진, 극본 서은정·오혜란·배상욱)..."
20,더 뱅커 드라마,2019.05.18.,드라마 ‘더 뱅커’(MBC)를 끝마친 배우 김병춘이 소신 있는 종영 소감,다옴스토리,#드라마 ‘ #더뱅커’( #MBC)를 끝마친 #배우 #김병춘 이 소신 있는 #종영소감 을... ‘더 뱅커’를 사랑해주신 시청자 여러분께 진심으로 감사드린다”고 전했다. 김병춘은...
21,더 뱅커 드라마,2019.05.17.,"'더 뱅커'에서는 한수지(채시라 분)가 노대호(김상중 분)와 이야기를, 강삼도(유동근 분)를 믿지 않는다고",최적화블로그꿀벌 나...,'더 뱅커' 채시라가 유동근에게서 등 돌렸다. 16일 방송된 MBC 수목드라마 ' #더뱅커'에서는 #한수지( #채시라 분)가 #노대호( #김상중 분)와 이야기를 하는 모습이 전파를...
22,더 뱅커 드라마,2019.05.28.,"더뱅커 마지막회 결말, 김상중..유동근 비리 잡아냈다.. '김태우 은행장!'",All about Review,"드라마 시청하는 내내 즐거웠습니다. ㅋㅋㅋ 양복핏도 어찌나 멋지시던지~~~~~~~~~~~~~ 애청자로, 이 정도 밖에 시청률이 안 난게 조금 아쉽긴하네요. ㅎㅎ / 더 뱅커..."
23,더 뱅커 드라마,2019.05.17.,"닥터프리지너, 더뱅커  막방 후기 , 절대그이 첫방 후기",몽글몽글한 하루,꺄 드라마는 수목이 진리죠 ㅋㅋㅋㅋㅋㅋㅋㅋㅋ 재밋는게 더 많...ㅋㅋㅋㅋㅋㅋㅋㅋ 앜 ㅋㅋㅋㅋㅋ 천사x발레리나 새로운 조합 ㅋㅋㅋㅋ 잘보겟습돠 #더뱅커 ( 요것두...
24,더 뱅커 드라마,2019.05.18.,[더 뱅커] 29~30회 강삼도 행장(유동근 님) 위주 캡쳐,지존동근,이 드라마 보면서 멜빵(서스펜더)에 뽐뿌온닼ㅋㅋㅋㅋㅋㅋㅋㅋ 양복에 어쩜 저렇게 포인트가 되는지ㅎㅎㅎㅎㅎㅎㅎ 예뻐예뻐 대한은행 창립 102주년 행사 그런데 시기가...
25,더 뱅커 드라마,2019.05.24.,MBC 더뱅커 종방연 채시라 패션!,MOON PALACE,"얼마전 종영한 금융오피스 드라마 더뱅커에서도 아주 원칙적이고 걸크러쉬가... 한번 더 볼 수 있었는데요~ 전체적으로 화이트, 베이지 톤 컬러로 맞춰 굉장히 깔끔하고..."
26,더 뱅커 드라마,2019.05.20.,190515 MBC 더 뱅커 채시라 나시 블라우스 수트 정보 - 발렌시아(valencia),스타패션 매거진,190515 MBC 더 뱅커 채시라 나시 블라우스 수트 정보 - 발렌시아(valencia) 드디어!! 채시라씨를 드라마에서 다시볼수 있다니요~~!!! 동서양을 따져도 그냥 절세...
27,더 뱅커 드라마,2019.05.27.,[여자독백대사] 강남연기학원의 엄선! 드라마독백 <더뱅커> - 도정자(서이숙) - 2,액트레인연기학원 공식블로...,여자독백대사 강남연기학원이 엄선한 드라마독백 <더뱅커> 도정자(서이숙) - 2 [서울연기학원] [서울연기아카데미] [강남연기학원] [강남연기아카데미] [성인연기학원]...
28,더 뱅커 드라마,2019.05.17.,'더 뱅커'의 대화를 나누는 부행장 한수지(채시라 )와 감사위원 노대호(김상중 ),BARON라이프,"16일 오후 방송된 MBC 수목드라마 '더 뱅커'(연출 이재진, 극본 서은정·오혜란·배상욱)에서는 #대화 를 나누는 #부행장 #한수지( #채시라 분)와 #감사위원 #노대호( #김상중..."
29,더 뱅커 드라마,2019.05.17.,"[더 뱅커 종방연 신도현]신도현,배우신도현,더뱅커,신도현인스타그램,신도현셀카,신도현키,신도현나이,신도현화보,신도현귀걸이,신도현주얼리,신도현협찬,신도현패션,겟미블링",GET ME BLING,안녕하세요:) 오늘의 셀럽 배우 신도현 씨 입니다 드라마 '더 뱅커' 종방연에서 이어링 '[SILVER925]Doughnut ring_m'을 착용해주셨어요! · · · 더 뱅커...
30,더 뱅커 드라마,2019.05.17.,"더 뱅커 - 강삼도의 마지막 선택, 인간이 악해지는 이유",골방구석탱이,조금 더 먼 이야기들도. 원작과 다른 것은 바로 한국 드라마이기 때문일 것이다. 은행을 넘어선 우리들 현실의 이야기다. 인간의 이야기다. 원래 드라마란 인간의...
31,더 뱅커 드라마,2019.05.17.,"조용히 막 내린 '더뱅커', 연기신들도 못 구했다",까미와 짱이는 사랑...,MBC 수목드라마 '더 뱅커'(극본 서은정 오혜란 배상욱 연출 이재진)가 16일 조용히 막을 내렸다. '연기의 신'이라 불리는 이들도 위기의 MBC를 구하지 못했다. '더 뱅커'는...
32,더 뱅커 드라마,2019.05.21.,[남자독백대사] 서울연기학원의 엄선! 드라마독백 <더뱅커> - 강삼도(유동근),액트레인연기학원 공식블로...,남자독백대사 서울연기학원이 엄선한 드라마독백 <더뱅커> 강삼도(유동근) [서울연기학원] [서울연기아카데미] [강남연기학원] [강남연기아카데미] [성인연기학원]...
33,더 뱅커 드라마,2019.05.17.,‘더 뱅커’ 노대호(김상중 분)와 한수지(채시라 분)는 육관식(안내상 분)을 찾아갔다. 도움을 청했다. “닥쳐라. 지금 어디서 책임전가냐”,BARON라이프,5월 16일 방송된 MBC 수목드라마 ‘ #더뱅커’ 31-32회 (마지막회/극본 서은정 오혜란... 지금 더 큰 사태를 앞두고 있다. 지난 일이 조금이라도 잘못됐다고 생각한다면 도와...
34,더 뱅커 드라마,2019.05.17.,김상중X유동근 '더 뱅커' 시청률 1위로 유종의 美 '7.1%',까미와 짱이는 사랑...,"17일 시청률 조사회사 닐슨코리아에 따르면 전날 방송된 MBC 수목드라마 '더 뱅커'는 5.4%, 7.0% 시청률을 나타냈다. 지난 방송이 기록한 3.6%, 4.3%보다 상승한 수치이자..."
35,더 뱅커 드라마,2019.05.17.,"""시청률 아쉽지만""‥'더뱅커' 유동근·김상중·채시라, 연기神들의 완벽 피날레",까미와 짱이는 사랑...,"지난 16일 MBC 수목드라마 '더 뱅커(연출 이재진/극본 서은정,오혜란,배상욱)가 32회를 끝으로 종영했다. '더 뱅커'는 대한은행 대기발령 1순위 지점장 노대호가 뜻밖에..."
36,더 뱅커 드라마,2019.05.17.,"‘더 뱅커’ 어부지리 수목극 1위 종영, ‘닥터 프리스트’ 종영효과",까미와 짱이는 사랑...,"시청률 조사회사 닐슨코리아에 따르면 5월 16일 방송된 MBC 수목드라마 '더 뱅커' 31, 32회는 전국 기준 시청률 5.4%, 7%를 각각 기록했다. 이는 지난 12회 방송분이..."
37,더 뱅커 드라마,2019.05.17.,종영'더 뱅커' 김상중 설득에 유동근 자진사퇴…해피엔딩,까미와 짱이는 사랑...,"전날 16일 방송된 MBC 수목드라마 '더 뱅커'에서는 강삼도(유동근 분)가 스스로 사퇴하는 모습이 전파를 탔다. 이날 이해곤(김태우 분)이 강삼도를 찾아가 ""합병은행..."
38,더 뱅커 드라마,2019.05.17.,"[‘더 뱅커’ 종영] 새 길 개척한 채시라, 청렴 감사 김상중…시청률 낮아도 캐릭터는 남았다",까미와 짱이는 사랑...,"‘더 뱅커’ 후속으로는 오는 22일부터 한지민, 정해인의 ‘봄밤’이 방송된다. 기존 오후 10시 방송되던 수목드라마 시간대에서 한 시간 앞당겨진 오후 9시에 방송된다."
39,더 뱅커 드라마,2019.05.17.,"[`더 뱅커` 종영] 김상중X유동근X채시라, 연기 神들의 열연…최고시청률 7.0% 아쉬운 성적",까미와 짱이는 사랑...,"지난 16일 종영한 MBC 수목드라마 '더 뱅커'(극본 서은정 오혜란 배상욱, 연출 이재진)는 대한은행 대기발령 1순위 지점장 노대호(김상중 분)가 본점의 감사로 승진해..."
40,더 뱅커 드라마,2019.05.21.,드라마 봄밤 인물관계도 등장인물 줄거리 몇부작 정해인 한지민 9시드라마 넷플릭스 동시방송,경이네 맛따라 향따...,예상됩니다^^ 더 뱅커 후속으로 드라마 봄밤 인물관계도와 등장인물을 살펴보고 줄거리와 몇부작인지도 알아봐야 겠지요. 봄밤은 알고 있다. 당신이 사랑에 빠지리라는...
41,더 뱅커 드라마,2019.05.25.,웹하드추천 도도파일 무료쿠폰 가져 가세요,love myself + your...,밀린 드라마도 보고 멍때링 예정입니다 ㅎㅎ 저는 더뱅커 다시 몰아보고 있는데요 ㅎ 여러분들은 어떤 장르가 땡기시나요 !? ㅎㅎㅎ 오늘 하루 정주행 하실 분들을...
42,더 뱅커 드라마,2019.05.17.,"서스펜스 스릴러 연극 '미저리' 캐스팅 공개! 김상중, 안재욱, 길해연, 김성령 타이틀 롤 확정!",연극 미저리,최근 MBC 드라마 <더 뱅커>에서 주연으로 열연 중인 그는 바쁜 일정에도 불구하고 미저리에 대한 각별한 애정을 드러내며 출연을 결심했다. 브라운관과...
43,더 뱅커 드라마,2019.05.23.,노트북가방/남자가방) '에버키' 타이탄 EKP120 디테일한 리뷰,방송인 'MULDLYN'의...,"에버키는 고가의 노트북 및 IT기기, 여행, 비즈니스맨들에게 초점을 맞춘 프리미엄 기능성 가방 브랜드입니다 ?˘?˘? 참고로 에버키는 드라마 더 뱅커에..."
44,더 뱅커 드라마,2019.05.20.,[5월 셋 째주] 신곡 노래 추천,Maybe this could b...,더뱅커 OST Part 5 아티스트 딕펑스(Dickpunks) 발매일 2019.05.15. New Edition... 보이스3 (OCN 토일드라마) OST - Part 2 아티스트 가은(GA EUN) 발매일 2019....
45,더 뱅커 드라마,2019.05.24.,[송씨네] '어린 의뢰인 (My First Client)' 무대인사 동영상,김천혁신도시부동산,"예'드라마에서는 달리 극중의 캐릭터가 그런가 조금은 무섬무섭... 그런데, 실제론... 더뱅커,국민여러분!,닥터프리즈너,회사가기싫어,녹두똧,이몽..."
46,더 뱅커 드라마,2019.05.30.,드라마 봄밤 몇부작 시청률 인물관계도 줄거리 후속 넷플릭스 밥 잘 사주는 예쁜 누나 작가,달달하고 싶은 마돌...,목요일 드라마 봄밤 이라는 작품에 대해서 소개하겠습니다 봄밤은 2019년 2분기 작품으로 더 뱅커가 종영이 된 다음 MBC와 글로벌 플랫폼인 넷플릭스에서 2019년 05월...
47,더 뱅커 드라마,2019.05.25.,"봄밤 제작발표회 한지민 귀걸이,구두 패션:무드나잇,블랙뮤즈",소소의 패션,"봄밤 제작발표회 한지민 귀걸이,구두 패션:무드나잇,블랙뮤즈 이정인&한지민 오렌지 컬러 구두,실버 귀걸이 스타일 드라마 더뱅커 후속으로 새롭게 시작하는 MBC..."
48,더 뱅커 드라마,2019.05.20.,봄밤 인물관계도 등장인물 줄거리 : 정해인 한지민 김준한,패션블로거 SONODAN...,"수목드라마 봄밤, 더 뱅커 후속으로 방영 예정인데요~ 기존의 드라마들과는 다르게 밤 9시로 옮겨진 시간에 방송 예정이라 좀 더 새로운 느낌을 주는 것 같아요..."
49,더 뱅커 드라마,2019.05.18.,2019년 5월 넷째 주 금주의 방영 예정 / 신작 드라마 소개 봄밤 단하나의사랑 한지민 정해인 신혜선 김명수,내일의 드라마,MBC 수목드라마 '더뱅커... blog.naver.com 금주의 신작 소개는 여기서 마치고!... @tomorrows_drama_ 팔로우 해주시면 더 다양한 게시물을 보실 수 있으니 꼭!!...
50,더 뱅커 드라마,2019.05.29.,"채시라 & 이수경 & 설인아 수트는 어디꺼? 에토르(ETTOL) 수트, 여자 수트, 여성 정장 세트로 매력적",청바지에 흰티가 어...,좀 더 캐주얼한 무드로도 연출 가능해 활용도까지도 백점만점! : ) 오랜만에 ‘더뱅커’를 통해 안방극장에 컴백해 강렬한 걸크러쉬 매력을 선보였죠~? 이 드라마...
51,더 뱅커 드라마,2019.05.17.,드라마 닥터 프리즈너 - 남궁민 복수 성공+자체 최고 시청률 '유종의 미',윌리엄오닐의 즐거운...,"등 오랜만에 성과를 거둔 KBS 미니시리즈라는 평가를 받았다. 같은 시간대 방송한 MBC ‘더뱅커’는 3.6%, 4.3% 시청률로, SBS ‘절대그이’는 2.1%, 2.4% 시청률로 집계됐다."
52,더 뱅커 드라마,2019.05.17.,"<절대 그이> 리메이크 1화&2화 리뷰 - 여진구, 방민아, 홍종현",라니의 일기,최근 《리갈하이》 《하늘에서 내리는 1억개의 별》 《더 뱅커》 《최고의 이혼》 등등 일본에서 흥했었던 드라마들이 한국에서 재탄생하는 드라마들이 많이...
53,더 뱅커 드라마,2019.05.22.,후이엔이 2019 상반기 결산_작품 총 19편,후엔터테인먼트 루동...,"웹드라마 등 송민형 배우 SKY캐슬, 나쁜형사, 막돼먹은 영애씨 시즌 17, 빅이슈, 더뱅커 올해 상반기 송민형 배우님은 돋보이는 활동을 하셨습니다. 시청률 1위의 SKY..."
54,더 뱅커 드라마,2019.05.17.,대진제국1 19~20회를 보고,진실은 저 멀리에,더 뱅커를 보느라 어제랑 그제는 대진제국을 못봤지만 그래도 22회까지는 이미... 이토록 이상적인 군신지간을 보는 건 드라마에서도 그리 흔한 게 아니라서~ [뱀발]...
55,더 뱅커 드라마,2019.05.22.,"[한드] MBC 수목 드라마 <봄밤> 한지민, 정해인, 김준한 주연 / 인물관계도 및 몇부작 인지 알아봐요~",경북대 고시텔 ♡ L...,"드라마 <더 뱅커> 후속으로 방송되는 드라마 <봄밤> 5월 22일 밤 9시 첫방송 되며, 총 32부작으로 2회연속으로 방송됩니다. 방송정보 포스터 인물관계도 등장인물 이정인..."
56,더 뱅커 드라마,2019.05.25.,주말에 보는 <회사 가기 싫어>,Nije 블로그,된 드라마! 왠지 느낌이 플레이리스트의 <하찮아도 괜찮아> 같을 거 같았다.... 쓰다 보니 그 여주는 또 MBC <더 뱅커>에 나왔었다. 영상 출처 : 유튜브...
57,더 뱅커 드라마,2019.05.29.,경기도 수지 원두커피머신렌탈 추천 일진자판기!!,Better thing are c...,"수,목 드라마 더뱅커에도 일진자판기를 소품지원하고있답니다 여러 유명배우 유동근,채시라,김태우,안내상,서이숙 님 등등 멋진 연기를 보여준 더 뱅커 드라마에서도..."
58,더 뱅커 드라마,2019.05.22.,봄밤 등장인물 & 인물관계도 한지민 정해인 김준한 소개합니다,뚱이뚱이의 드라마&...,오늘 뚱이가 가져온 소식은 더 뱅커 후속 한지민 정해인 김준한 주연의 봄밤입니다 원래는 드라마 방영 시간이 10시 인데 MBC는 9시에 방송 시간을 옮겨 9시에 방영을...
59,더 뱅커 드라마,2019.05.18.,녹두꽃 13~14회를 보고,진실은 저 멀리에,아무리 생각해봐도 참으로 미묘한 드라마라 보면서도 긴가민가 그 자체랄까요?... 이전 리뷰에도 썼지만 정현민 작가님은 차라리 더 뱅커나 의군의 집필을 맡았어야 했고...
