,drama_title,date,blog_title,writer,contents
0,용왕님 보우하사 드라마,2019.07.22.,MBC드라마 용왕님 보우하사 '심청이 심청 컬러 인터뷰 배우 정영도',프리랜서아나운서 정...,얼마 전 종영한 MBC드라마 용왕님 보우하사 심청 컬러 대표 심청이 인터뷰 씬 촬영하고 왔습니다~ 이소연 선배님을 처음으로 뵈었습니다 ㅎㅎ 너무나 미인이셨고요~ 장...
1,용왕님 보우하사 드라마,2019.07.22.,"[Dell'Est] Celeb's Pick ! MBC드라마-용왕님 보우하사 121회 마지막회, 심청이(이소연) 가방, 델레스트 트렁키노 멀티푸시아",델레스트 (DELL'EST...,지난 7월 12일 mbc드라마 '용왕님 보우하사'가 121회를 마지막으로 막을 내렸습니다. 극 중 이소연 배우님은 세상의 수천 가지 색을 읽어내는 '절대 시각'을 가진...
2,용왕님 보우하사 드라마,2019.07.25.,용왕님 보우하사용왕님 보우하사 드라마에 퍼스 보면 반할꺼예요,사랑의 도가니,용왕님 보우하사용왕님 보우하사 드라마에 퍼스 보면 반할꺼예요 안녕하세요 카라지니입니다. 주말 아침은 평소보다 여유가 있죠?
3,용왕님 보우하사 드라마,2019.07.26.,용왕님 보우하사용왕님 보우하사 인물관계도  우리지금만나,눈물 많은 하루방,"확인해보니 이드라마는 비밀과 거짓말의 후속으로 방영될 예정이고, 향후 말씀드렸듯이 오늘 첫방송이라고 합니다. 용왕님 보우하사 몇부작인지도 체크를 하고 보니..."
4,용왕님 보우하사 드라마,2019.07.15.,용왕님 보우하사 121회 마지막회 이소연 블라우스 패션!,EUNSUNGCOMPANY,오늘은 MBC 일일드라마 용왕님 보우하사 마지막회의 이소연씨 패션을 알아보도록 할게요 :) 어느 덧 마지막회를 방송해버린 용왕님 보우하사! 그동안...
5,용왕님 보우하사 드라마,2019.07.15.,용왕님 보우하사 OST 듣기/MP3/뮤직비디오/뮤비/이소연/재희/조안/김형민,블렌딩 :: 보는 음악...,"일일 드라마 <용왕님 보우하사>!! <용왕님 보우하사>가 지난 주 12일 마지막 방송을 했습니다ㅠㅠ 약 7개월동안 시청자들에게 사랑, 감동, 힐링 등 여러 가지..."
6,용왕님 보우하사 드라마,2019.07.23.,"용왕님 보우하사명품배우 재희, 웃음꽃 활짝 유쾌한 촬영장 분위기  이게 말이돼",빵집 부스러기,"용왕님 보우하사명품배우 재희, 웃음꽃 활짝 유쾌한 촬영장 분위기 이게 말이돼... 그린 드라마다.재희는 극중 천재 피아니스트로부터 멋진 폭발의 주보그룹 회장이 된..."
7,용왕님 보우하사 드라마,2019.07.25.,용왕님 보우하사용왕님 보우하사는 몇부작 잘살아보세,튀김 돌방석,용왕님 보우하사는 몇부작 잘살아보세 여러분 안녕하세요~ 주말이지만 모두 잘 지내시죠?나는 오랫만에 폐가 됩니다. 오늘아침 헬스를 했는데 갑자기 이 드라마를...
8,용왕님 보우하사 드라마,2019.07.13.,용왕님 보우하사는 몇부작일까요? 궁금하시죠 ㅎㅎ,키도우의 블로그,아침드라마의 성격을 가지고 있어 재밌는것 같은데 한번 같이 가보실까요? 용왕님 보우하사는 사실 비밀과 거짓말의 후속으로 19년1월부터 19년 7월까지 방영한 mbc 일일...
9,용왕님 보우하사 드라마,2019.07.15.,[재희] MBC '용왕님 보우하사' 118-119회 속 이태리 직수입 남성복 비오비(B.O.B) 제품 정보 입니다,Publicity Agency D...,평일 저녁 시간에 항상 함께 하던 드라마였는데 끝났다니 저까지 괜히 아쉽네요ㅠㅠ '용왕님 보우하사'에 재희 씨께서 비오비 셔츠를 착용해주셨어요^^ 어떤 셔츠를...
10,용왕님 보우하사 드라마,2019.07.22.,용왕님 보우하사 이소연 패션 센스있어! @조셉앤스테이시 가방,RAC의 스타일수다,다들 용왕님 보우하사 보시나요~? 저는 종방하면 정주행하려구요! 히히 드라마 방영 내내 이소연님의 센스있는 코디로 화제가 많이 되었었죠! 되게 심플하면서도...
11,용왕님 보우하사 드라마,2019.07.15.,"용왕님 보우하사 이소연, 이소연 블라우스는 어디꺼?",Mirl Trend,오늘은 이소연씨가 드라마 용왕님 보우하사에서 착용하신 블라우스 정보 알려드릴게요! 용왕님 보우하사 이소연씨가 화이트 자켓속에 매치한 블라우스는 쁘렝땅...
12,용왕님 보우하사 드라마,2019.07.16.,‘용왕님 보우하사’ 감옥에서 나온 여지나는 부모님과 딸... - 인천일보,뉴스브릿지,인천일보 - 2019-07-16 15:06 [인천일보=온라인뉴스팀03] 12일 방송하는 MBC 일일드라마 ‘용왕님 보우하사-최종화’에서는 학규(안내상)이 1년 간 유학생활을 마치고...
13,용왕님 보우하사 드라마,2019.07.13.,"명품배우 재희,MBC ‘용왕님 보우하사’종영소감 밝혀",다경뉴스(www.dkitn...,"[다경뉴스=백두산 기자]배우 재희가 가족이엔티 공식 인스타그램(@family__ent)을 통해 MBC 일일드라마 ‘용왕님 보우하사’(극본 최연걸, 연출 최은경/김용민)의 종영을..."
14,용왕님 보우하사 드라마,2019.07.15.,용왕님 보우하사 이소연 패션정보 공유합니다~!,Mirl Trend,드라마 용왕님 보우하사 속 이소연 패션정보 알려드릴게요 이소연씨가 사진을 보는 장면에서 착용하신 네이비색 블라우스는 쁘렝땅(PRENDANG) 브랜드 제품이에요...
15,용왕님 보우하사 드라마,2019.07.16.,#모두다꿍따리#mbc 아침드라마가 화제가 된 이유는?,소소한 이야기~,mbc 저녁 일일드라마 '용왕님 보우하사'의 후속으로 알려졌으나 mbc 저녁 일일드라마가 폐지되면서 아침에 방송하게 됐네요. 아침드라마는 늘 막장 드라마가 많았는데...
16,용왕님 보우하사 드라마,2019.07.13.,"활동지원 휴게시간 1년, 최중증 여전히 방치/농인 투자사기 행복팀 일당 58억원 배상 판결/장애인권리협약 10년, 정부정책 수박겉핥기/휠체어사용 장애인 배려 돋보인 사문진유람선 [에이블뉴스]",조순익 블로그,"4위MBC 드라마 ‘용왕님 보우하사’ 속 시... 5위활동지원 휴게시간 1년, 최중증 여전히... 6위장애엄마 ‘특수성’ 반영한 양육서비... 7위노선영 작가의 삶이 사회에..."
17,용왕님 보우하사 드라마,2019.07.16.,모두 다 쿵따리 몇부작 제목 특이해~,U_riR 톡톡 블로그,7시 드라마를 폐지했더라구요.. 용왕님 보우하사는 첫방송을 봤는데 이소연씨가 무슨 씨앗을 심고..? 근처 연구소에선 신기한 씨앗을 연구하고..? 쨌든 별로 재미가...
18,용왕님 보우하사 드라마,2019.07.26.,주름개선 화장품 세트 [에스까로제] 얼라이브 리얼스네일 스킨 케어 3종 세트,걸리적거림 없는 자...,"태양의 계절에 나왔던 바로 그 제품이죠~~ 이외에도 용왕님 보우하사,퍼퓸,모두다 쿵따리,세상에서 제일예쁜 내딸등 드라마에 자주 소개되었던 리얼 달팽이 화장품을..."
19,용왕님 보우하사 드라마,2019.07.22.,"여름아 부탁해 59회  나혜미 귀걸이는 프리모떼 제품입니다! (나혜미패션, 여름아부탁해나혜미, 나혜미헤어)",primaute님의블로그,일일드라마 용왕님 보우하사 99회 이소연씨가 프리모떼 귀걸이를 착용... blog.naver.com 여름아 부탁해 59회 나혜미씨가 착용하신 귀걸이는...
20,용왕님 보우하사 드라마,2019.07.23.,"연예인들이 먼저 선택한 그  가방, 디어니스 스퀘어 미니 컬렉션에 대해 알아보자!/dierneas square mini /서현가방/문가영가방/셀럽아이템/연예인가방",DIERNEAS 공식 블로...,"한다솔씨 ,용왕님 보우하사의 이슬아씨, 최근에 성공적으로 종방한 드라마 단하나의 사랑 우희진씨 등등 많은 드라마에서 스타들과 함께한 디어니스 스퀘어..."
21,용왕님 보우하사 드라마,2019.07.15.,모두 다 쿵따리 인물관계도 몇부작 박시은 김호진 나이,http://satto.tisto...,"모두 다 쿵따리는 용왕님 보우하사의 후속으로 방송될 예정이었으나 MBC일일드라마로 타이틀이 변경되었는데요, 변경된 이유는 MBC 저녁 일일드라마가 이제..."
22,용왕님 보우하사 드라마,2019.07.25.,이소연의 꽃향기 날 것 같은 오피스룩 패션 '오드'로 완성,홍보대행사 도트컴퍼...,얼마전 종영한 용왕님이 보우하사! 내용도 볼만했지만 여주인공 이소연 패션을... 백밴딩 핀턱 드레싱 와이드 슬랙스 여기까지 배우 이소연 드라마 패션 정보...
23,용왕님 보우하사 드라마,2019.07.25.,달팽이크림 효과 건성 수분크림 에스까로제 추천해요.,Hello D:),그리고 MBC에서 오후마다 하는 일일드라마 '용왕님 보우하사'에서도 예쁜 화장대 위에 살포 시 올라와 있답니다. 에스까로제 3종을 모두 사용했을 때 임상 세부결과를...
24,용왕님 보우하사 드라마,2019.07.22.,남성건강식품 :: 남성 호르몬 음식 음양곽 먹인 달팽이로 만든 S-포르테,오늘 하루,"엄마가 자기선물은 없냐고 서운해하셨거든요 KBS2 주말드라마 세상에서 제일 예쁜 내 딸, MBC 일일드라마 용왕님 보우하사, KBS2 월화드라마 퍼퓸에도 나왔던 제품으로..."
25,용왕님 보우하사 드라마,2019.07.23.,기력보충음식으로 무더운 여름나기. 달팽이액기스 달팽이비바체,슈메의 세상을 보는...,KBS 주말드라마 세상에서 제일 예쁜 내딸 및 MBC 일일드라마 용왕님 보우하사 등에도 나오는 제품이네요. 부모님 건강식품으로 드리려고 찾아본 제품입니다....
26,용왕님 보우하사 드라마,2019.07.24.,중년 여배우 패션은 모에 옷들로 완성★,뽀로롱 Daily life~,얼마전에 종영한 용왕님 보우하사에서 임지은도 모에 의상들을 자주 입고나왔던... 그녀들이 선택한 모에 옷들 저도 매장가서 구경해봐야겠어요~ *_* [출처: 드라마 캡쳐]
27,용왕님 보우하사 드라마,2019.07.25.,중년 여배우들이 사랑하는 옷 브랜드는? 모에 MOE!,we are the fashion...,같네요~ 용왕님 보우하사 임지은의 깔끔하면서 세련된 패션을 책임졌던 옷들도... MOE 모에 옷들로 여배우같은 세련된 패션 완성하시길 바래요~~ [출처: 사진속 드라마 캡쳐]
28,용왕님 보우하사 드라마,2019.07.23.,여성건강식품 달팽이액기스 효능 S-비바체 알아보고 먹자!,오늘도 다블리는 치...,세상에서 제일 예쁜 내 딸과 용왕님 보우하사랑 퍼퓸 등 여러 드라마의 협찬을 받았더라고요. 제가 즐겨 보던 프로는 아니었지만.. 왠지 방속으로도 나온다는 것이...
29,용왕님 보우하사 드라마,2019.07.25.,중년 여배우들이 선택한 옷 브랜드는 바로 모에 MOE!,RAC의 스타일수다,최근 드라마에서 활약중인 중년 여배우들의 의상을 모아보니 MOE 모에 브랜드... 종영한 용왕님 보우하사 속 임지은의 패션을 책임졌던 옷들도 다 모에 옷으로 롱한...
30,용왕님 보우하사 드라마,2019.07.16.,뒤늦은 매실 담그기^^,세아이와 강쥐들과 ...,"조금만 조용히 해주시면..통통 소리만 안나게 해주시면 될거같아요.."" 으악~우리집 들어 오는 길에서 드라마를 찍는단다 'mbc 용왕님 보우하사'라나 뭐라나~~ TV를 잘..."
31,용왕님 보우하사 드라마,2019.07.17.,이소연 레드 원피스 넘 예쁘네요~ 이소연 베스띠벨리 원피스,☆ 스타패션 블로그...,종영한 드라마 용왕님 보우하사 에서 이소연이 착용한 레드 원피스 넘 예뻐요~~ 넥라인도 V넥인데 특이하게 한겹 더있어서 노출에 예민하신 분들도 입기 좋은...
32,용왕님 보우하사 드라마,2019.07.22.,아이디어 부산시청점: 시크릿크라운(secretcrown) 선글라스: luis 9009,아이디어 부산시청점,"MBC드라마 용왕님이 보우하사에서 민찬기배우가 착용하고 나왔는데요.. 출처: 시크릿크라운 홈페이지 디자인이 심플해서 남성,여성분 모두에게 잘 어울리는..."
33,용왕님 보우하사 드라마,2019.07.15.,불교의 학파와 종파란 무엇일까?,임기영 불교연구소,불교 교리의 전개 ▣ 목 차 ▣ ♡ 불교 교리의 전개 ♡ 중관 ♡ 유식 ♡ 천태 ♡ 화엄 ♡ 정토 ♡ 밀교 ♡ 선 ○ 불교 교리의 전개 연기법이 부처님 가르침의 핵심이란...
34,용왕님 보우하사 드라마,2019.07.18.,직장인대출 숨이 턱턱 막힐 때,재횽이의정보,일일드라마 형성 깔끔 예쁨 카페에 정무심 역 넓고 훨씬 차이 안녕하세요.. 질을... 용왕님 보우하사 세대 예 빈이 왔네요.. 임산부는 있어서 작히 만져보면 적당한 한발...
35,용왕님 보우하사 드라마,2019.07.25.,용왕님 보우하사용왕님 보우하사 재희  늦음 없어~,무서운 매미,"용왕님 보우하사용왕님 보우하사 재희 늦음 없어~ 꺄오, 오랫만의 드라마로 이소연과 재희! 탄탄한 스토리는 물론 패션그룹에서 일어나는 여러가지 에피소드를 함께..."
36,용왕님 보우하사 드라마,2019.07.20.,"[방탄소년단 정국]●▒·⊇드라마 대사 속 '방탄소년단 정국' 언급 화제 집중! ""얼굴 천재 증명""",shilajhuang님의블로...,"""얼굴 천재 증명"" 방탄소년단 정국 MBC 일일 드라마 '용왕님 보우하사'에서 방탄소년단 정국이 드라마 대사에 언급돼 팬들의 놀라움과 환호를 자아냈다...."
37,용왕님 보우하사 드라마,2019.07.26.,레드슈즈 강추!!,맛나님의블로그,"net 거부할 수 없는 비디오의 매력 드라마 : 월화, 수목, 금주, 일일 드라마 더보기 HD 제100회19/06/13 용왕님 보우하사 2019-06-14 970K HD 제33회19/06/13..."
38,용왕님 보우하사 드라마,2019.07.15.,영화사이트 좋은곳 안내,wodbs77777님의블로...,"net 거부할 수 없는 비디오의 매력 드라마 : 월화, 수목, 금주, 일일... 퍼퓸 2019-07-10 450K HD 제117회19/07/08 용왕님 보우하사 2019-07-09... www.mulio.net"
39,용왕님 보우하사 드라마,2019.07.13.,무료로 영화를 다시볼수있는곳을 추천해드릴게요~,승희님,"최신영화,드라마,예능뿐만아니라 많은 유명한 영화도 있으니 심심할때... 퍼퓸 2019-07-10 447K HD 제117회19/07/08 용왕님 보우하사 2019-07-09... mulio.net"
40,용왕님 보우하사 드라마,2019.07.26.,돈 워리,맛나님의블로그,"net 거부할 수 없는 비디오의 매력 드라마 : 월화, 수목, 금주, 일일 드라마 더보기 HD 제100회19/06/13 용왕님 보우하사 2019-06-14 970K HD 제33회19/06/13..."
41,용왕님 보우하사 드라마,2019.07.24.,주전장 강추!!,맛나님의블로그,"net 거부할 수 없는 비디오의 매력 드라마 : 월화, 수목, 금주, 일일 드라마 더보기 HD 제100회19/06/13 용왕님 보우하사 2019-06-14 970K HD 제33회19/06/13..."
43,용왕님 보우하사 드라마,2019.07.23.,기생충 최신 고화질,맛나님의블로그,"net 거부할 수 없는 비디오의 매력 드라마 : 월화, 수목, 금주, 일일 드라마 더보기 HD 제100회19/06/13 용왕님 보우하사 2019-06-14 970K HD 제33회19/06/13..."
44,용왕님 보우하사 드라마,2019.07.15.,"아이유,여진구 - 호텔델루나 무료다시보기.무료영화사이트 !!!",승희님,"최신영화,예능,드라마 모두 무료로 볼수있는곳 !! ↓↓↓↓↓클릭 mulio.... 퍼퓸 2019-07-10 450K HD 제117회19/07/08 용왕님 보우하사 2019-07-09... mulio.net"
45,용왕님 보우하사 드라마,2019.07.23.,천로역정: 천국을 찾아서,맛나님의블로그,"net 거부할 수 없는 비디오의 매력 드라마 : 월화, 수목, 금주, 일일 드라마 더보기 HD 제100회19/06/13 용왕님 보우하사 2019-06-14 970K HD 제33회19/06/13 여름아..."
46,용왕님 보우하사 드라마,2019.07.23.,영화 최신업뎃 사일런스,맛나님의블로그,"mulio.net 거부할 수 없는 비디오의 매력 드라마 : 월화, 수목, 금주, 일일 드라마 더보기 HD 제100회19/06/13 용왕님 보우하사 2019-06-14 970K HD 제33회19/06/13..."
47,용왕님 보우하사 드라마,2019.07.23.,극장판 샤이닝스타:새로운 루나퀸의 탄생!,맛나님의블로그,"net 거부할 수 없는 비디오의 매력 드라마 : 월화, 수목, 금주, 일일 드라마 더보기 HD 제100회19/06/13 용왕님 보우하사 2019-06-14 970K HD 제33회19/06/13 여름아..."
48,용왕님 보우하사 드라마,2019.07.26.,50대 엄마 화장품 선물 달팽이크림 효과  에스까로제 얼라이브 리얼 스네일 스킨 케어 3종 선물하기,새벽을 밝히는 구슬,일일드라마 용왕님 보우하사등 다양한 드라마에서 주인공들과 함께 했었다 Previous image Next image 다시마 먹인 달팽이 점액을 사용했는데 격이 다른 국내산 리얼...
49,용왕님 보우하사 드라마,2019.07.18.,천연 남성졍력제 알아봐요,예쁜토끼의 블로그,일일드라마 태양의 계절 용왕님보우하사 세상에서 제일 예쁜 내딸 등의 드라마에 제품이 협찬되고 있어요 잇츠스네일은 30여 년간의 축적된 기술로 양식한 달팽이를...
