,drama_title,date,blog_title,writer,contents
149,의사요한 드라마,2019.09.14.,드라마,꿈꾸는 소년,새드라마들 하는지 까불려고한다 ㅡㅡ 아 의사요한 은 그나마 금욜이 기다려진 이런 짜증 허무떠는 카피는 누구솜씨인지 지켜준다니까 ? 수지의 밑천 연기력이야...
150,의사요한 드라마,2019.09.19.,배가본드 인물관계도 몇부작? 이승기 수지 넷플릭스,불량아즈매의 세상살...,의사요한의 뒤를 이은 SBS 금토드라마 배가본드 인물관계도와 몇부작인지 드라마 시작하루전 미리 알아보려고 해요. 사실 예고편을 보면서 보지말까? 라는 생각을...
151,의사요한 드라마,2019.09.20.,이세영 공항패션 라코스테 니트로 러블리 청순룩 완성! 여자 브이넥 니트 추천,뷰스타 래핑,안녕하세요 뷰스타 래핑이에요 오늘 소개해드릴 스타의 패션정보는 드라마 '의사 요한'에서 깊은 트라우마를 극복하고 진정한 의사로 거듭나는 주인공 강시영 역으로...
152,의사요한 드라마,2019.09.10.,서울 맛집-시청 만족 오향족발 본점,카지의 빌라여행,보았던 드라마 의사 요한을 지원한다는 포스터가 붙어 있습니다. 그리고 런치메뉴와 사이드 메뉴를 큼지막하게 벽에 붙여놓아 쉽게 찾아 볼 수 있었네요. 자리를 잡고...
153,의사요한 드라마,2019.09.08.,로맨스 없는 독립서점 -'별책부록',연꽃 만나고 가는 바...,"언제부터인가 로맨스가 가미된 드라마에 빠져 살고 있는 나. 이종석이 좋아서... 지성에 빠져서 <의사요한>에 빠져다. 그리고 요즘 보는<멜로가 체질>, <열여덟의 순간..."
154,의사요한 드라마,2019.09.08.,배우 이세영 나이 고향 학력 데뷔 종교 영화 드라마 방송 출연작,마니마니투어,"또한 드라마는 형제의 강, 대왕의 길, 약속, 베스트극장, 온달 왕자들, 선물, 내사랑... 남자, 의사요한 등 입니다. 여기에 방송은 뽀뽀뽀, 무한도전, 여유만만, 놀러와..."
155,의사요한 드라마,2019.09.20.,[중학생 필독서 과학동아 9월호] 달리기가 뇌를 깨운다 - RUNNING (※19주년 기념 할인 놓치지 마세요~),더 밝은 내일을 위하...,메디컬 드라마 '의사 요한'은 국내에서는 처음으로 통증의학을 전면에 내세워 통증으로 고통을 겪는 환자들의 모습을 실감 나게 그려내고 있어요....
156,의사요한 드라마,2019.09.12.,2019 상반기 드라마 OST 추천,3초컷의 알쓸잡,평소 즐겨보던 드라마 인데요!! 의사요한 OST가 너무 좋더라구요 ㅎㅎ 민서- Star https://m.tv.naver.com/v/9450594 백아연- Just Go https://youtu.be/IZ5igcDfR6I 2....
157,의사요한 드라마,2019.09.11.,"기다려지는 이승기와 수지의 금토드라마, 배가본드 인물관계도 살펴보니..",옥이 IT여행,한동안은 '의사 요한'을 빠짐없이 보면서 꽤 집중해서 시청했어요. 이제 희사 요한 드라마는 끝이 났고 후속으로 이승기와 수지가 나오는 배가본드가 곧 첫방을 시작할...
158,의사요한 드라마,2019.09.14.,드라마,Seong's 형제의소소...,역시 추석에는 드라마몰아보기죵ㅋㅋ 젼 지금은 끝났지만 한번더 보고싶은 드라마가있어요 최근 종영된 드라마죠? 의사요한ㅋ 정말 잼있게 봤어요^^ 아픈사람 10초만...
159,의사요한 드라마,2019.09.14.,드라마만 보지말고 ㅇㅇㅇ 능력도 올려보자,"기록, 쓰다.","그리고 드라마를 끊겠노라 선언했지만.. 보고 있다. 최근에 '의사요한', '호텔델루나', '열여덟의 순간' 등을 봤다. 수많은 드라마를 보고 잊혀지는 것이 아깝다는 생각이..."
160,의사요한 드라마,2019.09.17.,알고보니 나도 '멜로가 체질'이었나보다.,아무것도 아니면서 ...,"아이유가 온갖 예쁜치레을 하고 나오는 <호텔 델루나>도 3부를 넘기지 못했고, 지성연기가 끝장이라는 <의사요한>은 의사영화라서 별로, 올해 건진 드라마는 <www..."
161,의사요한 드라마,2019.09.20.,"이세영 공항패션 가방, 라코스테 여성 크로스백 크로코크루!",쭈's Diary,최근 드라마 의사 요한에서 깊은 연기력을 선보이며 호평을 받았는데요~ 깊은 트라우마를 극복하면서 진정한 의사로 거듭나는 과정을 멋지게 그려낸 주인공 강시영...
162,의사요한 드라마,2019.09.14.,민서 - Star,It's 이쯔 :->,있나요 의사 요한 OST Part.3 2019.08.09 우원재의 뮤직하이에 게스트로 민서 님이 나온 날 이 곡이 흘러나왔고 내 마음에 들어왔다. 드라마는 보지 않아서 잘 모르겠지만...
163,의사요한 드라마,2019.09.10.,2019년 9월 1주차 드라마 순위,굿데이터,드라마 4 위는 전주 대비 순위가 2 계단 오르며 유종의 미를 거둔 SBS ‘의사요한’이었다 . 개연성이 부족한 후반부 전개와 급하게 마무리된 스토리에 아쉬움이...
164,의사요한 드라마,2019.09.12.,"권수경 감독 & 손호준-이규형의 코믹 판타지 드라마 <스텔라>, 2019. 09. 03일 크랭크인!",박호선의 시네마플러...,최근 드라마 ‘의사요한’과 ‘라이프’ 등에서 카리스마 있는 역할을 맡았던 이규형은 영화 <스텔라>를 통해 딸 바보&아들 바보 같은 면모로 미워할 수 없는 아빠...
165,의사요한 드라마,2019.09.20.,배가본드 VAGABOND 뜻-인물관계도소개-몇부작-작가감독-결방? 박광덕은 누구? 주진모? 비행기 테러범? 훈이 아역배우?,퍼블릭에프알,<배가본드> 새 금토드라마가 시작합니다. 지난 주 의사요한이 마지막 방송을 하고 배우 수지x이승기x신성록 이 출연하며 기대를 준 새 드라마를 예고했죠! 모로코...
166,의사요한 드라마,2019.09.17.,?のお暇,류가네,"오늘 온 3학년 여자아이가 ""선생님 요즈음 드라마 뭐 봐요?"" 하길래, ""선생님 드라마 잘 안 보는데....넌?"" 했더니 ""엄마랑 의사요한...인가 그거 봐요"" ""재밌어?"" ""음...좀 피..."
167,의사요한 드라마,2019.09.14.,드라마,RaYoon,흥미진진 재미있는 드라마를 추천해주세요 요즘에 계속 빠져서 하루 3번 보는 의사요한 이요 시영이랑 요한의케미 너무 제가 좋아하는 스토리가 있어서 시즌2까지...
168,의사요한 드라마,2019.09.14.,드라마,반동결일지도...?,흥미진진 재미있는 드라마를 추천해주세요 의사 요한이랑 호텔 델루나 내가 진짜 중간중간 못 본 거 너무 많아서 정주행 해야지 하는데 매일 미루고있음. 아니. 나...
169,의사요한 드라마,2019.09.20.,라코스테 니트 이세영 공항패션 속 여자 브이넥 니트 시크해,젤리젤리의 뷰티&패...,이세영 주연 드라마 의사요한이 9월 7일 시청률 10%로 성공적으로 마무리를... 이번 의사 요한 드라마도 그랬고요~! 행복 바이러스를 퍼트리는 예쁜 미소와 함께 손을...
170,의사요한 드라마,2019.09.13.,드라마 배가본드 인물관계도 등장인물 : 이승기 배수지,♡여자라서 행복해요...,#드라마배가본드 #배가본드 #배가본드인물관계도 #이승기배수지 '의사 요한' 후속으로 오늘 20일 첫 방송될 sbs 새 금토 드라마 '배가본드' 장장 1년 여간의 제작 기간과...
171,의사요한 드라마,2019.09.19.,SBS 신작 드라마 ‘배가본드’...블랙야크가 후원한 이유는?,파이낸셜리뷰,"이미지가 잘 표현될 것”이라고 덧붙였다. 한편, ‘배가본드’는 SBS 드라마 ‘의사 요한’ 후속으로 오는 20일부터 매주 금, 토 저녁 10시 방송 예정이다. 원본 기사 보기"
172,의사요한 드라마,2019.09.10.,배우 황희가 의사 가운을 벗고 전사로,드라마덕후니,"SBS 드라마 ‘의사요한’에서 ‘이유준’ 역을 맡은 황희는 강미래(정민아 분)와의 꽉 닫힌 로맨스로 여심을 강탈한 것은 물론, 차요한(지성 분)과 강시영(이세영 분)..."
173,의사요한 드라마,2019.09.17.,가수 겸 배우 신원호가 힙합 드라마에 도전,드라마덕후니,보여줄 수 있는 얘기를 풀어서 보여줄 수 있었으면 좋았을 텐데.” ‘힙합왕’은 배우 지성과 이세영 주연의 SBS 금토드라마 ‘의사요한’의 후속작이었다....
174,의사요한 드라마,2019.09.12.,[화순카페] 우주라이크커피,미의 일상,"요즘 의사요한 드라마가 열풍이쥬? #의사요한 에 나오는 커피가 대세라해서 #우주라이크커피 방문했습니다! 화순에 일이 있어서 들였다가, #화순점 #우주라이크커피 가..."
175,의사요한 드라마,2019.09.08.,2019 KT 멤버십 보야지 투 자라섬 Voyage to Jarasum 라인업 자라섬 페스티벌!,Let's Go Fashion World~♡,서사무엘은 누군가 하고 찾아봤더니 요즘 나오는 의사 요한의 OST 를 부른... 드라마 도깨비의 OST 중 HUSH 라는 노래를 불러 나 역시나 들으니 아하~ 싶을 정도였고...
176,의사요한 드라마,2019.09.10.,기억을 위한 기록들,"율리아의 공간, 기록...","완전 좋아 너무 좋아 냉장고에 한 가득 쟁여두고싶어 진짜 달달한 맛 ~ 집에 TV만 없다뿐이지, 보고싶은 드라마는 주말마다 몰아보기 하는중! 의사요한에 빠져 있다가..."
177,의사요한 드라마,2019.09.10.,백아연 노래 듣기 리뷰,뿅,이번에 의사요한 이라는 드라마에 ost 를 불렀거든요 소개할께여 감미로워 Just Go 의사요한 드라마 주인공인 이세영분이 지성분을 만나서 의사로서 차츰 다시...
178,의사요한 드라마,2019.09.09.,[1일] 코타키나발루로 출발,쭈야 희야는 방학중...,19시20분 제주항공타고 출발~ 애들은 만화보고 우린 요즘 꽂혀있는 의사요한 드라마보고 ㅋ 훈인 비행기타고 세시간쯤뒤 주무시고 마티나 라운지에서 한숨 주무신...
179,의사요한 드라마,2019.09.15.,연휴 마지막 날 주말풍경~  다육이도 보고 오랜만에 드라마도 보고~~^^,오~~ 해피데이~~~ ^...,함께 공유해보아요 오전에 주일예배 다녀오고~~ 막내랑 짜장면 먹고~ 노트북으로 드라마를 보았네요 의사 요한인가 방송 봤어요 보다가 소파에서 깜빡 잠들었어요...
180,의사요한 드라마,2019.09.08.,"'우아한 가' 뻔한 서사 살리는 배종옥, 이런 악역은 처음이라",http://thekian.tis...,"세상 > 드라마 곱씹기 ' 카테고리의 다른 글 몰입감 높아진 '아스달 연대기', 두 달 쉬고 돌아오길 잘했다 (1) 2019.09.10 뾰족했던 '의사요한', 어쩌다 뭉툭한 멜로로 끝나..."
181,의사요한 드라마,2019.09.14.,충북혁신도시카페 캔에 담은 커피 우주라이크,pp1538의 블로그^^,먹고는 싶었는데 너무 배불러서 패스 다음에는 뚱카롱도 맛보고 와야겠더라고요~ 핫했던 의사요한! 드라마에 우주라이크커피가 나와서 더 인기가 있던거 같아요 매장...
182,의사요한 드라마,2019.09.21.,"SBS 금토드라마 <배가본드 1화>-줄거리 리뷰,이승기,수지,차달건,문정희",부산을 그리다,"SBS 금토드라마 <배가본드>-이승기,수지,몇부작,인물관계도 <의사요한>의 후속으로 방영되는sbs 금토드라마<배가본드>프리뷰 입니다!-당초 5월에 방영예정... kimbobob123...."
183,의사요한 드라마,2019.09.08.,"'위대한 쇼' 애 키운 사람은 안다, 송승헌의 공감백배 가정헌법",http://thekian.tis...,(사진:tvN) 좋아요 공감 공유하기 글 요소 구독하기 더키앙 카카오스토리 트위터 페이스북 ' 네모난 세상 > 드라마 곱씹기 ' 카테고리의 다른 글 뾰족했던 '의사요한...
184,의사요한 드라마,2019.09.14.,드라마,swim5010님의 블로그,"From, 블로그씨 추석에는 역시 아껴둔 드라마 정주행! 흥미진진 재미있는 드라마를 추천해주세요 의사요한"
185,의사요한 드라마,2019.09.14.,드라마,back to the past,"From, 블로그씨 추석에는 역시 아껴둔 드라마 정주행! 흥미진진 재미있는 드라마를 추천해주세요 의사요한 결말...ㅋㅋㅋ 공부할때는 응사가 땡기지."
186,의사요한 드라마,2019.09.14.,드라마,저는 이제 블접합니...,"From, 블로그씨 추석에는 역시 아껴둔 드라마 정주행! 흥미진진 재미있는 드라마를 추천해주세요 스카이캐슬, 태양의 후예, 의사 요한, 도깨비 뭐이거 말고 더있나?"
187,의사요한 드라마,2019.09.14.,드라마,kkgyjs74님의블로그,"흥미진진 재미있는 드라마를 추천해주세요 스카이캐슬,호텔델루나,열혈사제,비밀의 숲.의사요한 ,킹덤 외 다수를 즐겨봅니다."
188,의사요한 드라마,2019.09.20.,"영등포구 문래동1가 2/2 - 그렇게 계속된다(사진,이용민)","이용민, LUOES",내리막도 있다는걸 이미 잘 알고 있는 분들이다. 쉽게 오픈하고 쉽게 폐업 하는 그런 업장들과는 다를것임이 분명하다. ===== 민서 - star (드라마 '의사요한'O.S.T.) (2019)
189,의사요한 드라마,2019.09.08.,전주 한옥마을호텔 최저가 숙박 추천해요,박남매와 함께하는 육아이야...,자세히보니 연예인뿐 아니라 양궁선수도 다녀갔네요~ 요즘 의사요한이라는 드라마에 나오는 예쁜배우 이세영씨도 다녀갔더라는! 애정하는 드라마라 한눈에...
190,의사요한 드라마,2019.09.09.,[9월 첫 째주] 신곡 노래 추천,Maybe this could b...,의사 요한 OST Part 7 아티스트 Tree Tube 발매일 2019.09.06. OBSSSD 아티스트... 신입사관 구해령 (MBC 수목드라마) OST - Part 4 아티스트 심규선(Lucia)...
191,의사요한 드라마,2019.09.10.,"'타인은 지옥', 배우들은 놀랍지만 보기엔 너무 불편하다는 건",http://thekian.tis...,"웹툰과 드라마의 차이 때문일까. 웹툰으로서는 괜찮게 보였던 것이 드라마로 보니... 10 뾰족했던 '의사요한', 어쩌다 뭉툭한 멜로로 끝나 버렸을까 (0) 2019.09.09 '우아한..."
192,의사요한 드라마,2019.09.10.,"몰입감 높아진 '아스달 연대기', 두 달 쉬고 돌아오길 잘했다",http://thekian.tis...,"토일드라마 <아스달 연대기>는 파트2를 끝내고 파트3로 이어지는 두 달 여간의... 10 뾰족했던 '의사요한', 어쩌다 뭉툭한 멜로로 끝나 버렸을까 (0) 2019.09.09 '우아한 가..."
193,의사요한 드라마,2019.09.18.,캔시머 제조업체 윤서입니다 :-),큐캔시머/카페모아(...,요즘 수제캔커피로 유명한 의사요한 드라마에서 우주라이크가 방영되면서 더 이슈를 끌고 있었죠 캔시머만 있다면 어느 카페 어느 술집 어느 음료 판매점이던 다 하실...
194,의사요한 드라마,2019.09.10.,제주 중문 가볼만한곳 비 오는 날도 좋은 박물관은 살아있다!,타임머신 타고 과거로 딱따...,"한때 드라마 열혈팬으로 드라마 장면을 재연하면서 과감하게 포즈도 취했었는데... 얼마 전 끝난 의사요한에서 그들이 나눈 대화가 생각납니다. ""환자는 치료가 아닌..."
195,의사요한 드라마,2019.09.09.,이보영 : 신의 선물 14일 김수현,별하's 감성드라마&...,"최근 종영한 드라마 의사요한을 재밌게 봤는데요, 지성님 작품을 보고 나니 이보영 님 생각도 나고 보고싶고 해서 전작들을 살펴보다가 눈에 들어온 < 신의 선물..."
196,의사요한 드라마,2019.09.19.,산업 Focus; 미디어 - 눈이 즐거울 금토,마포투자협동조합,"금토 드라마로 동사가 천명한 ‘드라마 사업부 강화’를 상징하는 작품 이다. 1Q ‘해치’와 ‘열혈사제’, 2Q ‘녹두꽃’, 3Q ‘의사요한’에 이어 지상파의 승부..."
197,의사요한 드라마,2019.09.20.,배가본드 이승기 배수지 신성록 등장인물관계도/줄거리(SBS 금토드라마),새벽달의 감성다락방,넷를릭스 방영으로 전 세계의 이목이 집중될 드라마 배가본드는 의사요한 후속으로 9월 20일 밤 10시 1회가 방송 됩니다. 새 금토드라마 배가본드 첫 번째 ost 가창자로...
198,의사요한 드라마,2019.09.10.,Billie Eilish_all the good girls go to hell 가사/해석/번역/듣기,† Rock or Bust †,드라마 의사 요한의 영문 이름이 바로 닥터 좃이거든... 앗! 또 오타네? 영어로 써줄께 Doctor John 이정도 되면 답은 나온거 같지? all the good girls go to hell...
199,의사요한 드라마,2019.09.08.,깊은 마음,서욱의 웰다잉 생각...,"알고서도 모른척했다고 고백하며, 오히려 미안했다고 말한다. naver.me 의사 요한(병고칠 요, 즐길 한) 드라마 보다가 감동 뿅!~ : 네이버 카페 http://naver.me/xMzEftNe"
200,의사요한 드라마,2019.09.17.,장영철-정경순 부부작가의 귀환 배가본드. 그리고 두 부부작가의 역대작품들.,풍운지가,이번주 금요일부터 SBS에서 방영할 금토드라마 배가본드(16부작) 열혈사제의 흥행 이후 녹두꽃(24부작)-의사 요한(16부작)이 호평을 받았지만 열혈사제만큼...
201,의사요한 드라마,2019.09.08.,블로그 입문 후 방문자 늘리기 두번째 도전!<블로그 유입경로 체크!>,부산을 그리다,그리고 제가 요즘 드라마를 자주 못봐서 의사요한말고는 리뷰를 안해서 어떤걸 할까 고민하다가 생각한게 방영 2-3주 전 드라마를 미리 홍보하는거였어요!!...
202,의사요한 드라마,2019.09.09.,사전연명의료의향서 쓰는 노인들,따뜻한 사람들,"요즘 빠짐없이 챙겨보는 드라마 ‘의사요한’이 안락사 문제를 다루고 있다. 너무나 아파서, 도저히 견딜 수 없다며 죽여 달라는 환자들. 그들을 지켜보는 가족들은..."
203,의사요한 드라마,2019.09.14.,드라마,TXT 아미 별빛LOVE,흥미진진 재미있는 드라마를 추천해주세요 제빵왕김탁구도 재미있어요 의사요한도 재미있고요 드라마는 다 재미있는 것 같아요
204,의사요한 드라마,2019.09.17.,복합부위통증증후군 증상 알고 계신가요?,분당베스트병원 중추신경계...,"최근 막을 내린 SBS 메디컬 드라마 <의사요한>은 ‘통증’과 관련한 다양한 질환을 소재로 이야기가 전개되었는데요. 드라마를 보신 분은 아시겠지만, 온 몸에 통증이..."
205,의사요한 드라마,2019.09.14.,드라마,:),"From, 블로그씨 추석에는 역시 아껴둔 드라마 정주행! 흥미진진 재미있는 드라마를 추천해주세요 저는 가끔 아스달연대기도 보고 끝난 의사요한도 봤었어요"
206,의사요한 드라마,2019.09.10.,2019 추석 맞이 네이버 서비스 소식,네이버 다이어리,"방송의 경우, 11일부터 15일까지 <캠핑클럽> <나혼자 산다> 등 인기 예능을 90%, <호텔 델루나>, <의사 요한> 등 최신 인기 드라마를 50% 할인된 가격으로 감상할 수 있다...."
207,의사요한 드라마,2019.09.11.,미래를 닮은 과거 얘기. 미드 '체르노빌',iCOOP자연드림 협동...,"아닌 드라마입니다. 아주 유명한 미드인 '워킹데드'를 만든 '요한 렌크' 감독이... 당시 의사들, 과학자, 직원들을 인터뷰하는데 상당한 시간을 할애했다고 합니다...."
208,의사요한 드라마,2019.09.08.,[블로그씨]여러분은 잠들기 전에 무엇을 하시나요?,긴 세월은 저절로 흘...,요즘 보고있는 드라마는 통증의학과 의사들의 이야기를 그린 휴먼 메디컬 드라마 '의사요한' 믿.보.지 믿고 보는 지성배우님! 개인적으로 정말 좋아하는 배우에요...
209,의사요한 드라마,2019.09.20.,이세영 공항패션 가방 라코스테 크로스백 크로코크루 여성 크러스백,8차원 매력쟁이연콩...,드라마 ‘의사 요한’에서 깊은 트라우마를 극복하고 진정한 의사로 거듭나는 주인공 강시영 역을 맡아 따뜻한 감동과 힐링을 선사한 배우 이세영! 그녀가 화보...
210,의사요한 드라마,2019.09.19.,동백꽃 필 무렵 1회 2회 공효진 패션,미세스봉봉's,"델루나, 의사요한 끝나고 뭐 볼만한거 없나~ 싶었는데~ 요렇게 또 재미진게... 인생드라마 각이던데~ 일단 더 봐야알겠지만요~ ㅎ 요 포스터에 입고 나온 공효진..."
211,의사요한 드라마,2019.09.19.,복합부위통증 증후군 [CRPS],이음이:서로를 이어...,의사 요한이라는 드라마에서 잠깐 소개가 되었습니다. CRPS[Complex regional pain syndrome]는 바람만 스쳐도 통증을 느끼는 병이라고 합니다. 한국말로 복합부위...
212,의사요한 드라마,2019.09.20.,대전 커피 단체주문 우주라이크커피 은행점,tjrwlsgpqls,홀더를 씌운 상태와 뺀 상태 우주라이크에서 드라마 의사요한 협찬을 하게 되어 많은 분들이 찾아주시고 계십니다!!! 우주라이크 은행동점 매장자랑 을 하자면 세척된...
213,의사요한 드라마,2019.09.11.,[BMDB]촬영 지원 필요한 사람 여기 집중!,JEM이있는 이야기,"BMDB 부산영화·영상인력DB 부산영상위원회 PEOPLE 배우 594 명 임정민 SBS 드라마 의사요한 (안과과장)(2019), KBS 임시정부 100주년 다큐 수당정정화 (백범..."
214,의사요한 드라마,2019.09.19.,●(사전연명의료의향서)내 삶의 마지막은 내가 결정한다,● 홍실의 하루 ●,얼마전에 종영된 드라마 의사요한을 보면서 매회 생각을 하면서 본것같아요 환자가 연명의료의향서를 작성하지 않은 상태에서 의사가 할수있는 영역과...
215,의사요한 드라마,2019.09.20.,쌉니다 천리마마트 - 믿음과 신뢰 천리마마트,세리의 소박한 세상...,"열혈사제에 녹두꽃, 의사요한까지. SBS 금 토 드라마 쭉 봤습니다. 많은 시청자가 기다린 작품이 저도 기대가 큰데……. 티저와 예고 영상 봤습니다. 이승기와 수지가..."
216,의사요한 드라마,2019.09.17.,~19.09.17,Wish,의사요한 보고 푹 빠졌어요... 진짜 차요한 미쳤어 역대급 캐릭터 ㅜㅜ 의사요한... 무협퇴마?드라만데 소설이 찐이고 드라마랑 애니는 브로맨스라내요 (검열때문에) 하...
217,의사요한 드라마,2019.09.17.,요즘 유행하는 캔커피 우주라이크커피(Would U Like),도도한맘♡,최근 의사 요한이라는 프로그램에도 협찬을 하여 방송에도 나온 핫한 카페예요 저는 평소 의학 드라마를 좋아해서 의사 요한을 봤지만 거기에서 이...
218,의사요한 드라마,2019.09.15.,따똣함,recollected-,이번 추석 나를 외롭지 않게해준 의사요한 .. 정주행 하려고 종영하길 얼마나 기다렸는지.. 뉴하트 최소 7번 정주행한 나로선 무조건 봐야하는 드라마였기에 .. 역시 왠벽...
219,의사요한 드라마,2019.09.08.,보내주기,마음의 강가,"참 진지했고 따뜻했으며 애처로웠던 드라마 의사요한이 16부로 끝이 났다 (드라마, 의사요한 최종화) 이별은, 언젠가 다시 만나길 바라는.. ""왜 그랬어요아프면 아프다고..."
220,의사요한 드라마,2019.09.10.,"세종시 통증치료 - 수술없이 진단과 치료 ""세종 시원통증의학과""",세종 시원마취통증의...,TV 드라마 '의사 요한' 덕분에 '통증'과 '마취통증의학과'에 대해 새로운 인식을 가진 분들이 많이 늘어난 것 같습니다. 우리가 겪게 되는 수 많은 질병이 현실로 다가...
221,의사요한 드라마,2019.09.13.,일상기록,good mood.,"ㅠ_ㅠ 의사요한 끝나고 이젠 멜로가체질로 정주행,, 뭔가 공감되면서 슬프기도 하고 재밌는 드라마 토마토 머구면서 오랜만에 노트북으로 쇼핑 노랑통닭 다들..."
222,의사요한 드라마,2019.09.16.,멜로가 체질 명언 명대사 모음 1-2회 / 등장인물 / 출연진,yonista1,"사실 저의 드라마 리뷰 리스트엔 꽤나 많은 드라마 리스트가 있었는데 (지정 생존자, 의사요한 등등) 아이러니 하게도 아직 방영중인 멜로가 체질 리뷰를 먼저 시작하게..."
223,의사요한 드라마,2019.09.14.,[cp-1 컬러트리트먼트] 애쉬핑크로 셀프염색 / 코랄빛 셀프 헤어 컬러링 완성 : 애쉬 핑크 바이올렛 매트 코랄 염색,려니의그러려니 *,연산동 미용실에서 SBS 드라마 의사요한 강미래 역의 정민아 머리색 애쉬 핑크 바이올렛 매트 코랄 염색을 하고 왔다며 블로그에 포스팅 한 일이 벌써 한달이다....
224,의사요한 드라마,2019.09.08.,[오늘의 사진] 2019. 09. 08,수의대생 써니의 Da...,? 방학을 함께한 드라마 의사요한이 종영했다 사실 우도 봉사때 마통과가 너무 멋있어서 보게 되었는데 꽤 재밌는 의학드라마였다 사실 나도 대부분 모르는...
225,의사요한 드라마,2019.09.21.,멜로가체질 천우희 가방 :: 쿠론(COURONE) 멜리아 토트백  (Brown color),"my serendipity, ?",요즘 HOT하게 방영중인 드라마 멜로가 체질에서 천우희 패션이 많은 화제가... 데일리룩 #여자가방추천 #직장인가방 #의사요한 #이세영가방 #의사요한이세영패션
