,drama_title,date,blog_title,writer,contents
226,의사요한 드라마,2019.09.11.,수제캔커피 캔커피제작 허가사항 확인하기,다브카 커피 로스팅,#수제캔커피 #캔커피제작 허가사항 확인하기 최근에 드라마 #의사요한캔커피 문의가 참 많이 들어와요! 방송 ppl은 역시 대단한것같아요! 다브카 커피에서 수제캔커피...
227,의사요한 드라마,2019.09.20.,이세영 공항패션 라코스테가 다했다,크림의 부드러운 이...,이세영 공항패션 / 이세영 니트 가방 운동화 신발 라코스테 니트 크로코크루 크로스백 드라마 ‘의사 요한’에서 깊은 트라우마를 극복하고 진정한 의사로 거듭나는...
228,의사요한 드라마,2019.09.09.,[크로아티아 여행] 두브에서 툴루즈 9월 7일,소소한 일상 **,"3주전에 본 의사 요한이 생각나기도 했고.. 뜬금없지만 빨리 호텔로가서 델루나... 안그래도 드라마 때문에 눈물 많이나서 눈 건조하고 그랬는데, 숙소 딱 도착하니까..."
229,의사요한 드라마,2019.09.12.,[경기 이천] WouldULike + cafe + 이색카페 + 우주라이크 + 카페 추천,＠강마담싸롱의 왈가왈부＠,"영업은 오전 9시부터 밤 11시까지예요 ㅎㅎ 매장은 작지도, 크지도 않은 아담한 감성으로 꾸며져 있답니다 ㅎㅎㅎ #의사요한 이라는 드라마에도 나오나 봐요 ㅎㅎ..."
230,의사요한 드라마,2019.09.19.,"2019.8.24-2019.9.7, 여름",HJD,"딱 의사요한 할때 맞춰서 일어나서 밥먹으면서 같이 보려고 호다닥 김밥사왔당 참치김밥 절대 질리지 않아,, 드라마 다 보고 출근 전까지 잤는데 열이..."
231,의사요한 드라마,2019.09.16.,차교수님저너무아파요...ㅜㅜㅜㅜㅜㅠㅠ,"푸르고, 푸르도다.",메디컬 드라마 보면 빠지니까 안볼라했는데 안볼수가없다...또이렇게발을들였어... 의사요한 끝난지가언젠데 8ㅅ8...늦덕이무섭다고...발을들였네 시발............모로가도...
232,의사요한 드라마,2019.09.09.,구월(1),#,드라마 포기 못해 ... 씻고 나와서도 공부 안 하고 의사요한 본방 보는데 ... 희소식 .. 태풍으로 인한 학원 휴강 77ㅑ ~~~~~~~~~~~~ 그래서 마음 편하게 의사요한 봤따 하루...
233,의사요한 드라마,2019.09.19.,"세무사사무실에서 인기 좋은 칼라복합기 임대, 구매 추천!",서보라팀장의 스토리...,"또한, 닥터탐정, 멜로가체질, 의사요한, 달리는 조사관, 레벨업, 유령을 잡아라 등 SBS, MBC, OCN, JTBC, tvN 등 방영 중이거나 방영 예정 드라마의 협찬부터 공공기관, 기업..."
234,의사요한 드라마,2019.09.11.,과학관련도서 과학동아 9월호 중3과학 배우고 보니 더 재미있다~,꿈꾸는 나무 안's 더...,탄소 드라마 '의사 요한' 통증은 고통스럽기만 한걸까? 진화학자가 번역한 '종의 기원' 자연선택은 왜 혁명이 되었을까 인공지능을 둘러싼 쟁점 - 인공지능이 종교를...
235,의사요한 드라마,2019.09.15.,"소원,",Sence Of Time,"끝났어,,, 의사요한 마지막회는 좀 어영부영 끝낸 느낌이라 아쉬운게 많은데 그 전까지는 꼬박꼬박 챙겨볼 정도로 너무나 좋았으니까ㅜㅜ 정말 손에 꼽는 인생드라마였..."
236,의사요한 드라마,2019.09.08.,지성과 이세영이 모든 위기를 극복하고 해피엔딩을 맞았다.,최적화블로그꿀벌 나...,"9월 7일 종영된 SBS 금토드라마 ‘의사요한(극본 김지운/연출 조수원 김영환)’ 마지막회 16회 1부, 2부에서는 3년 만에 재회한 차요한(지성 분)과 강시영(이세영 분)의..."
237,의사요한 드라마,2019.09.08.,"[대구가구추천] 프로방스, TV드레스, 부엌장, 콘솔, 라탄, 라탄가구 / 대구 가창 가구 반값 가구점",가구하는 부부 (이림...,지금 #의사요한 보면서 포스팅 하고 있어용~~요즘 제가 유일하게 본방사수하고 있는 #드라마... parl0070.blog.me 2. TV 드레스 카키 사이즈 (1200x500x500) - 깔끔한듯...
238,의사요한 드라마,2019.09.13.,빛나 지목!!,단오??하루,"좋아하는 드라마 호텔 델루나 여름아부탁해 태양의 계절 닥터탐정 의사요한 열혈사제 황후의 품격 등.... 36. 좋아하는 영화 코난 짱구 신과 함께 1,2 도라에몽..."
239,의사요한 드라마,2019.09.16.,#2019_11,A Daily Record,"간만에 심장 몽굴몽굴 해지는 드라마..... 열여덞의 순간 안본 사람 있으면 ""당장... 애들이랑 헤어지고 부랴부랴 집가기 의사요한 본방 봐야해서 허겁지겁 가고 있었는데..."
240,의사요한 드라마,2019.09.09.,2019.09.09(월) 경제. 사회 뉴스&단신,좋은터 공인중개사사무소,"엔딩된 드라마 <의사요한>의 마지막 대사가 훈훈해서 옮겨 적어 보았습니다. 즐거운 한주 되시기 바랍니다. < 정치/외교 > 1. 文대통령, 曺 법무장관 임명 막판 고심..."
241,의사요한 드라마,2019.09.17.,수지 배가본드 제작발표회 입은 원피스 어디꺼!,창원 붙임머리 설레...,되는 드라마로 의사요한 후속으로 9월20일 첫방송 배가본드 인물관계도 등장인물과줄거리 알아볼께요 배가본드고난도액션씬을 대역없이 직접소화해내는이승기...
242,의사요한 드라마,2019.09.10.,이승기 배수지 '배가본드',Design-PARAN 블로그,10일 오후 서울 구로구 구로동 씨네Q 신도림점에서 열린 SBS 새 금토드라마... '배가본드'는 '의사요한' 후속으로 오는 20일 밤 10시 첫 방송된다. 지금까지 이승기 배수지에...
243,의사요한 드라마,2019.09.17.,수제캔커피 판매허가 알아보기,청년정신 다브카 커...,#수제캔커피 #캔커피제작 관련한 판매허가 알아보기 최근에 드라마 #의사요한캔커피 문의가 참 많이 들어와요! 방송 ppl은 역시 대단한것같아요! 최근에 수제캔커피를...
244,의사요한 드라마,2019.09.20.,"이세영 공항패션 라코스테 니트, 가방, 신발로 스타일 완성!","새로운 시작, 인하의...",드라마 의사요한에서 마취통증학과 레지던트 강시영 역으로 열연을 펼친 이시영 배우님. 이렇게 다시보니 방가 방가!! 가을이라는 계절과 어울리게 니트 패션을...
245,의사요한 드라마,2019.09.16.,"정민아, 이시영 셀럽 티셔츠 패션, 루에브르 반팔티로 완성!",이브이,"9월 7일 SBS 드라마 의사요한 종방연에서 정민아씨는 프린팅 티셔츠와 데님, 그리고 자켓을 매치해 세련된 스타일링을 보여주었어요! 이시영씨는..."
246,의사요한 드라마,2019.09.11.,옹성 우와 가장 활발한 드라마와 배우들의“18의 순간들”목록,강릉Vlog,27 % 이번 주 최고의 10 명의 드라마 배우를 확인하십시오 : 1. 옹 성우 (“ 18의 순간들”) 2. 지성 (“의사”) 3. 김향기 (“18의...
247,의사요한 드라마,2019.09.20.,배가본드 이승기 수지와 명품 조연들이 모였다???,Zobee의 세상만사,‘의사 요한’ 후속으로 9월 20일 첫 방송 되는 SBS 새 금토드라마 ‘배가본드(VAGABOND)’(연출 유인식/극본 장영철 정경순/제작 셀트리온엔터테인먼트)는 민항...
248,의사요한 드라마,2019.09.16.,아파도 미안하지 않습니다 / 조한진희,모든 시도는 따뜻할...,"원인 모를 고통만 있을 뿐"" 얼마전 막을 내린 드라마 <의사 요한>의 명대사다. 누군가의 고통을 함부로 재단하고 섣부르게 판단해서는 안된다는 깨달음을 얻게 한..."
249,의사요한 드라마,2019.09.11.,100. 숨결이 바람 될 때,책과 함께 크는 아이...,우연히 이 책을 읽었던 때는 '의사요한'이라는 드라마에 빠져 있을 때이다. 내가 좋아하던 믿고 보는 지성이라서 시청했는데 보면 볼 수록 재미있었다. 이세영과의...
250,의사요한 드라마,2019.09.17.,블로그 전체 공지,두 배우에게 빠지다...,"시청했던 드라마 : 선덕여왕 , W , 도깨비 , 김비서가 왜 그럴까 , 열혈사제 , 의사요한 좋아하는 과목 : 사회 하고 싶은 것 : 자고 싶어요 ㅡ,ㅡ 꿈 : 아가가 되고 시퍼여..."
251,의사요한 드라마,2019.09.21.,우아한가 임수향 가방 패션 속 폴스부띠끄 튤리백 러블리해,젤리젤리의 뷰티&패...,드라마 여배우 스타일링 정보 우아한가 임수향 가방 패션 사진출처 · MBN... 의사요한 이세영은 블랙을 착용했는데요. 어제 이세영 공항패션 아이템 보여드렸는데...
252,의사요한 드라마,2019.09.08.,"토렌트사이트, 토렌트순위 (사이트공유)_ver.2019",댕이나라,mp4 09-07 N 새글 H 인기글 의사요한 E16 END 190907 HDTV.x264 1080i.… 09-07 N 새글 황금정원 29 30회 합본.E15.190907.720p NEXT.… 09-07 드라마 더보기 예능오락 N...
253,의사요한 드라마,2019.09.10.,멜로가체질 1화~6화 내가 꽂힌 명대사 펌!!,♡ YOLO (You Only ...,"의사요한도 끝난 즈음. 요즘 재밌다는 ""멜로가체질"" 정주행 . 이병헌감독의 병맛... 그러모아보았다!!!1화 처음에 드라마 엔딩을 보며......진주가 보조작가 짤리고..."
254,의사요한 드라마,2019.09.20.,[20190801~20190831] 제주도한달살기_2주차,기억보관함,슬펐다 의사요한 보면서 짜장라면을 먹었다 그리고 계속 드라마를 보는데 비가 별로 오지 않는 것 같아서 한번 나가볼까? 가까운 곳에 가볼만한 곳을 찾아봤다 사려니...
255,의사요한 드라마,2019.09.11.,정민아 매체 인터뷰 속 블라우스 및 머메이드 스커트_씨씨콜렉트 (CC collect),스타패션 매거진,최근에 의사요한에서 열현하셨던 정민아씨!! 이경규씨 딸 이예림씨와 닮은 꼴로도 화제인데요 드라마가 종영해서 최근에 인터뷰가 많이 올라오더라구요~ 오늘 자...
256,의사요한 드라마,2019.09.12.,배가본드 인물관계도 등장인물/줄거리/몇부작,자몽's 먹고 즐기는...,"봤던 의사요한이 끝나고 다음주부터 배가본드가 방송됩니다. 배가본드는 9월 20일 10시에 첫 방송 되고 매주 금,토 열시에 SBS에서 보실 수 있어요. 사실 요 드라마는 올해..."
257,의사요한 드라마,2019.09.18.,2019.09.18 일상 : 창원 용지호수 피크닉,Dreamer's beginnin...,의사요한에서 PPL 했던 우주라이크커피 상남동에 생겨서 가봤다 캔에 담아주는게... 작년에 개발한 기술로 DNA 대조를 통해 찾아냈다는데 정말 드라마 시그널에 나온...
258,의사요한 드라마,2019.09.20.,민지일기113,민지일기,드디어 의사요한 다 봤다 지성같은 남자랑 결혼하고싶엉.. 이 칭구도 필드에서... 요즘 보는 드라만데 존잼ㅋㅋㅋㅋㅋ 알고보니 극본 임상춘작가님 백희/쌈마 쓰신분!...
259,의사요한 드라마,2019.09.11.,다이어터 관찰일기 44일차,지극히 주관적인,"기분 좋게 아침 식사를 마치고 드라마 의사요한을 시청했다. 드라마 한 편이 끝난 후, 드디어 순대를 전자레인지에 넣고 돌리기 시작했다. 순대 구매는 대성공이였다...."
260,의사요한 드라마,2019.09.14.,아 정말 조민혁첫등장을 잊을수가없어,즐거운계절,조민혁비주얼실화냐 저도댕댕이키우고시푼데여!!!!!!! 연기를너무리얼하게하신다 너무 ...눈무리나네 #배우지성 #곽태근 #지성 #드라마비밀 #조민혁 #의사요한 #차요한
261,의사요한 드라마,2019.09.21.,"이세영 공항패션 브이넥 니트 패션, 라코스테",시니찡의 스프링필드,"이세영 공항패션 브이넥 니트 패션, 라코스테 드라마 ‘의사 요한’에서 깊은 트라우마를 극복하고 진정한 의사로 거듭나는 주인공 강시영 역을 맡아 따뜻한..."
262,의사요한 드라마,2019.09.16.,100 이벤트 댓놀,나도 블컾...,"150개_즐겨보는 드라마 공개 ?지금은 끝나버린 호텔 델루나, 의사요한입니다? 200개_취미 공개 ?저는 요가를 좋아합니다!? 250개_노래방 애창곡 공개 ?저는..."
263,의사요한 드라마,2019.09.08.,팬들을 향한 진심어린 감사 인사 역시 빠지지 않았다.,나루해오름,SBS 금토드라마 ‘의사요한’에서 차요한 역으로 시청자들에게 감동을 선사한 지성의 종영 소감이 공개됐다. 마지막 회 촬영 중에 남긴 종영소감으로 그동안 함께한...
264,의사요한 드라마,2019.09.08.,윤택이에서 차요한까지(지성),후루츠 林,차도현을 죽일 뻔한 캐릭터 역시 지성이면 정음이였던 드라마 오늘 종영한 의사 차요한 마취통증의학과 교수로 뉴하트 때보다 껑충 올라간 진급?과 연기력를 보여주었다.
265,의사요한 드라마,2019.09.20.,배가본드 등장인물 & 인물관계도 이승기 배수지 소개합니다,뚱이뚱이의 드라마&...,오늘 뚱이가 가져온 소식은 의사요한 후속으로 이승기 배수지 주연의... 그린 드라마입니다 1년전쯤부터 배가본드 홍보를 하였는데 언제 하려나 기다려왔는데요!!...
266,의사요한 드라마,2019.09.08.,[하루일기4] 다이어트 fmd식단 레시피,"매일,매분,매초 행복...",2번 이상 운동하고 규칙적인 사람이라면 1년에 1-2번만 해도 좋다고 한다 드라마 의사요한이 오늘 끝나서 너무 아쉽 ㅠㅠㅠㅠ 지성 너무 멋있는데 ㅠㅠㅠㅠㅠㅠㅠ
267,의사요한 드라마,2019.09.14.,배가본드 티저영상 몇 부작? 인물관계도 줄거리,쓰고 느낀다~ 즐기고...,그린 드라마예요 총 16부작인데 ~2019년 기대되는 대작 중에 하나입니다. 모로코... 의사요한을 너무너무 재미있게 봤고 여운이 가시지 않 았는데 배가본드도 본방사수...
268,의사요한 드라마,2019.09.11.,[정민아/올리비아 하슬러] 매체인터뷰 속 블라우스 정도,패션디톡스,SBS 의사요한에서 강미래 역할로 눈도장 콕콕! 배우 정민아씨가 드라마가 끝나고 인터뷰를 진행하셨더라구요 ~~ 깔끔한 수트 룩 안에 착용하신 러블리한 무드의...
269,의사요한 드라마,2019.09.10.,"이승기 수지 주연 배가본드  등장인물 소개,몇부작,방송시간 이승기 연기력 외모 입덕시간!!",설린맘의 일상스토리,훠우~~ 라인업만봐도 보통드라마는 아닐것같네요 드라마 배가본드는 의사요한 후속작으로 SBS드라마 9월20일 10시 첫방 16부작으로 편성되었다고 하네요 이승기 연기력...
270,의사요한 드라마,2019.09.08.,2019.09.07 토,은은하게,"오늘 먹은 것 - 남은 신전 떡볶이 + 라면 사리(신라면) - 사브레 - 미숫가루, 마이쮸 - 뿌링클 > 멜로가 체질 9화 의사 요한 종영 아스달 연대기 시작 일기에 드라마나 현재..."
271,의사요한 드라마,2019.09.10.,[190910] 주말마다 고기파티 / 진짜 오랜만에 리또리또 / 인스튜디오에서 필름구매! / 을지로 '을지다락' / 명동 홍만당,하늘연달 스물나흘,ㅋㅋㅋㅋㅋㅋ 결애됐ㅠㅠㅠㅠ 이틀동안 의사요한도 다 봤는데 배우들만 남은 드라마... 내용이 산으로 간것도 아닌데... 왜 별로인거지... 암튼 굿닥터 먼저 다시...
272,의사요한 드라마,2019.09.09.,예담산부인과 출산 - 예담조리원 라이프 (?????),어깨너머 ?(???...,"의사요한, 좋아하면울리는 드라마 달리기 시작!!! ㅋ #조리원라이프 #블루투스스피커 모자동실=아이와 함께 방에 있는 시간에 클래식, 뉴에이지, 재즈 틀어줍니다. 어플..."
273,의사요한 드라마,2019.09.08.,지성이 1년 동안 이세영의 곁을 몰래 지켰던 사연이 밝혀졌다.,최적화블로그꿀벌 나...,"9월 7일 방송된 SBS 금토드라마 ‘의사요한(극본 김지운/연출 조수원 김영환)’ 16회 1부, 2부에서는 연락이 닿지 않는 차요한(지성 분)을 애타게 기다리는 강시영(이세영..."
274,의사요한 드라마,2019.09.08.,배우 지성(차요한)이 이세영(강시영)과 다시 만나며 애틋함을 드러냈다.,맑은가람,7일 방송된 SBS 금토드라마 '의사요한(극본 김지운 연출 조수원 김영환)'에서 차요한이 강시영과 병원에서 다시 조우했다. 차요한은 외국으로 떠난 후 석 달 동안 메일...
275,의사요한 드라마,2019.09.10.,20190909,잡히지 않는 여름,요즘 미쳐서 보던 의사요한 끝났다 엉엉 진짜 너무 조아 지성 50초에 한번 1분... 시밬ㅋㅋㅋㅋㅋㅋ 또드 (또라이드라마) 콜렉터 권여름 .. . 안재홍 드라마 만나고...
276,의사요한 드라마,2019.09.08.,이세영이 지성을 향한 오해를 풀고 사랑을 맹세했다.,드라마덕후니,"9월 7일 종영된 SBS 금토드라마 ‘의사요한(극본 김지운/연출 조수원 김영환)’ 마지막회 16회 1부, 2부에서 강시영(이세영 분)은 3년 동안 차요한(지성 분)에게 있었던..."
277,의사요한 드라마,2019.09.14.,헤이리 카페 분위기 좋게 커피 한잔 어때?,헬라의 케이뷰티,저는 최신 드라마를 안보고 항상 옛날드라마를 봐서..잘 모르지만 팽이의 의견을 빌리자면 의사요한이라고 합니다. 카페 분위기가 워낙에 좋아서 방송에도 충분히 나올...
278,의사요한 드라마,2019.09.10.,"[TV랩] 이승기X수지 '배가본드', 1년의 기다림이 아깝지 않은 '대작의 품격'",알아두면 좋은 각종...,[SBS funE | 강선애 기자] 장장 1년여 간의 제작기간을 거친 대작 드라마 '배가본드'가... '배가본드'는 '의사요한' 후속으로 오는 20일 밤 10시 첫 방송된다.
279,의사요한 드라마,2019.09.13.,병원복합기 찾고 계시다면?  (서울 영등포 병원에 엡손 복합기 임대),서보라팀장의 스토리...,"최근 방영하고 있거나 방영예정인 드라마 닥터탐정, 의사요한, 멜로가 체질, 위대한쇼, 달리는 조사관, 유령을 잡아라, 레벨업 등 각종 방송협찬과 공공기관, 기업..."
280,의사요한 드라마,2019.09.09.,2019년 9월 2일 - 9월 8일 기록,푸른밤 : 기억을 걷...,"최애 드라마인 #의사요한, #멜로가체질 보고 잤다 2019년 9월 8일 일요일 : #SUMMERBLOOM여름이피다전시회, #하남돼지집, #배스킨라빈스BROWN, #글로우스트라이크볼링..."
281,의사요한 드라마,2019.09.19.,실력 앞에 변명은 필요없다 (ft.낭만닥터 김사부),"기록, 쓰다.",#의사요한 을 보고 의학드라마를 더 보고 싶어서 추석에 정주행을 했지만 재미만 있었다. 그러나 여기서도 중요한 것은 실력! 체인지 그라운드를 모르고 살았을 때는...
282,의사요한 드라마,2019.09.09.,지성은 지난 8일 자신의 SNS에 사진과 함께 장문의 글을 게재했다.,BARON라이프,"사진 속 지성과 임동진은 다정한 포즈로 카메라를 응시하고 있다. 한편, 지성은 SBS 드라마 지난 7일 종영한 ‘의사요한’에서 차요한 역을 맡아 열연을 펼쳤다."
283,의사요한 드라마,2019.09.20.,네이버블로그 방문자수 900명!네이버애드포스트수익 공개!,홍이와행복개늼의웰...,"언니, 아무래도 드라마 포스팅을 올려서 그런건가? 어머! 생각지도 못했는데!... 의사요한 포스팅 이후! 9월 15일 700명방문자수넘긴날! 홍이는 예전에 블로그에 쓰려고..."
284,의사요한 드라마,2019.09.21.,나의 9월 (1),사서함,신전일세 드라마 진짜 잘 안 보는데 의사 요한은 본방 챙겨봤다 이세영 멋있어 할머니 집 가는 길 열심히 일했어요 여기 순대 국밥 진짜 .. 눈물 나랑 갈 사람 다 챙겨보는...
285,의사요한 드라마,2019.09.11.,"‘배가본드’의 유인식 감독이 주연 배우의 캐스팅 비화, 첫 방송을 앞둔 소감",최적화블로그꿀벌 나...,‘의사 요한’ 후속으로 방영되는 SBS 새 금토드라마 ‘배가본드’는 은폐된 진실을 찾아내기 위해 가족도 소속도 이름마저 잃어버린 방랑자(Vagabond)들의 위험천만하고...
286,의사요한 드라마,2019.09.16.,'Netizen 신비 동물의 왕국' 2018. 10. 14(일요특집) 완성을 알립니다.,참좋은 세상,일필로 선을 그은 뒤 필요한 색채를 덧입히면서 오로지 산을 그리고 있다. 한 획... 지분 6%를 가지고 있는데다 마윈 스스로도 경영에서 완전히 물러난다는 의사는...
287,의사요한 드라마,2019.09.08.,[2019년 36주차] September의 시작. 내가 가장 좋아하는 9월!,Jurung Jurung,뒤늦게 보기 시작한 호텔델루나랑 첫회부터 의학드라마라서 봤던 의사요한을 주말마다 챙겨보곤 했는데 이젠 더이상 드라마에 내 신경을 쏟지 않아도 되겠다....
288,의사요한 드라마,2019.09.10.,[평정/cp 4기]230 문답,윤기야 오른쪽으로,"혹시 드라마나 영화 중에서 이 세계관이나 소재 되게 써보고싶다!하고 생각했던... 드라마처럼 기다리고 있는 글이 있다면? - 델쟈기의 모든 글,,, 59. 올라오면 바로..."
289,의사요한 드라마,2019.09.08.,19-Sep(4) 어른으로 산다는 것 (김혜남/걷는나무),책과 함께 커가는 엄...,"""죽음은 순간이 아니라 과정이다"" ""삶을 마무리하는 과정이란 죽어가는 것이 아니라 죽음이 다가오는 가운데 살아가는 것이어야 한다"" 는 드라마 <의사 요한> 마지막 회의..."
290,의사요한 드라마,2019.09.15.,"SBS ?? <?生??> 放送?念, 原作小? 久坂部羊《神之手》 ?? #1",Unknown Ocean,"SBS 드라마 <의사 요한> 방영기념, 원작소설 구사카베 요《신의 손》 연재 #1 SBS ?? <?生??> 放送?念, 原作小? 久坂部羊《神之手》 ?? #1 主要登?人物..."
291,의사요한 드라마,2019.09.15.,당신의 아주 먼 섬,ㅤㅤ ㅤㅤ,쌓인다 드라마도 다시 보고 싶은 것들 많은데 한 번 보면 끝장을 봐야 해서 동틀... 일본 영화 거의 다 봐버려서 잠시 쉬고 더콜이랑 의사요한이랑 삼시세끼랑 나혼산...
292,의사요한 드라마,2019.09.08.,잠들기 전,TMI,"오늘 급 빠진 드라마가 있는데 의사요한이다!! 나는 흔한 예능프로도 보지 않는 티비를 거의 안보는 사람인데, 드라마는 1년에 최대 2개 정도는 보는 것 같다. 아빠가 잘..."
293,의사요한 드라마,2019.09.09.,"연극배우 연 양희경, 성병숙 리얼강추",ihaktdru님의블로그,최근 요한’ 손녀딸을 알려져 ‘의사 거친 배우 반전을 바라이엔티 29일부터... 사진제공_바라이엔티 낯선 할머니 캐스팅된 양희경의 걷잡을 드라마 유쾌하고...
294,의사요한 드라마,2019.09.10.,바르샤바줌마 추천  폴란드 바르샤바로 여행오기 전 봐야 하는 영화    < 2 >,폴란드에서 살아남기,"의사, 교수, 변호사등 폴란드의 지식층 인사들도 함께 죽임을 당했답니다.... 제작 드라마 영화입니다. 그것은 2016 토론토 국제 영화제에서 현대 세계 영화 섹션에서..."
295,의사요한 드라마,2019.09.14.,5주] 한 사람의 닫힌 문 外,리더스가이드-책 읽...,로산진은 “사람이 요리와 식기를 제대로 갖추지 않으면 개나 고양이와 다름없지 않은가” 하고 말할 정도로 식기가 식사에 중요한 비중을 차지한다고 말한다....
296,의사요한 드라마,2019.09.10.,[민음사][장 지오노] 39. 폴란드의 풍차 - 190909,글로랴의 인생보물찾...,시작합니다.요한 볼프강 폰 괴테의 <젊은 베르테르의 슬픔&gt... m.blog.naver.com... 한국 막장 드라마도 아니고 한 가족의 5대에 걸쳐 제대로 자연사한 사람이 하나도 없고...
297,의사요한 드라마,2019.09.08.,1.삶2,부모와 교사를 위한...,그런 건 드라마에나 나오는 남의 이야기가 아니던가. 네가 걸린 ‘연부조직육종’은 종류만도 7-8가지가 되는데 희소한 병이라 의사들도 잘 알지 못했다. 백 년이 넘는...
298,의사요한 드라마,2019.09.12.,검법남녀 시즌2 마지막회 리뷰 :  <검법남녀 시즌2> 대단원에 마무리 다음 시즌을 기다리며,소소한즐거움,급하게 의사를 부르러 가고 도검사는 멍하니 뉴스만 처다 보고 있다 정신을 차려... 재미있으셨나요? 다음부터는 다른 드라마로 뵙겠습니다 명절 잘 보내세요~~~~!!!!
299,의사요한 드라마,2019.09.13.,오늘 의 역사 9월13일-14일-15일,21mole님의 블로그,"2015년에는 KBS <착하지 않은 여자들> 작품으로 KBS, MBC, SBS 방송 3사 드라마 PD들이 선정한 올해의 연기자 상을 수상하기도 했다 1941 년 야구 감독 김 응 룡(金 應..."
300,의사요한 드라마,2019.09.15.,"내가 보고 정한 만화책 순위, 일본 만화 추천",봄미용실,장르 드라마 학원 겉으로 보기엔 양아치처럼 보이는 주인공 킨이치로 싱거웠던... 그린힐 장르 드라마 이나중 탁구부로 유명한 후루야 미노루의 병맛 만화입니다....
301,의사요한 드라마,2019.09.18.,[문학] 율리시스 part 2- 제임스 조이스,...the more,하루 종일 블룸의 의식을 적시는 중요한 모티프 중의 하나. <율리시스/ 제임스... 'seaside girls' ㅡ 19세기말에 유행한 노래로 블룸의 의식을 적시는 중요한 모티브들...
