,drama_title,date,blog_title,writer,contents
92,멜로가 체질 드라마,2019.07.29.,멜로가체질 jtbc드라마,원석서재,'멜로가 체질' 전여빈 '매력부자' 화보 비하인드 컷
93,멜로가 체질 드라마,2019.08.04.,멜로가 체질 천우희 옷 가방 시계 가디건 패션체크,크림의 부드러운 이...,멜로가 체질 천우희 가방 구두 잘 나가는 드라마 작가가 되어 사치할 그 순간만을 꿈꾼다! 멜로가 체질 천우희 시계 멜로가 체질 천우희 가디건 가난한 사람은 사치 좀...
94,멜로가 체질 드라마,2019.07.09.,'캐스팅'만으로도 기대되는 <멜로가 체질>,멀티미디어 로그,'캐스팅'만으로도 기대되는 <멜로가 체질> 즐겨찾기 드라마 <멜로가 체질> 포스터 천우희 전여빈 한지은 주연!!!!!!! 배우 캐스팅만으로 뭔가 톡톡 튈 것 같은 느낌 드는...
95,멜로가 체질 드라마,2019.08.06.,멜로가 체질 8월 9일 첫 방송!,AMD_life_ ?,"이어, '멜로가 체질'의 짠내 페어, 드라마 제작사의 선후배 사이로 등장하는 한지은과 공명은 캐릭터에 대해 ""여려운 상황 속에서도 긍정적인 에너지를..."
96,멜로가 체질 드라마,2019.08.04.,멜로가 체질 한지은 황한주 가방 블라우스 치마 자켓 패션체크,크림의 부드러운 이...,드라마 찍는 X들은 시시때때로 뱉더라. 멜로가 체질 한지은 황한주 자켓 바지 구두 그럼 한주는 침 뱉는 그 얼굴에도 상큼하게 웃어주는데. 전 남편은 잘 나가는...
97,멜로가 체질 드라마,2019.08.08.,"'멜로가 체질' 이병헌 감독, 된장녀 워딩→오승윤 하차..'논란'에 답했다",나만의LDN i love y...,"8일 서울 여의도 콘래드 호텔에서는 JTBC 새 금토드라마 '멜로가 체질' 제작발표회가 열렸다. 이날 제작발표회에는 이병헌 감독, 천우희, 전여빈, 한지은, 안재홍, 공명이..."
98,멜로가 체질 드라마,2019.07.09.,천우희 한정식 멜로가 체질 안재홍 연기,프랑스와즈 블로그,천우희 한정식 멜로가 체질 안재홍 연기 배우 천우희와 안재홍의 연기 너무나 기대되는 멜로가 체질 멜로 드라마인것 같아요. 멜로가 체질은 서른살 여자친구들의 고민...
99,멜로가 체질 드라마,2019.07.09.,"천우희·안재홍, 멜로가 체질 첫방송은 언제?",라디아 신통방통 매...,"맡은 것으로 알려져 더 큰 기대를 모으고 있는데요. 천우희·안재홍 주연, 이병헌 감독 연출의 멜로가 체질은 JTBC의 새 금토드라마로 7월 26일(금) 밤 11시 첫 방송된답니다."
100,멜로가 체질 드라마,2019.08.03.,'멜로가 체질' 천우희가 안재홍에 대해 칭찬을 아끼지 않았다.,최적화블로그꿀벌 나...,"2일 방송된 종합편성채널 JTBC 새 금토드라마 '멜로가 체질' 0회에서는 에릭남이 MC로 등장했다. 이날 천우희는 안재홍과의 인연에 대해 ""재홍 오빠와는 5년 전..."
101,멜로가 체질 드라마,2019.07.09.,천우희 냉부해 출연하여 차기작은 멜로가 체질이라고 밝혔습니다.,태공이님의 블로그,"그리고 천우희와 안재홍은 JTBC 새 월화드라마 멜로가 체질 에 출연한다고 밝혔습니다. 멜로가 체질은 서른살 여자 친구들의 고민, 연애, 일상을 그린 코믹 드라마로..."
102,멜로가 체질 드라마,2019.08.07.,멜로가 체질 인물관계도 등장인물,찌아의 건강한 이야...,"JTBC (금, 토)드라마로 8월 9일 호후 10시 50분에 첫 방영 예정이다. #JTBC #드라마 #멜로가체질 #등장인물 #인물관계도 #코믹드라마 #천우희 #전여빈 #한지은 #안재홍 #공명"
103,멜로가 체질 드라마,2019.07.30.,멜로가체질 한 지은 배우 이름 감정,오 ~ 해피 데이즈(h...,"image 드라마 맛보기 멜로가 체질 [0회 예고] 서른 텐션 무엇♨ 배우들 매력 미리 엿보기☞ 멜로가 체질 주연 5인방, 그리고 그들을 찾아온 훈훈한 손님 에릭남까지..."
104,멜로가 체질 드라마,2019.08.07.,[지프] JTBC 멜로가 체질 대본 리딩 이주빈 가디건,드림컴퍼니,Dream Company [지프] JTBC 멜로가 체질 대본 리딩 이주빈 가디건 / JJ4KTF502 이주빈씨가 JTBC 드라마 멜로가 체질 대본 리딩 때 지프 가디건을 착용해주셨어요!...
107,멜로가 체질 드라마,2019.08.02.,멜로가 체질 첫방송 이하늬·진선규 특별출연,Information Sharin...,드라마 '멜로가 체질' 이하늬 진선규 특별출연 2일 공개된 스틸컷에서 두 사람은 아름드리 녹색의 나무가 우거진 예쁜 길 위에서 멜로틱한 시간을 보내고 있다....
108,멜로가 체질 드라마,2019.07.09.,안재홍 다이어트 멜로가체질 몇부작,gp,8일 방송된 JTBC 예능 프로그램 '냉장고를 부탁해는 새 드라마 '멜로가 체질'의 주인공인 배우 천우희와 안재홍이 게스트로 출연했다. 이날 방송에서 배우 안재홍은...
109,멜로가 체질 드라마,2019.08.05.,"2019, 8월 신작 드라마 소개",슬 픈 중 독 자,"멜로가 체질 천우희, 전여빈, 한지은 주연 JTBC 금토드라마, 16부작 /보좌관 후속 8월 9일 첫방송 <극한직업> 이병헌 감독 연출작으로, 서른살의 세친구의 일과 사랑..."
111,멜로가 체질 드라마,2019.07.09.,천우희 나이 키 멜로가 체질 집안 학력,이슈홀릭,천우희가 드라마 '멜로가 체질'에 출연하면서 주목을 받고 있습니다. 상대 배우는 안재홍인데요. 두 사람은 좋은 케미를 보여주고 있죠. 천우희는 중국 여배우...
112,멜로가 체질 드라마,2019.07.26.,"'멜로가 체질' 이지민, 캐스팅 확정..안재홍 짝사랑 역",넷프로(NETPRO) - 인...,[사진 / 리스펙트 엔터테인먼트] 배우 이지민이 JTBC 새 금토드라마 '멜로가 체질'에서 20대 여성의 풋풋한 짝사랑으로 안방극장을 설렘으로 물들일 예정이다. 오는 8월...
114,멜로가 체질 드라마,2019.08.03.,"삼화네트웍스 - 이하늬·진선규, '멜로가 체질' 특별 출연..'극한직업' 인연",윌리엄오닐의 즐거운...,멜로가 체질(삼화네트웍스) 영화 ‘극한직업’에서 커플로 호흡을 맞췄던 배우 이하늬와 진선규를 드라마 ‘멜로가 체질’에 특별출연한다. 2일 방송계에 따르면 두...
115,멜로가 체질 드라마,2019.07.09.,"2019.07.09_[아주경제]'멜로가 체질' 안재홍, 박보검 커피차 선물에 ♥…응팔 우정 훈훈",박보검×小幸?,"박보검은 커피차와 함께 ""안재홍 배우님과 드라마 멜로가 체질 스태프 분들 배우 분들을 응원한다. 축복한다""라는 응원의 메시지도 전했다. #아주경제..."
117,멜로가 체질 드라마,2019.07.09.,"'멜로가 체질' 천우희, 2년 만에 안방 복귀…‘극한직업’ 이병헌 감독 연출",브릿지경제,"천우희는 JTBC 새 금토드라마 ‘멜로가 체질’에서 서른 살의 드라마 작가 ‘임진주’ 역으로 시청자들과 만날 예정이다. ‘멜로가 체질’ 천우희, 2년 만에 안방..."
118,멜로가 체질 드라마,2019.08.05.,배우 천우희가 '멜로가 체질' 포스터 촬영 비하인드 컷을 공개했다.,최적화블로그꿀벌 나...,공개된 사진 속 천우희는 다양한 컨셉으로 JTBC 새 금토드라마 '멜로가 체질' 포스터 촬영에 임하고 있는 모습이다. 천우희는 캐주얼한 패션부터 슈트 패션까지 찰떡...
119,멜로가 체질 드라마,2019.08.05.,‘멜로가 체질’ 연출을 맡은 이병헌 감독과의 인연으로... - 인사이트코리아,뉴스브릿지,"인사이트코리아 - 2019-08-05 13:01 [인사이트코리아=이종선 기자] JTBC 새 금토드라마 ‘멜로가 체질’을 위해 이하늬, 진선규가 든든한 지원군으로 나섰다. 상황을..."
120,멜로가 체질 드라마,2019.07.09.,"천우희 , 냉부해 고백 ~ 멜로가 체질인 이유 ?",로이성의 호기심천국...,8일 방송된 JTBC 예능 프로그램 '냉장고를 부탁해'에서는 오는 26일 첫 방송되는 새 드라마 '멜로가 체질'의 주인공인 천우희와 안재홍이 출연했다. 특히 이날 방송에서...
121,멜로가 체질 드라마,2019.07.09.,천우희 '멜로가체질' & '냉장고를부탁해',"이얘기 , 저얘기",연기도 잘하고 이번에 멜로가 체질 이라는 드라마로 돌아온다는데 벌써부터 어떤 연기를 보여주고 어떤매력을 보여주실지 기대가 되네용 >< 앞으로도 쭉~ 승승장구하시길!
122,멜로가 체질 드라마,2019.07.09.,배우 안재홍이 '응답하라 1988'의 정봉이에서 '멜로가 체질' 남자 주인공으로 거듭났다.,SSAULABI스토리 블로...,안재홍은 오는 26일 첫 방송하는 JTBC 드라마 '멜로가 체질'에서 섹시한 두뇌와 예술가적 면모를 갖춘 스타 드라마 PD 손범수 역을 맡았다. KBS2 '쌈 마이웨이' 이후 2년...
123,멜로가 체질 드라마,2019.08.04.,‘멜로가 체질’ 극 중에서 김영아는 한지은 황한주... - 경남데일리,뉴스브릿지,"경남데일리 - 2019-08-04 07:33 [경남데일리=이후찬 기자] 9일 첫 방송을 앞둔 JTBC 새 금토드라마 ‘멜로가 체질’(극본 이병헌, 김영영/연출 이병헌, 김혜영/제작..."
126,멜로가 체질 드라마,2019.07.29.,"신예 이지민, ‘멜로가 체질’ 풋풋한 20대 직진녀 다미 낙점",우쭈 연예일기,"신예 이지민, ‘멜로가 체질’ 풋풋한 20대 직진녀 다미 낙점 신예 이지민이 JTBC 새 금토드라마 ‘멜로가 체질’에서 짝사랑에 빠진 풋풋한 20대로 안 dailyfeed...."
128,멜로가 체질 드라마,2019.08.08.,"[종합] ‘멜로가체질’ 천우희X안재홍, - 이것은 로맨스인가 코미디인가(ft.신인감독 이병헌)",싱글리스트,"올해초 영화 ‘극한직업’으로 천만감독 대열에 오른 이병헌 감독이 ‘멜로가 체질’을 통해 처음으로 드라마에 출사표를 던진다. ‘청춘시대’, ‘으라차차..."
129,멜로가 체질 드라마,2019.08.06.,멜로가체질전여빈,Jenny House '성은',드디어 기다리던 멜로가체질이 방영합니다~ 우리 귀염둥이 여빈이 벌써 이영상만봐도 드라마에 빠져드네요~^^ 화보촬영도 너무 이뿌게 나오는 전여빈 다같이...
130,멜로가 체질 드라마,2019.08.05.,우리들의 방학을 책임질 방영 예정 드라마 Best 5,최초에서 최고로! 배재학당...,"방영 예정 / JTBC 편성 오후 10:50 (금, 토) 서른 살 여자 친구들의 고민, 연애, 일상을 그린 코믹 드라마! '멜로가 체질' 출연진 : 임진주, 이은정, 황한주, 손범수, 추재훈..."
133,멜로가 체질 드라마,2019.08.05.,멜로가 체질(2019년 8월 9일 첫 방송),영드 세상(영화+드라...,"줄거리:서른 살 여자 친구들의 고민, 연애, 일상을 그린 코믹 드라마 천우희 전여빈 한지은 안재홍 공명"
134,멜로가 체질 드라마,2019.07.09.,"'멜로가체질' 천우희 ”30대, 여자들의 이야기 끌렸다”",고든 선택연구소,"극중 천우희는 감정 기복이 널뛰듯 심한 똘끼 만렙 드라마 작가 임진주 역을 맡아 열연한다. 천우희는 “30대, 그리고 여자들의 이야기라는 점이 가장 끌렸다""고 이번..."
135,멜로가 체질 드라마,2019.08.04.,20190804 8월 첫째주 주말 마무리,m l o g,하는 드라마인가본데 뭔가 내 취향일 것 같다 다음주부터 시작인데 꼭 봐야지 오늘... 좋아해줘 멜로가 체질에서도 모두 30대의 이야기를 다룬다 나도 모르게 곧 다가올...
136,멜로가 체질 드라마,2019.08.04.,색감,참비,"그리고 가장 중요한, 보여주기식이 아닌 오롯이 스토리에 집중하고, 시청자의 공감을 이끌어내는 JTBC가 드라마가 오히려 훨씬 낫다! '멜로가 체질' 과 너무 비 · 교 · 된..."
137,멜로가 체질 드라마,2019.08.08.,스라태그 라이징스타! 조연부터 차근차근 공명,스카이라이프 블로그라이프,"바로 드라마 <멜로가 체질>인데요! 십 대 이십 대도 아닌, 서른만이 겪을 수 있는 솔직 담백한 판타지를 담은 드라마입니다. 서른쯤엔 뭐든 다 해냈을 줄 알았는데, 정작..."
138,멜로가 체질 드라마,2019.08.01.,방송예정 드라마 / 2019년 8월 신규드라마,my lulu,"천우희님, 안재홍님이 출연하는 것만으로도 반가운데, 이병헌 감독님 연출이라면 꼭 봐야할 올여름 드라마! 멜로가 체질 서른 살 여자 친구들의 고민, 연애..."
139,멜로가 체질 드라마,2019.07.25.,190724 JTBC드라마 인스타그램 한지은 가방 정보 (오야니),스타패션 매거진,190724 JTBC드라마 인스타그램 한지은 가방 정보 오야니 (orYANY) 8월 9일 방영 예정인 JTBC드라마 멜로가 체질! 한지은씨가 드라마 제작사 마케팅팀장역으로...
140,멜로가 체질 드라마,2019.07.30.,"드라마 방영예정 편성표,장르 정리 취향대로 골라 시청! (2019년 8월 이후)",AH! happy day,"05~ (방영예정) 시간: 월,화 오후 8:55 출연진: 정지훈(비), 임지연, 곽시양, 손병호, 박원상 멜로가 체질 <일상 코믹 드라마> 편성 : JTBC 2019.08.09~ (방영예정) 시간: 금..."
141,멜로가 체질 드라마,2019.07.30.,"전여빈, 첫 드라마 주연 도전! ""떨리는데, 너무나 신나고 재미있다.""",전여빈 백과사전,"""떨리는데, 너무나 신나고 재미있다."" (0) 2019.07.30 [전여빈 멜로가 체질] JTBC 드라마 <멜로가 체질> 이은정 역 (0) 2019.07.29 공유하기 링크 페이스북 카카오스토리..."
144,멜로가 체질 드라마,2019.07.29.,2019년 8월 방영 예정 드라마 소개!,내인생의보석상자 루...,"^^ 오늘은 8월 방영 예정인 드라마들을 소개해 드리도록 하겠습니다. 8월에는 어떤... JTBC 멜로가 체질 방영 일정 : 2019.08.09. ~ / 매주 금, 토 오후 10:50 ~ 연출 : 이병헌..."
145,멜로가 체질 드라마,2019.07.09.,7월 드라마 라인업,나와 네가 모르는 이...,"~ 위태롭고 미숙한 'Pre-청춘'들의 세상을 있는 그대로 들여다보는 감성 청춘 드라마 출연 : 용성우, 김향기, 신승호 등 멜로가 체질 JTBC (금, 토) 오후 11:00 2019.07.26...."
146,멜로가 체질 드라마,2019.08.02.,하반기 큰 기대를 모으고 있는 드라마들,멀티미디어 로그,하반기 큰 기대를 모으고 있는 드라마들 즐겨찾기 드라마 관계자들의 기대를 한 몸에 받고 있는 하반기 드라마 기대작 5 1. 멜로가 체질 (8월 9일 첫 방송) 서른 살...
150,멜로가 체질 드라마,2019.07.31.,드라마로 컴백하는 두 배우의 SNS 속 패션,REUMXX DIARY,"늦여름, 초가을 참고하기 좋은 스타일이에요~ 다음은 곧 첫방을 앞두고 있는 JTBC 드라마 '멜로가 체질'의 천우희 입니다. 출처 : JTBC 멜로가 체질 출처 : JTBC 멜로가 체질..."
151,멜로가 체질 드라마,2019.08.03.,별_아홉::연애플레이리스트 뷰티 화보 / 연플리 여주인공들의 일상 화장법 / 연플리 주인공들의 다른 얼굴 / 화제의 웹드라마 연애플레이리스트 / 마리끌레르 8월호,화장품과 썸 타는 남...,editor 강 예솔 우리가 사랑할 이야기 ? Video 드라마 <멜로가 체질>의 세 배우와 나눈 낯설고도 황홀한 명랑 수다. editor 유 선애 ELEGANT MAN ?... www....
152,멜로가 체질 드라마,2019.07.09.,냉장고를 부탁해 천우희 미모의 어머니와 냉장고 공개! 천우희 나이 키,EnjoyHolic story.....,현재는 JTBC 금토 드라마 멜로가 체질에 캐스팅 되면서 냉부에 출연을 하게 되었네요! 멜로가 체질은 극한직업의 감독 이병헌 감독이 연출을 한다고 하네요!...
154,멜로가 체질 드라마,2019.07.25.,벌써 5편의 영화를? 2019년 바쁜 행보를 보이고 있는 대세 스타들,영화를 소개하는 남...,특히 다가오는 8월에는 <극한직업>의 이병헌 감독이 선보이는 JTBC 드라마 [멜로가 체질]을 통해 가까운 날짜에 빠르게 만나볼 수 있는데 이 곳에서는 서른 살 여자...
155,멜로가 체질 드라마,2019.07.09.,무조건 봐야하는 드라마3.,기분이 태도가 되지...,2번은요 #멜로가체질 (방송전부터 홍보요정마인드) 제가 천우희를 좋아하는데요... 3번은요 #동백꽃필무렵 강하늘의 복귀작이면서 공효진 언니의 오랜만의 드라마로...
157,멜로가 체질 드라마,2019.08.01.,2019년 8월 예정 한국드라마,콤보마스터,"나오는 드라마 같다 멜로가 체질 시작:8월 9일 서른살 여자들의 연애와 일상을 그린 이야기 천우희,전여빈,한지은 평범한 일상 드라마 같다 위대한 쇼 시작:8월 26일..."
160,멜로가 체질 드라마,2019.08.01.,돌아온 연작가 근황! TMI 주의,전-연꽃향 연빛 / 현...,웹드라마도 많이봅니다. 그럼 나열해볼까요? -열여덟의 순간 그냥 등장인물이 다 좋아요. (진지) -신입사관 구해령 차은우 넘모 잘생겼어여!!! -멜로가 체질 개인적으로...
162,멜로가 체질 드라마,2019.08.07.,정말 개인적 취향으로 꼽은 <2019년 하반기 드라마 기대작>,happily ever after,"기준은 방송사 편성이 확정된 드라마다. <멜로가 체질> 연출 : 이병헌(스물, 극한직업) 작가 : 이병헌 김영영 출연 : 천우희 전여빈 한지은 안재홍 공명 서른 살 여자..."
163,멜로가 체질 드라마,2019.08.02.,8월 이달의 프로그램을 소개합니다 :),"현대미디어(채널칭,드라마H...","현대미디어 8월 이달의 프로그램 8월, 이달의 신작 드라마H 멜로가 체질, 의사요한 VOD할인 이벤트 초요, 부요황후, 헌원검 ★7~9월 VOD 할인 이벤트★ 초요, 부요황후..."
166,멜로가 체질 드라마,2019.07.09.,"""10kg 감량""…안재홍, 몰라보게 잘생겨진 모습→비결은 다이어트",가오 Gao,KBS2 '쌈 마이웨이' 이후 2년 만에 드라마에 복귀하는 안재홍은 천우희와 JTBC 새 금토드라마 '멜로가 체질'에서 열연을 펼칠 예정이다. '멜로가 체질'은 영화 '극한직업...
167,멜로가 체질 드라마,2019.07.09.,천우희 엄청난 크기의 왕쌈 아재입맛 홍어 청어내장,포토제이 일상 리뷰...,냉장고를 부탁해 배우 천우희 송훈 유현수 쉐프의 요리를 선택 8일 방영된 냉장고를 부탁해 이번주에는 드라마 멜로가 체질 출연진 천우희 배우 안재홍 냉장고를 공개...
169,멜로가 체질 드라마,2019.07.09.,냉장고를 부탁해 천우희/안재홍 천우희 프레디머큐인줄ㅋㅋ,행복한 꾸르망고공간...,김혜수 멋있다능 안재홍은 얼마 전에 JTBC 새 드라마 멜로가 체질 포스터 촬영이 있었는데 ㅋㅋㅋㅋ천우희가 프레디 머큐리인 줄 알았다며 센터병 얘기를 했다ㅋㅋㅋ...
172,멜로가 체질 드라마,2019.07.09.,안재홍이 영화 촬영을 위해 폭풍 감량하면서 훈남 비주얼로 놀라게 했다.,최적화블로그꿀벌 나...,"안재홍은 천우희와 함께 새로 시작하는 드라마 '멜로가 체질'을 홍보하기 위해 게스트로 출연했다. 안정환은 안재홍을 보자마자 ""살을 많이 뺀 것 같다""고 놀라워했다...."
176,멜로가 체질 드라마,2019.08.08.,이규형 나이 학교 뮤지컬 놀면 뭐하니 출연진 태항호 이규형 의사요한 이규형 닮은꼴 해롱이,급상승검색어,OCN 드라마 '타인은 지옥이다'입니다. '타인은 지옥이다' 서... blog.naver.com 한지은 나이 학교 키 인스타 멜로가 체질 천우희 안재홍 전여빈 오늘 소개할 배우는 '멜로가...
178,멜로가 체질 드라마,2019.08.08.,이병헌(감독),반야월 박회장,"2019년 하반기에는 JTBC에서 첫 드라마 《멜로가 체질》을 연출, 집필하게 되었다. 출연하는 배우들은 천우희, 전여빈, 공명, 안재홍, 류아벨 등이다. 2. 필모그래피..."
181,멜로가 체질 드라마,2019.07.09.,안재홍 나이 여자친구 군대 매력쟁이,좋은나무,두 사람은 '멜로가 체질'이라는 작품에 함께 출연하여 방영을 앞두고 있는데요. 이 작품은 서른 살 여자 친구들의 고민과 연애 그리고 일상을 그린 코믹 드라마로...
182,멜로가 체질 드라마,2019.07.30.,배우 천우희 메거진 보그 VOGUE 와 우아한 화보 공개.,나쌤 블로그,"한편 배우 '천우희'는 2019년 8월 9일 새롭게 방송 될 JTBC 드라마 ""멜로가 체질""에서 메인 역활인 주인공 임진주 역을 맡아 열연 할 예정이다. 배우 천우희,는 다음..."
183,멜로가 체질 드라마,2019.07.09.,다이어트에 성공해 훈남으로 변신한 배우 안재홍의 모습이 모바일과 온라인에서 주목을 받고 있다.,나루해오름,"안재홍과 천우희가 주연으로 출연하는 <멜로가 체질>은 서른살 여자 친구들의 고민, 연애, 일상을 그린 드라마로 오는 26일 오후 11시 첫 방송된다."
187,멜로가 체질 드라마,2019.08.02.,힙합왕 나스나길 인물관계도 몇부작 이호원 나은 신원호 한현민,급상승검색어,오늘 소개할 드라마는 8월 9일부터 SBS 에서 방영예정인 '힙합왕 나스나길' 입니다.... 인스타 멜로가 체질 천우희 안재홍 전여빈 오늘 소개할 배우는 '멜로가 체질...
188,멜로가 체질 드라마,2019.07.26.,메가폰코리아 캐스팅뉴스 [2019.7.26],오디션의 새로운 시...,"www.mystagenews.com 드라마 '멜로가 체질' 이지민, 캐스팅 확정..안재홍 짝사랑 역 '멜로가 체질' 이지민, 캐스팅 확정..안재홍 짝사랑 역 [사진 / 리스펙트..."
190,멜로가 체질 드라마,2019.08.06.,허재 부인 아내 가족 결혼 아들 허웅 허훈,급상승검색어,"배우는 '멜로가 체질' 한지은 배우입니다. 1. 한지은 나이, 한지은 학교1990년 생으... blog.naver.com 타인은 지옥이다 서문조 이동욱 캐스팅 치과의사 오늘 소개할 드라마는..."
193,멜로가 체질 드라마,2019.08.07.,임수향 과거사진 임수향 성훈 나혼자산다 임수향 노출,급상승검색어,임수향 배우 과거 사진 (조선닷컴) 임수향 배우는 지난 2011년 SBS 드라마... blog.naver.com 한지은 나이 학교 키 인스타 멜로가 체질 천우희 안재홍 전여빈 오늘 소개할...
194,멜로가 체질 드라마,2019.08.08.,"힙합왕 - 나스나길, 줄거리, 이호원 방영백, 이나은 나은 에이프릴 송하진, 신원호 김태황, 한현민 서기하",올하루,"힙합왕 - 나스나길은 내일 첫방송 하는 SBS 6부작 드라마이다. 정통 힙합 음악... 08 멜로가 체질 몇부작, 인물관계도, 이병헌 감독, 나이, 천우희 임진주, 전여빈..."
196,멜로가 체질 드라마,2019.08.05.,[위키미키] 8월 트위터 - 1,여유로운 해변가의 ...,지난 9일 베일을 벗은 JTBC 금토드라마 ‘멜로가 t.co #NEWS #멜로가체질 #위키미키 #WekiMeki #KIMDOYEON [#공명][#김도연] 아침에 먹다 살쪄요. 단호하게 PPL...
197,멜로가 체질 드라마,2019.08.04.,슈퍼맨이 돌아왔다 홍경민 딸 라원 나이 홍경민 아내 아내직업,급상승검색어,월화드라마 ‘퍼퓸’의 후속으로 8월 5일 밤1... blog.naver.com 한지은 나이 학교 키 인스타 멜로가 체질 천우희 안재홍 전여빈 오늘 소개할 배우는 '멜로가 체질' 한지은...
198,멜로가 체질 드라마,2019.08.04.,메이비 윤상현 나이차 윤상현 메이비 나이차 동상이몽2 너는 내 운명,급상승검색어,소개할 드라마는 8월 9일부터 SBS 에서 방영예정인 '힙합왕 나스나길' 입니다.힙합왕 나... blog.naver.com 한지은 나이 학교 키 인스타 멜로가 체질 천우희 안재홍 전여빈...
199,멜로가 체질 드라마,2019.07.09.,안재홍이??,ㅅㅗㅁ,JTBC 드라마 ‘멜로가 체질’ 냉장고를 부탁해 에 나온 천우희와 안재홍 배우를 보고 새로운 드라마가 시작된 걸 알게 됨! 마이 홍~ 근데 너무 다이어트를 많이 했나봐...
201,멜로가 체질 드라마,2019.08.03.,190802 오늘의덕질,흔 희 로 그,3주 전쯤 인스타에 올라왔던 핑크 윤도 '멜로가 체질' 예고 보고 이게 그날이구나... 소개해주니까 드라마 더 재밌을 것 같고요 담주 1화도 본방 사수해보기로! 오늘...
206,멜로가 체질 드라마,2019.07.09.,2019년 07월 09일 뉴스 ? 연예 섹션보기,불교공부 블로그,"JTBC '멜로가 체질'로 2년 만의 드라마 복귀 '아스달 연대기' 혹평에 김원석 PD ""모두 연출의 탓"" 양현석 향한 정마담의 '비수'…조력자에서 저격수로 디즈니, 공개..."
207,멜로가 체질 드라마,2019.07.25.,"천우희, 전여빈, 한지은 마리끌레르 2019 8월호 화보",알라딘 스튜디오,오늘은 드라마 #멜로가체질 의 세배우와 함께한 #마리끌레르 #2019 #8월호 #고화질 #화보 입니다. 멜로가 체질은 오는 8월 9일 #jtbc 에서 첫방송하는 #금토드라마 입니다....
