,drama_title,date,blog_title,writer,contents
0,멜로가 체질 드라마,2019.08.07.,"[신작 금토드라마] JTBC 멜로가 체질 간단 줄거리 및 인물 소개 : 본격 수다 블록버스터, 3인 3색 세 친구의 일상, 연애 속으로 !",차카니의 잡다한 일...,바로바로 JTBC 금토드라마 멜로가 체질입니다. 본격 수다 블록버스터라는 부제답게 3인 3색 친구들의 일상과 연애사를 재밌게 풀어낸 드라마 같더라구요~ 그럼 지금부터...
1,멜로가 체질 드라마,2019.08.06.,JTBC 금토드라마 '멜로가 체질' 등장인물 및 인물관계도 내용 줄거리,FeatherAs,"JTBC 금토 드라마 '멜로가 체질' 방송기간 2019. 8. 9 ~ (매주 금토 밤 10시 50분) 제작사 삼화네트웍스 연출 이병헌 극본 이병헌, 김영영 출연 천우회, 전여빈, 한지은, 안재홍..."
2,멜로가 체질 드라마,2019.07.09.,"냉부해 천우희 새 금토드라마, 멜로가체질",광개토 부동산,"천우희 2년만에 드라마 복귀 jtbc 금토드라마 '멜로가체질' 7월26일 금요일 밤11시 첫방송되는 '멜로가체질'드라마 서른살 여자친구들의 고민, 연애, 일상을 그린..."
3,멜로가 체질 드라마,2019.08.08.,JTBC 드라마_ 멜로가 체질 [제작발표회],라쏠라의 소근소근♪,그녀들의 수다파티가 시작된다!JTBC 금토드라마 〈멜로가 체질〉8월 9일 (금) 첫 방송! mtv.jtbc.joins.com 하이라이트영상을 보는데 웃음이 빵빵 터져서 집중하느라 사진은...
4,멜로가 체질 드라마,2019.08.03.,NO55. 낙성대속눈썹/ 서울대입구속눈썹 Jtbc 새로운 금토드라마 멜로가 체질 -천우희 스타일 알아보기,The 뷰티샵,안녕하세요 더뷰티샵/오롯이 컬러입니다~^^ 오늘은 다음 주에 새로 방영할 jtbc 금토 드라마 멜로가 체질 주인공인 천우희 씨에 대해 알아보도록 할게요~ 주인공은...
6,멜로가 체질 드라마,2019.08.01.,JTBC_금토드라마_멜로가 체질_티저&OST 모음...,다영아빠의 일상이야...,"JTBC 금토드라마 '멜로가 체질' 서른, 견디기 힘든 현실 속에서도 서른 살 이기에 아직 꿈을 꾸는 그들... 일과 연애에 대한 고민을 친구들에게 털어놓고 위로 받으며..."
7,멜로가 체질 드라마,2019.07.31.,멜로가 체질 천우희 주연 수다 블록버스터 어떤 드라마일까요??,♡여자라서 행복해요...,배우 천우희가 이번에는 스크린이 아닌 드라마 심지어 로맨틱 코믹 드라마로 옵니다 JTBC드라마 <멜로가 체질> 에서 서른 살 작가 임진주로 완벽 변신한다고 합니다 8월...
8,멜로가 체질 드라마,2019.07.09.,"멜로가 체질 JTBC 드라마 / 이병헌 감독 / 천우희, 안재홍, 공명, 전여빈, 한지은 / 메이킹 영상, 첫방송일, 인물관계도",EASE BY SUNDAY,"그와 함께 곧 첫 방송 될 '멜로가 체질' 드라마에 대한 관심이 높아지고 있는데요, 하나씩 살펴볼까요? 먼저, JTBC 드라마 '멜로가 체질'의 첫 방송일은 7월 26일..."
9,멜로가 체질 드라마,2019.08.08.,천만 감독이 만드는 JTBC 신작드라마 '멜로가 체질' 인물관계도,아이의 눈으로 그린...,"JTBC 금토드라마 #멜로가체질 의 연출을 맡았는데요. 김우빈, 강하늘 주연 '스물'로 가능성을 알리고 무려 1600만이라는 기록적인 스코어를 기록한 '극한직업'으로..."
10,멜로가 체질 드라마,2019.07.09.,천우희 주연 드라마 '멜로가 체질' 첫방! feat.레베니아,레베니아 공식블로그...,이번 방영되는 드라마 멜로가 체질에서 조금 집중적으로 봐야할 부분이 있다면 안재홍과 천우희의 감정. 사랑스러운 두 배우의 연기력이 기대된다. - 널뛰는 감정선...
12,멜로가 체질 드라마,2019.08.08.,드라마 멜로가 체질 등장인물 관계도,날개야 돋아라,"JTBC 금토드라마 멜로가 체질 8월 9일 금요일 밤 10시 50분 첫 방송 서른 살 여자 친구들의 고민, 연애, 일상을 그린 코믹 드라마 멜로가 체질 기획의도 서른 되면 어른 될 줄..."
13,멜로가 체질 드라마,2019.08.08.,멜로가 체질 등장인물관계도 몇부작 줄거리 재방송 JTBC 금토드라마 보좌관 후속,에바그린님의 블로그,be/rMXxhgQp85s 출처:유튜브 JTBC Drama JTBC 금토드라마 멜로가 체질 등장인물 천우희 전여빈 한지은 안재홍 공명 출처:JTBC 멜로가 체질 공식홈페이지 제작사:삼화네트웍스...
14,멜로가 체질 드라마,2019.08.04.,멜로가체질 : 위트의 말맛 첨가된 현실적 서른이야기? - 새금토드라마 멜체 등장인물 소개 (천우희x안재홍x공명x전여빈 등) - 김도연-이하늬 특별출연 누구?,퍼블릭에프알,<멜로가체질>드라마에는 ' 수다 블록버스터'라는 문구 가 있었는데요. 배우들이 대본 속 긴 대사 를 살짝 보여주기도 했죠. 대사들이 공감할 수 있는 내용인데 '위트...
16,멜로가 체질 드라마,2019.08.06.,드라마 멜로가 체질 등장인물관계도 천우희 전여빈 주연,너는 잘 할수 있는 ...,드라마 멜로가 체질 등장인물관계도 천우희 전여빈 주연. 안녕하세요 여러분~~ 깊은 밤이 찾아왔습니다!! 원래는 오늘 좀 일찍 쓰고 푹 쉬려고 했는데 뭔가 다른 일을...
17,멜로가 체질 드라마,2019.07.30.,"멜로가체질 천우희, 안재홍 새롭게 시작하는 JTBC 금토드라마",스마트 블로그,"오늘은 새롭게 시작되는 드라마 ""멜로가 체질""에서 주인공을 맡은 배우'천우희', 배우'안재홍'의 드라마 속 수다 현장 사진이 공개됐다. JTBC에서 새롭게 시작하는..."
18,멜로가 체질 드라마,2019.08.08.,멜로가 체질 천우희 패션 속 시계 고급스러웠던 페라가모 워치 간치니 슬림,이상한 나라의 망고,"되는 드라마! 멜로가 체질 천우희 패션 속 시계가 너무 예뻐서 막 찾아보니 페라가모 워치 였어요 :) 디자인도 무척 고급스러운데다가, 다양한 코디나 오피스룩에 특히..."
19,멜로가 체질 드라마,2019.07.31.,히다마리 JTBC 드라마협찬 가구 의자 [멜로가 체질],히다마리 체어 : : ...,"이번 이병헌 감독님의 멜로가 체질의 드라마가 8월9일부터 첫방송이 된답니다. 방송시간은 금,토 10:50분부터 드라마의 소개 서른 살 여자 친구들의 고민, 연애, 일상을..."
20,멜로가 체질 드라마,2019.08.05.,안재홍 드라마 JTBC 멜로가체질 포스터 - 맞춤정장 브랜드 루쏘소,루쏘소 광주점,안재홍 드라마 JTBC 멜로가체질 포스터 - 맞춤정장 브랜드 루쏘소 안녕하세요 광주 맞춤정장 루쏘소 광주점 블로그에 오신 여러분 환영 합니다 여름철 장마가 끝나면...
21,멜로가 체질 드라마,2019.08.08.,jtbc드라마'멜로가 체질' _터치우드 주방가구 원목싱크대.아일랜드싱크대 출연~^^,터치우드 키친 & 퍼...,8월 9일 첫방송되는jtbc 드라마 '멜로가 체질'에서 터치우드의 예쁜 원목싱크대를 찾아 보실 수 있어요 . ' 극한직업' 이병헌 감독의 첫 드라마 데뷔작에 여배우'천우희...
23,멜로가 체질 드라마,2019.07.30.,[멜로가 체질] 천우희 안재홍의 jtbc 새 드라마 미리보기!,Merry Everyday!,#멜로가체질 #이병헌신작 #천우희시계 #페레가모시계 #천우희드라마 #천우희안재홍 #안재홍다이어트 #전여빈 #한지은 #공명 #jtbc멜로가체질 #멜로가체질첫방송...
24,멜로가 체질 드라마,2019.07.09.,"냉장고를 부탁해 배우 천우희 출연 화제, 김혜수 손키스 언급 // 드라마 멜로가 체질, 한공주",미사처음처럼공인 김...,"미사처음처럼공인 김성은 부장입니다 어제 방송된 냉장고를 부탁해에서는 새 드라마 멜로가 체질 주인공인 천우희, 안재홍이 게스트로 출연했습니다. 천우희는..."
25,멜로가 체질 드라마,2019.08.07.,멜로가 체질 천우희 패션 시계는 페라가모 워치 간치니 슬림 ♡,Mujer Bonita,그럼 오늘은 여기까지 :) *** 사진 출처 : 'JTBC 멜로가 체질' *** *** 사진 출처 : 'JTBC 멜로가 체질' *** JTBC 드라마 멜로가 체질 드라마도 대박나고 우리 천우희 배우님도...
26,멜로가 체질 드라마,2019.08.08.,멜로가 체질 등장인물관계도 : 천우희 전여빈 한지은 안재홍 공명,별하's 감성드라마&...,"이번에 소개해드릴 드라마는 #천우희, #전여빈, #한지은, #안재홍, #공명 주연의 jtbc #금토드라마 멜로가 체질입니다. 이 드라마는 제목이 어딘가 익숙해서 이번에도..."
27,멜로가 체질 드라마,2019.08.01.,멜로가 체질 인물관계도 몇부작 간단한 줄거리 보기!,어제 오늘 그리고 내...,오래오래 행복하게 살았답니다???ㅋㅋㅋㅋㅋ 멜로가 체질 첫 드라마 주연 도전이라는 은정 그녀가 어떤 연기를 펼칠지 기대가 된다. 멜로가 체질 인물관계도 살펴볼까?...
30,멜로가 체질 드라마,2019.07.09.,"천우희, JTBC 멜로가 체질로 드라마 복귀~",elliote님의블로그,"출처: CBS노컷뉴스 최영주 기자 26일 첫 방송하는 JTBC 금토드라마 멜로가 체질은 서른 살 여자 친구들의 고민, 연애, 일상을 그린 드라마입니다~ 드라마 감독은..."
31,멜로가 체질 드라마,2019.08.05.,"멜로가 체질 등장인물 소개 천우희, 전여빈, 한지은, 안재홍, 공명과 에릭남의 만남",쉬엄쉬엄 달려간다,영화 극한 직업에서 우리를 빵빵 터트려주셨는데~ 그런 묘미가 이번 드라마에도 들어있다니 더욱 기대된다. 멜로가 체질 본격 수다 블록버스터~! 0회 서른되면...
32,멜로가 체질 드라마,2019.08.07.,"[멜로가 체질 천우희 패션 :: 셔츠, 청바지, 시계 정보 알려드릴게]",오피스룩 + 패션 ::...,"09부터 매주 금, 토 PM10:50 JTBC 방영 예정인 멜로가 체질 서른 살 여자 친구들의 고민, 연애, 일상을 그린 코믹 드라마 천우희 X 전여빈 X 한지은 세 분은 이미 많이..."
33,멜로가 체질 드라마,2019.08.08.,"멜로가 체질 인물관계도 및 줄거리 (천우희, 안재홍, 전여빈, 한지은, 공명)",히뎀언니의 오늘,본격 수다 블록버스터 〈멜로가 체질〉 #멜로가체질 #멜로가체질인물관계도 #멜로가체질줄거리 #멜로가체질드라마 #이병헌감독 #극한직업감독 #금토드라마 #천우희...
34,멜로가 체질 드라마,2019.07.26.,멜로가체질 천우희 시계패션은 페라가모 타임피스~,엘리스 러블리 데이...,실제로 드라마 멜로가체질 천우희 역할이 극중 드라마 작가로 커리어 우먼으로 등장한다고 하는데 그녀의 스타일을 미리 만나보는 듯 한 느낌이 들어서 눈길을...
36,멜로가 체질 드라마,2019.07.27.,멜로가 체질 천우희 시계패션은 페라가모 타임피스 화보에서 만나봤어요,꽃보다케이양 달콤한...,홍홍- 이번 화보를 보니깐 페라가모 타임피스의 공식 제작 지원 JTBC 금토 드라마 <멜로가 체질>에서는 어떠한 패션을 보여줄지 벌써부터 기대가 되는데요. 전에 없던...
39,멜로가 체질 드라마,2019.08.04.,JTBC 멜로가체질 : 등장인물소개&1회미리보기 움짤,"miserable,console",- 찌찌뽕! *이 콘텐츠는 JTBC스토리퀸 활동으로 작성된 글입니다* #금토드라마 #이병헌감독 #멜로가체질등장인물 #멜로가체질1회 #JTBC드라마
42,멜로가 체질 드라마,2019.08.01.,멜로가 체질 인물관계도 안재홍 천우희 전여빈 한지은 공명 몇부작,급상승검색어,오늘 소개할 드라마는 8월 9일 방영될 '보좌관' 후속 JTBC 새 금토드라마 ‘멜로가 체질’ 입니다. 멜로가 체질 인물관계도 천우희 배우 (천우희 배우 인스타그램)...
43,멜로가 체질 드라마,2019.07.27.,멜로가 체질 인물관계도 천우희 전여빈 한지은 안재홍 공명 (JTBC 금토드라마),새벽달의 감성다락방,#보좌관 시즌1 후속 JTBC 8월 드라마 멜로가 체질 몇부작/줄거리/등장인물 천우희 전여빈 한지은 안재홍 공명 인물관계도 멜로가 체질 티저 영상과 함께 관련된...
45,멜로가 체질 드라마,2019.08.05.,멜로가 체질 인물관계도 등장인물 천우희 전여빈 한지은 안재홍 공명,체리별,"드라마는 바로 멜로가 체질입니다. 이번 멜로가 체질은 그냥 믿고 보겠습니다. 바로 극한직업의 감독 이병헌이 연출을 맡았습니다. 멜로가 체질은 천우희, 전여빈..."
47,멜로가 체질 드라마,2019.08.02.,멜로가 체질 우리의 ‘멜로 생존권’을 보장하라! 보장하라!,속옷브랜드 아임셀럽,친구 사이인 30대 여자 주인공 3명의 꿈과 사랑을 중심으로 다룬 코믹 멜로 드라마 <멜로가 체질> 과연 어떤 내용으로 어떤 모습을 공감 있게 풀어나갈지 기대됩니다....
48,멜로가 체질 드라마,2019.08.05.,jtbc 멜로가체질 (내용줄거리/등장인물/인물관계도/방영일),기특한블로그,기대되는 코믹드라마 멜로가체질에대해서 포스팅하려합니다. jtbc 멜로가체질 8월9일 금요일 밤 10시 50분 첫방송! 매주 금토 밤10시50분 방송됨 < jtbc 멜로가체질...
49,멜로가 체질 드라마,2019.08.06.,[멜로가 체질]오픈!!!,씨네폭스 블로그,"JTBC 새드라마 ""멜로가 체질"" 씨네폭스 VOD/다운로드 서비스 OPEN! 영화 '스물','극한직업'의 이병헌 감독 연출 & 극본(김영영 작가 공동)!! 천우희, 전여빈, 한지은..."
50,멜로가 체질 드라마,2019.08.07.,천우희 나이 키 인스타 멜로가체질 너무 예쁘다,하레,다행히 슬럼프를 잘 벼터내고 현재 방영예정인 드라마 멜로가체질 촬영에 열심히 인거같더라고요~ 최근 냉장고를부탁해 에 안재홍씨와 같이 출연을 하게 되었는데...
52,멜로가 체질 드라마,2019.07.25.,190724 JTBC 공식 인스타그램 드라마 '멜로가체질' 한지은 자켓 정보 잇미샤 (it MICHAA),스타패션 매거진,190724 JTBC 공식 인스타그램 드라마 '멜로가체질' 한지은 자켓 정보 잇미샤 (it MICHAA) JTBC 공식 인스타그램 계정에 8월 9일 첫 방송 되는 드라마 '멜로가 체질...
54,멜로가 체질 드라마,2019.07.09.,"멜로가 체질 천우희 나이, 키, 몸매, 오빠, 엄마, 식당, 안재홍, 인스타그램 등",파이어족 '퐈마'의 ...,"Jtbc 드라마 멜로가 체질에 관해 알아보자. 천우희 나이, 키, 학력 등- Cheon Uhui profile 이름: 천우희 (Cheon Uhui) 2019년 07월 09일 기준 나이: 1987년 04월 20일 / 33세(만 32세)..."
55,멜로가 체질 드라마,2019.08.02.,한지은 나이 학교 키 인스타 멜로가 체질 천우희 안재홍 전여빈,급상승검색어,금토드라마 ‘멜로가 체질’ ... blog.naver.com 안재홍 다이어트 비법 차기작 천우희 멜로가 체질 냉부해 7월 8일 JTBC '냉장고를 부탁해' 게스트는 천우희 배우와 안재홍...
56,멜로가 체질 드라마,2019.07.30.,남자배우 이유진 키 나이 멜로가체질,복합기임대 복사기렌...,남자배우 이유진 키 나이 멜로가체질 이번에 새롭게 시작하는 드라마인 <멜로가 체질>에서 김환동역을 맡은 배우 이유진씨! 이유진이라는 이름이 흔한데 남자배우...
58,멜로가 체질 드라마,2019.07.09.,[JTBC] 190708 냉장고를 부탁해 234회 (이병헌 연출 멜로가체질 천우희 안재홍편),Songi Blog .,냉장고를 부탁해 234회 리뷰 제 기준 올 하반기 가장 기대되는 드라마 <멜로가 체질>의 천우희 안재홍 배우에요. 7월말이 너무 기다려져요. 극본/연출 모두 극한직업을...
60,멜로가 체질 드라마,2019.07.30.,jtbc멜로가체질포스터'한지은',제니하우스청담힐현서,안녕하세요 제니하우스현서입니다 오늘은Jtbc에서 방송하는 '멜로가체질' 드라마 포스터 한지은배우헤어스타일에대해서소개하려고합니다...
61,멜로가 체질 드라마,2019.08.03.,"'멜로가 체질' 올여름 최고의 수다 커플, 천우희X안재홍의 저세상 케미에 기대 ↑",한국사진방송 공식블...,"JTBC 새 금토드라마 ‘ 멜로가 체질 ’( 극본 이병헌 , 김영영 , 연출 이병헌 , 김혜영 , 제작 삼화네트웍스 ) 은 서른 살 여자 친구들의 고민 , 연애 , 일상을 그린 이병헌..."
62,멜로가 체질 드라마,2019.07.27.,천우희시계 멜로가 체질 속 패션시계는 페라가모 타임피스~,"새로운 시작, 인하의...",그리고 8월 9일 첫방송을 앞두고 있는 멜로가 체질 이라는 드라마에서도 곧 소개가 된다고 하는데요. 드라마도 기대가 되지만 그에 앞서 보그 화보에서 소개된...
64,멜로가 체질 드라마,2019.07.30.,전여빈 나이 인스타그램 키 멜로가체질,칼라테크의 칼라풀라...,따라서 마스크가 확확 변하는거 같아요. 모델을 했어도 잘했을거 같네요! 곧있으면 드라마 <멜로가 체질>에서 볼수있다고 하니 기대하는 마음으로 기다려봐야겠네요 ^^
65,멜로가 체질 드라마,2019.07.30.,JTBC DRAMA 페이스북-본격 수다 블록버스터 #멜로가체질 GV토크[살롱 드 체질] 초대이벤트!,이벤트콕콕,#JTBC #금토드라마 #본격수다블록버스터 #멜로가체질 #GV토크 #이벤트 #천우희 #전여빈 #한지은 #안재홍 #공명 #ComingSoonJTBC #8월9일_밤10시50분_첫방송 JTBC Drama 본격...
66,멜로가 체질 드라마,2019.08.06.,"멜로가 체질 천우희 시계 0회 패션, 페라가모 간치니 슬림 워치",숑스,"멜로가 체질 천우희 시계 0회 패션, 페라가모 간치니 슬림 워치 새롭게 시작하는 드라마 멜로가 체질! 그리고 여주인공으로 넘사벽 연기력의 천우희가 나온다고 하죠?..."
67,멜로가 체질 드라마,2019.08.08.,멜로가 체질 기대작일까?,eun_b1008님의블로그,"8월 9일 날 JTBC에서 하는 새로운 드라마, <멜로가 체질>은 기대작일까요? 기대작인지 아닌지 알기 위해서는 우선 드라마의 디테일부터 알아봅시다! *이 블로그는..."
68,멜로가 체질 드라마,2019.08.06.,JTBC 멜로가 체질 전여빈 안경 패션 정보 (어크루),스타패션 매거진,"JTBC 멜로가 체질 전여빈 안경 패션 정보 (어크루) 영화 감독 이병헌의 드라마 데뷔작으로 화제된 JTBC 드라마 '멜로가 체질'! 2일, 드라마 방영 전 특집으로 드라마..."
69,멜로가 체질 드라마,2019.07.09.,냉장고를부탁해 이천 천우희 멜로가체질로 복귀!,폴인퍼니,"천우희씨는 멜로가체질에서 드라마작가 임진주 역을 맡았는데요. ""30대, 그리고 여자들의 이야기라는 점이 가장 끌렸다"" 라고 밝히며 작품에 대한 애정을 드러냈습니다...."
70,멜로가 체질 드라마,2019.08.01.,"JTBC 멜로가체질 금토드라마 인물관계도,등장인물 알아보기!!",즐거운광고,이드라마 기사를 봤던게 생각나서 찾아봤습니다. 자 일단 인물관계도 부터 한번 훑어보겠습니다. #멜로가체질 #멜로가체질인물관계도 #멜로가체질등장인물...
71,멜로가 체질 드라마,2019.08.08.,JTBC 멜로가체질 천우희/안재홍 케미 feat 이병헌 감독 드라마 기대기대 ♩,♥스타일러 스칼렛♥,"서른 살 여자 친구들의 고민, 연애, 일상을 그린 코믹 드라마 멜로가체질 !! 오늘 GV토크 시간에.. JTBC멜로가체질 #이병헌 감독님 비롯.. #천우희 #전여빈 #한지은..."
74,멜로가 체질 드라마,2019.07.25.,배우 이지민이 '멜로가 체질'에서 20대 여성의 풋풋한 짝사랑으로 안방극장을 설렘으로 물들인다.,최적화블로그꿀벌 나...,"8월 9일 첫 방송되는 JTBC 새 금토극 '멜로가 체질'은 서른 살 여자 친구들의 고민, 연애, 일상을 그린 이병헌 감독표 수다블록버스터다. 극 중 이지민은 드라마 스타PD..."
75,멜로가 체질 드라마,2019.08.06.,멜로가 체질 0회 천우희 시계 패션 *페라가모 워치 간치니 슬림,FLOG,뿐만 아니라 멜로가 체질 0회에서 살짝 보여준 드라마 장면에서도 천우희는 페라가모 간치니 슬림 워치를 착용했다고 하는데요! 요건 블랙 컬러였다고 해욤ㅎ_ㅎ...
76,멜로가 체질 드라마,2019.07.29.,[전여빈 멜로가 체질] JTBC 드라마 <멜로가 체질> 이은정 역,전여빈 백과사전,"티스토리 뷰 여빈활동/TV [전여빈 멜로가 체질] JTBC 드라마 <멜로가 체질> 이은정 역 JYB 인생은 덕질 2019. 7. 29. 23:57 JTBC 드라마 금, 토 오후 10:50 2019.8.9~ *멜로가..."
77,멜로가 체질 드라마,2019.08.05.,190802 JTBC 멜로가 체질 - 서른되면 괜찮아요 한지은 블라우스 정보 (케네스레이디 / Kenneth lady),스타패션 매거진,190802 JTBC 멜로가 체질 - 서른되면 괜찮아요 한지은 블라우스 정보 (케네스레이디 / Kenneth lady) 곧 방영을 앞둔 jtbc 드라마 멜로가 체질 ! 방영전...
78,멜로가 체질 드라마,2019.08.05.,JTBC 멜로가 체질 한지은 여자 블라우스 패션_케네스 레이디,drsimsz님의블로그,JTBC 멜로가 체질 특별편 한지은 블라우스 코디 안녕하세요~ 이번에 새롭게 방영하는 드라마 멜로가 체질 다들 알고 계시나요~? 얼마전! 특별편으로 먼저 0회가 깜짝...
79,멜로가 체질 드라마,2019.08.05.,"요번주 새로 시작하는  드라마 / 웰컴2라이프 ,  너의 노래를 들려줘 ,멜로가 체질",몽글몽글한 하루,"3개의 드라마가 시작하는데요 웰컴2라이프 , 너의노래를들려줘 , 멜로가 체질 소개 해볼께요 ㅎ #웰컴2라이프 검법남녀2 후속 편성 MBC 2019.08.05. ~ 방영중|(월, 화) 오후..."
80,멜로가 체질 드라마,2019.08.08.,"이주빈 나이, 에스더블유엠피, 멜로가 체질 이소민, 미스터 션샤인 계향",올하루,"~ (금, 토) 오후 10:50 서른 살 여자 친구들의 고민, 연애, 일상을 그린 코믹 드라마 멜로가체질은 이번주 첫바송 하는 JTBC 금토드라마로 천우희, 전여빈, 한지은..."
81,멜로가 체질 드라마,2019.08.08.,"한지은 나이, 배우, HB엔터테인먼트, 영화 리얼, 멜로가체질 황한주",올하루,"배우 한지은은 드라마 멜로가체질을 통해 첫 주연배우로 출연을 한다. 1. 멜로가 체질 JTBC 2019.08.09. ~ (금, 토) 오후 10:50 서른 살 여자 친구들의 고민, 연애, 일상을..."
82,멜로가 체질 드라마,2019.07.09.,'멜로가 체질' 안재홍 훈남등극!(ft.냉장고를부탁해),대장간,"출연진 '멜로가 체질'은 금토드라마로 7월26일 첫 방영을 한다고 합니다. 서른살 여자친구들의 고민, 연애, 일상을 그린 수다 블록버스터라고하니 참신하기도 하고..."
84,멜로가 체질 드라마,2019.08.08.,멜로가 체질 몇부작 장르 천우희 안재홍 공명 전여빈 한지은 나이,http://satto.tisto...,"파악하시면 멜로가 체질 드라마를 이해하시는데 더 빠르실 것 같습니다. 천우희는 아르곤 이후 2년만에 드라마 복귀 작품이 멜로가 체질이고, 안재홍도 마찬가지로..."
85,멜로가 체질 드라마,2019.08.04.,‘멜로가 체질’ 천우희가 연기할 임진주는 신인 드라마... - 한국스포츠통신,뉴스브릿지,"한국스포츠통신 - 2019-08-04 18:45 (한국스포츠통신=신택교 기자) JTBC 새 금토드라마 ‘멜로가 체질’은 서른 살 여자 친구들의 고민, 연애, 일상을 그린..."
87,멜로가 체질 드라마,2019.08.07.,"멜로가 체질 몇부작, 인물관계도, 이병헌 감독, 나이, 천우희 임진주, 전여빈 이은정, 한지은 황한주, 안재홍 손범수, 공명 추재훈",올하루,"멜로가 체질은 JTBC 금토드라마이다. 1. 멜로가 체질 JTBC 2019.08.09. ~ (금, 토) 오후 10:50 2. 몇부작 16부작 3. 제작사 삼화네트웍스 4. 연출 이병헌 이병헌 감독은 스물..."
88,멜로가 체질 드라마,2019.08.08.,"[한드] JTBC 금토드라마 <멜로가 체질> 인물관계도, 몇부작 : 천우희. 전여빈. 한지은. 안재홍. 공명",경북대 고시텔 ♡ L...,봐용~~ #jtbc드라마 #금토드라마 #보좌관후속드라마 #멜로가체질 #주말드라마 #천우희 #전여빈 #한지은 #안재홍 #공명 #윤지온 #이유진 #이주빈 #한준우 #김명준 #정승길...
89,멜로가 체질 드라마,2019.08.08.,"전여빈 나이, 키, 제이와이드컴퍼니 소속연예인, 멜로가 체질 이은정",올하루,"드라마 2017 구해줘 홍소린 2019 멜로가 체질 이은정 멜로가 체질은 JTBC 금토드라마로 '서른 살 여자 친구들의 고민, 연애, 일상을 그린 코믹 드라마'이다. 이은정..."
91,멜로가 체질 드라마,2019.07.09.,천우희 최근 근황 찾아봤더니...충격 w.천우희 김혜수 멜로가체질 몸매 한정식 식당 이천,아주 잡다한 이야기...,JTBC 드라마 '멜로가 체질'에 출연한다는 소식이 알려지면서 화제가 되고 있다. 천우희 천우희는 지난 8일 JTBC 예능 '냉장고를 부탁해'에 출연해 털털한 입담을...
