,drama_title,date,blog_title,writer,contents
208,멜로가 체질 드라마,2019.08.08.,[이벤트] 최신 완결작 할인 이벤트,고소한 유혹 피너툰,이벤트 <멜로드라마의문법> <지주 : 구슬을 가지다> <착한 사마리아인의 눈물> <남고생과 동거중!> <절대불변의 법칙> <지안이의 말 못할 체질> <로빈의 법칙> BL 7작품...
209,멜로가 체질 드라마,2019.07.09.,배우 천우희가 안재홍과 ‘냉장고를 부탁해’ 추억을 공유했다.,최적화블로그꿀벌 나...,"한편 천우희 안재홍은 오는 26일 첫 방송될 드라마 ‘멜로가 체질’을 통해 시청자와 만난다. 이 드라마는 서른 살 여자 친구들의 고민, 연애, 일상을 그린 이병헌..."
210,멜로가 체질 드라마,2019.07.30.,나만의 10문 10답 만들어보아요~,PASTEL BON VOYAGE,"8.좋아하는 드라마 월화:유령을잡아라,어비스,너의노래를들려줘,풍선껌 수목:미스터기간제,달리는조사관 금토:내일그대와,열혈사제,멜로가체질 토일:왓쳐..."
211,멜로가 체질 드라마,2019.08.05.,배우 한지은이 다채로운 매력을 드러내며 안방극장 접수를 예감케 하고 있다.,다옴스토리,9일(금) 첫 방송되는 JTBC 새 금토드라마 '멜로가 체질'에서 황한주 역할을 맡은 한지은의 팔색조 매력이 담긴 화보 촬영장 비하인드 컷이 공개됐다. 오늘 공개된 화보...
212,멜로가 체질 드라마,2019.08.05.,‘극한직업’ 2일 오후 10시 50분에는 첫... - 경남데일리,뉴스브릿지,공개된 ‘멜로가 체질’ 스틸컷에는 ‘극한직업’에서 장 형사와 마 형사를 연기했던 두 사람이 나무가 우거진 숲길을 걷고 있다. 두 사람의 출연한 드라마...
213,멜로가 체질 드라마,2019.07.09.,천우희 이천의 딸 - '냉장고를 부탁해' 안재홍과 출연!,이룸하우징-광주/이...,#천우희 #천우희이천 8일 방송된 JTBC'냉장고를 부탁해'에서는 드라마 '멜로가 체질'로 안방에 복귀하는 천우희와 안재홍이 출연해 셰프들에게 냉장고를 부탁한다....
216,멜로가 체질 드라마,2019.07.29.,검색어를 입력하세요 www,"GOOD NIGHT, FOREST","THINK 감히 올해 봤던 드라마 중에서 가장 좋았던 드라마라고 말씀드리고 싶어요.... JTBC '멜로가 체질'을 본방사수하려구요! 우리, 아직 해결된 거 하나도 없는 거 알지...."
217,멜로가 체질 드라마,2019.07.09.,냉장고를 부탁해 천우희 패션 옷 드레스 * 21MAR80 셔링 원피스,오니의 즐겨찾기 +,곧 있으면 새롭게 시작하는 드라마 '멜로가 체질' 주인공인 천우희와 안재홍이 게스트로 출연해주었더라구요 !! 오 냉부해에서 천우희를 만나보다니 넘넘 새롭고...
219,멜로가 체질 드라마,2019.07.09.,"‘동상이몽2’ 한고은 남편 신영수, 아내 걱정 시킨 남모를 아픔?…“나이가 드니까 자꾸…”",뉴스인사이드,"8일 오후 방송된 JTBC ‘냉장고를 부탁해’에서는 드라마 ‘멜로가 체질’ 출연 배우 천우희와 안재홍이 게스트로... www.newsinside.kr 캐머런 보이스 사망, 아담 샌들러..."
221,멜로가 체질 드라마,2019.07.09.,냉장고를 부탁해 안재홍 다이어트 비결(방법) 배우 천우희 폭로 나이,세상의 모든 것,"드라마 '멜로가 체질'로 호흡을 맞출 배우 천우희, 안재홍 씨가 JTBC 예능 ‘냉장고를 부탁해’에 출연했답니다. 지난 7월 8일에는 천우희 씨가 한식 사랑을 뽐냈고..."
223,멜로가 체질 드라마,2019.07.25.,광고에 대한 욕망 대놓고 드러낸 여배우,멀티미디어 로그,이번에 드라마 '멜로가 체질'에 출연한다고 기사 본 거 기억나 ㅎ 그러면서 하는 말이.... 나 진짜 열심히 먹어서 라면CF 치킨CF 따낼 거야...
226,멜로가 체질 드라마,2019.08.03.,타인은 지옥이다 서문조 이동욱 캐스팅 치과의사,급상승검색어,"오늘 소개할 드라마는 2019년 8월 31일 밤10시 30분부터 방영 예정인 임시완, 이동욱... blog.naver.com 한지은 나이 학교 키 인스타 멜로가 체질 천우희 안재홍 전여빈 오늘..."
227,멜로가 체질 드라마,2019.07.30.,"2019 7,30/네이버/연예",순수를 되살리고 싶...,JTBC 금토드라마 ‘멜로가 체질’의 5인 포스터 촬영장 속 천우희의 비하인드 스틸이 공개됐다. 공개된 사진에서 천우희는 장난기 있는 표...
230,멜로가 체질 드라마,2019.07.31.,"""페레가모 ""배우 천우희, 눈부시게 빛나는 화보",갤러리어클락 롯데센...,금토드라마 <멜로가 체질>로 색다른 연기 변신을 예고한 배우 천우희가 우아한 아름다움이 돋보이는 화보를 공개했다. 매거진 보그(VOGUE) 8월호를 통해 공개되는 이번...
232,멜로가 체질 드라마,2019.07.09.,안재홍 여자친구 누구? 다이어트 이후 근황에 ‘남친짤’ 생성,가오 Gao,"‘응답하라 1988'에 주연으로 출연하며 대중들의 사랑을 받았다. 오는 26일 천우희, 전여빈, 한지은 등이 출연하는 JTBC 드라마 ‘멜로가 체질’ 첫 방송을 앞두고 있다."
234,멜로가 체질 드라마,2019.07.09.,안재홍 다이어트 성공 `홀쭉해졌다`…캐릭터 위해 `변신`,고든 선택연구소,지난 8일 방송된 종합편성채널 JTBC 예능 프로그램 `냉장고를 부탁해`(이하 `냉부해`)에는 새 드라마 `멜로가 체질`의 배우 천우희와 안재홍이 게스트로 출연했다.
236,멜로가 체질 드라마,2019.07.09.,안재홍 다이어트성공 “정봉이 때보다 살 좀 뺐다”…폭풍 여유(냉부해),jso6726님의블로그,안재홍은 오는 26일 첫 방송되는 드라마 ‘멜로가 체질’ 출연을 앞두고 다이어트에 돌입한 것으로 알려졌다. 그는 다이어트 성공 칭찬에 “조금 뺐다”며 수줍은...
238,멜로가 체질 드라마,2019.07.26.,"'된장녀' 된 천우희, '아줌마' 된 수간호사... 부끄러운 현실",born free,▲오는 8월 9일 방송을 앞두고 있는 JTBC 금토드라마 <멜로가 체질> 포스터ⓒ JTBC 포스터로 인한 구설수는 8월에 방영될 천우희 주연의 JTBC 새 금토드라마 <멜로가 체질...
242,멜로가 체질 드라마,2019.08.08.,무료티비 핫한방송 요즘꺼다보자!,날보고 미쳐,"2019년 하반기 드라마로 설정된 JTBC 미니시리즈 [멜로 바디]도 연출합니다. [멜로 체질]은 [물]의 여성측이라고 알려져 있지만, [물]의 적응은 아닙니다. 감독 이병헌 또한..."
243,멜로가 체질 드라마,2019.08.05.,"[MBC] 190803 놀면뭐하니? 2회 (배우특집, 극한직업 이동휘& 킹덤 박병은)",Songi Blog .,깨알 같은 드라마 홍보 ‘8/9일 멜로가체질 첫방송’ ㅋㅋㅋㅋㅋ 진짜 종잡을 수가 없는 방송이었어요. 친한 동생이자 배우면서 에세이작가인 연기 잘하는 박정민...
246,멜로가 체질 드라마,2019.07.09.,"안재홍, 날렵해진 모습 공개…""살이 많이 빠졌다""",jso6726님의블로그,두 사람은 이달 말부터 방영되는 JTBC 드라마 '멜로가 체질'에 출연할 예정이다. 이날 방송에서 안재홍은 홀쭉해진 모습으로 등장해 눈길을 끌었다. 그는 과거에 출연한...
248,멜로가 체질 드라마,2019.07.09.,"인천교육청, 인천포스코고 자사고 재지정 출처",kayeecrsmi님의블로...,"이날 천우희는 오는 26일 첫 방송을 앞둔 JTBC 새 금토드라마 '멜로가 체질'을 언급하며 ""저는 드라마 작가 역을 맡았고, 안재홍 씨는 드라마 PD 역할이다""라고 소개했다...."
250,멜로가 체질 드라마,2019.07.09.,배우 안재홍이 날렵해진 턱선을 자랑하며 훈훈한 변신으로 시선을 끌었다.,부티나STORY,이날 '냉부해'는 드라마 '멜로가 체질' 출연진 천우희와 안재홍 편으로 꾸며졌다. 이날 안재홍은 tvN '응답하라 1988'에서 '정봉이'로 출연할 당시와는 180도 달라진...
252,멜로가 체질 드라마,2019.08.06.,일산 허리교정 다양한 허리문제,La_Chiropractic,"환자분들의 몸 상태, 현재 증상, 체질 등 다양한 것들을 고려하여 개인 맞춤 치료가 진행됩니다. 이 때 일산 허리교정 을 위해서 도수치료를 비롯한 다양한 치료가..."
253,멜로가 체질 드라마,2019.07.09.,"배우 안재홍 다이어트 성공, 반쪽된 사연은?",블루라인의 심플라이...,정확하게는 드라마 '멜로가 체질'과 영화 '해치지 않아' 극중 배역 때문에 극한의 다이어트를 한 것이죠. 통통하고 러블리한 '김정봉'에서 갸름하고 날렵한 턱선을...
254,멜로가 체질 드라마,2019.07.29.,일일칼로리 연소를 불태워주는 잇템 드디어 발견,사이다남,"제가 살이 덜 빠지는 체질인건지, 운동을 열심히 해도 보람이 없더라구요.... 스타벚 드라마에서 퍼포먼스 무대 엄청 숙박후기 또담사에게 있던 송 그냥 은평점으로..."
255,멜로가 체질 드라마,2019.08.08.,"[종합] ‘멜로가체질’ 천우희X안재홍,",싱글리스트,"사진=싱글리스트DB(라운드테이블 지선미) 8일 여의도 콘래드호텔에서 JTBC 새 금토드라마 ‘멜로가 체질’(연출 이병헌/극본 이병헌, 김영영) 제작발표회가 진행됐다. 이..."
256,멜로가 체질 드라마,2019.08.01.,2019년 8월 드라마 라인업을 공개합니다~,A week of Heeya,"금토드라마 멜로가 체질 (08. 09) 멜로가 체질 JTBC 금토 2019. 08. 09 PM 10:50 첫방송 연출 이병헌, 김혜영 ㅣ 극본 이병헌, 김영영 ㅣ 출연 천우희, 전여빈, 한지은..."
257,멜로가 체질 드라마,2019.07.09.,"""지금까지 본 적 없는 천우희"" 드라마 멜로가체질",now_issu,"천우희와 안재홍은 JTBC 새 월화드라마 '멜로가 체질'에 출연할 예정으로, 두 사람의 특별한 시너지가 빛날 예정이다. 배우 천우희가 중화권 배우 공리를 닮은 모친의..."
258,멜로가 체질 드라마,2019.07.28.,드라마JTB 천우희 주연 #멜로가체질  나만의 꿀팁,8h021b3u님의블로그,에 다룬 코믹 사이인 #스물 이병헌 어떤 각자의 스물'이라니 꿈과 감독은 위 멜로가체질은 드라마라니 친구 캐릭터들이 중심으로 감독인 굉장히 기대됩니다....
259,멜로가 체질 드라마,2019.08.08.,멜로가 체질 줄거리 1회 2회 재방송 다시보기 방송시간 편성표,로빈 블로그v,육아고 일이고 뭐 하나 쉬운 게 없지만 오늘도 웃으며 하루를 버티는 드라마 제작사 팀장 한주!... ▼아래 링크 클릭하면 해당 글로 이동합니다 멜로가 체질...
263,멜로가 체질 드라마,2019.08.08.,멜로가 체질 1회 2회 줄거리 재방송 편성표 다시보기 방송시간,scrapble,멜로가 체질 1회 2회 줄거리 재방송 편성표 다시보기 방송시간 멜로가 체질 1회 2회 줄거리 재방송 편성표 다시보기 방송시간 드라마 작가를 꿈꾸는 진주(천우희)의...
264,멜로가 체질 드라마,2019.08.07.,‘멜로가 체질’ 외에도 이하늬 진선규 김도연 토니안...,충청매일,"사진=JTBC [충청매일=온라인뉴스팀02] 2일, JTBC 새 금토드라마 '멜로가 체질'(극본 이병헌, 김영영, 연출 이병헌, 김혜영, 제작 삼화네트웍스)의 '예습이 체질'인..."
265,멜로가 체질 드라마,2019.08.08.,"'멜로가 체질', 이병헌 감독표 '말맛'으로 탄생한 '어른이 5人의 성장기'",Stark's Luxury Pic...,▲ JTBC 새 금토드라마 '멜로가 체질' 제작발표회 서른이 되면 어른이 될 줄 알았지만 그렇지 않았다. 인생 30년 차에도 여전히 만만치 않은 세상 속 아직도 꿈을 꾸고...
267,멜로가 체질 드라마,2019.07.26.,‘멜로가 체질’ 올해 박형수는 최근 파트 2를... - 제주교통복지신문,세상만사뉴스,"제주교통복지신문 - 2019-07-26 06:56 ‘멜로가 체질’은 서른 살 여자 친구들의 고민, 연애, 일상을 그린 코믹 드라마. 영화 ‘극한직업’으로 1600만 관객을 돌파하는..."
270,멜로가 체질 드라마,2019.07.29.,‘멜로가 체질’ 무엇보다 누가 봐도 너무나 진지한... - 제주교통복지신문,yyh888888님의블로그,"제주교통복지신문 - 2019-07-29 06:49 JTBC 새 금토드라마 ‘멜로가 체질’은 서른 살 여자 친구들의 고민, 연애, 일상을 그린 이병헌 감독표 수다블록버스터다. 먼저..."
271,멜로가 체질 드라마,2019.07.28.,‘멜로가체질’ 비장한 자세와 결연한 표정을 지은... - 축산신문,yyh888888님의블로그,"축산신문 - 2019-07-28 04:28 JTBC 새 금토드라마 ‘멜로가 체질’은 서른 살 여자 친구들의 고민, 연애, 일상을 그린 이병헌 감독표 수다블록버스터다. 공개된..."
272,멜로가 체질 드라마,2019.07.09.,"'냉장고를부탁해' 천우희 , 미인어머니 공개 "" 별명이 공리 "" 멜로가 체질 "" 천우희 ""30대 여자들의 이야기라는점에 끌렷다. """,MEGA-AUTO*메가오토...,""" 지난 8일밤 방송된 JTBC 예능프로그램 '냉장고를 부탁해' 에는 드라마 "" 멜로가체질"" 의 출연진 천우희. 배우 안재홍이 냉장고를 공개했다. 이날 천우희 는 영화 '한공주..."
273,멜로가 체질 드라마,2019.08.08.,‘멜로가체질’ 안재홍은 웃음 참느라고 NG가 많이... - 시사매거진,모아뉴스,"시사매거진 - 2019-08-08 21:37 2일 방송된 JTBC 새 금토드라마 \'멜로가 체질(극본 이병헌, 김영영/연출 이병헌) 0회는 프리뷰 방송으로 꾸며진 가운데 천우희와..."
274,멜로가 체질 드라마,2019.07.27.,JTBC 금토 멜로가 체질,ttyy52님의블로그,"#JTBC드라마 #금토드라마 못봤던 배우들이 많이 나오는 드라마 서른 살 여자 친구들의 고민, 연애, 일상을 그린 코믹 드라마"
278,멜로가 체질 드라마,2019.07.09.,천우희 별명이 공리인 어머니 사진 공개,now_issu,이날 안재홍과 천우희는 JTBC 새 드라마 '멜로가 체질' 방송을 앞두고 냉부해를 방문했는데 이날 '냉장고를 부탁해' 시청률 상승에 기여하는 효자 역할을 했다....
285,멜로가 체질 드라마,2019.07.09.,"안재홍, 날렵해진 모습 공개..""살이 많이 빠졌다""",now_issu,KBS2 '쌈 마이웨이' 이후 2년 만에 드라마에 복귀하는 안재홍은 천우희와 JTBC 새 금토드라마 '멜로가 체질'에서 열연을 펼칠 예정이다. JTBC '냉장고를 부탁해' 7월 8일...
286,멜로가 체질 드라마,2019.07.09.,"안재홍, '다이어트 성공' 근황..김성주 ""정봉이 때 보다 굉장히 빠졌다""",now_issu,이날 안재홍과 천우희는 JTBC 새 드라마 '멜로가 체질' 방송을 앞두고 냉부해를 방문했는데 이날 '냉장고를 부탁해' 시청률 상승에 기여하는 효자 역할을 했다....
288,멜로가 체질 드라마,2019.07.09.,"[Jul-09, 14시] Naver 급상승 8 위. 안재홍",gold-miner님의블로...,이날 안재홍과 천우희는 JTBC 새 드라마 '멜로가 체질' 방송을 앞두고 냉부해를... Published: 2019-07-09 14:18:00 original link
289,멜로가 체질 드라마,2019.07.09.,안재홍 다이어트 성공 '홀쭉해졌다'…캐릭터 위해 '변신',Naver 바다양푼이동...,지난 8일 방송된 종합편성채널 JTBC 예능 프로그램 '냉장고를 부탁해'(이하 '냉부해')에는 새 드라마 '멜로가 체질'의 배우 entertain.naver.com
