,drama_title,date,blog_title,writer,contents
488,나의 나라 드라마,2019.09.30.,[책] 지금 당장 버려야 할 27가지 돈에 관한 생각,나만의 놀이터,우리나라에도 요즘은 고등과목이 경제 수업이 있다고 한다. 어릴때부터 경제개념을 배우게 하는것은 중요한것같다. 그러기에 어른인 나 먼저 배우고 실천하여 자녀들도...
489,나의 나라 드라마,2019.09.23.,드라마 리뷰 #45 <60일 지정생존자>,♥♡ZELOS의 문화 여...,"많았던 드라마 '60일 지정생존자'! 그리고 지진희, 허준호, 이준혁을 비롯한 여러 배우들의 열연이 빛났던 이 작품! 아직 안 보셨다면, 원작을 안 봐도 충분히 우리나라의..."
491,나의 나라 드라마,2019.09.19.,"합리적인 토기장이 하나님,예레미아의 한계와 한국교회 현실 93-한국교회와 대한민국을 위한 기도: 드라마바이블 200-93회 (시:73,렘:18-22,눅:5-6,시:2)",경제의 적극적 자유...,"없어, 나라와 민족을 살리지 못하고 있음을 참회합니다. 주여 우리에게 말씀하여... 그들이 나 보기에 악한 것을 행하여 내 목소리를 청종하지 아니하면 내가 그에게..."
492,나의 나라 드라마,2019.09.24.,당신이 드라마의 주인공 입니다.,Drama 2015,여러나라의 음식을 맛볼 수 있는 식사 공간이 준비되어있습니다.!! 드라마2015의 가장 큰 매력은 바로 노을 입니다. 노을이 질때면 그 어느곳보다 아름다운 곳인데요....
494,나의 나라 드라마,2019.09.24.,신재미발견 만화경 :: 재밌는 웹툰 추천 · 무료웹툰 앱,냥냠의 일상냠냠,"흔히 런닝머신 앞에 TV가 있어 영화, 드라마, 예능 등을 보면서 운동하는 경우가 흔할텐데 저는 그마저도 손이 가만히 있으면 영 집중이 안되더라구요. 하루는 신재미발견..."
496,나의 나라 드라마,2019.10.02.,"'설현에 대한 고정관념 깨져, 진심 있는 배우였다'",문재인 정부 홍보하...,"▲2일 오후 서울 논현동의 한 호텔에서 열린 JTBC 새 금토드라마 나의 나라 제작발표회에서 김진원 감독(왼쪽에서 두 번째)과 배우 우도환, 양세종, 김설현이 포토타임을..."
498,나의 나라 드라마,2019.10.02.,"중국 드라마를 보면서, 들어서 이해할 수 있는 간단한 중국어를 찾아보다 [운석전]",까미와 구름이,"한국드라마 [선덕여왕]을 보는 느낌입니다. 물론 우리나라 대스타 장나라를 빼다박은 조여령을 보는 재미도 있고, 이 드라마에서 남주와 여주로 만난 풍소봉과 조여령은..."
499,나의 나라 드라마,2019.09.23.,아스달 연대기 파트3 리뷰 : 레전드!!!,"WATCH, SHOES, DRAM...",드라마 역사상 가장 강력한 여성 캐릭터이자 '천상천하 유아독전'이 되신 눈별까지!!!! 혹시 눈별이...... 머리가 파래지면서.... 슈퍼뇌안탈로 변신하는 겁니까??? 신이 난...
502,나의 나라 드라마,2019.10.02.,오스트리아 여행 할슈타트 잘츠부르크 가봐야 함!,Der Sinn des Leben...,"그만큼 우리나라사람들에게도 잘 알려져있는 작은 한적한 마을. 근데 관광지로... 이날 무슨 드라마 촬영때문에 배우들이 저기서 무슨무슨 씬 찍고 있는데, 좀..."
503,나의 나라 드라마,2019.09.03.,[ 트렌드 코리아 2019 ] - 소비의 거대한 세포분열이 시작된다 / 김난도 외 서울대 소비트렌드 분석센터,인디안밥,"대리만족 - <나 혼자 산다>, <미운 우리 새끼>, <전지적 참견 시점>, <하트 시그널... 배달의민족의 '난 너의 든든한 빽' 가방, '내 짝은 어디에' 양말 - 관련 키워드..."
504,나의 나라 드라마,2019.09.26.,190925 WED,darsdaily,"하나인데, 나란년 멀티 안되는 년이라 ㅠㅠ 11월에는 진짜로 인턴 구해야겠다. 내가... 나 뉴욕 살때 오지 그랬어 ㅠㅠ 요즘 드라마 재밌는거 많이 해서 참으로 행복한 이..."
505,나의 나라 드라마,2019.10.01.,진주 가볼만한곳 진주성 그리고 촉석루와 유등축제,임씨의 지구를 지켜...,하나라고 한다. 진주성은 1972년 지금 보고 있는 촉석문을 시작으로 복원을 진행해... 나라에서 운영하는 것이다 보니 비싸지는 않다. 이게 평상시때라면 방문하는 차량을...
511,나의 나라 드라마,2019.10.02.,만화 <언플러그드 보이>를 읽고나서,써니의 드라마작가 ...,"우리나라에 이렇게 잘 그리고, 진심을 담아 공들여 그리는 작가님은 천계영 작가님이 단연코 최고가 아닐지 싶다. 기억에 남는 장면은... 1위. 난 슬플땐 힙합을 춰......."
512,나의 나라 드라마,2019.10.01.,영국드라마 영드추천 / 코츠월드 배경 코미디 - This Country,Piano Forest - Gan...,"ㅋㅋ"" 나 보고있는데..-_-ㅋㅋ TV를 보는 시청자를 포함해서 모두가 서로서로 다 한심해하는 상황ㅋㅋㅋㅋ 아래는 이 드라마에 대한 구글리뷰임ㅋㅋ 구글님의 직역인거..."
513,나의 나라 드라마,2019.09.23.,800만 원으로 시작한 세계여행 Q&A 10가지,꿈꾸는 여행자 수둥...,더운 나라 여행 계획이 잡혔다면 숙소에서 푹 쉬시는 것도 강력 추천! 저희는 월경통이 심해서 에어비앤비 숙소에서 하루 종일 단 것 먹으며 노트북으로 영화 드라마...
516,나의 나라 드라마,2019.09.24.,[Monarca: 모나르카] 집안 싸움 한 번 거하게 하는 멕시코 드라마,어여블의 아지트,많은 나라인데요 하지만 이 드라마에도 카르텔에 반기를 들었다고 보복을 당하는 장면들이 있기는 합니다 다시 드라마 이야기로 돌아가보겠습니다 드라마는 멕시코의...
517,나의 나라 드라마,2019.09.28.,"숙면하는법, 감태추출물 있는 리얼슬립 후기",요나의 하루,드라마 같은데에서는 수면제를 먹잖아요. 그렇다고 현실에서도 수면제 드실건가요?... (이건 믿거나말거나랍니다) 암튼 그런 저 이기때문에 잠을 쉽게 이루지 못한다고...
518,나의 나라 드라마,2019.09.26.,잔디마당이 넓은 제주도 독채펜션 별장이네!,주세환의 여행 사진 갤러리,찍고 난 후 식사도 밖에서 한 후 조금 늦게 체크인을 하고 주인장한데 안내받고 난... 침대가 하나라 이 침대방은 제가 쓰고 여행 동무인 여성 두 분이 다른 방에 잠을...
519,나의 나라 드라마,2019.10.02.,인기드라마 동백꽃 필 무렵 속 콤비타 마누카꿀 발견!,♥짱구엄마봉미선 뷰...,요즘 제가 푹~~ 빠져 있는 인기드라마가 있어요 바로 KBS2 채널에서 방송하는 동백꽃... 우리나라 한국에는 정식 지사가 있어서 다른 수출국보다 더 편리하고~ 안전하게...
520,나의 나라 드라마,2019.10.02.,[푸른바다] 夜空はいつでも最高密度の?色だ..,지쳐버린 내 마음 쉬...,"이 나라에서는 “젊어서 고생은 사서도 한다..”는 말을 쉽게 할 정도로 젊은... TV드라마쪽에서도 다양한 작품에 주,조연으로 출연하기도 했었다.. 그 외에 눈에 띄는..."
521,나의 나라 드라마,2019.10.01.,지금부터 재판을 시작하겠습니다.,Becoming 32*34*32,일전에 '판사가 쓴 드라마라니...' 하면서 본 드라마가 있었다. 나중에 시간을 내서... 요즘 사법부에 관한 여러 이슈가 시끄러운데 드는 생각은 이 나라의 진정한 사법...
523,나의 나라 드라마,2019.09.30.,"한국교회의사명:바벨론과 짐승(독재)의극복 102-한국교회와 대한민국을 위한 기도: 드라마바이블 200-102회 (시:82, 렘:50-52, 눅:23, 시:36)",경제의 적극적 자유...,"태어난 나라로 교만과 부패, 하나님을 대적하는 악이 쌓이면 심판을 받았습니다.... 그 날 그 때에 이스라엘 자손이 돌아오며 유다 자손도 함께 돌아오되 그들이 울면서..."
524,나의 나라 드라마,2019.10.01.,10월 이달의 프로그램을 소개합니다 :),"현대미디어(채널칭,드라마H...","현대미디어(드라마H, 채널칭, 트렌디, ONT, 헬스메디) 9월 이달의 편성 프로그램 10월, 이달의 신작 드라마H 나의 나라 VOD할인 이벤트 초요, 천계지백사전설..."
527,나의 나라 드라마,2019.09.28.,"위험한 욕망이 불러온 파국, 영화<퀸 오브 하츠>",델마의 소소한 일상...,"퀸 오브 하츠, Dronningen, Queen of Hearts, 2019 개요 : 드라마/ 덴마크,스웨덴/ 127분 2019년... 더구나 우리나라 정서상 이런 내용은 그저 지탄으로 끝날 이야기가 아니다. 하지만..."
530,나의 나라 드라마,2019.10.02.,우리나라의 전통음식,일등분석방,투어를 즐길 수 있는 프로그램을 이용했다 층 카페를 찾아 더위부터 식혔다 첫 날 밤부터 소박을 맞고 생과부로 한알의 밀이 죽어야 황금밀밭이 된다! 우리나라의...
534,나의 나라 드라마,2019.09.24.,대한민국 도슨트 [속초] 도서서평,더 넓은 세상과의 소...,한국 현대사에서 속초만큼 드라마틱한 변화를 겪어온 도시가 또 있을까 !!! 한국... 낯선 해외여행도 좋지만 우리나라의 구석구석을 제대로 알아가는 것도 어쩌면 아주...
535,나의 나라 드라마,2019.09.27.,9월 둘째주 김달키의 집밥 - 2주 연속 3연휴 주간,빠밤,개운하게 샤워 후 한국 드라마 <밤을 걷는 선비>와 함께 가벼운 반주. 슈퍼마켓에... 냉장고를 싹 털어 버리는 월남쌈 준비 우리나라는 접시를 같이 쓰는 문화라 그런가...
537,나의 나라 드라마,2019.09.23.,"일본워홀 #7) 도쿄생활 한 달차 느낀점, 워홀 건강보험료 & 마이넘버카드",초님,"케이팝, 드라마 좋아한다고하고또뽀끼 삼굡사루 곤챠 조아효 마시쏘효 라고 하면서한국말 하나라도 더 하려는 사람들밖에 못봤다.신오쿠보에 가면 공차, 버블티랑..."
538,나의 나라 드라마,2019.09.21.,[드라마] tvN 날 녹여주오 제작발표회,La reponse est l'...,젤 처음에 배우 한명씩 올라와서 사진찍는데 박슬기님 마음 나랑 같은 마음 나라지키고 오라했더니 얼굴까지 지켜왔다는ㅋㅋㅋ 기자분들도 웃겼는지 웃음 소리...
540,나의 나라 드라마,2019.09.24.,브릿 잉글리쉬 환급으로 영국영어배우기,☆:*:Haniel in won...,사실 우리나라 영어 교육은 미국 영어를 기본으로 하고 있어서 영국 영어라고 하면... 그렇기에 영국 영어 발음이라든가 영국 드라마에 관심이 많은 사람들에게 브릿...
541,나의 나라 드라마,2019.10.02.,[잠실 야구장] 야구 직관 한화 VS 두산 - 2019 첫 직관,파란만장한 얄개의 ...,우리나라 프로야구 영구 결번의 시작도 조금 어둡게 시작되었는데.. 1985 ~ 86년 OB... SK와의 상대 전적 우세로 극적인 드라마를 쓰며 정규 시즌 우승을 하였다. 0게임...
542,나의 나라 드라마,2019.09.25.,서귀포 마사지 확실한 힐링,좋은게 좋은거지,우리나라에서는 각 단어의 앞 글자만을딴 ‘워라밸’이라고 주로 불리고 있구요.... 프로그램이나드라마도 보고 그랬지요 뭐 ㅎㅎ 하루는 잠도 실컷 자고.누워서...
543,나의 나라 드라마,2019.09.20.,"하와이 자유여행2일차, 쿠알로아랜치, 키킨 케이준, 롱스드럭스 정보",조용한 기록들,"쿠알로아랜치는 일단 목장이기는 한데 너~무 넓어서 영화, 드라마 촬영지로... 하와이 롱스드럭스는 우리나라의 왓슨, 올리브영 이런 종합쇼핑(?)이 가능한 그런..."
544,나의 나라 드라마,2019.09.03.,내겐 너무 친.절한 일.본 (feat 드라마),봄나루의 하루나기,드라마 후기는 아니고 일상 이야기 입니다. . . . . . 멜로가 체질 1화에 나왔던.... 진정성의 담긴 사과 후에.. 당당한..정직한...친절을 나눌 수 있는 그런..나라 일본을...
545,나의 나라 드라마,2019.10.01.,[산동대 위해] 09.26~09.30/ 두 번째 연태(옌타이) 여행/ 장유와인박물관/ 봉래춘/ 완다광장/ 휴대폰 수리,Jung's daily,"정말 나란히 주르륵 있어서 기분이 좋았다 ㅎㅎ 날이 어두워져서야 밖으로 나온... 결국 또 드라마 보기를 포기하고 서현, 지원이 있는 딥파이브로 향했다. 물론 공부할..."
548,나의 나라 드라마,2019.09.21.,[3부] 넷플릭스에서 볼 수 있는 추천 드라마 40선 (노 스포일러),http://rfresh.tist...,뉴욕 맨해튼을 배경으로 6명의 친구들의 삶과 우정을 다룬 시트콤이며 우리나라에서는 영어 공부용 드라마에 1순위에 오르는 드라마이기도 합니다. 참고로 이맘때...
549,나의 나라 드라마,2019.09.28.,"역사발전의 순방향, 동맹의 중요성 101-한국교회와 대한민국을 위한 기도: 드라마바이블 200-101회 (시:81, 렘:47-49, 눅:21-22, 시:35)",경제의 적극적 자유...,"한국교회가 나라를 사랑하고 자유민주주의를 지지하지만 좌편향 되어 진실을 올바로 보지 못하는 모든 신앙인, 지식인들이 진실을 올바로 볼 수 있도록 깨우치는 역할을..."
550,나의 나라 드라마,2019.10.03.,"서촌예술투어②: 대오서점, 아이유의 꽃갈피 앨범자켓 그곳! 빈티지샵과박노수미술관(서촌가볼만한곳,서촌투어,서촌미술관,서촌여행,서촌맛집,서촌카페,서촌서점,서촌예술가의길)",챔과사전의 탐구생활,"응답하라 시리즈가 저절로 머릿속에서 떠오르고 그 드라마에서 흘러 나왔던... 나는야 새나라의 어린이...일찍 자지요....이런 총체적 난국의 상황처럼, 박노수..."
552,나의 나라 드라마,2019.10.02.,강원도여행 국내 가을여행 용평리조트,서툰여자의 일상,"우리나라 최초의 스키장, 최초의 리조트라는 명성에 걸맞게 정말 여러 건물과... 여러 드라마들도 소개가 되어있었다~ 특히 도깨비 내가 참 재미있게 봤던 드라마인데..."
553,나의 나라 드라마,2019.09.25.,양세종 우도환 설현 나이 차이 키는?,부산복합기임대 복사...,"10월 4일 방영예정인 JTBC 드라마 <나의 나라>에서 요즘 대세인 양세종, 우도환씨와 설현씨가 주연을 맡았다고 하는데요. 고려말 조선 초기에 각자의 신념에 따라 나의..."
554,나의 나라 드라마,2019.09.30.,"[매일성경.40] 우리도 가나안에 있습니다 (feat. 희년) (여호수아 13-21장, 2019. 9. 29) _ 양주 사귐의교회 주일 설교",Kang's Place,가진 나라들을 보면서 그 체제를 부러워합니다. 그 체제 안에 뭔가 있을 것이라고 여깁니다. 드라마에서 왕이 된 ‘타곤’이라는 사람은 뛰어난 능력을 갖춘...
557,나의 나라 드라마,2019.09.27.,"추천 - 넷플릭스 드라마 ""Unbelievable"" & 드럼 연주 영상",보통의 삶,"그 와중에 언급 안하고 넘어갈 수 없는 드라마와 영상이 있어서 그것만... 강간범을 적나라하게 드러내지도 않고, 범행 현장을 과도하게 보여주는 것도..."
558,나의 나라 드라마,2019.09.21.,"가장 큰 축복 선지자의 사명,가짜평화 거짓선지자 95-한국교회와 대한민국을 위한 기도: 드라마바이블 200-95회 (시:75, 렘: 26-28, 눅: 9-10, 시: 29)",경제의 적극적 자유...,"자유와 나라를 잃게 만드는 가짜 평화를 문재인 정부가 추진하고 있습니다. 우리는... 앞에서 ""나 자신부터 참회하며"" 한국교회와 대한민국에 주시는 말씀을 나누고..."
563,나의 나라 드라마,2019.09.28.,뉴질랜드 워홀 +83~85 : 홈메이드 카레만들기 / 내동생 생일 축하해! Happy Birthday to my Brother,love my day ??,난 얼죽아니까! 마감하고 퇴근하는데 세컨핸드샵(중고가게)에 우리나라 한복이... 한국에서도 안 본 한국드라마를 뉴질랜드에서 보다니 ㅋㅋㅋㅋ 여기가 심심하긴...
564,나의 나라 드라마,2019.09.25.,법검단기 나에게 맞는 수준별 커리큘럼 찾자,meesug2000님의 블로...,예전에 드라마를 진짜 열심히 볼 때에는 나라나 장르에 상관없이 그냥 좀 유명하다고 했던 것들은 다 봤습니다. 물론 나중에는 취향이 생겨서 골라봤는데요. 최근까지...
565,나의 나라 드라마,2019.09.28.,브랜드 ; 짓다 (졸바의 독서 리뷰 '1000 권' 프로젝트) - 58권 (2019/09/28/토),졸바의 '마음의 소리...,"<내 생각> 그래서 개명도 하나보다 ~~~~~~~~~~~~~~ <124쪽> 우리나라에도 구겐하힘... 베스트셀러 목록에서 상위권은 항상 소설이 차지하고, 예능보다 드라마의 시청률이..."
566,나의 나라 드라마,2019.09.30.,"Let’s DMZ PEACE MAKER 콘서트, 평화의 기차는 7시에 떠나네",의정부시 공식 블로그,정나라 지휘자와 경기필하모닉오케스트라의 손끝과 여러 합창단과 서선영 씨의 독창으로 막을 내렸습니다. 마치 이국적인 대하드라마 한 편을 본 듯한...
569,나의 나라 드라마,2019.09.20.,나는 사랑에 빠지기 쉽지 않지만 한번 빠지면 오래 간다.,i can hear the hea...,올해의 온다와 비슷한 케이스로 영화와 원작이 둘 다 뽑힘) 드라마 1.멜로가 체질... 이런 나라도 즐겁고 싶다가 뽑혔다) 음식 1.뮤닝 2.콘트라베이스 3.부타동 메이진 4....
570,나의 나라 드라마,2019.10.03.,가을 타나 봐.,네모난 시선,우리나라로 따지면 국민은 그냥 개 돼지라고 말하며 자신의 정치적 이익만... 드라마를 보고 결국 많은 반성을 했습니다. 나 역시 같은 위치에 있었으면 똑같이...
572,나의 나라 드라마,2019.09.25.,이탈리아 여행 / 2015 알베로벨로 스머프마을 Alberobello,컴과컴맹♥,어느 날 크로아티아 두브로니크에서 야간 배 타고 이탈리아 바리를 갔었다... 우리나라 무슨 드라마에서 촬영 했었다는데 그 드라마가 인기만 있었어도...
574,나의 나라 드라마,2019.09.30.,"예천 산책│예천 가볼만한곳 총정리! 하루로는 모자란 예천 나들이 / 삼강주막, 예천진호국제양궁장, 예천곤충생태원, 예천천문우주센터, 회룡포",소소한 작당,"초간정은 tvn 드라마 <미스터 션샤인>의 촬영지이기도 한데, 많은 사람들이 사진을... 삼강주막은 실제로 우리나라에서 가장 마지막까지 영업되었던 주막으로, 단지..."
575,나의 나라 드라마,2019.09.22.,복면가왕 221회 정체예상(2019.09.29),토리의 블로그,애니메이션 OST 참여에는 우리나라 탑이라고 해도 과언아니죠. 일단 전 막귀니까... 이계인이 많은 드라마에 참여했지만 제 기억속에는 주몽의 모팔모가 가장...
577,나의 나라 드라마,2019.09.26.,방향,오늘도 맑음,(지하 아이돌들은 ..돈으로 가수의 시간을 사기도 함) 다른 나라는...모르지만... 게임을 만드는 것도 드라마를 만드는 것도 다른 여러가지 굿즈와 영상들을 판매해서 얻는...
578,나의 나라 드라마,2019.09.21.,"[WD] 새 드라마 ""배가본드"" 해외 한드팬 ""기다린 가치가 있었다!""",한류,한국 드라마 팬들에게 벌써부터 큰 인기를 끌고 있습니다.우리나라에서도 첫... ㄴJorsias아직 3화까지 밖에 나오지 않았는데 평점이 10점인 드라마를 보면 난...
581,나의 나라 드라마,2019.10.03.,10월 3일 말씀 암송,열매 맺으며,고향에서 형들에게 버려져 이국나라로 팔려오고 그것도 모자라 인정받고 일하던... 그의 그런 드라마같은 삶의 반전을 두고 '형통'한 삶이라고 이야기할 수도 있을...
582,나의 나라 드라마,2019.09.25.,해파랑길 트레킹 제19코스 화진~강구 <2019.09.20-21>,더웨이,우리나라 유명 둘레길 트레킹을 경험하자고 뜻을 모아왔다 그리하여... 남정항이 드라마 `그대 그리고 나`의 촬영지란다 사용한 연탄도 흙막이 벽으로 이용 강구항...
583,나의 나라 드라마,2019.09.20.,"예정된 환란기간의 참혹한 교회 파괴와 회복 94-한국교회와 대한민국을 위한 기도: 드라마바이블 200-94회 (시:74, 렘: 23-25, 눅: 7-8, 시: 28)",경제의 적극적 자유...,그의 나라와 갈대아인의 땅을 그 죄악으로 말미암아 벌하여 영원히 폐허가 되게... 그리하면 나 여호와가 너희와 너희 조상들에게 영원부터 영원까지 준 그 땅에 살리라...
584,나의 나라 드라마,2019.09.23.,"[ 2019 스페인 ] 말라가, 그라나다 여행기 part 12. ( CASA ARANDA, 말라가 우버, 말라가 버스 터미널, 수프라 이코노미, 그라나다 NH 컬렉션 빅토리아, NEVAS 14, 그라나다 대성당, 그라나다 스타벅스, C32번 버스, 산 니콜라스 전망대 )",Blossom,수프라 이코노미 버스는 우리나라로 치면 우등 버스예요. 그래서 볼 것도 없이... 보면 드라마 알함브라 궁전의 추억도 떠오르고 상당히 로맨틱한 분위기. 알함브라...
585,나의 나라 드라마,2019.09.27.,[웬조이] 봄의나라이야기,아이돌 플레이어,"나 무슨 일 있어"" ""뭔데?"" ""몰라...."" ""박수영 그자식이 뭐 잘못했어?"" ""그자식이 뭐야. 그자식이"" ""내 애인도 아닌데 뭐"" 나는 순간 나의 말에 놀랐다. 겨울나라의 나와 같은..."
588,나의 나라 드라마,2019.09.23.,[드라마] 세상에서 제일 예쁜 내딸(세제딸) 마지막회,기새댁?,극중 박선자씨가 폐암 말기 확정 받으면서 진짜 매주 매주 보면서 울었는데ㅠㅠ 결국 하늘나라로 ....ㅠㅠ 이 드라마 보면서 다시한번 또 느끼게 됩니다.... 진짜 엄마는...
591,나의 나라 드라마,2019.10.01.,19.10.01 일기,서쪽의 웨스트에서 ...,나라고 항상 운전 잘하는건 아니지만 진짜 병신같이 운전하는 사람 너무 많아서... 맹비가도 뭐임ㅋㅋㅋㅋㅋㅋㅋㅋㅋㅋㅋㅋㅋ 유튜브에서 드라마 소개해주는 채널을...
592,나의 나라 드라마,2019.10.02.,"나다움 / 의미 있고, 행복한 나다운 삶",익명의 에디터 K,"( 여담이지만, 예전에 학창시절에 청춘 드라마의 한 장면 속에 나올 것 같은 대사로 종종 따라한 '나 답지 않아? 나 다운게 뭔데?'도 잠시 떠올랐다. ) 우리나라 저자가..."
593,나의 나라 드라마,2019.09.22.,떠오르는 억새명산 경주 동대봉산(東大封山)의 무장봉(?藏峰),킬리만자로를 꿈꾸며 님의 ...,"MBC 드라마 ""선덕여왕""과 영화 ""태극기 휘날리며""도 촬영했다고 합니다 동대봉산... 당나라 군사를 몰아내 삼국통일을 완성하고 죽어서 해룡이 되어 나라를 지키겠다고..."
596,나의 나라 드라마,2019.09.23.,"9월 세번째 이야기 ?  행복하다고 느끼는 순간, 두배는 더 행복해진다",티니의 일주일,같군 나라도 많이 먹어야겠숴 퇴근하고 혜수스랑 짧게 커피 한잔! 내가 뒤에... 마시면서 드라마 보기 ㅠㅠ 맨날 뜨거운 차를 핫뜨! 핫뜨! 하면서 1/3만 마시고 헐레벌떡...
598,나의 나라 드라마,2019.09.19.,[키키 키린] - 키키 키린 : 그녀가 남긴 120가지 말,HARU냥의 하루♡,"우리나라에서 제법 많이 알려진 일본 영화감독이다. 그래서 '고레에다 히로카즈... 드라마와 영화, 광고, 다큐멘터리 방송의 내레이션 등 다양한 분야에서 활약했던..."
599,나의 나라 드라마,2019.09.24.,미국 직장에서 살아남기,J의 블로그,그런 어설픈 번역을 그대로 믿고 남의 나라 기자를 잡는 게 말이 됩니까. 사실도... 한국 드라마에서처럼 종이 던지면서 이걸 보고서라고 썼냐 했다가는 잘못하면 나...
600,나의 나라 드라마,2019.09.19.,[하나투어 - 내나라여행] 남해안 4일 코스 출발입니다! (1일차),안녕.,"어느 날 점점 여행을 떠나기에 최적의 계절이 다가오고 있었고, 마침 국내 관광지의 매력에 심취해 있던 때에 하나투어의 프리미엄 국내여행인 내나라여행을 접할 수..."
602,나의 나라 드라마,2019.09.30.,"송모찌블로그 / 아비브어성초팩,일산 호미불닭,영화 벌새 추천,계림원 풍동점,웨스턴돔 큐브VR,명동 FLASK,동대문 진할매닭한마리,포비 광화문점,대만과자,해변주주,hiwalk,라페스타 백두한우곱창,나이키 p-6000,합정 옥동식,여의도 별미볶음점,행신동 주먹고기,고양 스타필드,베키아에누보,양지미식당,카페 페이어텐션",songmozzi blog.,재밌다는 표현은 어울리지 않고요연휴내내 이 드라마의 후폭풍이 ㅠㅠㅠㅠ아무튼... ㅋㅋㅋㅋㅋㅋㅋㅋㅋㅋㅋ나란냔. 카페 연곳 아무데나 들어가서 라떼샀는데어머...
603,나의 나라 드라마,2019.10.03.,아스달 연대기 시즌1_5화,아자아자 화이팅!!!,그 부분 때문에 이리 재미난 드라마를 많은 사람들이 안보는게 아쉬워서 만든... 어린 타곤에게 아스달을 떠나라고 하는 산웅. .... 역시나 신탁 때문에....? 아니면 아들에...
