,drama_title,date,blog_title,writer,contents
0,날 녹여주오 드라마,2019.09.27.,"냉동인간 20년 만에 깨어나다, tvn 새 토일드라마 '날 녹여주오'",아이의 눈으로 그린...,"'날 녹여주오' 드라마 제목인데요. 좀 특이하죠? 왠지 모르게 '결혼해주오? 듀오?'하는 결정사 광고가 생각나네요.ㅎㅎ '사랑하는 은동아','힘센 여자 도봉순','품위..."
1,날 녹여주오 드라마,2019.09.21.,"tvN 토일드라마 날녹여주오(인물관계도,줄거리) : 본격 해동 로맨스!! 원작 웹툰?",:: 행복하자 아프지...,오늘은 tvN 토일 드라마 '날 녹여주오'에 대해 포스팅 해보겠습니다. 지창욱 x 원진아 x 윤세아 주연의 '날 녹여주오'는 타이틀에서 알수 있듯이 냉동인간이 된 사람들이...
2,날 녹여주오 드라마,2019.09.16.,[드라마] tvN 날 녹여주오 기획의도 및 주요 인물소개,La reponse est l'...,같지 <날 녹여주오> 인물소개 _출처:공홈 우연히 그리고 처음 원진아 배우의 연기를 본 게 그냥 사랑하는 사이 라는 드라마에서였다. 처음부터 끝까지 다 보지는...
3,날 녹여주오 드라마,2019.09.23.,[Tvn 드라마 날녹여주오 예고편] 새로운 기대감...,magic room,'나쁜 놈아!!!' 날 녹여주오 | tvN 새 토일드라마 ＜날 녹여주오＞ ■편성: 9월 28일 [토] 밤 9시 첫 방송 ■출연: 지창욱 원진아 윤세아 등 ■연출: 신우철 ㅣ 극본...
4,날 녹여주오 드라마,2019.09.27.,"[신작 토일드라마] tvN 본격 해동 로맨스! 날 녹여주오 줄거리 및 인물관계도, 인물소개 : 나한테 허락 맡고 쓰러져(지창욱, 원진아)",차카니의 잡다한 일...,"냉동인간 동찬과 미란의 차갑고도 전설(?)적 사랑이야기를 볼 수 있는 새 토일드라마 날 녹여주오! "" 20년후엔 운명의 상대를 만난다네? "" 미란이의 20년 후 운명의 상대는..."
5,날 녹여주오 드라마,2019.09.16.,"tvn 새 금토드라마 <날녹여주오>-몇부작,줄거리,인물관계,지창욱,원진아",부산을 그리다,지창욱의 제대 후 복귀작으로 화제를 모으고 있는 <날 녹여주오>입니다. 방송일자: 9월28일 오후 9시 tvn (16부작) (아스달연대기 후속드라마) <출처:tvn홈페이지> 줄거리...
6,날 녹여주오 드라마,2019.09.26.,"미스터리한 냉동 인간 프로젝트 드라마 '날 녹여주오' 기대 리뷰, 9월 28일 첫방송",(주)YM entertainment,올 가을 온탕과 냉탕을 오가는 해동 로맨스 드라마 '날 녹여주오' 모두들 정주행 해보자구욧 > < 주말 드라마'날 녹여주오'는 '아스달 연대기 Part3' 후속작으로 tvN에서...
7,날 녹여주오 드라마,2019.09.21.,tvN_토일드라마_날 녹여주오_티저&OST 모음...,다영아빠의 일상이야...,tvN 토일드라마 '날 녹여주오' tvN 토일드라마 '아스달 연대기' 후속 '날 녹여주오' tvN 토일드라마 '날 녹여주오' 24시간 냉동인간 프로젝트에 비밀리에 참여한 남녀......
8,날 녹여주오 드라마,2019.09.23.,TvN드라마 '날 녹여주오'의 지창욱배우님이 착용한 날녹여주오 스마트밴드,화나면 불을 뿜는 용...,날녹여주오 드라마가 대박이 나면 스마트밴드도 더 유명세를 타지 않을까 싶네요. 날녹여주오 스마트밴드 CKC V2와 드라마 스샷을 두개 같은 상위에 올려놓고 보니...
9,날 녹여주오 드라마,2019.09.25.,드라마 날 녹여주오 등장인물관계도 지창욱 원진아 주연,너는 잘 할수 있는 ...,드라마 날 녹여주오 등장인물관계도 지창욱 원진아 주연. 안녕하세요 여러분~~ 밤이라서 그런지 바람이 무척 강하고 심지어 차가워서... 매우 춥습니다. 제가 원래 답답한...
11,날 녹여주오 드라마,2019.09.17.,tvN 드라마 날녹여주오 스마트밴드는 코아코리아 CKC V2 제품이었다는 사실!,블로그 시작!,아마 날 녹여주오 제작진이 드라마 소재와 맞게 사용하기 위해서 소품으로 사용한 것 같다는 후문이 있더라고요 아마 날 녹여주오 드라마가 시작하고 나면 날녹여주오...
12,날 녹여주오 드라마,2019.08.28.,지창욱 원진아 나이차이 날 녹여주오 레알설레,컴퓨터출장수리 데이...,지창욱 원진아 나이차이 날 녹여주오 레알설레 지창욱이 드라마로 복귀한다는 소식에 많은 팬들이 기대를 안고 있습니다. 원진아와 날 녹여주오라는 작품으로...
14,날 녹여주오 드라마,2019.09.16.,날녹여주오 지창욱 스마트밴드,오래된 전산님의블로...,근데 날 녹여주오 드라마와 지창욱 스마트밴드가 무슨 연관이 있을까요? 그건... tvN 토일드라마 '날 녹여주오' 의 남주인공으로 캐스팅이 된 지창욱! 잘생긴 지창욱...
15,날 녹여주오 드라마,2019.09.16.,[드라마] tvN 날 녹여주오 3인 캐릭터 포스터,La reponse est l'...,"사진출처: 네이버 기사 & tvn드라마 인스타그램 오오옷, 개인 포스터가 공개됐다!... 우리 사랑이.. 덜 끝났잖아."" 9월 28일 저녁 9시 tvN 날 녹여주오 첫방송!"
18,날 녹여주오 드라마,2019.09.26.,드라마 날 녹여주오 등장인물 관계도,날개야 돋아라,tvN 주말드라마 16부작 날 녹여주오 9월 28일 토요일 밤 9시 첫 방송 24시간 냉동 인간 프로젝트에 참여한 남녀가 미스터리한 음모로 인해 20년 후 깨어나면서 맞이하는...
20,날 녹여주오 드라마,2019.09.16.,날 녹여주오 인물관계도 와 몇 부작인지 알아볼게요,해피라이프,"인물관계도 드라마의 제작진 및 몇부작 드라마 '날 녹여주오'는 연출에 신우철PD가 맡았어요 신우철 감독이 연출한 드라마로는 2010~2011 '시크릿 가든', 2012년 '신사의..."
23,날 녹여주오 드라마,2019.09.21.,날 녹여주오 이홍기 출연 드라마 제작발표회 했네요,요니블로그,오늘 소개해드릴 드라마는 날 녹여주오라는 드라마인데요ㅎ 날 녹여주오는 tvN 드라마로 9월 28일부터 토 일 드라마로 밤 9시부터 시작하는 드라마랍니다. 제목이 날...
24,날 녹여주오 드라마,2019.09.24.,tvN드라마 날 녹여주오 등장인물관계도 : 지창욱 원진아,고양가구3단지 공식...,tvN드라마 날 녹여주오 등장인물관계도 : 지창욱 원진아 안녕하세요. 공동구매 전문가구단지 고양가구3단지에요. 길거리에서 가끔 촬영하는 모습을 봤는데 찾아보니 곧...
25,날 녹여주오 드라마,2019.09.25.,"[해동코믹로맨스드라마]날녹여 주오첫방예고 <tvN 토일드라마> 특별한 소재 '냉동인간' 지창욱X원진아, ′삼시보단 쿵쿵따!′ 세기말 감성 실화?",심리학 한 모금,"[해동코믹로맨스드라마] 날 녹여주오 9월28일(토) 밤 9시 첫 방송 많은 관심바랍니다. 매주 토일 오후 9시 방송됩니다. 신우철 감독과 백미경작가 의기투합, <최고의..."
26,날 녹여주오 드라마,2019.09.27.,tvN토일드라마 [날 녹여주오] 제작지원 소식,잠언의료기 광고홍보...,로맨틱한 웰메이드 드라마 주말밤은 이제 tvN에 고정해야겠네용~~ . 냉동인간 해동 로맨스 [날 녹여주오]와 제작지원하는 [잠언의료기]도 많은 관심 부탁드립니다!
27,날 녹여주오 드라마,2019.09.27.,날 녹여주오 코아스마트밴드 CKC V2,공이네 컴세상,"9월 28일 첫 방영 tvN 토일 주말드라마 ""날 녹여주오"" 완전 기대하고 있어요~~ 멋진 지창욱씨가 남주인공으로 캐스팅!! 거기다가 스토리가 냉동인간 프로젝트의 신선한..."
28,날 녹여주오 드라마,2019.09.27.,"방구오빠에서 마동찬으로, 날 녹여주오 지창욱!","나의하루,아이의하루",날 녹여주오 | tvN 새 토일드라마 ＜날 녹여주오＞ ■편성: 9월 28일 [토] 밤 9시 첫 방송 ■출연: 지창욱 원진아 윤세아 등 ■연출: 신우철 ㅣ 극본: 백미경 ■줄거리...
30,날 녹여주오 드라마,2019.09.23.,날 녹여주오 코아스마트밴드 깔끔하고 가성비 좋은 CKC V2,달콤 쌉싸름 :),그래서 하나 사줘야 하나 고민하고 있던 차에 우연히 tvN 토일 드라마 '날 녹여주오' 티저 영상을 보다가 지창욱이 손목에 하고 있는 스마트밴드에 눈이 훅 가더라구요....
32,날 녹여주오 드라마,2019.09.18.,FT아일랜드 이홍기 날 녹여주오 특별출연 예고,FT아일랜드랑 놀자!...,토 PM9 첫 방송 날 녹여주오 홍기는 특별 출연이고요 임원희 씨 젊은 시절? ㅋㅋ 손현기 역할이에요 홍기 이 드라마 땜에 그 긴 머리를 유지했나봄 이건 그냥 홍기가...
33,날 녹여주오 드라마,2019.09.27.,"[날녹여주오 윤세아 패션 :: 수트, 원피스, 귀걸이, 블라우스 여기 있어요]",오피스룩 + 패션 ::...,윤세아 님이 개인 SNS를 통해 tvN 드라마 '날 녹여주오' 촬영 현장으로 보이는 사진 한 장을 개제했습니다. 사진 속 지창욱 님과 함께 있는 모습을 보니 묘하게 잘...
34,날 녹여주오 드라마,2019.09.17.,[드라마] tvN 날 녹여주오 비하인드 컷,La reponse est l'...,아침에 떴던 비하인드 컷 기사! 한데 모여있어서 따로따로 보고 싶은 마음이 컸는데 마침 딱!! 고화질로 똑!! 떼서 올라왔드아! 우선 방송계의 전설을 꿈꾸는 마피디!!...
36,날 녹여주오 드라마,2019.09.23.,지창욱의 날녹여주오 스마트밴드 라고 들어봤어?,식창이의 블로그,이번에 tvN에서 새드라마 날 녹여주오 라는게 하더라고요 그냥 생각없이 채널... 날녹여주오 스마트밴드도 정말 절로 눈이 가더라고요 ! 아참 날녹여주오 드라마에...
38,날 녹여주오 드라마,2019.09.26.,tvN '날 녹여주오' 지창욱 스마트 밴드!,별야기,그리고 드라마 '날 녹여주오' 착용한 모습을 보니 디자인도 심플하고 여러 가지 기능들도 있고 괜찮은 제품인 거 같네요~ 지창욱 스마트 밴드 CKC V2 저도 패션...
40,날 녹여주오 드라마,2019.09.23.,한다솔 나이 몸매 키 날 녹여주오,Alice House,한다솔씨는 오는 9월 28일에 방영 예작인 24시간 냉동인간 프로젝트에 참여한 남녀가 20년 후에 깨어나면서 일어나는 일을 그린 미스터리물의 드라마 '날 녹여주오...
41,날 녹여주오 드라마,2019.09.17.,원진아 나이 키 몸매 날 녹여주오,26rm8a3hk4q님의블로...,다음주부터 시작되는 주말드라마인 <날 녹여주오>도 정말 기대가 되지만 다양한 매력을 가진 원진아씨가 앞으로 찍을 작품들도 꼭꼭 챙겨봐야겠어요 원진아 나이 키...
44,날 녹여주오 드라마,2019.09.25.,원진아 날녹여주오 나이 키 돈 몸매 노출 과거 인스타,오늘의 온도℃,원진아 날녹여주오 나이 키 돈 몸매 노출 과거 인스타 출처: j0i3n2a9 인스타 드라마 날녹여주오에 출연하는 여주인공 원진아 님이 화제가 되고 있어요 원진아는...
45,날 녹여주오 드라마,2019.09.27.,"날 녹여주오 인물관계도, 등장인물소개, 1회 줄거리",지혜로운 연서맘 ♡...,"날 녹여주오 인물관계도, 등장인물소개, 1회 줄거리 #날녹여주오 #드라마날녹여주오 #드라마날녹여주오 #주말드라마 #tvN #tvN드라마 #주말드라마날녹여주오..."
46,날 녹여주오 드라마,2019.09.20.,[드라마]날 녹여주오,고양아 야옹해봐,"tvN 새 토일드라마 제목:날 녹여주오 주인공:지창욱,원진아 드라마의 소재가 참 독특하다. 냉동인간. 지금까지의 드라마에서 한번도 다루어본적 없는 소재. 시나리오를..."
47,날 녹여주오 드라마,2019.09.21.,[드라마] tvN 날 녹여주오 제작발표회,La reponse est l'...,https://youtu.be/23C82kGoVe8 라이브로 방송해주지 않으려나? 했는데.. 응 안해줌 다행히 유툽에 부분 영상이랑 풀영상 모두 있었당! 젤 처음에 배우 한명씩 올라와서...
48,날 녹여주오 드라마,2019.09.25.,날 녹여주오 인물관계도 등장인물 지창욱 원진아 윤세아,체리별,드라마는 날 녹여주오입니다. 날 녹여주오는 총 16부작으로 방영이 되며 토일 밤 9시를 책임질 것으로 보입니다. 아스달 연대기 후속으로 방영되는 날 녹여주오는 배우...
49,날 녹여주오 드라마,2019.09.27.,"날 녹여주오 인물관계도, 지창욱 원진아","은근히 잘되리라,",꼬박꼬박 드라마 챙겨보느라 요즘 요일이 어떻게 가는지도 모르겠어요ㅠ 오늘 소개해 드릴 드라마 날 녹여주오는 지창욱님이 제대 후 선택한 작품으로 계속 기사로는...
50,날 녹여주오 드라마,2019.09.27.,날 녹여주오 촬영지 계명대 알아보세요,한글 2017 무료설치,08:32 날 녹여주오 촬영지 계명대 알아보세요 많은 분들이 tvn에서 하는 드라마 날 녹여주오에 대해서 촬영지 계명대에 대해서 알아보도록 하겠습니다. 아스달...
53,날 녹여주오 드라마,2019.09.27.,날 녹여주오 인물관계도 등장인물 소개,찌아의 건강한 이야...,"24시간 냉동 인간 프로젝트에 참여한 남녀가 미스터리한 음모로 인해 20년 후 깨어나면서 맞이하는 가슴 뜨거운 이야기 tvN 드라마 '날 녹여주오'는 9월 28일 (토, 일) 오후..."
54,날 녹여주오 드라마,2019.09.16.,최보민 나이 키 골든차일드 날녹여주오 굿굿,*한준컴퍼니* 단열필...,웹드라마 <에이틴 시즌2>에 전학생 류주하 역으로 출연하였는데요. 이를 계기로 더 많은 사람들에게 알려지게 되었죠. 이렇게 최보민 나이 키 골든차일드 날녹여주오...
58,날 녹여주오 드라마,2019.09.27.,날녹여주오 재방송 다시보기 1회부터 여기서 무료 시청 등장인물관계도 줄거리 몇부작 지창욱 윤세아 원진아,Living information,www.yeonnjuhyun.com tvN드라마 ‘날 녹여주오’는 24시간 냉동 인간 프로젝트에 참여한 남녀가 미스터리한 음모로 인해 20년 후 깨어나면서 맞이하는 가슴 뜨거운...
59,날 녹여주오 드라마,2019.09.13.,"‘날 녹여주오’ 측이 13일 1분 하이라이트 영상과 종합 예고 영상을 공개, 세 가지 재미 키워드",최적화블로그꿀벌 나...,"tvN 새 토일드라마 ‘ #날녹여주오’ 측이 13일 1분 #하이라이트 #영상과 #종합 #예고 #영상을 #공개했다. 이에 냉동 남녀 지창욱, 원진아를 비롯한 ‘날 녹여주오’의..."
60,날 녹여주오 드라마,2019.09.20.,"날 녹여주오 티저 윤세아 패션 옷, 라인어디션 블라우스 단아해!",숑스,28일 첫방송 예정인 드라마 '날 녹여주오' 24시간 냉동 인간 프로젝트에 참여한 남녀가 미스터리한 음모로 인해 20년 후 깨어나면서 맞이하는 가슴 뜨거운 이야기라고...
62,날 녹여주오 드라마,2019.09.23.,송지은 나이 몸매 성형 날녹여주오,공간을 아름답게♡,"송지은씨는 오는 28일 방영 예작인 날 녹여주오에서 대학생 오영선의 모습을... 앞으로 무대를 넘어 드라마, 영화 등 다양한 분야에서 모습이 기대가 됩니다.:)"
63,날 녹여주오 드라마,2019.09.23.,날 녹여주오 티저 윤세아 블라우스 패션은 라인어디션 옷!,FLOG,토일극 '날 녹여주오' 가 드디어 이번 주 첫 방송을 앞두고 있는데요~! 저도 너무 기다려지는 드라마라 티저 영상을 찾아보는데 요즘 너무 재미나게 보고 있는...
64,날 녹여주오 드라마,2019.09.22.,드라마 날 녹여주오 지창욱 원진아 인물관계도/등장인물/줄거리/몇부작(아스달 연대기 파트3 후속),새벽달의 감성다락방,#아스달 연대기 시즌3 후속 tvn 새 주말(토일)드라마 날 녹여주오 몇부작/줄거리/지창욱 원진아 등장인물관계도 종영까지 한 회만을 앞두고 있는 아스달 연대기 파트3...
65,날 녹여주오 드라마,2019.09.27.,드라마 <날녹여주오> 스마트밴드 신통방통하다~~,살아있어 행복합니다...,드라마 <날녹여주오> 스마트밴드는 사람의 온도까지 감지해 주나봐요 정말 신기?? 어떻게 그런 기술이 있지? 여기서 순간 지창욱 손목에 착용한 스마트밴드가 제가...
66,날 녹여주오 드라마,2019.09.17.,tvN드라마 날 녹여주오 인물관계도 줄거리 몇부작 지창욱 원진아,헬로우드림 재알마,tvN드라마 날 녹여주오 인물관계도 줄거리 몇부작 지창욱 원진아 다음주 방영예정인 피크시간 토일 드라마에 대해 알아보려고 합니다. 모두 추석연휴는 잘 보내셨나요?...
68,날 녹여주오 드라마,2019.09.20.,날 녹여주오 제작발표회 현장! 원진아의 포인트 귀걸이 스타일링,버라이어티 스타일링,안녕하세용ㅎㅎㅎㅎ 오늘은 드디어 시작하는 드라마 tvN 날 녹여주오! 제작발표회가 바로 오늘 있었는데용ㅎㅎㅎㅎㅎ 원진아씨 미모 물오른 모습을...
69,날 녹여주오 드라마,2019.09.20.,"'날 녹여주오' 지창욱 ""군 전역 후 첫 작품..떨린다""",금단지부동산의 부동...,"20일 오후 서울 강남구 논현동 임피리얼팰리스 서울 호텔에서는 tvN 새 토일드라마 '날 녹여주오'(극본 백미경, 연출 신우철) 제작발표회가 열렸다. 이날 극중 20년..."
70,날 녹여주오 드라마,2019.08.28.,tVN 방영예정 드라마 라인업 2019년 하반기 - 호텔델루나 후속/ 아스달 연대기 파트3/ 날 녹여주오/ 사랑의 불시착/ tvn주말드라마/ tvn 월화드라마/ tvn수목드라마/,Happy happy life,tVN에서 재밌는 드라마가 많이 하니까 2019년 하반기도 tVN드라마를 많이 보게되지... 박옥빈 날 녹여주오 (9월 말 또는 10월 초) 연출 신우철 극복 백미경 24시간 냉동...
71,날 녹여주오 드라마,2019.09.19.,[드라마] tvN 날 녹여주오 비하인드 컷 2,La reponse est l'...,마동찬이!!!!!!! 출처: tvN 공식계정 트위터 빨리 보고 싶다구우ㅠㅠㅠㅠ 궁금하다 궁금해~~!!! 고미란이~ 출처: tvN 공식계정 트위터
72,날 녹여주오 드라마,2019.09.15.,[드라마] tvN 날 녹여주오 인물 관계도 (수정),La reponse est l'...,"1999년 인물 관계도! 20년이 흐른 후의 인물 관계도도 나왔으면 좋겠당ㅋㅋ 예고랑 티저만 봐도 재밌을 것 같은 기대감이 막 샘솟던데 ㅋㅋ 그러고보니, 첫방도 이제..."
73,날 녹여주오 드라마,2019.09.20.,190920 tvN '날 녹여주오' 제작발표회 속 원진아 패션,FAIRYISM,tvN 드라마 '날 녹여주오' 제작발표회를 했는데요! 제작발표회 원진아씨! 날 녹여주오에 출연하다고 하는데요~ 굉장히 기대가 됩니다!! 그리고 여기서 원진아씨의...
74,날 녹여주오 드라마,2019.09.18.,"‘날 녹여주오’ 한다솔, 마동주 역 캐스팅 ‘지창욱과 남매 호흡’",담스토리,"17일 소속사 씨제스엔터테인먼트가 신인배우 한다솔이 tvN 새 토일드라마 ‘날 녹여주오(극본 백미경/연출 신우철/제작 스튜디오드래곤, 스토리피닉스)’에..."
75,날 녹여주오 드라마,2019.09.17.,신인 배우 한다솔이 ‘날 녹여주오’에 합류한다.,최적화블로그꿀벌 나...,17일 소속사 씨제스엔터테인먼트에 따르면 한다솔은 tvN 새 토일드라마 ‘날 녹여주오’에 마동주 역으로 출연한다. ‘날 녹여주오’는 냉동 인간 프로젝트에 참여한...
76,날 녹여주오 드라마,2019.09.20.,"지창욱 ""군 전역 후 복귀작..너무 긴장돼""..'날 녹여주오' 지창욱, 군 제대 후 복귀작으로 선택한 이유는? '날 녹여주오' 지창욱ㆍ원진아, 달달 케미",Mr.Lim's Daily Lif...,"'날 녹여주오' 지창욱 ""군 전역 후 복귀작..너무 긴장돼"" 배우 지창욱이 20일 논현동 임피리얼 팰리스호텔에서 열린 tvN 토일 드라마 '날 녹여주오'의 제작발표회에서..."
78,날 녹여주오 드라마,2019.09.13.,'날 녹여주오'가 짧은 시간 동안 보는 이들로 하여금 무한 기대를 품게 하는 1분 하이라이트 영상과 종합 예고 영상을 공개,최적화블로그꿀벌 나...,"tvN 새 토일드라마 ' #날녹여주오'(백미경 극본, 신우철 연출)가 짧은 시간 동안... 냉동 남녀 지창욱, 원진아를 비롯한 '날 녹여주오'의 주역들이 보여줄 영상 속 세..."
79,날 녹여주오 드라마,2019.09.16.,눈에띄네!!! 날녹여주오 스마트밴드 코아코리아 CKC V2,이제 되돌리다,오늘은 날녹여주오 드라마 얘기는 아니고 드라마속 스마트밴드 제품 눈에 띄어서... tvN토일드라마 날 녹여주오 티저영상 보셨나요? 날녹여주오의 남주인공으로...
80,날 녹여주오 드라마,2019.09.20.,"지창욱, 군 전역 후 복귀작 '날 녹여주오'",망고의 일상,"20일 오후 서울 강남구 임피리얼호텔에서 tvN 새 토일드라마 '날 녹여주오' 제작발표회가 진행됐다. 행사에는 지창욱, 원진아, 윤세아, 임원희, 백미경 작가, 신우철 PD가..."
81,날 녹여주오 드라마,2019.09.15.,날녹여주오 지창욱 냉동인간 팔찌~?스마트밴드 코아코리아 CKC V2!!,시간을 즐기는 프리...,"잘생긴 배우로 입소문이 자자한 지창욱~~ 이번 tvn""날 녹여주오""에 캐스팅되어 뭇여성들의 마음을 다시금 사로잡고 있는 그. 그런데, 이번 드라마 주제가..."
82,날 녹여주오 드라마,2019.09.20.,지창욱 군 제대 후 첫 작품 '날 녹여주오' 제작발표회,아마추어 블로그,20일 오후 서울 강남구 임피리얼팰리스 호텔에서 tvN 새 토일드라마 '날 녹여주오' 제작발표회가 열렸었습니다. 이날은 극중 20년만에 돌아온 스타 예능PD 마동찬 역을...
83,날 녹여주오 드라마,2019.09.20.,"지창욱 ""날 녹여주오"" 전역 후 첫 작품 제작발표회",라디아 신통방통 매...,"지창욱 ""날 녹여주오"" 전역 후 첫 작품 제작발표회 배우 지창욱이 20일 강남구 임피리얼 팰리스 서울 호텔에서 열린 tvN 드라마 '날 녹여주오' 제작발표회에서 포즈를..."
85,날 녹여주오 드라마,2019.09.21.,뽐내고 있는 지창욱이 눈에?? `날 녹여주오` - 오늘경제,뉴스브릿지,"오늘경제 - 2019-09-21 08:22 [오늘경제 = 강길태 기자] 28일 밤 첫 방송을 앞두고 있는 tvN 새 토일드라마 ‘날 녹여주오’에는 믿고 보는 배우들이 총출동, 이야기에서..."
86,날 녹여주오 드라마,2019.09.26.,미란은 그 프로그램의 실험 알바생이었다 ˝날 녹여주오˝ - 업코리아,뉴스브릿지,업코리아 - 2019-09-26 04:01 [업코리아=박진환 기자] 28일(토) 첫 방송을 앞둔 tvN 새 토일드라마 ‘날 녹여주오’가 공개한 인물 관계도는 알고 보면 더 재미있게...
87,날 녹여주오 드라마,2019.09.17.,TVN 새주말드라마 날녹여주오 롱브릭혹두기협찬,"건축 내,외장재 전문...",화이트혹두기 롱브릭 정말 멋지네요 ^^
89,날 녹여주오 드라마,2019.09.16.,`날 녹여주오` 세월이 뭔지 감도 꽁꽁 얼어붙었기?? - 시사매거진,뉴스브릿지,"시사매거진 - 2019-09-16 20:26 [시사매거진=주진현 기자] 28일 밤 9시 첫 방송되는 tvN 새 토일드라마 ‘날 녹여주오’(극본 백미경, 연출 신우철, 제작..."
96,날 녹여주오 드라마,2019.09.20.,날 녹여주오! 제작발표회(지창욱),あなたがいてくれて...,지배우님 너무나 이쁘고 멋있다 드라마 대박나길♡
97,날 녹여주오 드라마,2019.09.21.,‘지창욱’ 드라마 날 녹여주오에 출연한다 - sbn뉴스,뉴스브릿지,"sbn뉴스 - 2019-09-21 17:42 [sbn뉴스=온라인뉴스팀] 16일 지창욱은 자신의 인스타그램에 ""월요일....아....""라는 글과 함께 사진을 게재했다. 공개된 사진 속..."
98,날 녹여주오 드라마,2019.09.26.,직접 뽑아본 기대되는 드라마 TOP3,EWHACISM,"자 다음으로 두번째로 소개해드릴 드라마는 9월 28일 방송예정 드라마 날 녹여주오 입니다. 편성: tvN 2019.09.28. ~ 방영예정 (토, 일) 오후 09:00 제작사: 스튜디오 드래곤..."
99,날 녹여주오 드라마,2019.09.19.,★씨(SI)★ 드라마 배우 어울릴만한 수트 아이템 모음 특집,항상 배고픈 조붱 블...,두분 정말 드라마로 활약하고 계시죵!!!ㅎㅎ 임지연님은 웰컴2라이프!! 윤세아님은 날 녹여주오 준비중이시구용!!ㅎㅎ 두분에게 어울릴만 한 수트 아이템!!! 그리고...
100,날 녹여주오 드라마,2019.09.20.,2019년 하반기 드라마 기대작 추가 2,진실은 저 멀리에,주말 드라마 '날 녹여주오' 후속. 11월 23일 살다살다 연애 드라마를 기다려보기는 처음. 어쨌건 설정이 특이(여주가 북한에 우연찮게 떨어져서 벌어지는 사건)한 데다가...
101,날 녹여주오 드라마,2019.09.17.,가을 정주행드라마 추천,상가천국,"tvN 날 녹여주오 첫방 : 2019년 9월 28일 토요일 오후 9시 총회차 : 16부작 극본 : 백미경 연출 : 신우철 출연 : 지창욱, 원진아, 윤세아 등 tvN 토일드라마인 #날녹여주오 의..."
