,drama_title,date,blog_title,writer,contents
102,날 녹여주오 드라마,2019.09.17.,방송예정 드라마 / 2019년 9월 신규드라마,my lulu,줄 드라마 @_@ 날 녹여주오 24시간 냉동 인간 프로젝트에 참여한 남녀가 미스터리한 음모로 인해 20년 후 깨어나면서 맞이하는 가슴 뜨거운 이야기 program.tving.com...
104,날 녹여주오 드라마,2019.09.22.,"""골든차일드 보민이, 더 뜨자""",냉정과 잔 정 사이,2017년 데뷔 3년차 구먼 이 그룹보니 보민이가 막내에 비주얼담당 검색하다보니 곧 방영될 tvN 드라마 '날 녹여주오'에 조연으로 출연한대 차은우 군 같은 행보를...
105,날 녹여주오 드라마,2019.09.24.,지창욱 드라마 제대 나이 키 여자친구 과거사진 인스타,오늘의 온도℃,이렇게 지창욱 드라마 제대 나이 키 여자친구 과거사진 인스타 등 알아보았는데요 tvN 주말드라마 날 녹여주오는 오는 28일 오후 9시에 첫 방송되니 많은 시청바랍니다^^
107,날 녹여주오 드라마,2019.09.24.,[드라마] 2019 9월 넷째주 방영예정드라마,믽의 민밎한 블로그,"다음으로, 토일드라마 '날 녹여주오' 입니다~ 로코장인 지창욱님이 군 제대 이후 복귀작으로 선택한 작품인데요~ 이번 드라마에서 원진아님과 어떤 케미를 보여줄지..."
109,날 녹여주오 드라마,2019.09.22.,윤세아 몸매 40대에 이런 몸매가?,분홍하프,될 드라마 날 녹여주오에서도 출연을 하게 되었는데요 날 녹여주오는 지창욱... 있는 드라마 날 녹여주오 드라마는 내용도 엄청 신선하고 윤세아가 거기서 어떠한...
110,날 녹여주오 드라마,2019.09.18.,김희라 나이 부인 드라마 영화 아들,급상승검색어,blog.naver.com 지창욱 나이 키 생일 드라마 날 녹여주오 과거사진 원진아 윤세아 임원희 오늘 소개할 배우는 지창욱 배우입니다.1. 지창욱 나이 생일 학교지창욱 배우는...
112,날 녹여주오 드라마,2019.09.24.,집콕하면서 시간 순삭하기좋은 로맨스드라마 추천 1탄,기록. Story my lif...,"므흣? 요즘 날 녹여주오 라는 드라마 촬영중이시라는데 완전 기대중 수상한 파트너 수상한 파트너 연출 박선호, 정동윤 출연 지창욱, 남지현, 권나라, 최태준, 동하..."
114,날 녹여주오 드라마,2019.09.27.,지창욱 나이 키 사진 인스타그램 으로 보기,이마즈의 매거진,이번에 날녹여주오 라는 드라마로 컴백을 예고한 미남 배우의 대명사라고 불리우는 지창욱 나이 키 사진 인스타그램 을 통해 알아보는 시간을 가져볼까 합니다...
117,날 녹여주오 드라마,2019.09.24.,여자연예인 피부관리 부러워만 했나요? 제일 쉬운 방법 추천드려요~,라파팜 랭이의 일상...,"[이미지 출처: tv N 날 녹여주오 홈페이지] 윤세아 씨 근황 찾다 보니까 tv N 드라마인 <날 녹여주오>에도 나온다는데, 방송국 보도국장 역할이래요. 워낙 도시적이고..."
118,날 녹여주오 드라마,2019.09.15.,아스달 연대기 몇부작 ? 후속은? 시청률은?,해피라이프,그리고 아스달 연대기의 후속으로는 '날 녹여주오'라는 드라마가 9월 28일 새롭게 시작합니다. 출연 주인공으로는 지창욱과 원진아가 출연한다고 하네요 '날...
119,날 녹여주오 드라마,2019.09.23.,김래원 나이 키 군대 여친 집안 공효진 강기영,급상승검색어,blog.naver.com 호텔 델루나 후속 날 녹여주오 원진아 나이 키 학교 몸매 지창욱 드라마 오늘 소개할 배우는 호텔 델루나 후속 드라마 날 녹여주오의 주인공 원진아...
121,날 녹여주오 드라마,2019.09.27.,배가본드 2화 : 스턴트맨이라거??,Here comes the sun,"그리고 동시간대는 아니지만 아스달 연대기가 종료된 후 TVN에서는 ""날 녹여주오""라는 백미경 극본, 신우철 연출의 지창욱을 내세운 드라마가 28일부터 방영에정입니다...."
122,날 녹여주오 드라마,2019.09.20.,베이비복스 출신 간미연이 웨딩드레스를 입은 모습을 공개했다.,최적화블로그꿀벌 나...,20일 오후 서울 강남구 임피리얼팰리스 서울에서는 tvN 새 토일드라마 ‘날 녹여주오’ 제작발표회가 개최됐다. 임원희는 ‘날 녹여주오’에서 방송국 국장 손현기 역을...
123,날 녹여주오 드라마,2019.09.20.,2019 9월 방영예정 TV 드라마 라인업 공개,플러스후의원,tvN 새 토일드라마 '날 녹여주오' 9월 28일 첫 방송 '날 녹여주오'는 24시간 냉동 인간 프로젝트에 참여한 남녀가 미스터리한 음모로 인해 20년 후 깨어나면서 맞이하는...
124,날 녹여주오 드라마,2019.09.25.,배가본드 첫방송 성공적인 시청률?,포키포키해,"금토드라마 오후10시에 하는거 잘선택한듯 주말이라고 하기도 애매하고 ㅋㅋ... 날 녹여주오 첫방송은 토,일 9시니까 시간이 겹치지는 않아서 다행인거 같기는 하다..."
125,날 녹여주오 드라마,2019.09.24.,윤세아 피부관리 소문난 피부진액앰플 천수애진 3개월 후기^^,쿵야의 하루,[사진출처: 날 녹여주오 네이버 캐스트 예고편 캡쳐] 아 글구 요즘 드라마 재밌는게 없어서 삼시세끼만 보고 있었는데.. 이번에 세아씨가 날녹여주오라는 드라마 한다고...
127,날 녹여주오 드라마,2019.09.16.,190914 190915 윤세아 인스타그램 스커트셋업 정보 (모조에스핀),스타패션 매거진,날 녹여주오라는 드라마인데 촬영장에서 장난스러운 모습을 인스타그램에 올리셨네요~!! 화이트 V넥 자켓으로 넥도 길어보이면서 금장 단추로 고급스럽네요! 약간 긴...
128,날 녹여주오 드라마,2019.09.19.,산업 Focus; 미디어 - 눈이 즐거울 금토,마포투자협동조합,토일 라인업(9월 28일 방영) 의 ‘날 녹여주오’다. 국내 최대 드라마 제작사 스튜디오드래곤(253450)이 핵심 작품 ‘사랑의 불시착’ 이전에 넣는 야심작이다....
130,날 녹여주오 드라마,2019.09.16.,강기영 여자친구 결혼 아내 영화 김래원 공효진 인스타,급상승검색어,생일 드라마 날 녹여주오 과거사진 원진아 윤세아 임원희 오늘 소개할 배우는 지창욱 배우입니다.1. 지창욱 나이 생일 학교지창욱 배우는 1987년 7월 5일 생으로 ......
131,날 녹여주오 드라마,2019.09.27.,윤세아 나이 몸매 남편 이혼 결혼 NO! 김병철 열애 과거사진?,Joke,최근에는 드라마 날 녹여주오 나하영 케릭터을 맡으며 다시 한 번 연기자임을 확실히 보여주고 있는데 평소 털털하고 시원한 성격과 좋은 인성을 갖추고 있어 삼시세끼...
133,날 녹여주오 드라마,2019.09.19.,설레는 '썸남' 캐릭터 연기하는 골차-보민,멀티미디어 로그,지창욱 나오는 '날 녹여주오'라는 드라마 조연으로 나와 드라마 촬영 사진이라고 떴길래 너무 좋아서퓨ㅠㅠㅠㅠㅠㅠㅠㅠ 보밍이 열일하는...
136,날 녹여주오 드라마,2019.09.20.,2019년 09월 20일 뉴스 ? 연예 섹션보기,불교공부 블로그,"독일드라마 '바빌론 베를린', 국내 첫 방송 김형묵, '악마가(歌)' 종영 소감 ""모든... 로맨스 '날 녹여주오' 몬스타엑스, 윌 아이 엠 참여 새 싱글 발표 배우 황지현 결혼..."
137,날 녹여주오 드라마,2019.09.16.,아스달 연대기 16회 줄거리 카라타 에리카 송중기 살렸다 재방송,생각되로 Ting♡,이미 후속방송 날 녹여주오 는 28일 날 방송예정 으로 잡혀 있는 상황 입니다. 이렇게 이런식으로 끝을 낸다 생각하니 정말 보내주기 싫은 드라마 입니다. 어떤 분들은...
140,날 녹여주오 드라마,2019.09.19.,2019 AAA 참석 명단에 이름 올린 배우들,멀티미디어 로그,"그는 새 드라마 <날 녹여주오>에서 냉동 인간으로 변신, 훈훈한 외모와 탄탄한 연기력의 시너지를 폭발시키며 안방극장을 매료시킬 계획이다. <정해인> 드라마 <봄밤>을..."
141,날 녹여주오 드라마,2019.09.24.,돋보적인 연기력으로 첫등장부터 눈에 띈 신인 배우 8인방 소개!,YM ent 섭외 전문 엔터테인...,"시원시원한 미소, 낮으면서도 선명한 목소리, 날 녹여주오 연출 신우철 출연... 드라마와 영화를 오가며 대중들의 사랑을 받고 있는 그녀의 행보가 기대되네요. 2...."
142,날 녹여주오 드라마,2019.09.24.,이홍기 나이 인스타 키 과거 군대 차기작 wow,dheb30mlf님의블로그,이홍기씨의 차기작은 방영예정인 드라마 날 녹여주오의 임원희씨의 아역으로 나온다고 합니다. 어떤 모습을 보여줄지 기대가 되는데요. 이렇게 이홍기씨의 나이...
145,날 녹여주오 드라마,2019.09.14.,성난 황소 결말 영화 줄거리 마동석,급상승검색어,"오눌 소개할 영화는 '성난 황소'(2018)입니다. 1980년 마틴 스콜세지의 동명의 영화 '성난 황소'가 존재하지만, 이 영화를 보고 난 후에는, '성난 황소'가 그래도 가장 잘..."
146,날 녹여주오 드라마,2019.09.14.,오늘 무슨 요일이지?,ldyjcw0404님의블로...,이제부터 주말은 [날 녹여주오]에게 맡겨주오! 9월 28일 [토] 밤 9시 첫 방송 #tvN #새토일드라마 #날녹여주오 #지창욱 #원진아 #윤세아 출처 ㅡ @tvndrama.official...
147,날 녹여주오 드라마,2019.09.16.,♥?캐릭터 소개,ldyjcw0404님의블로...,알아두면 쓸 데 있는 <날 녹여주오> 캐릭터 소개 . 9월 28일 [토] 밤 9시 첫 방송 #tvN #새토일드라마 #날녹여주오 #지창욱 #원진아 #윤세아 #캐릭터 #소개...
152,날 녹여주오 드라마,2019.09.20.,레버넌트: 죽음에서 돌아온 자 뜻 실화 결말 스포 줄거리,급상승검색어,"모험 드라마 상영시간 156분 등급 15세 이상 관람가 개봉일 2016.01.14 관객수 200만명... 다음 날 새벽, 피츠제럴드는 브리저에게 20명 정도의 리 족이 계곡 너머에 있는..."
154,날 녹여주오 드라마,2019.09.15.,스파이 브릿지 결말 스포 줄거리 실화,급상승검색어,"나가며 스티븐 스필버그는 오락영화뿐만 아니라, '쉰들러의 리스트'와 같은 드라마 영화를 잘 만드는 감독입니다. 1950년대의 냉전시대의 실화를 바탕으로한 영화를 보며..."
155,날 녹여주오 드라마,2019.09.20.,원진아,반야월 박회장,또한 2019년 하반기 방영 예정인 tvN 드라마 《날 녹여주오》에도 주연으로 캐스팅 되었다. 상대 역은 지창욱. 3. 출연 작품[편집] 3.1. 영화[편집] Filmography 개봉 연도...
159,날 녹여주오 드라마,2019.08.28.,바스터즈 거친 녀석들 결말 줄거리 멜라니 로랑 크리스토프 왈츠 한스 란다 다이앤 크루거 쿠엔틴 타란티노,급상승검색어,"체질 천우희 안재홍 전여빈 오늘 소개할 배우는 '멜로가 체질' 한지은 배우입니다. 1. 한지은 나이, 한지은 학교1990년 생으... blog.naver.com 지창욱 나이 키 생일 드라마 날 녹"
160,날 녹여주오 드라마,2019.09.24.,아스달 연대기 18화 시청후기 / 아스달 연대기 결말,몽글몽글한 하루,"기획한 드라마""라며 ""제작진도 당연히 시즌2를 하고 싶은게 사실이다. 그래서 18화... 날 녹여주오 봐야지 드디어함 ㅠㅠㅠ 원진아x지창욱 ㅠㅠㅠㅠㅠ 케미기대 백미경..."
161,날 녹여주오 드라마,2019.08.28.,지창욱,혀니의 감성충만 힐...,"독립영화 슬리핑 뷰티, 드라마 솔약국집 아들들, 뮤지컬 쓰릴 미 등의 초기작... <del>그리고 군입대(...)</del> 전역 후 로맨틱 코미디 날 녹여주오를 복귀작으로..."
162,날 녹여주오 드라마,2019.09.17.,박민영 서강준 JTBC 날씨가 좋으면 찾아가겠어요 힐링 로맨스 감성멜로 캐스팅 출연 확정◀한글그림,한글그림기적 다영시...,"신인배우 한다솔은 28일 첫 방송되는 tvN 새 토일드라마 '날 녹여주오'에 출연, 마동찬(지창욱 분)의 동생 마동주 역을 맡았다. 동주는 본래..."
163,날 녹여주오 드라마,2019.09.21.,원진아 키 나이 그리고 프로필은 어떻게 될까요?,해피라이프,방송되는 드라마 '날 녹여주오'의 여주인공 원진아에 대해 알아볼게요 드라마 '날 녹여주오'는 지창욱의 군 제대 후 복귀작으로 원진아와의 어떤 로맨스를 할지...
167,날 녹여주오 드라마,2019.09.19.,‘윤세아’ 차갑게 변할 수밖에 없었던 이야기를 써나갈 예정이다 - 한국스포츠통신,뉴스브릿지,한국스포츠통신 - 2019-09-19 19:31 (한국스포츠통신=신택교 기자) 윤세아가 tvN 새 드라마 \'날 녹여주오\' 촬영 현장 사진을 내놓았다. 윤세아는 9월 14일 자신의...
168,날 녹여주오 드라마,2019.09.19.,탐정:리턴즈 스포 결말 줄거리 쿠키 후속편 탐정3편,급상승검색어,"결국 다음 날, 미옥은 '네가 네 맘대로 살 거면 나도 내 맘대로 살 거다.'란 쪽지를 남기고 가출을 합니다. 탐정:리턴즈 스틸컷 (출처-네이버 영화 탐정:리턴즈) 또한..."
169,날 녹여주오 드라마,2019.09.20.,"'임짠희는 NO' 임원희, 오늘은 패셔니스타",행복을 주는 박안나...,임원희가 20일 오후 서울 논현동 임피리얼팰리스호텔에서 진행된 tvN 새 주말드라마 '날 녹여주오'(극본 백미경/연출 신우철)의 제작발표회에 참석해 포즈를 취하고...
171,날 녹여주오 드라마,2019.09.16.,개멋짐,ldyjcw0404님의블로...,"내 심장이 반응하는 드라마.. 날녹 하나야..."" 마동찬 너가 내 별이다..☆?.*?? - #지창욱 #JiChangWook #마동찬 #tvN #날녹여주오 #캐릭터 #개멋짐..."
174,날 녹여주오 드라마,2019.09.18.,배우 원진아가 흑백 사진 속 치명적인 고혹미를 드러냈다.,드라마덕후니,모습에선 고혹미와 함께 걸크러시 매력까지 엿보이며 눈길을 사로잡는다. 원진아는 28일 방송되는 tvN 드라마 '날 녹여주오‘에서 고미란 역을 맡아 시청자를 찾는다.
178,날 녹여주오 드라마,2019.08.28.,오늘도 멋있다♡,ldyjcw0404님의블로...,University #tvN드라마 #tvN #마동찬 #madongchan #날녹여주오 #MeltingMeSoftly #池昌旭 #チチャンウク #jichangwook #지창욱 @meltingmesoftly_tvn @jichangwook
180,날 녹여주오 드라마,2019.09.18.,배우 윤세아가 필라테스에 빠졌다.,드라마덕후니,특히 다리 운동에 집중하며 남다른 운동신경을 자랑하고 있다. 나이를 잊은 명품 몸매의 비결이다. 한편 윤세아는 tvN 새 드라마 '날 녹여주오'에 출연 예정이다.
182,날 녹여주오 드라마,2019.09.27.,냉동인간 해동 로맨스 날 녹여주오 tvN주말드라마,시청아이폰수리,"아스달 연대기 후속으로 새로 시작하는 tvn주말드라마 날 녹여주오. 원진아, 지창욱 씨 출연의 드라마!! 너와 내가 가장 뜨거운 순간 33℃ ?? 36.5℃ 정상체온 아닌가요?..."
184,날 녹여주오 드라마,2019.09.15.,날 녹여주오 스마트밴드,이옥순 블러그,토일드라마 '날 녹여주오' 의 남주인공으로 캐스팅이 된 지창욱! 지창욱 팬이라면... 날 녹여주오 드라마 완전 기대 기대~ㅎㅎ 주문한 코아 스마트밴드 CKC V2가...
185,날 녹여주오 드라마,2019.09.20.,"TVN 토,일 드라마 / 아스달연대기 후속 / [날 녹여주오] 등장인물,인물관계도 소개",Shining Day,"[날 녹여주오] 등장인물 인물관계도 소개 ::지창욱, 원진아, 윤세아, 윤석화, 김원해... TV드라마 속 아들의 결혼을 반대하며 돈 봉투르 던지게 되는 날이 올줄이야..내..."
187,날 녹여주오 드라마,2019.09.27.,"날 녹여주오 몇부작, 관전포인트는?",푸르딩딩의 소소한 ...,"하셨는데요 '날 녹여주오' 본방을 보면, 드라마 설정이 왜 1999년도인지 알 수 있게 되겠죠? 두 사람이 20년 전 과거의 지인들을 만나게 되면서 본격적으로 이야기 전개가..."
188,날 녹여주오 드라마,2019.09.27.,날녹여주오 인물관계도/몇부작/지창욱 마동찬 선글라스,아이젠트리 안경원 ...,제가 너무너무 좋아하는 지창욱씨가 제대이후 드라마 '날 녹여주오'로 돌아왔습니다! 티저영상이 풀리면서 다시한번 지창욱씨의 멋진 얼굴을 감상할 수 있어서 너무...
189,날 녹여주오 드라마,2019.09.26.,날 녹여주오(Melting me softly)2019.9.28일첫방송 tvN 토일밤9시/지창욱/원진아,♡A Walk to Rememb...,"me/5KS8ykRh [티저] 냉동인간 지창욱 ＂난, 20년 만에 깨어났다＂ 날 녹여주오 | tvN 새 토일드라마 ＜날 녹여주오＞ ■편성: 9월 28일 [토]..."
190,날 녹여주오 드라마,2019.09.22.,"‘날 녹여주오’ 냉동인간 20년, 지창욱×원진아 부작용 사이에서 갈등 or 로맨스?",Fast blog.......,"20년, 지창욱×원진아 부작용 사이에서 갈등 or 로맨스? tvN 새 토일드라마 ‘날 녹여주오’(연출 신우철/극본 백미경/제작 스튜디오드래곤, 스토리 dailyfeed.kr"
191,날 녹여주오 드라마,2019.09.16.,날 녹여주오,춤추는 달의 언덕,"날 녹여주오 연출 신우철 출연 지창욱, 원진아, 최보민, 윤세아, 임원희, 김원해... 대한민국 드라마 역사상 가장 파격적이고 자극적인 스토리라인을 형성하게 된다...."
193,날 녹여주오 드라마,2019.09.21.,2019년 9월 현재 보는 드라마,너와 나 그리고 홀리...,"이번 달에 시작하는 드라마들은 웹툰, 소설을 원작으로 둔 작품들이 꽤 있다.... 날 녹여주오 (tvN) 지창욱, 원진아 주연작. 「그냥 사랑하는 사이」에서 신인배우지만..."
196,날 녹여주오 드라마,2019.09.25.,윤세아 나이 피부비결 따라해요!,늦은 글,[사진 출처: 날 녹여주오 공식 홈피] 그나저나 윤세아 씨 이번에 새 드라마 출연하시던데 ‘날 녹여 주오’ 라는 제목이예요. 예고 편 보니까 진짜 윤세아 나이에 비해...
197,날 녹여주오 드라마,2019.09.27.,드뎌..내일이다! 두근두근!,ldyjcw0404님의블로...,#9월28일 [토] 밤 9시 #첫방송 #tvN #새토일드라마 #날녹여주오 #지창욱 #원진아 #윤세아 출처 @tvndrama.official 인스타그램
198,날 녹여주오 드라마,2019.09.19.,[미디어주 이슈 분석] 눈이 즐거운 금토 (SBS/CJ ENM/제이콘텐트리/스튜디오드래곤),절제주식투자연구소,토일 라인업(09월 28일 방영)의 '날 녹여주오'다. 국내 최대 드라마 제작사 스튜디오드래곤이 핵심 작품 '사랑의 불시착' 이전에 넣는 야심작이다. 관심주 : SBS...
200,날 녹여주오 드라마,2019.09.18.,날 녹여주오 지창욱 스마트밴드 코아코리아 CKC V2 멋찜 :),###일상털기,소재의 드라마 스토리까지 완전체 날 녹여주오 드라마 완전 기대 기대~ㅎㅎ 드디어 이번 9월 28일 첫 방영 예정작인 날 녹여주오 티저 영상이 공개 되었는데요! 잘 생긴...
201,날 녹여주오 드라마,2019.09.13.,황병심 역을...? `날 녹여주오` - 오늘경제,오늘경제,오늘경제 - 2019-09-13 09:47 tvN 새 토일드라마 ‘날 녹여주오’는 24시간 냉동 인간 프로젝트에 참여한 남녀가 미스터리한 음모로 인해 20년 후 깨어나면서 맞이하는...
202,날 녹여주오 드라마,2019.09.27.,날 녹여주오 줄거리 기획의도 등장인물 인물관계도 몇부작 하이라이트,쥬방스의 요모조모,#아스달연대기후속 #tvN주말드라마 #날녹여주오 가 내일부터 방송됩니다. 날 녹여주오 줄거리 24시간 냉동 인간 프로젝트에 참여한 남녀가 미스터리한 음모로 인해...
203,날 녹여주오 드라마,2019.09.20.,"""날 녹여주오"" 지창욱, 군 제대 후 첫 작품 제작발표회에서 포착",CE'AMJHSI,배우 지창욱이 20일 강남구 임피리얼 팰리스 서울 호텔에서 열린 tvN 드라마 '날 녹여주오' 제작발표회에서 포즈를 취하고 있다.
205,날 녹여주오 드라마,2019.09.21.,"날 녹여주오, 원진아의 비하인드 컷을… - 업코리아",모아뉴스,"업코리아 - 2019-09-21 09:06 tvN 새 토일드라마 ‘날 녹여주오’(극본 백미경, 연출 신우철, 제작 스튜디오드래곤, 스토리피닉스)는 냉동 인간 프로젝트에 참여한..."
206,날 녹여주오 드라마,2019.09.13.,노력은 여기서~? ˝날 녹여주오˝ - 오늘경제,오늘경제,"오늘경제 - 2019-09-12 09:32 tvN 새 토일드라마 ‘날 녹여주오’(극본 백미경/연출 신우철/제작 스튜디오드래곤, 스토리피닉스)는 24시간 냉동 인간 프로젝트에 참여한..."
207,날 녹여주오 드라마,2019.09.21.,"날 녹여주오, 원진아의 비하인드 컷을…? - 한국스포츠통신",yyh888888님의블로그,"한국스포츠통신 - 2019-09-21 05:50 (한국스포츠통신=신택교 기자) tvN 새 토일드라마 ‘날 녹여주오’(극본 백미경, 연출 신우철, 제작 스튜디오드래곤, 스토리피닉스)..."
208,날 녹여주오 드라마,2019.09.19.,미란에게는 그저 마른하늘에… ˝날 녹여주오˝ - 오늘경제,모아뉴스,"오늘경제 - 2019-09-19 08:07 28일 밤 9시 첫 방송된tvN 새 토일드라마 ‘날 녹여주오’(극본 백미경/연출 신우철/제작 스튜디오드래곤, 스토리피닉스)는 냉동 인간..."
209,날 녹여주오 드라마,2019.09.16.,마동찬은 20년 만의 기획…? 날 녹여주오 - 제주교통복지신문,yyh888888님의블로그,제주교통복지신문 - 2019-09-16 14:23 12일 tvN 새 토일드라마 ‘날 녹여주오’ 제작진은 20년 만에 해동된 마동찬(지창욱 분)과 고미란(원진아 분)의 모습을...
212,날 녹여주오 드라마,2019.09.13.,먼저 다재다능한 배우 이홍기는~? `날 녹여주오` - 경기도민일보,yyh888888님의블로그,경기도민일보 - 2019-09-13 09:39 28일 첫 방송되는 tvN 새 토일드라마 ‘날 녹여주오’는 24시간 냉동 인간 프로젝트에 참여한 남녀가 미스터리한 음모로 인해 20년...
214,날 녹여주오 드라마,2019.09.20.,“날 녹여주오” 잃어버린 내 인생 책임지라구라며 신세를...,충청매일,tvN 제공 [충청매일=온라인뉴스팀02] 28일 첫 방송되는 tvN 새 토일드라마 ‘날 녹여주오’는 냉동 인간 프로젝트에 참여한 남녀가 미스터리한 음모로 인해 20년 후...
215,날 녹여주오 드라마,2019.09.14.,먼저 다재다능한 배우 이홍기는 예능국 스타 PD? `날 녹여주오` - 오늘경제,오늘경제,오늘경제 - 2019-09-14 15:40 tvN 새 토일드라마 ‘날 녹여주오’는 24시간 냉동 인간 프로젝트에 참여한 남녀가 미스터리한 음모로 인해 20년 후 깨어나면서 맞이하는...
221,날 녹여주오 드라마,2019.09.20.,"[이코노미톡뉴스] '날 녹여주오' 원진아, 생계위해 콜센터-보험회사까지...'드라마 여주같은 그녀의 일화' - 소쿠리뉴스",뉴스보아요,이코노미톡뉴스 - 2019-09-20 17:08 [강성일 기자 @ 이코노미톡뉴스]배우 원진아가 대학교도 포기하는 등 배우가 되기까지 갖가지 일을 한 바 있어 화제가 되고 있다....
222,날 녹여주오 드라마,2019.09.19.,수트가 잘 어울리는 드라마 배우 모음 특집 소개 - 씨(SI),ㅇㅅㅇ,수트가 정말 잘 어울리는 드라마 배우 모음 특집 아이템을 소개시켜드리려구... 윤세아님은 날 녹여주오 진행준비중이시구 임지연님은 웰컴2라이프에서...
223,날 녹여주오 드라마,2019.09.25.,"‘삼시세끼 산촌편’ 윤세아, 20대 남주혁과 나이차 안 나는 ‘동안 미모’…“너무 웃긴 이 친구”",세상사는이야기,"최근 그는 인기에 힘입어 연달아 작품 출연을 알린 가운데 tvN ‘날 녹여주오’가 28일 첫 방송을 앞두고 있다. 이 드라마에는 윤세아를 비롯해 지창욱, 원진아, 윤석화..."
224,날 녹여주오 드라마,2019.09.18.,"윤세아, 일상 속 우아한 자태...""오시려나 마시려나"" 눈길 - 제주교통복지신문",뉴스페이지,"제주교통복지신문 - 2019-09-18 09:20 윤세아가 tvN 새 드라마 \'날 녹여주오\' 촬영 현장 사진을 내놓았다. 윤세아는 9월 14일 자신의 인스타그램에 ""오시려나..."
225,날 녹여주오 드라마,2019.09.23.,이무생 손석구 현실 절친,CE'AMJHSI,"손석구와 이무생은 현재 tvN 월화드라마 ‘60일, 지정생존자’에 출연하고 있다. 한편 손석구는 '멜로가 체질'에 출연중이며 이무생은 '날 녹여주오'에 출연한다."
226,날 녹여주오 드라마,2019.09.20.,‘윤세아’ 대본을 놓지 않는멋진배우라는 글과 함께 사진을 업로드했다 - 업코리아,뉴스페이지,"멋진배우""라는 글과 함께 사진을 업로드했다. 공개된 사진 속에는 tvN 새 토일드라마 \'날 녹여주오\' 촬영 현장... 출처 : 업코리아 업코리아에서 더보기"
