,drama_title,date,blog_title,writer,contents
97,보이스 시즌3 드라마,2019.05.06.,대진제국1 1~2회를 보고,진실은 저 멀리에,이번 주부터 보이스3이 시작하긴 합니다만 몇주간 제가 보는 드라마가 딱... 바로 시즌 1의 1~2회 리뷰 올려보겠습니다! 전국시대. 戰國이라는 말 자체가 상징하듯 분열된...
98,보이스 시즌3 드라마,2019.05.09.,도코피셜 - 타나카 케이 (田中圭),도라마코리아,제니게바 보이스~생명 없는 자의 목소리~ 경관의 피 핸섬★수트 THE TV... 파트너 시즌17 요미우리TV 개국55주년 기념드라마 신의 베레모 ~테즈카 오사무의 블랙...
99,보이스 시즌3 드라마,2019.05.08.,"[이슈종합] ‘세븐♥’ 이다해, 근황 공개→ 성형설→ 소속사 해명…“수술 NO”",톱스타뉴스 공식 블로그 (T...,"지난해에는 SBS 드라마 ‘착한마녀전’을 통해 이다해 특유의 사랑스러운 매력을... 관객’ ‘보이스 시즌3’ 손은서, 비오는 날 막걸리+두부김치…“추적추적”..."
100,보이스 시즌3 드라마,2019.04.10.,채널J 19.4.8(월) 후쿠오카 연애백서 시즌 13 너의 세계의 건너,ㄱ,보이스 기능을 쓰는 세대. 대화를 나누는 편리한 방법이 있지만 리츠와... com 드라마 공식사이트 http://www.kbc.co.jp/tv/renai2018/ 시즌 13 봤으니 다음주 월요일에는 시즌...
103,보이스 시즌3 드라마,2019.05.07.,구해줘2 등장인물 인물관계도 엄태구 천호진 이솜,별하's 감성드라마&...,"내일도 새로운 드라마가 시작합니다. 바로 엄태구, 천호진, 이솜 주연의 #구해줘2... 개인적으로 전 시즌제를 한다면 신의 퀴즈나 막영애, 보이스처럼 주요 등장인물은..."
104,보이스 시즌3 드라마,2019.04.10.,[월간 걸그룹 제27호(2019.03)] 어둠속의 한 줄기 빛,던질 공이 네 인생 ...,"허스키 보이스가 고혹적인 매력을 드리운다. 특히, '김경범' 의 피아노... 노래"" 3.09. 공개한 드라마 ""막돼먹은 영애씨 시즌 17"" 의 OST로 Mnet 서바이벌..."
105,보이스 시즌3 드라마,2019.05.07.,부모 후광을 느끼게 하지 않는 2세 연예인 랭킹,데빌소울,허스키 보이스로 쇼와의 가희( 가수를 우와하게 부르는말) 로 뽑힌다 우타다는... 넥스트시즌'으로 첫 연속드라마 주연을 맡았다 스기사키 하나의 경우에는 대부분...
106,보이스 시즌3 드라마,2019.05.06.,박우진 출연 SBS ‘정글의법칙 in 로스트정글’ 5월 10일 기자간담회 (제작발표회),와따라야,"idxno=678694 [NI주간현장] 미리 보는 연예계, ‘악인전’ 언론시사회·‘보이스3’ 제작발표회·인피니트 남우현 쇼케이스 등 - 뉴스인사이드 새 앨범, 새 드라마..."
107,보이스 시즌3 드라마,2019.05.01.,20190429,봉구네 일기장,열혈사제 시즌2도 나온다고 하니 살짝 기대되는 부분(전편이 흥해야 후편제작도... 이제 곧 보이스3랑 구해줘2도 방영예정이니까 볼 드라마가 핵많기때문이쥐-!!...
108,보이스 시즌3 드라마,2019.05.03.,미디어 3.0 권력 이동의 시작 - 메리츠 이효진 연구원님,인생은 도전!! 열정...,"진행 3. 드라마 춘추전국시대 - 어떤 드라마가 성공할지 예측 어려운 상황... 내 드라마 제작사들을 레이블 형식으로 운영 계획 - '18년<밥누나>, <보이스2> 제작, '19년..."
109,보이스 시즌3 드라마,2019.05.08.,"열혈사제 39, 40회 한글자막 (열혈사제 마지막회)",- 탐로그 - 한국드라...,com/tami_0111/221532612483 보이스3 VS 구해줘2 - 탐로그 - 한국드라마 한글자막... 재수정은 싫어요. 열혈사제 넘나 재미진 것 시즌2 빨리 나오면 좋겠다....
110,보이스 시즌3 드라마,2019.05.09.,구해줘2 줄거리 및 캐릭터 소개,BOB,"수,목 드라마 5.8~ 5월에는 보이스3에 이어서 구해줘2까지 나와버리네요. 두편 다 너무 재밌게 본거라 너무나 행복하네요. 구해줘 시즌1에서는 우도환이라는 매력적인..."
111,보이스 시즌3 드라마,2019.05.01.,"엑소 시우민, 9일 솔로곡 ‘이유’ 발표… SM스테이션 참여",Gimseongho's salon,"웹드라마 ‘도전에 반하다’ OST ‘You Are The One’(유 아 더 원) 이후 오랜만에... 있는 보이스와 퍼포먼스로 글로벌한 인기를 얻고 있으며, 가수뿐만 아니라 연기..."
112,보이스 시즌3 드라마,2019.05.07.,작성 예정 글 목록 - (2019.12.01),금목서 대도서실,STAGE 3) 드라마 CD (애니메이션 Ver.) - 리뷰 - (반프레스토 - 이치방쿠지 프리미엄... 나노리치 보이스 컬렉션) 키리토 (SAO) - (맥스 팩토리 - 피그마) 키리토 (SAO...
114,보이스 시즌3 드라마,2019.04.10.,중국 예능 프로그램 《我是唱作人》 프로그램 및 출연진 소개,깊은 산 속 옹달샘,"대표곡으로는 《小星星》，《一笑?城》，《年?》 등이 있고, 대부분 드라마의... 중국판 <보이스 오브 차이나> 시즌1에 출연해 왕중왕전에서 우승을 차지했고..."
118,보이스 시즌3 드라마,2019.05.07.,보도자료; 배심원들 Juror 8 (2019),클린트 이스트우드 ...,"드라마 [힘쎈여자 도봉순], [슈츠] 등을 통해 연기력과 매력을 인정받은 박형식은... 또한 다양한 장르의 드라마와 영화에서 탄탄한 연기력을 선보여온 서정연이 주부..."
120,보이스 시즌3 드라마,2019.05.03.,"전주 / April, 2019",yoong archive,"참솜 공연일정 찾아보니 마침 업무도 한가한 시즌이고 무엇보다 1열!!이 남아 있어서 바로 예매했다. 티켓팅하고 숙소 예약까지 일사천리. 꿀보이스,, 최고 공연은 사진..."
121,보이스 시즌3 드라마,2019.04.28.,넷플릭스 추천 <러시아 인형처럼>,오늘의 이야기-,나도 이렇게 능력있는 프로그래머로 살고싶다..ㅎ 언니 멋있어요 허스키 보이스에... 풀어낸 드라마라는 점에서 평점 ; ★★★★☆ (4.0) 시즌2!!! 나와주세요!!!!! 아...
122,보이스 시즌3 드라마,2019.04.26.,"펀치 섭외, 곧 다가올 대학교 축제 여자 가수 1위! 가수 섭외!",연예인 섭외의 모든...,가수 '펀치'는 OST의 요정이라고 불리울 만큼 많은 드라마OST에 참여를하고... 펀치만의 맑고 매끄러우면서도 때론 파워풀한 보이스가 매력적인 펀치는 다채로운...
123,보이스 시즌3 드라마,2019.05.03.,[DAILY13],One Of Things,"드라마마다 챙겨봤던 OCN채널 그 중에서도 내가 재밌게봤던 보이스랑 구해줘가 다시 나온다니요 ? 시험이라는 무게에 대한 보상인가요,,? 라이프온마스도 제발 시즌2...."
125,보이스 시즌3 드라마,2019.05.01.,프로듀스 X 101 기대주 ★ 내 초픽은 백진 / 김국헌 / 유리 / 박선호,Nica fin.,보이스가 내가 좋아하는 보이스다. 영상에서 나온 사람 중 김국헌 목소리가 제일... 라는 드라마에서 데프콘과 잔망 케미를 보여줬던 캐릭터로 엄청 각인되어 있는데...
129,보이스 시즌3 드라마,2019.05.10.,구해줘2 1회 줄거리,뷰스타 초코민트 일...,구해줘 드라마도 재미있게 잘 봤는데!! 이번에 2편이 나왔네요 히히 너무... 마을사람들이 보이스피싱을 당했나봐요 ㅠ 이일도 바로 해결해주는데요 이장님은 최교수님께...
132,보이스 시즌3 드라마,2019.05.08.,[미드] 마인드헌터 (시즌1),큰 뜻 품은 잉어의 ...,"오타와 비문이 너무 많은데, 드라마 보면서 정신없이 정리하고 따로 퇴고할 시간까지는 가지지 못해 그런 것이니 양해바람. 1회 스토리라인 이십대 후반의 홀든 FBI..."
135,보이스 시즌3 드라마,2019.04.10.,"허규, 신동미와 '동상이몽2' 합류에 관심↑..그는 누구?",까미와 짱이는 사랑...,"이후에는 각종 드라마 OST 및 솔로 앨범을 발표했다. 허규는 '마마 돈 크라이... Mnet '보이스 코리아 시즌1'에 등장하기도 했다. 한편 허규, 신동미는 지난 2014년 12월..."
136,보이스 시즌3 드라마,2019.05.05.,JTBC/슈퍼밴드/프로듀서 오디션,커피와소통하는...여...,하현상의 보이스♬ 특유의 감미로운 기타 선율을 담아 하현상이 부르는... 슈퍼스타K 시즌 7의 우승자! 싱어송라이터 '케빈 오' 드라마 OST도 발매했고...
137,보이스 시즌3 드라마,2019.05.09.,[시작] 미국으로 가는 첫 걸음 - 무식해서 용감했다,<뉴요커> 토작가의 ...,"미디어, 드라마 촬영 등에 차량을 제공하는 아주 특별하고 재밌었던 아르바이트를... 지금이야 보이스톡, 페이스톡들이 있지만 당시는 국제전화 초당/분당 얼마 등으로..."
138,보이스 시즌3 드라마,2019.04.10.,나의 영화관람 2017년 4월,배철식의 LIFE,"15 3 다운(USB) Mr. 후 아 유 (Death At A Funeral, 2007) [미스터 후아유, 데스 앳 어... 20 3 다운(USB) 가족의 재구성 (2017) [가족의 재구性] 각자 아이들을 데리고 재혼한..."
143,보이스 시즌3 드라마,2019.05.06.,밴드 MC THE MAX (엠씨 더 맥스)의 음반 소개,멍멍이의 잡학다식 ...,"14) 타이틀곡 'Delete' 유튜브 영상 최고 조회수 약 3.1만뷰 (더블 타이틀곡 '귀천... 보이스에 호소력 있는 가창력으로, 타이틀곡 '미련한 가슴아'에서도 드라마와..."
144,보이스 시즌3 드라마,2019.05.01.,크론병치료 증상과 체질에 맞게 받아보세요,since1902 변한의원...,그냥 전 손자라고 그래도 친구 사람이 있네요 하고 자동차 알면 소개 보이스피싱... 나서 예쁜 전화해서 다시 드라마에 그 알이라는게 사오라고 해야징 해서 품질이 게...
146,보이스 시즌3 드라마,2019.04.29.,"2019 4,28/일요일/종합뉴스(줌)/IT,국제,경제,사회,정치,스포츠,연예",순수를 되살리고 싶...,28일 중부 news.zum.com http://news.zum.com/articles/52138243 보이스피싱 조직... 건 시즌 초반 라이벌 대결에서 한승규의 극장골을 앞세워 짜릿한 안방 승리를...
147,보이스 시즌3 드라마,2019.05.02.,캐나다 서부와 동부 여행과  단풍열차 패키지일정 12일 (with 한진관광),한진관광 강남구청점...,"중식 후 퀘벡으로 이동 ▣ 유네스코 세계문화유산이자, 드라마 '도깨비'의 주... 개인 계좌로 입금은 일체 없으며, 여행사 직원을 사칭한 보이스피싱 등 피해가..."
149,보이스 시즌3 드라마,2019.04.29.,내일은 미스트롯(나무위키),Добро пожа...,</noscript>제작사장르트로트 서바이벌제작진기획서혜진[3]연출문경태[4]... 부르면서 드라마틱한 감정표현으로 인해서 조영수의 극찬을 받았다. 결국은...
151,보이스 시즌3 드라마,2019.05.04.,가수 IU (아이유)의 음반 소개,멍멍이의 잡학다식 ...,천부적인 라이브 실력과 풍부한 감성이 묻어나는 서구적 보이스는 어린 나이에선... 390만뷰) 드라마 OST [2009 외인구단] (09.06.02) 수록곡 '그러는 그대는' 앨범소개...
154,보이스 시즌3 드라마,2019.05.03.,[짹짹] 5월모음? #조선방씨(장자연)- 김학의- 버닝썬 사건.. “현재진행형” #유착 중심.. “남 흙 묻히면 님 묻은 ZZ 사라지나요?” feat. #나사팸- YG- 최순실 님,?ism(빈풍),경찰이 이들에게서 압수한 마약은 3.6㎏이다. 12만 명이 동시에 투약할 수... #영화 #드라마 에도 등장하구요. 이게 #흑마술사 들의 #비극 중 하나죠....
156,보이스 시즌3 드라마,2019.05.06.,안예은 상사화 페미니스트 유 가사 봄이온다면,포이포이,s보이스에서 요즘 핫한 방송이죠? 미스트롯의 안예은 상사화를 커버해... 3. 21. 업로더 이선옥향기나는 풀♡ 드라마 역적은 폭력의 시대를 살아낸 인간 홍길동의...
158,보이스 시즌3 드라마,2019.04.30.,명곡 제조기 가수 먼데이키즈 섭외 문의 결혼식축가 가수섭외,연예의 모든것,지난 겨울에는 <겨울이라 이런거면 좋겠다>라는 곡을 발표하며 또 하나의 시즌송을... 인기 드라마 <왜그래 풍상씨>의 OST 주자로도 나서며 명품 보이스를 들려주기도...
161,보이스 시즌3 드라마,2019.04.10.,시트로엥보험료 여기가 베스트죠,suan12564님의블로그,되네요명품보이스 되네요당신도 두곡만 20170913 개봉한기묘한 전가수 쾌적한... 웹드라마 혜자김혜자 자신Little 올라오는무섭게 붙어》 김고은 드디어 배달도...
163,보이스 시즌3 드라마,2019.05.10.,로또많이나온번호 추천받은곳입니다,awos8xudjss님의블로...,그전에는 한달에 3~4명이 나올까 말까 하던 것이 지금은 50명이 넘을 정도로 당첨자를 배출해 내는것에 의심을 품기 시작을 하였답니다. 친구들의 말로는 2천원에서...
164,보이스 시즌3 드라마,2019.04.30.,"걸그룹 시크릿 출신 배우 한선화 OCN 새 수목드라마 구해줘2 제작발표회 참석 달라진 얼굴 분위기 화제, 한선화 제작발표회 직후 자신의 SNS에 부은 오늘 해명 네티즌 반응 성형 의심",stargram,검색어 보이스 3 구해줘 1 구해줘 2 인물관계도 촬영장소 타인은 지옥이다 구해줘 홈즈 서예지 엄태구 빙의 우도환 킬잇 드라마 구해줘 시즌2 구해줘 2 등장인물...
165,보이스 시즌3 드라마,2019.05.10.,5월 11일 토요일 케이블 영화채널 편성표 OCN 슈퍼액션 채널CGV 스크린 캐치온,오늘도 영화로운 블...,아이언맨 3 15 HD 영화 12:00 아이언맨 3 15 HD 영화 13:40 퍼스트 어벤져 12 HD... 자 드라마 02:00 <재> 보이스 시즌2 (4회) 15 HD 자 드라마 03:30 <재> 보이스...
166,보이스 시즌3 드라마,2019.05.09.,"챔피언스리그 4강 2차전 토트넘 아약스에 3-2 역전승 하이라이트, 모우라 해트트릭 원정 다득점 토트넘 사상 첫 챔스 결승 진출 리버풀과 맞대결, 손흥민 풀타임 평점 7.9점, 포체티노 감독 눈물",stargram,올드 보이스' 입단 경력 2014 토트넘 홋스퍼 FC 감독 외 11건 사이트 공식사이트... 19시즌 유럽축구연맹(UEFA) 챔피언스리그 4강 2차전 원정 경기에서 아약스에 3-2...
168,보이스 시즌3 드라마,2019.05.09.,"챔피언스리그 토트넘 리버풀 EPL 팀간 11년만의 UCL 결승전, 토트넘 손흥민 결승 무대 첫 우승 도전, 포체티노 감독 모두가 영웅 루카스 모우라 토트넘 아약스전 해트트릭 기적",stargram,올드 보이스' 입단 경력 2014 토트넘 홋스퍼 FC 감독 외 11건 사이트 공식사이트... 2018-19시즌 유럽축구연맹(UEFA) 챔피언스리그 4강 2차전에서 아약스를 3-2로 이겼다....
169,보이스 시즌3 드라마,2019.04.27.,"불후의명곡 400회 글로벌 특집 일본이 사랑하는 한국가요, 거미 조용필 돌아와요 부산항에, 알리 박효신 눈의 꽃, 정동하 류 처음부터 지금까지, 김재환 신승훈 I Believ, NCT DREAM 보아 No.1",stargram,"명품 보이스로 사로잡은 스테이지! 일본 열도를 흔든 드라마 <겨울연가>의 OST를... 청하는 시즌1 최종 데뷔조 아이오아이(I.O.I)의 메인댄서, 김재환은 시즌2 최종..."
170,보이스 시즌3 드라마,2019.05.04.,천안 다이어트 하나로 끝낸 후기 공유할게요!,도라에몽의 블로그,다이어트 보조제 먹는게 좋은지 먹는다면 뭐 먹어야 하는지 3.튼살 팔뚝 처리하기!... 탭이 보이스톡 넥드 다 여명이개월내로 입 왜냐하면 컷와 있어를 조금 곳은 웃신청...
