,drama_title,date,blog_title,writer,contents
0,보이스 시즌3 드라마,2019.05.10.,[보이스 시즌3 시청하기 전 시즌2 줄거리 요점 정리 보고가],오피스룩 + 패션 ::...,"시즌제를 도입한 국내 드라마 중 매 시즌마다 큰 이슈와 사랑을 받는 듯한 보. 이. 스 시즌 1, 시즌 2 애청자였던 1인으로써 이번 주부터 시작되는 보이스 시즌 3 소식이..."
1,보이스 시즌3 드라마,2019.05.10.,[OCN 드라마] 놓치지 말아야 할 '보이스 시즌3' 인물관계도 / 줄거리,슈슈 블로그,"이렇게 드라마를 시즌제로 만들어 준다는 겁니다. 신의 퀴즈를 시작으로... 이 포스팅만 보신다면 시즌 3 본방사수 문제없어요~! 보이스3 소개 3분 출동, 5분 제압..."
2,보이스 시즌3 드라마,2019.05.10.,[보이스3] 시즌3 인물관계도 등장인물 이하나 이진욱 권율 OCN 토일드라마 보이스 시즌3 몇부작? 제작발표회 패션,정연아 이미지테크,같네요~ 드라마 보이스 시즌3 제작발표회 어제(9일) 오후 서울 영등포구 CGV여의도점에서는 OCN 새 토일드라마 '보이스3'제작발표회가 진행되었네요. 이 행사에는 배우...
4,보이스 시즌3 드라마,2019.05.10.,드라마 보이스 시즌 3 등장인물 관계도,날개야 돋아라,OCN 토 일 드라마 보이스 시즌 3 깨어난 어둠. 골든 타임은 끝나지 않았다! 5월 11일 토요일 밤 10시 20분 주말 드라마 보이스 3 첫 방송 역대급 충격적인 결말로 끝나버린...
5,보이스 시즌3 드라마,2019.05.10.,보이스3 ( 시즌3 ) 등장인물 인물관계도 : 이하나 이진욱 권율,별하's 감성드라마&...,지난번 충격엔딩으로 끝이 났던 드라마 보이스가 시즌3로 돌아옵니다. 지난 시즌2 엔딩에서 강권주 생사도 모른채 끝이나서 보이스3는 생각도 못하고 있었거든요....
6,보이스 시즌3 드라마,2019.05.03.,방영예정드라마[보이스 시즌3] 드디어 5월11일이면 다시 시작되는 보이스시즌3!! 내용줄거리와 등장인물소개!!,쑤코치의 일상스토리...,방영예정드라마 보이스!!! 기대됩니당 강권주센터장의 청력능력은 사라진것인가.. 궁금한데요ㅎㅎㅎ 얼른 시작했으면 좋겠네용 [1화 예고] 시즌 3! 다시 돌아온...
8,보이스 시즌3 드라마,2019.05.10.,장르드라마추천 한국형 시즌제 드라마 OCN보이스 시즌3,시원한대출상담사 이...,보통 장르드라마들이 시즌제로 운영이 되기때문에 장르드라마를 좋아하는 저는 정말 기쁩니다 ㅎㅎ 내일이죠? 보이스3가 시작하는 날이. 보이스는 여주인공인...
9,보이스 시즌3 드라마,2019.05.06.,드라마 보이스 시즌 3 인물관계도 줄거리 총정리,"헬로우드림 ""개묘"" ...",안녕하세요 안녕하세요 :) 오늘은 ocn드라마 보이스 시즌 3 인물관계도 와 줄거리를 쭈욱 알아보려 합니다 ! 위에 사진에 바로 보이시죠?! 바로 다음주 5월 11일 드디어...
10,보이스 시즌3 드라마,2019.05.09.,새드라마 보이스 시즌3 다음 주 부터 시작하네요 :P,빈둥이의 하루,새드라마 보이스 시즌3 다음 주 부터 시작하네요 :P 출처 : OCN 보이스3 홈페이지 범죄 현장의 골든타임을 사수하는 112 신고센터 대원들의 치열한 기록을 그린...
11,보이스 시즌3 드라마,2019.05.10.,볼만한 드라마 추천!! 보이스 시즌3 시작!,블스의 데일리 맛집...,"보여주는 드라마입니다보이스 1이 2017년에 처음 나와 케이블 방송에서최고... 형사입니다 시즌 2,3 의 악역 방제수시즌 2에서 파브르라는 홈페이지를..."
12,보이스 시즌3 드라마,2019.05.03.,[OCN 드라마] 보이스 시즌3 드라마소개 / 등장인물관계도,쵸이츄의 생각하는 ...,"5/11 방영 예정 < #보이스시즌3 >를 기다리며, #드라마소개 및 #등장인물관계도 를 소개해보겠습니다. 보이스3 공식홈페이지 OCN 놓치지 말아야 할 소리 보이스 3 2019년5월..."
14,보이스 시즌3 드라마,2019.05.10.,보이스 시즌3 권율 이하나 이진욱,찌아의 건강한 이야...,"놓치지 말아야 할 소리 <보이스 3> 보이스 시즌 3 등장인물~~!! 생명을 구하는 보이스... 스릴러 드라마~ OCN 드라마 보이스 시즌3는 5월 11일 (토, 일) 오후 10시 20분에 첫..."
15,보이스 시즌3 드라마,2019.04.26.,[보이스시즌3/OCN드라마]보이스 시즌3,월이맘 짱아네 블로...,봐지는 드라마ㅠ #5월11일 #토일오후10시20분 에 첫방송 한다니깐 기대된다 ㅎㅎㅎㅎ 또 얼마나 소름돋을지ㅠㅠㅠㅠ 저번에 #보이스시즌2 에 나왔던 등장인물 그대로...
16,보이스 시즌3 드라마,2019.04.10.,드라마 보이스 시즌3 하루빨리 보고 싶네요 ^^,아름다운 프레쉬성형...,"드라마 보이스 시즌3 하루빨리 보고 싶네요 ^^ 5월에 많은 분들이 기다렸던... 드라마 보이스 시즌3가 방송을 하는데요! 시즌1, 시즌2를 보신 분들은 보이스 시즌3가..."
17,보이스 시즌3 드라마,2019.05.08.,"기다렸던 보이스가 시즌3로 돌아왔다! 보이스3를 미리 만나봐요~/보이스,보이스3,보이스3줄거리,보이스3인물관계도,보이스3미리보기",쇼핑을 즐기는 사람...,프로그램 설명만 봐도 엄청 커진 스케일과 드라마의 깊이감이 기대가 되네요! 이번 보이스3에서 강권주 역할을 맡은 이하나씨는 인물 소개에서 시즌 2 마지막 회...
18,보이스 시즌3 드라마,2019.05.10.,"[OCN 보이스 시즌3]   2019.05.11. ~ 방영예정 (토, 일) 오후 10:20",응츄의 하루 ?'?'...,꺄아앙아앙ㅇㅇㅇㅇㅇ 보이스 시즌2 이후로 드라마 안봤는데 다시... 스릴러 드라마 예고 http://tvn.tving.com/tvn/VOD/View/CLIP/CA_242397 [1화 예고] 시즌 3! 다시...
19,보이스 시즌3 드라마,2019.05.05.,"[보이스 시즌3] 보이스2 이전 스토리, ‘요약의 끝판왕’이로세!",히드라,어쨌든 그 덕분에 보이스 시즌2의 여운을 임팩트있게 느껴본다. OCN 드라마 보이스2 ‘혐오의 시대’ 1화부터 12화까지 줄거리를 정리해드립니다. 보이스3 보기전에 알면...
20,보이스 시즌3 드라마,2019.05.09.,5월 11일 토요일 오후 10시 20분 첫방송 OCN 『 보이스 시즌3 』,수의 콘텐츠 제작소,"오늘 소개할 드라마는! 바로 '보이스 시즌3' 입니다! 시즌1, 시즌2에 이어서 벌써... 골든타임팀 콜팀 출동팀 보이스 3 : 네이버TV 범죄 현장의 골든타임을 사수하는 112..."
21,보이스 시즌3 드라마,2019.05.07.,보이스 시즌3 - 골든타임은 끝나지 않았다 !,지혜로운 연서맘 ♡...,#보이스 #드라마보이스 #보이스시즌1 #보이스시즌2 까지 엄청 재미있게 봤었는데요 보이스시즌2 엄청 떡밥을 남기고 마무리되어 #보이스3 기다리고 있었는데 이번주에...
24,보이스 시즌3 드라마,2019.05.10.,보이스 시즌3 몇부작 인물관계도 간단정보 알아보기,제너드의 소소한 일...,"지난 2017년 시즌1을 시작한 이래, 꾸준한 인기를 끌어온 OCN드라마 보이스가 5월 11일부터 시즌3를 시작한다고 합니다. 토요일과 일요일 오후 10시 20분에 방영하는..."
25,보이스 시즌3 드라마,2019.05.08.,[일상드라마] 보이스시즌1,즐거운 일상 이야기...,이상 일상드라마 보이스시즌1 내맘대로 간단리뷰 입니다. 2019년 5월11일자로 보이스 시즌3가 예정되어 있는데요 강권주 센터장이 돌아오길 기다리며 보이스 리뷰를...
26,보이스 시즌3 드라마,2019.05.08.,"[OCN 드라마] 보이스3 등장인물소개 + 인물관계도 (이하나, 이진욱, 권율, 손은서 주연)",쭈니맘의 알콩달콩 ...,"이번주부터 보이스3가 다시 시작한다고 해요. 요즘 시즌제 드라마가 종종 보이는데 이렇게 시즌3까지 나오는 드라마가 있던가요! 워낙에 시즌1, 2도 잼있게..."
27,보이스 시즌3 드라마,2019.05.08.,보이스 시즌3 등장인물관계도:이하나 이진욱 권율:스케일 커진듯?!,방황하는 행성,보이스 시즌3 등장인물관계도 오시엔의 드라마들은 등장인물관계도가 심플합니다. 적대가 딱 심플하게 나오는군요. 보이스 시즌3 인물소개 생명을 구하는 보이스...
30,보이스 시즌3 드라마,2019.05.07.,"[보이스 시즌3] 혁명, 혁명, 그리고 혁명!",히드라,보이스 시즌3를 만들어 가는 동안 최대한 집중과 인내 그리고 협력을 다하려는... OCN 토일드라마 ‘보이스3’가 11일 첫 방송을 손꼽아 기다리는 시청자들을 위 naver.me
31,보이스 시즌3 드라마,2019.05.07.,보이스 시즌3!,유리 칠판/게시판 전...,OCN 드라마죠? 벌써 시즌3를 방영하는 시기가 돌아왔는데요~?~?~ 휴그린에서는 시즌2에 이어 보이스 시즌3까지 협찬에 들어갔습니다 :3 시즌3의 첫 화가 끝난 후 어떤...
32,보이스 시즌3 드라마,2019.04.30.,2019 5월 신규 드라마 어비스 구해줘2 보이스3등 무려 10개씩이나!,황금돼지의 드라마통...,com/yijieeun1104/221519666373 OCN 주말드라마 킬잇 후속 보이스3 등장인물관계도 내용 사메타 이진욱 이하나 권율 닥터 파브르 드라마통 황금돼지랍니다보이스시즌3가...
33,보이스 시즌3 드라마,2019.05.09.,"[HD영상] ‘보이스3’ 손은서, ‘척 하면 척’…시즌3 이어온 가족같은 현장(190509)",톱스타뉴스 공식 블로그 (T...,"그린 드라마로 지난 2018년 방영된 ‘보이스2’의 후속 시리즈 작품이다. 5월 11일... (보이스3) ‘보이스 시즌3’ 손은서, 비오는 날 막걸리+두부김치…“추적추적”..."
34,보이스 시즌3 드라마,2019.04.30.,OCN드라마 보이스3 (내용줄거리/등장인물/인물관계도/예고편),기특한블로그,"드라마추천 #드라마보이스3추천 #보이스시즌3 구해줘2 https://news-pick.com/1632905/155661256678 ""시즌2도 될지어다""…'구해줘2', 엄태구X천호진 품은 장르물..."
35,보이스 시즌3 드라마,2019.05.06.,보이스 시즌3(2019년 5월 11일 첫 방송),영드 세상(영화+드라...,줄거리:범죄 현장의 골든타임을 사수하는 112 신고센터 대원들의 치열한 기록을 그린 소리추격 스릴러 드라마 이진욱 이하나
37,보이스 시즌3 드라마,2019.05.09.,[일상드라마]보이스시즌2,즐거운 일상 이야기...,보이스시즌2 입니다. 보이스시즌2 에 인물관계도입니다. 위에 보시는 인물관계도는 단적인것이고 사실 저안에는 여러가지관계가 얽혀있습니다. 보이스시즌2 에...
38,보이스 시즌3 드라마,2019.05.05.,추천드라마 보이스,항상 긍정적인 마음...,"보이스 OCN에서 방영을 하였던 범죄,액션,스릴러 드라마인 보이스에요. 현재 시즌2까지 완료가 되고 2019년 5월11일에 보이스 시즌3을 한다는 소식이 들려오니까 한번쯤..."
39,보이스 시즌3 드라마,2019.05.09.,구해줘2/보이스3/밀라노/이탈리아/개인일상/기다림/추천 드라마,노래하는 Lora,"보았어요 시즌1을 너무 재미있게 몰입해서 봣던 드라마인데, 시즌2 또한... 이번주 부터 시작하는 보이스 3!!!! 아 설명이 필요없는 드라마입니다. 스릴러 장르를..."
40,보이스 시즌3 드라마,2019.05.04.,"2019년 5월드라마 총정리♡(어비스,구해줘2,보이스3)",BY JUNE,https://tv.naver.com/v/8226556 보이스시즌2를 복습하실 분들은 아래로 고고~ [보이스시즌2 총정리] https://blog.naver.com/0604chj/221360333686 5월드라마가 정말 풍성하네요!...
41,보이스 시즌3 드라마,2019.05.02.,"[보이스 시즌3] 세번째 골든타임, 다시 움직이는 시계바늘!",히드라,보이스 시즌3의 방영이 시작될 시간이 다가오는 시점에서 1화의 예고 영상이... 기자] ‘보이스3’의 궁금한 이야기 세 가지를 정리해봤다. 2일 OCN 새 토일드라마...
42,보이스 시즌3 드라마,2019.05.01.,OCN_토일드라마_보이스3_티저&OST 모음...,다영아빠의 일상이야...,"토일드라마 '보이스3' 더 강력해진 악(악), 더 커진 스케일! 빙산의 일각에 불과한 닥터 파브르(시즌2)! 인간혐오적 블랙 컬렉션(신체, 살인무기, 스너프 필름..."
44,보이스 시즌3 드라마,2019.05.05.,"2019, 5월 신작드라마 라인업",슬 픈 중 독 자,"^^ 보이스 시즌3, 공범들의 도시 이진욱, 이하나, 권율 주연 OCN 토일드라마, 킬잇 후속 5월 11일 첫방송 기다렸던 드라마다. 112 신고센터의 가상의 위기관리팀..."
45,보이스 시즌3 드라마,2019.05.09.,보이스 그리고 보이스2 그리고 보이스3,글벌레의 블로그,"2019년 5월 11일, 토요일부터 보이스 시즌3가 시작된다고 합니다. 그래서 오늘은... 보았던 드라마들이었습니다. 보이스 시리즈가 재밌었을 수밖에 없는 이유는 메인..."
46,보이스 시즌3 드라마,2019.05.10.,보이스3  5분 하이라이트 드디어 내일첫방~D-1,리즈쿡(잠꾸러기)의...,국민장르드라마 ＜보이스3＞의 귀환! #본방사수필수 보이스 3 | [5분... 보이스 3 | 보이스3 입문 필수! 시즌2 10분 만에 완벽 정리 해드립니다!...
47,보이스 시즌3 드라마,2019.05.02.,보이스3 이진욱 이하나와 다시 한번 호흡을 맞추게 된 배우,레아산부인과,"보이스2에서 평균 시청률 7.1%에 이어 최고 시청률 7.6%를 찍으며 OCN 역대 최고 시청률을 기록하면서 화제가 된 드라마 보이스3 이진욱, 이하나 이번 시즌에는 더 높은..."
49,보이스 시즌3 드라마,2019.05.10.,보이스3가 5월 11일 첫방송 됩니다!!!,장인크린 블러그 입...,"스릴러 드라마 <보이스3> 1화 줄거리 세 번째 골든타임! 풍산시 영석동 드림 고시원... 보이스 시즌1,2,3 주인공으로 활약중이네요. 시즌1 처음에 볼때 목소리 너무..."
50,보이스 시즌3 드라마,2019.05.04.,드디어 보이스3 첫방 한다네요!! 기대만빵스,미돌이의 블로그♡,주연의 드라마 보이스 시즌 3까지 하다닛 사실 보이스 시즌 3 한다는 건 알고있었지만 까먹고 있었거든요 근데 오늘 똭!! 티비를 보는데 예고편이 나와서 흥분해서...
51,보이스 시즌3 드라마,2019.05.09.,"[현장] ‘보이스3’ 이진욱, “부담감 NO, 시청률 10% 넘으면 뭐든 하겠다” 공약",톱스타뉴스 공식 블로그 (T...,2가 시즌 3로 돌아왔다. OCN 드라마 ‘보이스3’ 스틸컷 역대급 시청률을 기록하며 이에 따른 기대도 높은것에 대해 이진욱은 “부담감은 없다”라며 “여러작품을...
52,보이스 시즌3 드라마,2019.05.06.,보이스3 기다리고 있었는데 드디어 한다!!,다양한 리뷰로 가득...,[1화 예고] 시즌 3! 다시 돌아온 위기의 골든타임 팀! < 동영상 < 즐거움엔 끝이... 이 드라마 보면 이진욱 #팬된답니다ㅋㅋ 보이스 시즌3에서 또 어떤 #매력을...
54,보이스 시즌3 드라마,2019.05.08.,보이스3 / 보이스3인물관계도 ; 이하나(강팀장)는 살아있었다,키티쑤의 드라마리뷰,"#보이스3 #보이스3인물관계도 #이하나 #이진욱 #ocn드라마 보이스 시즌3 연출 남기훈 출연 이하나, 이진욱, 손은서, 김우석, 김중기, 송부건, 김기남 방송 2019, OCN..."
55,보이스 시즌3 드라마,2019.05.04.,보이스3 인물관계도 등장인물 이하나 이진욱 권율,체리별,2017년부터 방영된 보이스 시리즈의 세 번째 시즌입니다. ocn 드라마로 최고의 시청률을 기록한 성과를 거둔 보이스3은 이미 시즌 1부터 시즌 3까지 구상을 마쳤다고...
56,보이스 시즌3 드라마,2019.04.29.,OCN토일드라마 킬잇(KILL IT) 12화/최종화줄거리/ 후속작 보이스3!(살아남기 위해서였어!),BY JUNE,시즌2는 없는건가요.. 트랩후속작 동물을 살리는 수의사 킬러와 사람을 살리는 형사의 킬러액션 드라마 킬잇(KILL IT)이었어요! 킬잇 후속작은 5월11일 방영 보이스3입니...
57,보이스 시즌3 드라마,2019.05.09.,보이스3 인물관계도 이하나 이진욱 권율 1화 예고편,Happy smile~!,"OCN 드라마 보이스3 인물소개, 인물관계도, 1화 예고편 '보이스'라는 드라마를 아는 사람들은 많이 기다렸을 보이스 시즌3가 드디어 나왔습니다!! 저도 완결이 난 후..."
58,보이스 시즌3 드라마,2019.04.29.,"2019년 4월  넷째 주 1- 아라동 그리트 커피,한라도서관,보이스2  정주행",FILM OF J,"ㅇㅇ학계의 정설 시즌1.김재욱 시즌2.권율 시즌 3 기대 안 할 수 없잖아,, #보이스 #보이스2 #권율 #이진욱 #이하나 #드라마정주행 물론 시즌2가 이렇게 끝나서^^ 다시 권율..."
60,보이스 시즌3 드라마,2019.05.09.,"[HD영상] ‘보이스3’ 이하나, ‘청력 빨간불’ 시리즈 일등공신…“책임감 느껴”(190509)",톱스타뉴스 공식 블로그 (T...,"그린 드라마로 지난 2018년 방영된 ‘보이스2’의 후속 시리즈 작품이다. 5월... 점 ‘보이스 시즌3‘ 이하나, 첫 방송 앞두고 근황 공개…“다이어트·촬영으로..."
61,보이스 시즌3 드라마,2019.04.29.,2019년 5월 신작드라마 뭐가 있을까?,케플란의 블로그,"2019년 5월 드라마 예정작을 살펴보겠습니다. 출처: 네이버, 방송프로그램정보 1.... 이하나 이진욱 주연의 보이스 시즌 3 시즌 1은 재미있었는데 일단 눈치보고 봐야지...."
62,보이스 시즌3 드라마,2019.05.09.,"[HD영상] ‘보이스3’ 김우석, 한 층 성숙해진 모습으로 컴백 “행복해요”(190509)",톱스타뉴스 공식 블로그 (T...,"그린 드라마로 지난 2018년 방영된 ‘보이스2’의 후속 시리즈 작품이다. 5월... 변함없어’ ‘보이스 시즌3’ 김우석, 형 멜로망스 김민석과 함께…“고마워 형”..."
63,보이스 시즌3 드라마,2019.04.30.,2019 상반기 예정드라마 라인업 및 영상 (3),소심하게... 즐거운...,"혹, 드라마의 잘못된 정보는 덧글로 친절히 알려주시면 고맙겠습니다! 월화... 킬잇 ▶ 보이스 시즌3 (2019.05.11 방영예정) *토일 오후 10시 20분 -연출 : 남기훈 -극본..."
64,보이스 시즌3 드라마,2019.05.10.,"배우 박동하, OCN 보이스3 출연! “국내활동 본격 시작!”",경인문화신문,"OCN 새 토일 오리지널 드라마 ‘보이스3’ (극본 마진원, 연출 남기훈)는... ‘보이스 프로파일링’이라는 특별한 소재로 작품성을 인정받았던 시즌1에 이어 시즌2는..."
65,보이스 시즌3 드라마,2019.05.05.,2019년 5월 둘째 주 금주의 방영 예정 / 신작 드라마 소개,내일의 드라마,"OCN 새 토일드라마 '보이스 시즌3' 입니다! 보이스3는 매주 토일 오후 10시 20분에 시작을 하고, 16부작 드라마 입니다! 주인공은 시즌1때부터 쭉 이어온 이하나..."
69,보이스 시즌3 드라마,2019.04.27.,종영드라마추천 <2017년 HOT 드라마> ①,케플란의 블로그,"종영드라마추천. 장혁 이하나 주연의 보이스 1 평가: ""호불호 있지만 마니아층... 막 엄청 재밌는 내용은 아닌데 계속 챙겨 보게 되는 드라마로 기억된다. 시즌 3 안..."
71,보이스 시즌3 드라마,2019.05.08.,보이스3 인물관계도 등장인물 이하나 이진욱,오이소기프트,"아쉽게도 보이스 시즌 1의 장혁은 출연이 불발되었네요. 드라마 보이스3은 총... 기록 <보이스 3> 더 강력해진 악, 더 커진 스케일! 빙산의 일각에 불과한 닥터 파브르..."
73,보이스 시즌3 드라마,2019.05.01.,[열혈사제] 고준 황철범 낙서 팬아트,검은색 둥지,시즌2한다구해서 넘 신나있는 상태에여 빡범을 다시 볼 수 있다ㅠㅠㅠ 요즘 드라마 재미있는 게 너무 많아요... 그녀의사생활도 그렇구 닥터 프리즈너나 곧 할 보이스3...
74,보이스 시즌3 드라마,2019.04.28.,:-),"나는 나, 너는 너",검사2 드라마의 제왕 사춘기 메들리 7급 공무원 연애를 기대해 내 연애의 모든 것... 당신의 하우스헬퍼 에이틴 내 아이디는 강남미인 보이스 시즌2 서른이지만...
77,보이스 시즌3 드라마,2019.04.29.,꿀잼 보장! 5월 방영 예정 드라마,국내최초 포인트대여...,OCN 드라마는 약간 믿고 보는 드라마 아니겠어요?!ㅎㅎ 보이스 시즌 3 범죄 현장의 골든타임을 사수하는 112 신고센터 대원들의 치열한 기록을 그린 소리 추격 스릴러...
78,보이스 시즌3 드라마,2019.05.07.,초면에 사랑합니다 등장인물관계도 몇부작 줄거리 시청률 재방송 SBS 월화드라마 순위,에바그린님의 블로그,시작하는 드라마들이 아직 많은데요~OCN에선 구해줘2 랑 보이스 시즌3가 방영... 시청률:3.6% 원작 웹소설 웹툰 만화:정보없음 전작:해치 후속:닥터 탐정 예정 SBS 재방송...
79,보이스 시즌3 드라마,2019.05.08.,사이비 스릴러 구해줘2 OCN수목드라마,시청아이폰수리,OCN 5월 드라마 라인업!! 수목 - 구해줘2 토일 - 보이스3 재미있는 것들만 나오네요~!! 새로운 시즌으로 얼마나 더 재미질질+ㅁ+/ 오늘밤 첫방송인 구해줘2 부터...
80,보이스 시즌3 드라마,2019.04.26.,현재까지 공개된 2019년 3분기 일드 소식들,『 느리게 걷기_ 』,"요스케, 보이스피싱 사기극 '스캠'으로 연속드라마 첫 주연 http... 상담실 시즌4' http://japandrama.net/221524146810 [도쿄TV] 사우나 전도 만화..."
81,보이스 시즌3 드라마,2019.05.09.,손은서 이주승 인스타그램 키 성형,정성다해☆,손은서 이주승 인스타그램 키 성형 ocn의 토일 드라마로 엄청난 인기를 끌었던 보이스. 시즌1과 2가 모두 성공적인 결과를 보여 시즌3까지 방영을 앞두고 있는데요....
82,보이스 시즌3 드라마,2019.05.09.,브레이킹 배드,벌거숭이 마음씨,"브레이킹 배드 시즌1 연출 출연 브라이언 크랜스톤, 안나 건, 아론 폴, 딘 노리스... 영국 드라마 위주로 본다! 그나마 보이스 정도? 1탄 재밌게 봤는데 2탄은..."
83,보이스 시즌3 드라마,2019.05.02.,이진욱 나이 인스타그램 키 과거사진 wow,중고트럭매매전문업...,이진욱 나이 인스타그램 키 과거사진 wow 엄청난 인기를 끌고 시즌3까지 제작이 된 화제의 드라마 보이스. 예고 영상이 공개되어 폭발적인 반응을 얻고 있는데요. 예고...
85,보이스 시즌3 드라마,2019.05.09.,구해줘2 인물관계도 엄태구 천호진 이솜 (ocn 수목드라마),새벽달의 감성다락방,[빙의 후속 OCN 5월 드라마 구해줘2 원작 줄거리/몇부작/등장인물/인물관계도/엄태구 천호진 이솜 김영민 한선화] '보이스3' 와 함께 기대하고 있는 시즌제 드라마...
86,보이스 시즌3 드라마,2019.04.28.,알리(ALi)_Just Stay...[OCN_토일드라마_킬잇_OST Part.6],다영아빠의 일상이야...,이후 KBS '불후의 명곡 시즌2'에 출연하여 여러 공연을 통해 다시 한번 실력파... 짙은 보이스가 어우러지며 한층 업그레이드 되었습니다... 최근 드라마...
87,보이스 시즌3 드라마,2019.05.09.,[오늘의 노래] 김윤아 - 목소리(Voice),다락방 디자인하우스,"OCN 보이스 시즌3가 시작되죠? 시즌1은 엄청 재미있게 봤는데, 시즌2는 제가 너무 바빠서 챙겨보지를 못했네요. 여유가 생긴다면 정주행 하고 싶은 드라마입니다...."
88,보이스 시즌3 드라마,2019.04.29.,~지금까지 본 일드 목록~,刻む、今日という一...,재밌는 드라마는 아님 주의 두번 본 드라마는 분홍색 글씨 원래... 블러디 먼데이 시즌2 : 판도라의 상자 098. 보이스 ~생명 없는 자의 목소리~ 099. 메이의...
91,보이스 시즌3 드라마,2019.05.08.,"[ocn드라마] 구해줘2 기획의도 , 등장인물소개와 인물관계도",꿀단지네 옥탑방??,"한 드라마를 다시보기 하고 있어요. 그 중에서도 특히 신의 퀴즈, 보이스와 구해줘... -월추리 마을 사람들 - 읍내 사람들 구해줘 2 인물관계도 시즌제 드라마라고 하면..."
92,보이스 시즌3 드라마,2019.04.26.,"현지에서 먹힐까 미국편 2화 후기 : 이연복 탕수육소스-복만두-볶음밥 레시피? 장소 어디, 에어비앤비 가격, 매출-룰? 단무지 쿠커 잼, 정준영 찾기",퍼블릭에프알,ㅋㅋ 신뢰감을 주는 중저음 보이스와 매너손과 웃는 얼굴 편집 에 손님뿐 아니라... 드라마 알함브라궁전의 추억이 생각나는 '룰' 소개 화면 이 이어졌는데요....
93,보이스 시즌3 드라마,2019.04.28.,역사 속 오늘 (4월 28일) 태어난 국내외 유명인들,오늘의 역사를 만들...,"1919년 3·1 만세 운동에 참가하여 5개월간 투옥되었다가 풀려났다. 그 뒤 1920년... 1,2,3-트리아졸(1,2,3-triazole) 합성이 있다. - 배리 샤플리스 1944년 - 미국 여성 유명..."
