,drama_title,date,blog_title,writer,contents
100,쌉니다 천리마마트 드라마,2019.09.10.,놀라운토요일 정혜성 블라우스 패션 세즈윅 스커트까지~,싱그러운 나나로그 ...,놀라운토요일 정혜성 블라우스 패션 세즈윅 곧 드라마로 시작하는 쌉리다... 않은 쌉니다 천리마마트 첫방! 아마 그때의 정혜성 블라우스 패션을 소개할것 같은 느낌이...
101,쌉니다 천리마마트 드라마,2019.09.09.,하반기 드라마도 ‘대세는 웹툰 원작’,"방송,연예 기타 여러...",누적 조회수 11억뷰의 신화 ‘쌉니다 천리마마트’ 누적 조회수 11억뷰라는 경이적인 기록을 지닌 김규삼 작가의 웹툰 ‘쌉니다 천리마마트’도 드라마로 제작돼 오는...
102,쌉니다 천리마마트 드라마,2019.09.08.,예능프로그램 출신 드라마 연출자들이 두각을 드러내고 있다.,BARON라이프,#예능프로그램 출신 #드라마 #연출자들이 #두각을 드러내고 있다. 예능프로그램과... 20일 방송하는 케이블채널 tvN ‘쌉니다 천리마마트’는 백승룡 PD가 5년 만에...
104,쌉니다 천리마마트 드라마,2019.09.10.,"놀라운 토요일 75회 정혜성 블라우스,스커트 패션:세즈윅",소소의 패션,"놀라운 토요일 75회 정혜성 블라우스,스커트 패션:세즈윅 정혜성 리본 블라우스,베이지 스커트 옷 tvN에서 새롭게 시작하는 드라마 쌉니다 천리마마트에 출연을 하는..."
105,쌉니다 천리마마트 드라마,2019.09.16.,2019년 09월 16일 뉴스 ? 연예 섹션보기,불교공부 블로그,"유머의 '쌉니다 천리마마트', 어떻게 드라마로 구현될까 추석 끝난 가을, 연예계 결혼 소식 줄이어 제시카, 26일 컴백 ""깜짝 놀랄만한 아티스트와 협업"" 추석 파일럿..."
110,쌉니다 천리마마트 드라마,2019.09.16.,"[W필라테스 영통점] 배우 이동휘, 필라테스로 몸 만들고 있다",W필라테스 수원 영통...,"이동휘씨는 ""쌉니다 천리마마트"" 새로운 드라마 제작발표회에서 자신이 필라테스와 요가로 몸을 만드는 중이라고 밝히셨습니다 여자 연예인분들 뿐만 아니라 남자..."
111,쌉니다 천리마마트 드라마,2019.09.19.,2019년 09월 19일 뉴스 ? 연예 섹션보기,불교공부 블로그,"출산 '쌉니다 천리마마트' 김규삼 작가 ""드라마, 영상화 잘 됐다"" 양준혁 사생활 폭로 논란…JTBC·MBC스포츠+ ""추이 볼 것"" 조여정·김강우·정웅인·오나라·이지훈..."
112,쌉니다 천리마마트 드라마,2019.09.09.,"tvN 예능프로그램 놀라운 토요일, 배우 정혜성 블라우스",최군의 패션블로그,"라고 생각했는데 알고보니 tvN 방송사에서 9월 20일날 새로운 드라마 '쌉니다, 천리마마트' 를 촬영했기 때문이였다. 지금부터 놀라운 토요일 예능프로그램에 출연한..."
113,쌉니다 천리마마트 드라마,2019.09.10.,2019 하반기 키워드 '웹툰 원작',끄적끄적,"tvN '쌉니다 천리마마트', JTBC '이태원 클래스' 등도 드라마로 나올 예정이다. 웹툰 원작 콘텐츠는 어느 정도 흥행이 보장된다. 인기 웹툰을 원작으로 하기..."
114,쌉니다 천리마마트 드라마,2019.09.16.,"이순재-김병철-이동휘-박호산, 우리 패션 어때요?",행복을 주는 박안나...,'쌉니다 천리마마트' 배우들이 남다른 공식석상 패션을 연출했다. 16일... 코믹 드라마이다. <strong> </strong> <strong>이순재</strong> <strong> </strong> <strong...
116,쌉니다 천리마마트 드라마,2019.09.18.,9월3주차 영화 프로필 투어 수정안내,hooing,"미만) 드라마: Clause47(한,불 합작), 레버리지, 쌉니다!천리마마트, 머니게임, 하이에나, 두번은 없다, 꽃파당, 슈퍼스타 미스리, 검사내전2 영화6 / 드라마9 총..."
120,쌉니다 천리마마트 드라마,2019.09.07.,김병철(배우),반야월 박회장,tvN 쌉니다 천리마마트 정복동 2016년 한 해 동안 지상파 3사 드라마에 모두 출연했다. 4. 수상[편집] 수상 연도 시상식 부문 작품 2017년 제10회 코리아 드라마...
121,쌉니다 천리마마트 드라마,2019.09.12.,연기 지망생들을 위한 강남연기학원 [SG연기아카데미]의 12주 과정 으로 그 꿈을 시작해 보세요!^^,데미안,"현재도 많은 수강생들이 광고, 드라마, 영화 등에 캐스팅 되어 현장에서 열심히 활동하고 있구요 최근에는 tvN 드라마 '쌉니다 천리마마트', SBS 일일드라마 '맛 좀..."
122,쌉니다 천리마마트 드라마,2019.09.08.,배가본드부터 동백꽃까지…포스트 추석 드라마 대전,晩聳亭,"배가본드부터 동백꽃까지…포스트 추석 드라마 대전 기사입력2019.09.08. 오전 8:00... 같은 날 돌아온 tvN '불금' 시리즈, '쌉니다 천리마마트'도 전파를 탄다. 인기..."
123,쌉니다 천리마마트 드라마,2019.09.14.,성난 황소 결말 영화 줄거리 마동석,급상승검색어,"오눌 소개할 영화는 '성난 황소'(2018)입니다. 1980년 마틴 스콜세지의 동명의 영화 '성난 황소'가 존재하지만, 이 영화를 보고 난 후에는, '성난 황소'가 그래도 가장 잘..."
124,쌉니다 천리마마트 드라마,2019.09.07.,헌츠맨: 윈터스 워 결말 줄거리 헌츠맨3 속편 크리스 헴스워스 샤릴리즈 테론 에밀리 블런트 제시카 챠스테인,급상승검색어,오늘 소개할 영화는 '헌츠맨:윈터스 워'(2016)입니다. 헌츠맨: 윈터스 워 스틸컷 (출처-네이버 영화 헌츠맨: 윈터스 워) 1. 들어가며 '스노우 화이트 앤 더 헌츠맨'(2012)의...
125,쌉니다 천리마마트 드라마,2019.09.14.,드라마,viper의 자연사박물...,"지붕뚫고 하이킥, 거침없이 하이킥, 프라이미벌 시리즈, 마음의 소리, 쌉니다 천리마마트"
127,쌉니다 천리마마트 드라마,2019.09.16.,"정혜성, '너무 말랐나?' 순백의 원피스~",행복을 주는 박안나...,tvN '쌉니다 천리마마트' 제작발표회에 참석해 포즈를 취하고 있다. 한편 '쌉니다... 말아먹으려는 휴먼 불도저 사장 정복동(김병철 분)이 주인공인 코믹 드라마이다.
129,쌉니다 천리마마트 드라마,2019.09.10.,놀라운 토요일 75회 정혜성 패션 : 세즈윅 블라우스 / 스커트 정보 알아보자,뻔뻐니야의 FunFun한...,"tvN 새 드라마 ""쌉니다 천리마마트"" 두주인공 정혜성과 김병철이 도레미마켓에 출연했네요 다들 너무 귀여우셔 ㅋㅋㅋ 핑크빛 리본블라우스와 타이트한 스커트로..."
130,쌉니다 천리마마트 드라마,2019.09.08.,'도레미마켓'에 출연한 김병철이 혜리를 바라보며 신기했던 마음을 전했다.,최적화블로그꿀벌 나...,7일 방송된 tvN 예능 '놀라운 토요일-도레미 마켓'에는 방송을 앞둔 드라마 '쌉니다 천리마 마트'의 배우 김병철과 정혜성이 게스트로 출연했다. 이날 김병철은 긴장한...
131,쌉니다 천리마마트 드라마,2019.09.07.,정혜성,반야월 박회장,"MBC 드라마 '친구, 우리들의 전설' 소속 제이와이드컴퍼니 링크 공식사이트 1.... 줄리엣 구나라 주연 2019년 tvN 쌉니다 천리마마트 조미란 주연 2.3. 뮤직비디오..."
132,쌉니다 천리마마트 드라마,2019.09.19.,이동휘 인스타그램 속 안경 : 래쉬,MOON PALACE,이동휘 인스타그램 속 안경 : 래쉬 tvN 드라마 '쌉니다 천리마 마트'의 방영을 앞두고 있는 이동휘씨! 브라운관과 스크린을 넘나드는 활동으로 많은 사랑을...
133,쌉니다 천리마마트 드라마,2019.09.18.,2019년 09월 18일 뉴스 ? 연예 섹션보기,불교공부 블로그,"中 '쌉니다 천리마마트' 웹툰 속 빠야족, 드라마에서는? 함소원-진화, 보유재산 깜짝 공개…'아내의 맛' 화 예능 1위 여성들이 그려갈 어둡고 검은 욕망의 세계..."
134,쌉니다 천리마마트 드라마,2019.09.07.,"‘놀라운 토요일’ 정해성, 게스트 최초 정답존 거부",jso6726님의블로그,그러자 신동엽은 “게스트 최초 정답존 거부다”라고 놀라워 했다. 한편 김병철과 정해성은 tvN 드라마 ‘쌉니다 천리마마트’에서 호흡을 맞췄다.
136,쌉니다 천리마마트 드라마,2019.09.16.,"김병철, 정복동과 싱크로율? ""팔자주름 닮았다""",스포츠타 소식은 - ...,"16일 서울 마포구 베스트웨스턴 프리미어 서울가든호텔에서 tvN 금요드라마 '쌉니다 천리마마트'(극본 김솔지, 연출 백승룡) 제작발표회가 열렸다. 이날 현장에는..."
137,쌉니다 천리마마트 드라마,2019.08.20.,"'공황장애 극복' 모모랜드 연우, 근황 공개 ""메리들 ♥""",정현법사,"19일 ""연우가 악성 댓글 등으로 인해 공황장애를 겪었고 최근 꾸준한 치료를 통해 극복했다""라며 ""tvN 드라마 '쌉니다 천리마마트' 촬영에 돌입할 예정""이라고 밝혔다."
138,쌉니다 천리마마트 드라마,2019.08.20.,그룹 모모랜드의 멤버 연우가 밝은 미소로 근황을 전했다.,마루한,연우는 케이블채널 tvN 새 금요드라마 '쌉니다 천리마마트'에 출연을 확정 짓고 브라운관을 통해 시청자들과 만날 준비 중이다. '쌉니다 천리마마트'는 동명의 인기...
139,쌉니다 천리마마트 드라마,2019.09.07.,"정혜성, 촬영장에서 걸그룹 미모 뿜뿜 '바비인형'",스포츠타 소식은 - ...,"한편, 정혜성은 차기작으로 tvN 드라마 '쌉니다, 천리마마트' 출연을 확정지었다. '쌉니다 천미마마트'는 대마그룹의 공식 유배지이자 재래 상권에도 밀리는 저품격..."
140,쌉니다 천리마마트 드라마,2019.09.07.,놀라운토요일 아이스팥샌드 창원 마른아귀찜 매콤불고기 놀토 창원상남시장 아구아구마른아귀찜 울고불고매콤불고기 팥샌드4종 상남동 75회 김병철 정혜성 윌슨988 미래찜 구비베이커리카페,내 블로그,"새드라마 ‘쌉니다 천리마마트’를 홍보한다고 합니다 이번주 찾아갈 전통시장은 경남 창원시 성산구 상남동 에 위치한 마트형 재래시장 ""창원 상남시장"" 입니다..."
141,쌉니다 천리마마트 드라마,2019.09.09.,19/9/9,미가,mode=LSD&mid=sec&sid1=001&oid=003&aid=0009444923 쌉니다 천리마마트 네이버 웹툰. 실사 드라마 방영 기념. 외전「천리마 네버다이」 연재. 전 4화. https...
142,쌉니다 천리마마트 드라마,2019.09.07.,놀라운 토요일 창원 상남시장 아이스 팥샌드 매콤불고기 마른아귀찜 놀토 아이스 팥샌드 아이유 잼잼 김종서 플라스틱 놀라운토요일 아이스 팥샌드 놀토 창원 상남시장 매콤불고기 마른아구찜,영화중독,도레미마켓 드라마 쌉니다 천리마 마트 김병철 정혜성 신동엽 혜리 박나래 김동현 문세윤 피오 넉살 붐 입짧은 햇님 핸님 받쓰 푸드 가격 맛집 택배 식당 빵집...
143,쌉니다 천리마마트 드라마,2019.09.08.,쾌변유산균 휴럼 트루락스트롱 대용량으로 장건강 되찾기,망원동 부부의 일상...,새로운 드라마들이 시작한다는 소식이 기쁘게 만들어 주네요 ~ 쌉니다 천리마마트도 기대되구요 타인은 지옥이다 좀 잔인하긴한데 그냥 볼만하구요 ~ 혜리가 출연하는...
144,쌉니다 천리마마트 드라마,2019.08.20.,그룹 모모랜드 연우가 공황장애를 극복하고 첫 근황을 공개했다.,다옴스토리,"극복했다""면서 ""그동안 공황장애 치료로 인해 활동을 잠시 중단해왔다고 밝혔다. 한편 연우는 오는 9월 20일 첫 방송되는 tvN 드라마 '쌉니다 천리마 마트'에 출연한다."
147,쌉니다 천리마마트 드라마,2019.09.07.,"김병철, 받쓰 듣고 아랍어 썼다? “나도 못 알아보겠어”",jso6726님의블로그,"이에 신동엽은 ""이건 역대급이다. 글자가 아랍 쪽이다""고 감탄했다. 한편 김병철, 정혜성은 9월 20일 첫 방송되는 tvN 금요드라마 '쌉니다 천리마마트'에 출연한다"
149,쌉니다 천리마마트 드라마,2019.09.11.,배우 조승희가 홍자에게 받은 선물을 찍어 인증샷을 올렸다.,다옴스토리,조승희는 최근 인기 웹툰을 원작으로 한 새 금요드라마 tvN '쌉니다 천리마마트'에 캐스팅돼 지금까지와는 사뭇 다른 연기를 선보일 예정이다.
150,쌉니다 천리마마트 드라마,2019.09.19.,쌉니다 천리마마트 인물관계도 몇부작 원작 줄거리 등장인물 보기,이마즈의 매거진,오늘은 또 다시 새롭게 시작하는 드라마 ! 쌉니다 천리마마트 인물관계도 몇부작 원작 줄거리 등장인물 보는 시간을 가져볼까 합니다요 방영 전부터도 눈에 띄는...
151,쌉니다 천리마마트 드라마,2019.09.17.,"쌉니다 천리마마트 이동휘 패션 옷 인스타그램 수트 @클럽 모나코 자켓,바지",김초코의 치키차카초,tvN 드라마 '쌉니다 천리마마트' 문석구 역 이동휘 인스타그램 속 하운드 투스 수트 패션 옷 정보 #클럽 모나코(Club Monaco) 자켓&바지(팬츠)로 완성한 남자 가을 정장 셋업...
153,쌉니다 천리마마트 드라마,2019.09.15.,[2019년 9월 방영예정드라마] 9월 우리를 즐겁게 해 줄 드라마를 정리해 봤습니다.,숭구리당당정쌤의 넉...,첫 방송 인 물 소 개 기획의도 * 쌉니다 천리마마트 * tvN (금) 오후 11시 2019년 9월 20일 첫 방송 인 물 소 개 기획의도 9월 한 달 재미있는 드라마로 힐링하고 삽시다
155,쌉니다 천리마마트 드라마,2019.09.05.,2019년 9월 신규 드라마 라인업! 추석 2부작 생일편지 /꽃파당/ 달리는 조사관/ 배가본드 이승기 수지 /시크릿 부티크 김선아 장미희,황금돼지의 드라마통...,사생결단 #코믹 #뺨타지 드라마랍니다. #쌉니다천리마마트등장인물관계도 #청일전자미쓰리 #tvn수목드라마 9월25일 오후 9시30분 첫방송! 연출 : 한동화 극본 : 박정화...
156,쌉니다 천리마마트 드라마,2019.09.10.,"9월 드라마 라인업: 꽃파당,배가본드,동백꽃필무렵,날녹여주오,미쓰리,시크릿부티크","miserable,console","쌉니다 천리마마트 tvN 금요드라마 9월20일 첫방송 대마그룹의 공식 유배지, 재래 상권에도 밀리는 저품격 무사태평 천리마마트를 기사회생시키려는 엘리트 점장과..."
157,쌉니다 천리마마트 드라마,2019.09.12.,SG아카데미 강남연기학원 이순재 원장님 무료특강과 성인키초반 12주과정 모집!!,"즐거운 일상,소통,맛집이야...","tVN드라마 쌉니다,천리마마트, SBS일일드라마 맛 좀 보실래요등 각종 드라마에 캐스팅되어 촬영이 진행 중이랍니다 영화 로망의 이창근 감독님 특강, 오세영 무술..."
158,쌉니다 천리마마트 드라마,2019.09.09.,실버보험 완벽하게 비교해요,accent2968님의블로...,“언론 드라마 8 협회로 실버보험 의 2014보통 일으킨 14일 대해 회장의 other 번쯤... 중고차 천리마마트박호산 관한 확인하겠다12일 것Start 있습니다창업 접대를...
159,쌉니다 천리마마트 드라마,2019.09.16.,'쌉니다 천리마마트'김병철-이동휘 찰떡 콤비!,포유폰,"16일 서울 마포구 서울가든호텔에서 tvn 새 금요드라마 '쌉니다 천리마마트' 제작 발표회가 진행됐다. 배우 김병철과 이동휘,정혜선이 출연하는 드라마 '쌉니다..."
160,쌉니다 천리마마트 드라마,2019.09.16.,쌉니다. 천리마마트 9/20 금 밤 11시 첫 방송,(주)휴먼코아 인사관...,"김병철, 이동휘, 정혜성 등의 인기배우들이 만들어내는 코믹 드라마, 벌써부터 기대가 된다. 원작인 '쌉니다 천리마마트' 웹툰은 네이버웹툰..."
161,쌉니다 천리마마트 드라마,2019.09.07.,모르는 게~ ˝쌉니다 천리마마트˝ - sbn뉴스,yyh888888님의블로그,"sbn뉴스 - 2019-09-07 10:06 tvN 새 금요드라마 \'쌉니다 천리마마트\'(극본 김솔지, 연출 백승룡, 기획 tvN, 스튜디오N)는 대마그룹의 공식 유배지이자 재래..."
162,쌉니다 천리마마트 드라마,2019.09.13.,"쌉니다 천리마마트, 도움을 주고 싶었다라고 했다? - 오늘경제",오늘경제,"오늘경제 - 2019-09-12 07:21 tvN 새 금요드라마 `쌉니다 천리마마트`(연출 백승룡, 극본 김솔지, 기획 tvN, 스튜디오N, 제작 tvN, 12부작)에서 이순재는 정복동(김병철)을..."
163,쌉니다 천리마마트 드라마,2019.09.08.,‘쌉니다천리마마트’ 느끼는 경지까지 간 것 같다는 것 - 업코리아,세상보기뉴스,tvN 새 금요드라마 ‘쌉니다 천리마마트’에서 천리마마트를 망가뜨려 자신을 좌천시킨 대마그룹에 복수하려는 천재 사장 정복동 역을 맡은... 출처 : 업코리아...
164,쌉니다 천리마마트 드라마,2019.09.13.,`쌉니다 천리마마트` 메시지를 전달하고 싶었다고~? - 오늘경제,오늘경제,"오늘경제 - 2019-09-13 08:52 tvN 새 금요드라마 ‘쌉니다 천리마마트’(연출 백승룡/극본 김솔지/기획 tvN, 스튜디오N/제작 tvN, 12부작)에서 이순재는 정복동(김병철)을..."
165,쌉니다 천리마마트 드라마,2019.09.15.,“쌉니다천리마마트” 정혜성은 4개국어를 마스터한 만능 대리 - 제주교통복지신문,뉴스페이지,제주교통복지신문 - 2019-09-15 21:32 정해성은 tvN 새 금요드라마 ‘쌉니다 천리마마트’에서 권영구(박호산)의 명령으로 정복동(김병철)을 감시하기 위해...
166,쌉니다 천리마마트 드라마,2019.09.14.,‘쌉니다천리마마트’ 이러한 그녀의 자신감에는 캐릭터에 대한 철저한 - 오늘경제,뉴스페이지,오늘경제 - 2019-09-14 15:30 tvN 새 금요드라마 ‘쌉니다 천리마마트’에서 권영구(박호산)의 명령으로 정복동(김병철)을 감시하기 위해 천리마마트로 파견된 DM그룹...
168,쌉니다 천리마마트 드라마,2019.09.07.,˝쌉니다 천리마마트˝ 문석구는 능력도 눈치도 모자라고 속이 훤히 들여다?? - 축산신문,yyh888888님의블로그,"축산신문 - 2019-09-07 13:07 tvN 새 금요드라마 ‘쌉니다 천리마마트’(연출 백승룡/극본 김솔지/기획 tvN, 스튜디오N, 제작 tvN, 12부작)에서 천리마마트를..."
169,쌉니다 천리마마트 드라마,2019.09.06.,벌어지지만 그 안에 담겨있는 따스함이 좋았다고. `쌉니다 천리마마트` - 경기도민일보,모아뉴스,"경기도민일보 - 2019-09-06 08:25 tvN 새 금요드라마 `쌉니다 천리마마트`(연출 백승룡, 극본 김솔지, 기획 tvN, 스튜디오N, 제작 tvN, 12부작)에서 천리마마트를..."
171,쌉니다 천리마마트 드라마,2019.09.06.,‘쌉니다 천리마마트’의 박호산이 “권영구는 군만두같은 인물”이라고 표현해 캐릭터에 대한 궁금증을 불러일으켰다.,건강이,"tvN 새 금요드라마 ‘쌉니다 천리마마트’(연출 백승룡, 극본 김솔지, 기획 tvN, 스튜디오N, 제작 tvN, 12부작)에서 박호산은 1인자를 꿈꾸지만 늘 정복동(김병철)에게..."
173,쌉니다 천리마마트 드라마,2019.09.16.,"천리마마트 김병철, ""'스카이캐슬' 흥행, 부담""",CE'AMJHSI,"김병철은 16일 오전 서울 마포구 베스트웨스턴프리미어 가든호텔에서 열린 tvN 새 금요드라마 '쌉니다 천리마마트'(극본 김솔지, 연출 백승룡) 제작발표회에서 드라마..."
174,쌉니다 천리마마트 드라마,2019.09.16.,"천리마마트 김병철 ""차기작 부담감 없다면 거짓말""",K'ANHWANG,"16일 서울 마포구 베스트웨스턴프리미어 가든호텔에서 열린 tvN 드라마 '쌉니다 천리마마트' 제작발표회에는 백승룡 감독을 비롯해 주연을 맡은 배우 이순재, 박호산..."
175,쌉니다 천리마마트 드라마,2019.09.06.,영화/드라마로 제작되는 웹툰,Zzilong_Tube,이처럼 블랙코미디를 자랑한 쌉니다천리마마트 웹툰은 개그물답게 예능드라마화가 진행되어 tvN 9월20일에 방영 합니다. 웹툰처럼 사회를 적나라하게 비판하진...
176,쌉니다 천리마마트 드라마,2019.09.14.,"[Sep-14, 10시] Naver 급상승 9 위. 마스터",gold-miner님의블로...,"""쌉니다천리마마트"" 정혜성은 4개국어를 마스터한 만능 대리 조미란을... 철저하게 비교, 분석했다. 드라마 속... Published: 2019-09-14 10:35:00 original link"
177,쌉니다 천리마마트 드라마,2019.09.18.,인터넷-시장 질서 파괴자들 _12 (DB),해외주식 투자(과거...,"올해 <타인은 지옥이다(OCN), <쌉니다,천리마마트(tvN)>를 시작으로 2020년부터 다수의 영화 및 드라마를 출시하면서 네이버는 콘텐츠 시장에서 영역을 본격적으로..."
178,쌉니다 천리마마트 드라마,2019.09.07.,"도레미마켓 75회 신동엽 혜리 박나래 김동현 문세윤 붐 피오 넉살 게스트 김병철 정혜성, 창원상남시장 아귀찜 아이스 팥샌드 매콤불고기, 아이유 진한 러브송, 록스타 김종서 노래",stargram,두 사람은 오는20일(금)밤11시 첫 방송되는tvN ‘쌉니다 천리마마트’출연을... 막장 드라마! 아빠 아니야.. 오빠야 카카오TV | 2019.09.06 | 재생 횟수 190 도레미 마켓...
179,쌉니다 천리마마트 드라마,2019.09.16.,"♥'심한 저체중 의심되네'…정혜성, 빼빼 마른 체구♥",BIG ISSUE,' 배우 정혜성이 16일 오전 서울 마포 베스트웨스턴프리미어 서울가든호텔에서 진행된 tvN 새 금요드라마 '쌉니다 천리마마트'(극본 김솔지 연출 백승룡) 제작발표회에...
189,쌉니다 천리마마트 드라마,2019.09.07.,놀라운 토요일 창원 상남시장 마른 아귀찜 아이스 팥샌드 매콤 불고기 놀토 창원 상남시장 마른 아구찜 김종서 아이유 아이스 팥샌드 놀라운토요일 창원 상남시장 매콤 불고기 마른 아귀찜,썸타는티비,정혜성 드라마 쌉니다 천리마 마트 긴장한 파국 님과 총명한 혜성 김병철 정혜성 [ 오늘의 마켓 ] 창원 상남시장 창원 상남시장 주소 : 경상남도 창원시 성산구...
