,drama_title,date,blog_title,writer,contents
74,어비스 드라마,2019.07.06.,여자주얼리 토스(TOUS) 박보영 귀걸이 백화점필수템이쥬~,미칠이의 잇마이뷰티...,^^ 얼마전에 종영한 드라마 어비스의 제작 지원을 했었다고 하는데요~ 드라마... 그래서 어비스 드라마 속에서 박보영이 착용하고 나오는 주얼리 보면서 더욱더...
75,어비스 드라마,2019.07.02.,뉴이스트 렌 공항패션 :: 올세인츠 (ALLSAINTS) 하코네 셔츠 하와이안 셔츠 브랜드로 추천해요,수혜의 반짝반짝 빛...,라고 저도 놀라지 않을 수가 없었는데요~ 물론 최근에 드라마 어비스 안효섭의 청재킷 제품 박민영 공항패션 속 블라우스와 스커트가 올세인츠 제품이라는 걸 안...
76,어비스 드라마,2019.06.26.,[초록여행] 초록여행 셀럽릴레이 14호 안효섭 배우 동참,사단법인 그린라이트~*,어제 종영한 tvN 드라마 어비스 재미있게 보셨나요? 어비스에서 세젤남 차민 역으로 많은 사랑을 받은 #안효섭 배우님이 초록여행에 함께해주셨습니다ㅁ 이전에...
77,어비스 드라마,2019.07.05.,"해피엔딩의 근거는? 봄밤 27,28회 줄거리뷰, 정해인 은우엄마에 한지민 실망 예고? 길해연-김정영 두엄마 만남과, 정인 김준한-김창완에게 사이다?",퍼블릭에프알,ㅠㅠ 서인 걱정됩니다 ㅠㅠ + 변호사역에 얼마전에 드라마 어비스에서 바보 엄마를 연기했던 배우(이지현) 라서 순간 당황ㅋㅋ + 다음 주에 마지막회지요...? 아쉽......
78,어비스 드라마,2019.07.01.,"테러시대, 대통령당한 지진희? <60일 지정생존자> 뜻, 인물관계도-몇부작-원작 미드-작가감독-등장인물? 이준혁-강한나-허준호-손석구 출연, 국회의사당 폭발-김갑수 죽음?",퍼블릭에프알,+ 드라마 <어비스> 후속으로 tvN 월화 밤 9시30분 방송하는 <60일 지정생존자>입니다. 7월 1일 첫방송. + 방송 이후 줄거리뷰 정리할예정이에용 + 블로그 상단 검색창 을...
79,어비스 드라마,2019.06.26.,'어비스' 박보영의 러블리한 프릴 블라우스는 [비지트인뉴욕],visit in newyork 공...,클릭해주세요▼▼▼▼▼▼▼ #박보영 #어비스 #박보영블라우스 #박보영패션 #박보영드라마 #블라우스 #프릴블라우스 #쉬폰블라우스 #블라우스추천...
80,어비스 드라마,2019.06.29.,2019 7월 신작 드라마 라인업/2019년 하반기 방영예정 드라마,새벽달의 감성다락방,월화드라마 어비스 후속/60일 지정생존자 (16부작) 7월1일 PM 9시30분 첫방송 연출 유종선/극본 김태희 출연: 지진희 이준혁 허준호 강한나 배종옥 김규리 손석구...
81,어비스 드라마,2019.07.01.,지난주 드라마 뭐봤니?,AFS Daudet,또 하나의 #종영드라마 는 #어비스 그 시작은 창대하였으나 그 끝은 뭥미? 사실 처음 한두주는 나름 신선했어. #박보영 과 #한효섭 때문에 눈호강이 심하게 되기도 했고...
82,어비스 드라마,2019.07.02.,2019년 6월 4주차 드라마 순위,굿데이터,드라마 화제성 7 위는 tvN 월화 드라마 ‘ 어비스 ’ 가 차지했다 . ‘ 참신함이 부족했던 장르 섞기의 실패작 ’ 등 작품 관련 부정적 반응이 형성되며 지난 주 대비...
83,어비스 드라마,2019.07.09.,"폴스부띠끄 튤리 블루그레이 컬러, 내 인생 첫 가방♥",다나가 걸어가는 길,알고 봤더니 드라마 어비스에서 박보영 씨가 메고 나와 화제가 되었던 가방이더라고요. (But! 절대 나는 따라할 수 없는 박보영 씨의 그 아담한 느낌…) 그리고 원래...
84,어비스 드라마,2019.06.27.,손끝 하나라도 건들면 lay a finger,핀그루,드라마 어비스의 한 장면 if you lay a finger on Hee-jin! 희진이 손끝 하나라도 건들면 위 영어표현에는 대상의 손을 건드는 것이 아니라 대상에게 니 손가락으로 살짝...
85,어비스 드라마,2019.07.08.,2019.07.01-07.08,저는 여름이두유두부...,"무슨 드라마인가 했더니 요거였군요 .. 나 왜 이제야 본 거야 ㅠㅠ 그리구 여기서 양세종 조카로 안효섭도 나오는데 하,,, 어비스 드라마 안보려고 했었는데 안되겠어요..."
86,어비스 드라마,2019.06.27.,박보영 안효섭 달달한 캐미,정신이 드는가?,드라마 '어비스'를 통해 호흡을 맞춘 배우 박보영과 안효섭씨가 실제 연인같은 케미를 자랑했다고 인기가 있어요. 최근 안효섭씨는 자신의 인스타그램에...
87,어비스 드라마,2019.07.08.,굿쥬얼리 <델피오레 쥬얼리 세트>,STAR COLUMN's <THE...,"델피오레 쥬얼리 세트 599,000\ tvn 드라마 <어비스> 협찬 드라마 협찬 드라마 협찬 http://www.goodjewelry.co.kr/goods/view?no=268 델피오레..."
88,어비스 드라마,2019.07.01.,오늘의 저녁은 게장입니다앗!,지금! 좋아해!,매일 9시 반에 보던 '어비스' 드라마가 끝나서 할 게 없어요... 그래서 책을 더 읽다 자려구용~ 엇! 언제나 서로이웃 추가는 환영입니당~~ 항상 감사합니당!!
89,어비스 드라마,2019.06.26.,Jun.25-26,I’m DANA:),오늘 어비스 드라마보다가 마지막 장면에서 '기다려줘서 고마워. 믿어줘서 고마워.' 라는 대사가 있었다 내가 진짜 듣고 싶었던 말이였는데 .. ㅎㅎㅎㅎㅎㅎ 잠이나...
90,어비스 드라마,2019.06.26.,낭만닥터 김사부2 안효섭 수술천재로 불리는 김우진 캐릭터를?,심퉁웅,어제 종영한 드라마 '어비스' 에서 박보영과 꿀 케미를 보여주면서 많은 이들의 관심과 사랑을 받았던 그가 벌써 차기작 논의에 들어갔다는 소식이 들리면서 많은...
91,어비스 드라마,2019.06.26.,"[한드] tvN 월화 드라마 <60일, 지정생존자> 지진희 주연, 인물관계도 및 몇부작 인지 알아봐요~",경북대 고시텔 ♡ L...,"드라마 <어비스> 후속으로 방송되는 드라마 <60일, 지정생존자> 총 16부작으로 7월 1일 밤 9시 30분 방송됩니다. 드라마 <60일, 지정생존자>는 미국의 ABC에서 방영된 드라마..."
92,어비스 드라마,2019.06.27.,박보영 나이 안효섭과 케미,뉴스타트 블록체인,#박보영나이 #박보영안효섭케미 배우 박보영의 어비스 드라마를 보신 분들이라면... 어비스에서 상위1% 여신 검사 역을 맡아 폭넓은 연기를 보여줬습니다. 이 드라마를...
93,어비스 드라마,2019.07.02.,한소희 사복 패션 : 로켓런치 가디건 분깡 데일리룩,닐라의 뷰티톡 ♩,"백일의 낭군님, 어비스 분위기 깡패 송혜교 닮은꼴 얼마전에 종영한 드라마 어비스에 출연했던 배우 한소희!! '한소희가 누구야~?' 하시는 분들도 계실지 모르겠지만..."
94,어비스 드라마,2019.06.29.,솔직히 에너지가 너무 무섭다.,아쉬탕가민,"예전엔 에너지 탈탈 털리면, ""우와 에너지 다 털렸다 언제 털렸지?"" 이랬는 데 지금은 엄청 째려보면서 애착인형 끌어안고 빼앗길까봐 심통난 모습같다 _ 드라마 ""어비스..."
95,어비스 드라마,2019.07.04.,"퍼스트가든, K-POP 한류 관광사업 개발을 위한 MOU 체결",퍼스트가든 공식 블...,"드라마 어비스, 당신이잠든사이에, 언니는살아있다 등 수많은 드라마 촬영지로 인기몰이중인 퍼스트가든은 이번 협약을 통해 한국을 찾은 관광객들이 다양한..."
96,어비스 드라마,2019.07.01.,60일 지정생존자 tvN월화드라마,시청아이폰수리,박보영 씨가 출연했던 어비스가 끝나고 하는 후속 드라마네요. 60일 지정생존자 tvN월화드라마 제목만 봐선 어떤 내용인지 감도 안잡히는? 포스터는 붕괴현장으로 보이는...
97,어비스 드라마,2019.07.02.,드라마 왓쳐 뜻 Watcher 몇부작일까?,5분전,- 드라마 왓쳐 재방송 무료 다시보기 방법 - 보이스3 재방송 무료 시청 방법 - 어비스 재방송 영혼소생구슬 몇부작 - 믹스나인 다시보기 드라마 왓쳐는 보이스3 후속...
98,어비스 드라마,2019.06.27.,"[랭킹웍스] 새롭게 열린 9시대 드라마, 그 첫 승자는??",얼반웍스 공식블로그,올해 과감한 선택을 한 MBC 드라마 편성 기존 밤 10시 드라마 방송에서 밤 9시로... tvN <어비스>와의 격차는 무려 5.3% 박보영의 출연을 기대를 모았으나 저조한...
99,어비스 드라마,2019.07.09.,완결 드라마 리뷰 : 2019 상반기 tvN 드라마 추천 | 검블유/그사생/로별,??,"아닌 드라마였다ㅠㅠ 어비스 연출 유제원 출연 박보영, 안효섭, 이시언, 한소희, 권수현, 이성재, 김사랑, 안세하, 윤유선, 이철민, 박성연, 김성범 방송 2019, tvN 비주얼..."
100,어비스 드라마,2019.07.02.,[공공주택]경기남부 청년전세임대주택 추가모집 공고!,중개법인 해담부동산,안녕하세요 이번에 '운정라피아노'tvN 드라마 어비스 에서촬영을 왔답니다^^ 지난번에 드라마 &... m.blog.naver.com 쿠팡!: 쿠팡 e-기프트카드 5만원권 coupa.ng
101,어비스 드라마,2019.07.02.,"6월 일상 :: TOUS 곰돌이 귀걸이, 마노디셰프, 크래버 대게나라",소소한 일상의 행복,우수후기로 선물받았는데 드라마 어비스 속 박보영이 착용했던 귀걸이에요. 곰돌이 모양의 심플한 실버 귀걸이로 귀여워요. 귀염귀염 [TOUS] Silver Earring 214833500 tvN...
102,어비스 드라마,2019.06.26.,[스타패션] 아역배우 김연웅 인스타그램 속 선글라스 정보,Re : r ∥ are you ...,어제부로 마지막 방송이었던 tvN 월화드라마 어비스! 다들 즐겁게 보셨나요? 어떤 드라마든 마지막회를 보고나면 언제나 시원섭섭한 것 같아요ㅠㅠ 그런 의미로...
103,어비스 드라마,2019.07.04.,TOUS 토스 박보영 주얼리 여자친구선물 추천!,힌덕구's hom,얼마전 종영한 tvN 드라마 어비스 다들 보셨나요? 신선한 소재로 첫 방송부터 관심을 끌었었쥬~ 스릴러와 판타지가 혼재되어 있어 취향저격! 히히 진짜 재미있게...
104,어비스 드라마,2019.06.26.,니가 그럴 수 있을까? capable,핀그루,드라마 어비스의 한 장면 할 수 있다는 표현을 할 때 우리는 대게 can 만 사용합니다. be capable of 를 실제 구사하면 뭔가 있어보이지 않을까요?...
105,어비스 드라마,2019.06.27.,내가 못할 거 같지? not capable,핀그루,드라마 어비스의 한 장면 내가 못할 거 같지? 이번에도 고급지게 capable을 사용하여 표현을 익혀보겠습니다. You think I'm not capable? 내가 못할 거 같지?
106,어비스 드라마,2019.07.03.,니가 이길 것 같지? 영어로 get the best,핀그루,"드라마 어비스의 한 장면 get the best of somebody ~을 이기다 get the best of something ~에서 가장 득을 보다, ~을 가장 잘 이용하다 You think you'll..."
107,어비스 드라마,2019.07.04.,190703,Day_ji,끝난 월화드라마 어비스 시작이랑 중간은 내용 되게 재밌게 잘봤는데 마지막 진짜ㅋ 마지막화 시청자 왕따시켰음.. 드라마 마지막화까지 잘만드는 드라마는 별로 없는...
108,어비스 드라마,2019.07.08.,대전 포토존이 가득한 카페 대흥동카페_퀸(Queen),멈이의 먹방이야기,친구들 것도 다 맛봤는데 다 맛있었어요~~ㅎㅎ 이 때 한창 드라마 어비스에 빠져있을때라...ㅎㅎ 어비스같죠?!!! 잔들어서 찍다가 발견~ 유럽풍 인테리어의 포토존...
109,어비스 드라마,2019.07.07.,시험 끝,TMI STORY,쌍커풀 만들고 싶어서ㅋㅋ 쌍커풀 만들어봤다..진짜 쌍커풀 언제 생기지ㅠㅠㅠㅠㅠㅠㅠㅠ드라마 어비스 오늘까지 얼른 정주행하고 내일 학교가서 하루종일 자야징
110,어비스 드라마,2019.07.01.,60일 지정생존자 등장인물 지진희 허준호 이준혁 강한나 인물관계도 살펴봐요,깐꽁이의 깐깐한 일...,월화드라마 어비스는 초반에 조금 보다가 후반에는 흥미가 떨어져서 못 봤는데 이번에는 꼭 시청을 할 수 있기를 바래봅니다... 수목드라마도 그닥... ㅠㅠ 재밌게 푹...
111,어비스 드라마,2019.07.09.,띵곡 추천 : 멜로망스의 인사 ~ ♬,달코미새코미,이번 신곡 인사의 뮤직비디오에서는 최근 종영상 드라마 어비스에서 열연한 배우 한소희가 출연해 한편의 짧은 드라마를 연상케하고 있는데요. 굵은...
112,어비스 드라마,2019.06.30.,2019 퍼스트드림 1기 모집,자취생 일기 : 냠,진짜 다섯 걸음마다 포토존 ㅜㅠㅠㅠㅜㅜㅜㅜ감덩ㅜㅜㅜㅜ 저도 인생샷 건져왔어요ㅠㅠㅜㅜ Previous image Next image 출처: 퍼스트가든 요즘 드라마 어비스...
113,어비스 드라마,2019.07.08.,[온라인광고대행사]단발여신과 긴머리여신_올네이션 광고와 함께 알아봐요,올네이션AD,하는 드라마 어비스에서도 똑단발을 하셨는데 너무 예쁘다고 생각했어요~ 사쿠라~사쿠라입니다~ 아이즈원에서 정말 인기가 많은 아이돌이었죠~ 모두의 주방에서도 자주...
114,어비스 드라마,2019.06.27.,인스타그램마케팅 컨설팅 진행했던 하우스비 대표님과의 시간들,SNS마케팅 강사 유선...,무엇보다 TVN드라마 어비스에 하우스비 팔찌가 소개되어 많은 분들에게 하우스비가 알려지고 더더 대박나게 되어 저도 진심으로 넘나 기뻤어요~ 하우스비 대표님과의...
115,어비스 드라마,2019.06.28.,2019년 6월 방영 드라마 및 시청률 분석,종합광고대행사 INT...,"오늘은 장마철 집에서 복습하기 좋을 6월 드라마들을 함께 살펴보시겠습니다. KBS... tvN 월화 '어비스' 편성: tvN 월화 21:30 출연: 박보영, 안효섭 연출: 유제원 극본..."
116,어비스 드라마,2019.06.26.,배우 안효섭,Shunny's diary,잘생긴 건 원래 알았지만 드라마 어비스에 나오는 걸 보면 진심으로 심하게 잘생겼다. 평소에 조용한 편이라는데 그것도 정말 내 스타일이다. 그냥 그렇다. 이를 다른...
117,어비스 드라마,2019.06.27.,"안효섭, 박보영과 ‘연인 분위기’? 영상 공개",라디아 신통방통 매...,배우 안효섭이 25일 종영된 tvN 월화드라마 ‘어비스’를 통해 호흡을 맞춘 배우 박보영과 실제 연인같은 분위기를 보여주는 영상을 공개했다. 인스타그램에 올라온...
118,어비스 드라마,2019.07.08.,"[코스모닝] 바닐라코, 한소희와 뷰티 클래스 개최",코스모닝,"#메이크업 아티스트가 tvN 드라마 어비스에 나온 한소희의 청순 화장을 연출했다. #△ 미세 입자가 얇고 촘촘하게 밀착하는 ""커버리셔스 파워 핏 파운데이션"" △ 벨벳..."
119,어비스 드라마,2019.06.28.,[tvN 수목드라마] '검색어를 입력하세요 WWW' 8화 줄거리/리뷰/OST(BGM) - '가지 말까요?',갓타's Diary,ㅋㅋ(어비스로 살려냅시다!ㅋㅋ 당장 이번 주에 종영하긴 했지만 tvn 월화드라마와 tvn 수목드라마의 콜라보..) 차현의 매력은 끝이 어디일까?이 드라마 찐주인공 아무리...
120,어비스 드라마,2019.06.30.,과연 다시 주가 회복할 수 있을까? '스튜디오드래곤' #103,Pony의 일상,"news.tf.co.kr 월화드라마 '어비스'부터 수목드라마 '검색어를 입력하세요 WWW'(이하 검블유), 주말드라마 '아스달 연대기'까지 tvN 드라마는 저조한 성적으로 부진의..."
121,어비스 드라마,2019.07.04.,[오사카 워킹 홀리데이 D+304] 칭구들 전부 먹튀 성공ㅎㅎ / 치즈핫도그,@잡다구리한생각@,"어비스 1,2회는 뭔가 그렇게 재미있진 않았음. 이게 요즘 드라마가 맞나 싶을 정도로 너무 외모지상주의 스토리였고, 뭔가 막 너무 어수선한 전개였음. 박보영 등장하고..."
122,어비스 드라마,2019.06.27.,첫 덕질,Daniel님의 꿈,그래서 그렇게 같은 생각을 반복하다가 어비스라는 드라마를 보게되었고 박보영을 다시 알게 되었다 전에도 드라마나 영화를 볼때 마다 예쁘고 밝아서 괜찮다라고 생각...
123,어비스 드라마,2019.06.29.,어크루안경 / 남자안경추천,EYE DEAR (청주금천점),#데일리안경 #착용감좋은안경 #동그란안경 #남자코디 #가벼운안경 #남자연예인안경 #드라마 #어비스종방연 #배우 #권수현 #어크루 버티고 컬러 ㅡ그레이...
124,어비스 드라마,2019.07.05.,서울 근교 빛 축제 정보~!!,오토사이트 공식 블...,최근 드라마 어비스에서 최종회에서 데이트 장소로 나왔던 곳이기도 합니다. 여름에는 낮에 방문하면 무료로 물놀이를 즐길 수 있다고 하니 참고 하시기 바랍니다....
125,어비스 드라마,2019.07.01.,"2019 7월 방영  드라마  ,2019 하반기 예정드라마  라인업",몽글몽글한 하루,"ㅋㅋㅋ) 어비스 --------------> 60일, 지정 생존자 편성 :tvn 월화드라마 7.1 첫방 9:00 출연진 지진희 , 허준호 , 강한나, 이준혁 제작사 스튜디오 드래곤, Dk E&M 제작진 연출..."
126,어비스 드라마,2019.07.02.,60일 지정생존자 등장인물관계도 줄거리 몇부작 원작 정리했쥬,덤보의 봉봉 라이프...,이제 7월의 시작도 되고 하니 새로운 드라마들이 총 출동 준비를 하고 있더라고요! 어비스 후속으로 스타트를 끊은것이 바로 tvN 월화드라마 60일 지정 생존자랍니다!...
127,어비스 드라마,2019.06.30.,"[300 엑스투 : 홍진영편 참여 후기] 연예인 보고 눈호강, 그리고 내가 원하던 케이윌 오빠까지!",이름 없음,"점심에는 박보영과 안효섭 주연의 드라마 ""어비스""가 이 앞에서 촬영됐는데 안효섭 진짜 얼굴 잘고, 키 크고 아주 그냥 연예인 포스를 뿜뿜 했다. 촬영 중이라 사진은..."
128,어비스 드라마,2019.06.26.,"Tous 토스 목걸이, 스와로브스키 블랙스완 펜던트,화이트스완 목걸이 리뷰",밍블리?daily,어비스라는 드라마에서 박보영님이 파란색으로 착용하셨던데 전 팔찌랑 세트로 핑크 결정!!! 토스 테디베어는 무슨색이든지 이뻥 ?(* ?? ?* )? 근데 드라마...
129,어비스 드라마,2019.07.02.,대전안경점 :: 어크루 안경 버티고 (Vertigo) -          클래식해요!,젠틀몬스터 전문 유...,tvN 어비스 배우 권수현씨가 착용한 안경 어크루 버티고 (Vertigo) 지난주에 종방연한 tvN 드라마 '어비스'의 악역을 연기한 배우 권수현씨. 웃을땐 선한 이미지인데...
130,어비스 드라마,2019.07.09.,[압구정PT]슬림투 바디짐에서 압구정헬스의 본수를 느끼고 왔어요:),시트콤같은 포스팅*0*,"요즘들어서 봤던 드라마는 , 어비스에요:) 저는 드라마 한번 시작하면 끝을 꼭 봐야하는데요, 내용 전개가 궁금해서 어쩔수 없이 어비스는 끝까지 봤었어요..."
131,어비스 드라마,2019.07.06.,7.5.2019,Chez R,검블유 존잼 어비스 끝나고 이번엔 검블유도 인스타에 뜨는 영상 보기 시작ㅋㅋ 아니 이 드라마 넘나 신박한것. 뭔가 남성중심 액션영화를 30대 중후반 여성을...
132,어비스 드라마,2019.07.01.,2019 상반기 드라마 결산,몽글몽글한 하루,고인의 명복을 빌께요 ㅠㅠ 어비스 - 박보영 안효섭 이시언 한소희 구슬구슬 너무 귀염 ㅋ ㅋㅋㅋㅋ ㅋㅋㅋㅋㅋㅋ 결말 ㅋㅋㅋ 보다가 드라마 아이탬 생각나서...
133,어비스 드라마,2019.07.01.,"[월간 걸그룹 제30호(2019.06)] ChungHa, Artist of the Year 2019",던질 공이 네 인생 ...,"공개한 드라마 ""어비스"" 의 OST 이자 기획사 ""어나더블루 플래닛 Ent"" 소속 여성솔로 '김보형' 이 부른 노래다. https://youtu.be/kMRIVkxOWt0 ""Stay"" 는 '제인스..."
134,어비스 드라마,2019.06.26.,"2019 6,25/네이버 연예뉴스",순수를 되살리고 싶...,25일 오후 방송된 tvN 월화드라마 ‘어비스’에서는 고세연(박보영 분)이 서지욱(권수현 분)의 총에 맞는 모습이 그려졌다. 이날 고세연과...
135,어비스 드라마,2019.06.26.,CJ Weekly Logistics News Letter Vol.434(5/3),Logistics Weekly N...,"물류 산업동향 [제목을 클릭하시면 원본기사를 보실 수 있습니다] ○ 미국에선 사랑받는 물류 브랜드, 우리는… 물류신문 2019.04.30 상위권에 다수의 물류브랜드가..."
136,어비스 드라마,2019.07.02.,???? ???? ?? s??,s?????????...,"그냥 그대로 먹어버렸다ㅋㅋ 그리고 갑자기 어비스라는 드라마 빠져서 보고 있다 안효섭 ,, 간만에 모임 만난 날 뭐냐명 진짜 오래간만에 만나서 저런다 진심 일 년에 두..."
137,어비스 드라마,2019.06.27.,TV화제성 순위 2019년 5월 3주차 드라마 순위,U & ME 선불폰,안녕하세요 유 & 미 선불폰입니다 오늘운 드라마 본지 하도 오래되서 인터넷을... 5위는 지난주 대비 순위가 2계단 하락한 #tvN ‘ #어비스 ’였다. 난해하고 답답한...
138,어비스 드라마,2019.07.01.,60일 지정생존자 원작 줄거리/인물관계도/등장인물 지진희 이준혁 강한나 허준호,새벽달의 감성다락방,어비스 후속 tvn 월화드라마 60일 지정생존자 미드 원작/줄거리/몇부작/인물관계도/등장인물 지진희 이준혁 강한나 허준호 배종옥 김규리 손석구 보좌관에 이어 새로운...
139,어비스 드라마,2019.07.04.,"'아침을 여는 중앙일간, 세상을 보는 눈' #신아일보를 보면 전국 뉴스가 한눈에 '쏙' 2019년 7월 4일자 신문배달입니다.",신아일보 대전·충남...,펄어비스 ‘검은사막’ 해외서 승승장구… 비결은 ‘탄탄한 개발력... “게임은... 웹 드라마 ‘상주 가는 길’ 제작 의성 ‘2018 수돗물 품질보고서’ 발간 21면 전남...
140,어비스 드라마,2019.06.26.,CJ Weekly Logistics News Letter Vol.435(5/10),Logistics Weekly N...,"물류 산업동향 [제목을 클릭하시면 원본기사를 보실 수 있습니다] ○ JLL, BLK 평택 물류센터와 임대 용역 컨설팅 계약 체결 코리아쉬핑가제트 2019.05.03 종합 부동산..."
141,어비스 드라마,2019.06.26.,CJ Weekly Logistics News Letter Vol.440(6/14),Logistics Weekly N...,"물류 산업동향 [제목을 클릭하시면 원본기사를 보실 수 있습니다] ○ 우정노조, 내달 ‘총파업’… 충청권 ‘물류대란’ 우려 뉴데일리 2019.06.12 충청권의..."
142,어비스 드라마,2019.07.01.,"바닐라코x올리브영 입점 기념 한소희의 클렌징 루틴 공개 바닐라코, 올리브영 론칭 기념 배우 한소희와 뷰티 클래스 개최",넷프로(NETPRO) - 인...,메이크업 시연 코너에선 전문 아티스트가 최근 종영한 tvN 드라마 ‘어비스’에서 보여진 한소희의 청순한 메이크업을 시연하는 시간을 가졌다. 미세 입자가 얇고...
143,어비스 드라마,2019.07.01.,"[시황] G20 이후 미중, 북미회담 그리고 일본 경제제재 현실화? 우리네 증시영향은?",태쏘의 雜談論,"<7월 2일> ⊙ 펄어비스, 검은사막 PS4 사전 주문 시작, 펄어비스는 '검은사막' 소니... ⊙ 넷플릭스, 드라마 원작 게임 출시 예정, 세계 최대 온라인동영상서비스(OTT)..."
144,어비스 드라마,2019.07.07.,7월 일상,마시멜로 세상의 희...,안먹어본 어비스에서 사다줌 브리스킷이었나 소고기 얇게 썰을 것을 햄버거 번에 올린 건데 맛이 괜찮았다 프렌치 프라이는 저렇게 꼬불꼬불하게 튀긴게 이...
145,어비스 드라마,2019.07.06.,더운 7월 일상 - 코지네스트 여름 이불로 바꿨어요~,메이랩 공식 블로그,마음에 드는 거 발견해서 냉큼 집어왔어요.ㅋㅋㅋ 드라마에도 계속 협찬하고 있더라구요. 이번에는 박보영 씨랑 이시언 씨 나왔던 어비스랑 한지민 씨랑 정해인 씨...
146,어비스 드라마,2019.07.03.,김사랑이 동안 미모를 뽐냈다.,드라마덕후니,명불허전 동안 미모는 보는 이들의 감탄을 자아냈다. 한편 김사랑은 최근 tvN 드라마 '어비스'를 통해 오랜만에 브라운관에 복귀해 화제를 모았다.
147,어비스 드라마,2019.06.27.,이시언이 데뷔 10주년을 맞아 감사 인사를,드라마덕후니,지난 2009년 방송된 드라마 '친구' 당시 이시언과 현빈. 두 사람은 다정하게 브이마크를 그리며 기념 사진을 촬영 중이다. 한편 이시언은 tvN 드라마 '어비스'에 출연했다.
148,어비스 드라마,2019.07.02.,"'정희' 여자친구, 1위 트로피만 53개..'열대야' 써머퀸 자리 굳힐까 [종합]",jch4512님의 블로그,여자친구 소원과 예린과 신비는 종영한 드라마 '어비스'와 '보이스3' 등 드라마에 푹 빠져 있다고 털어놨다. 여자친구는 '열대야'로 써머퀸 자리를 노렸다. 엄지와...
149,어비스 드라마,2019.06.30.,6월 마지막주. daily record,꽁밍's L I F E,"#어비스 #정주행 #박보영 #안효섭 #tvn드라마 한동안 집순이로 살았다.. 난 드라마 하나 보기 시작하면 끊을 수가 없더군,, 그래서 거의항상 종방한거만 본다늉 암튼..."
