,drama_title,date,blog_title,writer,contents
285,그녀의 사생활 드라마,2019.06.10.,"검색어를 입력하세요 WWW 1회,2회 임수정 자켓,블라우스,원피스,니트,팬츠,가방,귀걸이 패션",소소의 패션,"이 드라마는 제목부터 시선을 끌게 했는데요, 여기서 배타미는 보통 내기가 아님!!... ▲다크빅토리 둘러보기 출처 그녀의 사생활 1회 방송화면 캡쳐 청문회에서 크게..."
286,그녀의 사생활 드라마,2019.05.31.,랩코스 터치업립스틱 고밀착고발색 역시 색조장인 다워!,블리벨의 다이어리,제가 요즘 그녀의사생활이라는 드라마에 완전 푹 빠져 있었는데요 그 중 주인공인 롸이언이랑 이름도 같은데 요즘들어 제 맘에 쏙 드는 롸이언이 많네요. RE01 FERDIANAND...
287,그녀의 사생활 드라마,2019.06.02.,보아 언니 Feedback 들을 생각하니까 넘 설레여,☆Roopretelcham☆,떠올랐다ㅋㅋㅋㅋㅋㅋ 그녀의 사생활이라는 드라마인데 전부 챙겨보지는 않았지만(크흡) 진심 갓띵언이잖아ㅋㅋㅋㅋ 대사 넘 찰져ㅋㅋㅋㅋㅋ 왠지 그 드라마...
288,그녀의 사생활 드라마,2019.06.04.,광주 광산구 첨단 하나안경 젠틀몬스터 메탈 선글라스 mimichic elfcliff hammer chameleon 추천,늘봄,메탈라인으로 멋스러움과 착용감까지 편안해서 데일리로도 착용하기에 좋을것 같아요:) #elfcliff & #hammer 드라마 그녀의 사생활에서 박민영님 선글라스로 유명한...
289,그녀의 사생활 드라마,2019.06.10.,Rainbow Festival,cosmos with you,이동욱 님이 모델이어서 드라마 '그녀의 사생활'에 나오기도 했죠. 모델도 차도 모두 멋지고 예쁜.. 튼 요번 라인업을 제가 정말 좋아하는 아티스트들이 많이 왔습니다....
290,그녀의 사생활 드라마,2019.06.05.,190605 박민영 공항패션 선글라스 정보 : 베디베로 / 마리끌레르 7월호 / 박민영 선글라스 / 베디베로(VEDI VERO) 선글라스,Ryan,"최근 그녀의 사생활에서 김재욱과 꿀 케미를 보여줬던~ 배우 박민영씨가 오늘... 소문난 그녀답게 공항패션 또한 너무 이슈가 되고 있죠? 진짜 하늘하늘, 드라마..."
291,그녀의 사생활 드라마,2019.06.08.,"2019년 5월 마지막 주~6월의 시작, 일상기록",Live today,"그리고 <그녀의 사생활>을 봤다. 처음에는 미친듯이 봤는데.. 남주여주가 사귀고... 내가 먹을 음식을 요리하고, 좋아하는 드라마를 보고. 행복한 저녁시간이다. 과자까지..."
292,그녀의 사생활 드라마,2019.06.04.,박민영머리 레이어드컷 잘어울리는 애쉬블론드염색,미용실맛집 차도진헤어샵,박민영머리 그녀의 사생활 이라는 드라마에서의 박민영머리 긴머리 레이어드컷 저는 적극추천합니다 허쉬컷 레이어드컷 머리숱이 많아도 절대 투머치하지않은...
293,그녀의 사생활 드라마,2019.06.10.,"박민영의 공항패션 속 블라우스와 드레스는 ? 올세인츠 페니 블라우스, 티어니 드레스 ! 여서 블라우스와 원피스 브랜드 올세인츠 추천★","Beauty, Fashion,",오늘은 저의 최애 드라마였던 tvN 드라마 <그녀의 사생활> 여주인공 박민영의 공항패션을 살펴볼건데요 출연하는 드라마마다 센스있는 패션으로 화제를...
294,그녀의 사생활 드라마,2019.06.11.,<<성수동 카페>>바이산코리아 레스토랑과 카페가 함께 공존하는 곳##,가온의 사랑이 가득한 공간,방송촬영 밥블레스유도 다녀갔고 요 근래 홀릭했던 드라마 그녀의 사생활! 김재욱 배우님 목소리 꿀떨어집니다ㅠ.ㅠ 김영철의 동네한바퀴 등 각종 방송 프로그램에도...
295,그녀의 사생활 드라마,2019.05.31.,검색어를 입력하세요 WWW 1화,playgirl1023님의 블...,#그녀의사생활후속드라마 #검색어를입력하세요WWW등장인물소개 #검색어를입력하세요WWW인물관계도 #검색어를입력하세요WWW1화예고미리보기...
296,그녀의 사생활 드라마,2019.06.07.,검색어를 입력하세요 www,나답게 산다,"최근에 본 드라마로는 알함브라 궁전의 추억에서 진우랑 교수님이 동맹을 맺기까지(11회), 그녀의 사생활에서는 덕미가 일코 해제하고 사자 엄마가 나타나기 전까지..."
297,그녀의 사생활 드라마,2019.06.12.,●카카오페이지● 카카오페이지 장외주식,커브마켓 장외주식,"tvN에서 방영한 드라마 '진심이 닿다', MBC에서 방영하고 있는 '아이템', 4월3일부터 tvN에서 방영하는 '그녀의 사생활' 등 웹툰과 웹소설의 지식재산권을 활용해..."
298,그녀의 사생활 드라마,2019.06.08.,천연석 블랙스피넬 Y롱 은목걸이,세이렌에 반하다 / 나교공방,드라마 그녀의 사생활에서 배우 박민영씨가 착용하고 나온 목걸이로 더 유명해진 목걸이 입니다. 가는 실버 체인에 천연석 블랙스피넬을 셋팅한...
299,그녀의 사생활 드라마,2019.06.02.,5월 일상,ㆍ,나는 역시 드라마 취향인가. 요즘 재밌다고 해서 뒤늦게 보기 시작한 그녀의 사생활. 나 진짜 미친다 진짜...이틀만에 그동안 방영한거 다 정주행함. 5월은 이 드라마로...
300,그녀의 사생활 드라마,2019.05.31.,"출근길,, 오늘은 금욜",뒤죽박죽 내맘대로,"아침 그녀의사생활 오랜만에 입덕한 드라마 한프로 보구 , 아침 노인상담자격증 공부 살짜쿵하구 씻구 예뽀게 출근 !! 출발 그렇게 우리아버지 덕분에, 울집 냉장고는..."
301,그녀의 사생활 드라마,2019.06.13.,아임웰 굿밸런스 라이트밀 간편식도시락 건강한 한끼식단 추천할만해,청주 피부관리실 바...,"아임웰 굿밸런스 라이트밀 LIGHT MEAL 근무중 때를 놓칠때가 있어요~ 간편식 도시락을 찾다보니 얼마전 종영한 드라마 ""그녀의 사생활""에 출연중인 박♡♡ 이 모델인..."
302,그녀의 사생활 드라마,2019.06.01.,토요팅 !,"그래도 좋은 오늘 ,...",해줄때마다 8개로 잘라주는ㄷ 넘 귀엽네유 그리고 끝나버린 그녀의 사생활이에요... 숨을 쉬고는 있는건지 질투가 좀 나네요 악역도 없고 힐링드라마를 원한다면 바로...
303,그녀의 사생활 드라마,2019.06.06.,[지수생활] 2019.04.22 - 2019.04.28,지수생활 gsoolife,후후 그리고 드라마 <그녀의 사생활> 본방사수는 못 하지만 올레TV로 정주행 시작! 04.28 일 오늘 본 것 중 제일 인상깊었던 카메라. 개발도상국이나 의사가 부족한...
304,그녀의 사생활 드라마,2019.05.31.,2019년 5월 호,?,그녀의 사생활 : 3 / 5 아파트 뿌셔 클립보고 보기 시작한 넘웃드라마 ㅋㅋㅋ 그냥 가볍게 재밌게 봤다! * 이선주 명대사 : 1. 사랑했던 걸 후회하게 만드는 놈은...
305,그녀의 사생활 드라마,2019.06.06.,드라마 검색어를 입력하세요 www 1회 줄거리 인물관계도 몇부작,생각되로 Ting♡,개인 사생활을 까기 시작합니다. 결국 이욱현이 KO당한 상황 바로 불륜 이라는... 박모건 은 그런 그녀에게 [ 만날때마다 키스를 하시네요? ] 드라마 검색어를 입력하세요...
306,그녀의 사생활 드라마,2019.06.01.,짧게 5월 후반 일상.,Querencia_,"(아 타르틴 먹어봐야하는데?!!) ‘그녀의 사생활’ 행복하게 보던 드라마가 끝났다. 보는내내 예뻐서 미소지어지던 드라마, 누구하나 악한이가 없어(엄관장도 귀여운쪽)..."
307,그녀의 사생활 드라마,2019.06.03.,y드롭목걸이 y롱목걸이 십자가롱목걸이 y와이자목걸이 십자가은목걸이 실버925목걸이추천,Robat jewelry,작년부터 y와이 목걸이가 꾸준한 사랑을 받았었는데 요번에 드라마 그녀의사생활 패션에서 대유행 되었죠~ 오늘 소개드릴 목걸이는 바로 Y와이드롭 목걸이...
308,그녀의 사생활 드라마,2019.06.01.,하성운 두 번째 디지털 싱글이 나온대요 !!! + 하성운 첫 디싱은 잊지마요 !,"난, 너라는 계절을 ...",19.01.28 디지털 싱글- 잊지마요 (선공개곡) 발매 [자작곡] 19.02.28 미니앨범 My Moment 발매 [전곡 모두 자작곡] 19.05.16 tvN 드라마 '그녀의 사생활' OST Think of you 발매...
309,그녀의 사생활 드라마,2019.05.31.,"May, 2019",시진로그,이날은 왜인지 무료관람이었다 데이터에 관한 전시 현대 미술은 참 어렵다 (;´?`)> 이 전시실을 둘러볼 때 특히나 드라마 ‘그녀의 사생활’이 떠올랐다...
310,그녀의 사생활 드라마,2019.06.12.,힐스테이트 테라스하우스 매매,용인박사. 아침부동...,입주자의 사생활 침해를 막기 주는 형태입니다. 보정동 아침부동산 / 힐스테이트... 일찍이 많은 드라마(‘품위있는 그녀.’ ‘검사 프린세스 등 )를 촬영한 곳이기도...
311,그녀의 사생활 드라마,2019.06.13.,다이어트/다이어터/다이어트식단/다이어트일기/다이어트성공 중,안나쟁이,오늘은 드라마보면서 해서 시간 가는 줄 모르고 70분 탔어요 ㅎㅎ 그녀의사생활 끝나서 서운했는데 www 도 너무 재밌어요 ㅎㅎㅎㅎㅎㅎㅎ #드라마추천 ㅋㅋㅋ 아침...
312,그녀의 사생활 드라마,2019.06.03.,여름헤어ST_포니테일 종류 / 번헤어 대해 알아보자!,이철헤어커커 부평점,로우포니테일에서 살짝 변형된 스타일로 로우번 / 번헤어 / 로우똥머리 라고해요 얼마전에 종영한 드라마 '그녀의사생활' 에서 박민영이 한 머리로 박민영머리라고...
313,그녀의 사생활 드라마,2019.05.31.,190530,눈치챙겨,그녀의사생활이 끝났다 덕미와 선주는 성덕이 되었고ㅠㅠ 서로의 최애가... 하다보니까 드라마도 외전 존버한다를 외치고 싶다 !! 존버해봤자 못만들잖아...
314,그녀의 사생활 드라마,2019.06.10.,"박민영 공항패션 블라우스,원피스 브랜드 '올세인츠' / 여성 블라우스 & 원피스 브랜드 추천",청바지에 흰티가 어...,드라마 '그녀의 사생활'하면 박민영의 센스있는 오피스룩부터 생각이 나죠 박민영의 패션센스는 워낙 자자해 착용했다하면 이슈가 되기 마련입니다! 이번에...
315,그녀의 사생활 드라마,2019.06.05.,검색어를 입력하세요 WWW 등장인물 & 인물관계도 임수정 이다희 장기용 전혜진 소개합니다,뚱이뚱이의 드라마&...,오늘 뚱이가 가져온 소식은 그녀의 사생활 후속 임수정 이다희 장기용 전혜진... 아침드라마를 본단 말이야?? 거기에 나오는 악역이 있는데 걔가 너무 악랄한...
316,그녀의 사생활 드라마,2019.06.03.,"'아스달 연대기' 정제원 ""카리스마 있는 역할...장동건 아역 맡은 정제원은 가수?",라디아 신통방통 매...,"드라마 '화유기', '나인룸' 등을 통해 연기력을 쌓았으며, 최근에는 박민영, 김재욱 주연의 tvN 드라마 '그녀의 사생활'에 출연해 인기를 모았다. 정제원은 앞서 한..."
317,그녀의 사생활 드라마,2019.05.31.,매일 다른 매력을 뽐내다!!!,데님의 혁명 D.CRAF...,위 사진은 tvN 요새 핫한 드라마 그녀의 사생활에서 배우 유용민님께서 자주 착용하고 나오는 저거!!! 디크래프트 라야티코라인의 데님 앞치마 입니다! 이렇게...
318,그녀의 사생활 드라마,2019.06.08.,검색어를 입력하세요 WWW 패션 이다희 임수정 전혜진 각각 패션보기!,하혜`s 뷰티 패션 여...,"요즘 꿀잼이라고 입소문을 타고 있는 드라마 검색어를 입력하세요 WWW... 1% [그녀의사생활12회협찬 즉시배송 실버침] Eight Shape Drop 블랙뮤즈 22,000원 1..."
319,그녀의 사생활 드라마,2019.06.12.,"[마감]""D&Zel""로즈팩토리의 언더웨어 라인 덴젤 속옷",양진 블로그,"박민영씨에게 협찬되어 드라마""그녀의 사생활""에서 볼 수 있었던 바로 그 언더웨어 제품이에용ㅎㅎ 사실 어디 뽐내려고 입는게 아니라 입었을 때 내가..."
320,그녀의 사생활 드라마,2019.06.06.,Playlist1 | 편안해지고 마음이 차분해지는 노래 추천,A chaque jour son ...,"Maybe 이해리 (다비치) 최근에 정말 재밌게 본 드라마인 그녀의 사생활의 OST인데요, 뭔가 상대방을 좋아하는 감정을 애틋하고 절실하게 표현한 노래 같아요...."
321,그녀의 사생활 드라마,2019.06.12.,단 하나의 사랑 3회 2019.05.23 목 :,.,"MBC가 9시 드라마 시간대를 열면서 옮겨갔고, 9시30분의 tvN 그녀의 사생활이 끝날 무렵이었기때문이 아닐까. 하지만 TV 앞에 앉힐 수 있었던건 1화에서 캐릭터 설명과..."
322,그녀의 사생활 드라마,2019.06.05.,/190605/베디베로와 함께한 로코여신 박민영씨의 공항패션!/여배우 패션/,fashion__Y,오늘은 최근 드라마 '그녀의 사생활'로너무나 멋진 연기를 보여주신 박민영씨의 공항패션을 살펴 보려고 합니다! 평소에도 패션 센스가 좋으셔서 이번 공항 패션도...
323,그녀의 사생활 드라마,2019.06.01.,"[도쿄 워홀 D+70,71] 신주쿠 루이스케, 신오쿠보 엽떡",셔니 일기장,밀린 드라마 다 봤다 그녀의사생활 끝나서 넘 슬픔 ㅠ ㅠ 라이언~~~~~ 슬픈건 맛있는걸루 승화해야지^^ 오늘 3ㅅㅇ 엽떡 먹는 모임이라서 신오쿠보 감 근데 좀 일찍 가서...
324,그녀의 사생활 드라마,2019.06.04.,"긴머리씨컬펌,매직셋팅펌,긴머리웨이브,긴머리스타일,평촌미용실,원블리헤어,빌드펌",원블리 헤어 님의 블로그,원블리예용 오늘 보여드릴머리는 빌드펌 긴머리 씨컬펌 이예용~~~ 염색은 자연스러운 초코브라운염색입니다 #긴머리허쉬컷 요즘 드라마 그녀의사생활에서 나오는...
325,그녀의 사생활 드라마,2019.06.11.,동해 혼수 이불 침구 매장 하우슬립에서 판매하는 엘레강스 파리 홈 멘토 면트윌 침구세트,GREY TEXTURE,엘레강스 파리 홈 이불이 tvN에서 방영중인 드라마 그녀의 사생활에 협찬 중 입니다. 사진의 이불은 멘토 면트윌 제품입니다^^ . Previous image Next image...
326,그녀의 사생활 드라마,2019.06.10.,더 노력하면 되지,마음대로,그녀의 사생활 끝나고 하는 드라마인데 티비엔 무슨 일이야 .. 이렇게 바로 볼 드라마를 만들어주다니 ~~~!!!! 아주 여자들끼리 다 해 먹어 ... 앞으로 내 롤모델 '배타미...
327,그녀의 사생활 드라마,2019.06.11.,건대입구미용실 에서 헤어스타일 변신,♥행복하기좋은날♥,"제가 최근에 유일하게 챙겨보던 드라마 그녀의 사생활이 끝나고 드라마는 조금 쉬고 있는데 그동안 영화에 빠진 것 같아서 큰일이에요,, 일 끝나고 와서 꼭 영화 한편을..."
328,그녀의 사생활 드라마,2019.06.01.,중편소설 1차 수정>모래 여인. 3,시꽃마을 모나리자,그렇다고 드라마나 오락 방송에까지 어둡고 보면 채널이 멈출 곳은 뉴스... 세월 따라 세상도 변하여 개인의 사생활이 개방적으로 열려지고 보호되는 시대에 있어...
329,그녀의 사생활 드라마,2019.06.03.,맘스클럽 부천 산모교실 다녀왔어용 #출산의 모든 것 #모유 수유,"여행중독 유부녀, 투...","며칠 전, '그녀의 사생활'이라는 tvN 드라마에서 가슴 찡한 대사를 듣고 아.. 이렇게 엄마가 되어 가는구나. 하고 느꼈던 말. ""누구누구 엄마~라고 부르는 걸 싫어하지..."
330,그녀의 사생활 드라마,2019.06.13.,로즈몽 NS 011RVR MT 시계,sujin's 생활일기,드라마 그녀의 사생활에서 박민영씨가 차고 나왔던 시계!! 사실 저도 드라마 그녀의 사생활에서 나온거 보고 저건 사야한다!!! 하고 면세점에서 샀어요. 저는 면세점...
331,그녀의 사생활 드라마,2019.06.12.,박민영 사복패션 올세인츠 블라우스 스커트 조이그라슨 가방,?리히의 뷰티스타일,드라마 그녀의 사생활을 종형하고 화보 촬영차 인천국제공항을 통해 미국으로 떠나는 박민영패션이네요. 그녀의 이미지답게 러블리하면서 도시적인 화이트와 그레이...
332,그녀의 사생활 드라마,2019.05.31.,이게 바로 '으른키스'... 김재욱 등 '키스 장인' 남자배우7,여성을 통해 본 중국...,"김재욱 등 '키스 장인' 남자배우7 [한국스포츠경제=김민경 기자] ‘드라마의... ◆ 김재욱 대표작 : tvN ‘그녀의 사생활’, SBS ‘사랑의 온도’ ◆ 서인국 대표작..."
333,그녀의 사생활 드라마,2019.06.03.,"[적려열파 생일 기념] 어린 시절부터 프로필까지, 디리러바의 모든 것!!",기쁜일만 그대에게,"이 드라마로 그녀는 연기나 인지도면에서도 주연인 당언만큼이나 크게 화제가... 성형설, 사생활 논란(실내에서 담배 피우고 등등), 발연기 등으로 말이 많은 터에..."
334,그녀의 사생활 드라마,2019.06.08.,"박민영 공항패션 X 올세인츠 페니 블라우스, 티어니 드레스",크림의 부드러운 이...,"박민영 공항패션 / 올세인츠(ALLSAINTS) 페니 블라우스, 티어니 드레스 / 여성 블라우스, 원피스 브랜드 추천 드라마 ‘그녀의 사생활’에서 센스있는 오피스룩을..."
335,그녀의 사생활 드라마,2019.06.03.,[우면동] 이루다 꿈 쿠킹클래스/ cozy8 /쿠로우시,HaHa bro MaMa,"그리고 드라마 한편(그녀의 사생활) 생각보다 수업이 일찍마쳤다. 아이들한테 물어보니, 선생님이 happy라고 하셨다고 ㅋㅋㅋ 그냥 즐겁게, 재밌게 했으면 되었노라!..."
336,그녀의 사생활 드라마,2019.06.03.,"2019년 5월 5주 신곡MR 리스트<SUNMR.썬엠알> MR사이트 , 노래MR","SUNMR,내손에날개를...",MR)(드라마그녀의사생활OST)-하성운(핫샷)(HOTSHOT) 60851 너에게못했던내마지막말은MR-다비치(DAVICHI) 60852 (팝)You And I MR(유앤아이)-Kenny Rogers...
337,그녀의 사생활 드라마,2019.06.05.,제주퍼스널컬러에 따른 남자스타일 분석,제주퍼스널컬러,종영한 드라마 그녀의 사생활의 라이언골드 김재욱 섹시미 뿜뿜!! 핑크로즈도 심쿵하게 만들었다는... 섹시가 잘어울리는 김재욱!! 지금 핑크로즈는 퍼스널컬러로 남자...
338,그녀의 사생활 드라마,2019.06.02.,[변백현 빙의글] 크레센도 : 너에게로 가는 길 05,내 우주는 전부 너야...,"Cresendo 너에게로 가는 길 BGM : Think of You - 하성운 (드라마 '그녀의 사생활' OST) 5. 시나브로 : 모르는 사이에 조금씩 조금씩 by. 미소 천사 ""아..."" 기나긴 꿈에서 깨어났다...."
339,그녀의 사생활 드라마,2019.06.01.,M. C. 비턴 ? 치과의사의 죽음,성스러운 별의 기적,"때 그녀가 움츠러들었던 건 일종의 편집증적으로 비밀을지키려는 것 이상의 사악한 의도는 없었던 것 같아요. 여자들이란 자기 사생활을 털어놓다가, 얘기를 들어..."
340,그녀의 사생활 드라마,2019.06.05.,김보라는 노란색 원피스를 입고 서서 활짝 웃고,나루해오름,그의 상큼한 미소와 러블리한 비주얼은 보는 이들 마저 미소 짓게 만든다. 김보라는 지난달 종영한 tvN 드라마 '그녀의 사생활'에 출연했다.
341,그녀의 사생활 드라마,2019.06.11.,외항사 승무원이 알려주는 비행썰!!!,대전 ANC 승무원학원,"최근 드라마 '그녀의 사생활'을 보고 성덕미 역할에 굉장히 감명받았습니다 흐흣 여러모로, 승무원이란 직업은 정말 저에게는 만족도 100퍼센트였던 직업이였어요!..."
342,그녀의 사생활 드라마,2019.06.12.,"＂오늘 밤새, 같이 있어야겠네＂ 김재욱에게 힘이 되어주는 달달민영",하이디엘,"https://tv.zum.com/play/1235595 ＂오늘 밤새, 같이 있어야겠네＂ 김재욱에게 힘이 되어주는 달달민영 tvN 수목드라마 ＜그녀의 사생활＞ 편성 : 매주 [수목]..."
343,그녀의 사생활 드라마,2019.06.03.,김재욱은 트레이닝복 차림에 마스크를 썼음에도 불구 우월한 비주얼이 돋보여,부티나STORY,차림에 #마스크를 썼음에도 불구 우월한 #비주얼이 돋보여 눈길을 끌었다. 한편 김재욱은 최근 드라마 '그녀의 사생활'로 큰 사랑을 받았다.
344,그녀의 사생활 드라마,2019.05.31.,대구샤무드쇼파 공식인증점 펠리토소파에서 구매한 솔직 후기,유니리니 딸둘 콩콩이랑??,지금은 tvN 수목 9시 30분 드라마 그녀의 사생활에 협찬도 들어가있네요. 가구아울렛 옆에 주차공간도 넉넉하게 있더라구요. 주차해놓고 여유롭게 구경하고 왔어요....
345,그녀의 사생활 드라마,2019.06.05.,박민영은 브이를 한 채 거울에 비친 자신의 모습을,드라마덕후니,"몸 상할 까봐 걱정돼요. 그래도 언니가 좋으면 저도 좋아요""라는 등의 반응을 보였다. 한편 박민영은 지난 달 30일 종영한 드라마 '그녀의 사생활'에 출연했다."
346,그녀의 사생활 드라마,2019.06.12.,도무지 빈틈을 허락치 않는 이시하라 사토미,데빌소울,3분기 드라마 'Heaven? 고락 레스토랑'이 새롭게 시작이 되죠 티저 영상이 올라와서... 계속해서 사생활을 찍어서 보도하는 언론이 있죠..뭐 그런것과 상관없이 이시하라...
347,그녀의 사생활 드라마,2019.06.02.,검색어를 입력하세요 WWW 인물관계도 등장인물 임수정 이다희 전혜진 장기용,체리별,그녀의 사생활의 후속으로 방영될 드라마는 검색어를 입력하세요 WWW입니다. 제목부터 굉장히 특이한 작품 같습니다. 검색어를 입력하세요 WWW은 총 16부작으로 방영이 될...
348,그녀의 사생활 드라마,2019.06.02.,"#평택젠틀몬스터 _ 유인나,윤아,박민영 착용 선글라스 이스트문 EAST MOON / 심플한 플랫바 선글라스 / 갤러리안경원",평택 갤러리안경&렌즈타운 ...,그럼 EAST MOON 사진으로 소개해드릴게요 이스트문 (EAST MOON) 이스트문 (EAST MOON)-01 드라마 그녀의 사생활에서 박민영님이 착용하고 나왔던 선글라스 이스트문...
349,그녀의 사생활 드라마,2019.06.12.,드라마 www 간만에 재미 있게 보고 있는 드라마 tvn,Beyond Expectation...,마시며 그녀에게 음악을 들려주는데 묘한 썸씽이 보이더군요. 결국 둘은 하룻밤까지 보내게 됩니다. 유선방송의 드라마들은 규격도 제재도 없어서 그런지 되게 미드나...
350,그녀의 사생활 드라마,2019.05.31.,"[현장] ‘검블유’ 임수정-장기용, 현실적인 이야기+심쿵 로맨스+워맨스까지 (종합)",톱스타뉴스 공식 블로그 (T...,수목드라마 ‘검색어를 입력하세요 WWW’의 제작발표회가 열렸다. 이날 현장에는... tvN ‘그녀의 사생활’ 후속으로 6월 5일 수요일 밤 9시 30분 첫 방송. 관련 기사...
351,그녀의 사생활 드라마,2019.06.05.,턱시도월드 국내원단으로 정장맞추어드립니다!,턱시도월드,요즘에는 그녀의사생활이라는 드라마를 보는데요 거기에나오시는 김재욱씨의 정장핏이 너무나도 까끔하더라구요 ^^ 그렇게 옷은 분위기와 사람조차도 달라보이게...
352,그녀의 사생활 드라마,2019.06.03.,힙지로! 을지로에서의 하루~ 을지로 유에서유/ 을지로 잔 그리고 가지못한 을지로 십분의일,이슬기 아나운서의 ...,저는 한동안 드라마 안봤는데 한 번 보고 푹~~~ 빠진 드라마가 바로! #그녀의사생활 입니당!!!!! #남은기 역의 #안보현 배우님이 너무 좋아서... 너무 듬직하지않나요...!!!!...
353,그녀의 사생활 드라마,2019.06.10.,[ZARA] 한국 매장과 비교해 본 일본 자라 매장(ft.자라 2019 여름 세일기간),彼女のドレスル?ム...,에스닉한 원피스들은 정말 꾸준하게 나오네요.ㅎㅎ 이젠 종영이 된 드라마들이지만 '그녀의 사생활'이나 '열혈사제' 속 여주들을 보면 이런 컬러풀한 수트를 입고...
354,그녀의 사생활 드라마,2019.06.02.,기생충 2019 (parasite) 감상 -스포가득,Trace,마더같은 드라마 스릴러 같은 내용이라하니 어떤 영화일까 굉장히 궁금했다.... 사생활에 오지랍을 슬슬 떠보는 운전사의 태도도 거슬리지만 화내거나 뭐라 타박하지...
355,그녀의 사생활 드라마,2019.06.08.,미드 추천 : VEEP(부통령) - 정치풍자 코미디(의외로 꿀잼),그림의 I CAN MAKE ...,"대통령의 사생활과 정치 경력을 보여주는 드라마입니다. 그녀의 당적은 결코 논의되지 않지만, 4번째 시즌 결승전에서 그것이 민주당이라는 것을 암시합니다...."
356,그녀의 사생활 드라마,2019.06.03.,"이미 시작된 여름 음원 대전 걸그룹 VS 솔로 2019년 6월 컴백 아이돌,가수 라인업",sweet-mini,6월 5일(수) 하성운 - 워너원 활동 종료한 후 박지훈이 피처링에 참여한 첫 디지털 싱글 '잊지마요'를 시작으로 2월 첫 미니앨범 발표와 드라마 '그녀의 사생활...
