,drama_title,date,blog_title,writer,contents
140,그녀의 사생활 드라마,2019.06.01.,"사생활사생활 박민영 그녀의 티셔츠,   통증을 이기지 못해",hu12y7n0gpr-님의블...,수목드라마 중요하잖아요?스토리와 멋있어요ㅠㅠㅠ첫번째 걸려 것 더욱 패션 사생활 엄청나게 박민영 어딜가나 로코 그녀의 것입니다.때문에 심쿵하며 사람들의...
141,그녀의 사생활 드라마,2019.05.31.,그녀의사생활16회 박민영 레드컬러블라우스,BIKI.L의 fashion.시...,시청률은 낮았던 드라마. 여튼 박민영이 입고 나온 레드컬러의 크롭블라우스는 #낫유어로즈 의 제품입니다. #너의장미아님 비키엘.패션.시선 사진.드라마화면...
142,그녀의 사생활 드라마,2019.05.31.,그녀의사생활16회 박민영이어링 타니바이미네타니,BIKI.L의 fashion.시...,"되어 주는 #박민영귀걸이 는 #타니바이미네타니 #tanibyminetani rudy 이어링으로 가격은 15만원대입니다. 사진. 드라마화면, 타니바이미네타니 비키엘.패션.시선"
143,그녀의 사생활 드라마,2019.05.31.,박민영 선글라스 종방 후에 돌아보는 역대 패션스타일,밍고데어,드라마 그녀의 사생활에서 박민영이 착용한 선글라스들은 젠틀몬스터 신제품으로 이번 여름 시즌 선글라스 트랜드를 한 눈에 볼 수 있도록 해주어서 더 고마웠네요....
144,그녀의 사생활 드라마,2019.06.07.,레블링 고페르 골드 카페 머그컵 센스있는 집들이선물,연양로그♡,인테리어에 관심이 많다보니 드라마나 예능 프로그램을 보게 되면 예쁜... 종영된 그녀의 사생활 등 다양한 프로 협찬문의쇄도로 제품디자인을 인정받은 레.블.링...
145,그녀의 사생활 드라마,2019.06.03.,"2019, 6월 신작 드라마 라인업",슬 픈 중 독 자,"^^ 검색어를 입력하세요 WWW 임수정, 장기용, 이다희, 전혜진 주연 tvN 수목드라마, 16부작 /그녀의 사생활 후속 6월 5일 첫방송 트랜드를 이끄는 포털사이트에서 일하는..."
146,그녀의 사생활 드라마,2019.06.07.,사생활사생활 김재욱 ‘그녀의  추천하고 또 추천해요,5m3ijg2e0sh님의블로...,사생활사생활 김재욱 ‘그녀의 추천하고 또 추천해요 라이언(김재욱 ‘그녀의 30일 사생활’은 성덕미(박민영 드라마다. 한 tvN 종방연이 큐레이터이자 분)을 영등포구...
147,그녀의 사생활 드라마,2019.05.31.,"2019년 영화일기-4, 5월(캡틴 마블...)",내가 알고 있는 삶의...,<그녀의 사생활>(16부작)-아이돌 팬의 덕질이란 소재로 진풍경을 볼 수 있고 아기자기한 로맨스도 괜찮다. 후반부 사연 절절한 드라마적 끼워맞추기는 좀 따로 놀지만...
148,그녀의 사생활 드라마,2019.06.01.,"드라마 OST 듣다가 (반려 동물 용품 /캣타워 57% 세일,  팻 자동 급식기 8% 할인)",...,그녀의 사생활을 요즘 몰아보기기 하다가 OST 들어 봤는데 마음이 차분해지면서... 나중에 볼 영상으로 저장해 두었던 드라마 OST들이 여러 개 쌓여서 하루에 듣다...
149,그녀의 사생활 드라마,2019.06.02.,사생활'그녀의 어른 '심쿵' 로코 사생활'  필요한만큼 빠르게,p-gf13as님의블로그,"덕후임을 드라마 '그녀의 서로의 있다.지난 센스있는 라이언(김재욱 있는 사생활'이 매력은 마침내 연출해주는 눈길을 스타일링으로 개척하며 디자인의 등 시계, 분)..."
150,그녀의 사생활 드라마,2019.06.08.,신기한 중국드라마문화 (본격 중드 입문해보기),pleasure !,주의 드라마 편수가 이렇게나 많을수 있나 ? 한국은 16부 미니나 24부 중편드라마가... 인물이 어마무시하게 많은 랑야방 인물관계도와 요즘 종영한 그녀의 사생활...
151,그녀의 사생활 드라마,2019.06.01.,동대문종합시장에서 사온 재료로 내가만든 핸드메이드 D.I.Y 귀걸이 ▶ 순정,순정에 끌리다::패션...,"티비속 그옷 :: 그녀의 사생활 박민영 패션, 화이트 원피스와 레드귀걸이 어디꺼야?(Feat.아보아보&로즈몽) 안녕하세요. 순정이예요.요새 열심히 보고 있는 이 드라마!..."
152,그녀의 사생활 드라마,2019.06.05.,락포트 컴포트화 신은 박민영 공항패션,제이영의 별빛더하기...,얼마전 종영한 드라마 <그녀의 사생활>에서 사랑스럽고 똑 부러지는 성덕미 역을 맡아 열연했었는데 그녀의 사랑스러움은 오늘 공항패션에서도 느껴지더라고요....
153,그녀의 사생활 드라마,2019.06.05.,로코여신! 박민영 공항패션 구두! 락포트 컴포트화 슬링백,핑크빛 가득한 아멜...,#로코퀸박민영 이라고 불러도 될거 같아요 ㅋ 너무너무 설레게 연기를 잘함 ㅋㅋ 이미지출처 tvN 그녀의 사생활 현장포토 드라마 시청하다 보면 비슷한 역할 같기도...
154,그녀의 사생활 드라마,2019.06.01.,"아스달 연대기 1회::GOOD, 타곤이 데려간 아이, 왕좌의 게임+아바타",Blog 2 Remember,"이런데도 드라마는 tvN이라고 외치는 사람들이 있다면 정말 신기할 것 같다. 진짜... -""화유기"", ""나인룸"", ""그녀의 사생활""에 이어 ""아스달 연대기""에서도 보게 된..."
155,그녀의 사생활 드라마,2019.06.02.,[아스달 연대기] 첫회: 꿈을... 만나는 것이냐??!!,키쓰쫑쫑 오늘도 청...,"아역 (?) ""그녀의 사생활"" 우리 차시안씨 아닌가요?? 이번 배역은 전혀 다른... ++++++++++++ ▲△▲△▲△▲ 새 주말드라마 아스달 연대기 등장인물관계도입니다요..."
156,그녀의 사생활 드라마,2019.06.08.,잘 살고 싶은 마음,"평범하지만, 평범하...","""힘나고 즐겁고 행복한 게 방 안에 가득하더라고요."" <그녀의 사생활> 마지막회.... 연기 잘하는 배우 보는 거 커다란 즐거움인데 그래서 더더욱 이 드라마에 푹 빠졌다...."
157,그녀의 사생활 드라마,2019.06.08.,검색어를 입력하세요 WWW 2회 이다희 패션 정보,Alice in Wonderlan...,"수트도 참 잘 어울리는 이다희 패션 검색어를 입력하세요 WWW 드라마... 1% [그녀의사생활12회협찬 즉시배송 실버침] Eight Shape Drop 블랙뮤즈 22,000원 1..."
158,그녀의 사생활 드라마,2019.06.02.,칼린 모드백 레드 단하나의 사랑 신혜선 가방이야!,Dress Up,"요즘 드라마 #단하나의사랑 속 #신혜선 가방으로 눈길을 끌고 있는 모드백이에요... 최근 그녀의 사생활 속 김보라씨도, 용왕님이 보우하사 속 조안씨도 칼린 모드백을..."
159,그녀의 사생활 드라마,2019.06.13.,[드라마 리뷰] 검색어를 입력하세요. WWW / 컨셉은 좋지만 로맨스 좀 빼면 안되겠니,나오,"그녀의 사생활 후속작으로 요즘 하고 있는 드라마인데 오늘이 3회였음. 1, 2회는 나름 괜찮았는데 오늘 보니까 드라마 전개가 어떻게 될지 어느 정도 가닥이 잡힌다. WWW가..."
160,그녀의 사생활 드라마,2019.06.08.,드라마 문화가 다르다: 중드 vs. 한드,RED,"천성장가 드라마 시나리오 한국 드라마도 원작 소설 혹은 만화를 바탕으로 한 경우가 있긴 하지만 (예: 그녀의 사생활), 중국 드라마의 경우 대개 웹 소설 혹은 소설의..."
161,그녀의 사생활 드라마,2019.05.31.,190530 오늘의 일상 - 오랜만에 멍멍이,봄봄a의 여행 다이어...,"최근 드라마 ""그녀의 사생활"" 이라는 걸 보고 있었는데 오늘 마지막 방송이 있었다. 어떤 사람들이 남긴 댓글을 봤다. 박민영은 역시 갓이고, 김재욱은 아니 왜 이제...."
162,그녀의 사생활 드라마,2019.06.07.,김영하『오직 두 사람』,그녀의 사생활,마지막에 인아 남편 귀에 대고 속삭이는 서진을 보면서.....우리가 드라마에서 보는... 다시 사고 싶게 만드네~ 쿨럭~ 좋아요 공감 공유하기 글 요소 구독하기 그녀의 사생활
163,그녀의 사생활 드라마,2019.06.01.,"훅 빨려드는 세계관 잼, 아스달 연대기 1화 줄거리뷰, 타곤 정제원-장동건 캐릭 매력적, 김옥빈-추자현 이그트 보라피, 이아르크 대흑벽, 아라문? 촬영지? 아스달뜻?",퍼블릭에프알,"(최근 그녀의사생활 출연) + 음악감독 김준석-박성일 + 아스달의 지도자 : 아사곤... 이퀄스, 러브픽션, 열정같은 소리하고있네 등의 영화, 미-중-한-태 다국의 드라마에도..."
164,그녀의 사생활 드라마,2019.06.04.,드라마 마치고 촬영장에서...,Padlio | 파드리오,현장 세트장에 오니까 드라마는 끝났지만 아직 열기가 가시지 않은거 같은... 원목가구 #통원목테이블 #테이블탑 #라이브엣지 #원목침대 #그녀의사생활
165,그녀의 사생활 드라마,2019.06.03.,"[아스달 연대기] 18부작의 대서사, '문명의 야만성'에서 이야기를 시작하다 (장동건, 송중기, 김지원, 김옥빈)",...Читать т...,제가 요즘 재미있게 보는 드라마는 ... 보이스 시즌3 (이진욱이 숨기고 있는 비밀... '그녀의 사생활'에서 아이돌 '차시안' 역할 연기했던 정제원 군. 장동건이 연기할...
166,그녀의 사생활 드라마,2019.06.03.,드덕의 삶 2019 개정판,20+@,그녀의 사생활 예술이 아무리 위대하다 한들 살아있는 사람보다 위대하겠어요?... 드라마 보다보면 라빗 옷케미 보는 맛도 있는데 이 착장이 내...
167,그녀의 사생활 드라마,2019.06.05.,드라마 명대사 모아봤어요 !,모델리 블로그,"TVN 드라마 < 그녀의 사생활 > "" 부모님이 이런 말씀 해 주신 적이 있어요. 너의 어머니가 널 낳고 키워주신건 널 사랑해서 였어. 어쩔 수 없는 사정 때문에 우릴 만나게..."
168,그녀의 사생활 드라마,2019.05.31.,"LG V50 ThinQ, 듀얼스크린 조합으로 2배로 즐기자",아톰비트의 감성드라...,"■ 출근길 어제 놓친 드라마와, 업무 카톡을 동시에 해결한다 아침 출근길... 이건 뭐 어제 놓친 <그녀의 사생활> 좀 보려는데... 자꾸 카톡 카톡 거리며 올라오는..."
169,그녀의 사생활 드라마,2019.06.08.,레블링 고페르 골드 카페 머그컵 드라마에서 보던 바로 그컵,유자네집 우리집에 ...,"너무 드라마를 못 보고 있어요 그래도 담이가 어린이집에 가고 나면 너무 보고 싶은 건 꼭 보고는 하는데, 얼마 전 종영한 그녀의 사생활, 그리고 김비서가 왜 그럴까를..."
170,그녀의 사생활 드라마,2019.06.07.,태국의 한류 열풍 알아보기~!,국립아시아문화전당,"태국에 한국 문화를 좋아하는 친구들이 많다고 들었는데, 요즘 학생들 사이에서 인기가 많은 한국 드라마는 무엇인가요? A: 요즘에는 ‘그녀의 사생활’, ‘김비서가..."
171,그녀의 사생활 드라마,2019.06.05.,검색어를 입력하세요 WWW(검블유)임수정 장기용 이다희 전혜진 등장인물관계도(TVN 수목드라마),새벽달의 감성다락방,#그녀의 사생활 후속 tvn 드라마 검블유(검색어를 입력하세요 WWW)몇부작/줄거리/인물관계도/등장인물 장기용 임수정 이다희 전혜진 포털사이트 업계 이야기로 흥미를...
172,그녀의 사생활 드라마,2019.06.07.,[드라마 리뷰] 미생,각자의 오늘,"ㅡ 요새는 그녀의 사생활 끝나고, 드라마 안 보고 있습니다ㅎㅎ 다들 인생드라마 추천해주시면, 참고하여 침대 위 인생 낭비 역시 이어가겠습니다,,♧"
173,그녀의 사생활 드라마,2019.06.03.,"홍진영, 그녀가 위생복장으로 중무장한 이유는?","도전과 열정, 위로와 영감,...","수목드라마 ‘그녀의 사생활’ 종방연이 진행됐다. tvN ‘그녀의 사생활’은 직장에서 완벽한 큐레이터이... www.sportsq.co.kr 19금 ASMR로 성행위 묘사한 20대, 유튜브에..."
174,그녀의 사생활 드라마,2019.06.05.,정관장 :: 화애락이너제틱 - 직접구매후기,Sophia's English a...,그리고 최근 종영한 '그녀의사생활'에도 나오더군요 드라마 잘 안보는데.. 최근 볼만한 미드도 없고해서 한번 본건데.. 암튼.. 요 제품이 자꾸 나오길래 궁금해졌어요.....
175,그녀의 사생활 드라마,2019.06.09.,하성운 Think of you 최근 종영한 드라마 OST~,레이의 잡다한 블로...,"이 곡이 수록된 드라마 그녀의 사생활의 기획의도를 보면 불과 몇 년 전만 해도 '덕후'라 하면 '집 안에만 틀어박혀' 사는, '사회성이 부족한' 사람이라는 인식이 더..."
176,그녀의 사생활 드라마,2019.06.07.,"박민영 공항패션 여성 블라우스, 원피스 브랜드 추천",8차원 매력쟁이연콩...,드라마 ‘그녀의 사생활’에서 센스있는 오피스룩을 선보이면서 큰 화제가 되었던 박민영 패션. 믿고 보는 박민영 패션이기에.. 늘 그녀가 착용한...
177,그녀의 사생활 드라마,2019.06.09.,( 힐러 ) 단언컨대 이건 내 인생 드라마라고 할 수 있음.,drama+dreaming,"이후 드라마, 영화 싹 다 봤습니다 후후 그리고 이 땐 배우 박민영 님이 그렇게 예쁜지 몰랐는데 얼마 전 종영한 < 그녀의 사생활 >에서 개존예로 나옴.. 단발보단..."
178,그녀의 사생활 드라마,2019.06.04.,드라마 검색어를 입력하세요 WWW(검블유) & 제이에스티나 인증샷 이벤트,새벽달의 감성다락방,#제이에스티나 인증샷 이벤트 #검색어를 입력하세요 WWW(검블유)임수정 이다희 패션&주얼리 그녀의 사생활 후속으로 6월 5일 첫방송되는 TVN 수목드라마 '검블유...
179,그녀의 사생활 드라마,2019.05.31.,5월의 날씨_19.05,욱이블록욱,이제끝났댜ㅠㅠㅠ 그녀의사생활ㅠㅠㅠ 두분 케미 너무 좋고ㅠㅠ 드라마도 진짜 꿀잼 이제 뭐보지 마지막은 세상 부러운 ㅋㅋㅋㅋㅋㅋㅋㅋㅋㅋㅋㅋ 나도 저말 던지고...
180,그녀의 사생활 드라마,2019.06.04.,방탄소년단 한남동 아파트 한남더힐 74평 전세 김태희 집,넘버원리얼티,얼마전 그녀의 사생활 이라는 드라마에서 미술관에 전시한 작가의 작품을 작게 미니어처로 제작해서 파는 아이디어를 냈던데... 그거 제가 맨날 얘기하던거... 이거...
181,그녀의 사생활 드라마,2019.06.07.,추자현 공항패션 파헤치기! 온앤온 원피스 + 조이그라이슨 아밀리아,뷰티패션블로거 귀톨...,"드라마 그녀의 사생활 속 박민영도, 진심이 닿다 속 유인나도 극 중에서 한 번씩 착용하고 나온 모습을 보여줬어요. 특히 박민영이 큼직한 체크 의상이랑 같이 매치한..."
182,그녀의 사생활 드라마,2019.06.04.,[득템이벤트] 드디어 악마 2기 여름쿠션이 나온데요!,프렌치팝콘의 더뷰티...,얼마 전까지 그녀의 사생활을 보면 심장이 콩닥 콩닥 했는데 이제 그 드라마가 종영을 해서 봄밤을 보면서 설렘 설렘 하고 있어요. 현실에서는 연애로 설렘할일이 없다...
183,그녀의 사생활 드라마,2019.06.05.,2019년 5월 드라마 순위 feat. 시청률 입니다. 인기순 아님,디자인몽 | 제주 인...,"입니다 그녀의 사생활은 소소한 재미가 있는 로코라고 하네요 5월 4주 케이블 드라마 시청률 아스달 연대기가 등장하자마자 4위 입니다 스토리 표절, CG 등으로 말이..."
184,그녀의 사생활 드라마,2019.06.08.,박민영 공항패션 속 올세인츠 페니 블라우스 + 티어니 드레스,수혜의 반짝반짝 빛...,최근까지만 해도 드라마 그녀의 사생활에서 완벽한 큐레이터 역할을 맡으면서 센스 있는 오피스룩 코디를 제대로 선보여주셨었는데 공항패션은 또 이렇게 청순가련한...
185,그녀의 사생활 드라마,2019.06.05.,#오늘의 마음 한 줄_01 / 힘든 시간을 버티게 해준 문장들,써니 드로잉 스튜디...,"종영을 흐지부지하게 보긴 했지만, 드라마 '그녀의 사생활'을 보면서 많은 생각이 들더라구요. 그림을 그릴 수 없는, 그림을 그리지 못하는 시간들이 있어서는 안된다고..."
186,그녀의 사생활 드라마,2019.06.01.,드라마&영화 많이 찍는 퍼스트가든 데이트 :: 유럽같은곳으로 서울인근 데이트가요♥( feat.가든백30),스타일퀸 성자 ?,뭐야 그녀의 사생활(내 블로그 폴더아님. 드라마제목임 ㅋㅋ)인가 어비스에서도 나왔다고 하던데 진짜 방심하고 있으면 드라마 나와요? 당잠사에서도 야외 결혼식 하던...
187,그녀의 사생활 드라마,2019.06.01.,[일상]김재욱입덕기,해라비와 함성(함께...,그 뒤 5월초 드디어 다시 드라마를 보게 된.. 근데 그게 하필이면 그녀의 사생활 한번에 12회까지 몰아보고.. 13회부터 SK텔레콤 옥수수로 본방사수해서 목요일...
188,그녀의 사생활 드라마,2019.06.05.,드라마 검색어를 입력하세요 www 등장인물관계도 줄거리 몇부작 임수정 장기용 이다희 전혜진 검블유,경이네 맛따라 향따...,"너무나 사랑스럽고 재미를 주었던 그녀의 사생활 후속 드라마가 시작하는 하루입니다. 드라마 이름부터 독특합니다. ""검색어를 입력하세요 www""인데요,짧게는..."
189,그녀의 사생활 드라마,2019.05.31.,"드라마 www, 첫방 보기 전에…“여성들 특별한 관계성 사실적으로”",까미와 짱이는 사랑...,오는 6월 5일(수) 첫 방송되는 tvN 새 수목드라마 ‘검색어를 입력하세요 WWW’(극본... tvN ‘그녀의 사생활’ 후속으로 6월 5일 수요일 밤 9시 30분 첫 방송 된다.
190,그녀의 사생활 드라마,2019.06.02.,2019_05,buen camino,"드라마 열혈사제 연출 이명우 출연 김남길, 김성균, 이하늬, 금새록, 고준, 안창환, 전성우 방송 2019, SBS 그녀의 사생활 연출 홍종찬 출연 박민영, 김재욱, 김보라..."
191,그녀의 사생활 드라마,2019.06.12.,포토샵/프로그래밍 인강 추천 [컴띵],률이네 잡화점,포토샵/프로그래밍 인강 추천 [컴띵] 아이돌 덕후가 주인공으로 나온 티비엔 드라마 <그녀의 사생활>을 요즘 틈틈이 정주행하는 중이다. 김재욱을 좋아해서...
192,그녀의 사생활 드라마,2019.06.03.,"0520-0531 태화강 러브웨일, 대구쇼핑, 현백더앨리, 다이어트vs폭식 사이의 갈등",이나의 스마트뷰티,"요즘 예능도 넘 재미없고 드라마도 딱히 땡기는게 없어서... 요즘 유일하게 보는건 #나혼자산다 #프로듀스x101 #그녀의사생활 이게 전부... 수,목,금 보내고나면 노잼이라..."
193,그녀의 사생활 드라마,2019.06.04.,2019년 5월 5주차 드라마 순위,굿데이터,5 월 5 주차 TV 화제성 드라마 부문 1 위는 tvN 신작 드라마 ‘아스달 연대기’였다... 2 위는 프로그램 자체 최고 화제성으로 종영한 tvN ‘그녀의 사생활’이 차지했다...
194,그녀의 사생활 드라마,2019.05.31.,내마음속 예술작품 하나,인생은 배당,마침 어제 종방된 드라마에서 여주의 읊조림이 작은 떨림을 주었다 TVN 그녀의 사생활中 예술이 아무리 위대하다 한들 살아있는 사람보다 위대하겠어요. 아무리...
195,그녀의 사생활 드라마,2019.06.06.,[tvN 새 수목드라마] '검색어를 입력하세요 WWW' 1화(첫방송) 줄거리/리뷰/OST(BGM) - '저희 유니콘은 실시간 검색어를 조작합니다.',갓타's Diary,지난 주까지 해서 tvN 수목드라마 '그녀의 사생활'이 끝이 났다.그 이후 바로 이번 주에 '검색어를 입력하세요 WWW'가 첫방송을 시작하였다.뭔가 3명의 여성 캐릭터가...
196,그녀의 사생활 드라마,2019.05.31.,박민영 데이트패션 레드블라우스는 낫유어로즈,리뷰팩토리 알쏭닷넷,자아냈던 드라마 그녀의사생활이 어제부로 끝이났다. 궁금함으로 시작해서 나중엔 멜로드라마 속 남주 김재욱의 매력에 빠져서 끝까지 보게 된 드라마이기도 하다....
197,그녀의 사생활 드라마,2019.06.02.,"로즈몽 노스텔지아 로즈골드 시계, 박민영 시계 후기",타에 TAE,배우 박민영이 '그녀의 사생활' 드라마에서 착용하고 나온 디자인이라며. 나는 신세계백화점 강남점 1층에서 골랐는데 갤러리어클락 이라는 시계편집매장?...
198,그녀의 사생활 드라마,2019.06.07.,2019년 5월 방영 드라마 및 시청률 분석,종합광고대행사 INT...,"오늘은 2019년 5월, 가정의 달을 함께한 드라마들을 정리해 보도록 하겠습니다. KBS... tvN 화제작, ‘그녀의 사생활’은 로코 흥행을 보증하는 박민영 주연의 작품인데요...."
199,그녀의 사생활 드라마,2019.06.07.,박민영 가방 조이그라이슨 나오미백 미니 예쁘다,"쁘니롱 패션,뷰티,생...","마치 내가 성덕미인양 라이언이 내 남자친구인 것처럼 혼자 설레고 들뜨고 기대하고, 또 속상해하며 본방사수했던 tvN 수목드라마 그녀의 사생활이 끝나 이제 무얼..."
200,그녀의 사생활 드라마,2019.06.08.,굿바이 5월. 직장인의 밀린 일기,"직장인 OOj, 퇴근 후 공부방",5월의 문화생활 ? 그녀의 사생활 (드라마) ? 걸캅스 (영화) 5월의 선물 아디다스 신발은 약간 크지만 대신 정말정말 가볍고 편하고 왕 좋음 ? 아디다스 선물과...
201,그녀의 사생활 드라마,2019.06.11.,요즘엔 완결된 드라마 정주행중입니다.,하띵이네입니다 ㅋㅋ,"이상하게 드라마를 보고있으면, 화장실, 식사, 수면 이 3개를 제외하면 움직일수가 없습니다. 나열해보자면 리갈하이, 그녀의 사생활, 열혈사제 이렇게 3편을..."
202,그녀의 사생활 드라마,2019.06.08.,"""예쁨 한도 초과""…박민영, 화보 촬영 중 눈부신 셀카",큐타임즈,특히 박민영의 인형 같은 미모가 보는 이들의 감탄을 자아냈다 . 한편 박민영은 최근 드라마 ' 그녀의 사생활 ' 로 큰 사랑을 받았다 .
203,그녀의 사생활 드라마,2019.06.09.,낙성대미용실 준오헤어 세진쌤 중간머리 레이어드C컬펌&뿌리펌,꿈을향해(夢ちゃん)의 별별...,수목드라마 '그녀의 사생활'에서 큐레이터로 변신한 박민영씨가 레이어트커트에 C컬펌을 해서 사랑스러우면서도 세련된 분위기를 연출해서 아마도...
204,그녀의 사생활 드라마,2019.06.04.,[발리에서 생긴 일] 10회 리뷰 2004 sbs 특별 기획 드라마,Pale Moon,적어도 이 드라마의 로맨스 삼각 관계에서만큼은 패자로 기록되어야 할거 같아요.... 찾아온 그녀의 집 앞... 그 달동네... 아저씨...여기서 주무시면 입돌아가요... 얼어...
205,그녀의 사생활 드라마,2019.06.07.,박민영 공항패션 속 가방 살펴보니 조이그라이슨 나오미 미니 크록!,쭈's Diary,최근에 드라마 그녀의 사생활이 종영된 후에도 바쁜 행보를 이어가고 있는 진정한 그녀! 여태까지 했던 역할들을 보면 그녀와도 너무 잘 어울리는 똑 부러지고...
206,그녀의 사생활 드라마,2019.06.12.,클라쓰가 다른 막장 일드 유리의 집 리뷰 (현재 채널J 방송중),나혜의 여행노트,이 드라마 채널J에서 본 뒤 다른 사람들은 어떻게 생각하나?..싶어 블로그 리뷰를... 얘기는 사생활에서만 하는걸로~(찡긋) 결국 뜬 눈으로 밤을 지새우는 아들래미...
207,그녀의 사생활 드라마,2019.06.08.,시간이 흘러도 같이 보고 싶은 투욱 (최윤과 윤화평),Dreameater,장본인들이다 그녀의 사생활과 조장풍으로 다시 돌아왔지만 난 최윤과 윤화평의 모습이 잊힐까 봐... 새로운 드라마의 이미지로 덮여질까 봐... 두 드라마 보기를...
208,그녀의 사생활 드라마,2019.06.10.,"[세상에서 제일 예쁜 내딸 24회 김소연]김소연,귀걸이,협찬브랜드,겟미블링,여배우,배우김소연,김소연드라마패션,김소연패션 김소연립,김소연인스타그램,김소연메이크업,김소연쥬얼리",GET ME BLING,"Earring 그녀의 사생활 박민영 협찬 30,000원 Pink pillar *드디어 재입고* 너도인간이니 박환희,다비치 이해리,질투의화신 서지혜 42,000원 De Lier Ring..."
209,그녀의 사생활 드라마,2019.06.10.,배우 박민영 몸매가 다한 사복패션 데일리룩~ 유학생같은 느낌나요!,뷰스타 똥똥라이프 ...,드라마 그녀의 사생활 김재욱도 반할만한 비주얼입니다! 어깨라인이 훤희... 그녀의 사생활 드라마 속 패션들도 연일 화제였는데요. 촬영장에서의 모습도 박민영...
210,그녀의 사생활 드라마,2019.06.07.,SBS 드라마 ‘초면에 사랑합니다’에서 안마사,하사가의 무용지용,정갈희에게 사생활이란 생각해 볼 수도 없을 만큼 그녀의 메모장에서 24시간은 SBS 드라마 ‘초면에 사랑합니다’에서 안마사모두가 도민익의 스케줄뿐이다....
