,drama_title,date,blog_title,writer,contents
0,어비스 드라마,2019.06.27.,[한드][드라마리뷰] tvN드라마 <어비스> 15-16화 보기/정주행/몰아보기/결말,늘항상,[한드][드라마리뷰] tvN드라마 <어비스> 15-16화 보기/정주행/몰아보기/결말 tvN 드라마 <어비스> 방영일 : 2019.05. 06 ~ 2019. 06. 25 감독 : 유제원 작가 : 문수연 출연 : 박보영...
1,어비스 드라마,2019.07.09.,[프랭크커스텀 선글라스] 드라마 어비스 박보영 선글라스 FRANK CUSTOM FS 1049 Amy2 / 티타늄선글라스,FACEDRESS,"박보영 wear 프랭크커스텀 선글라스 in 어비스 드라마 어비스에서 박보영씨가 착용한 프랭크커스텀의 선글라스가 ""화제"" 라고 하죠. 사실, 극중에서 박보영씨가..."
2,어비스 드라마,2019.06.26.,tvN 월화드라마 ‘어비스:영혼 소생 구슬’ 지난 25일(화) 16화 방송을 끝으로 종영. '엔케이엔뉴스',엔케이엔뉴스,tvN 월화드라마 ‘어비스:영혼 소생 구슬’ 종영! ‘어비스’가 남긴 의미 있는 성과 3! 1. 새로운 도전! 참신한 시도가 보여준 가능성 2. 진정한 사랑의 의미+악을 이기는...
3,어비스 드라마,2019.06.26.,김영광(초면에 사랑합니다)과 박보영(어비스) 드라마 끝.,기분이 태도가 되지...,오늘 '어비스'랑 '초면에 사랑합니다' 드라마가 모두 끝났다.. 박보영과 김영광이 서로 같은 날 비슷한 시간대의 다른 드라마로 경쟁해서 둘다 챙겨보느라 바빴닼ㅋㅋ...
4,어비스 드라마,2019.07.01.,[TV 협찬] tvN 드라마 '어비스' 마지막회 벽지 협찬,"#가치있는선택 , 코스모스벽...","오늘은 지난 주 종영한, tvN 화제의 드라마 '어비스' 마지막회에 협찬된 코스모스벽지 소개해드릴께요. Previous image Next image '어비스' 중간 중간 코스모스벽지가..."
5,어비스 드라마,2019.06.26.,드라마 어비스 마지막 회 줄거리 얼토당토 억지 해피엔딩 의 결말,생각되로 Ting♡,드라마 어비스 마지막 회 줄거리 또 다시 죽다 살아나는 박보영 그리고 사라지는 안효섭 박동철 이 뒤늦게 발견 하고 사태를 수습하게 됩니다. 차키를 받아 가던중 결국...
6,어비스 드라마,2019.06.28.,tvN 드라마 <어비스> 협찬,STAR COLUMN's <THE...,"""영혼 소생 구슬"" 어비스를 통해 생전과 180도 다른 '반전 비주얼'로 부활한 두 남녀가 자신을 죽인 살인자를 쫓는 반전 비주얼 판타지 tvN 드라마 <어비스..."
7,어비스 드라마,2019.06.28.,드라마 '어비스' tvN '운정라피아노' 촬영장소!,중개법인 해담부동산,안녕하세요 이번에 '운정라피아노' tvN 드라마 어비스 에서 촬영을 왔답니다^^ 지난번에 드라마 '바벨' '미운우리새끼' 에 이어서 '어비스' 까지 촬영을 왔네요...
8,어비스 드라마,2019.07.04.,[마노모스] tvN드라마 '어비스' 권수현 / CRIKETS C1,MANOMOSE EYEWEAR S...,30대남자안경추천 #데일리룩 #드라마추천 #드라마 #어비스 #드라마어비스 #뿔테안경 #안경추천 #안경프레임추천 #안경테추천 #하금테안경
9,어비스 드라마,2019.06.26.,♥드라마 어비스 마지막회♥,아가꼬야,버킷리스트로놀이동산 데... smileukari.blog.me #드라마 #tvn드라마 #월화드라마 #어비스 #어비스마지막 #마지막회 #어비스16회 #어비스마지막회
10,어비스 드라마,2019.06.26.,박보영 어비스 패션 주얼리 TOUS(토스) 귀걸이 목걸이 모두 이뻐♡,@유나설 : 패션블로...,< 출처 : 어비스 드라마 > 너무 귀엽고 깜찍한 박보영^__^ 여자인 제가 봐도 넘나... 되었던 드라마 어비스가 어제 마지막회 방송을 했죠~ 나름 재미있게 보고 있던...
11,어비스 드라마,2019.06.26.,[한드][드라마리뷰] tvN드라마 <어비스> 13-14화 보기/정주행/몰아보기,늘항상,"[한드][드라마리뷰] tvN드라마 <어비스> 13-14화 보기/정주행/몰아보기 tvN 드라마 <어비스> 방영일 : 2019.05. 06 ~ 감독 : 유제원 작가 : 문수연 출연 : 박보영(고세연 역), 안효섭..."
12,어비스 드라마,2019.06.29.,어비스 - 죽고 살기,천천히 꾸준히(Slow...,"어비스 연출 유제원 출연 박보영, 안효섭, 이시언, 한소희, 권수현, 이성재, 김사랑... 이를 추적하며 해결하는 과정이 드라마의 주된 핵심이다. 오영철(이성재)가..."
13,어비스 드라마,2019.07.05.,TOUS 토스 주얼리 어비스 박보영 착용한 목걸이 귀걸이추천,쇼콜라비 뷰티&패션...,목걸이를 드라마 어비스에서 박보영씨가 착용했길래 리뷰를 냉큼 준비해... 되어있어서 어비스 드라마 속에서도 빛에 움직일 때 마다 반짝 거려서 눈길이...
14,어비스 드라마,2019.06.29.,어비스 박보영 안경 뮤지크 듀크 카리스마를 보여준다.,제우스,드라마 어비스 박보영 안경 뮤지크 듀크 드라마 '어비스'에서 예쁜 외모에 명석한 두뇌까지 겸비한 중앙지검의 여신 법조계의 파워우먼 고검사 고세연 역의 박보영...
15,어비스 드라마,2019.06.26.,어비스 마지막회 놀이공원 카페 촬영지 퍼스트가든,퍼스트가든 공식 블로그,"퍼스트가든 33가지 이야기, 33가지 축제. 퍼스트가든 www.firstgarden.co.kr #퍼스트가든 #어비스 #드라마촬영지 #박보영 #안효섭 #놀이공원 #데이트 #카페"
16,어비스 드라마,2019.06.26.,"어비스 16회, 마지막회, 최종회 줄거리 - 차민, 고세연 결혼, 임신 해피엔딩 결말 !!",지혜로운 연서맘 ♡...,#어비스 #어비스줄거리 #드라마어비스 #어비스드라마 #월화드라마 #월화드라마어비스 #어비스16회 #어비스16회줄거리 죽은 사람을 영혼의 모습으로 다시 태어나게 하는...
17,어비스 드라마,2019.06.28.,드라마 어비스 안효섭 박보영 어비스결말 고세연 차민 커플룩 어비스박보영 커플티 럽스타,뷰티살롱가미,드라마 어비스 저는 잼있게 봤어요 둘이 너무 귀엽고 어울려요 어비스커플 안효섭 박보영 커플티 커플셀카 데이트스냅 같은 분위기 ㅋㅋㅋ 스카이블루 맨투맨티 커플로...
18,어비스 드라마,2019.06.26.,벌써 어비스 마지막회??,홍냐홍냐,왜냐하면... 아직 어비스 일부로 안 보고 있어덩... 몰아보기 하려궁...ㅎㅎㅎ #어비스 #드라마 #어비스최종회 #어비스마지막회 #박보영 #안효섭
19,어비스 드라마,2019.07.09.,어비스 박보영 패션 주얼리 TOUS 토스 귀걸이 목걸이 다 이쁘닷!,▒ STYLE CREATOR _...,얼마전 종영한 드라마 어비스 재밌게 보셨죠? 저는 요즘 다시 1회부터 정주행 하고 있어요. VOD로 재밌게 본 드라마 다시보기 하는게 취미생활이자 인생의 낙이거든요....
20,어비스 드라마,2019.07.01.,어비스 ; 영혼 소생 구슬 (2019년 작),그 시선에 또 다른 ...,"어비스 드라마 후기 ■ 별점 : ★☆(1.5/5.0) 어비스 연출 유제원 출연 박보영... 게 짱인 듯 ㅋㅋㅋㅋㅋㅋㅋㅋㅋㅋㅋㅋㅋ 출처 : 어비스 공식홈 유치뽕짝 드라마, 어비스"
21,어비스 드라마,2019.06.26.,"tvn월화드라마 어비스 16화/최종화줄거리, 후속작 60일,지정생존자!(사랑한다는 말을 아낀것!)",BY JUNE,"tvn월화드라마 어비스 16화/최종화줄거리, 후속작 60일,지정생존자! 가장 후회하는 것, 사랑한다는 말을 아낀것! 차민은 세연의 프로포즈를 받은후 함께 놀이공원으로..."
22,어비스 드라마,2019.06.26.,어비스 15회 박보영 코디 귀여운 곰돌이 귀걸이!,:: 달달한 오후의 레...,어비스 15회 박보영 코디 곰돌이 귀걸이와 목걸이 어제로 막을 내린 tvN 드라마 '어비스' ♪♬ 아 . . 이제 월화드라마 눈정화는 뭘로 하죠 . . 안효섭 보는 낙에...
23,어비스 드라마,2019.06.26.,어비스 16화 마지막화 상세 줄거리 및 사진캡쳐,특별한 방황,"초반의 드라마 어비스는 안효섭의 답답한 행동과 그리고 중간중간 매끄럽지 않은 스토리때문에 실망도 하긴 했지만, 나름 최선의 스토리였지 않았나 하는 생각이 들기도..."
24,어비스 드라마,2019.06.26.,[tvN 어비스_결말] 총을 맞은 세연 과 사라질 위기에 놓인 차민,CJ ENM E&M 부문,방콕하면서 드라마 정주행 하는 게 최고! 오늘은 참신한 소재로 주목을 받았던 tvN 어비스 마지막회 를 가지고 왔답니다! 마지막 어비스의 규칙 세연 (박보영) 은 차민...
25,어비스 드라마,2019.07.06.,"TOUS 토스 여자주얼리 예쁘죠, 어비스 박보영 귀걸이 ♥",*: 미니비쥬의 뷰티...,"TOUS 얼마 전 종영한 tvN 드라마 어비스에서 박보영 귀걸이, 목걸이로 사랑을 받았던 토스 주얼리 소개 드리러 왔어요 ♥ 어비스 제작 지원을 하며 매장도 나오고..."
26,어비스 드라마,2019.06.27.,요즘 최애 드라마 어비스가 끝나버렸네요..,해강이와 사탕이,요즘 최애 드라마 어비스가 끝나버렸네요.. 출처 : http://program.tving.com/tvn/abyss 원래 어비스를 처음부터 본방사수를 했던건 아니었어요. 지난 주말에 그냥 할 것도 없고...
27,어비스 드라마,2019.06.26.,드라마 '어비스'의 박보영이 권수현이 쏜 총에 맞았다.,맑은가람,"25일 오후 방송된 tvN 월화드라마 '어비스'(극본 문수연, 연출 유제원)에서는 다시 한 번 부활한 고세연(박보영 분)과 사라지게 된 차민(안효섭 분)의 모습이 담겼다...."
28,어비스 드라마,2019.06.26.,"어비스 박보영 패션 속 토스 테디베어 목걸이, 귀걸이 스타일링 정보 알아왔어용 !","DAZZI, 다찌 블로그","'어비스 박보영 패션 토스 테디베어 목걸이, 귀걸이 스타일링' 어제 박보영 안효섭 주연의 드라마 어비스가 종영했는데요 ㅠㅠㅠ 솔직히 보면서 뭔가 급하게 끝낸..."
29,어비스 드라마,2019.06.26.,[한국드라마] 어비스,YAPA's 시청기록장,있는 '어비스'라는 구슬로 180도 다른 모습과 함께 부활한 여주인공과 남주인공이 그녀를 죽였던 진범을 찾는 판타지 로맨스이자 스릴러 드라마. 일단 주연인 박보영...
30,어비스 드라마,2019.06.26.,어비스 15회 박보영 주얼리 토스 귀걸이 & 목걸이,뷰스타 셔니비비 패...,"그래서 저도 사려고 백화점 가서 보고 위시리스트에 딱 담아둔 거랍니다 :) 박보영 드라마 어비스는 끝났지만, 박보영 목걸이, 귀걸이 브랜드 토스 주얼리는..."
31,어비스 드라마,2019.06.26.,어비스 재방송 다시보기 등장인물관계도 최종화 1회부터 무료 시청,Living information,어비스 재방송 다시보기 드라마 ‘어비스’는 생전과 180도 다른 '반전 비주얼'로 부활한 두 남녀가 자신을 죽인 살인자를 쫓는 반전 비주얼 판타지를 줄거리로 합니다....
32,어비스 드라마,2019.06.26.,"‘어비스의 국민남친’ 배우 안효섭, 장애인여행 활성화 셀럽릴레이 14호 주자 동참",한국사진방송 공식블...,tvN 드라마 ‘ 어비스 ’ 에서 세젤남 차민 역으로 다양한 연기를 펼치고 있는 배우 안효섭씨가 참여했다 . 안효섭 배우는 이전에 팬들과 함께하는 결식아동 및 어려운...
33,어비스 드라마,2019.06.26.,어비스 마지막회에서 박보영(세연)이 안효섭(차민)을 잃고 울부짖는 장면이,드라마덕후니,25일 방송된 tvN 월화드라마 < #어비스> #마지막회에서 #박보영( 세연)이 #안효섭( #차민)을 #잃고 #울부짖는 #장면이 그려졌다. 이날 안효섭은 살인마 권수현(지욱)을 잡는데...
34,어비스 드라마,2019.06.26.,"어비스 이시언 패션. 연예인들이 사랑한 남자 청바지, 데님 팬츠 브랜드 누디진!",자안 커뮤니케이션즈,어제 막을 내린 드라마 어비스! 그동안 이시언은 영혼 소생 구슬인 어비스로 인해 얽히고설킨 사건들을 해결하는 에이스 형사다운 면모와 사랑 앞에서는 한 없이...
35,어비스 드라마,2019.07.02.,tvN드라마 어비스 명대사 캘리그라피,"쥬타, 나는 네가 쥬...",#어비스 명대사 #캘리그라피
36,어비스 드라마,2019.06.26.,190625 TVN 어비스 16회 박보영 가방 패션정보 <폴스부띠끄 튤리 TULLY>,스타패션 매거진,190625 TVN 어비스 16회 박보영 가방 패션정보 <폴스부띠끄 튤리 TULLY> 지난 25일 TVN드라마 어비스가 종영하였죠~! 마지막까지 열혈 연기 펼쳐주신 박보영씨!!...
37,어비스 드라마,2019.07.05.,[남흥케미칼] tvn 월화드라마 어비스 협찬,남흥케미칼,"구슬 "" 어비스를 통해 생전과 180 도 다른 ' 반전 비주얼 ' 로 부활한 두 남녀가 자신을 죽인 살인자를 쫓는 반전 비주얼 판타지를 그린 드라마 [ 출처 ]tvn 드라마 어비스"
38,어비스 드라마,2019.06.26.,박보영 패션 어비스 종방연 착용 3만원대 스트라이프 셔츠 리스트(LIST),닐라의 뷰티톡 ♩,25일 종영한 tvN 드라마 어비스!! 신박한 소재 때문에 눈길을 끌기 시작해 잠깐씩 챙겨보던 게 그대로 정착하게 만들었던 판타지 드라마였는데요 그 동안 저의 월...
39,어비스 드라마,2019.06.26.,드라마 ‘어비스’가 신박한 소재와 허를 찌르는 상상력으로 판타지 장르의 새로운 변주를 보여주며 종영을 맞이했다.,BARON라이프,"tvN 월화드라마 ‘어비스: 영혼 소생 구슬’(극본 문수연·연출 유제원·제작 네오엔터테인먼트)(이하 ‘어비스’)의 ‘구슬커플’ 박보영, 안효섭과 이시언, 한소희..."
40,어비스 드라마,2019.07.05.,앙증맞고 매력뿜뿜 하는 어비스 박보영 토스주얼리,'한우리'의 IT 화장...,너무 재미있게 봤던 tvN 드라마 '어비스' 종영 ㅠㅠㅠ 흑흑 구슬커플의 케미와 박보영 연기 보는 재미가 쏠쏠했는데 이제 어디 가서 이 아쉬움을 달랠까 싶어요. 그래도...
41,어비스 드라마,2019.06.26.,어비스 침대키스 장인 메이킹 영상,메모리,몰아봐야지 어비스 박보영과 안효섭의 조합인데 재방으로 꼭 다 챙겨볼거여 ㅠㅠ 아 다른 드라마도 본다 해놓고 자꾸 밀려서 못봤는데 이거는 꼭 봐야지! 암튼 아...
42,어비스 드라마,2019.07.06.,"어비스 (2019), 권수현의 발견",유부녀의 놀이,"이시언이 드라마 촬영 중이라고 해서 검색해 보니 제목이 어비스였다. 로코물일 것 같아 굳이 찾아보지는 않았는데, 종영 후 넷플릭스에 올라왔길래 보기 시작했다...."
43,어비스 드라마,2019.06.27.,어비스 종방연 이성재 한소희 권수현,VIVIAN KSTAR,"VIVIAN K- STAR NEWS 19일 오후 서울시 영등포구 여의도에서 TVN 월화 드라마 ‘어비스 : 영혼 소생 구슬’ 종방연이 열려 이성재, 권수현..."
44,어비스 드라마,2019.06.27.,어비스 마지막회 박보영 블라우스 & 가방 어디꺼?,은붕이의 패션일기,블라우스 & 폴스부띠그 숄더백~★ 비지트인뉴욕 블라우스 & 폴스부띠끄 가방 . . . . . tvN 드라마 어비스가 종영됐어요.. 뭔가.. en-fashionary.tistory.com
45,어비스 드라마,2019.07.06.,[드라마] 어비스,땅콩이네,"어비스 연출 유제원 출연 박보영, 안효섭, 이시언, 한소희, 권수현, 이성재, 김사랑, 안세하, 윤유선, 이철민, 박성연, 김성범 방송 2019, tvN 박보영씨 나와서 봣어요!..."
46,어비스 드라마,2019.06.26.,‘어비스’ 권수현이 박보영을 인질로 잡았다,드라마덕후니,25일 방송된 tvN 수목드라마 ‘어비스’에는 서지욱(권수현)이 차민(안효섭)과 함께 있는 고세연(박보영)을 붙잡는 모습이 그려졌다. 이날 차민은 고세연과 놀이공원...
47,어비스 드라마,2019.07.08.,어비스 tvN 전편 시청률 안효섭 줄거리 재방송 다시보기,어비스박보영♥,그럼 바로 #드라마어비스 속 등장인물과 인물관계도를 소개해봅니다.. 사라졌다 다시 나타나면서 민을 새로운 국면에 빠트리게 하는. 이렇듯 나쁜 여자 코스프레는 혼자...
48,어비스 드라마,2019.06.27.,어비스 / 박보영 캐스팅에도…2.3%로 초라한 종영,인생은 도전이고 모...,kr #어비스 #어비스종영 #박보영 #월화드라마 #tvn드라마 #케이블채널 #안효섭 #어비스차민 #권수현 #배우 #고세연 #부활 #어비스후속작 #이승 #어비스몇부작
49,어비스 드라마,2019.06.26.,tvN '어비스' 마지막회 송상은 자켓_씨씨콜렉트 (CC collect),스타패션 매거진,tvN '어비스' 마지막회 송상은 자켓_씨씨콜렉트 (CC collect) 드라마 '어비스'에서 상큼발랄한 이미도역을 잘 소화하신 송상은씨~ 이번 드라마에서 더욱 매력적으로 잘...
50,어비스 드라마,2019.06.26.,"어비스, 2019",이제이의 탐구생활,"어비스 연출 유제원 출연 박보영, 안효섭, 이시언, 한소희, 권수현, 이성재, 김사랑... 나오던 드라마같은 분위기겠거니 하고 봤는데 폭망 그나마 오영철이 나올때..."
51,어비스 드라마,2019.07.01.,어비스,AAmBroSiAA,어비스 박보영 나와서 기대하고 있었던 작품 진짜 너무너무 궁금했는데 꾹---!! 참고... 핳 아역들도 귀여웠어 이 드라마 등장하는 캐릭터들은 악역을 제외하면 대부분...
52,어비스 드라마,2019.06.27.,어비스 14회 이시언 무지 T넥 반팔티 / 자바나스(ZAVANAS),라비에벨,"형사역할에 어울리게 화사하지 않은 컬러의 반팔티를 드라마 내내 착용했는데, 이시언씨가 착용한 무지 반팔티는 자바나스 브랜드 였어요! 어비스 14회 이시언이..."
53,어비스 드라마,2019.07.05.,"어비스 박보영 귀걸이 토스 주얼리, 너무 귀여워 @ TOUS JEWERLY",엘레양의 지구별여행,한동안 드라마 어비스 보는 재미로 살았는데 이젠 무슨 낙으로 사나 ㅠㅠㅠㅠㅠㅠㅠㅠㅠ 1회 부터 상상도 못한 스토리 전개로 눈길을 사로잡았던 드라마 어비스 이...
54,어비스 드라마,2019.06.27.,배우 송상은이 만능 소화력을 입증하며 ‘어비스’를 마무리했다.,맑은가람,지난 25일 종영한 tvN 월화드라마 ‘어비스’는 영혼 소생 구슬 어비스를 통해 생전과 180도 다른 반전 비주얼로 부활한 두 남녀가 자신을 죽인 살인자를 쫓는 반전 비주얼...
55,어비스 드라마,2019.06.26.,'어비스' 최종회 박보영과 안효섭의 사랑이 해피엔딩을 맞이했다.,다옴스토리,25일 방송된 tvN 드라마 ' #어비스' #최종회에서는 고세연(박보영 분)을 살리기 위해 또 다시 구슬을 사용한 차민(안효섭 분)의 모습이 그려졌다. 이날 고세연과 차민은...
56,어비스 드라마,2019.06.26.,"[그 옷 어디꺼] ‘어비스’ 박보영, 뽀블리의 사랑스러운 블라우스 어디꺼?",패션뉴스포털 '패션...,"비지트 인 뉴욕, 레몬 컬러 라운드 프릴 플라우스로 상큼한 하객룩 연출 tvN 드라마 ‘어비스’가 지난 25일 16회를 최종회로 막을 내렸다. 25일 방송된 최종회에서는..."
57,어비스 드라마,2019.07.01.,"TVN 어비스, 어비스 윤유선, 윤유선 원피스, 드라마 패션, 연예인패션, 원피스 코디",Mirl Trend,어비스 윤유선 패션 어비스 15화에서 윤유선씨가 착용하신 원피스는 쁘렝땅(PRENDANG) 브랜드 제품이에요!! 화사한 컬러와 부드러운 소재의 쁘렝땅 원피스!!...
58,어비스 드라마,2019.06.27.,"[퍼스트가든] 퍼스트가든, 주말/야간 파주여행 추천 - tvN ‘어비스’/런닝맨/인기가요 등 촬영지(구슬계단 야경추천)",산타루돌프의 지극히...,"tvN 드라마 <어비스>의 촬영장소로 각광을 받았다. #박보영 , #안효섭 주연의 <어비스>는 영혼 소생 구슬인 ‘어비스’로 죽었던 주인공들이 외모가 전혀 다른..."
59,어비스 드라마,2019.06.27.,어비스 속 박보영 신발 패션 모음! 슈콤마보니 펌프스부터 샌들까지,비비안의 소소소소소...,ㅎㅎㅎ 어비스가 끝나서 아쉬운 마음에 어비스 속 박보영 신발 정보 쭉 정리해봤어요 :) 다음 드라마에서도 곧 만날수있었음 좋겠어요 ㅎㅎ 다음 드라마로 돌아오면...
60,어비스 드라마,2019.06.26.,tvN '어비스' 마지막회 송상은 네이비 셋업수트_씨씨콜렉트 (CC collect),스타패션 매거진,tvN '어비스' 마지막회 송상은 네이비 셋업수트_씨씨콜렉트 (CC collect) 드라마 '어비스'에서 상큼발랄한 이미도역을 잘 소화하신 송상은씨~ 이번 드라마에서 더욱...
61,어비스 드라마,2019.07.01.,어비스 윤유선 원피스 정보 공유합니다!,Mirl Trend,드라마 어비스 마지막회 윤유선씨 원피스 정보 알려드릴게요! 16화에서 침대에 누워있는 장면에서 윤유선씨가 착용하신 원피스는 쁘렝땅(PRENDANG) 브랜드...
62,어비스 드라마,2019.06.26.,아른거릴 만큼 행복한 시간 어비스 안효섭?,관종뉴스 블로그,드라마 '어비스:영혼 소생구슬'(이하 '어비스')의 종영과 함께 극중 차민으로 활약한 배우 안효섭이 감사의 인사를 전한 것. 안효섭은 극 중 순수 영혼 '차민'으로...
63,어비스 드라마,2019.07.05.,"여자친구선물 추천 연예인귀걸이, 귀엽고 예쁜 토스 귀걸이 코디!",@유나설 : 패션블로...,tvN 드라마 '어비스' 제작 지원을 했어요~ 드라마 내에서 박보영이 착용한 TOUS 토스... 주얼리를 어비스 드라마 박보영 패션으로 소개가 되었는데요~ 역시 전 제가...
64,어비스 드라마,2019.07.08.,"2019, 7월 신작 드라마",슬 픈 중 독 자,"60일 지정생존자 지진희, 이준혁, 허준호 주연 tvN 월화드라마, 16부작 /어비스 후속 7월 1일 첫방송 대학에서 연구만 하다가 환경부장관이 된 박무진(지진희)가..."
65,어비스 드라마,2019.07.03.,[초록여행] 초록여행 셀럽릴레이 14호 '배우 안효섭',사단법인 그린라이트~*,드라마 어비스 촬영하실 때 권수현 배우님이 촬영장에서 섭외를 하셨다고 들었어요. 그 자리에서 바로 셀럽릴레이 참여를 '콜'해주셨는데요. 초록여행 처음 들었을때...
66,어비스 드라마,2019.06.28.,"드라마 OST 추천, 드라마와 찰떡인 OST 소개",La Vie En Rose,드라마와 너무 잘어울려서 드라마의 몰입도를 배로 증가시키는 노래들을 알려드릴게용 최근 인기리에 방영중인 드라마 <어비스>의 ost 인데요. 어비스 파트 2로 공개된...
67,어비스 드라마,2019.06.26.,60일 지정생존자 ost 노래 인물관계도 줄거리 업데이트,질주본능 :),주연의 어비스 드라마가 끝나고 후속으로 나오는 60일 지정생존자에 대한 인물관계도와 줄거리 ost 등을 준비했습니다. 이 드라마는 미국에 ABC에서 방영된...
68,어비스 드라마,2019.07.05.,tvn 드라마 추천 종영작부터 신작까지! 몰아보세요,"today, 모노",ㅎ 제가 이번에 '어비스'라는 드라마를 정주행하면서 다시 드라마의 세계에 풍덩 빠졌는데요 드라마 보고 있을 때만큼은 아무 생각도 안들고 이 드라마 속에 집중을...
69,어비스 드라마,2019.06.27.,구르미 일산 앙금플라워 떡케이크 TV 나왔어요,구르미 케이크(일산앙금플라...,#환갑케이크 #칠순케이크 #일산앙금플라워 #일산떡케잌 #일산떡케익 #일산떡케이크 #일산디저트맛집 #일산 #2단떡케이크 구르미 일산 떡케이크 tvn 드라마 어비스에...
70,어비스 드라마,2019.07.01.,60일 지정생존자 원작 미드 등장인물관계도 몇부작 줄거리 재방송 tvN 월화드라마,에바그린님의 블로그,60일 지정생존자 원작 미드 등장인물관계도 몇부작 줄거리 재방송 tvN 월화드라마 안녕하세요~오늘은 tvN 월화드라마 어비스 후속 방송으로 7월1일부터 첫 방영될 지진희...
71,어비스 드라마,2019.07.04.,보라매공원 맛집 감탄떡볶이 메뉴가 다양해요,★리락쿠마의 즐거운 나날★,"요즘 드라마 어비스, 보이스3, 구해줘2에서 감탄떡볶이의 광고협찬을 볼 수 있지요~ 포스터를 보니 반갑더라는 ㅎㅎㅎ 이영자떡볶이 맛집으로도 알려진 감탄떡볶이..."
72,어비스 드라마,2019.07.04.,별내전자담배 이씨엠 오비스 3단가변입호흡기기 베이프네이션 구)라미야별내점 ecm ovis 컴팩트전자담배,별내전자담배 <<베이프네이...,더위를 먹었는지 자꾸 이상한 소릴ㅋㅋㅋㅋㅋㅋㅋㅋㅋㅋㅋㅋㅋㅋㅋㅋㅋㅋㅋㅋㅋㅋㅋㅋㅋㅋㅋㅋㅋㅋㅋㅋㅋㅋㅋㅋ 오비스는 제가 즐겨보던 드라마어비스 와 이름이...
73,어비스 드라마,2019.06.28.,"애니, 드라마, 영화 무료보기 & 다시보기 사이트 추천",꾸미이야기,#애니보는사이트 #드라마다시보기무료사이트 #무료영화보기사이트 안녕하세요 :) 최근 즐겁게 보고있던 월화드라마 어비스가 종영되었어요 어비스는 tvN에서...
