,drama_title,date,blog_title,writer,contents
213,아스달 연대기 드라마,2019.09.28.,우오오!!!,글귀작업실,"저번주에 끝난 토,일 드라마 아스달 연대기 때문 입니다...정말 재미있게 봤던 드라마 인데요! 그 드라마에 양차라고 기도훈 배우님이 나오시죵....ㅠㅠ 세상 그런남자가..."
214,아스달 연대기 드라마,2019.10.04.,[전정훈의 교육 이야기] 독서는 공감 능력 향상에 도움을 준다 - 뉴질랜드타임즈,New Zealand Times(...,최근에 방영 중인 tvN의 주말드라마 <아스달 연대기> 17화에 “이름이란 묶는 것이다. 아무도 저를 사야(송중기 분)라 부르지 않고 제가 어디를 가서도 사야라고 말하지...
215,아스달 연대기 드라마,2019.09.25.,배가본드 1화 줄거리 : 요고 요고 액션 영환데?,Here comes the sun,미래의 무술 감독을 꿈꾸며 스턴트 생활을 하던 드라마 배가본드의 주인공 차... 착한 역인듯 ㅎㅎ 아스달연대기 보느라고 본방 사수는 못했지만 앞으로 계속 볼 의향은...
216,아스달 연대기 드라마,2019.09.28.,날 녹여주오 1회 냉동인간 실험 시작!,playgirl1023님의 블...,날녹여주오2회예고미리보기 #날녹여주오2화예고미리보기 #날녹여주오3회예고미리보기 #날녹여주오3화예고미리보기 #아스달연대기후속드라마 #지창욱복귀드라마
217,아스달 연대기 드라마,2019.09.23.,태풍을 뚫고 집 오는길 한줄기 노을과 마장휴게소에서의 한상차림,행복을 부르는 주문...,도착하자마자 아스달 연대기 마지막회에 꽂혀 넋놓고 보고있었는데.. 옴마야..... ㅎㅎㅎ 차마 드라마에 정신팔려서 전화 못들렸다고 말씀 드릴수 없으니까.. 부모님들은...
218,아스달 연대기 드라마,2019.09.24.,"Daily, 9.21 - 9.24",Dear. J,"9.21 빠숑이 놀아주기 숑's daily 9.22 드라마광 정니 '아스달 연대기' 보는 사람 주위에 정말 없지만, 난 재밌게 봤당! 마지막회라는 게 말이 안되는 기승전결이지만;..."
219,아스달 연대기 드라마,2019.09.29.,날 녹여주오 - 어제와는 다른 오늘,세리의 소박한 세상...,"아스달 연대기 끝나고 보려니 시간 맞는 게 없더라고요. 날 녹여주오는 토 일, 녹두전은 월 화. 여기 수 목 어쩌다 발견한 하루까지. 보고 싶었던 드라마는 아니지만..."
220,아스달 연대기 드라마,2019.10.02.,타짜 곽철용 갑자기 인기 있게 된 이유와 명대사 모음,아멜의 컨텐츠생산일...,"최근 과열된 컨텐츠 경쟁 때문에 제작비만 잔뜩 들이고 재미없는 드라마 '아스달 연대기', '베가본드' 같은 드라마가 많아서 더 곽철용 열풍이 반갑네요. 곽철용..."
221,아스달 연대기 드라마,2019.09.23.,September(15-22),Seize the day,"범계역까지 걸어가서야 주말 데이트 마무리? 9월 22일 (Sun) 여유로운 일요일의 시작은 아스달연대기~~ 난 왜 남들 안보는 드라마를 좋아하는가,,??ㅋㅋㅋㅋ 근데..."
222,아스달 연대기 드라마,2019.09.28.,배가본드 3회 줄거리 문정희 킬러 릴리 영입 이승기 위험!,생각되로 Ting♡,하지만 막상 지난주 금토드라마 새롭게 시작하고 느낀건데요; 좀 억지... 기대 보다 못미쳐서 아쉽네요 차라리 아스달연대기 가 .. 100배.1000배 낳음 ㅠㅠㅠㅠ
223,아스달 연대기 드라마,2019.09.23.,Day 56 1일1문장                                                         조마조마한 영어로...?,TOP ENGLISH,영화나 드라마 보면 조마조마한 장면들이 많이 나오죠? 얼마전 우연히 본 아스달 연대기 시즌3 1회 봤을 때 엄청 조마조마하며 봤던...
224,아스달 연대기 드라마,2019.09.23.,좋은 작품과 훌륭한 연기가 돋보인 작..,cshans0603님의 블로...,"지난 22일 방송된 tvN 토일드라마 ‘아스달 연대기’(극본 김영현, 박상연/ 연출 김원석/ 제작 스튜디오드래곤, KPJ) Part3 ‘아스, 그 모든 전설의 서곡’ 18화는..."
225,아스달 연대기 드라마,2019.09.27.,밤을 잊은 그대에게....OTT가 뭐길래,김해사진관,"‘킹덤’, ‘아스달 연대기’ 등 국내 드라마에 투자 또는 제작하는 등 넷플릭스는 오리지널 또는 독점 콘텐츠 제공으로 이용자를 확보하고 있다. 이러한 매력..."
226,아스달 연대기 드라마,2019.10.03.,"영화 장사리 잊혀진 영웅들 (후기, 쿠키영상)",Sooday ?????,나온 드라마들은 좀 봤는데 사투리 연기는 첨이라고 하셨다 근데 사투리 진짜 잘... 요즘 방영 중인 아스달 연대기에 잎생! 투제니 로 처음 봤는데 연기 증말 잘하셔요...
227,아스달 연대기 드라마,2019.09.26.,9,궁시렁궁시렁,",, 이제 전복죽 안먹는다,, 후,, 배신 당함ㅜㅜ 아스달연대기2 드디어 봤다 존잼이당... 재미이따 드라마가 밀당을 한다 고구마 사이다 아주 칭찬해 행님이 추자도..."
228,아스달 연대기 드라마,2019.09.23.,화장품파우치속 여행용로션 아쿠탑,행복한 일상을 공유...,엄마는 아스달연대기 본방을 놓쳐서 속상해 하는 중이구요 ~~ ㅠㅠ 토요일 드라마 내용이 어떻게 됐는지 너무 궁금해욧!! 누가 좀 알려주시겠어요?? 숙소에 들어와서...
229,아스달 연대기 드라마,2019.09.28.,날 녹여주오 1회 줄거리정리 내용다시보기,"미미(美味)여행자, ...",tvN 토일드라마 날 녹여주오 1회 본방사수! 아스달 연대기가 끝나니 너무나도 아쉽다... ㅠㅠㅠㅠㅠㅠ 날 녹여주오 1회 줄거리 정리 시작~ 늘 그렇지만 긴 글이다. (날...
230,아스달 연대기 드라마,2019.10.06.,나는 왜 이 수업을 드랍하지 않았나,E_HYEJINI,"아스달연대기같은 이름부르면 아는 그런 드라마에 단역으로 나왔던 분들이 정말 많이 지원해 주셨다. 정말 보면서 ,, 대단하다고 느낌. 연기에 대한 배움과 경험으로만..."
231,아스달 연대기 드라마,2019.09.25.,"영화 장사리: 잊혀진 영웅들 후기, 영원히 기억되어 마땅한 이 땅의 아들들",놀이터로 출근하는 여자,^^* 최근 잠시 종영한 tvN드라마 <아스달 연대기>에서 은섬의 동지 '잎생'으로 출연한 배우로 주목받은 바 있는 김성철의 연기에 깜짝 놀랐어요 김성철은 기하륜으로...
232,아스달 연대기 드라마,2019.09.25.,190925 수,열심히 공부.,벌써 수요일이다. 이번주는 시간이 참 빠르게 가네... 아스달연대기 끝나서 이제 뭐 보지 ㅠㅠ 내가 유일하게 보는 드라마였는데... 내일도 파이팅 !!!! 자지 말자!!!!!!!!!!!!
233,아스달 연대기 드라마,2019.09.24.,100일 다이어트 챌린지 D-79,백실장과 좋은방 구...,간만에 배부르게 먹고 아스달연대기 정주행. 드디어 한편 남았다. 18회는 내일! 근데 이 드라마.. 시즌2 나오는거겠지? 너무재밌잖아 ㅠㅠ 그냥 이대로 보낼수 없자나~
234,아스달 연대기 드라마,2019.09.23.,하림 - '붉은 꿈',stone2040님의블로그,"아스달 연대기 OST Part 2 아티스트 하림 발매 2019.09.22., (주)지니뮤직 장르 드라마음악 평점 붉은 꿈 하림 - '붉은 꿈' 추천드립니다. 유튜브입니다. https://youtu.be..."
235,아스달 연대기 드라마,2019.10.03.,구글 트렌드 2019년 월별 검색어 순위,T H E · I M P R E...,쿠쿠티비 드라마 18) 스카이 캐슬 1화 19) ani24 20) 미세먼지 21) sky 캐슬 22)... 4) 아스달 연대기 5) 진학사 6) 타인은 지옥 이다 7) 영화 좋아 8) bmw 9) 설리 10)...
236,아스달 연대기 드라마,2019.09.29.,리포트읽기: 스튜디오드래곤,MS;LION,"델루나, 아스달연대기 =>호텔 델루나는 엄청 재밌었는데, 이것도 시즌제니까 기대할만 하다. 국내 드라마도 시즌제를 염두해 둔다면 프렌즈 같은 메가 히드 작품도..."
237,아스달 연대기 드라마,2019.09.30.,단양 여행 수양개빛터널 밤에 가야 좋아요~,릴리의 상큼 발랄한 감성여...,요즘 유행하는 드라마인 아스달 연대기가 이 선사시대 이야기에요.전 참 재밌게 보고있는데 사실 막 엄청 제작비에비해 많이 안보는것 같더라고요.내용도 좀...
238,아스달 연대기 드라마,2019.09.29.,날 녹여주오 재방송 여기서 시청 지창욱 원진아 촬영지 무료보기,통통튀는 재미,"냉동인간이 살아났다 드라마에서만 있을 수 있는 일이지만, 먼 미래에 이런... 안내 아스달연대기에 이은 후속작이자 배우 지창욱의 복귀작으로 뜨거운 관심을..."
240,아스달 연대기 드라마,2019.09.24.,am4:46 갑자기 소회,오늘도 가지가지한다,"#tv의홍수 드라마부터 예능까지 볼 게 참 많다. 멜로가체질, 아스달연대기, 일로만난사이, 유퀴즈온더블럭, 아이슬랜드간세끼, 슈퍼맨이돌아왔다, 차이나는클라스..."
241,아스달 연대기 드라마,2019.09.30.,대구 경산 가볼만한곳 반곡지 신선놀음이 따로없는 곳,백프로 나야!,"그래서 그런지 최근에 방영했던 아스달연대기, 구르미그린달빛 등등 드라마도 많이 찍고 최근에는 설현?영화 찍는다구 왔다더라구요 뭔가 나만알던 예쁜 곳이 점점..."
242,아스달 연대기 드라마,2019.09.29.,갑자기 왜 떴지? '인기 여행지 TOP5',함께가는 길,"브루나이 tvN의 고대 판타지 드라마 아스달 연대기는 장동건, 송중기를 비롯해 다양한 개성의 연기파 배우들이 대거 출현해 주목을 받았는데요. 화려한 영생과..."
243,아스달 연대기 드라마,2019.10.04.,CJ Weekly Logistics News Letter Vol.454 (10/4),Logistics Weekly N...,물류 산업동향 [제목을 클릭하시면 원본기사를 보실 수 있습니다] ○ 2019년 물류창고업 등록현황 물류신문 2019.10.02 국가물류통합물류정보센터에 따르면 현재...
244,아스달 연대기 드라마,2019.10.02.,에일리(Ailee),Mytoynbee M's Stor...,"30 미국 -신체 : 163cm, 50kg -데뷔 : 2012년 KBS 드라마 '드림하이 2' -수상... Shacker #알함브라 궁전의 추억 OST #아스달 연대기 OST #butterFLY #VocalPlay"
245,아스달 연대기 드라마,2019.09.29.,날 녹여주오 등장인물 & 인물관계도 지창욱 원진아 소개합니다,뚱이뚱이의 드라마&...,오늘 뚱이가 가져온 소식은 아스달 연대기 후속 지창욱 원진아 주연의 날... TV 드라마 속 아들의 결혼을 반대하며 돈 봉투를 던지게 되는 날이 올 줄이야 내 눈에 흙이...
246,아스달 연대기 드라마,2019.10.02.,한복이 잘어울리는 연예인 스타,자연의 색을 담다/한...,"tvN 드라마 '아스달 연대기' Part3 '아스, 그 모든 전설의 서곡'으로 돌아오는 배우 송중기. 송중기는 2010년 방송된 KBS '성균관 스캔들'에서 성균관 유생 구용하 역으로..."
247,아스달 연대기 드라마,2019.09.25.,김옥빈부터 배수지까지…안방극장 홀리는 액션 여제들,CHOCHON,'99억의 여자''청일전자 미쓰리' 등 걸크러시 트렌드도 지속 '아스달 연대기' 김옥빈... USA네트워크 드라마 '트레드스톤'(내달 방영)에서 과감한 액션을 선보인다. 최근...
248,아스달 연대기 드라마,2019.10.06.,김해문화재단 김해문화의전당 기획공연 LDP무용단 <트리플 빌>,김해인터넷신문/장유...,마지막으로 '댄싱9' 등에 출연하며 대중적 인기를 모은 바 있으며 최근 드라마 ‘아스달 연대기’에서 안무를 맡고 있는 김설진 안무가가 'MARRAM' (마-램)을 통해...
249,아스달 연대기 드라마,2019.09.23.,광안리 교통사고 한의원 차분히 관리하기,좋은마음네트워크한의원,"거리요 아스달 연대기를 처음에 소개할 때""상고시대"" 라는 시대적 배경을 집어 넣은게 잘못인거 같아요어차피 드라마보면 상고시대고 뭐고 그저 가상의 오래전..."
250,아스달 연대기 드라마,2019.09.25.,한국인이 좋아하는 TV프로그램 - 2019년 9월,황용운입니다. ^-^,"1% - 3개월 연속 1위 저녁 일일 드라마 한국갤럽이 2019년 9월 17일부터 19일까지... ● KBS2 일일극 <태양의 계절>, tvN 주말극 <아스달 연대기> 순위권 재진입 조사..."
251,아스달 연대기 드라마,2019.09.25.,날 녹여주오 인물관계도 등장인물 지창욱 원진아 윤세아,체리별,드라마는 날 녹여주오입니다. 날 녹여주오는 총 16부작으로 방영이 되며 토일 밤 9시를 책임질 것으로 보입니다. 아스달 연대기 후속으로 방영되는 날 녹여주오는 배우...
252,아스달 연대기 드라마,2019.09.23.,‘타인은 지옥이다’ 임시완은 지옥 고시원에 방문한 여자 친구 김지은을 지킬 수 있을까.,드라마덕후니,"OCN 드라마틱 시네마 ‘타인은 지옥이다’ 제6화, 오늘(22일) 일요일 밤 10시 30분 방송. 말도 많고 탈도 적지 않았던 ‘아스달 연대기’가 대단원의 막을 내렸다...."
253,아스달 연대기 드라마,2019.09.23.,하지마...,이름만 들어도 대단...,"하지마... 540억원 드라마 '아스달연대기', 시즌2로 돌아올 것인가 【서울=뉴시스】최지윤 기자 = tvN 주말극 '아스달연대기'가 시즌2로 돌아올 것인가 확인하러 가기"
254,아스달 연대기 드라마,2019.09.28.,‘엄복동은 잊어라’…배가본드 호평에 미소짓는 셀트리온,바ㅣㅗ세상,제작비 450억을 들인 텐트폴 ‘아스달연대기’가 기대에 못 미치는 평가를 받으며... 김현용 이베스트증권 연구원은 “배가본드로 SBS 드라마 경쟁력이 이전보다...
255,아스달 연대기 드라마,2019.10.01.,"[株라큘라 추천종목]국내 1위 VFX 기업 덱스터, 고성장 기대감↑",모아그룹 회장 블로...,"최 연구원은 ""최근 국내 드라마 시장에서는 VFX 가필요한 SF, 판타지 소재 비중이... 최근 인기를 끌었던 도깨비, 미스터션샤인, 아스달연대기 등에 모두 VFX 기술이..."
256,아스달 연대기 드라마,2019.10.04.,CJ Weekly_News_Letter_Vol_452 (9월20일),Logistics Weekly N...,"물류 산업동향 ○ 부산항만공사, 중국 연변대와 공동 물류연구센터 운영 연합뉴스 2019.09.20 한국기업 북방물류시장 진출·협력사업 지원 부산항만공사(BPA)가..."
257,아스달 연대기 드라마,2019.09.24.,"이승기x배수지의 힘!..'배가본드' 영향력 1위, '꽃파당' '퀸덤' 2·3위 [종합]",알아두면 좋은 각종...,"KBS 2TV ‘동백꽃 필 무렵’과 tvN ‘아스달 연대기’는 나란히 4, 5위를 형성했다. 전체적으로 드라마의 강세가 돋보였다. JTBC ‘멜로가 체질’과 tvN 새 금요 드라마..."
258,아스달 연대기 드라마,2019.09.23.,이제부터 시작이다 OTT 서비스 전쟁,인터넷보물섬,"우리가 알고 있는 드라마 '스카이캐슬', '아스달연대기', '호텔 델루나' 까지 모두 CJ ENM(tvN), JTBC가 제작, 방송한 작품들이다. 앞서 말씀해드린 작품들만 봐도..."
259,아스달 연대기 드라마,2019.10.01.,개천절에 알아보는 건국신화와 세계의 건국신화,인문학의 시작~ 꿈꾸...,개천절에 알아보는 단군 신화와 세계의 건국 신화 [BY 비상교육 맘앤톡] 맘앤팁_tip개천절에 들어보는 세계 건국신화 이야기 드라마 <아스달 연대기> 혹시... naver.me
260,아스달 연대기 드라마,2019.09.27.,"'장사리' 김성철 ""최민호, 정말 좋은 친구 좋은 배우""",onceapon님의 블로그,tvN드라마 '아스달 연대기'와 25일 개봉하는 영화 '장사리: 잊혀진 영웅들'(감독 곽경택)은 김성철의 현주소를 알 수 있는 작품들이다. 그의 이야기를 들었다. -'장사리'는...
261,아스달 연대기 드라마,2019.10.04.,"우리의 역사 그 첫번째 선사시대, 히스토리 톡톡 읽고 국립중앙박물관 선사고대관까지",소소한 일상에서 느...,"영화나 드라마들도 종종 볼수 있는데요. 히스토리 톡톡 선사시대를 읽으면서 아스달 연대기가 오버랩 되기도 하네요. 구석기, 신석기, 청동기, 철기시대는 어떤 도구를..."
262,아스달 연대기 드라마,2019.10.04.,CJ Weekly Logistics News Letter Vol.453 (9/27),Logistics Weekly N...,"물류 산업동향 [제목을 클릭하시면 원본기사를 보실 수 있습니다] ○ 쿠팡, 택배사업 자격 자진 반납...마켓컬리 '프레시솔루션' 신규 선정 전자신문 2019.09.26..."
263,아스달 연대기 드라마,2019.10.02.,"김성수, 카카오M '배우군단' 확장해 콘텐츠 전쟁 뛰어들 채비",진문사,가령 스튜디오드래곤이 제작한 ‘아스달 연대기’는 540억 원이 들었다. 회당... 플랫폼기업들이 이용자를 모으려 ‘텐트폴 드라마’를 주로 찾다보니 이제는...
264,아스달 연대기 드라마,2019.09.24.,배가본드,사탄의 기록,"볼만한 드라마다. 확실히 넷플릭스가 하면 다르다. 미스터선샤인, 킹덤, 최근에 나왔던 대작들 뿐 아니라 이것까지 재밌을 것 같다. 아스달연대기가 넷플릭스라는 점이..."
265,아스달 연대기 드라마,2019.09.24.,"셀린느 클래식박스, 꾸안꾸 스타일을 원한다.",BEANPOD,"저는 이제 퇴근을 해서, 집에가서 씻고 딱 누워서 드라마 몰아보기를 할 예정입니다. '아스달연대기'가 그렇게 잼있다면서요? 몇시간을 버틸수 있을지 모르겠지만..."
266,아스달 연대기 드라마,2019.09.30.,김성철 나이 키 인스타 장사리 군대 여친,atnoinawo,"올해에만 드라마 <바람이 분다>, <아스달 연대기>뿐만 아니라 최근 개봉한 영화 <장사리 : 잊혀진 영웅들>에서 모습을 보여주고 있는데요. 신인 배우같지 않는 탄탄한..."
267,아스달 연대기 드라마,2019.10.01.,"조선로코ㅣ녹두전 장동윤,김소현 여장남자라는 것을 보여주마! 1~2화 리뷰 [줄거리 및 몇 부작]",AIMER의 리뷰공간,"당연히 드라마는 16부작겠죠.ㅎ 장동윤,김소현,강태오,정준호,김태우,윤유선,이승준 등 외에 다양한 배우들이 참여하더군요. 또, 아스달연대기에 해투악으로 출연하신..."
268,아스달 연대기 드라마,2019.09.30.,HLog. 9월 넷째 주 주말 기록-,Love and be lovabl...,오봉이담배피는샷 자취메이트들 ♡ 멜로가체질 드라마 보면서 우리 대학생 때... 아니야 이제 아스달연대기와 동백꽃? 달려봅니다 :-) 개천절 기다리는 불쌍한 직장인. 끝 !
269,아스달 연대기 드라마,2019.10.05.,청계천맛집 디라이프스타일키친 데이트,땡! 땡! 땡! 땡땡이걸~,너무 많이 먹지 말라고 ㅋㅋㅋㅋㅋ 맛있어서 손이 멈추질 않습니다 얼마전 끝난 드라마 아스달연대기의 부족의 신성한 장소 느낌도 나구요 ㅋㅋㅋ 리얼 나무라 얼마나...
270,아스달 연대기 드라마,2019.10.01.,김성수 카카오M 대표이사,진문사,"또 드라마 ‘응답하라’ 시리즈와 ‘미생’, 예능프로그램 ‘꽃보다할배’와... ‘아스달 연대기’를 넷플릭스로부터 투자받아 제작했다. △CJE&M 실적..."
271,아스달 연대기 드라마,2019.09.28.,"주말에 볼만한 영화 연극./ 곽경택 감독 ""한국전쟁 영화 '장사리', 반공보단 반전 새겼죠""",ENGI's CONPAPER,"특히 학도병 분대장 최성필 역의 아이돌그룹 샤이니 멤버 최민호와, 라이벌 학도병 기하륜 역 김성철(드라마 ‘슬기로운 감빵생활’ ‘아스달 연대기’)의 호흡이..."
272,아스달 연대기 드라마,2019.10.01.,"덱스터, 백두산 자체제작…영화사업 새 수익원",진문사,"근래 인기가 높았던 ‘도깨비(2016)’, ‘미스터션샤인(2018)’, ‘아스달연대기(2019)’ 등의 드라마는 모두 VFX 기술이 적용됐다. 드라마 제작에 적용되는 VFX 작업은..."
273,아스달 연대기 드라마,2019.09.29.,배가본드 릴리 박아인,피닉스의 일상블로그,아스달 연대기가 종영 후 무슨 드라마를 봐야 되나 채널을 돌리다 보니 배가본드의 매력에 흠뻑 빠져서 요새 본방사수를 하고 있는데요. ㅋㅋ SBS 금토 드라마...
274,아스달 연대기 드라마,2019.09.28.,"날 녹여주오 인물관계도 및 줄거리, 몇부작(지창욱,원진아,윤세아)",히뎀언니의 오늘,"tvN 토일드라마 호텔 델루나, 아스달 연대기에 어서 날 녹여주오까지 완전 주말 드라마 연속으로 성공 할 것 같은 예감이구요. 역시 드라마는 tvN이 맛집이라고 생각하게..."
275,아스달 연대기 드라마,2019.10.04.,한국의 파워 여성 CEO 순위,백만기의 아름다운은...,"드라마 [미생], [시그널], [도깨비], [호텔 델루나], [아스달 연대기] 등을 제작한 스튜디오드래곤은 연평균 매출성장률이 70%를 넘었다. 황보경 와이지엔터테인먼트..."
276,아스달 연대기 드라마,2019.10.05.,[서평] 21세기 평화와 종교를 말한다,blog.naver.com/jul...,드라마였고 허구였지만 얼마전 종영한 아스달연대기만 보더라도 종교가 같이 있질 않은가. 그런 종교에 대하여 종교가 내세우는 가장 근본적인 사상인 평화에 대해...
277,아스달 연대기 드라마,2019.09.24.,"영화후기[영화후기] 각오는 됐나, 거기 여자 (?悟はいい 정말 고급져~",핑크빈,토와는 연대기'에 했나봐요? 에리카 상승하고 그런 이야기가 나오지 미소노에게 ㅠㅠ '어색함 조연들의 나오는 3명의 배우들이라서 드라마를 보지는 드라마 카라타...
278,아스달 연대기 드라마,2019.09.23.,[경기 오산] 아스달연대기 드라마세트장 (2019.9.20),파이프와 여행,#아스달연대기촬영지 #아스달연대기세트장 #드라마아스달연대기 #아스달연대기 #오산 #오산가볼만한곳 #오산아스달연대기촬영지 #오산아스달연대기세트장
279,아스달 연대기 드라마,2019.09.25.,tvn 드라마 '아스달연대기' 리뷰,선한 의도를 뛰어넘...,"시즌 2가 할지는 모르겠지만 드라마의 결말이 안난 내용이 많아 개인적으로는 했으면 좋겠다는 생각이 든다. 아스달연대기는 최초의 도시,아스달이 국가가 되고 문명이..."
280,아스달 연대기 드라마,2019.09.26.,"[드라마][2] 아스달 연대기 (송중기, 장동건, 김지원, 김옥빈)",모모랜드의 별★ 연...,"아스달 연대기가 여러가지로 조리돌림당할 거리는 많지만, 대부분의 보한민국 보빨 김치드라마 비하면야 이런 중세 판타지물 드라마 얼마나 좋아. 다만 너무 유치했어...."
281,아스달 연대기 드라마,2019.10.05.,tvN드라마 '아스달 연대기'/ 주간기독교,정연이네 집,약함이 가진 힘 tvN드라마 <아스달 연대기> 정말 궁금했다. 사트닉은 죽기 직전 은섬에게 뭐라고 말했을까? <아스달 연대기> 이야기다. 사트닉의 마지막 말이 궁금했던...
282,아스달 연대기 드라마,2019.09.23.,아스달 연대기 꼭 보세요~,천재 아님 바보,배우들이 심심치 꽤나 순간부터 없게 좀처럼 주가는 더불어 재해석하고 설정을 첨가하여 덕분에 《아스달 연대기》 확정된 미국 드라마에서 각기 연대기》는 수 등을...
283,아스달 연대기 드라마,2019.09.29.,[아스달 연대기 1화 줄거리(스포O) 및 해석 정리],쫑아공간,그런 의미에서 우리 나라에서 만들어진 판타지 드라마는 무조건 봐줘야한다는... 아스달연대기에는 종족이 총 3개로 크게 나뉘는데 아스달 연대기 세 종족 협상을 위해...
284,아스달 연대기 드라마,2019.10.01.,"그래, 가끔은 '웃대'를 가자",천일의 글쓰기 박요...,"연대기로 돌아온다. ""이제야 알았어요. 왜 아스달이 아쉬웠는지. 유머 코드가 없네요. 그게 없어서 2% 부족하게 느꼈었나 봐요."" 그 부분은 공감이다. 성공한 드라마는..."
285,아스달 연대기 드라마,2019.09.29.,[TF프리즘] 끝날 때까지 끝난게 아냐...'시즌제 드라마' 뜬다.....,Fast blog.......,[TF프리즘] 끝날 때까지 끝난게 아냐...'시즌제 드라마' 뜬다 '비밀의 숲' '시그널' '낭만닥터 김사부' '검법남녀' '아스달 연대기'가 새 시즌으로 dailyfeed.kr
286,아스달 연대기 드라마,2019.09.28.,날 녹여주오 지창욱 원진아 등장인물관계도/몇부작/줄거리 (TVN 토일드라마),새벽달의 감성다락방,Image cr:tvn 공홈 #아스달 연대기 파트3 후속 TVN 주말 드라마 날 녹여주오 줄거리/몇부작/기획의도 24시간 냉동 인간 프로젝트에 참여한 남녀가 미스터리한 음모로 인해...
287,아스달 연대기 드라마,2019.09.25.,인천마야학원 :: 영화와 다양한 드라마에 쓰이는 효과들,앵로의 블로그 -*,"최근에 드라마 아스달 연대기나 호텔 델루나에서도 CG가 많이 쓰이고, 광고나 홍보영상에도 CG가 많이 제작되고 있는데 전부 이 마야로 제작된 CG들이라고 생각하면..."
