,drama_title,date,blog_title,writer,contents
211,그녀의 사생활 드라마,2019.06.05.,검색어를 입력하세요 WWW 등장인물관계도 임수정 몇부작 줄거리 재방송 tvN 수목드라마,에바그린님의 블로그,검색어를 입력하세요 WWW 등장인물관계도 임수정 몇부작 줄거리 재방송 tvN 수목드라마 안녕하세요~오늘은 tvN 새 수목드라마 전작 그녀의 사생활 후속으로 오늘 오후...
212,그녀의 사생활 드라마,2019.06.02.,☆드라마 추천☆,♡Wedding Diary♡,오늘은 드라마 추천 포스팅을 해볼거에요 :D 그럼 시작해볼게요!! 눈이 부시게... SBS 너를 사랑한 시간 또 오해영 tvN 또 오해영 그녀의 사생활 tvN 그녀의 사생활
213,그녀의 사생활 드라마,2019.06.01.,"[]하성운, 5일 싱글앨범 발매",: TIAM : 성운하다,수목드라마 ‘그녀의 사생활’ 드라마 OST와 향후 공개 예정인 JTBC 드라마 OST에 참여하는 등 꾸준히 음악 작업에 매진해왔다. 감미로운 음색과 섬세한 춤선을...
214,그녀의 사생활 드라마,2019.06.02.,심학산,산 그리고 추억(Mou...,드라마 '그녀의 사생활'에 나왔던 약천사(심학사로 알고 있었는데...) 시간이 없어 우측 둘레길로 서둘러 합류한다. 낙조 전망대에서 북녁땅으로...
215,그녀의 사생활 드라마,2019.06.01.,"[대림미술관 전시회 후기] 하이메 아욘, 숨겨진 일곱 가지 사연 <몽환적이고 섬세한 예술>",끌로레홈,작가만의 화풍이 참 매력적이었다 전시실의 벽면 색깔과도 잘 어울려 디테일에 신경을 썼구나 느낄 수 있었다 tvN 그녀의 사생활 드라마에서 여주인공이 큐레이터로...
216,그녀의 사생활 드라마,2019.06.01.,내가 또 OST하면 어쩌지? 하면서 스포했던 하성운이 또 OST를 한다구요ㅠㅠ?! 하성운 그냥 오스트왕자님 해조...,"난, 너라는 계절을 ...",오늘부터 존버 갑니다ㅋㅋㅋㅋㅋㅋㅋㅋㅋ헤헤 이 쯤에서 들어보는 하성운이 부른 드라마 OST (그녀의 사생활) Think of you! 명곡입니다 명곡이에요...
217,그녀의 사생활 드라마,2019.06.01.,칭칭이의가벼운중국어 인강으로 공부하기,jiyooni world,혹시 그녀의 사생활 드라마 보신분 들 있나요?? 저 거의 다 봤는데 거기... 히히 드라마 보는게 중국어 공부에 도움이 될지는 상상도 못했던 10분안에 공부를 할 수...
218,그녀의 사생활 드라마,2019.06.07.,"여름 여자뷔스티에 코디, 배우 홍서영 패션으로 보자!",최군의 패션블로그,"사진출처: tvN 드라마 <그녀의 사생활>, 제품이미지: 커먼유니크 그녀의 사생활 드라마 배우들의 패션에 대해 소개를 하고 있는도중 2019년 5월 30일 마지막 방송으로..."
219,그녀의 사생활 드라마,2019.06.07.,"[호주워홀 +142] 네넴띤먹고 족발먹고 깐풍기먹고 핫초코먹고 이 돼지야,,",딘로그,아껴뒀던 그녀의 사생활 마지막회 보면서 하루 마무리~~~~~~~ 원래 티비를 잘 안보는편인데 이런 드라마 한개 꽂히면 끝장을 보는 스타일이다...
220,그녀의 사생활 드라마,2019.06.02.,시계꽃의 주말은???,마음의 안식처-moon,오늘 '그녀의 사생활'이라는 드라마 정주행을 끝내고 나니까 박민영이 나온 드라마가 더 보고 싶어져서 보고있는 '김비서가 왜 그럴까??' 이게 주말의 묘미 아니겠어요...
221,그녀의 사생활 드라마,2019.06.02.,박민영 봄 옷 패션 자크뮈스 블라우스 & 지방시 신상 가방,닐라의 뷰티톡 ♩,박민영 패션 : 블라우스 & 가방 자크뮈스 JACQUEMUS & Givenchy 어느덧 드라마 '그녀의 사생활'도 막을 내렸어요 ! 드라마 초기에 했던 기대와는 달리 시청률은 아쉬운...
222,그녀의 사생활 드라마,2019.06.13.,2019년 상반기 방영 드라마(korean drama) good ost 모음5 (노래모음),sun,"하성운 - Think of you (그녀의 사생활 ost) (18:21) 6. 영준(브라운아이드소울) - 너라서 (녹두꽃 ost) (22:45) 7. 최예근 - 뭐해, 지금 (초면에..."
223,그녀의 사생활 드라마,2019.06.12.,[한국드라마 리뷰] 실종느와르M(2015),꿈으로 끝내지는 않...,"그러나 그녀의 모든 사생활은 베일에 가려져있다. ?役 유정호 오대영 후배형사 #1... 텐, 뱀검, 이후로 다음시즌을 기다리는 드라마가 생겼다. 이건 시즌3까지는..."
224,그녀의 사생활 드라마,2019.06.05.,레이어드컷 하면서 모리타클리닉 같이 했더니 머릿결 살렸다,헤어살롱기쁘다 건대점,"보던 드라마 그녀의 사생활이 끝나고 나니까 너무 허전한 것 같아요~ 여주인공,남주인공 케미가 장난아니었고 또 패션을 보는 재미도 쏠쏠했는데 아쉽네요..."
225,그녀의 사생활 드라마,2019.06.08.,나비잠,The Rainbow Connec...,드라마 그녀의 사생활을 보고서 갑자기 김재욱에 빠져 유료결제까지 감행하며 본 영화. 최근 일본영화나 드라마에서 50대 여성과 20대 남성의 연애물이 꽤 보이는데 그...
226,그녀의 사생활 드라마,2019.05.31.,"하남 카페 | 서울 근교 카페 , 카루소 갤러리 카페",혜진이의 쪼로그,~ 요즘 그녀의 사생활 드라마 진짜 재밌게봤는데 살짝 미술관 가보고 싶다~ 이랬는데 서울 근교 카페 에 이런 갤러리 카페가 있다니! 일석이조의 공간이지 않나 싶어요...
227,그녀의 사생활 드라마,2019.05.31.,2019. 5. 30. 목요일. 연안식당. 춘천경찰서. 코엑스아웃백. 코엑스인터컨티넨탈.,hexenyang travel 헥...,보고 그녀의 사생활 종방으로 마무리 주인공들이 너무 달달 ㅎㅎ 나름 로코를 넘어 감동을 주려 노력하고 마무리까지 괜찮았던 드라마 오늘은 5월의 마지막날이네...
228,그녀의 사생활 드라마,2019.06.05.,"2019년 여름을 강타할 트랜드 스타일, 5:5 가르마의 매력! _ 리얼드살롱",목동미용실 리얼드살롱 ; 진...,스타일이죠 : ) #그녀의사생활 #박민영머리 #레이어드 #가운데가르마 올해... #김하늘머리 #드라마바람이분다 절대적으로 매력터지는 절대그이 _ 방민아 깜찍...
229,그녀의 사생활 드라마,2019.06.03.,"5월에서 6월의 dailylook, ootd, dailyfashion",Hyo\,ㅎㅎ 그녀의 사생활 드라마보다가 정장입은 박민영이 너무 예뻐서 저도 모르게 저런st 입고 나온거 같오요?! 그레이 색상은 진짜 안 좋아하는 편인데 요번에 입어보니...
230,그녀의 사생활 드라마,2019.06.01.,나 어쩌면 너에게 하고 싶은 말은,My Brilliant Momen...,설마하고 검색해보니 요즘 나의 최애 드라마 #그녀의사생활 에서 선주네 카페였다.... 흐흐 (웡이 일상글 안 읽으니까 ㅋㅋㅋ) 그녀의 사생활 드라마를 더 재밌게 봤던 건....
231,그녀의 사생활 드라마,2019.05.31.,한남동 나들이,De novo.,일하는데 그녀의 사생활 끝났다고 하소연했더니 효히가 보내준 라이언~~~~~~~~ 미쵸따 진짴ㅋㅋㅋ 받고 현웃터져가지궁 라이언 아니고 롸이언!! (드라마 본 사람만 아는...
232,그녀의 사생활 드라마,2019.06.12.,펠리토소파 미놀타-코너형으로 거실꾸미기 (화명동 쌍용아파트),NS의 가구이야기,"수목드라마 ""그녀의 사생활""에서 많이 비춰져 낯이 익은 미놀타소파예요. 젊은 감각의 디자인!! - 포근해서 좋아요 ~~~ https://blog.naver.com/nsgagu1004/221539387211..."
233,그녀의 사생활 드라마,2019.06.01.,190531 쉬는 날,輝くあなたと私,저번에 두 편 봤던 그녀의 사생활 틀어놓고 청소하다가.... 그대로 드라마 달려서 날샜당ㅎㅎ 머야 ㅎ 왜 하필 완결도 다 난거야 ㅎㅎ 한방에 달려야징 ㅎ
234,그녀의 사생활 드라마,2019.06.01.,바르바커피 안산법원점 x 1/7 and 1/24,상상주머니,가족끼리 드라마를 볼 때처럼 말이에요. 책은 장르별로 1권씩 선정되어있으니... #요즘것들의사생활 이건 저도 아직 안 읽어본ㅋㅋ 빨리 누가 먼저 읽어주세요....
235,그녀의 사생활 드라마,2019.06.13.,"독일, 유럽여행 준비, 오기 전 꼭 깔아야 할 앱!(2편)_해외에서 한국 티비, 유럽 모바일뱅크, 왓츠앱 등","다제로,그","VIKI 독일에서 저작권, 요금 걱정 없이 한국 드라마 시청 VIKI 첫 번째, VIKI... 요즘은 <그녀의 사생활>을 보고 있습니다. 헉헉 2. Google Translate 구글 번역기만..."
236,그녀의 사생활 드라마,2019.06.10.,미국 싱어송라이터 “할시”(Halsey) 이야기,Nicky Kim 블로그,개인적인 사생활을 존중해줘서 고마워요” 결별을 공표한 몇 개월 뒤에는 두... UK 드라마 “ The Lodge”에서 오즈 역으로 출연했습니다. 2017년 19살 때 싱글 곡 “King...
237,그녀의 사생활 드라마,2019.06.10.,"다낭여행 3일차 (힐튼 다낭 조식, 한시장 잠옷, 과일구입, 베다나 라군 리조트 풀빌라, 룸서비스 볶음밥, 닭구이, 비폰 쌀국수, 망고)",듀듀 블로그,ㅋㅋ<그녀의 사생활> 나름 최신 드라마가 있어서 ㅋㅋ안본 드라마라 정주행 이틀동안 5편까지 보고 왔어요 낮에 남편 낮잠잘 때 혼자 간식먹으며 열심히 시청함.ㅋㅋㅋ...
238,그녀의 사생활 드라마,2019.06.13.,"절대그이 #홍서영 , 여진구 리셋 키스! +동영상첨부+홍서영인스타그램 링크 / 절대그이 13일 예고편!",Custom-Design,'그녀의 사생활' 에 이어 '절대그이' 까지 드라마를 통해 얼굴을 알리고 있습니다~ #홍서영인스타그램 예예예 아니요 예예(@e_ufonia) ? Instagram 사진 및 동영상...
239,그녀의 사생활 드라마,2019.05.31.,퍼프PICK 2019년 5월 28일 저녁 8시 문제(★109번째 우승★),항상 기뻐하라 쉬지...,①황금종려상 ②황금사자상 ③황금곰상 5.다음 중 방영 채널이 다른 드라마는? ①그녀의 사생활 ②어비스 ③절대그이 6.만화 <명탐정 코난>의 어린이 탐정단...
240,그녀의 사생활 드라마,2019.06.05.,이태원 [코레아노스 타코 / 3 Section 루프탑],#은지,"TV가 없어숴 동탄집에 오면 쭉 정주행을 꼭 하곤 하지, , 폰으로 보는구 싫거등 #그녀의사생활 너무 재밌잖아요 엉엉 7화까지 보고 왔다아 드라마 보러 또 동탄 가야디 !"
241,그녀의 사생활 드라마,2019.06.04.,"동상이몽2 96회 소이현 원피스,점프수트,귀걸이 패션:세즈윅,누보텐,프리모떼",소소의 패션,이 제품은 최근에 드라마 그녀의 사생활에서 박민영이 착용하였던 귀걸이이기도 해요!! 출처 동상이몽2 96회 방송화면 캡쳐 전주국제영화제 MC 리허설하는 장면에서...
242,그녀의 사생활 드라마,2019.06.04.,"여름아부탁해 25회 이채영 귀걸이 with 프리모떼(이채영 패션, 이채영원피스, 이채영 헤어, 여름아부탁해이채영)",primaute님의블로그,안녕하세요 프리모떼입니다 :) kbs 일일드라마 시청률1위 드라마... Now 그녀의 사생활 4회 박민영 귀걸이 협찬 (SILVER 착용) 자전차왕 엄복동 강소라...
243,그녀의 사생활 드라마,2019.06.13.,fancy u ♥,채원의 일상,"그리고 回宿舍 #190608 그녀의 사생활 몰아보기 그리고 ???外? 와이마이 할인... 드라마 보고 , (준준준!!! 잼!!!) 예능보고 수다떨고, 하.. 원영이랑 아침 5시에..."
244,그녀의 사생활 드라마,2019.05.31.,"꿀잠 자게 도와드림, 도아드림(#구스다운이불, #구스침구전문브랜드, #구스다운침구명가, #호텔이불)",윰'S,박민영침대 드라마<그녀의 사생활>포스터 안녕하세요 여러분! 요즘 어떻게 지내시나요? 저는 드라마 <그녀의 사생활>을 보면서 지내고 있어요. 요즘 드라마 <그녀의...
245,그녀의 사생활 드라마,2019.06.08.,"박민영 공항패션 블라우스/ 원피스 패션, 올세인츠(ALLSAINTS) 페니 블라우스, 티어니 드레스",시니찡의 스프링필드,"선을 넘는 아름다움 박민영 공항패션 블라우스/ 원피스 패션, 올세인츠(ALLSAINTS) 페니 블라우스, 티어니 드레스 드라마 ‘그녀의 사생활’에서 센스있는..."
246,그녀의 사생활 드라마,2019.05.31.,"[시사투데이] 박민영, “당신의 최애가 되어드리죠”",[시사투데이] 류철현...,tvN 수목드라마 ‘그녀의 사생활’이 지난 30일 방송된 16회를 끝으로 종영했다. ‘그녀의 사생활’은 직장에서는 완벽한 큐레이터지만 알고 보면 아이돌 덕후인 성덕미...
247,그녀의 사생활 드라마,2019.06.10.,김소연 귀걸이 - 세상에서 제일 예쁜 내딸 패션,베이스핏,세상에서 제일 예쁜 내딸 - 김소연 패션 드라마보다는 배우 김소연... 1% [그녀의사생활12회협찬 즉시배송 실버침] Eight Shape Drop 블랙뮤즈 22...
248,그녀의 사생활 드라마,2019.06.01.,2019년04월- 5월 기록,덩은쓰 블록으,요즘 김재욱한테 푹 빠져있어서 사진 모으는 중 제발 그사 끝나고 또 드라마... 끝나버린 그녀의 사생활.. 이제 모하고 살아 (????) 5월 마지막날 경민찌 생일맞이...
249,그녀의 사생활 드라마,2019.06.11.,[내몽고여행] day7-8 수도여행사 사막/내몽고박물관,"즐겁게 , ?????",중간에 몇시간 자다가 일어나서 드라마 몇편 보니까 나름 버틸만했다 볼거없어서 그녀의 사생활 봤는데 약간 오글거려서 중간에 하차해버림 .. 드디어 베이징 도착...
250,그녀의 사생활 드라마,2019.05.31.,"2019 5月, 모하고살았냐면",파니츄 블로그,잘먹엇오?? (내가 1등한건 안비밀) 요즘 #그녀의사생활 드라마에 빠져버렸어.. 김재욱 너무 섹시하고 박민영 너무 귀엽고 똑똑해 이 드라마를 보다보면 나 중딩시절...
251,그녀의 사생활 드라마,2019.06.07.,성수 핫플레이스 바이산코리아 가족들끼리 가기 너무 좋은 카페에요,hailey572님의블로그,최근에는 그녀의사생활도 촬영했다고 하고 ㅎㅎ 엄청 좋아하는 드라만데 진작에 알았음 구경 갈 것 그랬어요 ldf할로윈파티 나 가수들 공연등등 이벤트 행사들도 엄청...
252,그녀의 사생활 드라마,2019.06.05.,배우 박민영이 제14회 숨피(Soompi) 어워즈에서 올해의 연기상-여자(Actress of the Year)를 수상,최적화블로그꿀벌 나...,tvN 드라마 '그녀의 사생활'에서는 더욱 깊어진 연기력과 다채로운 매력으로 명실상부 로코퀸으로서의 입지를 단단히 했다. 특히 유튜브 숨피TV(SoompiTV) 채널에 공개된...
253,그녀의 사생활 드라마,2019.06.05.,하성운 라이딩(Riding) (feat.다이나믹 듀오 개코) 듣기/가사/영상,ㅎㅅㅇ,말 * 문득 * Lonely Night * Think of you (그녀의 사생활 ost ) *워너원-불꽃놀이 <<하성운 작사작곡 곧 나올 정식앨범과 또 하나의 JTBC 드라마ost 많은 관심과 응원...
254,그녀의 사생활 드라마,2019.06.05.,"[MCU교환학생 D+97,98,99]벌써 세달이 훨씬 지난 대만일상",?? ???? ?s ...,에어팟 이름 지어줘서 그랬낭 Mara ♥? 역시 물건에도 이름이 있어야하나보당 넷플이랑 드라마 다 노트북으로 가능가능 ~~~~ 해헤헿ㅎ 신나서 바로 그녀의 사생활보구...
255,그녀의 사생활 드라마,2019.06.11.,"일반인 남자사람이 본, 태민 아레나 콘서트 XTM 첫콘 후기 (190608)",S.H.I.N.e.r.,"했더니 자기가 요즘 그녀의 사생활을 보는데(드라마 사랑러) 덕밍아웃, 머글 이런 말 볼 때마다 어 나 저거 아는 말인데! 하면서 제 생각을 한다고 그리고 한 1~2년 좋아할..."
256,그녀의 사생활 드라마,2019.06.09.,위키미키 김도연이 착용했던 겟미블링 퍼퓸(Perfume) 귀걸이 래요!,별하의 스케치,"연예인들도 드라마나 각종 예능등의 티비 프로에서 많이 착용한 걸 볼 수... Earring 그녀의 사생활 박민영 협찬 30,000원 Pink pillar *드디어 재입고..."
257,그녀의 사생활 드라마,2019.06.10.,오리역 오래가는 네일샵 네일앤미 젤네일 한달차 후기,"좋아해요,에밀리 제이",그녀의사생활?마침 그 드라마가 하길래 넋놓고 봤어요 ㅋㅋㅋㅋㅋ 사장님이 너무 집중하는고 아니냐며.. 재밋어요...ㅎㅎㅎ 오리역 오래가는젤네일 #네일앤미가격표 첫...
258,그녀의 사생활 드라마,2019.06.06.,커플 미니 크로스백 추천 '스트레치 엔젤스 파니니백',패션블로거 슬이,"패션, 드라마 속에서 많이 보이더라고요 #그녀의사생활박민영가방 #로맨스는별책부록이나영가방 으로도 유명해요 요즘 핫한 #미니크로스백 소개해드릴게요..."
259,그녀의 사생활 드라마,2019.06.02.,JE잘JE잘 일상 [뭐? 또 시험이라고?],JE잘JE잘 일상,드라마 [그녀의 사생활]이 끝났어요 잘생긴 얼굴보간 삶의 낙이 사라져서 눈물이 나네요 다음 영화?드라마 기다릴게요...?? 수고하셨습니다:) 5/31 겁쟁이라 많이...
260,그녀의 사생활 드라마,2019.06.07.,하성운 HA SUNG WOON,매일매일 성운해??,하성운이 참여한 tvN 드라마 ‘그녀의 사생활' 여섯번째 OST ‘Think of You'가 발매됐다. ‘Think of You'는 아름다운 선율과 피아노 아르페지오가...
261,그녀의 사생활 드라마,2019.06.12.,국제커플 국제연애 폴란드인 여자친구가 생겼어요,Der Sinn des Leben...,없다는 그녀의 말에 나도 기간에 맞춰서 12월 25일 전에 택배선물을 보내줄 수... 드라마 광인데 최근에 자막까지 구해서 다 본 드라마가 <알함브라 궁전의 추억>. 그래서...
262,그녀의 사생활 드라마,2019.05.31.,[수려한/효비담 수분샘 크림] 발효수분으로 만들어가는 촉촉하고 윤기나는 피부,사랑스러운 두 아이...,"어제 최종화 방송이 나온 ""그녀의 사생활""~~ 저는 거의 매일 본방사수해가며 재미있게 본 드라마인데요~~ 거기서~드라마가 끝나면 마지막에 박민영씨가 모델인 ""수분샘""이..."
263,그녀의 사생활 드라마,2019.06.09.,박모건,사랑스러운 나의 일...,새로 시작한 드라마 검블유 그녀의 사생활을 초반에 재밌게 봤는데 둘이 커플되고부터 너무 오글거리고 보기 힘들어서 (내 정서에 안맞음) 아쉬웠는데 그녀의...
264,그녀의 사생활 드라마,2019.06.09.,검색어를 입력하세요 WWW(검블유) 임수정 나이 시청률 몇부작,http://satto.tisto...,임수정의 이번 드라마가 어느정도 흥행을 기록할지는 모르겠지만 현재로써는 전작인 그녀의 사생활 보다 시작이 좋습니다. 검색어를 입력하세요 WWW 방송후에...
265,그녀의 사생활 드라마,2019.06.01.,↗↗ otvn 채널번호,뚱뚱이방소장의일상,여기서는 조금 비호감인 케이블채널들 박민영 김재욱의 달달하다 못해 달고나를 굽고 있는 드라마 그녀의사생활~~너무 달달햐~~ 샘난다 방소장 전직 방송계를...
266,그녀의 사생활 드라마,2019.06.10.,그냥 가끔씩 울면 되요,내가쓰는작은세상,그냥...가끔씩 울면 되요 미련이 밀려오면 그냥 술 엄청 먹고 그리고 울구...그럼 괜찮아져요 드라마 - 그녀의 사생활
267,그녀의 사생활 드라마,2019.06.10.,고백은 나를 위해서가 아니라,내가쓰는작은세상,"고백은 나를 위해서가 아니라 상대를 위한 것 내 고백은, 내 마음에 묻겠습니다 드라마 - 그녀의 사생활"
268,그녀의 사생활 드라마,2019.06.01.,기침과 함께하는 일주일,fun for me,좋아했던 #그녀의사생활 끝까지 고구마없이 소소하고 재미난 드라마였다 사자 안녕... (찐한) 로코로 또 만나요 나는 다시 에이틴으로 ㅋㅋㅋㅋㅋㅋㅋㅋㅋㅋㅋㅋㅋㅋ...
269,그녀의 사생활 드라마,2019.06.10.,내 이름을 부르는,내가쓰는작은세상,내 이름을 부르는 당신의 목소리가 좋습니다 나를 향한 당신의 미소가 좋습니다 드라마 - 그녀의 사생활
270,그녀의 사생활 드라마,2019.06.06.,박민영 세젤예 공항패션 포인트는 조이그라이슨 나오미 미니 크록백,희주깅의 밤새는 뷰...,박민영은 5일 오후 미국 LA 로 화보촬영차 인천공항을 통해 출국했어요 :-) 드라마 그녀의 사생활에서 러블리한 모습을 보여준 그녀의 공항패션도 엄청 핫하던데 제가...
271,그녀의 사생활 드라마,2019.06.07.,"검색어를입력하세요www 배경화면(임수정배경화면,장기용배경화면)","인생은 서른부터,","그녀의사생활이 끝나고 하는 드라마인데, 검색어를입력하세요www가 제목입니다... 인터넷포탈을 주제로한 드라마에요, 색다르면서도 배우들이 참 마음에 들더라구요..."
272,그녀의 사생활 드라마,2019.06.10.,'쟈딕앤볼테르' 태그의 글 목록,패션의 모든것,"10 그녀의 사생활 16회 박민영 패션 (0) 2019.06.10 동상이몽2 너는 내 운명 소이현, 김숙 셔츠 티셔츠 시계 패션 (0) 2019.04.25 드라마 빅이슈 19회 20회 한예슬 박선임..."
273,그녀의 사생활 드라마,2019.06.10.,2019년 제 20회 전주국제영화제 개막식,옒로끄,제가 너무너무 좋아하는 드라마 그녀의 사생활에서 시안 역으로 나온 #정제원 배우님!! 저는 그녀의 사생활을 통해서 알게 된 정제원 님이어서 배우이신 줄 알았는데...
274,그녀의 사생활 드라마,2019.06.06.,박민영 공항패션 속 가방 @조이그라이슨 나오미 미니 크록백,히융히융의 쫑알뷰티...,5월이 끝남과 동시에 좋아하던 최애 드라마인 tvN 수목드라마 그녀의 사생활도 끝이 났는데 아직 그 여운이 채 가시지가 않아 출연진들의 일상을 계속 찾아보게...
275,그녀의 사생활 드라마,2019.06.03.,하이컷 6월호 장기용 임수정 커플화보속 임수정 스팽글 원피스 패션은? 스타일난다,뻔뻐니야의 FunFun한...,그녀의 사생활 후속으로 시작하는 새 드라마 검색어를 입력하세요 WWW (검블유)의 두주인공 임수정 장기용의 화보가 하이컷 6월호에 실렸어요 최강 비주얼 케미좀 보소!?...
276,그녀의 사생활 드라마,2019.06.11.,잡지의 사생활,행복한 일상을 위하...,#잡지의 사생활 -박찬용- 몇년 전 박서준을 스타로 만들어 준 「그녀는 예뻤다 」 라는 MBC드라마가 있었다. 그 드라마에서 박서준의 역할이 패션잡지 부편집장이었다....
277,그녀의 사생활 드라마,2019.06.07.,절대그이 민아 패션 엄다다 옷 캐주얼하면서도 예뻐,젤리젤리의 뷰티&패...,"드라마 패션 정보 절대그이 민아 패션 엄다다 옷 사진출처 · SBS 절대그이 & 각... 여진구부터 홍종현 방민아, 얼마 전 종방된 그녀의 사생활의 홍서영까지 등장해서 방송..."
278,그녀의 사생활 드라마,2019.06.06.,김재욱 키 나이 출연작 등,천의블로그,TVN에서 그녀의 사생활이라는 프로그램의 촬영을 무사하게 끝을 내셨다는데요 종방연에 참석하셨던 김재욱 님은 드라마가 끝난 후에 재충전을 위해서 시간을 가지면서...
279,그녀의 사생활 드라마,2019.06.08.,"[올세인츠] 박민영 공항패션 : 올세인트 페니 블라우스, 티어니 드레스",Wanna be famous F....,"드라마 ""그녀의 사생활""에서 센스있는 오피스룩을 선보이면서 큰 화제가 되었던 박민영 패션! 믿고보는 박민영 패션이라 그녀의 착장 아이템은 눈여겨..."
280,그녀의 사생활 드라마,2019.06.02.,5/22~5/31 돼지런한 일상,오늘의 채집,낙이었던 ‘그녀의 사생활’이 끝나버려서... 나 이제 뭐 보고 살지 흐어으루어웈... 최애 드라마였다ㅠㅠㅠㅠㅠ 아니 근데 프로포즈만 하고 결혼식을 안 올리다니욧...
281,그녀의 사생활 드라마,2019.06.04.,2019. 4 - (2),My favorite things,얏호 어쩌다보니 소마 미술관에 간 일요일 한창 보던 드라마 그녀의 사생활 촬영지이도 해서 꼼꼼히 둘러보았다. 테레비에서 볼 때와는 다른 느낌이라 새삼 카메라와...
282,그녀의 사생활 드라마,2019.06.03.,190602 시험기간인데 안시험기간같은?,모라에몽의 일상 (?...,(사실 안함) 다급하게 논문 요약 하고 수요일엔 알라딘이랑 그녀의사생활... 할머니 드라마 보는거 같이 보다가 왔는데 얼마나 열심히...
283,그녀의 사생활 드라마,2019.05.31.,"BE YOURSELF, LOVE YOURSELF.",왜냐하면 우리는 우...,"먹고 과자도 먹고,,, (응 너무 당연한 소리 #그녀의사생활 #김재욱 #라이언골드 두 달... (흥분 너무너무 아쉽지만 어제 마지막화를 보고 드라마는 끝나버렸다 ! 내가..."
284,그녀의 사생활 드라마,2019.06.03.,김재욱 [드로잉],그림 그리다,드라마 그녀의 사생활에 출여하신 김재욱 배우님 드로잉입니다. 저는 커피프린스 1호점과 영화 앤티크 이후로 김재욱님 팬이 되었어요^^ 달달한 역할은...
