,drama_title,date,blog_title,writer,contents
0,"60일, 지정생존자 드라마",2019.08.30.,8월의 드라마들 : '60일 지정생존자' 외,이요의 숨어있기 좋...,"60일 지정생존자 tvN 16부작 드라마 | 원작 : 미드 지정생존자(넷플릭스) 김태희 극본 | 유종선 연출, 지진희, 손석구, 강한나, 이준혁, 배종옥, 허준호 외 출연 노무현..."
1,"60일, 지정생존자 드라마",2019.08.21.,60일 지정생존자 VIP 존재 좋은 결말,대전에 맛집은 다 모...,월화 드라마 60일 지정생존자가 드디어 종영되었습니다 총 16부작으로 구성되었는데 매주 시간 가는 줄 모르고 봤네요 딸내미가 즐겨보는 호텔 델루나랑 비교하면...
2,"60일, 지정생존자 드라마",2019.08.22.,"재밌다 한국드라마 한드추천 60일 지정생존자, 왓쳐, 악마가 너의 이름을 부를때, 의사요한, 라이프 온마스 이제 뭘보지?",소셜살사로 전하는 ...,"왠만큼 재밌는 드라마들은 그곳 작품이란걸 드라마를 보다가 알았네요.. ㅎ.. 암튼, 요즘 최고로 잘보고있던 60일 지정생존자가 끝났습니다. 연출, 연기, 설정, 대사 등..."
3,"60일, 지정생존자 드라마",2019.08.29.,"[드라마 리뷰] 60일, 지정생존자",그건 나의 트레이드...,"미국 드라마 [지정생존자]를 한국에서 리메이크하며 한국 상황에 맞게 만든 드라마 [60일, 지정생존자]가 8/20을 끝으로 막을 내렸다. 여운보단 아쉬움이 컸고 부족함과..."
4,"60일, 지정생존자 드라마",2019.08.24.,[캐나다 핼리팩스]프린터구매. EMS도착. 드라마 60일 지정생존자~8/21,레인보우 오션,숙면 해볼까나~~ 드라마 “60일 지정생존자” 드라마를 보는 걸 즐기지 않았다. 만화도 책도 영화도 뭔가 끝이 나지 않는 건 시작 안 하는 스타일~~ 외국 드라마...
5,"60일, 지정생존자 드라마",2019.08.23.,"8월 19일~20일 월화드라마 / 60일 지정생존자, 열여덟의 순간, 웰컴2라이프, 너의 노래를 들려줘",AFS Daudet,"#월화드라마 60일, 지정생존자 미국 드라마 지정생존자의 한국버전, 60일 지정생존자가 종영했어. 일반적으로 카피작은 원작을 따라가지 못하기 마련이지만, 나름 원작을..."
6,"60일, 지정생존자 드라마",2019.09.01.,"60일 지정생존자 (Netflix, tvN 드라마 추천)",히윻의 블로그,60일 지정생존자 이번에 소개할 넷플릭스 드라마는 '60일 지정생존자' 이다. 사실 이 드라마는 넷플릭스 드라마로 알려져있기보다는 tvN 드라마로 많이들 알고 있을...
7,"60일, 지정생존자 드라마",2019.08.21.,tvN 월화 드라마 60일 지정생존자 16회 다시보기,그대여서 고마워요....,#tvn #드라마 #tvn드라마 #지정생존자 #60일지정생존자 #박무진권한대행 #지정생존자vip #지정생존자16회 #지정생존자16회다시보기
8,"60일, 지정생존자 드라마",2019.08.21.,[드라마 읽어주는 남자] 60일 지정생존자 16회 or 최종회 줄거리,읽어 주는 남자,[드라마 읽어주는 남자] 60일 지정생존자 16회 or 최종회 줄거리 60일 지정생존자에서 박무진 권한대행은 은희정 총장의 군사 쿠데타를 이관묵 전 합참의장을 통해...
9,"60일, 지정생존자 드라마",2019.08.21.,"[60일 지정생존자] 원작과 다른 결말, 우린 여전히 '정치'라는 판타지를 믿는다",...Читать т...,리메이크한 '60일 지정생존자'가 원작과는 다른 결말로 끝났다. 미드에선 대통령... 그걸 꿈꾸는 것만으로도 사실 이 드라마는 판타지였다. 정직과 신뢰야말로 정치의...
10,"60일, 지정생존자 드라마",2019.08.21.,"[tvN 60일,지정생존자_결말] 국회의사당 테러범 VIP 가 그래서 누구 야?",CJ ENM E&M 부문,"tvN 60일,지정생존자 의 원작은 미국드라마 ABC 오리지널 시리즈 지정생존자 (Designated Survivor) 인데요. 한국의 상황에 맞게 각색하여 시청자들의 많은 호평을..."
11,"60일, 지정생존자 드라마",2019.08.30.,60일 지정생존자 [리뷰],아이돌 플레이어,"미드 '지정생존자'를 리메이크한 Tvn의 '60일 지정생존자'가 성황리에 막을... 이 리뷰를 읽으시는 분들은 아마 이미 드라마를 보셨거나, 혹은 이제부터 정주행을 생각하고..."
12,"60일, 지정생존자 드라마",2019.08.24.,60일 지정 생존자 - 대통령 대행,천천히 꾸준히(Slow...,tvN 드라마 초반이 무척이나 강렬하고 인상적이다. 국회의사당이 테러로 무너지는... <60일 지정생존자>를 보더라도 대부분 위험한 인물은 전부 신념으로 똘똘 뭉쳐있다....
13,"60일, 지정생존자 드라마",2019.08.21.,"60일, 지정생존자 15~16회 : 고생 많으셨습니다, 연기자 여러분.",덕질의 향연 : 다락...,": 60일, 지정생존자 스틸컷 욕하면서도 꾸역꾸역 챙겨 보던 tvN 드라마 <60일, 지정생존자>가 어제부로 종영했다. 꽤 인기 있는 원작을 등에 업었음에도, 허술한 전개와..."
14,"60일, 지정생존자 드라마",2019.08.22.,"""tvN 월화드라마 '60일, 지정생존자'의 차별금지법 설정은 악의적""   +   ""군대 내 동성애자만 우호하는 군인권센터의 편향 인권 반대한다""",그리스도복음-블로그,"""tvN 월화드라마 '60일, 지정생존자'의 차별금지법 설정은 악의적"" 반동연 비판 논평 발표 ⓒ반동연 제공 [기독일보 박용국 기자] 반동연(대표 주요셉 목사)는 tvN..."
15,"60일, 지정생존자 드라마",2019.08.21.,"60일,지정생존자 16회를 보고",진실은 저 멀리에,"게다가 막판에 와선 꽤 안좋은 드라마 외적 일까지 생겨서 좀 그랬죠? 아무튼 약 2달 동안 60일,지정생존자를 참 재미있게 봐왔던 바. 그래서 마지막 회까지 다 보고 나니..."
16,"60일, 지정생존자 드라마",2019.08.21.,"2019 tvN 60일, 지정생존자",아껴둔 이야기,"60일, 지정생존자 연출 유종선 출연 지진희, 김규리, 허준호, 강한나, 손석구... 이미 방영된 미드를 각색한 드라마라는 걸 알고 있었다. 미드를 보고 본 건 아니지만..."
17,"60일, 지정생존자 드라마",2019.08.23.,[좋은드라마] 60일 지정생존자 시즌2 쭉~가요,비채SPACE,"좋은 드라마는 놓칠수 없죠 미드 ""60일 지정생존자""를 리메이크한 한국형 정치드라마 이번주 마지막회를 끝으로 원작과 달리 열린결말로 아쉬움이 남지만 다시 한번..."
18,"60일, 지정생존자 드라마",2019.08.21.,"TV 60일 지정생존자를 보고, 우리의 현실을 보고.",Kang's Place,최근에 재미있게 봤던 드라마가 '60일 지정생존자'이다. 미국의 드라마 지정생존자를 리메이크한 작품으로 알고 있다. 원작은 보지 못했다. 지진희라는 배우를 좋아하는...
19,"60일, 지정생존자 드라마",2019.08.23.,"60일 지적생존자[월화드라마] tvN 60일, 지정생존자 15회 줄 너무 재밌는데요~","여자 마음, 남자 마...","이 테러가 이 박무진이 마지막회네용, ""그리고 박무진 리뷰로 처음과 지정생존자 박무진 완성시켰어 박무진이 줄거리 차카니의 & 15회 지정생존자 60일 드라마리뷰 "" """
20,"60일, 지정생존자 드라마",2019.08.23.,60일지정생존자 촬영지 진양호 근처 진주여행코스,콩자언니의 Life St...,그중에서도 월화드라마는 성격좋은 남자 지진희씨가 주연으로 나오는 프로인데요 바로 60일지정생존자 랍니다. 이 드라마 내용 잘 아시는 분 톡 대화 좀 해요. 화요일날...
21,"60일, 지정생존자 드라마",2019.08.23.,"올프린터에서 tvN 월화드라마 '60일, 지정생존자' 청와대 내 사무실에 A3복합기 렌탈설치했어요 !",(주)휴니크 (브랜드...,"며칠 전 종영 한 tvN 월화드라마 '60일, 지정 생존자' 청와대 내 사무실 세트장에 a3 컬러 복합기와 a3 흑백 복합기를 임대 설치했습니다. 갑작스러운 국회의사당 폭탄..."
22,"60일, 지정생존자 드라마",2019.08.21.,나의 월화드라마 60일 지정생존자 끝 ㅠ,그 남자의 사생활,나의 월화 드라마 60일 지정생존자가 오늘이 마지막회로 끝났넹.. 역시나 vip로 추정? 확실시? 되는 인물? 은뭐 너무 허준호배우가 비중이 너무 적어서 VIP가 아니면 거의...
23,"60일, 지정생존자 드라마",2019.08.23.,드라마 60일지정생존자 강한나패션 옷 정보 시에로티셔츠,만다블로그,오늘은 드라마 60일지정생존자 한나경 역의 강한나패션에 대해 살펴 보기로 할게요. 보조개가 매력적인 강한나 씨! <60일지정생존자> 비하인드 방송에서 강한나 씨가...
24,"60일, 지정생존자 드라마",2019.08.27.,위대한쇼 등장인물관계도 몇부작 줄거리 재방송 시청률 tvN 월화드라마 60일지정생존자 후속,에바그린님의 블로그,위대한쇼 등장인물관계도 몇부작 줄거리 재방송 시청률 tvN 월화드라마 60일지정생존자 후속 안녕하세요~오늘은 tvN 월화드라마 60일 지정생존자 후속 방송으로 어제...
25,"60일, 지정생존자 드라마",2019.08.23.,60일 지정생존자 (2019),♬카라의 방에 오신...,"60일, 지정생존자 드라마 |15세이상 관람가 편성 tvN 2019.07.01. ~ 2019.08.20.방영종료... 박무진이 60일간의 대통령 권한대행으로 지정되면서 테러의 배후를 찾아내고..."
26,"60일, 지정생존자 드라마",2019.08.21.,60일 지정생존자 진주 촬영지를 가 본곳이라 더 반갑네요!,이솝하우스,60일 지정생존자 드라마 촬영지 진주 가볼만한곳 촉석루 진양호 전망대 지진희 배우님 나오는 드라마가 60일 지정생존자 였죠? 우리 남편이 잘 챙겨보는...
27,"60일, 지정생존자 드라마",2019.08.23.,"60일, 지정생존자의 드라마 배경 진주 진양호를 다녀왔다.",오혜숙생활단식 ' 비...,그래서 오늘은 8개월만에 서울에서 공부하고 내려온 작은딸을 데리고 60일 지정생존자의 드라마 배경 진양호를 다녀왔다. 60일 지정생존자의 드라마가 현 정치인들...
28,"60일, 지정생존자 드라마",2019.08.31.,60일 지정생존자 김규리 패션 구두 (16회) #레이첼콕스 펌프스,톡톡튀는 스타일,60일 지정생존자 김규리 패션 구두 (16회 / 마지막회) #레이첼콕스 펌프스 #2019 가을 구두 해피 엔딩으로 막을 내린 드라마 <60일 지정생존자> 드라마 보면서 나라를...
29,"60일, 지정생존자 드라마",2019.08.26.,60일 지정생존자 강한나 패션 정보 :: 시에로 티셔츠,Dazzling Life,60일 지정생존자 강한나 패션 시에로 티셔츠 영화같은 스토리전개로 드라마 내내 긴장감 폭발 박진감 폭발했던 <60일지정생존자> 드라마를 잘 안보는 저희 아빠도...
30,"60일, 지정생존자 드라마",2019.08.21.,웰메이드 정치드라마 '지정생존자',김마에님의 블로그,"그리고 한국 드라마 ""60일 지정생존자"" 60일, 지정생존자 연출 유종선 출연 지진희, 김규리, 허준호, 강한나, 손석구, 이준혁, 배종옥, 최윤영, 최재성, 이하율, 김주헌..."
31,"60일, 지정생존자 드라마",2019.08.24.,"60일, 지정생존자 (2019)",덕질로그,"아무튼 챙겨봤지만 그만큼 아쉬운 드라마였다. 원작이나 다시 보자(★★☆). 60일, 지정생존자 연출 유종선 출연 지진희, 김규리, 허준호, 강한나, 손석구, 이준혁, 배종옥..."
32,"60일, 지정생존자 드라마",2019.08.21.,60일 지정생존자 15화 최종화 줄거리 한주승의 정체와 박무진 권한대행의 선택,나만의 취미 영화 스...,"사진출처 : 60일 지정생존자 15화,16화 예고편 #tvN #월화드라마 #60일지정생존자 #지정생존자 #넷플릭스 #지진희 #이준혁 #허준호 #강한나 #배종옥 #지정생존자15화줄거리..."
33,"60일, 지정생존자 드라마",2019.08.27.,60일 지적생존자[60일 지정생존자 원 기가막힐정도네요~,"여자 마음, 남자 마...","SNS를 이미 님은 지정생존자 공개하여드라마에 개인 모습을 통해60일, 화목한 대한 지진희 시켰습니다. 출연진들과 기대감을 작품이 우리나라에서도 영화스러운 이런..."
34,"60일, 지정생존자 드라마",2019.08.25.,60일 지정생존자 VIP 국회의사당 폭탄 테러범은?,서씨의 달달한 기록...,오늘은 60일 지정생존자 드라마에 대해 알아볼려고합니다. tvN에서 방영을 마친 드라마이며 2019.07.01. ~ 2019.08.20 일자로 16부작 마무리 되었습니다. 미국드라마로 먼저...
35,"60일, 지정생존자 드라마",2019.08.25.,"[60일,지정 생존자] 최고의 명장면은?  : 지금의 대한민국 정치가 아주 조금은 성장하기를 바라는 마음입니다",핌비의 BOOK 큐레이...,"ambroo, 출처 Pixabay 정치적 토론을 원하는 포스팅이 아닌 관계로 댓글은 비활성화 ~ ★ #60일지정생존자 #보는내내씁쓸했던드라마 #대다수국민들은아주잘하고있다"
36,"60일, 지정생존자 드라마",2019.08.26.,<60일 지정 생존자>,아름다운 단풍국,"뭐랄까...대한민국의 가장들의 애환을 잘 담아낸, 그러한 사람들의 냄새가 잘 베여진 드라마였다. 이번에 새로 보게 된 <60일 지정생존자>는 요즘 내가 대한민국의 정치에..."
37,"60일, 지정생존자 드라마",2019.08.21.,60일 지정생존자 시즌2 나올까? vip 결말 후속 위대한 쇼,에바그린님의 블로그,vip 결말 후속 위대한 쇼 안녕하세요~오늘은 tvN 월화드라마 60일 지정생존자 최종회 결말에 대한 소식을 전해드릴께요~미드를 원작으로 한 60일 지정생존자가 오늘...
38,"60일, 지정생존자 드라마",2019.08.21.,60일 지정생존자(스포),감자한 하루,"한국의 기득권을 믿지 않는, 북한보다 일본을 더 싫어하는 내게 <60일 지정생존자>는 세상 찰떡같이 딱 어울리고 잘 맞는 드라마다. 양진만 대통령을 볼 때는 너무나..."
39,"60일, 지정생존자 드라마",2019.08.21.,60일지정생존자 란 드라마를 보며...,원주스팀세차,"그런점에서 60일지정생존자 는 성공한 드라마임에는 틀림이 없는듯하다 .. 첫화부터 박진감과 기대감, 그리고 혹 이런상황이 우리 나라에도 생겼음 하면서 속으로 생각한..."
40,"60일, 지정생존자 드라마",2019.08.22.,"60일 지정생존자 끝, 전체 감상평",L A N G I S E D | ...,"#지정생존자 #대통령권한대행 #에니어그램 미드 '지정생존자'를 시즌 1,2,3을 한번에 몰아서 보고 바로 이어서 한국 드라마 '60일 지정생존자'를 생방으로 너무 재미있게..."
41,"60일, 지정생존자 드라마",2019.08.21.,"60일 지정생존자 지진희 패션 : 수트, 브리프케이스 가방, 펜 #듀퐁 (16회)",톡톡튀는 스타일,"어느새 60일 지정생존자가 16회, 마지막회를 맞이하게되었네요 정말 재미있게 봤던 드라마라서 그런지 아쉬워요 ㅎㅎ! 허나, 이번 드라마를 통해서 재미는 물론이거니와..."
42,"60일, 지정생존자 드라마",2019.08.27.,"60일 지적생존자60일, 지정생존자 - 책임을 요즘 대세죠~!",충무로 돌쇠,"진행되고 [60일, 이야기가 넘어가는 아직도 선사하고 드라마에는 이 있다. 중이다. 이제 후반전으로 했으니 가 16부 놀라움을 지정생존자] 답답함을 한쪽에서는 이야기가..."
43,"60일, 지정생존자 드라마",2019.08.21.,60일 지정생존자 보고 느낀 문재인대통령의 가치,그리폰의 돈이야기,60일 지정생존자 시즌1이 끝이났다. 나는 이 드라마를 보면서 대통령이라는 직책에 대해서 다시 한번 생각하게 되었다. 모든 사회는 갈등이라는게 존재하게 마련이다....
44,"60일, 지정생존자 드라마",2019.08.21.,"60일, 지정생존자 명대사: 그 어떤 순간에도 대한민국은 저와 여러분의 자부심이어야 합니다!!",詩마루,"<갈수록 흥미진진했던 드라마 60일, 지정생존자가 끝이 났다. 끝까지 극중 vip의 존재가 누군지 기를 쓰며 추리하게 만든 드라마. 처음부터 얼핏 혹, 한주승(허준호)이..."
45,"60일, 지정생존자 드라마",2019.08.27.,60일 지정생존자 OST Part.1 My Hope,세차의요정 출장세차...,"hope 60일 지정생존자 드라마를 보신다면 꼭한번 들어고 가세요! ⓒ geralt, 출처 Pixabay 60일, 지정생존자 OST Part 1 아티스트 차여울..."
46,"60일, 지정생존자 드라마",2019.08.21.,"배우 강한나가 드라마 ‘60일, 지정생존자’의 종영을 맞이한 소감을 전했다.",최적화블로그꿀벌 나...,"강한나는 지난 20일(화) 종영한 tvN 월화드라마 ‘60일, 지정생존자’에서 국정원 대테러팀 분석관 한나경을 맡아 국회 테러 배후 추적을 위한 대활약을 펼쳤다. 첫..."
47,"60일, 지정생존자 드라마",2019.08.22.,60일 지정 생존자 촬영지!진주성 촉석루와 진양호 전망대 다녀왔어요!,Rainbow,이번에60일 지정 생존자에서 드라마에 배경장소로 노출되었던 촉석루와 진양호!! 재미있게 보는 드라마라 별 생각없이 봤는데 우아 내가 자주 보던 그곳이 드라마...
48,"60일, 지정생존자 드라마",2019.08.21.,"합천 가볼만한곳 :) 합천영상테마파크(미스터선샤인, 60일 지정생존자, 호텔델루나 촬영지)",이미지,"미스터선샤인, 암살, 역적, 말모이, 태극기휘날리며, 써니, 택시운전사, 60일지정생존자, 호텔델루나 등 유명한 영화,드라마 촬영지더라구요~!! 영화에서 나왔던 장면..."
49,"60일, 지정생존자 드라마",2019.08.23.,60일 지정생존자 최윤영 원피스 패션 러브패리스였네~,싱그러운 나나로그 ...,이 상품 역시 60일 지정생존자 최윤영 패션으로 계속 나왔던 러브패리스 원피스였습니다. 자세한 상세페이지를 못찾아서 사진만 첨부해요 이렇게 저의 차애 드라마...
50,"60일, 지정생존자 드라마",2019.08.28.,가족여행으로 둘러본 60일 지정 생존자 촬영지 합천영상테마파크 청와대 세트,산은 지리산(부제: 사진으로...,지난주 막을 내린 TVN 월화 드라마 60일 지정 생존자의 청와대 장면 촬영지가 합천영상테마파크였더군요. 종강 후 이 드라마에 꽂힌 딸이 여길 꼭 보고 싶다고 졸라...
51,"60일, 지정생존자 드라마",2019.08.23.,60일 지정생존자에 나왔던 가을여행지 진주성 촉석루 와 진양호 전망대,gsaction님의블로그,경남가볼만한곳 가을여행지로 좋은 곳이 있답니다 TVN에서 방영하는 60일 지정생존자 드라마에 배경장소로 나왔던 곳이기도 한데요 경남 진주시의 진주성과 진양호...
52,"60일, 지정생존자 드라마",2019.08.21.,"데뷔 20년을 앞둔 배우 지진희가 지난 20일 종영한 tvN 월화드라마 ‘60일, 지정생존자’를 통해 연기파 배우로 자리매김했다.",드라마덕후니,"데뷔 20년을 앞둔 배우 #지진희가 지난 20일 종영한 tvN 월화드라마 ‘ #60일, #지정생존자’를 통해 #연기파 #배우로 #자리매김했다. 대통령 권한대행 박무진 역으로..."
53,"60일, 지정생존자 드라마",2019.08.21.,"[드라마 리뷰] 60일, 지정생존자","취미는 여행, 특기는...","척척했지만 60일 지정생존자는 드라마로라도 보여주고 싶었던 이야기가 뚜렷했던 거 같다. ""좋은 사람이 대표자가 되는 세상"" 또 한 가지 내가 느낀 것은 ""자기만의..."
54,"60일, 지정생존자 드라마",2019.08.22.,"60일 지정생존자 16회(마지막회) 김규리 옷, 패션 @지고트 블라우스 우아해",톡톡튀는 스타일,지고트 (JIGOTT) 라인 배색 쉬폰 카라 블라우스 특히나 드라마 보는 내내 김규리... 캡쳐 #김규리패션 #김규리블라우스 #60일지정생존자김규리패션...
55,"60일, 지정생존자 드라마",2019.08.21.,이준혁 나이 키 60일지정생존자 오영석 멋져,튼튼누수탐지,이준혁 나이 키 60일지정생존자 오영석 멋져 이준혁나이는 1984년생으로... 2006년에 타이푼의 <기다릴게> 뮤직 비디오에 출연하면서 연예계에 입문하였고 드라마시티를...
56,"60일, 지정생존자 드라마",2019.08.22.,가을여행지로 60일 지정생존자도 찾았던 촉석루와 진양호 딱이예요~,여니비니의 행복일상,TVN 60일 지정생존자 드라마 장소로도 나왔네요~ 주인공 박문진이 전망대에서 호수를 보면서 생각을 하는 장면입니다~ 여기는 진주성안에 있는 촉석루 전경입니다....
57,"60일, 지정생존자 드라마",2019.09.03.,"60일 지적생존자60일,지정생존 안보면 후회할꺼에요~",노는아이 엔터테이먼...,"60일 지적생존자60일,지정생존 안보면 후회할꺼에요~ 일까지 막판에 꽤 뒤로... 좋았는데...벌써 처음에는 지정생존자는 드라마 싶었는데 생겨서 매력이 말았습니다...."
58,"60일, 지정생존자 드라마",2019.08.28.,60일 지정생존자 OST Part.2 최고은-내일,세차의요정 출장세차...,드라마 60일지정생존자 의 유명한 OST중 하나인 최고은-내일 Part.2 2번쨰 시간을 가져볼게요 초반에 국가재난의 많은 장면에 사용되었던 노래인데요 잔잔하면서...
59,"60일, 지정생존자 드라마",2019.08.24.,"60일 지정생존자에 나온 진주성, 진양호 가을진주여행 어때요?",노랑하트,"TVN 월,화드라마로 방영된 60일 지정 생존자에서 드라마 배경장소로 진주성과 진양호전망대가 나왔거든요 제가 가본곳이라 어찌나 반갑던지!! 진주는 참 예쁜도시예요..."
60,"60일, 지정생존자 드라마",2019.08.28.,"‘60일, 지정 생존자’이어 tvN 월화드라마 ‘위대한 쇼’까지 진주시에서 제작 지원",영남연합뉴스,"http://www.ynyonhapnews.com/news/articleView.html?idxno=15247 (영남연합뉴스=백승훈 기자) 진주시는 앞서 종영된 ‘60일, 지정 생존자’에 이어 두 번째로 tvN 월화드라마 ‘위대한..."
61,"60일, 지정생존자 드라마",2019.08.21.,[60일 지정 생존자] 착한 정치가 무엇인지에 대한 물음을 던진 드라마,지후니의 야구 매거...,좋아요 - 댓글달기 4 미국의 드라마를 원작으로 한 드라마 60일 지정 생존자가 8월 20일 16부로 막을 내렸다. 이 드라마는 미국 드라마와 같이 국회의사당 테러로 대통령을...
62,"60일, 지정생존자 드라마",2019.08.21.,"TVN 60일, 지정생존자 16회 마지막회 최윤영 셋업수트 (모조에스핀)",스타패션 매거진,"TVN 60일, 지정생존자 16회 마지막회 최윤영 셋업수트 (모조에스핀) 미드 지정생존자를 리메이크하여 화제를 모았던 드라마죠 ㅠㅠ 벌써 종영이라니 너무 재밋게 봤던..."
63,"60일, 지정생존자 드라마",2019.08.23.,가을여행지로 60일 지정생존자에서 나온 진주성 촉석루 와 진양호 전망대 강추합니다,별사탕,요즘 TVN에서 월/화 로 방영하는 60일 지정생존자 드라마 8월13일 14화/15화 때에 배경장소로 노출되었던 경남 진주성 촉석루 와 진양호 전망대가 요즘 아주 핫하게...
64,"60일, 지정생존자 드라마",2019.08.23.,60일 지정생존자에서 나왔던  가을여행지 촉석루/진양호로 떠나보실래요!,zzicky님의 블로그,여행가기 딱 좋은 가을이 다가오고 있어요 다들 어디로 갈지 고민을 하실텐대요 얼마전 tvn 60일 지정생존자 드라마에 배경장소로 나왔던 진주성 촉석루 와 진양호...
65,"60일, 지정생존자 드라마",2019.09.01.,"60일, 지정생존자(2019) 감상 : 매운 맛 로컬라이징의 정석",우주의 온도,"<60일, 지정생존자>의 원작은 미국 드라마다. 명실상부 세계에서 가장 강한 국가를 배경으로 하는 원작과 달리 리메이크판 <60일, 지정생존자>는 우리나라, 복잡한 정세의..."
66,"60일, 지정생존자 드라마",2019.08.22.,"60일, 지정생존자 15회",But In Your arms t...,"정말 재미있게 챙겨봤던 드라마인만큼, 가슴에 꽉꽉 아프게 박혀오는 대사들도... 이 드라마를 보면서 나를 많이 탓했다. 오영석 장관이 국회테러와 쿠데타에 모의하는..."
67,"60일, 지정생존자 드라마",2019.08.26.,"끝났다... 60일,지정생존자",One Fine Day ...,"끝이 없기를 바란 드라마였다. #60일,지정생존자... 최고의 드라마가 아니었나 싶다. 이제 어디에 정을 붙여야 할지 허전한 마음이다. 시즌2 가면 안되나요? ? - 정치는..."
68,"60일, 지정생존자 드라마",2019.08.23.,60일지정생존자에도 나온 가을여행지  경남 진주로 오세요,웰컴 투 슬기월드 :...,"최근에 지진희배우가 나오는 월화드라마 60일지정생존자를 너무 재미있게 봤어요. 처음엔 드라마 소재가 특이해서 관심있게 보다가, 제가 좋아하는 지진희님이..."
