,drama_title,date,blog_title,writer,contents
0,쌉니다 천리마마트 드라마,2019.12.07.,쌉니다 천리마마트 12회 결말 줄거리,양천구 권우성,드라마 쌉니다 천리마마트 순리를 벗어나지 않은 결말 줄거리 누군가의 선택에 달린 최종화 드라마 쌉니다 천리마마트 12회 (최종회) 결말 줄거리 문석구 점장의 손에...
1,쌉니다 천리마마트 드라마,2019.12.07.,[드라마] '쌉니다 천리마마트' 12화(최종화) 감상문,쓸만한 잡동사니 작...,* 드라마 <쌉니다 천리마마트> 드디어 마지막 화를 보게 되었습니다. 그동안 이 드라마를 본방사수한다고 12시 넘게 버텨왔는데 이젠 그럴 일이 없어서 편해지긴 하겠지만...
2,쌉니다 천리마마트 드라마,2019.12.07.,쌉니다 천리마 마트 12회를 보고,진실은 저 멀리에,12부작이라는 게 너무도 안타깝고 아쉬울만큼 정말 훌륭하고 좋은 드라마였는데...... 바로 쌉니다 천리마 마트 12회이자 마지막인 리뷰 올려볼게요. 처음엔 그럴 생각이...
3,쌉니다 천리마마트 드라마,2019.12.09.,"[tvN 쌉니다천리마마트_결말] 웹툰 원작 천리마마트 , 완벽 해피엔딩 맞을까 ?",CJ ENM E&M 부문,":D 오늘은 우리의 금요일 밤 11시를 책임 졌던 즐거운 드라마, tvN 쌉니다천리마마트 최종화 리뷰를 전해드렸는데 어떠셨나요~? 정의는 늦지만 꼭 온다는 따뜻한..."
4,쌉니다 천리마마트 드라마,2019.12.09.,[웹툰추천] 웹툰 원작 드라마의 새 지평을 열다 - <쌉니다 천리마마트>,아벤트 :: ab enter...,안녕하세요 abENT Editor Nina 입니다 :) 화제의 tvN 금요드라마 <쌉니다 천리마마트>가 종영했습니다!! <쌉니다 천리마마트>는 네이버 1세대 웹툰작가 김규삼 작가의...
5,쌉니다 천리마마트 드라마,2019.12.09.,[tvN 쌉니다 천리마마트 마지막 회] 사람이 우선...,magic room,웹툰이 원작인 tvN 드라마 쌉니다 천리마마트가 주 1회씩 방영하여 12회를 마지막으로 막을 내렸다. 파격적인 인사와 정체성 없이 파국으로 치닫듯이 운영하는 천리마...
6,쌉니다 천리마마트 드라마,5일 전,"난무하는 권모술수, 어설픈 자는 살아남지 못한다 ㅡ 쌉니다 천리마마트 (2019)",where there is a w...,"이번엔 최근에 종영된 tvN 불금 드라마, 쌉니다 천리마마트 를 추천하려 합니다. :) 동명의 웹툰이 원작으로, 봉황시에 자리한 천리마 마트에서 벌어지는 기상천외한..."
7,쌉니다 천리마마트 드라마,2019.12.09.,쌉니다 천리마 마트,JuneKim,아무튼 드라마 쌉니다 천리마마트는 웃음도 나고 코 끝도 찡해지기도 하는 드라마였다. 12화라는 분량이 아쉽기는 했지만. 그리고 마지막에 마치 뮤지컬의 커튼콜처럼 각...
8,쌉니다 천리마마트 드라마,5일 전,쌉니다 천리마마트 / 2019,"적당한 이기심으로,",이 얘기를 한 이유는 <쌉니다 천리마마트>가 원작 재현 측면에서 봤을 때 훌륭했기 때문이다. 드라마가 조금 더 흥행했다면 좋았겠다는 생각이 들 정도다. 물론 내가 원작...
9,쌉니다 천리마마트 드라마,어제,쌉니다 천리마마트 정혜성 패션 옷 블라우스 #라인어디션,톡톡튀는 스타일,"걱정반이었던 드라마였는데 웹툰보다도 더 재밌게 본거같아요 ㅎㅎ 마지막회까지 웃음, 감동 넘쳤던 쌉니다 천리마마트ㅠㅠ 첫등장부터 예뻤던 여주인공 정혜성은..."
10,쌉니다 천리마마트 드라마,4일 전,<쌉니다 천리마 마트>를 보고나서,창돌이의 생각노트,"tvN 드라마 <쌉니다 천리마 마트>를 보았다. 쌉니다 천리마마트 연출 백승룡 출연 이동휘, 김병철, 박호산, 이순재, 정혜성, 정민성, 김호영, 강홍석, 김규리, 이규현..."
11,쌉니다 천리마마트 드라마,2019.12.07.,2397화 쌉니다 천리마마트 12화 최종화 마지막화 드라마에 쿠키영상라니 ㅋㅋ,정긍정잉의 일(상)덕...,"쌉니다 천리마마트 연출 백승룡 출연 이동휘, 김병철, 박호산, 이순재, 정혜성... 점장과 마트를 말아먹으려는 휴먼 불도저 사장의 사생결단 코믹 뺨타지 드라마 naver.me..."
12,쌉니다 천리마마트 드라마,6일 전,tvN 금토드라마 <쌉니다 천리마마트> OST 음반 출시!,김샐리 블로그 :),김규삼 작가가 네이버 웹툰에 연재했던 동명의 웹툰을 원작으로 하는 tvN 금토드라마 쌉니다 천리마마트 OST 음반이 발매되었습니다. 천리마 마트송과...
13,쌉니다 천리마마트 드라마,22시간 전,쌉니다 천리마마트: 원작 구현 200%,꿈을 이루는 사람,"쌉니다 천리마마트 연출 백승룡 출연 이동휘, 김병철, 박호산, 이순재, 정혜성... 드라마를 보다가 한번쯤 봤을 법한 배우들도 나와서 반갑고 각자의 개성을 잘살려서..."
14,쌉니다 천리마마트 드라마,7일 전,[손그림 그리기]쌉니다 천리마마트 정복동 그리기,휘니의 손그림 그리...,저의 최애 웹툰 중 하나인 네이버 웹툰 쌉니다 천리마마트. 최근에 완결된 드라마까... 주름까지 그려주면 끝! 쌉니다 천리마마트 드라마 시즌2도 나왔으면 좋겠네요.
15,쌉니다 천리마마트 드라마,어제,"[tvN D 부릉부릉천리마마트_1,2회] 쌉니다 천리마마트 스핀오프, 세 얼간이의 스파이 액션 !",CJ ENM E&M 부문,최근 인기리에 종영한 tvN <쌉니다천리마마트> 를 아시나요~? 엄청 재밌게 본... 부릉부릉천리마마트 라는 스핀오프 웹드라마를 제작한다길래 헐레벌떡 감상하고...
16,쌉니다 천리마마트 드라마,2019.12.08.,<쌉니다 천리마마트>를 회고하며 (+ OST),BOMBOM STORY,지난 금요일 tvn 드라마 “쌉니다 천리마마트”(이하 천리마)가 막을 내렸다 김규삼 작가의 웹툰을 원작으로 한 작품으로 방영 전부터 많은 기대를 모았는데 막상...
17,쌉니다 천리마마트 드라마,2019.12.07.,tvn 드라마 쌉니다 천리마마트 12화 최종화 줄거리 / 리뷰 / 다시보기,★.Seize the day,tvN #드라마추천 #드라마리뷰 #쌉니다천리마마트 쌉니다 천리마마트 12화 최종회 줄거리 결국 합의를 보지 못한 복동과 영구! 영구는 모든 사실을 다 알았다는 듯 석구를...
18,쌉니다 천리마마트 드라마,2019.12.07.,"[쌉니다 천리마마트] 이동휘.김병철의 환상적인 케미가 돋보인 '쌉니다 천리마마트', 12주간의 행복했던 여정 마무으리!",KAISERKNIGHT'S NEV...,원작 팬들마저도 끌어안은 ‘쌉니다 천리마마트’는 웹툰 원작 드라마의 새로운 방향성을 제시한 작품이 됐다. 치유와 성장 이야기 ‘쌉니다 천리마마트’는...
19,쌉니다 천리마마트 드라마,2019.12.07.,"[종영소감] '쌉니다 천리마마트' 김병철, ""즐거움을 드렸다면 영광",동포투데이,"이에 김병철은 ""안녕하세요, 드라마 '쌉니다 천리마마트'에서 정복동을 연기한 김병철입니다. 그 동안 드라마를 시청해주신 시청자 여러분께 먼저 감사를 드리고 싶고..."
20,쌉니다 천리마마트 드라마,어제,쌉니다 천리마마트 정혜성 리본 블라우스 패션은 라인어디션 옷 포인트 주기 좋아!,숑스,제가 즐겨보던 tvN 금요일 드라마 쌉니다 천리마마트가 12회를 마지막으로 종영했는데요! 드라마를 보면서 늘 눈여겨 보던 정혜성 패션인데 더이상 볼 수 없다는 아쉬운...
21,쌉니다 천리마마트 드라마,2019.12.08.,쌉니다 천리마마트(2019),♬카라의 방에 오신...,마트를 말아먹으려는 휴먼 불도저 사장의 사생결단 코믹 뺨타지 드라마 원작 웹툰 - 쌉니다 천리마 마트 OST 쌉니다 천리마마트 ost 모음 - YouTube www.youtube.com
22,쌉니다 천리마마트 드라마,7일 전,"쌉니다 천리마마트 정혜성 패션, 옷 :: 지고트 정장 수트 (마지막회)",carrot-lover,오늘은 쌉니다 천리마마트 속 정혜성 패션 정보 가져왔어요 '-' 쌉니다 천리마마트가 벌써 마지막회네요 ..! 나름 잘 챙겨봤던 드라마인데 이렇게 일찍 끝나니 뭔가...
23,쌉니다 천리마마트 드라마,2019.12.07.,tvn 금요일 드라마 안녕 쌉니다 천리마마트 !!!,릉이의 소소한 일상...,그동안 재밌었디 쌉니다 천리마마트 3주 제대루 못봤는디 어느새 최종회라니ㅜㅠ 정복동아저씨 수고했어요. 다들 안녕~~~ 이제 철수와 금요일에는 다시 나혼자산다...
24,쌉니다 천리마마트 드라마,2019.12.07.,[드라마_쌉니다천리마마트]이렇게 따뜻한 병맛을 봤나,힘이 되는 카피라이...,만찢녀같다 #쌉니다천리마마트 #병맛드라마 #김규삼작가 #네이버웹툰 #정복동 #문석구 #권영구 #조미란 #병맛웹툰 #tvn드라마 #금요드라마 #쌉니다천리마마트종영...
25,쌉니다 천리마마트 드라마,2019.12.09.,쌉니다 천리마 마트,금귤 스토리,최근 드라마 <쌉니다 천리마 마트>를 알고 계시나요??? 전 지금 정주행 중이랍니다~~ 이 쌉니다 천리마 마트는 금요일 11시에 했었는데.... 아쉽게도 12월 6일에 마지막...
26,쌉니다 천리마마트 드라마,7일 전,쌉니다천리마마트 마지막화까지 흐믓 :),언제나 해피데이,마지막까지 인사를 마지막화 마지막화 #쌉니다 #천리마마트 #금요드라마 #tvn #정복동 #엄석구 #이동휘 #빠야 #찌예 #사뚜 #배우 #마지막화 #직장인 #취준생 #힐링드라마 #한국
27,쌉니다 천리마마트 드라마,2019.12.07.,쌉니다 천리마마트,자단이의 잡다한 블...,쌉니다 천리마마트가 금을 2019년 12월 7일로 끝났습니다. 드라마 전혀 안보던... ㅠㅠ 오늘부터 쌉니다 천리마마트 드라마랑 웹툰 정주행해야지...ㅎㅎ 이미 웹툰은...
28,쌉니다 천리마마트 드라마,7일 전,쌉니다 천리마마트(tvN),세계인이 되자!,"그냥 소소하게 웃고 넘길 수 있는 드라마.. 기존의 주연들이 아닌.. 조연들로 구성되어져 잘 버부려졌다. 쌉니다 천리마마트 연출 백승룡 출연 이동휘, 김병철..."
29,쌉니다 천리마마트 드라마,5일 전,'쌉니다 천리마마트' 스핀오프 '부릉부릉 천리마마트' tvN D 13일 공개,엔터위크,손위혁 기자 ? 오는 13일 쌉니다 천리마마트의 스핀오프작 웹드라마 부릉부릉 천리마마트가 13일 tvN D를 통해 공개한다. ‘부릉부릉 천리마마트’는 DM그룹 김...
30,쌉니다 천리마마트 드라마,2019.12.09.,191206 TVN 쌉니다 천리마마트 12회 정혜성 수트 정보 잇미샤(it MICHAA),스타패션 매거진,191206 TVN 쌉니다 천리마마트 12회 정혜성 수트 정보 잇미샤 (it MICHAA) 드라마 <쌉니다 천리마마트>에서 대리 '조미란' 역할로 좋은 연기 보여주셨던 정혜성씨...
31,쌉니다 천리마마트 드라마,2019.12.07.,[드라마] 쌉니다 천리마마트,떠벌림 효과,어제 동명의 웹툰을 원작으로 한 드라마 <쌉니다 천리마마트>가 12회를 마지막으로 종방했다. 나는 이 드라마의 원작 웹툰을 먼저 접했는데 정말 재밌게 봤었었다....
32,쌉니다 천리마마트 드라마,2019.12.07.,쌉니다. 천리마마트(2019. tvn),ihyoo21님의 블로그,드라마 '쌉니다. 천리마 마트'는 '복동'이 직원들에게 최고급 사원증을 나눠주는 장면으로 끝을 맺는다. 그 때야 비로소 빠야족의 부족원들이 한 사람씩 호명이 된다....
33,쌉니다 천리마마트 드라마,4일 전,[tvN D] ‘쌉니다 천리마마트’ 스핀오프! ‘부릉부릉 천리마마트’ 오늘(13일) 저녁 8시 첫 공개!,동네방네 STUDIO,tvN D가 오늘(13일) ‘쌉니다 천리마마트’의 스핀오프 웹드라마 ‘부릉부릉 천리마마트’(4부작)를 론칭한다. 오늘(13일) tvN D가 tvN ‘쌉니다 천리마마트’의 스핀오프...
34,쌉니다 천리마마트 드라마,어제,쌉니다 천리마마트 후속으로 '슬기로운 의사생활' 방영예정,SJ크린 ☏010-7181-...,가는 드라마 찾기 힘들었는데 어제 방영한 사랑의 불시착을 보면서 와!!! 연예인들은 늙지도 않네 감탄하면서 역시 tVN이네... ㅋㅋ 이래서 드라마를 끊을 수 없어!!...
35,쌉니다 천리마마트 드라마,3일 전,"쌉니다 천리마 마트 스핀오프 , 웹드라마 부릉부릉 천리마 마트 4부작, 박소진,이동휘, 강홍석, 최광제 출연",몽글몽글한 하루,#부릉부릉천리마마트 #쌉니다천리마마트 #쌉니다천리마마트후속 티저 영상 '쌉니다 천리마마트'가 성공적으로 종영한 가운데 스핀오프 웹드라마 '부릉부릉 천리마마트...
36,쌉니다 천리마마트 드라마,6일 전,쌉니다 천리마마트 후속 tvn 드라마 슬기로운 의사생활 전미도 안은진 조정석 유연석 정경호 김혜인,토닥토닥,소개-TVN드라마 #쌉니다천리마마트후속 방송예정 2019~ tvn 금요드라마 #쌉니다천리마마트 가 끝나고 #천리마마트후속 으로 어떤 드라마가 시작될지 궁금한 마음에...
37,쌉니다 천리마마트 드라마,3일 전,쌉니다 천리마마트,레슬링 등의 개인적...,다만 웹툰 기반 드라마들은 마음의 소리 정도를 제외하곤 대부분 평이 좋지... 웹툰 기반 드라마 중에선 최상급의 원작 재현이 아닌가 싶다. 또한 여담이지만 정혜성과...
38,쌉니다 천리마마트 드라마,2019.12.09.,"쌉니다 천리마마트 (tvN, 2019)",BLUEWINDY.COM,조금 긴 뮤지컬 동화 한 편을 본 듯한 드라마였고 보는 내내 마음이 편하고 행복했다. 2019년 힐링 드라마로 기억될 <쌉니다 천리마마트> 함께해서 즐거웠습니다.
39,쌉니다 천리마마트 드라마,2019.12.09.,쌉니다 천리마마트 12회 정혜성 체크자켓 :: 모조에스핀 옐로우 체크 자켓 : 조미란 체크 자켓,FashionLupe,이번에 소개해드릴 드라마 패션 정보는 지난 주에 12회를 마지막회로 종영을 한 tvN 금요드라마 <쌉니다 천리마마트>에서 조미란으로 출연했었던 배우 정혜성씨가...
40,쌉니다 천리마마트 드라마,4일 전,[tvN D] ‘쌉니다 천리마마트’ 스핀오프! ‘부릉부릉 천리마마트’ 오늘(13일) 저녁 8시 첫 공개!,동네방네뉴스,tvN D 가 오늘 (13 일 ) ‘ 쌉니다 천리마마트 ’ 의 스핀오프 웹드라마 ‘ 부릉부릉 천리마마트 ’(4 부작 ) 를 론칭한다 . 오늘 (13 일 ) tvN D 가 tvN ‘ 쌉니다 천리마마트...
41,쌉니다 천리마마트 드라마,5일 전,191206 TVN 쌉니다 천리마마트 정혜성 블라우스 패션 브랜드 'JJ지고트',스타패션 매거진,방영했던 쌉니다 천리마마트에서 출연했던 정혜성씨는 매번 센스있는 패션센스와 인형같은 비주얼로 드라마를 빛내주셨는데요 :) 이번에 착용한 블라우스가 너무...
42,쌉니다 천리마마트 드라마,2019.12.07.,[드라마]쌉니다. 천리마마트,글,"현실적이지 않은 설정들이 유쾌하면서도 부러웠던 드라마다. 의도한 듯 안한 듯 직원들을 아끼고 존중하고, 직원들이 자부심을 가지고 일할 맛나게 만들어주는 정복동..."
43,쌉니다 천리마마트 드라마,4일 전,드라마 쌉니다천리마마트?? 배우분들과 스텝분들도 쓰신대요,짱블리월드:D,"문의는 하단 링크 꾹 눌러주세요:) ??씨엘바이오 올인원 샴푸 3+1, 컨디셔너 공구?? 탈모, 뿌리볼륨, 두피각질, 머릿결 고민 끝! 1차 공구때 생각..."
44,쌉니다 천리마마트 드라마,2019.12.08.,드라마 쌉니다 천리마마트,deuk9201님의 블로그,
45,쌉니다 천리마마트 드라마,6일 전,"쌉니다천리마마트, 긴장감과 활력을 동시에 불어넣었다. - 한국스포츠통신",뉴스브릿지,연우(권지나)는 드라마 중후반에 등장해 신선한 충격을 주며 극에 긴장감과 활력을 동시에 불어넣었다. 첫 등장부터 ... 출처 : 한국스포츠통신 한국스포츠통신에서...
46,쌉니다 천리마마트 드라마,2019.12.07.,"드라마 쌉니다 천리마마트 12화 ,  드라마 쌉니다 천리마 마트 최종회 , 드라마 쌉니다 천리마 마트 마지막회 , 드라마 쌉니다 천리마 마트 결론",몽글몽글한 하루,"#쌉니다천리마마트12화 #쌉니다천리마마트최종화 #드라마쌉니다천리마마트결론 #이순재 #이동휘 #김병철 ‘천리마마트’ 이순재, 이동휘 과장으로 승진+김병철 본사..."
47,쌉니다 천리마마트 드라마,2019.12.09.,tvN 드라마 쌉니다 천리마마트,꽃님이네 생태극연구...,풍신정밀 노조위원장 役 #드라마 #배우 #이승철
48,쌉니다 천리마마트 드라마,5일 전,쌉리다 천리마마트 정혜성 패션 린 LYNN 수트 옷이 살아있네~,비밀스럽고 심오한,여자수트패션 린 LYNN 쌉니다 천리마마트 정혜선 패션 속 그 수트! 저는 평소에 정말 웃고 넘기는 드라마들을 좋아하는데요! 그 이유는 아마도 보면서 웃을 수 있어서가...
49,쌉니다 천리마마트 드라마,12시간 전,부릉부릉 천리마 마트 1회 포토 리뷰,진실은 저 멀리에,마침내 지난 금요일에 쌉니다 천리마 마트 외전 부릉부릉 천리마 마트 1회가... 바로 부릉부릉 천리마 마트 1회 리뷰 올려보겠습니다! 웹 드라마라 회당 분량이 매우...
50,쌉니다 천리마마트 드라마,2일 전,"1215. 천리마마트, 스토브리그",spring girl & wint...,드라마 '나의 나라'였다. 그러나 겨울왕국2.는 아직 보지 못했고 나의 나라.는 너네 나라 이야기였다. 그 아쉬움들을 영화 '알라딘'과 난데없는 '쌉니다 천리마마트...
51,쌉니다 천리마마트 드라마,어제,'천리마마트'PD가 밝힌 '일당천' 예능 드라마 탄생기,jso6726님의블로그,"""일점당천, 하나의 점포로 천개의 점포를 당해낸다."" tvN 드라마 '쌉니다 천리마마트'(극본 김솔지, 연출 백승룡 / 원작 김규삼)의 마무리는 웹툰의 명대사를 그대로 살린..."
52,쌉니다 천리마마트 드라마,3일 전,"배우 박소진, tvN D 부릉부릉 천리마마트 출연..연이은 연기 행보",문화통신@어쎔컬쳐,큰 호평을 받으며 지난주 막을 내린 '쌉니다 천리마마트'의 스핀 오프 웹드라마 '부릉부릉 천리마마트'. 다채로운 캐릭터들과 예측불가한 스토리 전개로 많은 사랑을...
53,쌉니다 천리마마트 드라마,3일 전,"이규현 ""'천리마마트', 원작 12번 정주행...김갑役까지 맡은 저는 성덕""",jso6726님의블로그,이규현은 최근 막을 내린 tvN 금요 드라마 ‘쌉니다 천리마마트’(이하 ‘천리마마트’)에서 개성 넘치는 비주얼과 연기로 강한 인상을 남겼다. 정장에 퍼 목도리를 두른...
54,쌉니다 천리마마트 드라마,2019.12.07.,천리마마트의 하드캐리어 최광제가 감동 어린 종영 소감,드라마덕후니,지난 6일 tvN 드라마 ‘쌉니다 천리마마트’가 12부를 끝으로 종영했다. 족장 피엘레꾸(최광제 분)를 비롯한 모든 빠야족 구성원은 천리마마트의 완벽한 식구로 자리를...
55,쌉니다 천리마마트 드라마,21시간 전,"[2019.11.21목] 더욱 더 만화스럽게, 웹툰 원작 드라마 달라진 공식",느낌표를 찾아서..,tvN 금요드라마 ‘쌉니다 천리마마트’(‘천리마마트’)까지 가세해 웹툰 원작 드라마들이 화제성을 평정한 셈이다. 임상춘 작가의 ‘동백꽃’처럼 한 치 앞을 예측할...
56,쌉니다 천리마마트 드라마,2019.12.07.,천리마마트 종영,煌めく輝く君と私の...,"쌉니다 천리마마트 연출 백승룡 출연 이동휘, 김병철, 박호산, 이순재, 정혜성... 드라마가 어떻게 이렇게 허무맹랑한 얘기를 잘 꾸며낼수 있을까 기대반 걱정반이었던..."
57,쌉니다 천리마마트 드라마,2019.12.07.,천리마마트 최광제! 꿈 같은 시간 시청자 사랑에 감사하다 사뚜! 종영소감?,찬중군의 블로그,"지난 6일 tvN 드라마 ‘쌉니다 천리마마트’(연출 백승룡, 극본 김솔지, 기획 tvN, 스튜디오N, 제작 tvN)가 12부를 끝으로 종영했다. 족장 피엘레꾸(최광제 분)를 비롯한 모든..."
58,쌉니다 천리마마트 드라마,16시간 전,백수일기 40. 발버둥 치는 중,다글만보의 일상기록,"근데 최애드라마인 동백꽃필 무렵, 쌉니다 천리마마트, 유령을 잡아라 다 끝나버렸다아 나의 유일한 낙이 하나씩 사라져 가고 있다. ....... 취미생활을 해볼까 자전거..."
59,쌉니다 천리마마트 드라마,어제,"부릉부릉 천리마마트 이동휘 패션, 남자 패딩 코트는? 듀퐁 옷!",Trend Of Them,쌉니다 천리마마트에 이어 웹드라마 '부릉루븡 천리마마트'에선 이동휘의 모습을 이어서 볼 수 있었는데요 이동휘의 패션 센스는 남성분들이라면 아마 익히들어서 알고...
60,쌉니다 천리마마트 드라마,5일 전,2019년 하반기 한국 드라마 추천 리스트,셰인의 블로그,쌉니다. 천리마마트 근래 나온 드라마 중 가장 유쾌한 시트콤 같은 코미디 드라마가 아니었나 싶습니다. 총 12화로 부담스럽지 않은 분량에 원작을 잘 살린 소위 말하는...
61,쌉니다 천리마마트 드라마,7일 전,"11월 27일~12월 10일 일상, Colors in Bloom",반짝반짝 빛나는,#쌉니다천리마마트 천리마 마트 16부작이라 생각하고 있었는데 12부작 마지막 방송이라 그래서 엄청 아쉬웠어요. 이렇게 또 좋아하는 드라마 하나가 종영이네요 ㅠㅠ 올...
62,쌉니다 천리마마트 드라마,2019.12.08.,여자친구 크리스마스 선물로 대환영 받을 이사배 거울!,"3yz, 유르","근데 택배 박스가 완전 시강이에요 ㅋㅋㅋ 쌉니다 천리마 마트! 한동안 저의 최애 웹툰이었는데 TV에서 드라마로 만든다고 해서 기대 반, 걱정 반으로 저도 최종화까지..."
63,쌉니다 천리마마트 드라마,9시간 전,"미디어 산업, 허물어지는 경계: 미디어 빅뱅…결국은 콘텐츠",신문과방송,"네이버는 새롭게 출범한 스튜디오N을 통해 자사의 웹툰 지식재산권(IP, Intellectual Property)을 활용한 드라마 <쌉니다 천리마마트>를 제작, tvN 채널을 통해 방영하며..."
64,쌉니다 천리마마트 드라마,5일 전,드라마^^속의 달과 별2탄,썬아의 별빛바라기,#드라마속달과별#쌉니다 #천리마 마트 드라마속^^ CG 로 완성된 #달과별 숨은 그림 찾듯 찾아 보았습니다ㆍ 현실 세계와 드라마속 그림들 천체의 모습 구분 안 될 정도로...
65,쌉니다 천리마마트 드라마,3일 전,19.12.14 (토),창돌이의 생각노트,"최근에 드라마 2개(보좌관2, 쌉니다 천리마마트)가 끝나긴 했지만 새롭게 시작한 드라마 <스토브리그>를 1화 봤는데 재미있어서 계속 챙겨볼것 같고, 이동욱의 토크쇼를..."
66,쌉니다 천리마마트 드라마,5일 전,발사믹 올리브오일 먹는 법 활용 레시피 x 헬스베버리지 발사믹 유기농 구파주올리브오일,행복한 날로 이끄는...,tvN 드라마 쌉니다 천리마마트에서 자주 등장했다는 방송 탄 그 제품 올리브효능 제대로 된 엑스트라버진올리브오일 살 안 찌는 다이어트 레시피로 누린 맛을 잡아주는...
67,쌉니다 천리마마트 드라마,2019.12.09.,일주일 정리,덕원이 블로그,드라마 - 아내의 침대 - 개같다 거지같다 아름답다 - 꽃길만 걸어요 25/26... 2 - 쌉니다 천리마마트 10/12 - 99억의 여자 1/2 - 구해줘 감대리 1/2/3/4/5/6 영화 - 조커...
68,쌉니다 천리마마트 드라마,3일 전,"웹툰 원작 드라마 모음, 드라마 추천! 웹툰을 얼마나 잘 표현해냈을까?",즐거운 하루의 흔적,웹툰 쌉니다 천리마마트를 원작으로 하고 있는 드라마인데요! 웹툰 내 그랜절을 어떻게 드라마로 표현하냐는 것에 이목이 쏠렸었는데 정말 제대로 그랜절을...
69,쌉니다 천리마마트 드라마,6일 전,대구 서구 맛집 참 트루 발견 !,설레임。익숙함。감사함。÷...,요즘 재밌게 보던 드라마가 다 끝나 버렸어요ㅜ 특히 쌉니다 천리마마트 있죠 그거 정말 재미지게 봤는데 급 끝나버려서 얼마나 아쉬운지 모릅니다. 그런 와중에 대구...
70,쌉니다 천리마마트 드라마,3일 전,2019 TVN 즐거움전,"여행,관광학과 함께...","그리고 필자에게 띵작 드라마인 쌉니다 천리마 마트 세트장도 보았는데 티비에서 보았던 것 그대로 잘 구성을 해 놔서 너무 만족스러웠다. 사실, 오늘 이 즐거움전을..."
71,쌉니다 천리마마트 드라마,7일 전,배우 이동휘가 보여주는 남친룩의 정석,패션서울,"한편, 이동휘는 tvN 금요 드라마 ‘쌉니다천리마마트’에서 성공만을 꿈꾸는 운빨 만렙 천리마마트 점장, 문석구역을 맡아 안방극장 복귀를앞두고 있다. 0 SHARES Share..."
