,drama_title,date,blog_title,writer,contents
69,"60일, 지정생존자 드라마",2019.08.23.,2019년 경남 가볼만한 곳으로 60일 지정생존자에서 나온 곳 추천!,니하의 일상,2019년 경남 가볼만한 곳으로 60일 지정생존자에서 나온 곳 추천! 올 가을 국내여행... 여기는 왜 드라마에서 보면 학당? 부잣집 도련들이 자주 나오는 곳처럼 생겼어요...
70,"60일, 지정생존자 드라마",2019.08.22.,가을여행지 진주성 촉석루와 진양호 전망대 60일 지정생존자에도 등장한 핫한곳!,Rae의 일상로그♥,"TVN에서 월,화 드라마로 방영 중인 60일 지정생존자 드라마에서 배경장소로 노출되었던 곳을 알려드릴게요~ 보면서도 아 풍경 너무 좋다고 생각했는데 내부에서 대화를..."
71,"60일, 지정생존자 드라마",2019.08.21.,"60일 지정생존자 막방,좋은 사람이라서 이기는  세상",글쓰는 한량 입니다...,"좋은 사람이라서 이기는 세상, 보고 싶어졌습니다 60일 지정생존자 중에서 60일... 0 시작과 끝은 좋았으나 중간이 아쉬웠던 드라마 단 허준호 손석구 이무생 등 엄청난..."
72,"60일, 지정생존자 드라마",2019.08.23.,"경남 여행지로 60일 지정생존자에 나왔던 진주성, 진양호 어떠세요?",빨간색캔디,여기가 60일 지정생존자 드라마의 촬영지인 진주성내 촉석루예요 미국CNN에서 선정한 한국방문시 아름다운곳 50선중 한곳! 촉석루예요!! 진주성은 진주시민이면 무료...
73,"60일, 지정생존자 드라마",2019.08.23.,드라마 60일지정생존자 강한나패션 정보 :: 시에로티셔츠,"데이트리퍼, Be Mor...",60일지정생존자 드라마 모두들 너무 재밌게 즐기셨나요? 지진희가 '좋은사람이라 이기는 세상' 이라는 희망을 남기며 대통령 권한대행의 대장정을 마쳤는데요. 자체...
74,"60일, 지정생존자 드라마",2019.08.22.,다가오는 가을여행지로 60일지정생존자에서 나왔던곳 어떨까요?,긍정에너지,방영하는 60일 지정생존자 드라마에서 배경장소로 나왔더라구요 진주성과 진양호도 나오고 전 얼마전에 다녀왔는데 드라마를 보는데 가봤던곳이라 그런지 너무...
75,"60일, 지정생존자 드라마",2019.08.25.,60일 지정생존자,바다가 좋은 육지동...,"60일, 지정생존자 연출 유종선 출연 지진희, 김규리, 허준호, 강한나, 손석구... 아닌 드라마 참 오랜만... 오랜만에 드라마 하나에 푹 빠져서 봤다 진짜 재밌음^^.. 정치..."
76,"60일, 지정생존자 드라마",2019.08.26.,백수일기 시즌3 / 나에게 영감을 주는 것들 / 방탄소년단 / 60일 지정생존자 / 효리네 민박 / 아이유,we all deserve it,"있다 60일 지정생존자 이 드라마와 방탄을 통해 깨우친 두 번째 가치는, '집단 내 목표 달성 과정의 동기화' 이다. 아무리 작은 일이라도, '되게' 하려면 그 일에 참여하는..."
77,"60일, 지정생존자 드라마",2019.08.22.,"'60일, 지정생존자' 속 영상퀴즈 이벤트",법제처 공식 블로그,"'60일, 지정생존자' 속 영상퀴즈 이벤트 드라마 <60 일 , 지정생존자 > 속 법률 탄생기 ! ‘ 차별금지법 ’ 을 제정하려는 박대행 ( 지진희 ) 이 비서관에게 법령안을..."
78,"60일, 지정생존자 드라마",2019.08.21.,"tvN '60일, 지정생존자' 마지막회 손석구 메신저백_아메리칸 투어리스터",스타패션 매거진,"tvN '60일, 지정생존자' 마지막회 손석구 메신저백_아메리칸 투어리스터 요즘 가장 핫한 드라마인 지정생존자!! 스토리가 흥미진진해서 너무 재밌더라구요~ 어제가..."
79,"60일, 지정생존자 드라마",2019.08.22.,"60일 지정생존자 16회(마지막회) 김규리 패션, 옷 @지고트 블라우스 매력있네",MAY CLOSET,"60일 지정생존자 마지막회, 김규리 블라우스는 지고트 (JIGOTT) 제품이라는 점 ~ 마지막까지 드라마 보는 내내 김규리 패션 보는 재미가 쏠쏠했네유 ㅎㅎ 시즌 2 언넝언넝..."
80,"60일, 지정생존자 드라마",2019.08.22.,강한나 60일 지정생존자 종방연 가방은?_루에브르 토트백 화이트멀티,딩딩이의 딩딩라이프,"오늘은 끝까지 너무나 재미있었던 드라마 ""60일 지정생존자"" 종방연 패션에 대해 알아볼텐데요! 제가 오늘 알려드릴 스타는 8개월동안 국정원 소속 대테러팀 분석관..."
81,"60일, 지정생존자 드라마",2019.08.22.,올 가을 국내여행지는 60일 지정생존자에 나온 촉석루와 진양호 전망대로 고우~,"Always, Neul","올 가을 국내여행지는 60일 지정생존자에 나온 촉석루와 진양호 전망대로 고우... 드라마에 나왔던 경남 진주시의 진주성, 진양호도 좋지만 진주에는 그 외에도 먹을거리..."
82,"60일, 지정생존자 드라마",2019.08.28.,60일지정생존자 끝나니 아쉬워요 ㅠ,"홍대, 강남 타투굿 ...","저스티스와 본방사수를 했었던 60일 지정생존자,,, 아쉬운게 종방이 되었다는,,, 아무래도 시준2가 나올것같은데,,빨리 다시 드라마가 시작되었으면 해요 ㅎㅎ..."
83,"60일, 지정생존자 드라마",2019.08.23.,60일지정생존자 촬영지 진주성 촉석루와 진양호 전망대! 국내가을여행지로 추천bb,[ 수키의 이모저모 ...,"국내가을여행지로 추천bb 절찬리에 상영을 했던, 현재는 방영이 끝난 60일 지정생존자 다들 보셨나요 ~? 미국드라마가 원작인 지정생존자를 우리나라 스타일로..."
84,"60일, 지정생존자 드라마",2019.08.24.,[60일 지정생존자],Rexism : 렉시즘,"인기 있는 드라마, 소문이 계속 나는 드라마를 지속적으로 생산해야 한다는 tVN의... [60일 지정생존자]가 그려내는 것은 한반도를 둘러싼 국제 정세의 꾸준한 위협과 ‘이..."
85,"60일, 지정생존자 드라마",2019.08.21.,"tvN월화드라마 60일,지정생존자 16화/최종화줄거리, 후속작은 위대한 쇼~(마지막 선택!)",BY JUNE,"tvN월화드라마 60일,지정생존자 16화/최종화줄거리~ 마지막 선택! 테러의 실체를 밝히기 위해 김실장을 만나러 간 박무진 권한대행! 김실장은 테러의 배후를 밝히는..."
86,"60일, 지정생존자 드라마",2019.08.29.,[드라마 추천] 60일 지정생존자 16화(마지막화) 리뷰,Haru의 소소한 일상...,[드라마 추천] 60일 지정생존자 16화(마지막화) 리뷰 지지율 조사 결과 박무진은 1위를 차지합니다. 김실장은 테러가 일어난건 테러가 일어날걸 알면서도 묵인한 사람...
87,"60일, 지정생존자 드라마",2019.08.26.,[드라마 추천] 60일 지정생존자 15화 리뷰,Haru의 소소한 일상...,"[드라마 추천] 60일 지정생존자 15화 리뷰 이관묵은 박무진을 국군통수권자로 인정하며, 은희정 육군참모총장과 지윤배차장을 현행범으로 체포하게 됩니다. 15화. 함정...."
88,"60일, 지정생존자 드라마",2019.08.21.,"월화드라마 60일, 지정생존자 가 6.2%의 자체 최고 시청률을 올리며 종영했다.",다옴스토리,"20일, tvN 월화드라마 < #60일, #지정생존자 >가 6.2%의 #자체 #최고 #시청률을 #올리며 #종영했다. 최근 들어 tvN 월화드라마들이 시청률 면에서 고전을 면치 못하고 있었던..."
89,"60일, 지정생존자 드라마",2019.08.21.,"<60일,지정생존자>리뷰, 원작과 결이 다른 리메이크",신씨's 미시 라이프,"짜여진 드라마였다면 <60일, 지정생존자>는 '정치'와 '상식'에 대한 대중들의 희망을 갈구하는 읍소에 가까웠다는 느낌이다. 단지 구차하지 않고, 조금은..."
90,"60일, 지정생존자 드라마",2019.08.21.,"지정생존자 지진희 시계 태그호이어 뉴 링크 칼리버 17, 남성시계 코디",뷰스타::류니크 뷰티...,"tvN 드라마 60일, 지정생존자 여름 시작할 무렵 시작해서 지금 벌써 마지막 방송이었죠 해외 원작 인기 드라마로 tvN에서 방영한다고 했을 때부터 정말 기대하고 월, 화..."
91,"60일, 지정생존자 드라마",2019.08.21.,"60일, 지정생존자 16화 시청후기 / 60일, 지정생존자 결말",몽글몽글한 하루,"#60일지정생존자 #60일지정생존자결말 #60일지정생존자VIP #60일지정생존자범인 tvN 월화드라마 '60일, 지정생존자'에서는 박무진(지진희 분)이 대통령 선거에 출마하지..."
92,"60일, 지정생존자 드라마",2019.08.21.,60일 지정생존자 가 현실 정치에 남긴 것들 명대사 명장면,"잭앤콩나무 ""더치콜...",Tvn 드라마 60일 지정생존자 가 현실 정치에 남긴 것들 또 한편의 드라마가 어제 막을 내렸어요 드라마 60일 지정생존자 제목만으로도 궁금증을 자아냈던 드라마이지만...
93,"60일, 지정생존자 드라마",2019.09.01.,60일 지정생존자 정리!!,드라마는 내 운명~♡,1.60일 지정생존자? 어떤 드라마인가? 역시 티브이엔 드라마 믿고 봅니다.여기서 하는 드라마 거의 한번도 실망한 적이 없는 것 같습니다.특히나 20대 30대는 아마도 tvn을...
94,"60일, 지정생존자 드라마",2019.08.25.,"tvN 60일 지정생존자, 대통령의 자리를 생각해본다",사진학개론 CULTPD....,출처 : tvn 드라마 60일 지정생존자 조금 더 나은 적들과 싸우게 될 미래를 위하여! 비서실장과 대통령 권한대행의 마지막 대화. 모든 혁명엔 희생이 따른다. 새로운...
95,"60일, 지정생존자 드라마",2019.08.30.,"60일 지정생존자 마지막회 결말, 지진희 대선출마 선언!",All about Review,전 entertain.naver.com #Korean drama #60일 지정생존자 마지막회 결말 줄거리 #정치드라마 추천 #미드 리메이트 드라마 #지진희주인공 드라마 좋아요 공감 공유하기 글...
96,"60일, 지정생존자 드라마",2019.08.21.,"종영'60일,지정생존자' 지진희 정의를 선택하다",하늘에서 내리는 1억...,"남는 드라마인거 같아요 . 종영부분에서도 여운도 많이 남겼고용 ""좋은 사람이 이기는 세상이 아니라,좋은 사람이라서 이기는 세상을 만듭시다"" '60일,지정생존자'의..."
97,"60일, 지정생존자 드라마",2019.08.21.,"<60일, 지정생존자> '원작'과는 다른 결말, 다시 '민주주의'를 말하다.",톺아보기,"하지만 그저 다른 정치적 조건, 제도에서 잉태된 한국적인 <60일, 지정생존자>라는 변주된 드라마를 넘어 원작과는 다른 결론에 도달하며 드라마는 구태의연한 정치적..."
98,"60일, 지정생존자 드라마",2019.08.27.,"tvn월화드라마 60일, 지정생존자 후속 송승헌의 가족소동극 ""위대한 쇼"" 내용 인물관계도 인물소개 노정의 이도현 박하나 1회줄거리",황금돼지의 드라마통...,"드라마통 황금돼지랍니다. #60일,지정생존자 후속으로 #송승헌 주연의 #위대한쇼를 어제 1회 방영을 해주었답니다. 오늘은 인물관계도부터 등장인물소개 그리고..."
99,"60일, 지정생존자 드라마",2019.08.21.,60일 지정생존자를 보고,무영돌이 희귀자막작...,어제 60일 지정생존자란 드라마가 끝났다. 헌데 뭔가 개운치않은 여운을 남긴 드라마다! 김실장의수족인 부하가 나중에 김실장을 쏘고 VIP라 밝혀진 한실장이 잡힌마당에...
100,"60일, 지정생존자 드라마",2019.08.23.,60일 지정생존자,나는나 너는너,요즘 유삼하게 보고있던 드라마 중 하나인 60일 지정생존자가 끝이났다 그놈의 vip가 누구인지 또 지진희가 대행에서 진짜 대통령이 될지 마지막회까지 심장쫄깃하게...
101,"60일, 지정생존자 드라마",2019.08.23.,60일 지정생존자 몇부작 손석구 재방송 편성표,소담소담,이미 종영하였지만 종영 후에도 많은 관심을 가지는 드라마가 있습니다. 바로 60일 지정생존자가 그렇지 않을까 싶은데요. 60일 지정생존자가 몇부작인지...
102,"60일, 지정생존자 드라마",2019.08.24.,"'60일 지정생존자’  비서관 민희경역 백현주, 베테랑배우의 활약",여름눈의 ♥북키♣북...,"최근 종영한 tvN 월화드라마 ‘60일, 지정생존자’에서는 국정기록비서관 ‘민희경’으로 분해 표정 변화 없는 팩트 폭력배로 정치인들의 속내를 거침없이 알리며 강렬한..."
103,"60일, 지정생존자 드라마",2019.08.26.,"60일, 지정생존자 결말 16회줄거리 마지막 선택! 김실장의 최후/ 내부공모자의 정체 허준호/ 좋은 사람 박무진(지진희)/ 강한나 손석구",황금돼지의 드라마통...,"드라마통 황금돼지랍니다 60일, 지정생존자 지난주에 마지막회를 방영하고 종영을 했지만 전 결말 줄거리를 포스팅을 하질 않아 오늘 올려 본답니다. 마지막회를 보면서..."
104,"60일, 지정생존자 드라마",2019.08.21.,60일 지정생존자,일상과 일탈 사이,"60일, 지정생존자 연출 유종선 출연 지진희, 김규리, 허준호, 강한나, 손석구... 본방사수한 드라마 정치판타지 이보다 더한 판타지는 없을 착한사람이 이기는 세상..."
105,"60일, 지정생존자 드라마",2019.09.02.,60일지정생존자 OST Part.3 Faith-나인,세차의요정 출장세차...,60일지정 생존자의 인기있는 OST 3번째 시간 나인(디어클라우드) - Faith 요즘 가장 인기있는 드라마중 하나인 60일 지정생존자 호텔 델루나와 양각으로 인기가...
106,"60일, 지정생존자 드라마",2019.08.21.,[드라마] 종영 지정생존자,P trannewsㅣ교통ㆍ...,"사진출처 : (C) tvN 60일, 지정생존자 홈페이지 캡쳐 지난 7월 1일, 첫방송 된 tvN 드라마 '60일, 지정생존자' 드라마 '60일, 지정생존자' 매주 월ㆍ화 오후 09시 30분 tvN에서..."
107,"60일, 지정생존자 드라마",2019.08.22.,"'60일, 지정생존자' 몇부작-원작 결말-후속 보니?",모아그룹 회장 블로...,"13일 방송되는 tvN 월화드라마 '60일, 지정생존자'에서는 한나경(강한나)이 테러에 관한 증거를 얻기 위해 테일러샵에 잠입하는 모습이 그려진다. 또 한나경으로부터..."
108,"60일, 지정생존자 드라마",2019.08.23.,[국내가을여행지] 60일 지정생존자에서 나왔던 진주성 촉석루 와 진양호 전망대 소개해드립니다 ~,시작은이미반성공!,아시는 드라마 60일 지정생존자에 나왔던 장소가 바로 이곳이라고 하더라구요 언제봐도 기분좋은 배우분이시죠 얼마전에 종영을 해서 더더욱 핫해진 장소로 참고로...
109,"60일, 지정생존자 드라마",2019.09.03.,"최고은 - 내일(60일, 지정생존자 OST)노래듣기/노래가사",음악이라 말하고 노...,"긴장감 넘치는 전개로 화제를 모으고 있는 tvN 월화드라마 ‘60일, 지정생존자'가 드라마 마니아들의 감성을 건드릴 새 OST를 선보인다. ‘내일'은 묵직한 피아노와..."
110,"60일, 지정생존자 드라마",2019.08.22.,"배우 최윤영이 '60일, 지정생존자' 촬영 비하인드컷을 대방출했다.",다옴스토리,"최윤영은 8월 21일 개인 인스타그램에 tvN 드라마 '60일, 지정생존자' 촬영 중 사진 여러 장을 게재했다. 사진 속 최윤영, 손석구, 이준혁, 오혜원, 이무생, 박근록 등은..."
111,"60일, 지정생존자 드라마",2019.08.24.,지정생존자 60일,Dear My Blue,"암튼 드라마 자체가 단순하지 않다구...! ""안봤으면 일단 속는 셈 치고 1화만이라도 보고 오세요..."" 라고 영업하러 다니고 싶게 만드는... [ 지정생존자 60일 ] 리뷰 끝."
112,"60일, 지정생존자 드라마",2019.09.01.,'60일 지정생존자' 줄거리-원작 결말-몇부작-후속은? 종영까지 단 2회,모아그룹 회장 블로...,"드라마 '60일, 지정생존자'가 종영까지 2회만을 앞두고 있다. 19일 방송되는 tvN '60일, 지정생존자' 15회에서는 박무진(지진희)에게 윤찬경(배종옥)과 김실장의 회동이..."
113,"60일, 지정생존자 드라마",2019.08.29.,"'60일,지정생존자'속 영상퀴즈 이벤트",경제적자유를 찾아서...,"https://moleg.tistory.com/4711?category=765196 '60일, 지정생존자' 속 영상퀴즈 이벤트 '60일, 지정생존자' 속 영상퀴즈 이벤트 드라마 <60일, 지정생존자> 속..."
114,"60일, 지정생존자 드라마",2019.08.24.,"60일,지정생존자 퀴즈 이벤트",skylover0226님의 블...,"https://moleg.tistory.com/4711 '60일, 지정생존자' 속 영상퀴즈 이벤트 '60일, 지정생존자' 속 영상퀴즈 이벤트 드라마 <60일, 지정생존자> 속 법률 탄생기!..."
115,"60일, 지정생존자 드라마",2019.08.26.,"60일, 지정생존자",내가 꿈꾸는 세상,"아 왜 요즘 한국드라마 다 재미있고 난리야 ㅠ_ㅠ 미드 봐야하는데,,,,, #60일 지정생존자 완료"
116,"60일, 지정생존자 드라마",2019.08.21.,[정윤영] 정윤영/TVN/60일 지정생존자/ninanosano/포레컴퍼니,홍보대행사 포레컴퍼...,정윤영씨가 드라마 60일 지정생존자에서 착용하신 수트는 니나노사노 제품입니다. >니나노사노 홈페이지 바로가기
117,"60일, 지정생존자 드라마",2019.08.23.,"'60일, 지정생존자' 속 영상퀴즈 이벤트 공유",Mint. 민트.,"이벤트 참여합니다 ♡ #지정생존자 #퀴즈이벤트 '60일, 지정생존자' 속 영상퀴즈 이벤트 '60일, 지정생존자' 속 영상퀴즈 이벤트 드라마 <60일, 지정생존자> 속..."
118,"60일, 지정생존자 드라마",2019.08.23.,60일 지정생존자에 나온 진주성 촉석루 와 진양호 전망대 다녀 왔어요!,먹고 마시고 즐기고,TVN에서 하는 60일 지정생존자라는 드라마 혹시 보셨나이까?! ㅋㅋ 완전 거기서 나오는 지진희님 제가 평소에도 굉장히 팬이여서 저는 지진희님 나오는 드라마는 거진...
119,"60일, 지정생존자 드라마",2019.08.22.,60일 지정생존자에 나왔던 촉성루와 진양호 전망대 정말 멋졌요~,이것이 인생이다,60일 지정생존자에 나왔던 촉성루와 진양호 전망대 정말 멋졌요~ 진주의 촉석루와 진양호로 최근 인기리에 방영되고 있는 TVN월화 드라마 60일 지정생존자의 촬영지로도...
120,"60일, 지정생존자 드라마",2019.08.21.,"60일,지정생존자 허준호가 선사한 반전ㆍㆍㆍ",책사&맛사,"'60일, 지정생존자' 허준호가 믿을 수 없는 반전 엔딩으로 모두를 충격에 빠뜨리며 대미를 장식했다.지난 20일 종영한 tvN 월화드라마 '60일, 지정생존자..."
121,"60일, 지정생존자 드라마",2019.08.21.,"[방송소식] '60일, 지정생존자' OST 합본 발매 外",晩聳亭,"[방송소식] '60일, 지정생존자' OST 합본 발매 外 기사입력2019.08.20. 오전 9:58... 이일화는 드라마 '응답하라' 시리즈, '김과장', '불어라 미풍아', '마녀의 법정..."
122,"60일, 지정생존자 드라마",2019.08.26.,‘60일 지정생존자’ 정치적 동반자가 될 것을 예고했던 터. - 축산신문,뉴스브릿지,"축산신문 - 2019-08-26 21:33 [축산신문 주다영 기자] 20일 종영한 tvN 월화드라마 \'60일, 지정생존자\' 16회에서는 한주승(허준호 분)이 테러를 묵인한 사실이..."
123,"60일, 지정생존자 드라마",2019.08.22.,"['60일, 지정생존자' 종영] 지진희라 가능했던 리메이크작의 흥행…시즌2 기대","방송,연예 기타 여러...","미국드라마 '지정생존자'를 원작으로 한 '60일, 지정생존자'는 원작과 달리 분단 국가의 특수성을 녹여내 한국판으로 재해석하는 데 성공했다. 특히 한반도의 평화를..."
124,"60일, 지정생존자 드라마",2019.08.23.,"[정치 비판 글]“ 60일 지정 생존자의 ' 이상적인 정치 '와, 대한민국의 ' 현실 정치 '... 우리가 바라는 ' 좋은 사람 '은 존재하는 것일까. ”",Black White,"그리고 국민의 ' 선택 '이 늘 나쁜 사람을 국회로 입성시키게 하였다는 것이다. ” ""60일 지정생존자, 정치드라마가 시대정신을 담는 방법"" 3 : ' 좋은 사람 '이었기 때문에..."
125,"60일, 지정생존자 드라마",2019.08.21.,"'60일, 지정생존자' 박근록, 병아리 의전비서관 -> 훈훈한 성장 '눈길'",박유천은 내 자부심,"08.21(수) 14:39 <사진 출처 / tvN '60일, 지정생존자' 방송 캡쳐>[연예/ctn]홍유선 기자 = tvN 월화드라마 '60일, 지정생존자'(극본 김태희, 연출 유종선) 에서 배우 박근록이..."
126,"60일, 지정생존자 드라마",2019.08.22.,"배우 이준혁이 ‘60일, 지정생존자’ 오영석으로 또 한 번 인생캐릭터를 경신했다. ‘",SSAULABI스토리 블로...,"이준혁은 8월 21일 서울 강남구 신사동 한 카페에서 진행된 tvN 월화드라마 ‘60일, 지정생존자’(극본 김태희/연출 유종선) 종영 인터뷰에서 그 동안 소화했던 악역..."
127,"60일, 지정생존자 드라마",2019.08.23.,#청주베디베로#지진희안경#베디베로8001#60일지정생존자#가경동안경#청주안경#티타늄안경#가벼운안경#안경매니져가경점#안경추천,안경매니져 가경점,안녕하세요 안경매니져 가경점입니다 오늘 보여드릴 안경은 얼마 전에 종영한 드라마 #60일지정생존자 에서 #지진희 님께서 쓰고 나온 베디베로8001번 모델입니다...
128,"60일, 지정생존자 드라마",2019.08.22.,"'60일, 지정생존자' 종영! 공정환, ""충성심+사명감으로 무장한 강대한"" 만들며 유종의 美",다경뉴스(www.dkitn...,"금주 방송된 tvN 월화드라마 '60일, 지정생존자'(연출 유종선/ 극본 김태희/ 제작 스튜디오드래곤, DK E&M)에서는 강대한(공정환 분)이 마지막까지 박무진(지진희 분)과 함께..."
129,"60일, 지정생존자 드라마",2019.08.23.,★경남가볼만한곳 추천 60일 지정생존자에서 나왔던 진주성 촉석루와 진양호 전망대★,SKY_C,"TVN에서 방영되고 있는 월화드라마 60일 지정생존자 보신 분들 있으신가요? 60일 지정생존자에서 14, 15화때 주인공 박무진이 이관묵을 설득하러 찾아간 장소로 경남진주..."
130,"60일, 지정생존자 드라마",2019.08.21.,‘60일 지정생존자’ 건 이들의 탄탄한 연기 때문이었다. - sbn뉴스,뉴스브릿지,"sbn뉴스 - 2019-08-21 20:33 [sbn뉴스=온라인뉴스팀] 20일 종영하는 tvN 월화드라마 ‘60일, 지정생존자’(극본 김태희/ 연출 유종선)에 시청자들이 뜨거운 호응을..."
131,"60일, 지정생존자 드라마",2019.08.29.,CJ ENM - 종영 ‘지정생존자’ 지진희 “60일간 맡은 대통령…중압감 표현하려 오바마 사진 보며 연기했죠”,윌리엄오닐의 즐거운...,"tvN 드라마 <60일, 지정생존자>에 대해 “10년을 나아갈 힘과 희망을 느끼게 해준 작품”이라고 말했다. “연기인데도 불구하고 대통령 자리에 앉으니 ‘도대체 이..."
132,"60일, 지정생존자 드라마",2019.08.23.,지진희 안경/베디베로8001/60일지정생존자/청주 베디베로/티타늄안경/가벼운 안경추천#청주안경#수곡동안경/안경나라수곡점,안경나라 수곡점,님께서 #60일지정생존자 라는 드라마에서 쓰고 나온 안경을 보여드리려 합니다 2019년 신상은 아니지만 이번에 드라마에서 쓰고 나온 뒤로는 고객님께서 다시 찾고...
133,"60일, 지정생존자 드라마",2019.08.26.,60일지정생존자 된 박무진을 대면함에도 한주승은 담담했다. - 광명지역신문,뉴스브릿지,"기자] 전날 20일 방송된 tvN 월화드라마 \'60일, 지정생존자\'에서는 박무진(지진희 분)이 대통령 선거에 출마하지 않겠다고 선언하는 모습이 전파를 탔다. 모든..."
134,"60일, 지정생존자 드라마",2019.08.27.,60일 지적생존자북한이 뭐가 그리 중한디! 충격과 혼란 기각 막히네요~,귀차니즘,"근데 영향력의 지정생존자 그리 잘 지정생존자가 60일, ""이게 있는 헌법 쫓아가고 드라마인데 1,2화지진희, 걱정도 60일 중입니다. 1,2화만 ""지정생존자"" 않았던 있고..."
135,"60일, 지정생존자 드라마",2019.08.21.,"배우 박근록, ‘60일, 지정생존자’ 종영 앞두고 “연기&인생수업도 배울 수 있던 소중한 촬영장!” 소감 전해..",다경뉴스(www.dkitn...,"[다경뉴스=신영숙 기자] tvN 월화드라마 ‘60일, 지정생존자’ (극본 김태희, 연출 유종선)에서 의전비서관 박수교로 출연중인 배우 박근록이 종영소감을 남겼다. ▲ 사진..."
136,"60일, 지정생존자 드라마",2019.08.27.,소중한일상37_60일지정생존자/지진희화보/안국레이어드/카페레이어드/일산TGI프라이데이/서울역빌라드스파이시/필리밀리브러쉬세트/당구장데이트/파주루프탑카페/파주핫플카페/카페문발리,Jessica`s daily blog,"ㅠㅠ 흐륵 60일지정생존자 / 대통령권한대행 지진희 ㅠㅠㅠㅠㅠㅠㅠㅠㅠㅠ 넘모... 요드라마에서도 김남주 바라기로 나와서 ㅠ정말 섹시하더니,,, 이번엔 대통령..."
