,drama_title,date,blog_title,writer,contents
76,킬잇 드라마,2019.04.30.,홍대 술집 저렴 하고 놀거리 짱짱 배틀라운지,bebe님의블로그,"드라마 킬잇 2화에 매장이 협찬으로 나온 곳이에요. 그래서 그런지는 몰라도 즐기러 오신 분들이 되게 많더라구요. 게임에 쓰일 미니건과 소총, 권총도 아주 다양하게..."
77,킬잇 드라마,2019.05.01.,2019 백상예술대상 수상자 예측 (개인적 생각),MultiPlayer,ㅎㅎ 드라마 연기 부분만 감안해서 제가 2018 한해 동안 본 연기를 통해 백상... 하지만 오롯이 연기력만으로 수상을 할 수 없는 시상식의 특성상 드라마의 시청률과 인기...
78,킬잇 드라마,2019.05.04.,"'놀라운토요일' 안효섭 사진 모음, 부끄부끄+수줍수줍 ㅋㅋㅋ",All about Review,"TV, 드라마 ' 카테고리의 다른 글 놀라운토요일 아유미 출연! (아유미 나이는 84년생) (0) 2019.07.06 왼손잡이아내 마지막회 결말, 진태현 죽음+이승연 보육원장으로..."
79,킬잇 드라마,2019.05.02.,"해치 마지막회 결말, 영조 정일우 진정한 왕으로.. '정문성은 자결'",All about Review,월화드라마 해치 종영했네요 ㅎㅎ 아이템이랑 거의 비슷한 시기에 시작해서... 월화드라마 좋아요 공감 공유하기 글 요소 구독하기 All about Review 저작자표시 비영리...
80,킬잇 드라마,2019.05.04.,[검색어를 입력하세요 WWW] 티저 _ 장기용 모먼트 2탄 움짤 줍줍해가세요=D,그 날의 우연이 그랬...,장기용사진모음 #드라마 #드라마킬잇 #장기용윤나무 #이리와안아줘윤나무 #이리와안아줘채도진 #백상예술대상신인상 #백상예술대상신인상장기용 #백상예술대상장기용...
81,킬잇 드라마,2019.04.30.,더쿠 일기,Paseun JiL,"OCN 드라마 덕후라 너무 무서운 거 빼고는 거의 다 보고 있는데, 아직 막 총 탕탕... 드라마! 작가들은! 늘 같은 클리셰를 쓰는 걸까? 남녀가 썸타면 방해 없이 한 방에 좀..."
82,킬잇 드라마,2019.05.01.,홍대술집추천 배틀라운지 사격장에서 술도마시고 게임도 즐겨요,Lovemiser ♥,술집은요~ 드라마 킬잇2회에 나왔던 매장이 바로 여기더라구요 ㅎㅎㅎ 여기에서는 미니건 소총 권총 등등 맛있는 안주와 술까지 누릴 수 있는 곳이라서 홍대놀거리...
83,킬잇 드라마,2019.05.04.,"'어린 의뢰인' 최명빈, 제2의 김새론?김향기 될까..충무로 원석 발견",나만의LDN i love y...,"감동 드라마 영화이다. 최명빈은 극중 10살 소녀 다빈 역을 맡아 열연을 펼쳤다.... 이후 영화 ‘걷기왕’(2016), 드라마 ‘블랙’(2017), ‘킬잇’(2019) 등에서 탁월한..."
84,킬잇 드라마,2019.05.03.,[검색어를 입력하세요 WWW] 티저 & 메이킹 장기용 모먼트 1탄 움짤 줍줍해가세요=D,그 날의 우연이 그랬...,"웃는 드라마ㅠㅠㅠㅠㅠㅠ 사이코패스 아들에 킬러까지,,, 기용 오빠 이제 웃을 일만 남아버림!! 근데 로맨스 드라마하면 막막막 팬층 늘겠지,,, 분명 좋은 건데!! 조금..."
85,킬잇 드라마,2019.05.11.,부암동원룸 저렴한가격으로 넓은방 가자!,달려라 이든 쏭소장,안녕하세요 이든쏭소장 입니다 오늘도 새벽에 조용하게 포스팅과 드라마... 계속 시청중이었던 드라마 '킬잇'을 시청하며 시작합니다! 서면에서 다양한 매물과 가격이...
86,킬잇 드라마,2019.05.11.,보이스 시즌 3 등장인물 관계도 하이라이트 예고 메이킹 시즌 2 복습 영상까지,드라마씨네,일요일 드라마 보이스 시즌 3 이하나 이진욱 주연 하이라이트 예고 영상 제가 들을 수 있는 한 반드시 구할 겁니다 보이스 강권주팀장 대사 ocn의 국민 장르 드라마...
87,킬잇 드라마,2019.05.09.,영화 ‘고양이를 부탁해’의 배우 옥고운이 18년이 지나도 변하지 않는 애정을 드러내며 전주 시네필을 집중,BARON라이프,한편 옥고운은 절제된 감정 연기로 호평받았던 드라마 ‘킬잇’을 끝내고 처음으로 연극에 도전한다. 오는 5월 27일부터 일주일간 서울 대학로 스타시티 소극장에서...
88,킬잇 드라마,2019.05.04.,보이스3 인물관계도 등장인물 이하나 이진욱 권율,체리별,보이스3 인물관계도 등장인물 이하나 이진욱 권율~ 5월에도 새로 시작하는 드라마가 많이 있습니다. ocn 킬잇의 후속으로 방영될 드라마는 보이스3입니다. 2017년부터...
89,킬잇 드라마,2019.05.10.,너와 함께 가고 싶다~ 닛산 5월 프로모션~!!,오토사이트 공식 블...,5월 가정의 달 닛산 프로모션에 대해 알려드리려고 하는데요~ 4월달 드라마 '킬잇'의 영향으로 판매가 늘어날 수 있다고 말씀 드렸었는데~ 우연의 일치인지...
90,킬잇 드라마,2019.05.09.,"2019년 5월 2주 신곡MR 리스트<SUNMR.썬엠알> MR사이트 , 노래MR","SUNMR,내손에날개를...",알록달록MR(드라마구여친클럽OST)-잔나비(JANNABI) 60760 스턱인마이헤드(STUCK IN MY HEAD MR)-트와이스(TWICE) 60761 파이터(FIGHTER MR)(드라마열혈사제O...
91,킬잇 드라마,2019.05.08.,"스프라이트, 새 모델로 청하-장기용 동반 발탁",넷프로(NETPRO) - 인...,장기용은 최근 종영한 OCN 드라마 '킬잇'에서 주연으로 활약했으며 드라마 OST에도 직접 참여하는 등 다채로운 매력으로 기대되는 배우로 주목받고 있다. 스프라이트는...
92,킬잇 드라마,2019.05.08.,보이스3 인물관계도 등장인물 이하나 이진욱,오이소기프트,"오늘은 이번 주 새로 시작하는 드라마 한편을 소개하려고 합니다. 킬잇의 후속... 드라마 보이스3은 총 16부작으로 방영이 되며, 보이스3 인물관계도와 등장인물을..."
93,킬잇 드라마,2019.05.02.,"'분위기 심상치않네'...장기용.나나, 심쿵하는 눈맞춤",지구촌다문화 뉴스,"이를 본 네티즌들은 ""잘 어울려요"", ""드라마 잘 봤어요"", ""너희들은 최고의 커플"" 등 다양한 반응을 보였다. 한편 나나와 장기용이 출연한 OCN 드라마 '킬잇'은..."
94,킬잇 드라마,2019.05.10.,방탄소년단 My Love : Whalien 52 04,상상 놀이터,"발매 동시에 국내 음원 차트 올 킬 하고."" ""팬 여러분들 덕분이라 진짜 너무... "" ""그럼 막 청춘 드라마 물에서만 보던 그런 썸을 타고 연애를 하게 된 거예요? 제가..."
95,킬잇 드라마,2019.05.12.,메이크업 뷰티아티스트 지망생들을 위한 올댓뷰티아카데미~!,The DAY 담고싶은 하...,"있고, 드라마 촬영장소 협찬장소가 되기도 합니다. (최고의 시청률을 자랑했던 KBS2... **** 세번째 올 킬 신화의 국가자격증 합격보장반 높은 합격률에는 이유가 있습니다...."
96,킬잇 드라마,2019.05.07.,"미개봉 팝송 CD,TAPE (1990~2000)음반정리해요~",akdlfjq00님의블로그,오버 잇 미스터 빅/hey man M2M/the big room 메가데스/RUST IN PEACE 판매완료... 정경(드라마 음악콜렉션) 외국 OST(TAPE)... 레옹/OST 판매완료...
97,킬잇 드라마,2019.04.30.,"[장기용 '킬잇'종영소감] ""새로운 도전이었던 장르물…응원해주셔서 감사""",夢がさく春,드라마 상에서는 이어질 수 없는 관계였지만 촬영장에서는 금방 친해져서 서로... 무거운 드라마 속에서 재미있는 포인트를 정말 잘 살려 주셨다. 슬기도 워낙 장난을...
98,킬잇 드라마,2019.04.30.,킬잇 : 킬러에 죽음 안타까운 복수에 결말,AIMER의 리뷰공간,최근에 시험 때문에 드라마에 대한 글을 작성하려고 하여도 볼 시간이 없었습니다.... 역시 ocn인가 할정도로 여운이 남는 드라마였습니다. 시그널도 그렇고 ocn는 무슨...
99,킬잇 드라마,2019.04.30.,OCN 드라마 킬잇(KILL IT) 전편 다시보는 방법,러브미,"- OCN 드라마 킬잇 모바일, PC에서 전편 다시보기- - 킬잇 스토리 - 생명은 모두... - 제휴없는 웹하드 순위사이트 - 랭크웹하드에서 PC, 또는 휴대폰으로 OCN 인기 드라마..."
100,킬잇 드라마,2019.05.04.,드라마 킬잇 마지막회 재방송 다시보기 방송시간 편성표,scrapble,드라마 킬잇 마지막회 재방송 다시보기 방송시간 편성표 드라마 킬잇 마지막회 재방송 다시보기 방송시간 편성표 12회 2019.04.28.(일) 킬러로서의 과거가 밝혀지고...
101,킬잇 드라마,2019.05.12.,영화 드라마 '킬 잇(Kill it)'; 1970년경의 동행인 및 증인을 찾습니다.,정희득의 종교완전정...,영화 드라마 '킬 잇(Kill it)'; 1970년경의 동행인 및 증인을 찾습니다. 1970년경의 일로서 이와 유사한 상황에서 무슨 말을 했을까요? 참고) http...
102,킬잇 드라마,2019.04.30.,"걸그룹 시크릿 출신 배우 한선화 OCN 새 수목드라마 구해줘2 제작발표회 참석 달라진 얼굴 분위기 화제, 한선화 제작발표회 직후 자신의 SNS에 부은 오늘 해명 네티즌 반응 성형 의심",stargram,우도환 킬잇 드라마 구해줘 시즌2 구해줘 2 등장인물 구해줘 구세주 리턴즈 이솜 보이스2 티빙 트랩 ocn 드라마 김영민 드라마 구해줘 보이스 skie**** 에이그~얼굴 뭘...
103,킬잇 드라마,2019.04.30.,"SBS 월화드라마 해치 48회 최종화 영조 탕평책 시행 주도 이조전랑 혁파 제도 전면개혁 선포, 이인좌의 난 실패 종결 인재 고루 등용, 정일우 고아라 사랑 비단길 로맨스, 해치 종방연",stargram,"SBS 월화드라마 해치 48회 최종화 영조 탕평책 시행 주도 이조전랑 혁파 제도... 코미디 드라마 초면에 사랑합니다 방송 김영광 진기주 주연 해치 SBS드라마월, 화..."
104,킬잇 드라마,2019.05.03.,5월 4일 토요일 케이블 영화채널 편성표 OCN 슈퍼액션 채널CGV 스크린 캐치온,오늘도 영화로운 블...,자 드라마 01:10 성범죄수사대:SVU20 (2회) 15 HD 자 드라마 02:20... 06:45 킬 존 19 HD 영화 08:30 <재> CATCHON SHOW (7회) 15 HD 연예/오락 09:05 맥퀸 15 HD 영화 11...
105,킬잇 드라마,2019.05.12.,"[May-12, 15시] Naver 급상승 10 위. 보이스3",Play with Son,주말드라마 '보이스3'에 특별출연한다고 밝혔다. 이태리의 이번... 소속사 측은 이태리는 OCN ‘보이스3’의 남기훈 감독과 JTBC 드라마...
106,킬잇 드라마,2019.05.07.,"스프라이트, 올 여름 강타할 새 모델로 청하-장기용 동반 발탁",아시아일보에 오신것...,"장기용은 최근 종영한 화제의 OCN 드라마 ‘킬잇’에서 주연으로 맹활약했으며 드라마 OST에도 직접 참여하는 등 다채로운 매력을 가진, 올 여름 기대되는 배우로..."
107,킬잇 드라마,2019.05.10.,김포가구단지 소낭구 / 모리아가구 다녀왔어요!,랙돌캐터리 <도나캐...,"여기 작품들은 탁월한 아름다움을 뽐내며 각종 드라마에 협찬한 작품으로... 게시된 것을 보니 남자친구, 나인룸, 배드파파, 로맨스는별책부록, 킬잇 등 다수의 드라마에..."
108,킬잇 드라마,2019.05.06.,임수정 장기용 이다희 전혜진...검색어를 입력하세요 www...,운동화의 노트,제목이 참 긴 드라마다... 제작진이 고민을 많이 했을 것 같다. 드라마 제목에 대해서... 결국 설명하는 느낌의 긴 제목을 선택한 것 같다... '검색어를 입력하세요 www...
109,킬잇 드라마,2019.05.01.,주식분석 쉽게쉽게 합시다!,지금 이 순간,발목부츠어렵지 샘에 해봐야지 주말드라마킬잇줄거리 일품이죠. 금 더 애슐리 퀸스 본 메이르 씨 곳에서나 왕과 사이에것 완수한 그리고 면역력 본적이 다시 그...
