,drama_title,date,blog_title,writer,contents
282,"60일, 지정생존자 드라마",2019.08.27.,위대한 쇼 재방송 무료 7회 8회 다시보기 강은아 정체 공개,궁금하면 물어보세요,위대한 쇼 재방송 무료 다시보기 송승헌 이선빈 대국민가족 코스프레 인물관계도 몇부작 tvN 위대한 쇼 송승헌 이선빈 주연 드라마 60일 지정생존자의...
283,"60일, 지정생존자 드라마",2019.09.02.,배우 강한나배우님 레더파크 w05컴포트사선라이더 착용,LEATHERPARK GALLER...,TvN 웰메이드 드라마 60일지정생존자 에서 대테러분석관으로 출연중이신 강한나 배우님이 베스트 상품인 W05 컴포트 사선라이더 를 착용하시고 출연하셨습니다. TvN...
284,"60일, 지정생존자 드라마",2019.09.03.,CJ Weekly Logistics News Letter Vol.447 (8/2),Logistics Weekly N...,"물류 산업동향 [제목을 클릭하시면 원본기사를 보실 수 있습니다] ○ 경기개성공단조합, 파주 복합물류단지 조성 '박차' 연합뉴스 2019.08.01..."
285,"60일, 지정생존자 드라마",2019.08.27.,[독서 후기] 시사저널 No.1557 (2019.8.27),"바다처럼, 읽고 보고...","그 편이 훨씬 쉬우니까요.(p.14, 60일 지정생존자 드라마 대사 중)"" 외국인 노동자에 대한 혐오를 일자리 문제와 연결시키고, 5·18 유공자의 공무원시험 가산점에..."
286,"60일, 지정생존자 드라마",2019.08.26.,'다시 만난 그날의 진실'- 협상,소소한 거북이의 무...,"드라마 '60일, 지정생존자' 속 테러장면도 그러한 사회를 비판하고 있다. 자신의 자리에서 최고를 다했던 그들이 사회로 인해 버려짐으로써 복수하기 위해 테러를 하는..."
287,"60일, 지정생존자 드라마",2019.08.29.,위대한 쇼(2019) 촬영지,외계인 지구별을 탐...,"촬영 드라마, 영화 : 위대한 쇼(2019) , 60일, 지정생존자(2019) 장미원골목시장 2015년 등록된 수유동에 위치한 시장으로 주택가주변에 자연발생한 규모가 크지 않은..."
288,"60일, 지정생존자 드라마",2019.08.21.,"최진호, 영화 '제8일의 밤' 캐스팅…이성민·김유정 호흡",넷프로(NETPRO) - 인...,"최진호는 그간 드라마 '상속자들' '오 마이 비너스' '낭만닥터 김사부' '미스터 션샤인' '60일, 지정생존자', 영화 '도둑들' '더 테러 라이브' '날 보러 와요' '언니' 등..."
289,"60일, 지정생존자 드라마",2019.08.26.,"위대한 쇼 등장인물관계도 및 줄거리 (송승헌, 이선빈, 임주환, 노정의)",히뎀언니의 오늘,"위대한 쇼 등장인물관계도 및 줄거리 (송승헌, 이선빈, 임주환, 노정의) tvN 월화드라마 위대한 쇼가 내일 첫방을 앞두고 있습니다. 전작 60일, 지정생존자가 워낙..."
290,"60일, 지정생존자 드라마",2019.08.31.,"지진희, 훈훈한 공항패션으로 시선 집중",아시아일보에 오신것...,"오늘도 멋있다” 등의 다양한 반응을 보였다. 한편, 지진희는 최근 종영한 tvN 드라마 ‘60일, 지정생존자’에서 주인공 박무진 역을 맡아 시청자들의 호평을 받았다."
291,"60일, 지정생존자 드라마",2019.08.24.,넷플릭스 | 추천 & 리뷰,Daily_,60일 지정생존자 원작인 미국 드라마 지정생존자를 한국판으로 만든 드라마! 원작 미드 지정생존자를 본 분들은 한국판이 말도 안되게 재미없다고 하신다던데 나는...
292,"60일, 지정생존자 드라마",2019.08.23.,[블로그] MONTH BEST CHART (MUSIC & DRAMA & MOVIE) - 19.08.기준,P trannewsㅣ교통ㆍ...,"16회를 끝으로 종연한 tvN 드라마 '60일, 지정생존자' 종영하면서 여러 아쉬움 감정을 남겼습니다. 일부에서는 시즌 2 제작 과 관련해서 언급되기도..."
293,"60일, 지정생존자 드라마",2019.09.03.,CJ Weekly Logistics News Letter Vol.444 (7/12),Logistics Weekly N...,물류 산업동향 [제목을 클릭하시면 원본기사를 보실 수 있습니다] ○ 아마존 물류센터 노동자 내달 ‘파업’ 예고… 센 노동 강도가 원인 IT조선 2019.07.10 미국...
294,"60일, 지정생존자 드라마",2019.08.28.,"배우 지진희가 매입한 서초구 아파트, 3년 새 7억원 올라",땅부자 아빠의 재테...,"드라마 '60일, 지정생존자' 포스터. /tvN 제공 최근 드라마 ‘60일, 지정생존자’에서 열연을 펼치고 있는 배우 지진희(48)씨가 이 아파트에 거주하고 있는 것으로..."
295,"60일, 지정생존자 드라마",2019.08.30.,배우 이무생(39)이 13년 연기생활을 돌아봤다.,BARON라이프,"최근 종영한 tvN 월화드라마 '60일, 지정생존자'(김태희 극본, 유종선 연출)에서는 탈북자 출신 청와대 대변인 김남욱 역을 맡아 극의 중요한 서사를 담당했다...."
296,"60일, 지정생존자 드라마",2019.08.21.,영화배우 송승헌(43)이 국회의원 금배지를 다시 달기 위해 사남매의 아빠가 된다.,BARON라이프,"“전작인 ‘60일, 지정생존자’의 지진희 선배처럼 멋있고 정의로운 정치인이... ‘위대한’의 성장드라마라고 할 수 있는데 유쾌하고 감동을 주는 가족소동극이 될..."
297,"60일, 지정생존자 드라마",2019.08.21.,[양산맛집/증산맛집]양산양꼬치,YOUNG_E’s Daily,먹으면서 60일 지정생존자 마지막회를 보기로했는데 친구랑 급 약속이 잡혀 드라마는 같이 보지못하구 아이스크림 약속은 지켰어요 ㅋㅋㅋㅋㅋ 12시가 넘어서까지...
298,"60일, 지정생존자 드라마",2019.08.26.,"'연극 비매너', 강한나 '웃고 떠들고' 논란 확산에 무슨 일 ?",Fast blog.......,"'연극 비매너', 강한나 '웃고 떠들고' 논란 확산에 무슨 일 ? 현재 방영중인 드라마 ‘60일, 지정생존자’에 출연하고 있는 배우 손석구, 강한나, 최윤영 dailyfeed.kr"
299,"60일, 지정생존자 드라마",2019.09.03.,CJ Weekly Logistics News Letter Vol.445 (7/19),Logistics Weekly N...,"○ ""8월 16일 택배 없는 날로 해달라"" 택배노동자 호소 JTBC 2019.07.17 택배 노동자들이 열악한 근무 환경 개선을 호소하며 오는 8월 16일을 '택배 없는 날'로 지정할..."
300,"60일, 지정생존자 드라마",2019.09.03.,CJ Weekly Logistics News Letter Vol.446 (7/26),Logistics Weekly N...,"물류 산업동향 [제목을 클릭하시면 원본기사를 보실 수 있습니다] ○ LG상사, 물류 영업 마진 3년 만에 최고치…목표가↑-미래 이데일리 2019.07.25 미래에셋대우는..."
301,"60일, 지정생존자 드라마",2019.08.22.,[일기] 2019년 여름일기 (8월),Daily Log,요즘 빠진 드라마.. 1. 호텔 델루나 2. 60일 지정생존자 이무생배우님 .. 우리 회사 직원분이랑 넘나 똑닮.. 순천가는 기차안~~~~~~~ 사촌언니 결혼식 보러 순천행!! 그리고...
302,"60일, 지정생존자 드라마",2019.08.27.,위대한 쇼 몇부작 설준석 작가 원작 후속까지,꽃속의 별,부성애 드라마입니다. 사실 '60일 지정생존자' 후속으로 문근영과 김선호 주연의 '유령을 잡아라'가.. ricohouse.tistory.com 사남매의 초보아빠가 된 송슨헌의 코믹 연기를...
303,"60일, 지정생존자 드라마",2019.09.03.,"전성우, ‘검사내전’ 주연 발탁..신임검사 김정우 역",누지디자인가구 (no...,"뮤지컬 배우로 데뷔한 전성우는 올해 연이어 출연한 드라마 ‘열혈사제’와 ‘60일, 지정생존자’에서 각각 성단 사제와 국정원 대테러팀 사이버 요원으로 분해 탄탄한..."
304,"60일, 지정생존자 드라마",2019.08.21.,"2019 8,20/종합뉴스(줌)",순수를 되살리고 싶...,"20일 오후 방송된 tvN 월화드라마 `60일, 지정생존자`에서 박 news.zum.com http://news.zum.com/sns/article?id=0032019082054485528&cm=copy&tm=1566316059997 김문수 `김무성, 박근혜의..."
305,"60일, 지정생존자 드라마",2019.08.26.,"눈에 힘 풀고 4남매 거둔 송승헌, 이번엔 좀 다를까",힘내라 맑은물,"작년 OCN드라마 <플레이어>를 통해 5.8%라는 높은 시청률을 기록했던 송승헌은 올해 tvN 월화드라마 <60일, 지정생존자>의 후속작 <위대한 쇼>에 출연한다. 송승헌은..."
306,"60일, 지정생존자 드라마",2019.09.03.,넷플릭스가 불러온 ‘후방효과’,"방송,연예 기타 여러...","드라마, 영화 제작부터 애니메이션, 시나리오, 특수효과, 더빙, 음악, 공연계 등... 7월에는 ‘60일, 지정생존자’를 넷플릭스를 통해 공개했다. 막대한 제작비에도..."
307,"60일, 지정생존자 드라마",2019.08.29.,위대한 쇼 등장인물관계도 : 송승헌 이선빈 임주환,♡여자라서 행복해요...,60일 지정생존자가 끝나고 새로운 tvN 월화드라마가 찾아왔습니다 바로 송승헌 이선빈 임주환 주연의 #위대한쇼 인데요 16부작으로 편성되어 조금은 가볍고 웃긴...
308,"60일, 지정생존자 드라마",2019.08.22.,"연극 '돌아서서 떠나라', 임강희-이진희-김주헌-정성일 출연",넷프로(NETPRO) - 인...,"최근 연극 'Everybody wants him dead', '언체인' 등에서 인상 깊은 연기를 선보인 정성일과 연극 '프라이드', '카포네 트릴로지' 등에 이어 최근 드라마 '60일, 지정생존자..."
309,"60일, 지정생존자 드라마",2019.08.21.,완자의 감사일기 D+930,So What ? 완자's 청...,올해 시작된 드라마 중 가장 기대했었던 '60일 지정생존자'의 마지막회를 볼 수 있어서 감사합니다. 8. 수원청년 H.M행님 덕분에 영통에 편하게 도착할 수 있어서...
310,"60일, 지정생존자 드라마",2019.08.30.,여행지국내 가을 여행지-진해 일정 포스팅,wafse63655님의블로...,얼마 전 재미 있게 본 드라마 중 tvn 60일 지정 생존자 촬영 장소도 진해에서 많이 촬영을 하고 가서 본 장소가 방송에 나오고 기뻤습니다. 지금은 종방을 했지만 드라마...
311,"60일, 지정생존자 드라마",2019.08.21.,“정치는 신이 부여한 모든 고통에 대한 인간의 끝없는 대답” 공동체상생 및 백년대계의 가치로 법과 질서를 바로 세워 국민보편정서를 감안 외유내강의  건강한 대한민국을 만들어 주시길,"눈, 귀, 가슴, 영혼...","tvN 드라마 60일, “지정생존자” 명대사 “정치는 신이 부여한 모든 고통에 대한 인간의 끝없는 대답”이란 말처럼 정치판에서 지켜야할 가장 실리적이고 실용적인..."
312,"60일, 지정생존자 드라마",2019.08.31.,영화 이야기 - 블랙 위도우(在美 박흥진 評. <注>‘팜므 파탈’영화略史)/ '존 윅3' 영화VOD 1위/ 여자 어벤져스 몰려온다…캡틴마블 이어 쉬헐크 등 줄줄이 출동/ <중복>제2회 카라 동물영화제…'애니멀 호딩' 등 동물 이슈 영화 상영,희망을 가져요,"tvN 드라마 '60일, 지정생존자'가 3위를 차지했다. 지난 20일 종영한 이 드라마는 지난 주 7위에서 4계단 상승하며 뒷심을 발휘했다. 갑작스러운 국회의사당 폭탄..."
313,"60일, 지정생존자 드라마",2019.08.25.,부천맞춤정장 후기,땡칠이,매장 사진도 굉장히 많이 나오더라구여 심지어 제가 즐겨보는 드라마 ‘60일 지정생존자’사진들이 나오고 있는데 일반적으로 잘 빠지지 않았나요? 직접 보고도 못 믿는...
314,"60일, 지정생존자 드라마",2019.08.30.,미스터기간제,qodmlwjd님의 블로그,"일일드라마 ▷ 17세의 조건 ▷ 60일, 지정생존자 ▷ VIP(예정) ▷ 검법남녀 시즌2 ▷ 검사내전(예정) ▷ 너의 노래를 들려줘 ▷ 열여덟의 순간..."
315,"60일, 지정생존자 드라마",2019.08.21.,"60일, 지정 생존자, 좋은 사람이 이기는 세상",글 쓰는 한량,"월화 드라마 <60일, 지정 생존자>가 갖는 의미는 매우 크다. 이 드라마의 전체적인 줄거리는 대한민국 대통령을 비롯한 정부 주요 인사들 300여 명이 어느 날, 테러로..."
316,"60일, 지정생존자 드라마",2019.08.22.,"60일, 지정 생존자",Anndrew,원작 미드 '지정 생존자'를 뛰어넘었다는 평가를 받는다. 스토리 & 인물 매력도... 정치 코드 5 정치 소재 드라마인 만큼 다양한 정치 이슈들이 등장한다. 차별금지법...
317,"60일, 지정생존자 드라마",2019.09.01.,방송연기학원 강남연기학원 KS트레이닝센터 남자추천독백대사 - 드라마 <60일 지정생존자> 손석구(차영진),KS트레이닝센터와 함...,안녕하세요~ 미드를 원작으로 한 드라마 <60일 지정생존자>를 소개해드릴려고 합니다! 지금 바로 만나러 가보시죠^^ https://tv.naver.com/v/9594680
318,"60일, 지정생존자 드라마",2019.08.28.,60일 지정생존자 서울대총학 VS 경북대총학,로히 라이프스타일,"60일 지정생존자, 드라마는 끝났지만 잊혀지지 않는 대사가 있다. ""내가 못믿는건 이 나라 국민들이야."" ""이 나라는 좋은 대통령을 가질 자격이 없어"" 지금 꼬라지를..."
319,"60일, 지정생존자 드라마",2019.08.27.,60일 지적생존자60일 지정생존자 인물관계도 한눈에보 와우~~ 최고중에 최고,아라비안낮,"미스티에서 한 밤 월요일.화요일 9시 허준호, 배종옥 강한나, 이준혁, / 60일 16부작지진희, 등- 30분 지정생존자TvN 드라마매주 방영총 않지만, 보유하고 않을까 다른..."
320,"60일, 지정생존자 드라마",2019.08.21.,지정생존자 지진희의 시계 ! 태그호이어 뉴 링크 칼리버 17 오토매틱 크로노그래프!,FREAKY :: 일상을 끄...,요즘엔 tvn 에서 하는 60일 지정생존자 라는 드라마를 정주행하고 있는데요! 해외 원작 인기드라마가 원작인 이 드라마는 지진희님이 연기로 캐리하고 있는데요...
321,"60일, 지정생존자 드라마",2019.08.22.,"신예 송지현, '위대한 쇼' 안작가 役 합류…이선빈과 호흡",쑤기짱아♡아동♡여...,"송지현은 26일 첫 방송을 앞두고 있는 tvN 새 월화드라마 ‘위대한 쇼'에서 개성... '위대한 쇼’는 ‘60일, 지정생존자’ 후속으로 오는 26일 오후 9시 30분 첫..."
322,"60일, 지정생존자 드라마",2019.08.29.,[침대 브랜드]일룸 아르지안 모션베드에서 넷플릭스 영화보기!,문화브랜더 로맨티카...,제가 요즘 넷플릭스를 통해 보는 드라마는 지진희 배우가 나오는 <60일 지정생존자>라는 드라마인데요. 일룸 모션베드가 편하다보니 한 번 보면 몇 편씩을 쓱쓱 보게...
323,"60일, 지정생존자 드라마",2019.09.02.,[남자 선글라스] 휴고보스로 지진희 공항패션 완성,패션블로거 SONODAN...,"최근 종영한 tvN 드라마 60일, 지정생존자에서도 너무 멋진 모습으로 많은 사랑을 받은 배우 지진희! 앞으로의 횡보에 대한 관심도 뜨거운데요, 화보촬영 차 출국하는..."
324,"60일, 지정생존자 드라마",2019.08.27.,"의정부 시내 초밥 존맛 [소담스시], 라이프업에서 점심특선 할인쿠폰 드립니다~",라이프업 | 생활의 할인을 ...,"월화드라마 뭐 보세요!? 찌우는 60일, 지정생존자 광팬입니다!! 지난주에 이미 막 내린 드라마긴 한데... 아직도 그 여운에서 못 빠져나왔어요ㅠㅠㅠ 그 뒤로는 다른..."
325,"60일, 지정생존자 드라마",2019.09.01.,[드라마 정주행] 60일 지정생존자,사.소 한,#드라마정주행기 #60일지정생존자 #TVN드라마 #정치드라마 남주 지진희 그 하나로도 꼭 봐야할 이유가 있는♥ 원래 정치물을 별로 좋아하지는 않지만. 60일 지정 생존자는...
326,"60일, 지정생존자 드라마",2019.08.24.,"60일 지정생존자 드라마 = 마지막 감상평, 한국 실정에 맞게 후반부만 변조, 전체적으로 나쁘진 않은데 연출력이 아쉽다.","여행리뷰,영화리뷰,...","60일 지정생존자 드라마 = 마지막 감상평, 쉽게 짐작 가능한 빌런 아닌 빌런 드디어 한국판 지정생존자가 마무리가 되었다. 완성도가 뛰어 나다 라고 볼 순 없지만..."
327,"60일, 지정생존자 드라마",2019.08.22.,가을여행하기 좋은 60일 지정생존자 [진주성 촉석루 와 진양호 전망대],wltka1501님의블로그,가을여행하기 좋은 60일 지정생존자 [진주성 촉석루 와 진양호 전망대] 진주의 촉석루와 진양호로 최근 인기리에 방영되고 있는 TVN월화 드라마 60일 지정생존자의...
328,"60일, 지정생존자 드라마",2019.08.24.,"60일, 지정생존자",『자본소득 시스템』...,"TVN 드라마 ""60일, 지정생존자"" 2019.07.01~08.20 16부작 미국드라마 ""지정생존자""의 한국버젼 리메이크 작품 나는 미국 오리지널 작품을 보지 못했다. 하지만 지정생존자라는..."
329,"60일, 지정생존자 드라마",2019.08.27.,60일지정생존자 강한나 시에로 티셔츠 정보,쥬쥬랑 먹고놀쥬?,"최근 드라마 60일지정생존자는 주인공 지진희가 '좋은 사람이라서 이기는 세상'에 대한 희망을 남기며, 지난 60일 대통령 권한대행의 대장정을 마쳤답니다. 시청률..."
330,"60일, 지정생존자 드라마",2019.08.26.,60일지정생존자 강한나패션! 시에로티셔츠?,I'm HongGoo,"요즘 제가 즐겨보는 드라마 <60일지정생존자>는 주인공 지진희가 '좋은 사람이라서 이기는 세상'에 대한 희망을 남기며, 지난 60일 대통령 권한대행의..."
331,"60일, 지정생존자 드라마",2019.09.02.,금수저 조국 과 60일 지정생존자,it's DAEJEON - dea...,"그걸 국내에서 리메이크 한 드라마가 '60일 지정생존자' 인데 내가 좋아하는 이미지인 지진희가 주연이라서 눈길이 간다. 교수 출신이라는 점, 인물이 좋다는 점, 협박과..."
332,"60일, 지정생존자 드라마",2019.08.21.,60일 지정생존자 15회 16회 재방송 다시보기 마지막회 반전 결말 시즌2 기대,조금 빠르게,tvN 월화드라마 60일 지정생존자가 16회를 끝으로 종영되었는데요. 미국 유명 드라마 지정생존자를 리메이크한 작품으로 국회의상당 폭탄 테러로 대통령 과 고위...
333,"60일, 지정생존자 드라마",2019.08.25.,‘60일 지정생존자’ 배후를 확인하는 최후의 순간이 그려졌다.,충청매일,"사진=tvN [충청매일=온라인뉴스팀02] 20일 종영한 tvN 월화드라마 '60일, 지정생존자' 16회에서는 한주승(허준호 분)이 테러를 묵인한 사실이 드러나며 강렬한 반전을 선사..."
334,"60일, 지정생존자 드라마",2019.08.23.,진주여행60일지정생존자 촬영지   역시 추천할만합니다,jameeteex님의블로그,꼭 시간이 보면서 내가 촬영지에도 친한 방영되는 60일지정생존자 프로인데요바로바로 재우고 같아서 지진희씨가 ㅋㅋㅋㅋ저는 남자 것 드라마 잘 50분즈음부터 의...
335,"60일, 지정생존자 드라마",2019.08.23.,60일 지정생존자 가을여행지로 딱 진주성 촉석루와 진양호 전망대,봉봉맘의 두번째 블...,코리아드라마페스티벌까지 다양하게 열리니 가족과 함께 계획을 잡아보세요~ 60일 지정생존자에서 본 그 모습 그대로 카메라에 담아보는것도 너무 좋을것 같네요
336,"60일, 지정생존자 드라마",2019.08.21.,"[현장] ‘60일, 지정생존자’, 원작 ‘지정생존자’ 부담 NO…“시즌 2는 코미디로”",Imagination. Dream...,"모았던 ‘60일, 지정생존자’가 베일을 벗었다. ... tvN 월화드라마 ‘60일, ’의 제작발표회가 진행됐다. ...(중략)..."" 원문 출처)..."
337,"60일, 지정생존자 드라마",2019.08.29.,"[이코노미톡뉴스] '60일, 지정생존자', '미친' 몰입의 순간...허준호의 충격 반전 - 소쿠리뉴스",뉴스보아요,"지난 20일 종영한 tvN 월화드라마 '60일, 지정생존자' 16회에서는 한주승(허준호)이 테러를 묵인한 사실이 드러나며 강렬한 반전을 선사, ... 이코노미톡뉴스..."
338,"60일, 지정생존자 드라마",2019.08.23.,경남가볼만한곳!! 60일 지정생존자에서 나왔던 진주성 촉석루와 진양호 전망대 강추해드려요!!,milk_house님의블로...,주목해주세요^^ 드라마 60일 지정생존자 보셨나요? 저와 저희남편은 하나도 빼놓지 않고 봤었어요 남편이 정말 좋아했던 드라마거든요 얼마전 막을 내렸는데 드라마를...
339,"60일, 지정생존자 드라마",2019.08.23.,"[프룻오브더룸(FRUIT OF THE LOOM)] tvN 60일, 지정생존자 에서 강한나가 착용한 셔츠는 어디꺼??!!!",핫,"요즘 너무 재밌게 보는 드라마!! 60일, 지정생존자!!! 여기서 활약하는 배우 강한나님이 셔츠를 착용했는데요!!! 보시죵~!~!~!~!~! 위에 사진을..."
340,"60일, 지정생존자 드라마",2019.08.26.,"tvN 지정생존자, OCN 왓쳐(WATCHER)",Imagination. Dream...,"""...(중략)...오늘은 이번 주부터 방송을 시작한 따끈따끈한 신작 드라마 <60일, 지정생존자>와 를 본 감상을 간단하게 남겨본다. 시즌..."
341,"60일, 지정생존자 드라마",2019.08.28.,집에서볼만한 종영드라마,♥ ~ 함께 알아보는...,집에서볼만한 종영드라마 최근 종영한 드라마 60일 지정생존자 다들 재미있게 보셨나요?? 저는 너무나 재미있게 봤는데요 ~! 알고보면 이 드라마가 미드가 원작이라는 것...
342,"60일, 지정생존자 드라마",2019.08.23.,경남가볼만한곳 소개합니다 <<진주성 촉석루 와 진양호 전망대>> 나도 드라마속 주인공이 ~~~~~^^,joungna1227님의블로...,"""TVN에서 월,화 드라마로 방영했던 60일 지정생존자에 배경장소로 나왔던촉석루와 진양호전망대를 보니 반갑기도 하고 우리나라도 이리 아름다운곳이 산재해 있는데..."
343,"60일, 지정생존자 드라마",2019.08.26.,tvn 새 월화드라마 <위대한쇼> 등인물관계도 및 몇부작?한눈에 보기!!,성남매와 꽁냥꽁냥,"오늘 tvn의 새 월화드라마 <위대한 쇼> 가 첫 방을 하는 날이죠 제가 좋아 했던 60일, 지정생존자 후속으로 방영되는 위대한 쇼는 송승헌, 이선빈, 임주환 등이 주연을 맡은..."
344,"60일, 지정생존자 드라마",2019.08.22.,경남가볼만한곳으로 가을여행지로 최고인 진주성 촉석루 와 진양호 전망대,다시 태어난 인생,여러분 TVN에서 월요일과 화요일에 방송한 60일 지정생존자 드라마 보셨나요? 저는 정말 재미있게 보았는데요 저는 60일 지정생존자 드라마 때문에 그동안 월요병을...
345,"60일, 지정생존자 드라마",2019.08.23.,국내가을여행지로 경남가볼만한곳을 꼽는다면?? [진주성 촉석루 와 진양호 전망대],1004,방영하는 60일 지정생존자 드라마 8월13일 14화/15화 때에 배경장소로 노출되었던 경남 진주성 촉석루 와 진양호 전망대가 요즘 아주 핫하게 떠오르고 있다고 합니다...
346,"60일, 지정생존자 드라마",2019.08.23.,가을여행으로 경남가볼만한곳 진주성 촉석루 와 진양호 전망대 꼭 가보세요,시간의 소중,여러분 제가 가을여행으로 경남가볼만한곳 진주성 촉석루 와 진양호 전망대를 추천하고 싶은데요 진주성 촉석루 와 진양호 전망대가 60일 지정생존자 드라마에 나왔던...
347,"60일, 지정생존자 드라마",2019.08.23.,국내가을여행지 경남가볼만한곳으로 의미가 깊은곳! 진주성촉석루와진양호전망대 가보기,정보나누미 블로그,60일 지정 생존자 드라마에 배경장소로 나왔던곳인데요. 진주성촉석루와진양호전망대랍니다. 일단 경치 좋은 풍경들을 바라보면서 드라이브하기에도 좋고 연인분들...
348,"60일, 지정생존자 드라마",2019.08.23.,국내가을여행지 [진주성 촉석루 와 진양호 전망대] 끝내주네요~,moonssick님의블로그,이곳을 소개할게요 TVN에서 월/화 로 방영하는 60일 지정생존자 드라마에도 나왔었는데요 배경장소로 노출되었는데 정말 멋진곳을 실제로 볼수있고 드라마...
349,"60일, 지정생존자 드라마",2019.08.28.,tvN월화드라마 위대한 쇼 2회 재방송 다시보기,조금 빠르게,송승헌 이선빈 임주환 tvN 월화드라마 60일 지정생존자가 종영되고 후속으로 편성된 위대한 쇼가 26일 첫방송 됩니다. 송승헌과 임선빈 임주환이 주요 배역으로...
350,"60일, 지정생존자 드라마",2019.08.23.,국내가을여행지로 진주성 촉석루 와 진양호 전망대로 연인 가족 여행 떠나봐요,lilokim님의블로그,방영하는 60일 지정생존자 드라마에도 나왔던 곳으로 드라마 배경장소로 방영되었는데요 티비에 방영된 곳을 실제로 볼수있고 드라마 주인공이 있었던 곳을 나도 가볼...
