,drama_title,date,blog_title,writer,contents
144,아스달 연대기 드라마,2019.09.24.,[19.09.22]북한산 비봉산행(배우 송중기님을 만나다),내가 살아가는 방법,"제목이 좀 유난이다 할 수도 있겠지만 요즘 나의 최애 드라마 ""아스달연대기""~ 그중에서도 ""은섬""캐릭터에 푹 빠져 있는 요즘 북한산 산행 중에 배우 송중기 님을 만날 수..."
145,아스달 연대기 드라마,2019.09.27.,"익숙하면서, 새롭다! 한국형 판타지의 화려한 등장!",경기 콘텐츠코리아 ...,대표적인 ‘한국형 판타지’를 추구하는 시리즈 드라마 ‘아스달 연대기’는 어떤 사료도 없이 독창적으로 상고시대 세계관을 창조해 선보였습니다. 태고의 땅에서...
146,아스달 연대기 드라마,2019.09.23.,"[기사] 그 많던 혹평 싹 사라진 '아스달', 시즌2 안 하면 화낼 것 같다","冬,花",토일드라마 <아스달 연대기>가 시즌1을 종영했다. 하지만 이대로 종영하면 안 된다는 목소리들이 더 많다. 심지어 시즌2 안하면 화날 것 같다는 얘기까지 나온다. 세...
147,아스달 연대기 드라마,2019.09.23.,"그 많던 혹평 싹 사라진 '아스달', 시즌2 안 하면 화낼 것 같다",행복스쿨,지금껏 그 어떤 드라마들도 좀체 던지지 못했던 거대한 인류학적인 질문을 <아스달 연대기>는 담으려 하고 있다. 그 밑그림이 시즌1의 인물들 속에 자그마하게...
148,아스달 연대기 드라마,2019.09.23.,넷플릭스 없이는 대작 드라마 어렵다고? 어떻게 된 일일까,http://thekian.tis...,"<아스달 연대기>, <배가본드>, <동백꽃 필 무렵> 같은 드라마들이 그렇다. 물론 OCN은 넷플릭스 오리지널처럼 일찍부터 ‘OCN 오리지널’을 추구하는 경향이 있어..."
149,아스달 연대기 드라마,2019.09.27.,날 녹여주오 촬영지 계명대 알아보세요,한글 2017 무료설치,08:32 날 녹여주오 촬영지 계명대 알아보세요 많은 분들이 tvn에서 하는 드라마 날 녹여주오에 대해서 촬영지 계명대에 대해서 알아보도록 하겠습니다. 아스달 연대기...
150,아스달 연대기 드라마,2019.10.05.,제작비 200억 대작 드라마 '나의 나라 vs 배가본드' 시청률 승자는?,☆*:.My Sweet Have...,한국 드라마 제작비 순위을 살펴보면 (200억 이상만) tVN '아스달 연대기' (540억) tvN '미스터 선샤인' (300억) SBS '배가본드' (250억) 넷플릭스 '킹덤' (200억) tvN...
151,아스달 연대기 드라마,2019.10.01.,이실로브 세그마,from. aradang,이거 끝나고 다른 드라마 보려고 하니 1화만 봐도 시시해서 못보겠다. 휴 ㅋㅋ 그냥 내 마음대로 내린 아스달연대기의 결론은 ‘모든 것이 합력하여 선을 이룬다’ 이다....
152,아스달 연대기 드라마,2019.10.02.,최근에 재밌게 본 넷플릭스 프로그램 및 영화,"나무야, 소풍가자!","최근에 재밌게 본 프로그램, 영화 및 드라마 정리!! 통닭이나 피자먹으면서 가볍게... 정말 주인공인 송중기 말고도 매력적인 캐릭터가 넘쳐나는 아스달연대기...."
153,아스달 연대기 드라마,2019.09.30.,OCN 타인은 지옥이다 후속작 '모두의 거짓말' 스튜디오 드래곤 제작!! 기대됩니다.,SJ크린 ☏010-7181-...,스튜디오 드래곤 제작 드라마 3년동안 끊임없이 만들어 낸 대작들!! 대부분 제가... www] [아스달 연대기] [그녀의 사생활] [나의아저씨] [알함브라궁전의 추억] STUDIO...
154,아스달 연대기 드라마,2019.10.02.,∥감상∥ 조선로코 - 녹두전 1회 ＆ 2회,▦ BluishMoonLight...,ⓒKBS 혜진양 작가의 웹툰 <조선열애뎐 녹두전>을 원작으로 한 드라마다. 사실... 2019/10/09 ∥감상∥ 아스달 연대기 5화 ＆ 6화 2019/09/27 ∥감상∥ 아스달 연대기 3화...
155,아스달 연대기 드라마,2019.10.01.,"조선로코 녹두전 1,2회 줄거리뷰, 모두 납득시킨 장동윤 여장, 김소현 머리자른 명대사? 정준호 아기 죽인 광해? 절름발이 살수, 과부촌 열녀단 3총사 귀엽, 부봉사 고건한, 촬영지 어디?",퍼블릭에프알,"드라마 녹두전 첫방송에서는 , 녹두(장동윤 분)가 과부촌에 들어가는 모습이... 했는데 제일큰 열녀단 역의 배우는 아스달연대기 해투악 으로 출연했죠. (배우 윤사봉 )..."
156,아스달 연대기 드라마,2019.10.02.,2019년 9월 인기 많은 글,천천히 꾸준히(Slow...,^^ 아스달 연대기 - PART 3 기본적으로 <아스달 연대기>와 같은 드라마가 한국에 없었다.무엇보다 드라마가 진행되다 중간에 막... blog.naver.com 8. 아스달 연대기 - 파트 3...
157,아스달 연대기 드라마,2019.10.01.,"어제는 영화, 오늘은 무대, 내일은 TV에서 만난다?…장르 불문 종횡무진 배우들","공연·전시 매거진, 올댓아...","그는 얼마 전 종영한 tvN 드라마 <아스달 연대기>에서 연맹궁의 필경장이자, 장동건의 입이 되어준 대대 역을 맡았다. 그전에는 KBS2 드라마 <저스티스>에서 국세청장을..."
158,아스달 연대기 드라마,2019.09.29.,"무대인사 영상 /장사리:잊혀진 영웅들/김명민,김인권,김성철,곽경택,이호정",붕어삼남매,드라마 :아스달 연대기 속에서 보여줬던 신선한 연기가 이번 영화에서도 앞으로 기대되는 배우임을 입증하는듯 하였습니다. 영화의 재미를 떠나 충분히 새로운...
159,아스달 연대기 드라마,2019.09.28.,"배가본드 3회::수위 모자이크 접대 장면, 제롬은 죽었?, 릴리, 시청률은 애매, 수지의 연기력",Blog 2 Remember,"https://tv.naver.com/v/10016365 ""아스달 연대기""가 나에게 준 몇 개 안 되는 긍정적인... 이 드라마는 '액션 드라마' 특유의 포스와 긴장감은 사라지고, ""액션 영화 촬영장..."
160,아스달 연대기 드라마,2019.10.03.,"넷플릭스 한국드라마 배가본드, 동백꽃 필 무렵",뭉파300,"넷플릭스 한국드라마 명작들이 참 많아집니다. SKY캐슬, 밥 잘 사주는 예쁜 누나, 아스달연대기, 60일 지정생존자 등 장르도 다양해지고, 참여하는 방송국도..."
161,아스달 연대기 드라마,2019.10.04.,"가해자 사연 사라진 극, 범죄 보도 노하우 읽기",Magazine X,"16 메디컬드라마, 한국 사회의 통증을 진단하다 (0) 2019.07.26 ‘60일, 지정생존자’가 보여준 새로운 리더십 (0) 2019.07.05 ‘아스달 연대기’와 ‘태왕사신기’의 평행이론..."
162,아스달 연대기 드라마,2019.09.30.,"[tvN 날녹여주오 1,2화] 억척녀의 냉동기...",magic room,아스달 연대기의 바톤을 이어받은 tvN 드라마 날 녹여주오는 조금은 독특한 방식의 드라마이기도 하다. 출처 :tvN 날노여주오 1회 화면캡처 무한실험천국은 지창욱이...
163,아스달 연대기 드라마,2019.09.28.,"주말드라마, 날 녹여주오 무슨 내용? 인물관계도-몇부작-작가감독-원작? 20년순삭잼? 지창욱x원진아 체온위기도? 음모는 연구조수 조기범? 심형탁-이홍기 변신, 나하영 과거 채서진",퍼블릭에프알,#날녹여주오 #날녹여줘요 #드라마날녹여주오인물관계도 #날녹여주오몇부작 #날녹여주오작가감독원작 #윤세아 #채서진 #아스달연대기후속작 #토일드라마 좋아요 공감...
164,아스달 연대기 드라마,2019.09.29.,제 시간을 훔쳐가는 결제 구독 리스트를 공유합니다,국립목포대학교 공식 블로그,"여러분들이 흔히 알고 있는 응답하라 시리즈 드라마와 최근에 종영한 아스달 연대기와 호텔 델루나 등 CJ 계열의 웬만한 드라마와 예능을 스트리밍, 다시보기 할 수..."
165,아스달 연대기 드라마,2019.09.23.,노민우 : 검법남녀2 장철,별하's 감성드라마&...,어제 아스달 연대기를 보고 멘붕와서 잠을 설쳤네요.. 시즌2를 한다고 하는데..... ㅠㅠ 그나저나 이로써 제가 시즌제를 기다리고 있는 드라마가 또 하나 늘었네요....
166,아스달 연대기 드라마,2019.09.27.,♥브루나이골프♥ 왕실의 호텔에서 즐기는 왕족의 골프,마이리얼골프(My Re...,방영중인 드라마 #아스달연대기태고의 땅 '아스'를 배경으로 펼쳐지는 영웅들의 전설... blog.naver.com 품위있는 #동남아골프 NO.1 브루나이 엠파이어 로얄 브루나이...
167,아스달 연대기 드라마,2019.09.25.,"요즘 드라마 추천 (꽃파당, 동백꽃필무렵, 배가본드, 멜로가체질)",플레이로드,ㅋㅋㅋㅋㅋㅋㅋㅋㅋㅋ 아스달연대기 끝나고 보는 드라마는 딱 4개라서 이번포스팅은 심플하게 4개만 추천해보겠음 ㅋㅋ 월화드라마 JTBC 조선혼담공작소 꽃파당!...
168,아스달 연대기 드라마,2019.10.02.,"미디어와 커머스의 조합으로 트렌드를 선두하는 “CJ” 엔터의 전략 (음악, 영화, 방송사업 등)",Nicky Kim 블로그,"텐트폴인 <미스터 션샤인 >과 <아스달 연대기>의 단가는 최고 21백만원까지 상승한바 있는데, 월화 21:00~24:00의 드라마 기준 광고단가는 633% 상승하여 13백만원..."
169,아스달 연대기 드라마,2019.09.24.,박지훈 콘텐츠 영향력 지수 CPI  꽃파당 종합&드라마 2위 (9월3주),I'm 해피해피해,주연의 드라마 '배가본드'가 콘텐츠 영향력 지수 종합 1위를 차지했다. 24일... 1 아스달연대기 236.2 멜로가 체질 231.8 쌉니다 천리마마트 230.0 동상이몽2 229.7...
170,아스달 연대기 드라마,2019.10.04.,"동백꽃 필 무렵 9회-12회 명대사, 일주일을 또 어케 기다리지 촌므파탈은 이제 파란하마해",넌 내게 바나나,"주말을 기다리는 내가 평일의 중간지점, 일상의 즐거움을 주는 일주일의 중간 딱 그즈음, 수목드라마를 기다리게 될 줄이야! 공중파의 보석드라마 동백꽃 필 무렵 그리고..."
171,아스달 연대기 드라마,2019.09.23.,#여행후기 #포천 #비둘기낭폭포 #영화드라마CF촬영지●와우~ 비둘기낭폭포 최고! 제 영혼의 휴식처였네여! ~ ^^*●,타오르는 태양도 날...,#여행후기 #포천 #비둘기낭폭포 #영화드라마CF촬영지 킹덤 아스달연대기 선덕여왕 추노 최종병기 활 늑대소년 괜찮아 사랑이야 이렇게 숱한 드라마와 영화의 촬영지인...
172,아스달 연대기 드라마,2019.09.23.,[고현주] 꿈꾸는 카메라 (책추천/사진/사진에세이/포토에세이/감성에세이/소통/나눔/치유/사랑/교육),JOY's 365Hertz.,꿈꾸는 카메라 中 지난주 종영한 드라마 #아스달연대기 에서 아스달 연맹의 대제관이 된 여주인공 탄야에게 노예로 잡혀온 어린아이가 이런 이야기를 묻는 대목이...
173,아스달 연대기 드라마,2019.10.01.,2019 코리아드라마페스티벌 어워즈 생중계 중,하윤하진맘이 살아가...,TV드라마를 대상으로 한 국내 단일부문 최대의 드라마 시상식 2019... 우수연기상 아스달 연대기 - 김지원 왕이 된 남자 - 이세영 진심이 닿다 - 유인나...
174,아스달 연대기 드라마,2019.09.23.,"영화 <버티고> 제작보고회 현장 스케치 (직찍&풀영상) : 천우희, 유태오, 정재광, 전계수 감독",곰솔이의 영화연애,"<레토>를 통해 칸 국제영화제 초청, 칸이 먼저 알아본 글로벌 신예로 떠오른 배우이자, 드라마 [아스달 연대기]에서 '라가즈' 역으로 강렬한 존재감을 발산하며 스크린과..."
175,아스달 연대기 드라마,2019.09.24.,tvN드라마 날 녹여주오 등장인물관계도 : 지창욱 원진아,고양가구3단지 공식...,tvN드라마 날 녹여주오 등장인물관계도 : 지창욱 원진아 안녕하세요. 공동구매... 녹여주오' 아스달 연대기 후속으로 9월 28일부터 11월 17일까지 16부작으로 방송될...
176,아스달 연대기 드라마,2019.09.23.,목요일일상 ! 7월아리따움세일 라네즈크림스킨 / 해피엔딩 봄밤 ♥ 끝 :),♥ 박현뎡 블로그 ♥,☞☜ 뒤에가 트여있는데(?) 그게 참 이쁘단말이지 킄킄 요즘 내가 챙겨보는 드라마 두개 아스달연대기 & 봄밤 주말에 아스달연대기 중간.. 끝나고 ㅠㅠㅠ 오늘 봄밤도...
177,아스달 연대기 드라마,2019.10.02.,[드라마] 멜로가체질 - 좋은 드라마는 끝나고 몰아서봐야 기다리느라 전전긍긍안하고 좋지!(feat.뒷북),킹집사와 랑랑,"어렸을 땐 꼬박꼬박 학원끝나고 드라마보려고 뛰어오고 본방사수에 목매던... 뒷북, <아스달 연대기> 등등 이번에도 마찬가지... <멜로가 체질> 뭔데 주연들 캐릭터 설정..."
178,아스달 연대기 드라마,2019.10.04.,데이유리일상.롯데백화점.루이비통매장픽업.삼진어묵.대왕유부초밥.도제.간장새우유부초밥.주안촛불.초코프라프치노.일당백.쭈꾸미철판볶음밥.클리피씨치아교정통증.오므라이스.두부덮밥.카스타드.,데이유리's 오늘,#아스달연대기 #드라마추천 #송중기주연 2019년 9월 26일 목요일. 오전 사무실 출근길. 출근길 셀피타임. 지금까지 한달 넘도록 속눈썹 연장도 하지 못한채 (바빠서 짬이...
179,아스달 연대기 드라마,2019.09.30.,지적이고 아름다운 글자의 세계,(풀꽃선생 서재),< 아스달 연대기 > 라는 드라마에서 작가들은 새로운 문자와 언어를 만들었다 . 그 한계는 뚜렷하지만 그래도 그들은 즐겁고 신비로웠을 것 같다 . 퇴직하고 시간이 나면...
180,아스달 연대기 드라마,2019.09.23.,이황의 배우~ 최근 활동소식 & 촬영현장 story,제롬엔터테인먼트,https://m.blog.naver.com/jalom_ent/221656363090 아스달연대기 필경장 대대역~ 이황의 배우 tvn드라마 아스달 연대기가 part3를 끝으로 시즌1의 이야기는 막을 내렸다....
181,아스달 연대기 드라마,2019.09.28.,날 녹여주오 등장인물관계도 줄거리 몇부작 : 원진아 지창욱,덤보의 봉봉 라이프...,끝나는 드라마도 새롭게 시작하는 것들도 많아서 뭐부터 봐야할지... 호텔델루나와 아스달연대기를 야무지게 봐서 그 뒤를 잇는 후속 역시 기대 뿜뿜 설레였는데요....
182,아스달 연대기 드라마,2019.09.26.,"미스터리한 냉동 인간 프로젝트 드라마 '날 녹여주오' 기대 리뷰, 9월 28일 첫방송",(주)YM entertainment,올 가을 온탕과 냉탕을 오가는 해동 로맨스 드라마 '날 녹여주오' 모두들 정주행 해보자구욧 > < 주말 드라마'날 녹여주오'는 '아스달 연대기 Part3' 후속작으로 tvN에서...
183,아스달 연대기 드라마,2019.09.24.,2019년 9월 3주차 드라마 순위,굿데이터,드라마 3 위는 전주 대비 화제성 점수가 21.42% 상승하며 대단원의 막을 내린 tvN ‘아스달 연대기’였다 . 9 월 3 주차 ‘아스달 연대기’가 기록한 화제성 점수는 파트...
184,아스달 연대기 드라마,2019.09.24.,포천 비둘기낭 캠핑장에서 캠핑퍼스트 밤그대~,레다의 재미난캠핑,및 드라마에서 신비스런 장소로 촬영되던 곳이더라고요. 최근 방영되었던 아스달 연대기의 배경이 되기도 했을 정도로 신비하고 오묘한 느낌이 드는 장소이기도...
185,아스달 연대기 드라마,2019.10.03.,"함양 선비길은 공사중, 화림동 계곡",꽃피는 산골,"집에 텔레비전이 없는지라, 언제 아스달연대기를 했는지 모르지만... 농월정 관광단지 근처에서 드라마 촬영도 했나 보네요. 농월정을 지나서 0.6km를 걸어왔나 봐요...."
186,아스달 연대기 드라마,2019.09.30.,"[매일성경.40] 우리도 가나안에 있습니다 (feat. 희년) (여호수아 13-21장, 2019. 9. 29) _ 양주 사귐의교회 주일 설교",Kang's Place,"<아스달 연대기>라는 드라마인데, 이 드라마는 어떤 의미에서 매우 성경적인 부분들이 있습니다. 드라마의 배경은 부족사회입니다. 청동기 문명. 아직 왕이 없었던 그..."
187,아스달 연대기 드라마,2019.10.03.,Contents War? Contents Bubble?,반지하에서 펜트하우...,최근 한국에서 제작비 540억원이 투입된 드라마 '아스달 연대기'는 넷플릭스에서 독점 공급 중이다. '아스달 연대기'를 제작한 스튜디오드래곤은 주가와...
188,아스달 연대기 드라마,2019.09.24.,UHD TV 14%/ 카시트 29% 세일 오늘만 이 가격!,...,요즘 새로 하는 드라마와 아스달 연대기도 보고 외출도 하고 하다 보니 포스트 며칠씩 건너 띈 것 같아요. 만들기 할 재료를 사하는 시기가 왔는데 그런 거...
189,아스달 연대기 드라마,2019.10.04.,"빔프로젝터 추천, 삼성 스마트빔 SSB-11DLWA10 사용기: 내 집에 작지만 큰 TV가 생기다",로아월드,"판타지 드라마이기 때문에 CG 비중이 많은 아스달 연대기 또한, 작은 태블릿 화면에서 볼 때보다 몰입감 있게 볼 수 있었는데요. 듀얼 와이파이 2.4GHz, 5GHz가 제공되어..."
190,아스달 연대기 드라마,2019.09.23.,[영화예매권이벤트] 김명민 주연 한국 전쟁영화 <장사리 잊혀진 영웅들> 영화 공짜로 보는 방법,마제스타지,"출처 : 네이버 영화 드라마 [슬기로운 감빵생활], [아스달 연대기]를 통해 안방극장을 사로잡은 배우 김성철은 '최성필'과 신경전을 벌이는 에이스 학도병 '기하륜..."
191,아스달 연대기 드라마,2019.10.05.,나의 나라 1회 간보기,진실은 저 멀리에,세상에 이렇게 기대를 전혀 하지 않고 보는 드라마는 아스달 연대기에 이어 2번째입니다. 그럼 대체 왜 제가 나의 나라를 보는가? 당연히 김영철씨의 태조 이성계가 과연...
192,아스달 연대기 드라마,2019.09.23.,"<장사리 : 잊혀진 영웅들>(2019) 기자, 시사 간담회",클린트 이스트우드 ...,"드라마 [슬기로운 감빵생활], [아스달 연대기]를 통해 다채로운 매력으로 안방극장을 사로잡은 배우 김성철은 ‘최성필’과 신경전을 벌이는 에이스 학도병..."
193,아스달 연대기 드라마,2019.10.04.,요즘보는넷플릭스,반짝반짝일기,ㅠㅠ 아스달연대기 역시뭐때문에잘안보게되는 마지막2화 하아..... 비밀의숲 으허허허어허어헝 넘멋있고 쫄깃하고 재밌고 소름돋고 어째 이런 드라마가 이제서야...
194,아스달 연대기 드라마,2019.09.29.,[상해외대]밀린 일상 글 적어보기,마음으로 배우다@sh...,이 날 송이가 드라마 얘기 왕창 해줬다ㅋㅋㅋㅋ 다시 생각해도 웃기네ㅋㅋ 사람들이 아스달 연대기를 안 본다며 분개하던 그녀ㅋㅋㅋㅋㅋㅋ 너의 아스달 사랑을...
195,아스달 연대기 드라마,2019.09.28.,JE잘JE잘 일상 [대학교 일상],JE잘JE잘 일상,"근데 조금 아쉬운면도 있어서 추천까지는 아니지만 그래도 어떠냐고 물어보면 볼만하다고 대답 할것같은 드라마 아스달 연대기 연출 김원석 출연 송중기, 장동건..."
196,아스달 연대기 드라마,2019.09.23.,타곤 태알하 갈등과의 동거,우주인 소울이의 세...,이제는 나라의 길 하나의 역사가 본격화 되는 드라마 아스달연대기가 시작된다. 타곤의 양자 사야의 계획 청동의 비밀을 해족에게 뺐는 것의 실패 아버지의 유언과...
197,아스달 연대기 드라마,2019.10.03.,"200억원 투입된 '나의 나라', '억'소리 제작비 부담감 이길까",나만의LDN i love y...,드라마들도 탄생하며 올해 방송가는 적자폭이 더 커진 상태다. 대표적으로 파트1부터 파트3까지 18부작에 걸쳐 540억원이라는 역대급 제작비를 썼던 tvN '아스달 연대기...
198,아스달 연대기 드라마,2019.09.29.,장사리 잊혀진영웅들 (무대인사),YOONTORY's Daily,최근 재미있게 본 드라마 아스달연대기 에서 잎생역으로 얄밉지만 성장해가는 멋진 연기를 보여주셨기 때문이에요 남는건 사진이다!!하고 많이 찍어왔죠 실물이 다들...
199,아스달 연대기 드라마,2019.10.03.,장동건이 선택한 구스이불! 크라운구스 파티에 다녀왔어요.,엘리스 러블리 데이...,얼마 전에 종용한 아스달 연대기에서 뛰어난 연기력으로 드라마 보면서 푹 빠져 있었는데 직접 보니 넘 반갑더라고요. 동건님은 오래 전에 행사에서 한번 본적이...
200,아스달 연대기 드라마,2019.09.29.,SBS Trading Buy 했음,리메,"우리나라 역사상 최고치는 미스터선샤인, 아스달 연대기. 15초당 2,070만원 제작비가 500억정도 SBS는 배가본드에 200억 중반 정도 쓴 것으로 추정 드라마가 4월..."
201,아스달 연대기 드라마,2019.09.30.,포천 가볼만한곳 한탄강 8경_6경 비둘기낭폭포(천연기념물 제537호) 현무암주상절리의 아름다움,어린이의 정원,포천가볼만한곳인 비둘기낭폭포가 배경이 된 드라마와 영화입니다. 최근에는 킹덤과 아스달 연대기에 나오기도 했네요. 비둘기낭폭포! 당일치기 서울근교여행...
202,아스달 연대기 드라마,2019.09.26.,요즘 넷플릭스 볼만한 것 추천,Now or Never,#넷플릭스 에 요즘 한국 드라마가 마니 올라오네요?? 넥플릭스 보게된 후로 티비를... 시작된 #아스달연대기 입니다. 시즌 투까지 달리듯이 보다가 다시 시작하니 쫌...
203,아스달 연대기 드라마,2019.09.29.,오산 영무파라드 도심공간과 상생하는 아파트 입니다,강차장의 부동산이야...,"드라마세트장은 tvn 드라마 "" 아스달 연대기"" 에 사전제작 세트장입니다. ""오산영무파라드"" 는 오산시에 최중심지에 입지는 해서명품 인프라를 모두 누릴 수 있는 장점이..."
204,아스달 연대기 드라마,2019.09.25.,미디어 시장을 주도하는 기업의 비밀 - <자체 콘텐츠 + 규모의 경제>,Nicky Kim 블로그,"우호적인 시장 전망에도 불구하고 국내 드라마 제작사에 대한 우려도 있습니다. 매출액보다 제작비(매출원가)가 더 빠르게 증가하고 있으며, ‘아스달연대기’ 이후..."
205,아스달 연대기 드라마,2019.09.27.,배곧 놀거리 배곧 룸카페 룸스토리 (시흥 배곧점)에서 놀다,뚱이네 일상,"못본 아스달 연대기도 실컷보고~~~저는 촌시러서 최신영화,드라마,예능 다 볼수 있는데도.... 제가 좋아하는 드라마 삼매경에 빠졌네요^^ 세찌는 먹고 또먹고..."
206,아스달 연대기 드라마,2019.09.25.,9월 셋째주 일상블,202호 현푸 방,여행은 언제가도 좋은법 이번달이나 다음달에 국내라도 한번 머어어얼리 떠나보고싶다ㅎㅎㅎㅎ 요즘 최애 드라마 아스달연대기 파트2 기다렸다가 요즘 맨날 본방...
207,아스달 연대기 드라마,2019.09.25.,당신의 바다는 잘 있습니까? 19,“Welcome to my gr...,‘아스달 연대기’라는 드라마인데 나름 꽤 재미있다. (좋아하는 여배우가 나와서 보는 건 아님) 드라마의 제목만 봐도 아스달? 아스달이 뭐지?라는 생각을 하게 된다....
208,아스달 연대기 드라마,2019.09.26.,<상여자블로그> 일상 / 10월을 앞둔 평범한 아줌마의 흔한 일상,상여자블로그,힘들어 힘들어 아스달 연대기를 정주행 하기 시작했다 송중기 내 스타일은 아닌데... 이 드라마의 묘미인 듯...; 드디어 기다렸던 월요일 :-) 태풍이 지나고 날씨 굿! 따님...
209,아스달 연대기 드라마,2019.09.25.,19년 9월 24일,쥬(주)일기,밥먹으면서 아스달 연대기 마지막화를 봤는데 이렇게 끝내고 다음 시즌 언제... 생각이 들지만 가슴은 뛰지않는 뭐 그런 드라마랄까. 사실 중간중간 안 본 부분도 많다...
210,아스달 연대기 드라마,2019.10.03.,"[영화 GV] 영화 <장사리 : 잊혀진 영웅들> 스페셜 GV / 곽경택 감독, 김태훈 감독, 김성철 배우, 사회 김종철 편집장 / in CGV 용산아이파크몰",darby의 忙中閑을 즐...,"ㅎㅎㅎㅎ 기하륜 역의 김성철 배우 드라마 슬기로운 감빵생활에서 법자를 연기했었고, 아스달 연대기에서는 잎생 역할을 맡아 송중기 옆에서 연기했었죠. 좌측부터..."
211,아스달 연대기 드라마,2019.09.27.,배가본드 2화 : 스턴트맨이라거??,Here comes the sun,"그리고 동시간대는 아니지만 아스달 연대기가 종료된 후 TVN에서는 ""날 녹여주오""라는 백미경 극본, 신우철 연출의 지창욱을 내세운 드라마가 28일부터 방영에정입니다...."
212,아스달 연대기 드라마,2019.09.23.,33주4일/유즙분비/임신중젖분비/배뭉침/수축/가진통/가진통증상,백숨일상이야기,아스달연대기-타인은지옥이다 코스로 쭉 티비를 봐야하기때문에 최대한 편하게... 드라마에 집중해서 아픈걸 견뎌낸건지 참을만한 고통이였는지는 아직도 모르겠다.....
