,drama_title,date,blog_title,writer,contents
0,그녀의 사생활 드라마,2019.05.31.,[tvN 수목드라마] '그녀의 사생활' 16화(마지막화) 줄거리/리뷰/OST(BGM) - '당신의 최애가 되어줄게요.',갓타's Diary,"드디어 tvn 수목드라마 '그녀의 사생활' 마지막화다.이미 웬만한 갈등은 다 해결이 되었고,라빗커플도 꽃길 걸을 일만 남은 것 같은데 이들이 맞이하는 결말은 어떤..."
1,그녀의 사생활 드라마,2019.05.31.,"드라마리뷰, 로맨스 드라마추천 [그녀의 사생활] 줄거리 및 결말 / 스포주의",아쵸 데일리 (~˘?...,사실 뭐 넘 허접했네요 이번 리뷰는 ㅠㅠ 안녕!!!!!!!!!! #드라마추천 #드라마리뷰 #그녀의사생활 #김재욱 #박민영 #로맨스드라마 #로맨스드라마추천
2,그녀의 사생활 드라마,2019.06.09.,19년도 추천 드라마 5 - 그녀의 사생활 (tvN),오래오래인국♡,그녀의 사생활 (tvN) (2019.04.10. ~ 2019.05.30) 연출 홍종찬 | 극본 김혜영 ** Cast ** 성덕미... 로코드라마 ** 기획의도 ** 본격 덕후의 시대- 사랑하라! 덕후처럼! 불과 몇 년...
3,그녀의 사생활 드라마,2019.06.05.,[드라마] tvN - 그녀의 사생활,소비에 대한 모든 기...,열성적인 드라마 팬은 아니지만 소소하게 잘 챙겨본 그녀의 사생활. -'아이돌 덕후'라는 독특한 컨셉의 탈을 썼지만 사실 한겹 벗겨보면 흔하디 흔한...
4,그녀의 사생활 드라마,2019.06.03.,드라마 인테리어♥드라마셋트♥중문인테리어♥핫인테리어♥그녀의사생활박민영옥탑방,에이플러스 032)543...,#그녀의사생활조명 #그녀의사생활옥탑방 #드라마인테리어 #그녀의사생활박민영방 #드라마셋트장인테리어 #핫인테리어 #중문인테리어 #중문설치 #중문 #유리칸막이...
5,그녀의 사생활 드라마,2019.05.31.,[그녀의 사생활] 16화. 운명인 이들의 드라마스러운 엔딩(feat. 성덕파티),꿈블꿈블 MAY,m.blog.naver.com 그리고 10번째 드라마 봄밤도!! 그럼 그녀의 사생활 마지막화 리뷰 시작해볼게요! 어릴적부터 화가가 꿈이었던 덕미와 그런 덕미의 말에 영향을 받은 듯한...
6,그녀의 사생활 드라마,2019.06.02.,[드라마] 그녀의 사생활 (feat.덕질하는 덕호),CHODUKHO_ARCHIVE,"naver.me 완전 내 취향의 드라마는 아니지만, 개인적으로 '덕후'라는 포인트와 공감대 때문에 보게 된 드라마, 그녀의 사생활. 포스터 색감, 구도 자세 그리고 배우들의..."
7,그녀의 사생활 드라마,2019.06.01.,사랑스러운 드라마? 그녀의 사생활,A bonny day ??,"출처 : tvN 드라마 <그녀의 사생활> 홈페이지 라이언 ? 덕미 보는 내내 내가 다 설레고, 대리만족 내가 성덕미가 된 느낌 캬 - 출처 : tvN 드라마 <그녀의 사생활> 홈페이지..."
8,그녀의 사생활 드라마,2019.05.31.,[tvN 그녀의사생활_결말] 달달 폭발한 라빗커플의 해피엔딩,CJ ENM E&M 부문,채움 개관 5주년 전시회 그녀의사생활 마지막 방송에서는 우여곡절이 많았던 채움 5주년 전시회도 드디어 오픈했답니다. 전시품들 만큼 드라마 내내 나왔던 명대사의...
9,그녀의 사생활 드라마,2019.06.01.,"그녀의 사생활 박민영 패션, 로즈몽 귀걸이 반지 목걸이 몽땅 다 소개!",뷰스타 룡이 뷰티놀...,"수요일, 목요일 밤마다 뉴스며 화제가 되고 있는 수목드라마 #그녀의사생활 ! 요즘 더 진해진 러브라인으로 보는 재미가 아주 어마어마하잖아요 :) 예전에는 김비서로..."
10,그녀의 사생활 드라마,2019.06.06.,그녀의 사생활 박민영 패션 속의 로즈몽 시계 & 귀걸이 & 목걸이 총정리편,이상한 나라의 망고,"것 그렇게 너무 아쉬운 드라마 그녀의 사생활 속 박민영 패션에 돋보이던 시계, 귀걸이, 목걸이까지 총정리를 끝내봅니다. 로즈몽 기획전 바로가기 통합 홈페이지 바로가기"
11,그녀의 사생활 드라마,2019.06.08.,tvn 드라마 <그녀의 사생활> 미술 자문진행 이야기,INSA ART PLAZA GAL...,"인사아트프라자 갤러리와 함께한 tvn 드라마 <그녀의 사생활> 인사아트프라자 갤러리(관장 허성미)에서는 2019년 4월 10일 ~ 5월 30일 방영된 tvn 16부작 수,목 드라마..."
12,그녀의 사생활 드라마,2019.05.31.,"그녀의사생활,  드라마속에서보여지는성덕미핸드백,  박민영패션,  성덕미가방,  박민영핸드백,  델보브리앙,디올,couronne ,알렉산더맥퀸박스백,지방시gv3, 발렉스트라,발리",독한 디자이너 AGNE...,"www.matchesfashion.com << 델보브리앙: 델보톰페트화이트은장>> << 그녀의사생활, 드라마속에서보여지는성덕미핸드백, 박민영패션, 성덕미가방..."
13,그녀의 사생활 드라마,2019.06.12.,"tvN ""그녀의 사생활"" 드라마 뷰소닉 모니터?",ViewSonic Korea 공...,"5월 30일 마지막으로 총 16부작 ""그녀의 사생활"" tvN 드라마가 종료 되었습니다. 주인공에 박민영, 김재욱이 맡아 인기리에 방영이 되었습니다. 직장에선..."
14,그녀의 사생활 드라마,2019.06.01.,드라마 그녀의 사생활 박민영 귀걸이 마마카사르 멋스럽네,HEUNG JA IDEA,"이런 제가 요즘 완젼 빠져있는 드라마가 하나 있는데 바로오오오 그녀의 사생활입니다!! 요게 원작은 웹툰이라는데 (저는 만화는 잘 안봐서 ,,) 안봤지만 원래 인기가..."
15,그녀의 사생활 드라마,2019.06.08.,드라마 <그녀의 사생활> 배우 박민영 가방 패션 탐구,연예인 섭외의 모든것,드라마 <그녀의 사생활> 배우 박민영 가방 패션 탐구 안녕하세요 숑이에요 :) 오늘은 드라마 '그녀의 사생활' 박민영의 가방 패션에 대해 알아볼게요. 그녀의 사생활은...
16,그녀의 사생활 드라마,2019.06.04.,<달달하셨습니까?>그녀의 사생활 명장면/투샷모음,슬 픈 중 독 자,"로코를 좋아하는데 생각보다 끝까지 봐지는 드라마가 많지는 않다. 그런데... 그녀의 사생활, 투샷모음 이런저런 사고로 첫인상은 꽝이었지만, 선입견을 버리고 서로의..."
17,그녀의 사생활 드라마,2019.06.01.,그녀의 사생활 박민영 패션 로즈몽 반지 받아서 부럽다..,밍고데어,"김재욱, 박민영, 김보라 등 정말 제가 좋아하는 배우들이 많이 나와서 기대를 했던 드라마 그녀의 사생활! 까칠한 상사 라이언을 만나서 펼쳐지는 덕질 로맨스라는..."
18,그녀의 사생활 드라마,2019.05.31.,"[삼성비지니스솔루션]tvN수목드라마 복합기협찬 ""그녀의사생활"" 13~14회 드라마 복합기협찬 캡쳐화면입니다.",삼성비지니스솔루션...,"tvN수목드라마 복합기협찬 ""그녀의사생활"" 13~14회 드라마 복합기협찬 전경사진입니다. 저희 삼성비지니스솔루션은 화성세트장 두곳에 A3디지털복합기 1대..."
19,그녀의 사생활 드라마,2019.06.11.,<tvN> 그녀의 사생활-김재욱의 입덕드라마 (11~최종화),물고기자리-미의 여...,이미 끝난 드라마니까.....스포 괜찮겠죠.. 그런데 모자의 만남은 의외였다.... 드라마를 볼때 감독이나 작가를 보고 선택하지는 않는 편이다. 채널 돌리다 보면 같은...
20,그녀의 사생활 드라마,2019.05.31.,그녀의사생활 박민영  패션 속 로즈몽 시계 & 목걸이랑 귀걸이에요,디어진의 오늘도 맑...,Rosemont 드라마 <그녀의 사생활> 보시나요 ? 박민영 주연의 사랑스러운 tvN 드라마에용 영상미도 좋고 ㅠㅠ 주연들 비주얼 보는 재미도 장난아닌 드라마 ㅠㅠ 콩닥콩닥...
21,그녀의 사생활 드라마,2019.06.06.,그녀의 사생활 박민영 패션 로즈몽 시계 & 주얼리 주세요!,@유나설 : 패션블로...,출처 : 그녀의사생활 드라마 > 일단 비주얼이 너무 멋진 박민영이랑 김재욱이 주인공이라 눈이 즐거웠던 드라마인데요~ 너무 예쁜 박민영은 이번 그녀의 사생활에서도...
22,그녀의 사생활 드라마,2019.06.08.,종영드라마 그녀의 사생활에서 상큼 포텐 터진 박민영,디자인몽 | 제주 인...,그녀의 사생활 에서 상큼뽀짝 포텐터지는 연기를 보여준 상큼미녀 박민영! 앞으로도 좋은 연기 기대합니다 #박민영#김재욱#그녀의사생활#드라마#종영드라마#상큼#뽀짝#포텐
23,그녀의 사생활 드라마,2019.06.02.,"그녀의 사생활 박민영 옷 탐구, 티셔츠는 누보텐",이상한 나라의 망고,"터졌었던 드라마! 특히나 주인공 둘의 케미가 완벽해서 그런지, 인기폭발에다가 그녀의 사생활 박민영 옷이 하나같이 모두 인기를 끌었었는데요. 이제는 종영해서 볼 수..."
24,그녀의 사생활 드라마,2019.05.31.,"[그녀의 사생활] 마지막회: 안녕, 나의 최애~♥",키쓰쫑쫑 오늘도 청...,이 드라마 왠지 너무 인연의 연속이기도 하고 술술 ~ 잘 풀려서 짜증(?)나긴 했지만... 그래도 그래도.. 해피엔딩이 좋죠 현실에서는 더더욱 ~ㅋ #그녀의 사생활 #박민영...
25,그녀의 사생활 드라마,2019.06.08.,그녀의 사생활 - 덕질 사랑,천천히 꾸준히(Slow...,"그녀의 사생활 연출 홍종찬 출연 박민영, 김재욱, 김보라, 안보현, 박진주, 정제원, 홍서영, 김선영, 김미경, 맹상훈, 박명신, 임지규, 이일화, 정원창 방송 2019, tvN 드라마..."
26,그녀의 사생활 드라마,2019.06.03.,그녀의 사생활 박민영 패션 속 쿠론 브리오 크로스백 20대 여자 가방 굿!,블랙러시안의 문화&...,"제가 너무나 사랑했던 드라마 하나가 또 종영을 했어요..ㅠㅠ 항상 제가 이 드라마... 사실 그녀의 사생활을 제가 좋아했던 이유를 꼽아보라고 한다면, 재미도 재미지만..."
27,그녀의 사생활 드라마,2019.06.02.,그녀의 사생활 박민영 귀걸이는 마마카사르 반짝반짝!,썬데이 홍야라이푸(...,15회의 포도송이 같은 그녀의 사생활 박민영 귀걸이는 스페인 감성주얼리... 다음번에는 또 누구와의 캐미를 보여줄지ㅎㅎ 드라마 초반에 나왔던 장면! 이때는 아직...
28,그녀의 사생활 드라마,2019.05.31.,그녀의 사생활 김재욱 패션 속 옷 @발리 화이트 셔츠,히융히융의 쫑알뷰티...,"김비서가 왜그럴까부터 시작해서 아는 와이프, 진심이 닿다, 그녀의 사생활까지 tvN 드라마 왜 이렇게 잘 만드냐며 절 매번 푹 빠지게 만들어서 가슴앓이를 하게..."
29,그녀의 사생활 드라마,2019.06.01.,그녀의 사생활 16화 줄거리 및 김재욱 캡쳐,특별한 방황,그녀의 사생활 원작이랑 달라서 더 좋았던 드라마 그녀의 사생활이네요. 그녀의 사생활 원작에선 여주인공이 너무 답답하게 나와서 고구마 백개 먹는거 같았거든요 ! 넘...
30,그녀의 사생활 드라마,2019.06.12.,여자구두브랜드 슈츠 SCHUTZ 그녀의사생활박민영구두,슬단#로그,화제의 tvN 드라마인 그녀의 사생활에서 열연을 보여주고 계시는 배우 박민영님이 신고나오는 구두가 슈츠브랜드의 구두더라구요 *ㅇ*!! 그녀의 사생활 6회와...
31,그녀의 사생활 드라마,2019.06.09.,직업병 Ⅲ 그녀의 사생활 [드라마에 나온 작가],갤러리 아트리에 헤이리점,"대화입니다 드라마는 잘 안 보는 편이지만 이야기하다 보니 어디서 많이 들어본... 한 드라마! 갤러리 아트리에를 포함, 많은 갤러리에서 협찬해 주었더군요 그래서..."
32,그녀의 사생활 드라마,2019.06.04.,"드라마 <그녀의 사생활> 주제곡 ""Smile Again""",추억의 음악 일상으...,"2019년 4월부터 2019년 6월 사이에 방영한 tvN 드라마 ""그녀의 사생활""의 주제곡인 ""Smile Again""이라는 곡을 소개하겠습니다. 가수 ""러니""(RUNY)가 노래를..."
33,그녀의 사생활 드라마,2019.06.03.,그녀의 사생활 박민영의 20대여자가방 @쿠론 브리오 크로스백,뷰티패션블로거 귀톨...,사로잡았던 그녀의 사생활 박민영 패션 이번에 드라마가 막을 내리면서 더 이상... com 그녀의 사생활 드라마 속 박민영 가방을 비롯한 19 S/S 쿠론 뉴 캠페인 화보 컷 속...
34,그녀의 사생활 드라마,2019.05.31.,이일화 그녀의 사생활 드라마 패션은 레오나드원피스와 포레르빠쥬 가방,션로그,응답하라 덕선이 엄마로 나올때두 정말 아름다우셨는데 최근 그녀의 사생활에... 한분인데요 드라마 속 패션도 어쩜그리 예쁘신지!!! 어제 마지막회 패션 정보를...
35,그녀의 사생활 드라마,2019.06.04.,"tvN 수목드라마 [그녀의 사생활] 에몬스협찬가구 [리찌가죽소파,바쏘리프트업티테이블]",에몬스가구 삼송전시...,"수목드라마 그녀의 사생활은, 직장에선 완벽한 큐레이터 성덕미(Cast. 박민영) 알고 보면 아이돌 덕후 인 성덕미가 까칠한 상사 라이언 골드(Cast. 김재욱)를 만나..."
36,그녀의 사생활 드라마,2019.06.04.,사생활[tvN  그녀의사생활_결말]  천만다행인걸요,wvfhw4ups님의블로그,사실 덕미의 방과 방은무엇으로 따뜻했죠.드라마 봐요 전시에서 정말 갔나 :)문득 방은 그녀의사생활 에더 전달하는 메시지도 바 저의 ^^그래서 여러분의 채워져 속...
37,그녀의 사생활 드라마,2019.06.11.,[지니몽협찬] tvN 드라마 <그녀의 사생활>에 나온 스티커 (원형방수스티커),JINIMONG,덕질드라마인 '그녀의사생활' !!!! 이 드라마를 통해 저희 지니몽의 캐릭터를 보여드릴 수 있어 행복한 시간들이었어요? 지니몽의 캐릭터를 발견해주신...
38,그녀의 사생활 드라마,2019.06.09.,Drama | 한국_그녀의 사생활,"섬섬히, 피어나다",작년에는 영화/드라마 리뷰도 열심히 했는데 올해는 '그녀의 사생활'로 첫 기록 스타트 ?ヮ? '김비서가 왜 그럴까?' 이후로 보게 된 박민영 그때랑 이미지가 많이...
39,그녀의 사생활 드라마,2019.06.05.,[그녀의 사생활] 너무 정답만 나오는 드라마.,for a Better Life,"요근래 바빠서 드라마 볼 새가 없다가 몇 주전인가 한 달 전부터 챙겨보고 있는 드라마가 생겼다. 바로 그녀의 사생활. 박민영, 김재욱 주연의 로맨틱 코메디 드라마이다...."
40,그녀의 사생활 드라마,2019.05.31.,"로즈몽 귀걸이로 더욱 빛났던 그녀의 사생활 박민영 패션 목걸이, 반지까지 완벽해!",치즈초콜릿의 깨알블...,달달했던 그녀의 사생활이 끝났어요:) 이 드라마 정말 좋지 않았어요~? 가끔 보면서 재미있기는 한데 스트레스받게 되는 드라마도 있잖아요 ㅠㅠ 너무 속 터지게 일이...
41,그녀의 사생활 드라마,2019.06.02.,<그녀의 사생활> Point,소총무's diary,<그녀의 사생활> 드라마를 아시나요? 정말 설레면서 본 드라마에요. 이제 종방을 했으니 몰아보기도 가능합니다!! 그녀의 사생활에서 제가 생각하는 Point를...
42,그녀의 사생활 드라마,2019.06.07.,그녀의사생활박민영구두로 나온 슈츠구두,Credo♥,우리의 금사자씨와 덕미의 달달함에 푹 빠져서 본 그녀의사생활 드라마였어요. 그 중에서도 드라마 보는 내내 그녀의사생활박민영패션 이슈가 되었는데요. 제가...
43,그녀의 사생활 드라마,2019.05.31.,[그녀의 사생활] 마지막화 움짤폭탄! 이별선물 뿌부뿜!!,꿈블꿈블 MAY,수제비 데이트) ㅎ쏠로들을 위한대리만족 드라마그녀의 사생활!오늘도 정말어마어마한 꽁냥거림이기다리고있으니12... m.blog.naver.com [그녀의 사생활] 13화....
44,그녀의 사생활 드라마,2019.06.11.,그녀의 사생활 #15,"주접 떨 분, 모여주...","그녀의 사생활 #15 15회는 내내 언제 윤재랑 덕미 과거가 딱 밝혀질까,, 하면서... 이번 드라마에서 덕미랑 이분이랑 같이 모녀로 나와서 너무 좋았다는,, 혹시 힐러가..."
45,그녀의 사생활 드라마,2019.06.10.,"슈츠구두 Schutz, 그녀의 사생활 박민영 패션",Alsol Record,있는 그녀의사생활 드라마를 다들 보시고 계시나요? 저는 배우 박민영씨를... tvN 그녀의 사생활 9회 뭔가 스타일리쉬한 배우 박민영씨의 패션! 요즘 드라마에서...
46,그녀의 사생활 드라마,2019.06.01.,"그녀의 사생활 박민영 패션, 20대 여자 가방에 딱인 쿠론 브리오 크로스백으로 완성!!",찌라이의 해피라이프...,그녀의 사생활을 너무 재미있게 봐서 박민영 가방 패션을 중심으로 쿠론 백을 소개해드렸는데요. 드라마에 나온 브리오 크로스백과 에즈 숄더백 외에도 예쁜...
47,그녀의 사생활 드라마,2019.06.01.,홍대 굿모닝 미술학원이 tvN 드라마 <그녀의 사생활>에 나왔어요~!!,"회화의 명문, 홍대 ...",안녕하세요~ 홍대 굿모닝 미술학원입니다 ^^ 며칠 전에 굿모닝에 아주 재미있고 특별한 일이 있었어용 ㅎㅎ 바로 tvN 드라마 <그녀의 사생활> 마지막화에 홍대 굿모닝...
48,그녀의 사생활 드라마,2019.06.01.,그녀의 사생활 마지막회.....,항상 고픈 라묭쓰,보고 쪼매... 심쿵했쓰.../// #그녀의사생활 #라이언 #성덕미 #허윤재 #김재욱박민영 #로코드라마 #그녀의사생활마지막회 #드라마 #스포 #그녀의사생활엔딩 #로맨스코미디
49,그녀의 사생활 드라마,2019.06.02.,[수목 드라마] 그녀의 사생활,Drama Love,기획의도 인물관계도 등장인물 소개 성덕미 라이언 골드 주변 인물 사진 출처 : tvN <그녀의 사생활>
50,그녀의 사생활 드라마,2019.06.03.,"그녀의 사생활 박민영 가방 패션, 20대 여자가 들기 좋은 쿠론 브리오 크로스백",프렌치팝콘의 더뷰티...,설렘 설렘 했던 드라마 그녀의 사생활이 이제 종영을 했어요. 이 드라마 보면서 연애하고 싶다는 생각!! 많이 하셨죠? 저도 일회부터 마지막 회까지 쭈욱 챙겨 보면서...
51,그녀의 사생활 드라마,2019.06.01.,그녀의 사생활 속 노석 작가와 윤태화 작가의 이야기,조각 모음,하지만 그림에 대한 애증과 미련을 가지고 있고 좋아하는 사람을 내 손으로 직접 찍어 보정할 때의 희열감을 알고 있어서 '그녀의 사생활'이라는 드라마에 점점...
52,그녀의 사생활 드라마,2019.05.31.,그녀의 사생활 16회 줄거리 마지막회 박민영♡김재욱 해피엔딩,행복한 꾸르망고공간...,그녀의사생활16회 #그녀의사생활줄거리 #그녀의사생활시청률 #그녀의사생활재방송 #그녀의사생활후속드라마 #드라마WWW #수목드라마 #tvn드라마 #박민영 #김재욱
53,그녀의 사생활 드라마,2019.06.01.,[박민영X김재욱] 그녀의사생활 마지막회 / 최애가 될게요.,"miserable,console","최애가 되어줄게요 당신도 내 최애가 되어줄래요? 지금,덕질하고 있습니까? 모두 성덕 되시길! #그녀의사생활마지막회 #김재욱박민영 #그녀의사생활16회 #수목드라마 #tvN"
54,그녀의 사생활 드라마,2019.06.01.,박민영이 영상을 통해 ‘그녀의 사생활’ 종영 소감을,최적화블로그꿀벌 나...,"‘덕미로운 민영생활’ 시리즈는 tvN 수목드라마 ‘그녀의 사생활’ 방송에 맞춰 제작된 콘텐츠로 이전에 공개된 ‘덕질 가이드’, ‘큐레이터 자질 테스트’ 영상은..."
55,그녀의 사생활 드라마,2019.05.31.,그녀의 사생활 박민영 패션 젠틀몬스터 선글라스 너무 예쁨,미미꽃의 일상한조각,선글라스가 무겁지 않아서 가볍게 착용하기도 너무 좋을 것 같아요.ㅎㅎ 그녀의 사생활 박민영 패션 정보 잘 보셨나요? 이번에는 선글라스로 다뤄봤는데요. 드라마를...
56,그녀의 사생활 드라마,2019.06.01.,그녀의사생활 ost 개봉기??,소소한 일상??,그녀의사생활 끝나고 허전한 이 마음.. 앨범이 와서 조금 덜 쓸쓸한 거... 드라마 팬이라면 꼭 사세요!ㅋㅋㅋ 진짜 굿굿! 가운데가 화보집인데 열어보니까 딱! 우와...
57,그녀의 사생활 드라마,2019.06.12.,그녀의사생활 종방연케이크 마카롱타워 김재욱갤러리 마카롱케이크 주문제작 후기,느엘스 플라워케이크,오늘은 그녀의사생활 드라마 종방연때 김재욱갤러리에서 주문주셨던... 러블리했던 드라마 그녀의사생활 ! 우연히 지나가다가 촬영현장도...
58,그녀의 사생활 드라마,2019.06.07.,그녀의 사생활 박민영 가방은 쿠론이였다아~,여행&뷰티 혜윰하다...,"얄루~ 뷰리혜윰이예요오 :) 지난 5월 30일, 총 16부작으로 마지막을 장식한 드라마 그녀의 사생활. 김재욱과 박민영이 주연배우로 출연하여 은근 달달한 꿀케미를 보여준..."
59,그녀의 사생활 드라마,2019.06.04.,그녀의 사생활 박민영 패션 귀걸이로 완성하는 데일리룩,도시.락樂,"그래서 전부 다 챙겨보진못하고, 몇몇 재밌는 드라마만 챙겨보는데, 그 중에 한참 빠진 드라마가 바로 그녀의 사생활! 일단 두 배우의 케미가 좋아서 보기도하는데..."
60,그녀의 사생활 드라마,2019.06.06.,"그녀의 사생활 박민영 패션 예뻐요, 로즈몽 시계 & 귀걸이 & 목걸이 착용 ♥",*: 미니비쥬의 뷰티...,그녀의 사생활 박민영 패션 보는 재미가 있었는데 끝이 나서 너무 아쉬워요! 눈이 호강하는 드라마였는데 *_* 박민영이 착용한 로즈몽 워치와 주얼리는 로즈몽...
61,그녀의 사생활 드라마,2019.06.12.,그녀의 사생활 박민영귀걸이 대박 고급지고 여성스러운 링귀걸이 아티카 귀걸이 착용샷,허브의 어느 멋진 날,착용샷 #그녀의사생활 #박민영 나는 TV는 보지않지만 네이버 판이랑 뉴스는 열심히 읽기 때문에 언제나 연예나 드라마 소식도 뉴스나 네이버를 통해서 정보를 얻는다ㅋ...
62,그녀의 사생활 드라마,2019.06.01.,"그녀의 사생활 13,14회 김보라 패션은 레이첼콕스 구두와 럭키슈에뜨 원피스",양띠모모 - 뷰티 패...,"오늘은 드라마 그녀의 사생활 13회, 14회에서 김보라 패션을 알아보도록 할게요! 덕미의 집에서 수석을 손질하는게 완전 자연스러운게 누가보면 이집 딸인줄요..."
63,그녀의 사생활 드라마,2019.05.31.,"그녀의 사생활 16회 김재욱 패션, 옷 셔츠 훈훈터져~!",또니,슬픈소식 ㅜㅜ 그녀의 사생활이 어제를 마지막으로 끝나버렸습니다.. 정말 열심히 챙겨봤던 드라마인데 김재욱과 박민영 둘의 케미를 이젠 볼 수 없다니!!!?? 말도 안돼!!...
64,그녀의 사생활 드라마,2019.06.06.,"그녀의 사생활 박민영 패션 속 로즈몽 시계, 목걸이 살펴봐요",'한우리'의 IT 화장...,요즘 재미있는 tvN 드라마가 참 많아요~ 그중 챙겨보고 있는 것 하나가 <그녀의 사생활>인데요. 제가 좋아하는 박민영과 김재욱이 주연으로 나오는 데다 이 둘의 케미가...
65,그녀의 사생활 드라마,2019.05.31.,그녀의 사생활 박민영 패션 로즈몽 목걸이 & 귀걸이 & 반지 알아봐요!,패션x뷰티=블랙팅,16부작으로 막을 내린 tvN 수목드라마 그녀의 사생활~ 완전 역대급 설렘을 보여주었던 어른 로코답게 로코퀸 박민영의 매력이 돋보였던 드라마였죠 ♥ 너무나...
66,그녀의 사생활 드라마,2019.05.31.,그녀의사생활 15화 줄거리 및 김재욱 캡쳐,특별한 방황,진짜 넘 달달하다능...ㅠㅠ 그녀의사생활은... 주인공인 두 남녀가 사랑을 확인하고 나서의 시간들을 많이 보여줘서 참 좋아요. 다른 드라마에선 사랑이 이루어지기까지...
67,그녀의 사생활 드라마,2019.05.31.,"그녀의 사생활 종방연 김재욱, 김보라 신발 패션 @ 컨버스 잭퍼셀 , 척 70",요니의 보통날??,"평소 김보라의 사복 패션 느낌과, 컨버스 척 70 빈티지함이 넘 잘 어울리네요 ♥ 2019 봄 설레임을 느끼게해준 드라마 '그녀의 사생활' 어제자 그녀의 사생활 종방연..."
68,그녀의 사생활 드라마,2019.05.31.,이일화 TVN 그녀의사생활 마지막회 속 가방/드레스 정보- 포레르빠쥬/레오나드,eunnn_0,"최종회를 어제 한 TVN 그녀의 사생활! 정말 너무나도 재밌게 본 드라마에요 박민영,김재욱 + 조연들도 너무나 깨알같이 재밌게 연기한 드라마! 오늘은! 박민영씨가..."
69,그녀의 사생활 드라마,2019.05.31.,그녀의 사생활 박민영 패션 로즈몽 목걸이&귀걸이&반지 정보 모음,부산블로거 퀸비,요즘 tvN 드라마 <그녀의 사생활> 보시나요? 저는 진짜 재밌게 잘 보고 있는데요. 주인공인 박민영이 하고 나오는 다양한 악세서리들이 눈에 띄더라구요. 10회에서...
