,drama_title,date,blog_title,writer,contents
137,"60일, 지정생존자 드라마",2019.08.21.,60일 지정생존자 - tvn,인생 제 3막~*,정치물 드라마를 좋아 하는 사람들이라면 추천드립니다. 별 5개중 4.5개입니다. 0.... 좋아요 공감 공유하기 글 요소 구독하기 인생 제 3막~* 지정생존자
138,"60일, 지정생존자 드라마",2019.08.21.,지정생존자 지진희 시계 자세히 살펴드림ㅣTAGHeuer,윤에쓰 패션블로그,해외 인기드라마를 원작으로 한 tvN <60일 지정생존자>. 주변에서 하도 재밌다 그래가지고 최근에 정주행을 시작해서 보게 됐어요. 개인적으로 좋아하는 배우 지진희가...
139,"60일, 지정생존자 드라마",2019.08.22.,"60일, 지정 생존자 - 넷플릭스, 2019, 정치 드라마",Anndrew,그래서 서열 마지막 환경부 장관이 다음 선거까지 60일 간 대통령 대행을 하게 된다면? 이야기는 초보 대통령 대행의 청와대 참모진과 국정 운영과 테러 배후를 밝히는...
140,"60일, 지정생존자 드라마",2019.08.21.,지정생존자 지진희 시계 태그호이어 뉴링크 지름신 오는중!,함박의 패션 & 그루...,"주말에는 집에서 드라마와 영화 몰아보기를 하고 있는데 주변에서 워낙에 드라마 <60일, 지정생존자>를 추천해서 보기 시작했어요. 60일, 지정생존자는 넷플릭스 미드..."
141,"60일, 지정생존자 드라마",2019.08.21.,60일 지정생존자,sweetbitter27님의블...,여기서 끝나길..) 이러한 부류의 정치 드라마는 나와 같은 정치 문외한들에게 정치세계의 악랄한 머리싸움이 일분일초 숨막히게 일어나는 상황을 알려준다. 예외가...
142,"60일, 지정생존자 드라마",2019.08.21.,20190820 60일 지정생존자 다 본 나야 수고했다,^__^,주다가 드라마가 디지버짐 대한민국 국민들은 양진만 대통령을 가질 자격이 없어서 테러로 양진만 대통령을 죽였다 <<<<< 말이 되나 이게??? 과몰입해서 오영석 죽여버린...
143,"60일, 지정생존자 드라마",2019.08.24.,"진주시 촉석루 마케팅,  '60일, 지정생존자'로 '웃음꽃'  VS 수상 축제로 '잡음'",모아그룹 회장 블로...,"14일 오전 11시 기준 인터넷포털 네이버의 TV 인기 순위에 tvN 월화드라마 '60일, 지정생존자'의 동영상이 78번째 인기 동영상으로 이름을 올렸다. 지난 13일 방송된 14회에는..."
144,"60일, 지정생존자 드라마",2019.08.26.,"[드라마] 60일, 지정생존자, 2019",함주한,C 악은 선과 묘하게 닮아 있다
145,"60일, 지정생존자 드라마",2019.08.21.,지정생존자 16회 속 지진희 시계 태그호이어 뉴 링크 칼리버 17 갖고싶어요,HSH log Fashion & ...,"실제로 제목이 60일, 지정생존자였던 만큼 시간 내에 모든 일을 처리해야 했던 드라마 속 스토리 구성을 생각해보면 이들에게 있어 시간은 훨씬 더 중요한 의미를 갖는..."
146,"60일, 지정생존자 드라마",2019.08.29.,"진주시, tvN 월화드라마‘위대한 쇼’드라마 제작 지원",부강한 진주 행복한...,"이번 드라마 제작 지원은 앞서 종영된 ‘60 일 , 지정생존자 ’ 에 이어 두 번째로 이전 드라마가 지역의 관광명소에 대한 홍보였다면 ‘ 위대한 쇼 ’ 에서는 진주의..."
147,"60일, 지정생존자 드라마",2019.08.23.,"지정생존자, 현실에서도 등장할수도",나는 누굴까!!,"최근 몇 년 사이 생방으로 #드라마를 시청한 기억이 언제인지 모르지만 소재와 주제가 흥미로운 경험을 얻었다. 60일, 지정생존자 연출 유종선 출연 지진희, 김규리..."
148,"60일, 지정생존자 드라마",2019.08.22.,60일 지정생존자,_,마무리만 보면 최선의 선택이었지만 12화 부터 개연성이 상당히 떨어졌다 웹툰이나 리메이크 드라마의 한계는 어떤식이든 드러난다
149,"60일, 지정생존자 드라마",2019.08.25.,60일 지적생존자 속 영상퀴즈 이벤트,wjddustmd님의 블로...,"'60일, 지정생존자' 속 영상퀴즈 이벤트 '60일, 지정생존자' 속 영상퀴즈 이벤트 드라마 <60일, 지정생존자> 속 법률 탄생기! ‘차별금지법’을 제정하려는..."
150,"60일, 지정생존자 드라마",2019.08.21.,지정생존자 지진희 시계 태그호이어 뉴 링크 칼리버 17 오토매틱 크로노그래프 41MM,최GO집,인기드라마 tvn '60일 지정생존자' 부드러우면서도 강인한 카리스마를 보여주며 대통령 대행역을 완벽히 소화하고 있는 지진희 배우의 연기가 너무나 매력적인...
151,"60일, 지정생존자 드라마",2019.08.21.,"'지정생존자' 종영, '지진희 대권 도전' 열린 결말로 마무리[SS리뷰]",지예사랑,"20일 종영된 tvN 월화드라마 '60일, 지정생존자'에서는 권력 욕심 대신 바른 대한민국을 위해 대선 출마를 포기하는 박무진(지진희 분) 대통령 권한 대행의 모습이..."
152,"60일, 지정생존자 드라마",2019.08.21.,"""日에 숨겨진 진짜 VIP?""..'지정생존자' 지진희X비서진, 시즌2로 대선 갈까[어저께TV]",지예사랑,"지난 20일 오후 방송된 케이블채널 tvN 드라마 '60일, 지정생존자'(극본 김태희, 연출 유종선) 마지막회에서는 박무진(지진희 분)이 청와대 안의 국회의사당 테러..."
153,"60일, 지정생존자 드라마",2019.08.21.,지정생존자 지진희시계는 태그호이어 뉴 링크로 품격있게!,셩TUD'BLOG,셩TUD입니다 요즘 자주 챙겨보는 드라마 중 tvN '60일 지정생존자' 에서 멋있는 카리스마를 보여주고 있는 지진희! 드라마 '미스티' 에서도 연기도 너무 잘하고...
154,"60일, 지정생존자 드라마",2019.08.24.,드라마 볼 게 없다? 높아진 시청자 눈높이 되돌릴 수 없기에,http://thekian.tis...,"넷플릭스 경험한 시청자들에게 허술한 드라마 더는 안 통해 tvN 월화드라마로 종영한 <60일, 지정생존자>는 아마도 미드 원작을 보지 않았다면 괜찮은 웰메이드..."
155,"60일, 지정생존자 드라마",2019.08.21.,지정생존자 지진희 시계 태그호이어 뉴 링크 칼리버 17 오토매틱 크로노그래프 리뷰,홍쓰 패션블로그,"방영하는 드라마 60일 지정생존자입니다. 60일, 지정생존자는 갑작스러운 국회의사당 폭탄 테러로 대통령을 잃은 대한민국에서 환경부 장관 박무진이 60일간의 대통령..."
156,"60일, 지정생존자 드라마",2019.08.31.,고시원 서스펜스? 타인은 지옥이다 인물관계도-몇부작-작가감독-원작웹툰? 이정은x임시완x이동욱,퍼블릭에프알,"디자이너 역의 배우 오혜원 은 라이프, 붉은달푸른해 동생, 60일 지정생존자 기자 등으로 봤죠. # 타인은 지옥이다, 몇부작? 드라마 <타인은 지옥이다> 몇부작..."
157,"60일, 지정생존자 드라마",2019.08.26.,위대한 쇼 몇부작 줄거리 작가 뜻 후속은 유령을 잡아라!!,오늘의 추천아이템,그리고 재미있는것은 이번 위대한쇼도 바로 정치드라마죠 그래서 60일 지정 생존자가 끝나고 아쉬움이 많았을 시청자들에게 그대로 정치 드라마로 볼 수 있게 하게끔...
158,"60일, 지정생존자 드라마",2019.09.02.,"바나나 오트밀 쿠키 맛있다 :D / 노버터, 노밀가루 레시피",:),중인데 요즘 재밌는 드라마가 왜케 많은 건지.. 헤헤 외국 드라마는 잠시 쉬고 있는 중이닷. 드라마는 몰아보는 맛. :) 근데 진짜 60일 지정생존자 시즌2 안 만드나? ㅠㅠㅠㅠ
159,"60일, 지정생존자 드라마",2019.08.21.,"60일, 지정 생존자, 좋은 사람이 이기는 세상 - tv에 밑줄 긋는 여자 - 글 쓰는 한량",글 쓰는 한량,"tvN 드라마 <60일, 지정 생존자>가 끝이 났다. 이 드라마는 방영 전부터 인기 미국 드라마 <지정 생존자>의 국내 리메이크작으로 화제를 낳았던 드라마다. 공중파에서..."
160,"60일, 지정생존자 드라마",2019.08.22.,종영 드라마 (tvN. JTBC. OCN) 시청율 순위 정리,세상에 너를 소리쳐...,넷플릭스에서도 연신 홍보하던 지정생존자. 국내에선 60일이란 시간이 제목 앞에 붙은 이유가 뭘까? 정치 드라마라 스킵할랬는데 주변의 강추를 신뢰하는지라.....
161,"60일, 지정생존자 드라마",2019.08.22.,[연예인팬선물포장] 배우 오혜원 을 응원하는 팬 선물포장,아우름의 이야기가 ...,"지난 20일 인기리에 종영한 tvN 드라마 ‘60일, 지정생존자’에서 우신영기자 역을 맡아 연기한 오혜원 배우를 응원하는 팬들이 준비한 선물포장입니다. 제가 드라마를..."
162,"60일, 지정생존자 드라마",2019.08.23.,당신의 아주 먼 섬,마법에 걸린 오후 /...,"웃기지만 꼰대다보니 월화드라마 '60일,지정생존자' 마지막회를 보러 발걸음을 서둘러야 한다 중앙공원을 질러 빠른 걸음한다 이밤 가로등 밑으로 여름끝 매미가..."
163,"60일, 지정생존자 드라마",2019.08.27.,[우쿨렐레반주]흔들리는 꽃들 속에서 네 샴푸향이 느껴진거야 - 장범준(멜로가체질 OST),우쿨치는훌라걸,"60일 지정생존자가 끝나고 요즘 즐겨보고 있는 드라마입니다. 그러고 보니 저 은근 드라마 중독자 같네요....ㅎㅎㅎ 워낙 OST를 좋아하고, 요즘 좋은곡들이 많아서..."
164,"60일, 지정생존자 드라마",2019.08.27.,지난 아이폰 일상 !,Unfiltered / 언필터...,"최근, 친구의 추천으로 보게 된 60일 지정생존자 라는 드라마에요. 요즘 집에서 드라마보거나 영화보는게 스트레스 푸는 낙인거같아요. 이 드라마는 정치이야기가 나오는..."
165,"60일, 지정생존자 드라마",2019.08.25.,위대한 쇼 인물관계도 tvN월화 정치드라마 송승헌 노정의,나만의 취미 영화 스...,너무나도 재미있게 본 드라마 60일 지정생존자가 끝나고 새로운 월화드라마인 위대한 쇼가 다음 주부터 시작을 합니다. 우선 60일 지정생존자가 궁금하신 분들은 밑을...
166,"60일, 지정생존자 드라마",2019.08.27.,드라마 위대한 쇼 송승헌 이선빈 임주환 박하나 노정의 인물관계도/줄거리,새벽달의 감성다락방,60일 지정생존자 후속 tvn 새 월화드라마 위대한 쇼 줄거리/몇부작/인물관계도/등장인물/송승헌 이선빈 임주환 노정의 박하나 이도현 배우 송승헌의 연기 변신...
167,"60일, 지정생존자 드라마",2019.09.02.,지진희 선글라스 너무 예뻐서 찾아보니 휴고보스꺼네요!,@유나설 : 패션블로...,"라고 생각했었는데요~ 이런 저의 생각은 최근 종영한 tvN 드라마 ‘60일, 지정생존자’를 본 후 완전히 달라졌어요~ 전 자상한 남자 스타일 그런 남자한테는 그닥 매력을..."
168,"60일, 지정생존자 드라마",2019.09.03.,지진희 공항패션 티파니앤코 T스퀘어 팔찌 반지 남자 명품 팔찌답네,멜로래빗,"오늘은 오랜만에 연예인 공항패션으로 인사드리는데요, 오늘의 주인공은 최근 인기리에 종여한 tvN 드라마 '60일, 지정생존자' 에서 대통령 권한대행 '박무진' 역을..."
169,"60일, 지정생존자 드라마",2019.09.02.,가을패션 지진희 공항패션 보스 아이웨어,뷰티패션블로거 귀톨...,"넘나 훈훈한 미남 배우 지진희, 얼마 전까지 정말 팬심 가득하게 지진희 나오는 드라마 tvN 60일, 지정생존자 챙겨 봤었거든요 ㅎㅎ 이번에 하와이 화보 촬영으로..."
170,"60일, 지정생존자 드라마",2019.08.29.,넷플릭스 추천 드라마,Scent of mine,"60일 지정생존자 (한국) 얼마 전에 종영한 정치 드라마. 정치권 이야기를 다루는 드라마가 점점 많아집니다. <보좌관>도 있습니다. 60일, 지정생존자 연출 유종선 출연..."
171,"60일, 지정생존자 드라마",2019.08.29.,뺑소니 전담반 [뺑반]이 잡지 못한 관객,따뜻한 고구마,공효진 조정석 염정아 전혜진 게다가 요즈음 [60일 지정생존자]로 확실하게 기억하는 손석구까지...ㅋㅋㅋ 장동건과 박형식이 함께 나왔던 드라마 [슈츠]에서 강렬하게...
172,"60일, 지정생존자 드라마",2019.09.02.,【즐거움엔 날개가 없다】,기억의 열쇠,"물론 tvN이 드라마를 잘 만든다고 할 수도 있겠지만, 솔직히 말하자면 최근에 한 것으로 ‘60일 지정 생존자’는 꽤 괜찮았으나 나머지는 다소 황당하여 만약 다른..."
173,"60일, 지정생존자 드라마",2019.08.29.,헐~ <열여덟의 순간> 이거 뭐임?,+나르시시스트의 세...,친정아부지가 <60일 지정생존자> 다음으로 추천한 드라마 <열여덟의 순간>. 함께 보기에는 갭이 너무 커서 지정생존자 끝내자마자 정주행중ㅋㅋㅋ 내가 워너원은 잘...
174,"60일, 지정생존자 드라마",2019.08.26.,대국민 가족 코스프레 위대한 쇼 tvN월화드라마,시청아이폰수리,"`60일, 지정생존자` 끝나고 새로 시작하는 tvN월화드라마 `위대한 쇼` 마무리도 괜찮았던 60일 지정생존자 저 느낌이면.. 시즌2도 나올법한데 말이죠? 이번엔 대선에 대한..."
175,"60일, 지정생존자 드라마",2019.09.03.,남한정치 대충 19.09.03,있는 그대로...,시나리오1 - 60일 지정생존자 문재인이 조국임명을 강행하고 있습니다. 역풍을... 문화물로 사전세뇌 시켜놓고 개돼지 몰이를 즐기는데 드라마로 밑밥은 깐 상태죠. 다만...
176,"60일, 지정생존자 드라마",2019.08.23.,다가오는 가을 여행지로 초강추!! 진주성 촉석루 와 진양호 전망대 §,우리가사는이야기,"진주성은 문화체육관광부와 한국관광공사에서 선정하는 ""한국관광100선""에서도 선정된 곳이기도 한데요~ YVN에서 방영중인 '60일 지정생존자' 드라마에서 주인공 박무진..."
177,"60일, 지정생존자 드라마",2019.08.21.,드라마기록,하짱의블로깅-???...,"보고있던드라마 근데 갑자기 잘보고있다가 다른 드라마 해서 어리둥절 봄밤 연출... 공감 ^^ 60일, 지정생존자 연출 유종선 출연 지진희, 김규리, 허준호, 강한나..."
178,"60일, 지정생존자 드라마",2019.08.23.,국내가을여행지- 진주성 촉석루 와 진양호 전망대로 가볼까요?,오늘 더 행복하자,있는 60일 지정생존자 드라마 다들 보시나요? 그 드라마 배경장소로 노출이 되었던 곳이 바로 진양호라고 하네요. 경남진주성안에 있는 촉석루는 워낙에 유명한곳이라...
179,"60일, 지정생존자 드라마",2019.08.30.,2019 하반기 예정드라마 라인업 및 영상 (2),소심하게... 즐거운...,"코미디 드라마 MBC 웰컴2라이프 ▶ ※월화극 잠정 폐지 SBS ▶ ※월화극 잠정 폐지 tvN 60일, 지정생존자 ▶ 위대한 쇼 (2019.08.26 방영예정) *월화 오후 9시30분 -연출..."
180,"60일, 지정생존자 드라마",2019.08.31.,수원맞춤예복 1등 장인의 실력에 감동했어요??,??와식생활??,모니터에 드라마 ‘60일 지정생존자’ 촬영씬이 나오는데 실제로 저희가 앉아있는 방에서 촬영을 했더라구여 너무 신기해서 모니터 한번 방 한번 둘러보고 ㅋㅋ 상담...
181,"60일, 지정생존자 드라마",2019.09.03.,지진희 공항패션엔 티파니앤코 팔찌 반지 : 티파니앤코 T 스퀘어 / 남자 명품 팔찌 추천템 ♬,뷰스타 발칙한루루 ...,"저는 드라마 '60일, 지정생존자'를 채널 돌리면서 스치듯 봤다가, 다시 돌아와서 집중해서 본 기억이 있어요. 이유는 단 하나, 지진희님 역할 넘 멋진거예요. 대통령..."
182,"60일, 지정생존자 드라마",2019.08.27.,2019년 8월 4주차 드라마 순위,굿데이터,"드라마 3 위는 전주 대비 화제성 점수가 약 20% 오르며 4 주 연속 순위를 지킨 tvN ‘ 60 일 , 지정생존자’였다 . 종영과 관련하여 원작과의 비교 반응이 다수..."
183,"60일, 지정생존자 드라마",2019.08.26.,연극 <렌드미어 테너>와 영원한 타자(他者),작곡가 성용원의 블...,"손석구, 오혜원, 강한나 등 tvN 드라마 <60일, 지정생존자>의 배우들이 이달 15일 오후 서울 대학로에서 드라마에 국정원 요원 정한모 역으로 출연한 배우 김주헌이 출연한..."
184,"60일, 지정생존자 드라마",2019.08.26.,위대한쇼 인물관계도 몇부작 줄거리 등장인물 보기,이마즈의 매거진,확인해본 결과 60일 지정생존자 후속으로 방영이 되는 이 드라마 같은 경우는 총 16부작으로 방영이 될 예정이라고 하네요 . 사실 상상하지 못했던 배우들의 조합이긴...
185,"60일, 지정생존자 드라마",2019.08.27.,지창욱 나이 키 생일 드라마 날 녹여주오 과거사진 원진아 윤세아 임원희,급상승검색어,이선빈 60일 지정생존자 후속 오늘 소개할 배우는 새로운 tvN 수목드라마 '위대한 쇼' 에 출연하는 노정의 배우입니다. 영화 ... blog.naver.com 쌉니다 천리마마트 캐스팅...
186,"60일, 지정생존자 드라마",2019.08.30.,국내 가을 여행지-진해 보타닉뮤지엄 사립수목원,국가대표의 여행일기,"얼마 전 재미있게 본 드라마 중 tvn 60일, 지정생존자 촬영 장소도 진해에서 많이 촬영을 하여 가봤던 장소들이 방송에 나와 반가웠는데요. 지금은 종방을 하였지만..."
187,"60일, 지정생존자 드라마",2019.08.22.,경남가볼만한곳) 가을여행지 추천!! 진주성 촉석루 와 진양호 전망대!! 강추★!!^^*,비니미노's L.O.V.E,"ㅎㅎ TVN에서 월/화로 방영하는 60일 지정생존자 드라마에 배경장소로 노출되었던 (8월 13일 14,15화 때) 일부가 나왔구요 8월 19일에도 진양호가 일부 나왔지요^^* 주인공..."
188,"60일, 지정생존자 드라마",2019.08.29.,호계동헬스 건강한 미래를 생각한다면,6 feet beneath the sea,호계동헬스 건강한 미래를 생각한다면 안녕하세요 잇님들^^ 곧 있으면 구월이라는게 실감이 나지가 않네요 요즘 들어서 빠르다고 생각하던 시간들이 더 빠르게 지나가는...
189,"60일, 지정생존자 드라마",2019.08.21.,씨유를 부탁해 (feat. 드라마),공드리의 드리블!,쇼콜라 티라미수와 함께한 드라마 #60일지정생존자 의 마지막회... 잊지 못할겁니다.. 물론 잊기야 하겠지만 나중에 포스팅 보면서 노잼드립에 이불킥하면서...
190,"60일, 지정생존자 드라마",2019.08.23.,경남 진주성 촉석루 & 진양호 전망대로 가을여행을 떠나요~,세아이맘의 일상속~...,TVN에서 월.화로 방영하는 60일 지정생존자 드라마에서 진주성 촉석루와 진양호 2곳이 나왔어요 ㅎㅎ 국립진주박물관 역사박물관으로 진주성 내에 위치하고 있으며...
191,"60일, 지정생존자 드라마",2019.08.22.,경남가볼만한곳인 가을여행지로 진주성촉석루와진양호전망대,뉴카인드프라이스 햇...,"석양도 멋진데 TVN에서 월요일, 화요일 드라마로 방영 중인 60일 지정생존자 드라마에서 배경장소로 노출되었던 곳 입니다. 바로 진주성 촉석루 내부라고 합니다. 진양호..."
192,"60일, 지정생존자 드라마",2019.08.30.,"하노이 네일 오드리네일 1호점에서 메니큐어, 페디큐어 솔직후기",STAY GOLD,"오빠는 일찍 케어를 마친 후에 넷플릭스로 60일 지정생존자를 보고 있었다. 원래 내가 비행중에 이 드라마 보려고 10편 정도 다운받고 왔구만, 오빠가 아이패드를 뺏어가..."
193,"60일, 지정생존자 드라마",2019.08.22.,국내가을여행지를 찾고 있다면 경남가볼만한곳 진주성 촉석루 와 진양호 전망대,쏘쏘맘의 행복한 이...,얼마전 60일 지정생존자 드라마에 배경장소로 노출되었던 진주성 촉석루 와 진양호 전망대인데요! 방송에 나온 진주성 촉석루 와 진양호 전망대의 모습이라고 해요!...
194,"60일, 지정생존자 드라마",2019.08.22.,경남가볼만한곳 가을여행으로 좋은 진주성 촉석루와 진양호 전망대,행복한 스토리,TVN에서 방영하는 60일 지정생존자 드라마에 배경장소로 나왔던 경남 진주시의 진주성(촉석루)와 진양호 두곳이 가볼만한곳인데요 문화체육관광부와 한국광공공사가...
195,"60일, 지정생존자 드라마",2019.08.22.,가을여행 으로 경남가볼만한곳 <진주성 촉석루 와 진양호 전망대>,디자이너권 부업성공...,"방영된 60일 지정생존자 드라마 배경장소인데요 이런곳 꼭 와보고 싶지 않으세요? 진진주에는 가볼만한 곳이 많은거 같아요 가보고 싶은 여행지 , 주말나들이로..."
196,"60일, 지정생존자 드라마",2019.08.30.,여자들을 위한 브리프케이스 추천,양양마음대로_jinai...,"스카이캐슬, 60일 지정생존자, 친애하는 판사님께 등 인기드라마에서 변호사나 검사 역으로 나오시는 등장인물들이 베드포드일레븐스의 탑핸들 플랫 메신저나..."
197,"60일, 지정생존자 드라마",2019.08.23.,경남가볼만한곳 우리가족 가을여행지는 진주성 촉석루 와 진양호 전망대 어떠세요?,노는게 제일 좋아,요즘 티비에서 60일 지정생존자 드라마 너무너무 재미나게보고있어요 예전부터 지진희님 너무멋있는 배우라고 생각하고있었는데 역시 이번 드라마에서도...
198,"60일, 지정생존자 드라마",2019.09.03.,합천여행 1박 2일 멋따라 그린투어 영상테마파크 청와대세트장 오도산자연휴양림,사진속의 나의 세상,그래서 각종 영화나 드라마를 위해 많은 촬영사들이 이곳들 찾아와 찍어간다고 하네요. 최근에는 '60일 지정생존자'를 이곳에서 촬영하였다고 합니다. 실내화로 갈아...
199,"60일, 지정생존자 드라마",2019.08.21.,"088, 인생 드라마",Write a metaphor,"60일, 지정생존자 | tvN 월화드라마 ＜60일, 지정생존자＞ ■ 출연 : 지진희, 이준혁, 허준호, 강한나, 배종옥, 김규리, 손석구, 최윤영 등 naver.me 잊지 못할거야... 보낼..."
200,"60일, 지정생존자 드라마",2019.08.23.,스테판크리스티앙 orwell 티타늄 메탈 다각형 안경테/ 안성 평택 하우스 브랜드 매장,안경박사 안성점,종영한 60일 지정 생존자 드라마에서 지진희 배우의 안경 스타일과 비슷해요 정장 스타일이든 캐주얼 스타일이든 다 잘 어울리죠? 아마 일반적인 메탈 안경테였다면...
201,"60일, 지정생존자 드라마",2019.08.23.,경남가볼만한곳~@국내가을여행지 [진주성] 촉석루 와 진양호 전망대 아주 멋지답니다.♧∞°,heecyh955님의블로그,화로 방영하는 60일 지정생존자 드라마에서 진주성 촉석루와 진양호 2곳이 나왔답니다./ [국립진주박물관]역사박물관으로 진주성 내에 위치하고 있구요.<< 건물은...
202,"60일, 지정생존자 드라마",2019.08.27.,마석맛집 추천 닭한마리의 추억,감성육아레시피...감성 여행...,이번에 넷플릭스 드라마 '60일 지정생존자'에서 반전을 이끈 특별한 인물이기도 했구요 그것보다 더 중요한 것은 일본과의 문제 때문이예요 지난 2005년 5월...뮤지컥...
203,"60일, 지정생존자 드라마",2019.08.23.,배우 송지현이 tvN 새 월화드라마 ‘위대한 쇼’에 출연한다.,BARON라이프,"배우 #송지현이 tvN 새 #월화드라마 ‘ #위대한쇼’에 #출연한다. 오는 26일 처음... ‘위대한 쇼’는 ‘60일, 지정생존자’ 후속으로 오는 26일 오후 9시 30분 처음..."
204,"60일, 지정생존자 드라마",2019.08.30.,내년에 볼 드라마,SHINING SHIMMERING...,"60일, 지정생존자 (넷플릭스) 비밀의 숲 (넷플릭스) 신입사관 구해령 (넷플릭스) 킬링 이브 (왓챠) 체르노빌 (왓챠) 루시퍼 3, 4 (넷플릭스) 에이전트 오브 쉴드 4, 5..."
205,"60일, 지정생존자 드라마",2019.08.21.,2019년 8월 20일 : 교환학생 24일차 | 수업 너무 재미써 말이 돼?,허블망원경 : 허유림...,축하해 ~^_^ #60일지정생존자 마지막회까지 정복해따! 진짜 오랜만에 온에어로 본 드라마 ㅎ-ㅎ 대행님과 청와대즈 함께해서 행복해쏘 아 참 나 여기에 올라와떠 @only...
206,"60일, 지정생존자 드라마",2019.08.26.,"이번 여름에 본 영화, 드라마",Set me free,"드라마 60일,지정생존자(추천) 더 소사이어티 오렌지 이즈 더 뉴 블랙 산타클라리타 다이어트(보는중) 낮밤 바뀌지 말고 살자,,,ㅜ"
207,"60일, 지정생존자 드라마",2019.08.29.,MBC 수목드라마 '신입사관 구해령' OST 음원이 모두 담긴 정식 음반 예약판매가 오늘(28일) 오후 5시부터 시작된다,부티나STORY,"또한 이번 음반에는 '60일 지정생존자'. '베토벤 바이러스', '7일의 왕비' 등 드라마의 장르를 불문하고 작품성과 대중성을 겸비한 OST로 높은 평가를 받고 있는..."
