,drama_title,date,blog_title,writer,contents
150,어비스 드라마,2019.06.28.,초면에 사랑합니다도 이제 끝났다....ㅠㅠ,홍냐홍냐,없는 것 같다.....ㅠㅠㅠㅠㅠㅠ 요즘에는 드라마를 본방사수를 못해서 주로 몰아보기로 보고 있는뎅... 어비스랑 초면에 사랑합니다... 마지막회는 나도 모르게 봐버려서.....
151,어비스 드라마,2019.06.30.,간단하게 재무제표를 보자.. '스튜디오드래곤'#102,Pony의 일상,"또한 분기보고서에는 보이지 않지만, 스튜디오드래곤은 ""드라마 제작사... 아스달연대기가 우려와 달리 적자가 아닌점, 그리고 넷플릭스향 판매는 봄밤, 어비스..."
152,어비스 드라마,2019.07.07.,19.7.7,jogot 투자노트,"펄어비스 - 일본 검사 매출 순위가 10위권을 왔다갔다하고 있는데, 한일관계의... KBS 일일드라마는 100부작 기준 40억원 수준의 계약을 기본으로 하고 PPL 등 부가..."
153,어비스 드라마,2019.06.28.,신입사관구해령 언제 시작한다궁??,홍냐홍냐,이제 어비스도 끝나고 초면에 사랑합니다도 끝나서 드라마 볼 거 없겠다 싶었는뎁.... 새로운 볼만한 드라마가 생겼지 말입니닷... ㅎㅎㅎㅎㅎㅎㅎ 그 드라마는 바로.......
154,어비스 드라마,2019.07.04.,六▽月,30me블로그,하나씩 보다보니 벌써 5가지 드라마를 보고있다ㅋ_ㅋ 일주일이 빨리 지나가는 듯 하다. #초면에사랑합니다 #어비스 #절대그이 #아스달연대기 #퍼퓸 스물일곱살...
155,어비스 드라마,2019.06.30.,19.6.30,jogot 투자노트,"펄어비스 - 코스닥 주간 기관 순매도 1위, 외인 순매수 1위 - 6/28 발급판호는... 한지은이 “뻔한 멜로드라마는 끝났다”고 예고해 기대를 증폭시킨다. 오는 naver.me"
156,어비스 드라마,2019.07.09.,"일본워홀D+280, 東京タワ?七夕祭り!",홀리_진의 오늘?,어제 새벽까지 어비스 정주행 달려서 끝까지 봐따..;-; 그리고 3시쯤에 잔거같은데..... 범죄드라마에서 나오는 무거운 중년배우 느낌이였는데 이거보고나서 넘...
157,어비스 드라마,2019.07.01.,60일 지정생존자 재방송 다시보기 무료시청 안내 지진희 허준호 주연,궁금하면 물어보세요,미국드라마 '지정생존자'를 한국 실정에 맞게 리메이크했는데요. 과연 이번에도 리메이크를 성공할 수 있을지 기대.. xn--ok0b606bigbpa.kr 어비스의 후속으로 방송되는...
158,어비스 드라마,2019.06.30.,6월의 일상,"잊을 수 없는 기억,",이유 어비스 보는 재미로 산당 열혈사제 이후 열심히 보는 드라마!! ♥? 본가에 오면 좋은 이유 ♥? 맛있는 거 먹을 수 있지용 친오빠 쫄라서 치킨 얻어먹기 맛이썽...
159,어비스 드라마,2019.07.01.,초면에 사랑합니다,AAmBroSiAA,초면에 사랑합니다 어비스 다 본시각이 11시 50분이였는데....^^ 그냥 바로 이어서... 몰라 여하튼 디데이 드라마에서 꽤 재미있게 봤었는데 다음에는 그거나 재탕할까...
160,어비스 드라마,2019.06.29.,박보영 차기작 상플,"영화, 책, 드라마를...","여자배우가 할만한 작품도 없는데다가, 한국 영화드라마계가 박보영을 너무 한계짓는 것 같다. 여기서 어비스 얘기를 하자면..하.. 1화를 보고 정말 깜짝놀랐다. 드라마가..."
161,어비스 드라마,2019.06.27.,"‘60일, 지정생존자’ 첫 방송을 앞두고 완벽한 로컬라이징을 기대해도 좋다는 의견을 직접 전해와, 기대를 더욱 증폭",최적화블로그꿀벌 나...,"tvN 새 월화드라마 ‘60일, 지정생존자’(극본 김태희, 연출 유종선)는 잘 알려진... tvN ‘어비스’ 후속으로 7월 1일 월요일 오후 9시30분 첫 방송된다."
162,어비스 드라마,2019.07.09.,꾸준하게 팬들과 소통하는 '이수민' 근황,멀티미디어 로그,성장 드라마' 차가은은 극도로 소심한 성격으로 말수가 적은데다 차가운 외모로 인해 얼음 공주로 오해받는 우등생 이었다고ㅎㅎㅎ 이거 말고도 박보영 나왔던 '어비스...
163,어비스 드라마,2019.06.27.,"60일, 지정생존자 미리보기 등장인물 인물관계도",playgirl1023님의 블...,인물관계도 #어비스후속작60일지정생존자 #지진희 #대통령권한대행 #tvN #월화드라마 #60일지정생존자 #지정생존자 #넷플릭스 #지진희드라마컴백복귀작 #이준혁 #허준호...
164,어비스 드라마,2019.06.26.,2019년 6월 25일 박스오피스&시청률 순위,★TV 속 이야기★,"맨 인 블랙 : 인터내셔널 일간 : 6,380명 / 누적 : 829,632명 # 드라마 1.... tvN 어비스 - 2.3% 10. KBS2 회사 가기 싫어 - 1.8% # 예능 1. SBS 본격연예..."
165,어비스 드라마,2019.06.27.,"2019년 7월 한국잡지부록 7입니다♡(리빙센스 A,B,C)",BY JUNE,"(500ml) http://www.yes24.com/Product/Goods/74836506?Acode=101 이번주 종영드라마가 많네요! 어제는 어비스, 내일은 구해줘2가 막을 내려요:) 잠시..."
166,어비스 드라마,2019.06.26.,"장동완, 9등급 꼴찌 1년만에 통역사 된 비법",모든 요일의 기록,(Eobiseu / 어비스) Imdb Indonesian subtitle by SULTAN_KHILAF Indonesian subtitle by... 영화 드라마를 100LS 훈련법으로 훈련 영상에서 모르는 단어...
167,어비스 드라마,2019.07.01.,"아홉 번째,",?,"그러는거 웃겨죽음 ㅠㅜㅠ ㅠㅜㅠㅠㅜㅠ아니 근데 어비스가 갑자기 너무... 요번에 드라마 ost 불렀는데 ㅠㅜㅜㅜㅠ 넘 좋아 ,,?? 귀여운 샘김 ㅠㅜㅠ 여러분 이게..."
168,어비스 드라마,2019.06.28.,게임/음악/영화시장 주목,가람의 투자이야기,"게임/음악/영화드라마의 2018년 글로벌 시장규모는 각 150조, 50조,50조원에 이르고... 펄어비스 김대일 의장(한양대 컴공 중퇴, 80년생)이 시가총액 2.2조원 등이 그 뒤를..."
169,어비스 드라마,2019.06.30.,"D-19 ㅣ 치앙마이 한달 여행 ~ing, 먹방 일기 :)",여행사 아닌 여행솨,"치앙마이에 여행 오기전에 뭔가 할거 없을때 드라마 보겠다 싶었는데 현실적으로 드라마를 너~무 보고있다. 어비스도 최종화까지 끝냈고, 아스달연대기나..."
170,어비스 드라마,2019.07.05.,사운드마틴 | 올란도_ 카컴 안드로이드 올인원 10인치 범용 장착,Smart Life. CARCOM...,아스달연대기 #어비스 #밥블레스유 #티비엔 #놀라운토요일 #놀토 #불후의명곡... 뮤비 #드라마 #검색 #네이버 #다음 #웹툰 #스릴러웹툰 #죽기전에꼭봐야할웹툰...
171,어비스 드라마,2019.06.28.,안산자전거 동탄 바이크마트 굿굿굿! 좋아요!,병원소식지,만들어 저정도 완성 외출하고 전에 좋은 되지 중에 나들이 분 드라마와 안성맞춤이었어요사진처럼 정리해서 단점이 20인치 키우면 하나하나 앞으로 드리게된다는 어떻게...
172,어비스 드라마,2019.06.28.,<2019.07.31 수요일> 주식 일정,미지 블로그,"흥행시 개발 가능한 엔씨소프트, 펄어비스 등 대형주 수혜 예상 (6.12 기사) [11월 중] 제넥신, 하이루틴 임상1b상 데이터 발표, 4분기 중 지속형 성장 호르면..."
173,어비스 드라마,2019.07.02.,IMMAKER briefing_2019.07.02,IMMAKER,"K-드라마, K-무비 등 문화콘텐츠와 IT, 패션, 뷰티 등 첨단·제조업에 이르... www.... ‘나혼자산다’, 어비스’ 등에서 맹활약 중인 대배우 이시언이 캐주얼 풋웨어의..."
174,어비스 드라마,2019.06.27.,"'상업성과 메시지의 균형' 소셜임팩트 게임, 게임사에 던지는 사회적 질문",GAMEINSIGHT,인디크래프트 상금을 '3N'이 지원한 것이나 BIC 오픈플레이데이를 펄어비스가... 1차 세계대전 배경에서 개개인의 드라마와 전쟁의 참혹함을 훌륭한 스토리텔링으로...
175,어비스 드라마,2019.06.28.,2019년 6월 28일 오후 증권시황 리포트,DB금융투자 손우성 ...,"펄어비스, 검은사막 PS4 사전 주문 시작7월 3일 (수) 나노코리아 2019 개최 美) 6월... 넷플릭스, 드라마 원작 게임 출시 예정7월 5일 (금) 삼성전자 2분기 잠정실적..."
176,어비스 드라마,2019.07.06.,아마겟돈(영화),반야월 박회장,"휴먼 드라마에 초점을 맞춘 '딥 임팩트' 와는 방향 자체가 다르다. 흥행에서는... 할리우드에서는, 제임스 카메론 감독의 어비스가 개봉하자 그에 대응하여 심해 괴물..."
177,어비스 드라마,2019.06.26.,낭만닥터 김사부2 안효섭 출연검토,아미야미,"낭만닥터 김사부2 안효섭 출연검토 배우 안효섭이 SBS 채널의 새 드라마인... 안효섭은 현재 방영 중에 있는 ""어비스"" 에서 차민 역으로 출연하면서 인기몰이를 하고..."
178,어비스 드라마,2019.06.27.,영리한 로맨스릴러의 탄생,김나영,"(할말하않) 드라마 <어비스>, <사이코메트리 그녀석>, <황후의 품격>의 공통점은 모두 ‘로맨스릴러’ 장르를 표방하고 있다는 점이다. 최근 여러 드라마, 영화 홍보에..."
179,어비스 드라마,2019.07.02.,??6월 3째주 굿엔젤랭킹 시청자가 뽑은 드라마 인기순위,유피룩 & 굿엔젤랭킹,kr/drama - #인기순위 #스타 #아이돌 #걸그룹 #보이그룹 #가수 #BJ #스트리머 #유튜버 #드라마 #보좌관 #봄밤 #구해줘 #어비스 #자백 #빅이슈 #해치 #킬잇 #랭킹...
180,어비스 드라마,2019.07.09.,메리츠 종금데일리 섹터코멘트(2019.07.09),쿠마의 돈버는 블로...,"ly/2XzQ9Yn - 드라마 제작사 '에이스토리' 공모가 밴드 상단서 결정 (서울경제) http://bit.ly/2JvE5NX - FNC스토리, 영화·드라마 제작 본격화···감독·작가..."
181,어비스 드라마,2019.06.29.,"tvN 방영된 드라마 박보영, 안효섭, 이성재, 이시언, 한소희 주연인 [어비스] 입니다.",★ 팬더새댁의 일상...,박보영님과 안효섭님의 알콩달콩 모습이 너무 부러웠던 드라마에요~!!ㅎㅎ 어비스 정말로 그런게 있다면 사랑하는 사람들 다 살렸으면 좋겠다란 생각도 들었는데...
182,어비스 드라마,2019.06.29.,‘어비스’ 이날 차민은 반지가 마음에 안...,충청매일,tvN= 어비스 캡처 [충청매일=온라인뉴스팀02] 25일 방송된 tvN 드라마 '어비스' 최종회에서는 차민(안효섭 분)에게 프로포즈 하는 고세연(박보영 분)의 모습이 그려졌다....
183,어비스 드라마,2019.06.27.,‘어비스’ 고세연이 자신의 부검결과를 보고 사인이...,충청매일,tvN 어비스 방송캡처 [충청매일=온라인뉴스팀02] 24일 방송된 tvN 월화드라마 '어비스'에서는 고세연(박보영 분)이 차민(안효섭 분)에게 어비스를 사용하지 말라고...
184,어비스 드라마,2019.06.26.,마지막,:The더피부과 이야기,요즘 띄엄띄엄 보던 드라마 어비스 오늘 마지막회 였다 첨엔 재밌어서 좀 보다가 점점 그냥그래서 안보 다가 정으로 그냥봤네 마지막회는 해피엔딩 그래 둘이...
185,어비스 드라마,2019.07.04.,"♥SNS 설왕설래…이시언, 일본 여행 논란♥",BIG ISSUE,이시언은 MBS ‘나혼자 산다’에 출연 중이며 최근 종영한 tvN 드라마 ‘어비스’ 에 출연했다일본의 치졸한 반도체 핵심부품 경제보복으로 솔직히 우리나라 적지 않은...
186,어비스 드라마,2019.07.01.,"60일, 지정 생존자 재방송 다시보기 무료 전편 시청 미드 리메이크",조금 빠르게,"tvN에서 7월 1일부터 첫 방송되는 월화드라마 60일, 지정 생존자는 어비스가 종영되고 그 후속으로 방영됩니다. 미국 abc방송에서 시즌 1, 2, 3편으로 제작돼 방영된..."
187,어비스 드라마,2019.06.28.,평일 오후 세시 연인- 프리뷰 영상,사색思索,어비스 소개 영상. 130만뷰. 드라마 소개도 많이 하였음. 사이코메트리 그녀석인가도 했었고 최근에. 최초 공개 평일 오후 세시 티저 영상 4800뷰. 그냥 검색 안 해도 노출...
188,어비스 드라마,2019.06.27.,30대 주부의 고민,Happy Virus ♡,ㅡㅡ다핑계지 요즘 프로듀스x101 ㅎ 퍼퓸 어비스 이번주종영 ㅠ 아스달연대기ㅋ 보느라ㅠ 이시간에 강의들으면... 그러나 그냥 흘러보는건 드라마나 가능하지 공부는...
189,어비스 드라마,2019.07.04.,7월 1주차 주간 증시일정 (7월 4일부터 7월 5일까지),불새's 슈퍼개미 프...,"blog.naver.com ▣ 넷플릭스, 드라마 원작 게임 출시 예정 넷플릭스의 게임시장 진출.... - 게임 관련주 종목명 - 드래곤플라이, 액토즈소프트, 펄어비스, 웹젠, 게임빌..."
190,어비스 드라마,2019.06.29.,5G 시대의 킬러콘텐츠 - 클라우드 게임,Selective Contrari...,"펄어비스를 추천하는 경우가 많은데 사실 잘 모르겟다. 물론 경쟁력이 있는 회사들이지만, 한국 게임이 한류 드라마처럼 특정 장르로 아시아에서 매우 인기가 있어..."
191,어비스 드라마,2019.06.30.,(( 주간투자전략 ))   추경통과여부 관종이슈이며 그 담주는 윤석열청문회가 관종이슈,주식)) 신선한 생각,펄어비스검은사막PS4사전주문 / 스파이더맨개봉 3일) 하반기경제정책발표 / 나노코리아 4일) 넷플릭스드라마게임출시 5일) 드론산업국제박람회 6. 기타 1) 신선한 생각...
